title	abstract	url	authors
Interactive AI Material Generation and Editing in NVIDIA Omniverse	We present an AI-based tool for interactive material generation within the NVIDIA Omniverse environment. Our approach leverages a State-of-the-art Latent Diffusion model with some notable modifications to adapt it to the task of material generation. Specifically, we employ circular-padded convolution layers in place of standard convolution layers. This unique adaptation ensures the production of seamless tiling textures, as the circular padding facilitates seamless blending at image edges. Moreover, we extend the capabilities of our model by training additional decoders to generate various material properties such as surface normals, roughness, and ambient occlusions. Each decoder utilizes the same latent tensor generated by the de-noising UNet to produce a specific material channel. Furthermore, to enhance real-time performance and user interactivity, we optimize our model using NVIDIA TensorRT, resulting in improved inference speed for an efficient and responsive tool.	https://dl.acm.org/doi/abs/10.1145/3588430.3597248	Hassan Abu Alhaija, James Lucas, Alexander Zook, Michael Babcock, David Tyner, Rajeev Rao, Maria Shugrina
Intermediated Reality with an AI 3D Printed Character	We introduce live character conversational interactions in Intermediated Reality to bring real-world objects to life in Augmented Reality (AR) and Artificial Intelligence (AI). The AI recognizes live speech and generates short character responses, syncing the character's facial expressions with speech audio. The Intermediated Reality AR warping technique allows for a high degree of realism in the animated facial expressions and movements reusing live video optical appearance direct from the device's embedded camera. The proposed applications of Intermediated Reality with AI are exemplified through the captivating fusion of these technologies in toy interactive storytelling broadcasts and social telepresence scenarios. This innovative combination allows individuals to engage with AI characters in a natural and intuitive manner, creating new opportunities for social engagement and entertainment.	https://dl.acm.org/doi/abs/10.1145/3588430.3597251	Llogari Casas, Kenny Mitchell
Juxtaform: interactive visual summarization for exploratory shape design	We present , a novel approach to the interactive summarization of large shape collections for conceptual shape design. We conduct a formative study to ascertain design goals for creative shape exploration tools. Motivated by a mathematical formulation of these design goals, juxtaform integrates the exploration, analysis, selection, and refinement of large shape collections to support an interactive divergence-convergence shape design workflow. We exploit sparse, segmented sketch-stroke visual abstractions of shape and a novel visual summarization algorithm to balance the needs of shape understanding, shape juxtaposition, and visual clutter. Our evaluation is three-fold: we show that existing shape and stroke clustering algorithms do not address our design goals compared to our proposed shape corpus summarization algorithm; we compare juxtaform against a structured image gallery interface for various shape design and analysis tasks; and we present multiple compelling 2D/3D applications using juxtaform.	https://dl.acm.org/doi/abs/10.1145/3592436	Karran Pandey, Fanny Chevalier, Karan Singh
Kindred	Based on the true story of one aspirational LGBTQ+ parent's ground-breaking journey through the adoption process in the United Kingdom, KINDRED highlights unique challenges faced by non-binary parents in the U.K.'s outdated adoption process and tells the remarkable story of Syd and Ollie who helped redefine the meaning of family.	https://dl.acm.org/doi/abs/10.1145/3577025.3583567	Lee Harris
La Diplomatie de L'éclipse	At the moment of alignment, of total eclipse, humanity will vanish, this was the message sent by the Sun and the Moon. The World Council decides to send his best negociator to stop the end of the world.	https://dl.acm.org/doi/abs/10.1145/3577024.3588734	César Luton
Language-based Photo Color Adjustment for Graphic Designs	Adjusting the photo color to associate with some design elements is an essential way for a graphic design to effectively deliver its message and make it aesthetically pleasing. However, existing tools and previous works face a dilemma between the ease of use and level of expressiveness. To this end, we introduce an interactive language-based approach for photo recoloring, which provides an intuitive system that can assist both experts and novices on graphic design. Given a graphic design containing a photo that needs to be recolored, our model can predict the source colors and the target regions, and then recolor the target regions with the source colors based on the given language-based instruction. The multi-granularity of the instruction allows diverse user intentions. The proposed novel task faces several unique challenges, including: for recoloring with exactly the same color from the target design element as specified by the user; for parsing instructions correctly to generate a specific result or multiple plausible ones; and for recoloring in semantically meaningful local regions to preserve original image semantics. To address these challenges, we propose a model called with two main components: the language-based source color prediction module and the semantic-palette-based photo recoloring module. We also introduce an approach for generating a synthetic graphic design dataset with instructions to enable model training. We evaluate our model via extensive experiments and user studies. We also discuss several practical applications, showing the effectiveness and practicality of our approach. Please find the code and data at https://zhenwwang.github.io/langrecol.	https://dl.acm.org/doi/abs/10.1145/3592111	Zhenwei Wang, Nanxuan Zhao, Gerhard Hancke, Rynson W.H. Lau
Learning Human-like Locomotion Based on Biological Actuation and Rewards	We propose a method of learning a policy for human-like locomotion via deep reinforcement learning based on a human anatomical model, muscle actuation, and biologically inspired rewards, without any inherent control rules or reference motions. Our main ideas involve providing a dense reward using metabolic energy consumption at every step during the initial stages of learning and then transitioning to a sparse reward as learning progresses, and adjusting the initial posture of the human model to facilitate the exploration of locomotion. Additionally, we compared and analyzed differences in learning outcomes across various settings other than the proposed method.	https://dl.acm.org/doi/abs/10.1145/3588028.3603646	Minkwan Kim, Yoonsang Lee
Learning Physically Simulated Tennis Skills from Broadcast Videos	We present a system that learns diverse, physically simulated tennis skills from large-scale demonstrations of tennis play harvested from broadcast videos. Our approach is built upon hierarchical models, combining a low-level imitation policy and a high-level motion planning policy to steer the character in a motion embedding learned from broadcast videos. When deployed at scale on large video collections that encompass a vast set of examples of real-world tennis play, our approach can learn complex tennis shotmaking skills and realistically chain together multiple shots into extended rallies, using only simple rewards and without explicit annotations of stroke types. To address the low quality of motions extracted from broadcast videos, we correct estimated motion with physics-based imitation, and use a hybrid control policy that overrides erroneous aspects of the learned motion embedding with corrections predicted by the high-level policy. We demonstrate that our system produces controllers for physically-simulated tennis players that can hit the incoming ball to target positions accurately using a diverse array of strokes (serves, forehands, and backhands), spins (topspins and slices), and playing styles (one/two-handed backhands, left/right-handed play). Overall, our system can synthesize two physically simulated characters playing extended tennis rallies with simulated racket and ball dynamics. Code and data for this work is available at https://research.nvidia.com/labs/toronto-ai/vid2player3d/.	https://dl.acm.org/doi/abs/10.1145/3592408	Haotian Zhang, Ye Yuan, Viktor Makoviychuk, Yunrong Guo, Sanja Fidler, Xue Bin Peng, Kayvon Fatahalian
Learning to Simulate Crowds with Crowds	Controlling agent behaviors with Reinforcement Learning is of continuing interest in multiple areas. One major focus is to simulate multi-agent crowds that avoid collisions while locomoting to their goals. Although avoiding collisions is important, it is also necessary to capture realistic anticipatory navigation behaviors. We introduce a novel methodology that includes: 1) an RL method for learning an optimal navigational policy, 2) position-based constraints for correcting policy navigational decisions, and 3) a crowd-sourcing framework for selecting policy control parameters. Based on optimally selected parameters, we train a multi-agent navigation policy, which we demonstrate on crowd benchmarks. We compare our method to existing works, and demonstrate that our approach achieves superior multi-agent behaviors.	https://dl.acm.org/doi/abs/10.1145/3588028.3603670	Bilas Talukdar, Yunhao Zhang, Tomer Weiss
Les Pieds en Haut : Lou	There are as many ways to be autistic as there are autistic people. LOU --- Kid/Teen lets people experience what it's like to be in the body of an autistic child named Lou, to see and hear through his eyes and ears.	https://dl.acm.org/doi/abs/10.1145/3577025.3581770	Philippe Chrusten
Listen, Denoise, Action! Audio-Driven Motion Synthesis with Diffusion Models	Diffusion models have experienced a surge of interest as highly expressive yet efficiently trainable probabilistic models. We show that these models are an excellent fit for synthesising human motion that co-occurs with audio, e.g., dancing and co-speech gesticulation, since motion is complex and highly ambiguous given audio, calling for a probabilistic description. Specifically, we adapt the DiffWave architecture to model 3D pose sequences, putting Conformers in place of dilated convolutions for improved modelling power. We also demonstrate control over motion style, using classifier-free guidance to adjust the strength of the stylistic expression. Experiments on gesture and dance generation confirm that the proposed method achieves top-of-the-line motion quality, with distinctive styles whose expression can be made more or less pronounced. We also synthesise path-driven locomotion using the same model architecture. Finally, we generalise the guidance procedure to obtain product-of-expert ensembles of diffusion models and demonstrate how these may be used for, e.g., style interpolation, a contribution we believe is of independent interest.	https://dl.acm.org/doi/abs/10.1145/3592458	Simon Alexanderson, Rajmund Nagy, Jonas Beskow, Gustav Eje Henter
LivEdge: Haptic Live Stream Interaction on a Smartphone by Electro-Tactile Sensation Through the Edges	We present LivEdge, a novel method for live stream interaction on smartphones utilizing electro-tactile sensation through the edges. Conventional interactions between users and a streamer on a smartphone are restricted to the streamer's response through user comments or effects. Our goal is to provide a more immersive interaction through the use of haptic technology. LivEdge can convey spatial tactile sensations through electrical stimulations from electrode arrays affixed to both edges of the smartphone. This spatial tactile stimulus represents the streamer's physical presence and movements in contact with the edge of the screen. Preliminary experiment showed LivEdge enhances the live stream experience.	https://dl.acm.org/doi/abs/10.1145/3588037.3595386	Taiki Takami, Taiga Saito, Takayuki Kameoka, Hiroyuki Kajimoto
Locally Attentional SDF Diffusion for Controllable 3D Shape Generation	Although the recent rapid evolution of 3D generative neural networks greatly improves 3D shape generation, it is still not convenient for ordinary users to create 3D shapes and control the local geometry of generated shapes. To address these challenges, we propose a diffusion-based 3D generation framework --- , to model plausible 3D shapes, via 2D sketch image input. Our method is built on a two-stage diffusion model. The first stage, named , aims to generate a low-resolution occupancy field to approximate the shape shell. The second stage, named , synthesizes a high-resolution signed distance field within the occupied voxels determined by the first stage to extract fine geometry. Our model is empowered by a novel mechanism for image-conditioned shape generation, which takes advantage of 2D image patch features to guide 3D voxel feature learning, greatly improving local controllability and model generalizability. Through extensive experiments in sketch-conditioned and category-conditioned 3D shape generation tasks, we validate and demonstrate the ability of our method to provide plausible and diverse 3D shapes, as well as its superior controllability and generalizability over existing work.	https://dl.acm.org/doi/abs/10.1145/3592103	Xin-Yang Zheng, Hao Pan, Peng-Shuai Wang, Xin Tong, Yang Liu, Heung-Yeung Shum
Locally Meshable Frame Fields	The main robustness issue of state-of-the-art frame field based hexahedral mesh generation algorithms originates from non-meshable topological configurations, which do not admit the construction of an integer-grid map but frequently occur in smooth frame fields. In this article, we investigate the topology of frame fields and derive conditions on their meshability, which are the basis for a novel algorithm to automatically turn a given non-meshable frame field into a similar but locally meshable one. Despite local meshability is only a necessary but not sufficient condition for the stronger requirement of meshability, our algorithm increases the 2% success rate of generating valid integer-grid maps with state-of-the-art methods to 58%, when compared on the challenging HexMe dataset [Beaufort et al. 2022]. The source code of our implementation and the data of our experiments are available at https://lib.algohex.eu.	https://dl.acm.org/doi/abs/10.1145/3592457	Heng Liu, David Bommes
Looking Back to Look Forward: Keeping SIGGRAPH Vibrant for Another 50 Years: SIGGRAPH 2023 Retrospective Panel	Panelists will discuss the effects of rapid technological change, global economic shifts, and conference site characteristics on the SIGGRAPH conference during its first 50 occurrences.	https://dl.acm.org/doi/abs/10.1145/3587422.3598009	David Kasik
Luna: Episode 1 --- Left Behind	LUNA: EPISODE 1 --- LEFT BEHIND is an interactive VR story about a robot and a little girl trying to survive an AI apocalypse. The experience uses voice recognition to let the player talk to the characters.	https://dl.acm.org/doi/abs/10.1145/3577025.3580493	Charuvit Wannissorn
Lustration	Lustration is a four-part animated series following a group of characters from both the real world and afterlife. As these characters' stories unfold and intersect, we discover the lengths that some will go to in the name of love while uncovering a vast conspiracy that will change everything.	https://dl.acm.org/doi/abs/10.1145/3577025.3579653	Nathan Anderson
MERF: Memory-Efficient Radiance Fields for Real-time View Synthesis in Unbounded Scenes	Neural radiance fields enable state-of-the-art photorealistic view synthesis. However, existing radiance field representations are either too compute-intensive for real-time rendering or require too much memory to scale to large scenes. We present a Memory-Efficient Radiance Field (MERF) representation that achieves real-time rendering of large-scale scenes in a browser. MERF reduces the memory consumption of prior sparse volumetric radiance fields using a combination of a sparse feature grid and high-resolution 2D feature planes. To support large-scale unbounded scenes, we introduce a novel contraction function that maps scene coordinates into a bounded volume while still allowing for efficient ray-box intersection. We design a lossless procedure for baking the parameterization used during training into a model that achieves real-time rendering while still preserving the photorealistic view synthesis quality of a volumetric radiance field.	https://dl.acm.org/doi/abs/10.1145/3592426	Christian Reiser, Rick Szeliski, Dor Verbin, Pratul Srinivasan, Ben Mildenhall, Andreas Geiger, Jon Barron, Peter Hedman
Malacabra	What if, a goat ended the Mayan civilization?	https://dl.acm.org/doi/abs/10.1145/3577024.3588034	Marylou Bort
Masonry Shell Structures with Discrete Equivalence Classes	This paper proposes a method to model masonry shell structures where the shell elements fall into a set of discrete equivalence classes. Such shell structure can reduce the fabrication cost and simplify the physical construction due to reuse of a few template shell elements. Given a freeform surface, our goal is to generate a small set of template shell elements that can be reused to produce a seamless and buildable structure that closely resembles the surface. The major technical challenge in this process is balancing the desire for high reusability of template elements with the need for a seamless and buildable final structure. To address the challenge, we define three error metrics to measure the seamlessness and buildability of shell structures made from discrete equivalence classes and develop a hierarchical cluster-and-optimize approach to generate a small set of template elements that produce a structure closely approximating the surface with low error metrics. We demonstrate the feasibility of our approach on various freeform surfaces and geometric patterns, and validate buildability of our results with four physical prototypes. Code and data of this paper are at https://github.com/Linsanity81/TileableShell.	https://dl.acm.org/doi/abs/10.1145/3592095	Rulin Chen, Pengyun Qiu, Peng Song, Bailin Deng, Ziqi Wang, Ying He
Material Texture Design: Texture Representation System Utilizing Pseudo-Attraction Force Sensation	We propose Material Texture Design, a material texture representation system. This system presents a pseudo-attraction force sensation in response to the user's motion, and displays a shear sensation at the fingertips. The user perceives a change in the center of gravity from the shear sensation and feels the artificial material texture. Experimental results showed that the perceived texture could be changed by adjusting the frequency. Through demonstration, users can distinguish different textures such as water, jelly, or a rubber ball, depending on the frequency and latency. We propose this system as a small, lightweight, and simple implementation system for texture representation.	https://dl.acm.org/doi/abs/10.1145/3588037.3595397	Masaharu Hirose, Masahiko Inami
Materialistic: Selecting Similar Materials in Images	Separating an image into meaningful underlying components is a crucial first step for both editing and understanding images. We present a method capable of selecting the regions of a photograph exhibiting the same material as an artist-chosen area. Our proposed approach is robust to shading, specular highlights, and cast shadows, enabling selection in real images. As we do not rely on semantic segmentation (different woods or metal should not be selected together), we formulate the problem as a similarity-based grouping problem based on a user-provided image location. In particular, we propose to leverage the unsupervised DINO [Caron et al. 2021] features coupled with a proposed Cross-Similarity Feature Weighting module and an MLP head to extract material similarities in an image. We train our model on a new synthetic image dataset, that we release. We show that our method generalizes well to real-world images. We carefully analyze our model's behavior on varying material properties and lighting. Additionally, we evaluate it against a hand-annotated benchmark of 50 real photographs. We further demonstrate our model on a set of applications, including material editing, in-video selection, and retrieval of object photographs with similar materials.	https://dl.acm.org/doi/abs/10.1145/3592390	Prafull Sharma, Julien Philip, Michaël Gharbi, Bill Freeman, Fredo Durand, Valentin Deschaintre
Mechanical Brain Hacking : A VR Cybernetics Simulator for Body Editing	"Avatar technology has attracted attention, but research in the field of non-humanoid avatars has mainly focused on evaluating the operability and embodiment of new body systems. In addition to these points, we believe that users' design of their own avatar structure and body motion mapping is also important to improve the user experience. We present Mechanical Brain Hacking, a VR cybernetics simulator that allows for easy modification of both the mapping and the structure of the avatar. Participants take on the role of a damaged robot with limited mobility except for the right hand. They use a surgical machine linked to their avatar's hand movements to access their own brain and repair its circuits to regain control of their limbs. Haptic and electrical stimulation feedback, along with visual and auditory feedback through a VR headset, provide a fully immersive experience. Participants can even gain an extra limb by attaching additional limb parts. Through the experience of changing motion mapping and body structure in real time, this project offers a unique perspective on the concept of an ""editable body"", a body that is edited by oneself and in real time."	https://dl.acm.org/doi/abs/10.1145/3588027.3595595	Shuto Takashita, Naoki Tanaka, Taiga Suzuki
Melody Slot Machine HD	Melody Slot Machine HD is an application that allows users to experience generating melodies using musical structures while playing slot machines. To make it possible, we use the Generative Theory of Tonal Music (GTTM) to analyze the melody structure and generate variations of the melody. All variation melodies created on the basis of GTTM have a similar musical structure, so even if the melody switches to another variation in the middle, the overall structure will not collapse. It is possible to see the player on the display playing a new combination of a melody generated interactively by the user's manipulation.	https://dl.acm.org/doi/abs/10.1145/3588427.3595356	Masatoshi Hamanaka
Meso-Facets for Goniochromatic 3D Printing	Goniochromatic materials and objects appear to have different colors depending on viewing direction. This occurs in nature, such as in wood or minerals, and in human-made objects such as metal and effect pigments. In this paper, we propose algorithms to control multi-material 3D printers to produce goniochromatic effects on arbitrary surfaces by procedurally augmenting the input surface with meso-facets, which allow distinct colors to be assigned to different viewing directions of the input surface while introducing minimal changes to that surface. Previous works apply only to 2D or 2.5D surfaces, require multiple fabrication technologies, or make considerable changes to the input surface and require special post-processing, whereas our approach requires a single fabrication technology and no special post-processing. Our framework is general, allowing different generating functions for both the shape and color of the facets. Working with implicit representations allows us to generate geometric features at the limit of device resolution without tessellation. We evaluate our approach for performance, showing negligible overhead compared to baseline color 3D print processing, and for goniochromatic quality.	https://dl.acm.org/doi/abs/10.1145/3592137	Lubna Abu Rmaileh, Alan Brunton
Metro Re-illustrated: Incremental Generation of Stylized Paintings Using Neural Networks	Metro Re-illustrated is a project that explores incremental generation of stylized paintings of city metro maps using neural networks. It begins with an interactive system for labeling time-series data on city metro maps and generating reference images. These images are fed into a neural painter that incrementally generates oil painting-like strokes on virtual canvases. The generated paintings demonstrate blending and layering features of oil paintings while capturing the progressive nature of urban development.	https://dl.acm.org/doi/abs/10.1145/3588028.3603658	Bo Shui, Chufan Shi, Xiaomei Nie
