title	abstract	url	authors
'South of Midnight': Crafting a Stop Motion Southern Gothic Game	This talk will break down the animation process in South of Midnight across gameplay and cutscenes. And how it is a mix of art and tech that brings the stop motion, southern gothic world and characters alive.	https://dl.acm.org/doi/abs/10.1145/3698897.3730573	Vincent Schneider, Remi Edmond, Sebastien Dussault
3D Stylization via Large Reconstruction Model	With the growing success of text or image guided 3D generators, users demand more control over the generation process, appearance stylization being one of them. Given a reference image, this requires adapting the appearance of a generated 3D asset to reflect the visual style of the reference while maintaining visual consistency from multiple viewpoints. To tackle this problem, we draw inspiration from the success of 2D stylization methods that leverage the attention mechanisms in large image generation models to capture and transfer visual style. In particular, we probe if large reconstruction models, commonly used in the context of 3D generation, has a similar capability. We discover that the certain attention blocks in these models capture the appearance specific features. By injecting features from a visual style image to such blocks, we develop a simple yet effective 3D appearance stylization method. Our method does not require training or test time optimization. Through both quantitative and qualitative evaluations, we demonstrate that our approach achieves superior results in terms of 3D appearance stylization, significantly improving efficiency while maintaining high-quality visual outcomes. Code and models are available via our project website: https://github.com/ipekoztas/3D-Stylization-LRM.	https://dl.acm.org/doi/abs/10.1145/3721238.3730636	Ipek Oztas, Duygu Ceylan, Aysegul Dundar
3D-Fixup: Advancing Photo Editing with 3D Priors	Despite significant advances in modeling image priors via diffusion models, 3D-aware image editing remains challenging, in part because the object is only specified via a single image. To tackle this challenge, we propose 3D-Fixup, a new framework for editing 2D images guided by learned 3D priors. The framework supports difficult editing situations such as object translation and 3D rotation. To achieve this, we leverage a training-based approach that harnesses the generative power of diffusion models. As video data naturally encodes real-world physical dynamics, we turn to video data for generating training data pairs, i.e., a source and a target frame. Rather than relying solely on a single trained model to infer transformations between source and target frames, we incorporate 3D guidance from an Image-to-3D model, which bridges this challenging task by explicitly projecting 2D information into 3D space. We design a data generation pipeline to ensure high-quality 3D guidance throughout training. Results show that by integrating these 3D priors, 3D-Fixup effectively supports complex, identity coherent 3D-aware edits, achieving high-quality results and advancing the application of diffusion models in realistic image manipulation. The code is provided at .	https://dl.acm.org/doi/abs/10.1145/3721238.3730695	Yen-Chi Cheng, Krishna Kumar Singh, Jae Shin Yoon, Alexander Schwing, Liang-Yan Gui, Matheus Gadelha, Paul Guerrero, Nanxuan Zhao
3DGS2: Near Second-order Converging 3D Gaussian Splatting	3D Gaussian Splatting (3DGS) has emerged as a mainstream solution for novel view synthesis and 3D reconstruction. By explicitly encoding a 3D scene using a collection of Gaussian kernels, 3DGS achieves high-quality rendering with superior efficiency. As a learning-based approach, 3DGS training has been dealt with the standard stochastic gradient descent (SGD) method, which offers at most linear convergence. Consequently, training often requires tens of minutes, even with GPU acceleration. This paper introduces a (near) second-order convergent training algorithm for 3DGS, leveraging its unique properties. Our approach is inspired by two key observations. First, the attributes of a Gaussian kernel contribute independently to the image-space loss, which endorses isolated and local optimization algorithms. We exploit this by splitting the optimization at the level of individual kernel attributes, analytically constructing small-size Newton systems for each parameter group, and efficiently solving these systems on GPU threads. This achieves Newton-like convergence per training image without relying on the global Hessian. Second, kernels exhibit sparse and structured coupling across input images. This property allows us to effectively utilize spatial information to mitigate overshoot during stochastic training. Our method converges an order faster than standard GPU-based 3DGS training, requiring over 10 × fewer iterations while maintaining or surpassing the quality of the compared with the SGD-based 3DGS reconstructions.	https://dl.acm.org/doi/abs/10.1145/3721238.3730687	Lei Lan, Tianjia Shao, Zixuan Lu, Yu Zhang, Chenfanfu Jiang, Yin Yang
60,000nits Full-color Native RGB Single Junction 3,386PPI Micro-OLED	In this study, we independently developed a knowledge system named uNEEDXR™, successfully realizing a full-color micro-OLED device with a brightness of 60,000 nits on a silicon-based backplane. This knowledge system was developed over nine years and innovatively know-how and integrates expertise across design, processes, manufacturing, equipment, and material, overcoming the performance limitations of traditional micro-OLED architectures. The system enables high brightness, high pixel density, low power consumption, high contrast ratio, high color saturation, and tunable energy distribution (including viewing angle, wavelength, and bandwidth). Additionally, it meets customer requirements for reliability and lifespan. This technology provides a scalable production solution for near-eye display applications in augmented reality.	https://dl.acm.org/doi/abs/10.1145/3721250.3742970	Kuo-Cheng Hsu, Li-Min Huang, Yujia Qiu
A Fast Parallel Median Filtering Algorithm Using Hierarchical Tiling	Median filtering is a non-linear smoothing technique widely used in digital image processing to remove noise while retaining sharp edges. It is particularly well suited to removing outliers (impulse noise) or granular artifacts (speckle noise). However, the high computational cost of median filtering can be prohibitive. Sorting-based algorithms excel with small kernels but scale poorly with increasing kernel diameter, in contrast to constant-time methods characterized by higher constant factors but better scalability, such as histogram-based approaches or the 2D wavelet matrix. This paper introduces a novel algorithm, leveraging the separability of the sorting problem through hierarchical tiling to minimize redundant computations. We propose two variants: a data-oblivious selection network that can operate entirely within registers, and a data-aware version utilizing random-access memory. These achieve per-pixel complexities of ( log ( )) and ( ), respectively, for a × kernel — unprecedented for sorting-based methods. Our CUDA implementation is up to 5 times faster than the current state of the art on a modern GPU and is the fastest median filter in most cases for 8-, 16-, and 32-bit data types and kernels from 3 × 3 to 75 × 75.	https://dl.acm.org/doi/abs/10.1145/3721238.3730709	Louis Sugy
A Fluorescent Material Model for Non-Spectral Editing & Rendering	Fluorescent materials are characterized by a spectral reradiation toward longer wavelengths. Recent work [Fichet et al. ] has shown that the rendering of fluorescence in a non-spectral engine is possible through the use of appropriate reduced reradiation matrices. But the approach has limited expressivity, as it requires the storage of one reduced matrix per fluorescent material, and only works with measured fluorescent assets. In this work, we introduce an analytical approach to the editing and rendering of fluorescence in a non-spectral engine. It is based on a decomposition of the reduced reradiation matrix, and an analytically-integrable Gaussian-based model of the fluorescent component. The model reproduces the appearance of fluorescent materials accurately, especially with the addition of a UV basis. Most importantly, it grants variations of fluorescent material parameters in real-time, either for the editing of fluorescent materials, or for the dynamic spatial variation of fluorescence properties across object surfaces. A simplified one-Gaussian fluorescence model even allows for the artist-friendly creation of plausible fluorescent materials from scratch, requiring only a few reflectance colors as input.	https://dl.acm.org/doi/abs/10.1145/3721238.3730721	Laurent Belcour, Alban Fichet, Pascal Barla
A Large-Étendue Direct-View Holographic Display System	Direct-view 3D displays enable immersive experiences but often cause visual discomfort from relying on binocular disparity alone. Holographic displays offer an ultimate solution by reconstructing the full light wavefront, but face scalability and viewing freedom limitations due to the spatial-bandwidth product and high cost of fine-pitch phase-only SLMs. We present a system combining an amplitude-only display with ultra-high pixel count and dynamic optical steering for a fully 3D eye box. By axially translating a lens, we expand the eye box in depth beyond the capabilities of conventional pupil-steering methods. We further extend SGD-based hologram optimization to support dual light sources and an amplitude-only SLM, enabling stereoscopic delivery with suppressed crosstalk. Our prototype shows accurate depth cues, paving the way for scalable, high-quality holographic displays with expanded viewing freedom.	https://dl.acm.org/doi/abs/10.1145/3721250.3742975	Ryota Koiso, Suyeon Choi, Manu Gopakumar, Brian Chao, Jacqueline Yang, Gordon Wetzstein
A No-Code Introduction to Creating Geospatial Worlds with 3D Tiles and Cesium	Digital twins increasingly require integrating, viewing, and interacting with ever larger amounts of disparate data. 3D Tiles enables users to visualize geospatial data on a massive scale while balancing performance across devices. 3D Tiles likewise provides a method to aggregate diverse data, such as 3D models, photogrammetry, LiDAR, BIM/CAD models, and more, into an interoperable ecosystem based on open-source standards. Cesium is a leading platform for 3D geospatial data suitable for developers, technical artists, data visualizers, and non-technical stakeholders. Cesium provides users with a number of free tools to convert 3D models into 3D Tiles and to host 3D Tiles for streaming. In this hands-on lab, we'll leverage the Cesium platform to create global-scale digital twins by creating 3D Tiles, uploading them to a server, and interacting with the data in various runtimes such as the web and game engines.	https://dl.acm.org/doi/abs/10.1145/3721251.3742865	Cory Barr, Ben Jewett
A Novel Maxwellian Optics Combining Spherical Multi Pinholes and TMD for Enhanced Field of View	In this study, we propose a novel Maxwellian optics that achieves a wide field of view and evaluate its effectiveness through 2D and 3D simulations. The fundamental principle of the proposed system is based on Maxwellian view, a form of retinal projection that can mitigate the vergence–accommodation conflict. Conventional Maxwellian optics typically employ a pinhole to focus light on a single point within the pupil, enabling the projection of sharp images onto the retina with a wide field of view, independent of the eye's accommodation. However, a major limitation of such systems is the disappearance of the image when the eye rotates and the convergence point shifts outside the pupil. To address this issue, we propose a novel Maxwellian optical system that combines a spherical multi-pinhole (SMP) with a transmissive mirror device (TMD).	https://dl.acm.org/doi/abs/10.1145/3721250.3743022	Shuri Futamura, Ryuichi Inui, Tomoki Matsumoto, Yasuhisa Nakano, Tatsuji Tokiwa
A Platform for Interactive AI Character Experiences	From movie characters to modern science fiction — bringing characters into interactive, story-driven conversations has captured imaginations across generations. Achieving this vision is highly challenging and requires much more than just language modeling. It involves numerous complex AI challenges, such as conversational AI, maintaining character integrity, managing personality and emotions, handling knowledge and memory, synthesizing voice, generating animations, enabling real-world interactions, and integration with physical environments. Recent advancements in the development of foundation models, prompt engineering, and fine-tuning for downstream tasks have enabled researchers to address these individual challenges. However, combining these technologies for interactive characters remains an open problem. We present a system and platform for conveniently designing believable digital characters, enabling a conversational and story-driven experience while providing solutions to all of the technical challenges. As a proof-of-concept, we introduce , which allows users to engage in conversations with a digital representation of Albert Einstein about his life, research, and persona. While exemplifies our methods for a specific character, our system is flexible and generalizes to any story-driven or conversational character. By unifying these diverse AI components into a single, easy-to-adapt platform, our work paves the way for immersive character experiences, turning the dream of lifelike, story-based interactions into a reality.	https://dl.acm.org/doi/abs/10.1145/3721238.3730762	Rafael Wampfler, Chen Yang, Dillon Elste, Nikola Kovacevic, Philine Witzig, Markus Gross
A Polyhedral Construction of Empty Spheres in Discrete Distance Fields	Lie sphere geometry provides a unified representation of points, oriented spheres and hyperplanes in Euclidean -space as the subset of lines in that are contained in a certain quadric. The natural scalar product in this construction is zero if two elements are in oriented contact. We show how the sign of this product can be used to decide if spheres are disjoint. This allows us to model the space of spheres that are not intersecting a given union of spheres as the intersection of half-spaces (and the quadric). The maximal spheres are on the boundary of this set and can be computed by first constructing the intersection of half-spaces, which is a convex hull problem, and then intersecting edges of the hull against the quadric, which are the roots of a univariate quadratic. We demonstrate the method at the example of contouring a discrete signed distance field: every sample of the signed distance field represents an empty spheres and the zero-level contour has to be disjoint from the union of these spheres. Maximal spheres outside the empty spheres provide samples on the zero-level contour. The quality of this sample set is comparable to existing methods relying on optimization, while being deterministic and faster in practice.	https://dl.acm.org/doi/abs/10.1145/3721238.3730748	Maximilian Kohlbrenner, Marc Alexa
A Robust and Generalized Gauss-Seidel Solver for Physically-Correct Simultaneous Collisions	Simulating multi-object collisions in real-time environments remains a significant challenge, particularly when handling simultaneous collisions in a physically accurate manner. Traditional Gauss-Seidel solvers, widely employed in physics engines, often fail to preserve the symmetry and consistency of multi-object interactions that are often observed in physics. In this paper, we present a generalized and robust Gauss-Seidel solver to overcome the difficulties in simultaneous collisions. Using spatial and temporal collision states to classify and resolve constraints, our algorithm ensures correct collision propagation and symmetry, addressing the limitations commonly found in existing solvers. Moreover, our algorithm can mitigate jitters caused by floating-point errors, ensuring smooth and stable collision responses. Our approach demonstrates fast convergence and improved accuracy in scenarios involving complex multi-object collisions.	https://dl.acm.org/doi/abs/10.1145/3728291	Huanbo Zhou, Zhenyu Xu, Xijun Liu, Xinyu Zhang
A Sparrow's Song	Inspired by a true story, an elderly widow in the midst of World War II struggles to overcome grief and rediscover joy in her life. Day by day, she serves as an air raid warden in the crowded shelters, witnessing the suffering of children and others. One morning, she finds a dying sparrow and hopes to save its fragile life. As the sparrow gradually heals, a bond grows between them, and the bird begins to respond to her piano playing—a shared language that builds a bridge. During bombing raids, she carries the sparrow to the shelters, where she plays the piano, and the sparrow sings its song to comfort the children and offer hope to those around her. Through this newfound purpose and unexpected alliance, her life begins to change.	https://dl.acm.org/doi/abs/10.1145/3698896.3721357	Tobias Eckerlin
A Texture Streaming Pipeline for Real-Time GPU Ray Tracing	Disney Animation makes heavy use of Ptex [Burley and Lacewell ] across our assets [Burley et al. ], which required a new texture streaming pipeline for our new real-time ray tracer. Our goal was to create a scalable system which could provide a real-time, zero-stall experience to users at all times, even as the number of Ptex files expands into the tens of thousands. We cap the maximum size of the GPU cache to a relatively small footprint, and employ a fast LRU eviction scheme when we hit the limit.	https://dl.acm.org/doi/abs/10.1145/3721239.3734098	Mark Lee, Nathan Zeichner, Yining Karl Li
A Whirlwind Introduction to Computer Graphics	"For a beginner, walking into a SIGGRAPH conference is a very intimidating experience. There is so much to see and so much to do, and everyone seems to be speaking an unfamiliar language, and they seem to be ooh'ing and ahh'ing over things that they appreciate but you don't know how to. This course is for you! Rather than kicking new attendees off the dock and expecting them to swim at SIGGRAPH, the Whirlwind Introduction course's purpose is to give anyone who wants it a basic background in the concepts and terminology that they need to get more from the different venues in the conference. It is like a ""pre-course"" in that it is more fundamental than any other introductory activities and should be attended before anything else in the conference program."	https://dl.acm.org/doi/abs/10.1145/3721241.3733985	Mike Bailey
AI-Powered Real-Time VFX for Mobile	Cinematic visual effects have long been the domain of high-end hardware, reserved for movie studios and powerful gaming rigs. But what if we could bring that same level of quality to mobile devices—without sacrificing performance? AI VFX was born out of this challenge: to push the boundaries of real-time visual effects on mobile by merging Generative Adversarial Networks (GANs)[Goodfellow et al. ] with the VFX Graph. In this talk, we'll take you behind the scenes of AI VFX, a technology that enables stunning, real-time fire and water effects that run seamlessly across the full spectrum of mobile devices—from six-year-old Android phones to the latest iPhones. By integrating AI-powered enhancements into the VFX Graph (GPU particle system), we've developed an approach that balances visual fidelity with efficiency, ensuring cinematic-quality effects can exist in mobile gaming, social media, and beyond. We'll dive into the technical breakthroughs that made this possible, including synthetic data generation, real-time inference optimization, and workflows for combining GAN[Goodfellow et al. ] and VFX Graph—all while overcoming the hardware constraints of mobile platforms. Through recorded demos and real-world examples from TikTok, you'll see firsthand how AI is revolutionizing mobile VFX, unlocking new creative possibilities for developers, artists, and storytellers.	https://dl.acm.org/doi/abs/10.1145/3721239.3734099	Domin Lee, Anda Li, Kexin Lin
AI-Powered Visual Generation for Video Mapping	This hands-on session introduces a practical and accessible method for AI-powered visual generation in projection mapping. Participants will explore how artificial intelligence, real-time computer graphics, and interactive mapping can converge to empower creators—regardless of coding or technical background—to produce immersive visuals. The class focuses on generating dynamic visual content using AI models trained on diverse artistic styles, and adapting it in real time to various 2D and 3D projection surfaces. Attendees will learn how to use intuitive interfaces to customize visual outputs and control shader-based rendering parameters for optimized performance and fluid interaction. Technical insights will be shared on how real-time shader optimizations reduce computational load without compromising visual quality. Beyond technical execution, the session will include an open discussion on ethical AI use, transparency in dataset sourcing, and energy-conscious design practices. Over the course of 90 minutes, participants will: This class transforms a complex creative pipeline into an accessible learning experience, offering concrete skills and critical insights into the future of AI-assisted digital art.	https://dl.acm.org/doi/abs/10.1145/3721251.3737367	Etienne Mathé
AMOR: Adaptive Character Control through Multi-Objective Reinforcement Learning	Reinforcement learning (RL) has significantly advanced the control of physics-based and robotic characters that track kinematic reference motion. However, methods typically rely on a weighted sum of conflicting reward functions, requiring extensive tuning to achieve a desired behavior. Due to the computational cost of RL, this iterative process is a tedious, time-intensive task. Furthermore, for robotics applications, the weights need to be chosen such that the policy performs well in the real world, despite inevitable sim-to-real gaps. To address these challenges, we propose a multi-objective reinforcement learning framework that trains a single policy conditioned on a set of weights, spanning the Pareto front of reward trade-offs. Within this framework, weights can be selected and tuned after training, significantly speeding up iteration time. We demonstrate how this improved workflow can be used to perform highly dynamic motions with a robot character. Moreover, we explore how weight-conditioned policies can be leveraged in hierarchical settings, using a high-level policy to dynamically select weights according to the current task. We show that the multi-objective policy encodes a diverse spectrum of behaviors, facilitating efficient adaptation to novel tasks.	https://dl.acm.org/doi/abs/10.1145/3721238.3730656	Lucas N. Alegre, Agon Serifi, Ruben Grandia, David Müller, Espen Knoop, Moritz Bächer
Accelerated Gamut Discovery via Massive Parallelization	This paper presents a scalable framework for efficiently discovering the performance gamut of different processes. Gamut boundaries comprise the set of highest-performing solutions within a design space. While sampling methods are often inefficient or prone to premature convergence, Bayesian optimization struggles with taking advantage of existing large-scale parallel computation or experimentation. To address these challenges, we utilize Bayesian neural networks as scalable surrogates for performance prediction and uncertainty estimation. We further introduce a novel acquisition function that combines the diversity-driven exploration of stochastic optimization with the information-efficient exploitation of Bayesian optimization. This enables generating large, high-quality batches of samples. Our approach leverages large batch sizes to reduce the number of iterations needed for optimization. We demonstrate its effectiveness on real-world engineering and robotic problems, achieving faster and more extensive discovery of the performance gamut. Code and data are available at .	https://dl.acm.org/doi/abs/10.1145/3721238.3730712	Navid Ansari, Hans-Peter Seidel, Vahid Babaei
Accelerating AEC Workflows with 3D Geospatial Context in Runtime Engines	HNTB, a global architectural and infrastructure engineering firm, has partnered with Cesium, a leader in open and interoperable 3D geospatial platforms, to enhance the design, visualization, and contextual analysis of large-scale infrastructure projects. By adopting Cesium's technology, HNTB has significantly reduced the manual effort required to model complex projects—from small toll plazas to extensive 26-mile roadway alignments—by leveraging Cesium's 3D Tiles and geospatial streaming capabilities. To further streamline workflows, HNTB developed custom tools within Unity and Unreal Engine for editing Cesium 3D Tiles, including volumetric masking, edge blending, curvature adjustments, and the addition of natural elements like trees and foliage. Cesium supports AEC (Architecture, Engineering, and Construction) workflows by providing out-of-the-box geospatial context, such as Google Photorealistic 3D Tiles, and by optimizing and hosting user data for performant runtime streaming. Enhancing this ecosystem, Cesium continues to innovate with tools like the Cesium Design Tiler for efficient BIM model streaming and Cesium ion for Autodesk Revit, enabling seamless export and publication of Revit designs as 3D Tiles.	https://dl.acm.org/doi/abs/10.1145/3721239.3736526	Philip Luhn, Alex Paulson, Adam Liss, David Willard
