title	abstract	url	authors
QRBTF - AI QR Code Generator	QRBTF generates artistic QR codes that maintain machine readability while enhancing visual appeal. Our method integrates diffusion models with ControlNet conditioning and adaptive brightness control. Experimental results demonstrate effective brightness contrast control in specific image regions and robust model migration capabilities. Key innovations include: (1) Ternary luminance quantization mapping QR modules to control signals; (2) Style-adaptive generation using LoRA embeddings; (3) Post-processing optimization. The system has generated over 600,000 codes via qrbtf.com , validating its utility in branding and digital marketing applications.	https://dl.acm.org/doi/abs/10.1145/3721250.3743038	Hao Ni, Baiyu Chen, Zhaohan Wang, Zhiyong Chen, Wanyi Miao, Xin Lyu, Nan Cao
Quadtree Tall Cells for Eulerian Liquid Simulation	This paper introduces a novel grid structure that extends tall cell methods for efficient deep water simulation. Unlike previous tall cell methods, which are designed to capture all the fine details around liquid surfaces, our approach subdivides tall cells horizontally, allowing for more aggressive adaptivity and a significant reduction in the number of cells. The foundation of our method lies in a new variational formulation of Poisson's equations for pressure solve tailored for tall-cell grids, which naturally handles the transition of variable-sized cells. This variational view not only permits the use of the efficacy-proven conjugate gradient method but also facilitates monolithic two-way coupled rigid bodies. The key distinction between our method and previous general adaptive approaches, such as tetrahedral or octree grids, is the simplification of adaptive grid construction. Our method performs grid subdivision in a quadtree fashion, rather than an octree. These 2D cells are then simply extended vertically to complete the tall cell population. We demonstrate that this novel form of adaptivity, which we refer to as quadtree tall cells, delivers superior performance compared to traditional uniform tall cells.	https://dl.acm.org/doi/abs/10.1145/3721238.3730652	Fumiya Narita, Nimiko Ochiai, Takashi Kanai, Ryoichi Ando
Quantum Teleportation: Let's Write Code and Run It!	Quantum teleportation is a protocol that allows two people, conventionally named Alice and Bob, to transfer (not copy) quantum information. The transfer is performed seemingly instantaneously, no matter how far apart they are. It requires that Alice an Bob each have one of two entangled qubits, and that Alice sends two classical bits to Bob by conventional means. Note that this is a transfer of , rather than anything physical. Quantum teleportation is not teleportation as usually seen in science fiction, because we can only send quantum information. There's no way for Bob to turn that received information into matter, whether it's a grumpy (but humane) doctor or an exploding warp core.	https://dl.acm.org/doi/abs/10.1145/3721251.3742866	Andrew Glassner
RELATE3D: REfocusing Latent Adapter for Targeted local Enhancement and Editing in 3D Generation	Recent advancements in 3D generation techniques have simplified the tedious manual process of 3D asset production. Among these methods, 3D native latent diffusion models are particularly effective in generating high-quality geometric details. However, achieving local enhancement and editing of the generated 3D models remains a challenge due to the limited understanding of the relationship between text,images,and 3D in terms of local semantics and feature space.We explore and reveal the characteristics of the native 3D latent space, make it decomposable and low-rank, thereby enabling efficient and effective learning for multimodal local alignment. Based on this, we introduce , a novel approach that combines a Refocusing Adapter with part-to-latent correspondence guided training for precise local enhancement and part-level editing of 3D geometry. The Refocusing Adapter incorporates partial image and caption signals, and, combined with part-to-latent mapping, directs modifications to the relevant latent dimensions during latent diffusion process. We validate the effectiveness of our approach through extensive experiments and ablation studies, showcasing the capabilities of our generative local enhancement and editing process, as well as global refinement.	https://dl.acm.org/doi/abs/10.1145/3721238.3730648	Xiao-Lei Li, Hao-Xiang Chen, Yanni Zhang, Kai Ma, Alan Zhao, Tai-Jiang Mu, Hao-Xiang Guo, Ran Zhang
Racing With Legends: Bridging the Physical and Virtual World for a First of a Kind Film	"In January 2023, FCB New York approached The Mill with a brief for a groundbreaking branded film that would be presented as a TV special. ""We want to create an experience for a rookie Formula 1 driver that allows him to virtually race past legends, but in his real car, on a real track. And we want to make it into a TV special."" We knew that this would be one of the most ambitious projects that The Mill has ever undertaken, drawing on every department across several studios around the world. At the heart of this undertaking was a bespoke Augmented Reality display system for the driver. The final system incorporated race-grade GPS tracking, high-speed data transfer, and a custom display system that was safe enough to mount in the driver's helmet. To bring the race to viewers at home, we leveraged AR camera tracking to match the physical camera positions to the virtual world, creating a seamless viewing experience for fans around the world."	https://dl.acm.org/doi/abs/10.1145/3721239.3734081	Adam Smith, Rui An
Radiance Surfaces: Optimizing Surface Representations with a 5D Radiance Field Loss	We present a fast and simple technique to convert images into a radiance surface-based scene representation. Building on existing radiance volume reconstruction algorithms, we introduce a subtle yet impactful modification of the loss function requiring changes to only a few lines of code: instead of integrating the radiance field along rays and supervising the resulting images, we project the training images into the scene to directly supervise the spatio-directional radiance field. The primary outcome of this change is the complete removal of alpha blending and ray marching from the image formation model, instead moving these steps into the loss computation. In addition to promoting convergence to surfaces, this formulation assigns explicit semantic meaning to 2D subsets of the radiance field, turning them into well-defined radiance surfaces. We finally extract a level set from this representation, which results in a high-quality radiance surface model. Our method retains much of the speed and quality of the baseline algorithm. For instance, a suitably modified variant of Instant NGP maintains comparable computational efficiency, while achieving an average PSNR that is only 0.1 dB lower. Most importantly, our method generates explicit surfaces in place of an exponential volume, doing so with a level of simplicity not seen in prior work.	https://dl.acm.org/doi/abs/10.1145/3721238.3730713	Ziyi Zhang, Nicolas Roussel, Thomas Muller, Tizian Zeltner, Merlin Nimier-David, Fabrice Rousselle, Wenzel Jakob
Rags2Riches: Computational Garment Reuse	We present the first algorithm to automatically compute sewing patterns for upcycling existing garments into new designs. Our algorithm takes as input two garment designs along with their corresponding sewing patterns and determines how to cut one of them to match the other by following garment reuse principles. Specifically, our algorithm favors the reuse of seams and hems present in the existing garment, thereby preserving the embedded value of these structural components and simplifying the fabrication of the new garment. Finding optimal reused pattern is computationally challenging because it involves both discrete and continuous quantities. Discrete decisions include the choice of existing panels to cut from and the choice of seams and hems to reuse. Continuous variables include the precise placement of the new panels along seams and hems, and potential deformations of these panels to maximize reuse. Our key idea for making this optimization tractable is quantizing the shape of garment panels. This allows us to frame the search for an optimal reused pattern as a discrete assignment problem, which we solve efficiently with an ILP solver. We showcase our proposed pipeline on several reuse examples, including comparisons with reused patterns crafted by a professional garment designer. Additionally, we manufacture a physical reused garment to demonstrate the practical effectiveness of our approach.	https://dl.acm.org/doi/abs/10.1145/3721238.3730703	Anran Qi, Nico Pietroni, Maria Korosteleva, Olga Sorkine-Hornung, Adrien Bousseau
Real Time Path-Tracing with NVIDIA RTX MegaGeometry	NVIDIA's RTX Mega Geometry is a technology that accelerates Bounding Volume Hierarchy (BVH) building, enabling path tracing of scenes with up to 100x more triangles. With our cluster-based renderer, we introduce several improvements to existing methods and APIs that enable:	https://dl.acm.org/doi/abs/10.1145/3721243.3735983	Manuel Kraemer, Dylan Lacewell, Ardavan Kanani
Real-Time Interactive Graphics on Embedded Systems with ossia score, Puara, and Raspberry Pi	This course explores the creation of real-time interactive graphics on embedded systems, focusing on the integration of , , and Raspberry Pi. Participants will learn to design and implement dynamic visual experiences using GPU shaders, including the use of Interactive Shader Format (ISF) and techniques for porting shaders from platforms such as Shadertoy. The course will cover mapping physical behaviours through the interactions possible with a Raspberry Pi's inputs directly to GPU shaders, enabling responsive and interactive visuals. Through hands-on exercises, attendees will create custom mappings using , a tool for integrating gestural control into real-time graphics. The course will discuss the limitations of embedded systems, such as resolution constraints and the trade-offs between each stage of the rendering pipeline. Practical insights into direct rendering from an application to the GPU, bypassing compositors and display servers, will be provided, offering a comprehensive understanding of optimizing graphics performance on resource-constrained devices. Designed for artists, developers, and researchers, this course bridges the gap between creative expression and technical implementation, empowering participants to push the boundaries of real-time graphics on embedded platforms.	https://dl.acm.org/doi/abs/10.1145/3721251.3734069	Manuel Bolduc, Jean-Michaël Celerier, Eduardo Meneses
Real-Time Markov Chain Path Guiding for Global Illumination and Single Scattering	We present a lightweight and unbiased path guiding algorithm tailored for real-time applications with highly dynamic content. The algorithm demonstrates effectiveness in guiding both direct and indirect illumination. Moreover, it can be extended to guide single scattering events in participating media. Building upon the screen-space approach by Dittebrandt et al. [ ], the incident light distribution is represented as a von Mises-Fisher mixture model, which is controlled by a Markov chain process. To extend the procedure to world space, our algorithm uses a unique Markov chain architecture, which resamples Markov chain states from an ensemble of hash grids. We combine multi-resolution adaptive grids with a static grid, ensuring rapid state exchange without compromising guiding quality. The algorithm imposes minimal prerequisites on scene representation and seamlessly integrates into existing path tracing frameworks. Through continuous multiple importance sampling, it remains independent of the equilibrium distribution of Markov chain and hash grid resampling. We perform an evaluation of the proposed methods across diverse scenarios. Additionally, we explore the algorithm's viability in offline scenarios, showcasing its effectiveness in rendering volumetric caustics. We demonstrate the application of the proposed methods in a path tracing engine for the original Quake game. The demo project features path traced global illumination and single scattering effects at frame rates over 30 FPS on NVIDIA's GeForce 20 series or AMD's Radeon RX 6000 series without upscaling.	https://dl.acm.org/doi/abs/10.1145/3728296	Lucas Domingo Alber, Johannes Hanika, Carsten Dachsbacher
Real-Time Multispectral Lighting Reproduction	We present a real-time algorithm for driving multispectral LED lights in a spherical lighting reproduction stage to achieve optimal color rendition for a dynamic lighting environment. Previous work has driven multispectral LED lights (ours include red, green, blue, white, and amber LEDs) by solving a nonnegative least squares (NNLS) problem for each light source; the solution ensures that each light appears to be the correct RGB color seen by the camera and also optimizes how closely the lights illuminate a color chart to appear as it should in the target lighting environment. We create a real-time version of this technique by pre-computing a lookup table of these NNLS solutions across the full range of input RGB values. Since the proper relative mix of LEDs depends on chrominance and not on luminance, our lookup table can be reduced to 2D saving both storage and computation. With this technique, we can drive several thousand multispectral LED lights at video frame rates with proper color matching and color rendition for a dynamic lighting environment.	https://dl.acm.org/doi/abs/10.1145/3721250.3743035	Xueming Yu, David George, John Millward, Paul Debevec
Real-time graphics in Desmos, with just math and a browser	Desmos 2D and 3D calculators are browser-based tools that enable real-time experimentation with graphics defined by math. The software is all browser-based with purely client-side computation, which lowers the barrier for both creating and sharing. We employ a series of features to enable complicated computation to work natively and performantly in the browser, as well as a real-time rendering pipeline specifically for mathematics. We combine these technological building blocks into a system that allows users to build in real-time with graphics defined by math itself, which lowers the barrier to entry relative to more abstract languages and systems. This browser-first approach has enabled artists and engineers, from students to professionals, to make extraordinary creations using just math and a browser.	https://dl.acm.org/doi/abs/10.1145/3721243.3735987	Pooja Shaw, Eli Luberoff
Reassemble by Packing: Path-Valid Spectral Placement for 3D Fragment Assembly	3D reassembly needs both tight alignment and a collision-free insertion path, but most methods enforce only the former. We recast the task as constrained packing, apply FFT correlation for coarse placement, and prune unreachable poses with a flood-fill path test on the correlation map. A final ICP stage then maximizes surface alignment (instead of minimizing contact as in classic packing). Assuming a known target envelope, this path-aware spectral pipeline yields high-fidelity, physically valid reconstructions, although accuracy still depends on the initial pose sampling.	https://dl.acm.org/doi/abs/10.1145/3721250.3743043	Vinicius Gonçalves Hirono, Paula Dornhofer Paro Costa
Reconstructing Graphic Design Posters via Visual Decomposition and Semantic Layer Translation	This work presents a pipeline to convert rasterized graphic design posters into multi-layered, editable digital assets. It decomposes the input poster into core elements, categorizes them, and converts them into semantically meaningful formats. A novel strategy using Z-index addresses layer ordering and overlap. The pipeline's accuracy was evaluated by comparing over 24,000 original and reconstructed posters of multiple widely used sizes and aspect ratios in print & digital media. Layer semantic accuracy was assessed using the LLaVA-7B model, which showed high confidence scores across image, text, and shape layers. A user-centered evaluation with 20 participants resulted in high satisfaction ratings, confirming the pipeline's ability to accurately reproduce poster designs with excellent fidelity, layout, and overall quality. This pipeline contributes a refined approach to reconstructing rasterized graphic design posters, advancing beyond existing methods.	https://dl.acm.org/doi/abs/10.1145/3721250.3743040	Veeramanohar Avudaiappan, Ritwik Murali
Reenact Anything: Semantic Video Motion Transfer Using Motion-Textual Inversion	Recent years have seen a tremendous improvement in the quality of video generation and editing approaches. While several techniques focus on editing appearance, few address motion. Current approaches using text, trajectories, or bounding boxes are limited to simple motions, so we specify motions with a single motion reference video instead. We further propose to use a pre-trained image-to-video model rather than a text-to-video model. This approach allows us to preserve the exact appearance and position of a target object or scene and helps disentangle appearance from motion. Our method, called , leverages our observation that image-to-video models extract appearance mainly from the (latent) image input, while the text/image embedding injected via cross-attention predominantly controls motion. We thus represent motion using text/image embedding tokens. By operating on an inflated motion-text embedding containing multiple text/image embedding tokens per frame, we achieve a high temporal motion granularity. Once optimized on the motion reference video, this embedding can be applied to various target images to generate videos with semantically similar motions. Our approach does not require spatial alignment between the motion reference video and target image, generalizes across various domains, and can be applied to various tasks such as full-body and face reenactment, as well as controlling the motion of inanimate objects and the camera. We empirically demonstrate the effectiveness of our method in the semantic video motion transfer task, significantly outperforming existing methods in this context. Project website: https://mkansy.github.io/reenact-anything/	https://dl.acm.org/doi/abs/10.1145/3721238.3730668	Manuel Kansy, Jacek Naruniec, Christopher Schroers, Markus Gross, Romann M. Weber
Relightable Full-Body Gaussian Codec Avatars	We propose Relightable Full-Body Gaussian Codec Avatars, a new approach for modeling relightable full-body avatars with fine-grained details including face and hands. The unique challenge for relighting full-body avatars lies in the large deformations caused by body articulation and the resulting impact on appearance caused by light transport. Changes in body pose can dramatically change the orientation of body surfaces with respect to lights, resulting in both local appearance changes due to changes in local light transport functions, as well as non-local changes due to occlusion between body parts. To address this, we decompose the light transport into local and non-local effects. Local appearance changes are modeled using learnable zonal harmonics for diffuse radiance transfer. Unlike spherical harmonics, zonal harmonics are highly efficient to rotate under articulation. This allows us to learn diffuse radiance transfer in a local coordinate frame, which disentangles the local radiance transfer from the articulation of the body. To account for non-local appearance changes, we introduce a shadow network that predicts shadows given precomputed incoming irradiance on a base mesh. This facilitates the learning of non-local shadowing between the body parts. Finally, we use a deferred shading approach to model specular radiance transfer and better capture reflections and highlights such as eye glints. We demonstrate that our approach successfully models both the local and non-local light transport required for relightable full-body avatars, with a superior generalization ability under novel illumination conditions and unseen poses.	https://dl.acm.org/doi/abs/10.1145/3721238.3730739	Shaofei Wang, Tomas Simon, Igor Santesteban, Timur Bagautdinov, Junxuan Li, Vasu Agrawal, Fabian Prada, Shoou-I Yu, Pace Nalbone, Matt Gramlich, Roman Lubachersky, Chenglei Wu, Javier Romero, Jason Saragih, Michael Zollhoefer, Andreas Geiger, Siyu Tang, Shunsuke Saito
RenderFormer: Transformer-based Neural Rendering of Triangle Meshes with Global Illumination	We present RenderFormer, a neural rendering pipeline that directly renders an image from a triangle-based representation of a scene with full global illumination effects and that does not require per-scene training or fine-tuning. Instead of taking a physics-centric approach to rendering, we formulate rendering as a sequence-to-sequence transformation where a sequence of tokens representing triangles with reflectance properties is converted to a sequence of output tokens representing small patches of pixels. RenderFormer follows a two stage pipeline: a view-independent stage that models triangle-to-triangle light transport, and a view-dependent stage that transforms a token representing a bundle of rays to the corresponding pixel values guided by the triangle-sequence from the the view-independent stage. Both stages are based on the transformer architecture and are learned with minimal prior constraints. We demonstrate and evaluate RenderFormer on scenes with varying complexity in shape and light transport.	https://dl.acm.org/doi/abs/10.1145/3721238.3730595	Chong Zeng, Yue Dong, Pieter Peers, Hongzhi Wu, Xin Tong
Reservoir Splatting for Temporal Path Resampling and Motion Blur	Recent extensions to spatiotemporal path reuse, or ReSTIR, improve rendering efficiency in the presence of high-frequency content by augmenting path reservoirs to represent contributions over full pixel footprints. Still, if historical paths fail to contribute to future frames, these benefits disappear. Prior ReSTIR work to the prior frame to identify paths for reuse. Backprojection can fail to find relevant paths for many reasons, including moving cameras or subpixel geometry with differing motion. We introduce to reduce these failures. Splatting forward-projects the primary hits of prior-frame paths. Unlike backprojection, forward-projected path samples fall into the current-frame pixel relevant to their exact primary hits, making successful reuse more likely. This also enables motion blur for ReSTIR, by splatting at multiple time steps, and supports depth of field without the specialized shift maps needed previously. Beyond enabling motion blur, splatting improves resampling quality over Zhang et al.'s [ ] Area ReSTIR at up to 10% lower cost. To improve robustness, we show how to MIS splatted and backprojected samples to help every current-frame pixel get at least one historical path proposed for reuse.	https://dl.acm.org/doi/abs/10.1145/3721238.3730646	Jeffrey Liu, Daqi Lin, Markus Kettunen, Chris Wyman, Ravi Ramamoorthi
SAWNA: Space-Aware Text to Image Generation	Layout-aware text-to-image generation allows users to synthesize images by specifying object positions through text prompts and layouts. This has proven useful in a variety of creative fields such as advertising, UI design, and animation, where structured scene control is essential. In real-world workflows, however, certain regions are often intentionally left empty—for instance, for headlines in advertisements, buttons in interface prototypes, or subtitles and speech bubbles in animation frames. Existing models lack the ability to explicitly preserve such negative spaces, often resulting in unwanted content and complicating downstream editing. We introduce Space-Controllable Text-to-Image Generation, a task that treats reserved areas as first-class constraints. To address this, we propose SAWNA (Space-Aware Text-to-Image Generation), a training-free diffusion framework that injects nonreactive noise into user-defined masked regions, ensuring they remain empty throughout generation. Our method maintains semantic integrity and visual fidelity without retraining and integrates seamlessly into layout-sensitive workflows in design, advertising, and animation. Experiments demonstrate that SAWNA reliably enforces spatial constraints and improves the practical usability of generated content.	https://dl.acm.org/doi/abs/10.1145/3721250.3743023	Ryugo Morita, Sho Kuno, Ryunosuke Tanaka, Rongzhi Li, Hoang Dai Dinh, Issey Sukeda
SEE-2-SOUND: Zero-Shot Spatial Environment-to-Spatial Sound	Generating combined visual and auditory sensory experiences is critical for immersive content. We introduce SEE-2-SOUND, a pipeline that turns an image, GIF, or video into 5.1 spatial audio. SEE-2-SOUND sequentially: (i) segments visual sound sources; (ii) estimates their 3-D positions from monocular depth; (iii) synthesises mono audio for every source; and (iv) renders the mix with room acoustics. Built entirely from off-the-shelf models, the method needs no fine-tuning and runs in zero-shot mode on real or generated media. We demonstrate compelling results for generating spatial audio from videos, images, dynamic images, and media generated by learned approaches. Project page: .	https://dl.acm.org/doi/abs/10.1145/3721250.3742965	Rishit Dagli, Shivesh Prakash, Robert Wu, Houman Khosravani
