title	abstract	url	authors
Project nira: instant interactive real-time access to multi-gigabyte sized 3D assets on any device	Here is some text in the style of last year's RTL lineup descriptions: We demonstrate a collaboration platform for viewing massive 3D assets in real-time using any web browser on any device. Technologies such as high framerate server-side rendering, low-latency video encoding, and artist friendly markup tools are combined to accelerate production pipelines. Additional text below: Nira is a powerful new collaborative design and art review platform for 3D production pipelines. Nira removes the burden of having to send proprietary files back and forth for reviews by providing a unified platform for viewing, reviewing, tracking, and version comparing of all assets. Upon upload of a production asset, the Nira asset ingestion pipeline converts the asset to a format optimized for very fast loading and display performance within its custom renderer. When the asset is subsequently viewed, Nira renders and then encodes the frame buffer to an efficient and high quality video stream, which is then decoded within a web browser on the viewer's device at 60 fps in real-time. The client device need only be capable of decoding a video stream, so this allows large production assets to be interactively viewed on lower powered mobile devices like never before. In addition to viewing capabilities, Nira also includes a host of collaborative drawing and markup tools allowing for effective visual communication between team members and stakeholders.	https://dl.acm.org/authorize?N689129	Arash Keissami, Andrew Johnson, Dario Manesku
PuppetMaster: robotic animation of marionettes	We present a computational framework for robotic animation of real-world string puppets. Also known as marionettes, these articulated figures are typically brought to life by human puppeteers. The puppeteer manipulates rigid handles that are attached to the puppet from above via strings. The motions of the marionette are therefore governed largely by gravity, the pull forces exerted by the strings, and the internal forces arising from mechanical articulation constraints. This seemingly simple setup conceals a very challenging and nuanced control problem, as marionettes are, in fact, complex coupled pendulum systems. Despite this, in the hands of a master puppeteer, marionette animation can be nothing short of mesmerizing. Our goal is to enable autonomous robots to animate marionettes with a level of skill that approaches that of human puppeteers. To this end, we devise a predictive control model that accounts for the dynamics of the marionette and kinematics of the robot puppeteer. The input to our system consists of a string puppet design and a target motion, and our trajectory planning algorithm computes robot control actions that lead to the marionette moving as desired. We validate our methodology through a series of experiments conducted on an array of marionette designs and target motions. These experiments are performed both in simulation and using a physical robot, the human-sized, dual arm ABB YuMi IRB 14000.	https://dl.acm.org/authorize?N688158	Simon Zimmermann, Roi Poranne, James M. Bern, Stelian Coros
Puppeteered rain: interactive illusion of levitating water drops by position-dependent strobe projection	Light projection onto falling water produces distinct and impressive experience which is suitable for entertainment and advertising installations in public spaces [Barnum et al. 2010; Eitoku et al. 2006]. One of popular and classical techniques used in illuminating water for such purposes is strobe lighting, which presents optical illusion of levitating --- or slowly falling or rising --- water drops depending on the relation between water dropping and strobe lighting frequencies (e.g. [Pevnick 1981; Rosenthal 1984]).	https://dl.acm.org/doi/abs/abs/10.1145/3306214.3338603	Shingo Kagami, Kotone Higuchi, Koichi Hashimoto
Purl	"""Purl,"" directed by Kristen Lester and produced by Gillian Libbert-Duncan, features an earnest ball of yarn named Purl who gets a job in a fast-paced, high energy, bro-tastic startup. Yarn hijinks ensue as she tries to fit in, but how far is she willing to go to get the acceptance she yearns for, and in the end, is it worth it?"	https://dl.acm.org/authorize?N689248	Kristen Lester
Quixel's rebirth: megascans environment breakdown	One of the aims of the project was to prove that the kinds of results we achieved with Rebirth are accessible, not only for studios with huge budgets and large teams but also for freelancers and independents. If an individual wanted to download and use the assets that we did in Rebirth it would cost the equivalent of around $75. While Rebirth may look complex, in reality, we used a small set of assets throughout the entire cinematic. As each Megascans asset is quite visually complex, this allowed us to repurpose the same assets across many different shots whilst creating a varied look.	https://dl.acm.org/authorize?N689120	Galen Davis
Rapid 3D building modeling by sketching	This paper proposes an intuitive tool for users to create 3D architectural models through 2D sketch input. A user only needs to draw the outline of a frontal or oblique view of a building. Our system recognizes the parts drawn in a sketch and estimates their types. The estimated information is then used to compose the corresponding 3D model. Besides, our system provides additional assistant tools for rapid editing. The modeling process can be iterative and incremental. To accomplish a building complex, a user can gradually create their models from one view to another. Our experiment shows that the proposed interface with sketch analysis tools eases the process of 3D building modeling.	https://dl.acm.org/doi/abs/abs/10.1145/3306214.3338545	Chia-Yu Chen, I-Chen Lin
Real-time pose and shape reconstruction of two interacting hands with a single depth camera	We present a novel method for real-time pose and shape reconstruction of two strongly interacting hands. Our approach is the first two-hand tracking solution that combines an extensive list of favorable properties, namely it is marker-less, uses a single consumer-level depth camera, runs in real time, handles inter- and intra-hand collisions, and automatically adjusts to the user's hand shape. In order to achieve this, we embed a recent parametric hand pose and shape model and a dense correspondence predictor based on a deep neural network into a suitable energy minimization framework. For training the correspondence prediction network, we synthesize a two-hand dataset based on physical simulations that includes both hand pose and shape annotations while at the same time avoiding inter-hand penetrations. To achieve real-time rates, we phrase the model fitting in terms of a nonlinear least-squares problem so that the energy can be optimized based on a highly efficient GPU-based Gauss-Newton optimizer. We show state-of-the-art results in scenes that exceed the complexity level demonstrated by previous work, including tight two-hand grasps, significant inter-hand occlusions, and gesture interaction.	https://dl.acm.org/authorize?N688094	Franziska Mueller, Micah Davis, Florian Bernard, Oleksandr Sotnychenko, Mickeal Verschoor, Miguel A. Otaduy, Dan Casas, Christian Theobalt
"Real-time procedural VFX characters in unity's real-time short film ""The Heretic"""	"""The Heretic"", the latest real-time short film by Unity's Demo Team features two entirely vfx-based characters, Boston and Morgan. VFX-based characters are notoriously hard to conceptualize, especially in motion. Building and using real-time tools allowed us to explore the space of possibilities and quickly arrive at designs we were satisfied with. The character of Boston is made up of steel wires navigating the environment, conforming to the shape of a bird-like creature. Animating thousands of wires in a traditional way was unthinkable. The challenge then lied in building tools allowing to express the intention of the artists, allow for emergent behavior, but also make it directable at the same time. Boston is implemented as a set of tools, scripts, and shaders within the Unity engine. The character Morgan doesn't have a clearly- defined physical manifestation, morphs between its female and male forms, and constantly varies its size. Morgan is implemented using the Unity Visual Effect Graph, extended with additional tools and features. The presentation will be of value to all creative communities that base their process on real-time technology - both within game development and real-time filmmaking. From a film production perspective, such characters are typically entirely within the domain of expertise of post-production / VFX studios. With the introduction of realtime-based VFX characters, these characters can be included much earlier in the production process and are more open for experimentation and better connected to the rest of the production elements. From a game development perspective, real- time VFX-based characters allow for bolder and more unconventional creative ideas to be conceived and executed and thereby contribute to richer and more elaborate virtual worlds. They allow the creatives to express more complex, abstract or surreal ideas and develop interesting and original aesthetics."	https://dl.acm.org/authorize?N689121	Veselin Efremov, Adrian Lazar
Real-time structure aware color stippling	In computer graphics, stippling is a widely used non-photorealistic rendering technique. As the art of representing images with dots, one of the key problems is the placement of dots. In general, they should be distributed evenly, and with some randomness at the same time. Blue noise methods provide these characteristics and are used by state-of-the-art gray-scale algorithms to distribute dots. Color stippling, however, is more challenging as each channel should have even distribution at the same time. Existing approaches cast color stippling as a multi-class blue noise sampling problem and provide high quality results at the cost of a very long processing time. In this paper, we propose a real-time structure aware method for color stippling, based on samples generated from an incremental voronoi set. Our method can handle an arbitrary input color vector for stippling and produce significantly better results than previous methods, at real-time frame rate. We evaluate the perceptual quality of our stippling with a user study and its numerical performance by measuring the MSE between the reconstructed image from the stippling and the input image. As a result, the real time performance of our method makes interactive stippling editing possible, providing the artist with an effective tool to explore quickly a wide space of color image stippling.	https://dl.acm.org/doi/abs/abs/10.1145/3306214.3338606	Lei Ma, Hong Deng, Beibei Wang, Yanyun Chen, Tamy Boubekeur
Real-time, single camera, digital human development	We have built a real-time (60 fps) photo-realistic facial motion capture system which uses a single camera, proprietary deep learning software, and Unreal Engine 4 to create photo-real digital humans and creatures. Our system uses thousands of frames of realistic captured 3D facial performance of an actor (generated from automated offline systems) instead of a traditional FACS-based facial rig to produce an accurate model of how an actor's face moves. This 3D data is used to create a real-time machine learning model which uses a single image to accurately describe the exact facial pose in under 17 milliseconds. The motion of the face is highly realistic and includes region based blood flow, wrinkle activation, and pore structure changes, driven by geometry deformations in real-time. The facial performance of the actor can be transferred to a character with extremely high fidelity, and switching the machine learning models is instantaneous. We consider this a significant advancement over other real-time avatar projects in development. Building on top of our real-time facial animation technology, we seek to make interaction with our avatars more immersive and emotive. We built an AR system for the actor who is driving the human / character to see and interact with people in VR or others viewing in AR. With this technique, the character you are interacting with in VR can make correct eye contact, walk around you, and interact as if you were together all while still achieving the highest quality capture. This process allows for a much more tangible VR / AR experience than any other system. Another goal of ours is to achieve photo-real avatar telepresence with minimal latency. We have been able to successfully live-drive our digital humans from our office in Los Angeles to our office in Vancouver.	https://dl.acm.org/authorize?N689122	Doug Roble, Darren Hendler, Jeremy Buttell, Melissa Cell, Jason Briggs, Chad Reddick, Lonnie Iannazzo, Deer Li, Mark Williams, Lucio Moser, Cydney Wong, Dimitry Kachkovski, Jason Huang, Kai Zhang, David McLean, Rickey Cloudsdale, Dan Milling, Ron Miller, JT Lawrence, Chinyu Chien
Reconsideration of ouija board motion in terms of haptic illusions (IV): effect of haptic cue and another player	The Ouija board game is associated with a type of involuntary motion known as an ideomotor action. We sought to clarify the conditions under which this motion occurs by evaluating the effect that visual and haptic movement cues have on its occurrence. Using our lateral skin deformation device, we found that the simultaneous presentation of visual and tactile illusory motion and force produced larger ideomotor actions than when either modality presented alone, an effect that was further potentiated by the presence of another player (an avatar).	https://dl.acm.org/doi/abs/abs/10.1145/3306214.3338567	Takahiro Shitara, Vibol Yem, Hiroyuki Kajimoto
Recreating BoPeep for Toy Story 4	In , audiences rediscover BoPeep, who returns after nearly 20 years away from the big screen. In adapting her design, we considered not only the cultural context of reviving one of our industry's first female characters, informing our story and design, but also the technology now available, which drove explorations in shading and simulation, among other areas. Our talk describes BoPeep's journey through production: from initial research into decades-old reference and visualization, to the modern results and strides we've taken across both creative and technical specialties.	https://dl.acm.org/authorize?N689379	Mariana Galindo, Carrie Hobson, Radford Hurn, Patty Kihm, Tanja Krampfert, Mara MacMahon, George Nguyen, Becki Tower
RedMax: efficient & flexible approach for articulated dynamics	It is well known that the dynamics of articulated rigid bodies can be solved in time using a recursive method, where is the number of joints. However, when elasticity is added between the bodies , damped springs), with linearly implicit integration, the stiffness matrix in the equations of motion breaks the tree topology of the system, making the recursive method inapplicable. In such cases, the only alternative has been to form and solve the system matrix, which takes ( ) time. We propose a new approach that is capable of solving the linearly implicit equations of motion in near linear time. Our method, which we call RedMax, is built using a combined reduced/maximal coordinate formulation. This hybrid model enables direct flexibility to apply arbitrary combinations of constraints and contact modeling in both reduced and maximal coordinates, as well as mixtures of implicit and explicit forces in either coordinate representation. We highlight RedMax's flexibility with seamless integration of deformable objects with two-way coupling, at a standard additional cost. We further highlight its flexibility by constructing an efficient internal (joint) and external (environment) frictional contact solver that can leverage bilateral joint constraints for rapid evaluation of frictional articulated dynamics.	https://dl.acm.org/authorize?N688159	Ying Wang, Nicholas J. Weidner, Margaret A. Baxter, Yura Hwang, Danny M. Kaufman, Shinjiro Sueda
Reincarnation: virtual reality recreation of Yves Tanguy's world	Reincarnation is a virtual reality art experience, built upon a series of French surrealist painter Yves Tanguy's paintings in combination with my creation of pseudo-natural beings. It seeks and argues the animism in various matters and challenges the anthropocentric worldview in an artificial intelligence era.	https://dl.acm.org/authorize?N689148	Mengyu Chen, Jing Yan
Remote control experiment with displaybowl and 360-degree video	DisplayBowl is a bowl-shaped hemispherical display for showing omnidirectional images with direction data. It provides users with a novel way of observing 360-degree video streams, which improves the awareness of the surroundings when operating a remote-controlled vehicle compared to conventional flat displays and HMDs. In this paper, we present a user study, in which we asked participants to control a remote drone using an omnidirectional video streaming, to compare the uniqueness and advantages of three displays: a flat panel display, a head-mounted display and DisplayBowl.	https://dl.acm.org/doi/abs/abs/10.1145/3306214.3338568	Shio Miyafuji, Soichiro Toyohara, Toshiki Sato, Hideki Koike
Remote spatial programming and collaboration using a real-time volumetric capture space	Collaboratively program a machine through a spatial drag-and-drop interface while being captured real-time in volumetric-video. We explore the future of industrial programming by using AR to build a drag-and-drop spatial interface. One person programs a machine using their phone while another can collaborate remotely through a volumetric-video	https://dl.acm.org/authorize?N689252	Hisham Bedri, Christian Vazquez, Valentin Heun, Anna Fusté, Benjamin Reynolds
Retiming of fluid simulations for VFX: distributed non-linear fluid retiming by sparse bi-directional advection-diffusion	We present our FX retiming workflow developed on Blue Sky Studios' latest feature, Spies in Disguise. Retiming refers to the slowing down and speeding up of FX assets in a shot. These include point particles, rigid bodies, volumetric elements like smoke and fire, and fluids. Our solution is shown to be robust and efficient, even for the challenging cases of retiming heavily dynamic events, such as fire and explosions.	https://dl.acm.org/authorize?N689315	Ravindra Dwivedi, Jon Barry, Sean C McDuffee
Rodent: generating renderers without writing a generator	Monte-Carlo Renderers must generate many color samples to produce a noise-free image, and for each of those, they must evaluate complex mathematical models representing the appearance of the objects in the scene. These models are usually in the form of shaders: Small programs that are executed during rendering in order to compute a value for the current sample. Renderers often compile and optimize shaders just before rendering, taking advantage of the knowledge of the scene. In principle, the entire renderer could benefit from a-priori code generation. For instance, scheduling can take advantage of the knowledge of the scene in order to maximize hardware usage. However, writing such a configurable renderer eventually means writing a compiler that translates a scene description into machine code. In this paper, we present a framework that allows generating entire renderers for CPUs and GPUs without having to write a dedicated compiler: First, we provide a rendering library in a functional/imperative language that elegantly abstracts the individual rendering concepts using higher-order functions. Second, we use to combine and specialize the individual components of a renderer according to a particular scene. Our results show that the renderers we generate outperform equivalent high-performance implementations written with state-of-the-art ray tracing libraries on the CPU and GPU.	https://dl.acm.org/authorize?N688095	Arsène Pérard-Gayot, Richard Membarth, Roland Leißa, Sebastian Hack, Philipp Slusallek
SAGNet: structure-aware generative network for 3D-shape modeling	We present SAGNet, a structure-aware generative model for 3D shapes. Given a set of segmented objects of a certain class, the geometry of their parts and the pairwise relationships between them (the structure) are jointly learned and embedded in a latent space by an autoencoder. The encoder intertwines the geometry and structure features into a single latent code, while the decoder disentangles the features and reconstructs the geometry and structure of the 3D model. Our autoencoder consists of two branches, one for the structure and one for the geometry. The key idea is that during the analysis, the two branches exchange information between them, thereby learning the dependencies between structure and geometry and encoding two augmented features, which are then fused into a single latent code. This explicit intertwining of information enables separately controlling the geometry and the structure of the generated models. We evaluate the performance of our method and conduct an ablation study. We explicitly show that encoding of shapes accounts for both similarities in structure and geometry. A variety of quality results generated by SAGNet are presented.	https://dl.acm.org/authorize?N688046	Zhijie Wu, Xiang Wang, Di Lin, Dani Lischinski, Daniel Cohen-Or, Hui Huang
SPOT: sliced partial optimal transport	"Optimal transport research has surged in the last decade with wide applications in computer graphics. In most cases, however, it has focused on the special case of the so-called ""balanced"" optimal transport problem, that is, the problem of optimally matching positive measures of equal total mass. While this approach is suitable for handling probability distributions as their total mass is always equal to one, it precludes other applications manipulating disparate measures. Our paper proposes a fast approach to the optimal transport of constant distributions supported on point sets of different cardinality via one-dimensional slices. This leads to one-dimensional partial assignment problems akin to alignment problems encountered in genomics or text comparison. Contrary to one-dimensional balanced optimal transport that leads to a trivial linear-time algorithm, such partial optimal transport, even in 1-d, has not seen any closed-form solution nor very efficient algorithms to date. We provide the first efficient 1-d partial optimal transport solver. Along with a quasilinear time problem decomposition algorithm, it solves 1-d assignment problems consisting of up to millions of Dirac distributions within fractions of a second in parallel. We handle higher dimensional problems via a slicing approach, and further extend the popular iterative closest point algorithm using optimal transport - an algorithm we call We illustrate our method on computer graphics applications such a color transfer and point cloud registration."	https://dl.acm.org/authorize?N688034	Nicolas Bonneel, David Coeurjolly
Sample-based Monte Carlo denoising using a kernel-splatting network	It has been shown that rendering in the gradient domain, i.e., estimating finite difference gradients of image intensity using correlated samples, and combining them with direct estimates of pixel intensities by solving a screened Poisson problem, often offers fundamental benefits over merely sampling pixel intensities. The reasons can be traced to the frequency content of the light transport integrand and its interplay with the gradient operator. However, while they often yield state of the art performance among algorithms that are based on Monte Carlo sampling alone, gradient-domain rendering algorithms have, until now, not generally been competitive with techniques that combine Monte Carlo sampling with post-hoc noise removal using sophisticated non-linear filtering. Drawing on the power of modern convolutional neural networks, we propose a novel reconstruction method for gradient-domain rendering. Our technique replaces the screened Poisson solver of previous gradient-domain techniques with a novel dense variant of the U-Net autoencoder, additionally taking auxiliary feature buffers as inputs. We optimize our network to minimize a perceptual image distance metric calibrated to the human visual system. Our results significantly improve the quality obtained from gradient-domain path tracing, allowing it to overtake state-of-the-art comparison techniques that denoise traditional Monte Carlo samplings. In particular, we observe that the correlated gradient samples --- that offer information about the smoothness of the integrand unavailable in standard Monte Carlo sampling --- notably improve image quality compared to an equally powerful neural model that does not make use of gradient samples.	https://dl.acm.org/authorize?N688171	Markus Kettunen, Erik Härkönen, Jaakko Lehtinen
