title	abstract	url	authors
Large-Scale Multi-Character Interaction Synthesis	Generating large-scale multi-character interactions is a challenging and important task in character animation. Multi-character interactions involve not only natural interactive motions but also characters coordinated with each other for transition. For example, a dance scenario involves characters dancing with partners and also characters coordinated to new partners based on spatial and temporal observations. We term such transitions as coordinated interactions and decompose them into interaction synthesis and transition planning. Previous methods of single-character animation do not consider interactions that are critical for multiple characters. Deep-learning-based interaction synthesis usually focuses on two characters and does not consider transition planning. Optimization-based interaction synthesis relies on manually designing objective functions that may not generalize well. While crowd simulation involves more characters, their interactions are sparse and passive. We identify two challenges to multi-character interaction synthesis, including the lack of data and the planning of transitions among close and dense interactions. Existing datasets either do not have multiple characters or do not have close and dense interactions. The planning of transitions for multi-character close and dense interactions needs both spatial and temporal considerations. We propose a conditional generative pipeline comprising a coordinatable multi-character interaction space for interaction synthesis and a transition planning network for coordinations. Our experiments demonstrate the effectiveness of our proposed pipeline for multi-character interaction synthesis and the applications facilitated by our method show the scalability and transferability.	https://dl.acm.org/doi/abs/10.1145/3721238.3730750	Ziyi Chang, He Wang, George Koulieris, Hubert P. H. Shum
Launcher: balancing stability and flexibility in CG artist software	We present the Launcher, a software environment configuration tool that has contributed to the success of numerous productions over the course of two decades at Animal Logic, now Netflix Animation Studios. We explore the core features that enable us to manage a large number of configurations across numerous departments and projects while balancing stability and flexibility. We touch on the ability to roll back configurations to any moment in time and how the Launcher helps us with the propagation of VFX platform updates and other new workflows.	https://dl.acm.org/doi/abs/10.1145/3721239.3734114	Ghislain Roy-Veilleux, Steve Agland, Federico Naum
LayerFlow: A Unified Model for Layer-aware Video Generation	We present LayerFlow, a unified solution for layer-aware video generation. Given per-layer prompts, LayerFlow generates videos for the transparent foreground, clean background, and blended scene. It also supports versatile variants like decomposing a blended video or generating the background for the given foreground and vice versa. Starting from a text-to-video diffusion transformer, we organize the videos of different layers as sub-clips, and leverage layer embeddings to distinguish each clip and the corresponding layer-wise prompts. In this way, we seamlessly support the aforementioned variants in one unified framework. For the lack of high-quality layer-wise training videos, we design a multi-stage training strategy to accommodate static images with high-quality layer annotations. Specifically, we first train the model with low-quality video data. Then, we tune a motion LoRA to make the model compatible with static frames. Afterward, we train the content LoRA on the mixture of image data with high-quality layered images along with copy-pasted video data. During inference, we remove the motion LoRA thus generating smooth videos with desired layers.	https://dl.acm.org/doi/abs/10.1145/3721238.3730662	Sihui Ji, Hao Luo, Xi Chen, Yuanpeng Tu, Yiyang Wang, Hengshuang Zhao
LayerPano3D: Layered 3D Panorama for Hyper-Immersive Scene Generation	3D immersive scene generation is a challenging yet critical task in computer vision and graphics. A desired virtual 3D scene should 1) exhibit omnidirectional view consistency, and 2) allow for large-range exploration in complex scene hierarchies. Existing methods either rely on successive scene expansion via inpainting or employ panorama representation to represent large FOV scene environments. However, the generated scene suffers from semantic drift during expansion and is unable to handle occlusion among scene hierarchies. To tackle these challenges, we introduce LayerPano3D, a novel framework for full-view, explorable panoramic 3D scene generation from a single text prompt. Our key insight is to decompose a reference 2D panorama into multiple layers at different depth levels, where each layer reveals the unseen space from the reference views via diffusion prior. LayerPano3D comprises multiple dedicated designs: 1) We introduce a new panorama dataset Upright360 , comprising 9k high-quality and upright panorama images, and finetune the advanced Flux model on Upright360 for high-quality, upright and consistent panorama generation related tasks. 2) We pioneer the Layered 3D Panorama as underlying representation to manage complex scene hierarchies and lift it into 3D Gaussians to splat detailed 360-degree omnidirectional scenes with unconstrained viewing paths. Extensive experiments demonstrate that our framework generates state-of-the-art 3D panoramic scene in both full view consistency and immersive exploratory experience. We believe that LayerPano3D holds promise for advancing 3D panoramic scene creation with numerous applications. More examples please visit our webpage:	https://dl.acm.org/doi/abs/10.1145/3721238.3730643	Shuai Yang, Jing Tan, Mengchen Zhang, Tong Wu, Gordon Wetzstein, Ziwei Liu, Dahua Lin
Learn OpenUSD: Robotics Best Practices	This course explores OpenUSD's transformative role in robotics simulation, providing a comprehensive framework for converting Universal Robot Description Format (URDF) assets into modular Universal Scene Description (USD) workflows. Participants learn to bridge industry-standard robotics specifications with OpenUSD's interoperability features, enabling seamless integration of robotic components like UR10e arms and 2F-140 grippers into physics-accurate training environments. Techniques include joint...	https://dl.acm.org/doi/abs/10.1145/3721251.3736528	Ji Yuan Feng, Andrew Kaufman
Learning to Draw Is Learning to See: Analyzing Eye Tracking Patterns for Assisted Observational Drawing	Drawing is an artistic process involving extensive observation. Understanding how professional artists observe as they draw has significant value because it offers insight into their perception patterns and acquired skills. While previous studies used eye tracking to analyze the drawing process, they fell short in aligning gaze data with drawing actions due to the spatial and temporal gaps between observation and drawing in a model-to-paper setup. This paper presents a study in an image-to-image setup, in which artists observe a reference image and draw on a blank canvas on a tablet, capturing a clearer mapping between eye movements and drawn strokes. Our analysis demonstrates a strong spatial correlation between observed regions and corresponding strokes. We further find that artists initially follow a more structured region-by-region approach and then switch to a less constrained sequence for details. Based on these findings, we develop an assistive interface that integrates real-time visual guidance from professional artists' eye tracking data, enabling novices to emulate their observation and drawing strategies. A user study shows that novices can draw significantly more accurate shapes using our assistive interface, highlighting the importance of modeling observation and the potential of leveraging eye tracking data in future educational and creativity support tools. Our datasets, analysis code, and assistive interface are available at .	https://dl.acm.org/doi/abs/10.1145/3721238.3730734	Fengqi Liu, Longji Huang, Zhengyu Huang, Zeyu Wang
Level-of-Detail for Geometry Processing and Simulation	Level-of-detail (LOD) is a concept we intuitively experience in everyday life—whether it is how our brains filter visual information or how digital maps adjust as we zoom. At its core, LOD is about allocating detail where it matters most, striking a balance between efficiency and precision. While originally developed to accelerate rendering in computer graphics, modern LOD techniques have evolved into a powerful framework for constructing hierarchical shape representations and designing multilevel solvers in geometry processing and simulation. This course begins by highlighting the role of LOD not just in visualization, but also in numerical computation. We introduce key methods for constructing hierarchical structures, then dive into the design of multilevel solvers—focusing on how to transfer quantities and signals across levels, with emphasis on and . We conclude with applications that showcase how these hierarchical frameworks enable efficient, accurate and scalable solutions to problems in geometry processing and physical simulation.	https://dl.acm.org/doi/abs/10.1145/3721241.3733988	Jiayi Eris Zhang, Hsueh-Ti Derek Liu
Lifting the Winding Number: Precise Discontinuities in Neural Fields for Physics Simulation	"Cutting thin-walled deformable structures is common in daily life, but poses significant challenges for simulation due to the introduced spatial discontinuities. Traditional methods rely on mesh-based domain representations, which require frequent remeshing and refinement to accurately capture evolving discontinuities. These challenges are further compounded in reduced-space simulations, where the basis functions are inherently geometry- and mesh-dependent, making it difficult or even impossible for the basis to represent the diverse family of discontinuities introduced by cuts. Recent advances in representing basis functions with neural fields offer a promising alternative, leveraging their discretization-agnostic nature to represent deformations across varying geometries. However, the inherent continuity of neural fields is an obstruction to generalization, particularly if discontinuities are encoded in neural network weights. We present , a novel neural representation designed to accurately model complex cuts in thin-walled deformable structures. Our approach constructs neural fields that reproduce discontinuities precisely at specified locations, without ""baking in"" the position of the cut line. To achieve this, we augment the input coordinates of the neural field with the generalized winding number of any given cut line, effectively lifting the input from two to three dimensions. Lifting allows the network to focus on the easier problem of learning a 3D everywhere- volumetric field, while a corresponding restriction operator enables the final output field to precisely resolve discontinuities. Crucially, our approach does not embed the discontinuity in the neural network's weights, opening avenues to generalization of cut placement. Our method achieves real-time simulation speeds and supports dynamic updates to cut line geometry during the simulation. Moreover, the explicit representation of discontinuities makes our neural field intuitive to control and edit, offering a significant advantage over traditional neural fields, where discontinuities are embedded within the network's weights, and enabling new applications that rely on general cut placement."	https://dl.acm.org/doi/abs/10.1145/3721238.3730597	Yue Chang, Mengfei Liu, Zhecheng Wang, Peter Yichen Chen, Eitan Grinspun
LightLab: Controlling Light Sources in Images with Diffusion Models	We present a simple, yet effective diffusion-based method for fine-grained, parametric control over light sources in an image. Existing relighting methods either rely on multiple input views to perform inverse rendering at inference time, or fail to provide explicit control over light changes. Our method a small set of real raw photograph pairs, supplemented by synthetically rendered images at scale, to elicit its photorealistic prior for the relighting task. We leverage the to synthesize image pairs depicting controlled light changes of either a target light source or ambient illumination. Using this data and an appropriate fine-tuning scheme, precise illumination changes with explicit control over light intensity and color. Lastly, we show how our method can achieve compelling light editing results,	https://dl.acm.org/doi/abs/10.1145/3721238.3730696	Nadav Magar, Amir Hertz, Eric Tabellion, Yael Pritch, Alex Rav-Acha, Ariel Shamir, Yedid Hoshen
Like Friend, Like Deer	This animation is about some people from the Middle East. It is about the connection and similarity of the people with their living environment, animals, and generally with Nature... all of which are almost in a critical condition.	https://dl.acm.org/doi/abs/10.1145/3698896.3725447	Malek Eghbali
MAGNET: Muscle Activation Generation Networks for Diverse Human Movement	We introduce MAGNET (Muscle Activation Generation Networks), a scalable framework for reconstructing full-body muscle activations across diverse human movements. Our approach employs musculoskeletal simulation with a novel two-level controller architecture trained using three-stage learning methods. Additionally, we develop distilled models tailored for solving downstream tasks or generating real-time muscle activations, even on edge devices. The efficacy of our framework is demonstrated through examples of daily life and challenging behaviors, as well as comprehensive evaluations.	https://dl.acm.org/doi/abs/10.1145/3721238.3730617	Jungnam Park, Euikyun Jung, Jehee Lee, Jungdam Won
MASH: Masked Anchored SpHerical Distances for 3D Shape Representation and Generation	We introduce ( ), a novel and representation of 3D shapes. Inspired by multi-view geometry and motivated by the importance of perceptual shape understanding for learning 3D shapes, MASH represents a 3D shape as a collection of , each defined by a spherical distance function emanating from an anchor point. We further leverage the compactness of spherical harmonics to encode the MASH functions, combined with a with a parameterized base that the spatial extent of the spherical function to attain locality. We develop a differentiable optimization algorithm capable of converting any point cloud into a MASH representation accurately approximating ground-truth surfaces with arbitrary geometry and topology. Extensive experiments demonstrate that MASH is versatile for multiple applications including surface reconstruction, shape generation, completion, and blending, achieving superior performance thanks to its unique representation encompassing both implicit and explicit features. More information and resources can be found at: .	https://dl.acm.org/doi/abs/10.1145/3721238.3730610	Changhao Li, Yu Xin, Xiaowei Zhou, Ariel Shamir, Hao Zhang, Ligang Liu, Ruizhen Hu
MGPBD: A Multigrid Accelerated Global XPBD Solver	We introduce a novel Unsmoothed Aggregation (UA) Algebraic Multigrid (AMG) method combined with Preconditioned Conjugate Gradient (PCG) to overcome the limitations of Extended Position-Based Dynamics (XPBD) in high-resolution and high-stiffness simulations. While XPBD excels in simulating deformable objects due to its speed and simplicity, its nonlinear Gauss-Seidel (GS) solver often struggles with low-frequency errors, leading to instability and stalling issues, especially in high-resolution, high-stiffness simulations. Our multigrid approach addresses these issues efficiently by leveraging AMG. To reduce the computational overhead of traditional AMG, where prolongator construction can consume up to two-thirds of the runtime, we propose a lazy setup strategy that reuses prolongators across iterations based on matrix structure and physical significance. Furthermore, we introduce a simplified method for constructing near-kernel components by applying a few sweeps of iterative methods to the homogeneous equation, achieving convergence rates comparable to adaptive smoothed aggregation (adaptive-SA) at a lower computational cost. Experimental results demonstrate that our method significantly improves convergence rates and numerical stability, enabling efficient and stable high-resolution simulations of deformable objects.	https://dl.acm.org/doi/abs/10.1145/3721238.3730720	Chunlei Li, Peng Yu, Tiantian Liu, Siyuan Yu, Yuting Xiao, Shuai Li, Aimin Hao, Yang Gao, Qinping Zhao
MIND: Microstructure INverse Design with Generative Hybrid Neural Representation	The inverse design of microstructures plays a pivotal role in optimizing metamaterials with specific, targeted physical properties. While traditional forward design methods are constrained by their inability to explore the vast combinatorial design space, inverse design offers a compelling alternative by directly generating structures that fulfill predefined performance criteria. However, achieving precise control over both geometry and material properties remains a significant challenge due to their intricate interdependence. Existing approaches, which typically rely on voxel or parametric representations, often limit design flexibility and structural diversity. In this work, we present a novel generative model that integrates latent diffusion with Holoplane, an advanced hybrid neural representation that simultaneously encodes both geometric and physical properties. This combination ensures superior alignment between geometry and properties. Our approach generalizes across multiple microstructure classes, enabling the generation of diverse, tileable microstructures with significantly improved property accuracy and enhanced control over geometric validity, surpassing the performance of existing methods. We introduce a multi-class dataset encompassing a variety of geometric morphologies, including truss, shell, tube, and plate structures, to train and validate our model. Experimental results demonstrate the model's ability to generate microstructures that meet target properties, maintain geometric validity, and integrate seamlessly into complex assemblies. Additionally, we explore the potential of our framework through the generation of new microstructures, cross-class interpolation, and the infilling of heterogeneous microstructures. Code and data for this paper are at .	https://dl.acm.org/doi/abs/10.1145/3721238.3730682	Tianyang Xue, Longdu Liu, Lin Lu, Paul Henderson, Pengbin Tang, Haochen Li, Jikai Liu, Haisen Zhao, Hao Peng, Bernd Bickel
Machine Learning Meets Lighting: Using Depth Estimation To Build The Light Rigs	This paper describes the techniques we use to build the complex light rigs in the Sony Pictures Imageworks lighting pipeline. Typically we receive the panoramic HDRI from the set and need to make a light rig from it. Building a light rig has several steps: extracting area lights from HDRI, placing them in a 3D scene, aligning lights with Lidar from set. We describe how this process can be sped up. For example, the positioning of extracted lights is automated using PatchFusion [Li et al. ], an off-the-shelf machine learning model for high resolution monocular depth estimation. PatchFusion computes accurate metric depth directly from the HDRI. The depth map is used as a distance from light to camera to place the area lights in 3D scene. This removes the need for manual distance measurements or guesswork. Our approach significantly reduces manual labor. The time required to build the light rig goes from hours to about a minute.	https://dl.acm.org/doi/abs/10.1145/3721239.3734127	Sergey Shlyaev
Making Worlds Feel Alive with Procedural Systems in Blender	This hands-on class focuses on progressively building a simple space traffic system, using proceduralism. The two main building blocks of this system are the spaceship generator and a guided entity simulation. The goal of the system is to achieve believable behavior, making the background of a scene feel alive. The implementation of the setup makes use of the procedural generation framework Geometry Nodes built into Blender. While the spaceship system will be used as a practical example, the concepts are more generally applicable to similar scenarios. There is no requirement of previous experience with the Geometry Nodes system, while a base level familiarity with Blender is encouraged to follow along.	https://dl.acm.org/doi/abs/10.1145/3721251.3734067	Simon Thommes
Making the Stream of Consciousness in Pixar's Inside Out 2	In Pixar's feature animation (2024), the core Emotions led by Joy find themselves navigating through the Stream of Consciousness in an attempt to reach Riley's Back of the Mind and then retrieve her Sense of Self. Our team was cast to develop the look for the Stream of Consciousness and support its deployment across nearly twenty shots. In particular, it was clear during production that we needed ways to work concurrently with the Animation team, at times even independently, while still able to address notes and changes rapidly. This work discusses our technical solutions for the implementation of the Stream of Consciousness, including in-house procedural tools that facilitated the authoring and stylization of velocity fields interacting with 3D obstacles.	https://dl.acm.org/doi/abs/10.1145/3721239.3734078	Tolga Goktekin, Krzysztof Rost, Ravindra Dwivedi, Fernando de Goes
Manu-Grid: UI for parameter estimation of tilt angle extended generalized projection function in illustrations	Compositing a background image and a foreground image produced from a 3D object requires a projection function that ensures consistency in the scene. We modified the generalized projection of [Yoshimura and Saito ] to allow tilted-angle images and introduced a user interface, Manu-Grid, to estimate the parameters of the projection function corresponding to the drawing method used in a background image. The interface has a useful characteristic that when a user manipulates a vanishing direction, a vanishing line, and a reference point on the ground, the others are pinned.	https://dl.acm.org/doi/abs/10.1145/3721250.3743003	Mamoru Akiyoshi, Ayumu Sato, Suguru Saito
MatCLIP: Light- and Shape-Insensitive Assignment of PBR Material Models	Assigning realistic materials to 3D models remains a significant challenge in computer graphics. We propose MatCLIP, a novel method that extracts shape- and lighting-insensitive descriptors of Physically Based Rendering (PBR) materials to assign plausible textures to 3D objects based on images, such as the output of Latent Diffusion Models (LDMs) or photographs. Matching PBR materials to static images is challenging because the PBR representation captures the dynamic appearance of materials under varying viewing angles, shapes, and lighting conditions. By extending an Alpha-CLIP-based model on material renderings across diverse shapes and lighting, and encoding multiple viewing conditions for PBR materials, our approach generates descriptors that bridge the domains of PBR representations with photographs or renderings, including LDM outputs. This enables consistent material assignments without requiring explicit knowledge of material relationships between different parts of an object. MatCLIP achieves a top-1 classification accuracy of 76.6%, outperforming state-of-the-art methods such as PhotoShape and MatAtlas by over 15 percentage points on publicly available datasets. Our method can be used to construct material assignments for 3D shape datasets such as ShapeNet, 3DCoMPaT++, and Objaverse. All code and data will be released at .	https://dl.acm.org/doi/abs/10.1145/3721238.3730740	Michael Birsak, John Femiani, Biao Zhang, Peter Wonka
MeshTorrent: A Community-Driven P2P System for AI-Generated 3D Model Creation and Distribution	MeshTorrent is a peer-to-peer platform for automated 3D content creation and exchange, inspired by BitTorrent-style file sharing. By merging AI-based text-to-3D generation with swarm-based distribution, MeshTorrent harnesses the combined bandwidth and storage resources of its users, enabling scalable and decentralized sharing of 3D assets. This paper describes the core design of MeshTorrent, including an AI workflow for generating fresh .glb files, metadata management via a distributed hash table, partial previews for quick inspection, and specialized extensions for 2D sprites ( ) and rigged character models ( ). Preliminary tests show faster content download times than single-host alternatives, reduced server costs, and robust resilience to network churn, advancing an open ecosystem for collaborative 3D model exchange.	https://dl.acm.org/doi/abs/10.1145/3721251.3736272	Ryan Hardesty Lewis
Metaball Madness - The Rigging Of An Implicit Surface Character	We present a novel character rigging solution developed for OOOOO, a liquid supercomputer in Pixar's Elio. OOOOO's design and desired movement necessitated reimagining our conventional way of articulating characters and she became Pixar's first mesh-free character rig. We developed a system that allowed our animators full fidelity control over what is essentially a rigged shader while ensuring downstream renderability. [Luo et al. ] The system's architecture supports a hierarchical arrangement of implicit surface primitives and operators, allowing for complex transformations while preserving normal animation paradigms and offers unprecedented flexibility in character animation.	https://dl.acm.org/doi/abs/10.1145/3721239.3734079	Anna-Christine Lykkegaard, Andrew Butts, Julian Teo
