title	abstract	url	authors
Drag Your Gaussian: Effective Drag-Based Editing with Score Distillation for 3D Gaussian Splatting	Recent advancements in generative models have significantly propelled 3D scene editing. While existing methods excel at text-guided texture modifications for 3D representations like 3D Gaussian Splatting (3DGS), they struggle with geometric transformations (e.g., rotating a character's head) and lack precise spatial control over edits due to the inherent ambiguity of language-driven guidance. To address these limitations, we introduce DYG, a 3D drag-based editing framework for 3DGS. Users intuitively define editing regions using 3D masks and specify desired transformations through pairs of control points. DYG integrates the implicit triplane representation to establish the geometric scaffold of editing results, effectively overcoming suboptimal editing outcomes caused by the sparsity of 3DGS in the desired editing regions. Additionally, we incorporate a drag-based Latent Diffusion Model through the proposed Drag-SDS loss, enabling flexible, multi-view consistent, and fine-grained editing. Extensive experiments demonstrate that DYG enables effective drag-based editing, outperforming other baselines in terms of editing effect and quality. Additional results are available on our project page: .	https://dl.acm.org/doi/abs/10.1145/3721238.3730600	Yansong Qu, Dian Chen, Xinyang Li, Xiaofan Li, Shengchuan Zhang, Liujuan Cao, Rongrong Ji
Drawing with Light: AI-Driven Visual Synthesis for Real-Time Laser Installations	This paper presents a real-time system combining AI image generation with laser installations for live audiovisual performance. Using StreamDiffusion integrated with TouchDesigner, we generate imagery and convert it to laser-traceable paths while working within graphics hardware and laser display constraints. The system includes feedback loops between AI generation, performer control, and physical laser output, creating an interactive visual instrument for live musical performance.	https://dl.acm.org/doi/abs/10.1145/3721243.3735988	Spencer Sterling
DreamCraft: Interactive 3D Scene Creation from Editable Panorama in Virtual Reality	Creating interactive 3D scenes often requires technical expertise and significant time, limiting accessibility for non-experts. To address this, we present DreamCraft, a VR system enabling users to intuitively generate and edit interactive 3D environments from panoramas without professional skills. DreamCraft supports panorama generation, interactive object selection, panorama editing, and 3D reconstruction. By combining techniques like 3D Gaussian Splatting (3DGS), object segmentation, and 2D-to-3D conversion, it streamlines immersive scene creation. A user study confirmed its usability, ease of learning, and creative potential, positioning DreamCraft as a step toward accessible 3D content creation.	https://dl.acm.org/doi/abs/10.1145/3721250.3743026	Cheng-Chih Tsai, Tse-Yu Pan
DreamMask: Boosting Open-vocabulary Panoptic Segmentation with Synthetic Data	Open-vocabulary panoptic segmentation has received significant attention due to its applicability in the real world. Despite claims of robust generalization, we find that the advancements of previous works are attributed mainly to trained categories, exposing a lack of generalization to novel classes. In this paper, we explore boosting existing models from a data-centric perspective. We propose DreamMask, which systematically explores how to generate training data in the open-vocabulary setting, and how to train the model with both real and synthetic data. For the first part, we propose an automatic data generation pipeline with off-the-shelf models. We propose crucial designs for vocabulary expansion, layout arrangement, data filtering, etc. Equipped with these techniques, our generated data could significantly outperform the manually collected web data. To train the model with generated data, a synthetic-real alignment loss is designed to bridge the representation gap, bringing noticeable improvements across multiple benchmarks. In general, DreamMask significantly simplifies the collection of large-scale training data, serving as a plug-and-play enhancement for existing methods. For instance, when trained on COCO and tested on ADE20K, the model equipped with DreamMask outperforms the previous state-of-the-art by a substantial margin of 2.1% mIoU.	https://dl.acm.org/doi/abs/10.1145/3721238.3730684	Yuanpeng Tu, Xi Chen, Ser-Nam Lim, Hengshuang Zhao
Dual-Band Feature Fusion for Neural Global Illumination with Multi-Frequency Reflections	In this paper, we present a novel neural global illumination approach that enables multi-frequency reflections in dynamic scenes. Our method utilizes object-centric, spatial feature grids as the core framework to model rendering effects implicitly. A lightweight scene query, based on single-bounce ray tracing, is then performed on these feature grids to extract principal and secondary features separately. The principal features can capture a wide range of relatively low-frequency global illumination effects, such as diffuse indirect lighting and reflections on rough surfaces. In contrast, the secondary features can provide sparse scene-specific reflection details, typically with much higher frequencies than the final observed radiance. Inspired by the physical processes of light propagation, we introduce a novel dual-band feature fusion module that seamlessly blends these two types of features, generating fused features capable of modeling multi-frequency rendering effects. Additionally, we propose a two-stage training strategy tailored to accommodate the distinct characteristics of each feature type, significantly enhancing the overall quality and reducing artifacts in the rendered results. Experimental results demonstrate that our method delivers high-quality, multi-frequency dynamic reflections, outperforming state-of-the-art baselines, including path tracing with screen-space neural denoising and other neural global illumination methods.	https://dl.acm.org/doi/abs/10.1145/3721238.3730733	Shaohua Mo, Chuankun Zheng, Zihao Lin, Dianbing Xi, Qi Ye, Rui Wang, Hujun Bao, Yuchi Huo
DualMS: Implicit Dual-Channel Minimal Surface Optimization for Heat Exchanger Design	Heat exchangers are critical components in a wide range of engineering applications, from energy systems to chemical processing, where efficient thermal management is essential. The design objectives for heat exchangers include maximizing the heat exchange rate while minimizing the pressure drop, requiring both a large interface area and a smooth internal structure. State-of-the-art designs, such as triply periodic minimal surfaces (TPMS), have proven effective in optimizing heat exchange efficiency. However, TPMS designs are constrained by predefined mathematical equations, limiting their adaptability to freeform boundary shapes. Additionally, TPMS structures do not inherently control flow directions, which can lead to flow stagnation and undesirable pressure drops. This paper presents , a novel computational framework for optimizing dual-channel minimal surfaces specifically for heat exchanger designs in freeform shapes. To the best of our knowledge, this is the first attempt to directly optimize minimal surfaces for two-fluid heat exchangers, rather than relying on TPMS. Our approach formulates the heat exchange maximization problem as a constrained connected maximum cut problem on a graph, with flow constraints guiding the optimization process. To address undesirable pressure drops, we model the minimal surface as a classification boundary separating the two fluids, incorporating an additional regularization term for area minimization. We employ a neural network that maps spatial points to binary flow types, enabling it to classify flow skeletons and automatically determine the surface boundary. DualMS demonstrates greater flexibility in surface topology compared to TPMS and achieves superior thermal performance, with lower pressure drops while maintaining a similar heat exchange rate under the same material cost. The project is open-sourced at .	https://dl.acm.org/doi/abs/10.1145/3721238.3730700	Weizheng Zhang, Hao Pan, Lin Lu, Xiaowei Duan, Xin Yan, Ruonan Wang, Qiang Du
DuetGen: Music Driven Two-Person Dance Generation via Hierarchical Masked Modeling	We present DuetGen, a novel framework for generating interactive two-person dances from music. The key challenge of this task lies in the inherent complexities of two-person dance interactions, where the partners need to synchronize both with each other and with the music. Inspired by the recent advances in motion synthesis, we propose a two-stage solution: encoding two-person motions into discrete tokens and then generating these tokens from music. To effectively capture intricate interactions, we represent both dancers' motions as a unified whole to learn the necessary motion tokens, and adopt a learning strategy in both the stages. Our first stage utilizes a VQ-VAE that hierarchically separates high-level semantic features at a coarse temporal resolution from low-level details at a finer resolution, producing two discrete token sequences at different abstraction levels. Subsequently, in the second stage, two generative masked transformers learn to map music signals to these dance tokens: the first producing high-level semantic tokens, and the second, conditioned on music and these semantic tokens, producing the low-level tokens. We train both transformers to learn to predict randomly masked tokens within the sequence, enabling them to iteratively generate motion tokens by filling an empty token sequence during inference. Through the hierarchical masked modeling and dedicated interaction representation, DuetGen achieves the generation of synchronized and interactive two-person dances across various genres. Extensive experiments and user studies on a benchmark duet dance dataset demonstrate state-of-the-art performance of DuetGen in motion realism, music-dance alignment, and partner coordination. Code and model weights are available at .	https://dl.acm.org/doi/abs/10.1145/3721238.3730741	Anindita Ghosh, Bing Zhou, Rishabh Dabral, Jian Wang, Vladislav Golyanik, Christian Theobalt, Philipp Slusallek, Chuan Guo
Dust in Time: Exploring Embodied Experience of Time via an Interactive Installation	This paper introduces , a tangible and embodied art installation that allows the audience to interact with physical hourglasses and virtual particles through embodied gestures and motions. We describe the design concept and technical details of this installation. Through this conceptual tangible interactive installation, we aim to explore how tangible and embodied interaction can be used to represent the concepts of time and its relationship with human beings and promote both explicit and implicit interaction.	https://dl.acm.org/doi/abs/10.1145/3721250.3743021	Zhonghe Ruan, Junwei Liu, Min Fan, Haiyan Li
Dynamic Concepts Personalization from Single Videos	Personalizing generative text-to-image models has seen remarkable progress, but extending this personalization to text-to-video models presents unique challenges. Unlike static concepts, personalizing text-to-video models has the potential to capture dynamic concepts – entities defined not only by their appearance but also by their motion.In this paper, we introduce Set-and-Sequence, a novel framework for personalizing Diffusion Transformers (DiTs)–based generative video models with dynamic concepts. Our approach imposes a spatio-temporal weight space within an architecture that does not explicitly separate spatial and temporal features. This is achieved in two key stages. First, we fine-tune Low-Rank Adaptation (LoRA) layers using an unordered set of frames from the video to learn an appearance LoRA basis that represents the appearance, free from temporal interference. In the second stage, with the appearance LoRAs frozen, we augment their coefficients with Motion Residuals and fine-tune them on the full video sequence, capturing motion dynamics. Our Set-and-Sequence framework resulting in a spatio-temporal weight space effectively embeds dynamic concepts into the video model's output domain, enabling unprecedented editability and compositionality, and setting a new benchmark for personalizing dynamic concepts.	https://dl.acm.org/doi/abs/10.1145/3721238.3730644	Rameen Abdal, Or Patashnik, Ivan Skorokhodov, Willi Menapace, Aliaksandr Siarohin, Sergey Tulyakov, Daniel Cohen-Or, Kfir Aberman
Dynamic Skinning: Kinematics-Driven Cartoon Effects for Articulated Characters	We propose Dynamic Skinning (DS), an extension of rig skinning which exhibits the appearance of a physical phenomena without the need for simulation. Our approach applies offsets from traditional skinning to produce these effects based on time-delayed, filtered joint motion. We showcase a number of effects including 1) time-varying oscillation and 2) time delay across skeletal bones to produce what we call delayed linear blend skinning (dLBS) directly on skinning computation. Our approach is easy to control by artists with simple input parameters and the method is compatible with standard rigged characters.	https://dl.acm.org/doi/abs/10.1145/3721250.3743004	Karim Salem, Damien Rohmer, Niranjan Kalyanasundaram, Victor Zordan
ELGAR: Expressive Cello Performance Motion Generation for Audio Rendition	The art of instrument performance stands as a vivid manifestation of human creativity and emotion. Nonetheless, generating instrument performance motions is a highly challenging task, as it requires not only capturing intricate movements but also reconstructing the complex dynamics of the performer-instrument interaction. While existing works primarily focus on modeling partial body motions, we propose Expressive ceLlo performance motion Generation for Audio Rendition (ELGAR), a state-of-the-art diffusion-based framework for whole-body fine-grained instrument performance motion generation solely from audio. To emphasize the interactive nature of the instrument performance, we introduce Hand Interactive Contact Loss (HICL) and Bow Interactive Contact Loss (BICL), which effectively guarantee the authenticity of the interplay. Moreover, to better evaluate whether the generated motions align with the semantic context of the music audio, we design novel metrics specifically for string instrument performance motion generation, including finger-contact distance, bow-string distance, and bowing score. Extensive evaluations and ablation studies are conducted to validate the efficacy of the proposed methods. In addition, we put forward a motion generation dataset SPD-GEN, collated and normalized from the MoCap dataset SPD. As demonstrated, ELGAR has shown great potential in generating instrument performance motions with complicated and fast interactions, which will promote further development in areas such as animation, music education, interactive art creation, etc. Our code and SPD-GEN dataset are available at .	https://dl.acm.org/doi/abs/10.1145/3721238.3730756	Zhiping Qiu, Yitong Jin, Yuan Wang, Yi Shi, Chao Tan, Chongwu Wang, Xiaobing Li, Feng Yu, Tao Yu, Qionghai Dai
ESCT3D: Efficient and Selectively Controllable Text-Driven 3D Content Generation with Gaussian Splatting	In recent years, significant advancements have been made in text-driven 3D content generation. However, several challenges remain. In practical applications, users often provide extremely simple text inputs while expecting high-quality 3D content. Generating optimal results from such minimal text is a difficult task due to the strong dependency of text-to-3D models on the quality of input prompts. Moreover, the generation process exhibits high variability, making it difficult to control. Consequently, multiple iterations are typically required to produce content that meets user expectations, reducing generation efficiency. To address this issue, we propose GPT-4V for self-optimization, which significantly enhances the efficiency of generating satisfactory content in a single attempt. Furthermore, the controllability of text-to-3D generation methods has not been fully explored. Our approach enables users to not only provide textual descriptions but also specify additional conditions, such as style, edges, scribbles, poses, or combinations of multiple conditions, allowing for more precise control over the generated 3D content. Additionally, during training, we effectively integrate multi-view information, including multi-view depth, masks, features, and images, to address the common Janus problem in 3D content generation. Extensive experiments demonstrate that our method achieves robust generalization, facilitating the efficient and controllable generation of high-quality 3D content.	https://dl.acm.org/doi/abs/10.1145/3728305	Huiqi Wu, Li Yao, Jianbo Mei, Yingjie Huang, Yining Xu, Jingjiao You, Yilong Liu
EVA: Expressive Virtual Avatars from Multi-view Videos	With recent advancements in neural rendering and motion capture algorithms, remarkable progress has been made in photorealistic human avatar modeling, unlocking immense potential for applications in virtual reality, augmented reality, remote communication, and industries such as gaming, film, and medicine. However, existing methods fail to provide complete, faithful, and expressive control over human avatars due to their entangled representation of facial expressions and body movements. In this work, we introduce Expressive Virtual Avatars (EVA), an actor-specific, fully controllable, and expressive human avatar framework that achieves high-fidelity, lifelike renderings in real time while enabling independent control of facial expressions, body movements, and hand gestures. Specifically, our approach designs the human avatar as a two-layer model: an and a . First, we present an expressive template tracking algorithm that leverages coarse-to-fine optimization to accurately recover body motions, facial expressions, and non-rigid deformation parameters from multi-view videos. Next, we propose a novel decoupled 3D Gaussian appearance model designed to effectively disentangle body and facial appearance. Unlike unified Gaussian estimation approaches, our method employs two specialized and independent modules to model the body and face separately. Experimental results demonstrate that EVA surpasses state-of-the-art methods in terms of rendering quality and expressiveness, validating its effectiveness in creating full-body avatars. This work represents a significant advancement towards fully drivable digital human models, enabling the creation of lifelike digital avatars that faithfully replicate human geometry and appearance.	https://dl.acm.org/doi/abs/10.1145/3721238.3730677	Hendrik Junkawitsch, Guoxing Sun, Heming Zhu, Christian Theobalt, Marc Habermann
EditDuet: A Multi-Agent System for Video Non-Linear Editing	Automated tools for video editing and assembly have applications ranging from filmmaking and advertisement to content creation for social media. Previous video editing work has mainly focused on either retrieval or user interfaces, leaving actual editing to the user. In contrast, we propose to automate the core task of video editing, formulating it as sequential decision making process. Ours is a multi-agent approach. We design an Editor agent and a Critic agent. The Editor takes as input a collection of video clips together with natural language instructions and uses tools commonly found in video editing software to produce an edited sequence. On the other hand, the Critic gives natural language feedback to the editor based on the produced sequence or renders it if it is satisfactory. We introduce a learning-based approach for enabling effective communication across specialized agents to address the language-driven video editing task. Finally, we explore an LLM-as-a-judge metric for evaluating the quality of video editing system and compare it with general human preference. We evaluate our system's output video sequences qualitatively and quantitatively through a user study and find that our system vastly outperforms existing approaches in terms of coverage, time constraint satisfaction, and human preference. Please see our companion supplemental video for qualitative results.	https://dl.acm.org/doi/abs/10.1145/3721238.3730761	Marcelo Sandoval-Castañeda, Bryan Russell, Josef Sivic, Gregory Shakhnarovich, Fabian Caba Heilbron
Efficient Proxy Raytracer for Optical Systems using Implicit Neural Representations	Ray tracing is a widely used technique for modeling optical systems, involving sequential surface-by-surface computations which can be computationally intensive. We propose , a novel method that leverages implicit neural representations to model optical systems with greater efficiency, eliminating the need for surface-by-surface computations in a single pass end-to-end model. learns the mapping between rays emitted from a given source and their corresponding rays after passing through a given optical system in a physically accurate manner. We train on nine off-the-shelf optical systems, acheiving positional errors on the order of 1 m and angular deviations on the order 0.01 degrees in the estimated output rays. Our work highlights the potentials of neural representations as a proxy optical raytracer.	https://dl.acm.org/doi/abs/10.1145/3721250.3742994	Shiva Sinaei, Chuanjun Zheng, Kaan Akşit, Daisuke Iwai
Eigenanalysis in Computer Graphics	Like a semester long graduate seminar on Eigenanalysis, Singular Value Decompositions, and Principal Component Analysis in Computer Graphics and Interactive Techniques, this course looks at matrix diagonalization and analysis through the lens of 13 technical papers selected by the lecturers. The lecturers will highlight trends, similarities, differences, and historical threads through the papers. Applications will range from image segmentation, to fast, robust phsyics simulation, to geometric modeling, to BRDF modeling. Note that we slightly abuse the term Eigenanalysis to include its generalizations, Singular Value Decomposition and Principal Component Analysis, as all three techniques rely on matrix diagonalization. The course will also serve as a retrospective on the selected papers, placing them in historical context and highlighting significant contributions, as well as forgotten gems. The lecturers have broad expertise across computer graphics and interactive techniques and have co-led the VANGOGH lab meeting at UMBC since 2015. They delivered a similarly structured course on at SIGGRAPH 2024.	https://dl.acm.org/doi/abs/10.1145/3721241.3733993	Adam Bargteil, Marc Olano
Elastic Locomotion with Mixed Second-order Differentiation	We present a framework of elastic locomotion, which allows users to enliven an elastic body to produce interesting locomotion by prescribing its high-level kinematics. We formulate this problem as an inverse simulation problem and seek the optimal muscle activations to drive the body to complete the desired actions. We employ the interior-point method to model wide-area contacts between the body and the environment with logarithmic barrier penalties. The core of our framework is a mixed second-order differentiation algorithm. By combining both analytic differentiation and numerical differentiation modalities, a general-purpose second-order differentiation scheme is made possible. Specifically, we augment complex-step finite difference (CSFD) with reverse automatic differentiation (AD). We treat AD as a generic function, mapping a computing procedure to its derivative w.r.t. output loss, and promote CSFD along the AD computation. To this end, we carefully implement all the arithmetics used in elastic locomotion, from elementary functions to linear algebra and matrix operation for CSFD promotion. With this novel differentiation tool, elastic locomotion can directly exploit Newton's method and use its strong second-order convergence to find the needed activations at muscle fibers. This is not possible with existing first-order inverse or differentiable simulation techniques. We showcase a wide range of interesting locomotions of soft bodies and creatures to validate our method.	https://dl.acm.org/doi/abs/10.1145/3721238.3730685	Siyuan Shen, Tianjia Shao, Kun Zhou, Chenfanfu Jiang, Sheldon Andrews, Victor Zordan, Yin Yang
Elevating 3D Models: High-Quality Texture and Geometry Refinement from a Low-Quality Model	High-quality 3D assets are essential for various applications in computer graphics and 3D vision but remain scarce due to significant acquisition costs. To address this shortage, we introduce Elevate3D, a novel framework that transforms readily accessible low-quality 3D assets into higher quality. At the core of Elevate3D is HFS-SDEdit, a specialized texture enhancement method that significantly improves texture quality while preserving the appearance and geometry while fixing its degradations. Furthermore, Elevate3D operates in a view-by-view manner, alternating between texture and geometry refinement. Unlike previous methods that have largely overlooked geometry refinement, our framework leverages geometric cues from images refined with HFS-SDEdit by employing state-of-the-art monocular geometry predictors. This approach ensures detailed and accurate geometry that aligns seamlessly with the enhanced texture. Elevate3D outperforms recent competitors by achieving state-of-the-art quality in 3D model refinement, effectively addressing the scarcity of high-quality open-source 3D assets.	https://dl.acm.org/doi/abs/10.1145/3721238.3730701	Nuri Ryu, Jiyun Won, Jooeun Son, Minsu Gong, Joo-Haeng Lee, Sunghyun Cho
