title	abstract	url	authors
Reverse Projection: Real-Time Local Space Texture Mapping	We present Reverse Projection, a novel projective texture mapping technique for painting a decal directly to the texture of a 3D object. Designed to be used in games, this technique works in real-time. By using projection techniques that are computed in local space textures and outward-looking, users using low-end android devices to high-end gaming desktops are able to enjoy the personalization of their assets. We believe our proposed pipeline is a step in improving the speed and versatility of model painting.	https://dl.acm.org/doi/abs/10.1145/3588028.3603653	Adrian Xuan Wei Lim, Lynnette Hui Xian Ng, Conor Griffin, Nicholas Kryer, Faraz Baghernezhad
Revisiting controlled mixture sampling for rendering applications	Monte Carlo rendering makes heavy use of mixture sampling and multiple importance sampling (MIS). Previous work has shown that control variates can be used to make such mixtures more efficient and more robust. However, the existing approaches failed to yield practical applications, chiefly because their underlying theory is based on the unrealistic assumption that a single mixture is optimized for a single integral. This is in stark contrast with rendering reality, where millions of integrals are computed---one per pixel---and each is infinitely recursive. We adapt and extend the theory introduced by previous work to tackle the challenges of real-world rendering applications. We achieve robust mixture sampling and (approximately) optimal MIS weighting for common applications such as light selection, BSDF sampling, and path guiding.	https://dl.acm.org/doi/abs/10.1145/3592435	Qingqin Hua, Pascal Grittmann, Philipp Slusallek
Rhizomorph: The Coordinated Function of Shoots and Roots	Computer graphics has dedicated a considerable amount of effort to generating realistic models of trees and plants. Many existing methods leverage procedural modeling algorithms - that often consider biological findings - to generate branching structures of individual trees. While the realism of tree models generated by these algorithms steadily increases, most approaches neglect to model the root system of trees. However, the root system not only adds to the visual realism of tree models but also plays an important role in the development of trees. In this paper, we advance tree modeling in the following ways: First, we define a physically-plausible soil model to simulate resource gradients, such as water and nutrients. Second, we propose a novel developmental procedural model for tree roots that enables us to emergently develop root systems that adapt to various soil types. Third, we define long-distance signaling to coordinate the development of shoots and roots. We show that our advanced procedural model of tree development enables - for the first time - the generation of trees with their root systems.	https://dl.acm.org/doi/abs/10.1145/3592145	Bosheng Li, Jonathan Klein, Dominik L. Michels, Bedrich Benes, Sören Pirk, Wojtek Pałubicki
Roald	A birthday party escalate when an toad who perceives life in a cute and colorful way meets a paranoiac fly.	https://dl.acm.org/doi/abs/10.1145/3577024.3587948	Julie Chêne
Roblox Generative AI in action	Roblox is investing in generative AI techniques to revolutionize the creation process on its platform. By leveraging natural language and other intuitive expressions of intent, creators can build interactive objects and scenes without complex modeling or coding. The use of AI image generation services and large language models aim to make creation faster and easier for every user on the platform.	https://dl.acm.org/doi/abs/10.1145/3588430.3597250	Brent Vincent, Kartik Ayyar
Robust Low-Poly Meshing for General 3D Models	We propose a robust re-meshing approach that can automatically generate visual-preserving low-poly meshes for any high-poly models found in the wild. Our method can be seamlessly integrated into current mesh-based 3D asset production pipelines. Given an input high-poly, our method proceeds in two stages: 1) Robustly extracting an offset surface mesh that is feature-preserving, and guaranteed to be watertight, manifold, and self-intersection free; 2) Progressively simplifying and flowing the offset mesh to bring it close to the input. The simplicity and the visual-preservation of the generated low-poly is controlled by a user-required target screen size of the input: decreasing the screen size reduces the element count of the low-poly but enlarges its visual difference from the input. We have evaluated our method on a subset of the Thingi10K dataset that contains models created by practitioners in different domains, with varying topological and geometric complexities. Compared to state-of-the-art approaches and widely used software, our method demonstrates its superiority in terms of the element count, visual preservation, geometry, and topology guarantees of the generated low-polys.	https://dl.acm.org/doi/abs/10.1145/3592396	Zhen Chen, Zherong Pan, Kui Wu, Etienne Vouga, Xifeng Gao
Rock, Paper, Scissors	Step into teenager Priya's world and influence her story by playing the game Rock Paper Scissors against single-mum Lina in this interactive virtual reality coming-of-age drama funded by the BFI Network.	https://dl.acm.org/doi/abs/10.1145/3577025.3584914	Juliette Chabrier
Rockets, Robots, and AI: Lessons Learned from Science-Fiction Movies and TV for HCI/UX	"This tutorial present examples from notable science-fiction films and videos that incorporate human-computer interaction (HCI) and user-experience (UX) design and shows what lessons can be learned. The course begins with the advent of movies in the early 1900s ( , Melies' ""A Trip to the Moon,"" which was later referenced in the movie ""Hugo"", 2011) and concludes with the latest sci-fi movies/videos. Originally, many science-fiction movies, taking their cue from pulp science-fiction, focused on rocket ships and interplanetary travel. Later the scope of the stories broadened and deepened to future consumer products, psychological/social issues, and new technologies such as exoskeletons, robots, and artificial intelligence. Once a rarified genre and primarily products of Hollywood (with notable films from Germany, the United Kingdom, and Japan), these films/videos now occupy a primary place in modern international popular media, and originate in China, India, or South Korea, and Japan, as well as North America and Europe."	https://dl.acm.org/doi/abs/10.1145/3587423.3595550	Aaron Marcus
SIGGRAPH 2023 - Course Notes What We Talk About, When We Talk About Story	"Today's digital media is defined by not only the latest, greatest technical innovations but also how original story solutions are adapting to these new technological changes. No longer are the story/narrative solutions the exclusive responsibility of directors and writers but increasingly fall on the shoulders of technical directors, software engineers, animators, VFX creators, and game/XR designers whose work is essential in making ""the content"" come to life. Understanding story is particularly useful when communicating with screenwriters, directors, and producers. This course answers the question, ""What is Story?"" (and you don't even have to take a course in screenwriting). Knowing the basics of story enables the crew to become collaborators with the producer and director. As a director talks about their story goals; and the crew will know what specific story benchmarks they are trying to meet. This information is more than a story being ""a sequence of events (acts) to a ""dramatic"" story that that builds from Setup through Resolution. Having an understanding of story structure allows one to understand a story's elements in context (i.e., theme, character, setting, conflict etc.) and their relationship to classic story structure (i.e., setup, inciting incident, rising action, climax, resolution, etc.). This information is for all whose work makes the story better, but their job is not creating the story. The following course notes have been adapted from CRC Publishers, a division of Taylor and Francis."	https://dl.acm.org/doi/abs/10.1145/3587423.3595494	Craig Caldwell
SIGGRAPH 2023 Course on Diffusion Models	Diffusion models have been successfully used in various applications such as text-to-image generation, 3D assets generation, controllable image editing, video generation, natural language generation, audio synthesis, and motion generation. The rate of progress on diffusion models is astonishing. In the year 2022 alone, diffusion models have been applied to many large-scale text-to-image foundation models, such as DALL-E 2 [Ramesh et al. 2022], Imagen [Saharia et al. 2022], Stable Diffusion [Rombach et al. 2022], and eDiff-I [Balaji et al. 2022]; video generation models such as Imagen Video [Ho et al. 2022] and Make-a-video [Singer et al. 2022]; 3D asset generation models such as Magic3D [Lin et al. 2022] and DreamFusion [Poole et al. 2022]. This course covers the advances in diffusion models over the last few years and will be tailored to the computer graphics community. We will first cover the fundamental machine learning and deep learning techniques relevant to diffusion models. Next, we will present state-of-the-art techniques for the application of diffusion models to high-fidelity image synthesis, controllable image generation, compositional representation learning, and 3D asset generation. Finally, we will conclude with a discussion on the future application of this technology, societal impact and open research problems. After the course, the attendees will learn basic knowledge about diffusion models and how such models can be applied to different applications such as image generation, image editing, and 3D asset generation.	https://dl.acm.org/doi/abs/10.1145/3587423.3595503	Chenlin Meng, Jiaming Song, Shuang Li, Jun-Yan Zhu, Stefano Ermon, Tsung-Yi Lin, Chen-Hsuan Lin, Karsten Kreis
Sag-Free Initialization for Strand-Based Hybrid Hair Simulation	Lagrangian/Eulerian hybrid strand-based hair simulation techniques have quickly become a popular approach in VFX and real-time graphics applications. With Lagrangian hair dynamics, the inter-hair contacts are resolved in the Eulerian grid using the continuum method, i.e., the MPM scheme with the granular Drucker-Prager rheology, to avoid expensive collision detection and handling. This fuzzy collision handling makes the authoring process significantly easier. However, although current hair grooming tools provide a wide range of strand-based modeling tools for this simulation approach, the crucial sag-free initialization functionality remains often ignored. Thus, when the simulation starts, gravity would cause any artistic hairstyle to sag and deform into unintended and undesirable shapes. This paper proposes a novel four-stage sag-free initialization framework to solve stable quasistatic configurations for hybrid strand-based hair dynamic systems. These four stages are split into two global-local pairs. The first one ensures static equilibrium at every Eulerian grid node with additional inequality constraints to prevent stress from exiting the yielding surface. We then derive several associated closed-form solutions in the local stage to compute segment rest lengths, orientations, and particle deformation gradients in parallel. The second global-local step solves along each hair strand to ensure all the bend and twist constraints produce zero net torque on every hair segment, followed by a local step to adjust the rest Darboux vectors to a unit quaternion. We also introduce an essential modification for the Darboux vector to eliminate the ambiguity of the Cosserat rod rest pose in both initialization and simulation. We evaluate our method on a wide range of hairstyles, and our approach can only take a few seconds to minutes to get the rest quasistatic configurations for hundreds of hair strands. Our results show that our method successfully prevents sagging and has minimal impact on the hair motion during simulation.	https://dl.acm.org/doi/abs/10.1145/3592143	Jerry Hsu, Tongtong Wang, Zherong Pan, Xifeng Gao, Cem Yuksel, Kui Wu
ScanBot: Autonomous Reconstruction via Deep Reinforcement Learning	Autoscanning of an unknown environment is the key to many AR/VR and robotic applications. However, autonomous reconstruction with both high efficiency and quality remains a challenging problem. In this work, we propose a reconstruction-oriented autoscanning approach, called ScanBot, which utilizes hierarchical deep reinforcement learning techniques for global (ROI) planning to improve the scanning efficiency and local (NBV) planning to enhance the reconstruction quality. Given the partially reconstructed scene, the global policy designates an ROI with insufficient exploration or reconstruction. The local policy is then applied to refine the reconstruction quality of objects in this region by planning and scanning a series of NBVs. A novel mixed 2D-3D representation is designed for these policies, where a 2D quality map with tailored quality channels encoding the scanning progress is consumed by the global policy, and a coarse-to-fine 3D volumetric representation that embodies both local environment and object completeness is fed to the local policy. These two policies iterate until the whole scene has been completely explored and scanned. To speed up the learning of complex environmental dynamics and enhance the agent's memory for spatial-temporal inference, we further introduce two novel auxiliary learning tasks to guide the training of our global policy. Thorough evaluations and comparisons are carried out to show the feasibility of our proposed approach and its advantages over previous methods. Code and data are available at https://github.com/HezhiCao/Scanbot.	https://dl.acm.org/doi/abs/10.1145/3592113	Hezhi Cao, Xi Xia, Guan Wu, Ruizhen Hu, Ligang Liu
Scratch-based Reflection Art via Differentiable Rendering	The 3D visual optical arts create fascinating special effects by carefully designing interactions between objects and light sources. One of the essential types is 3D reflection art, which aims to create reflectors that can display different images when viewed from different directions. Existing works produce impressive visual effects. Unfortunately, previous works discretize the reflector surface with regular grids/facets, leading to a large parameter space and a high optimization time cost. In this paper, we introduce a new type of 3D reflection art - , which allows for a more compact parameter space, easier fabrication, and computationally efficient optimization. To design a 3D reflection art with scratches, we formulate it as a multi-view optimization problem and introduce differentiable rendering to enable efficient gradient-based optimizers. For that, we propose an analytical scratch rendering approach, together with a high-performance rendering pipeline, allowing efficient differentiable rendering. As a consequence, we could display multiple images on a single metallic board with only several minutes for optimization. We demonstrate our work by showing virtual objects and manufacturing our designed reflectors with a carving machine.	https://dl.acm.org/doi/abs/10.1145/3592142	Pengfei Shen, Ruizeng Li, Beibei Wang, Ligang Liu
Seated-Walking: A Walking-in-Place Technique for Seated VR	We present Seated-Walking, a footstep locomotion technique designed for use when sitting on a chair. Seated-Walking is driven by users' forefoot or rearfoot stepping, which is meant to embody the foot motions of real walking while mitigating potential fatigue. We demonstrate Seated-Walking in two applications. The first application delivers a casual virtual showroom experience, where users sitting iOptoma Corporationn a chair are allowed to walk navigating artworks in the virtual environment. The second application is an intense survival shooter experience where users track and fight enemies while avoiding their attacks, all while seated walking.	https://dl.acm.org/doi/abs/10.1145/3588027.3595603	Liwei Chan, Tzu-Wei Mi, Zung-Hao Hsueh, Ming-Yun Hsu
Second-order Stencil Descent for Interior-point Hyperelasticity	In this paper, we present a GPU algorithm for finite element hyperelastic simulation. We show that the interior-point method, known to be effective for robust collision resolution, can be coupled with non-Newton procedures and be massively sped up on the GPU. Newton's method has been widely chosen for the interior-point family, which fully solves a linear system at each step. After that, the active set associated with collision/contact constraints is updated. Mimicking this routine using a non-Newton optimization (like gradient descent or ADMM) unfortunately does not deliver expected accelerations. This is because the barrier functions employed in an interior-point method need to be updated at every iteration to strictly confine the search to the feasible region. The associated cost (e.g., per-iteration CCD) quickly overweights the benefit brought by the GPU, and a new parallelism modality is needed. Our algorithm is inspired by the domain decomposition method and designed to move interior-point-related computations to local domains as much as possible. We minimize the size of each domain (i.e., a stencil) by restricting it to a single element, so as to fully exploit the capacity of modern GPUs. The stencil-level results are integrated into a global update using a novel hybrid sweep scheme. Our algorithm is locally second-order offering better convergence. It enables simulation acceleration of up to two orders over its CPU counterpart. We demonstrate the scalability, robustness, efficiency, and quality of our algorithm in a variety of simulation scenarios with complex and detailed collision geometries.	https://dl.acm.org/doi/abs/10.1145/3592104	Lei Lan, Minchen Li, Chenfanfu Jiang, Huamin Wang, Yin Yang
Seeing Photons in Color	Megapixel single-photon avalanche diode (SPAD) arrays have been developed recently, opening up the possibility of deploying SPADs as generalpurpose passive cameras for photography and computer vision. However, most previous work on SPADs has been limited to monochrome imaging. We propose a computational photography technique that reconstructs high-quality color images from mosaicked binary frames captured by a SPAD array, even for high-dyanamic-range (HDR) scenes with complex and rapid motion. Inspired by conventional burst photography approaches, we design algorithms that jointly denoise and demosaick single-photon image sequences. Based on the observation that motion effectively increases the color sample rate, we design a blue-noise pseudorandom RGBW color filter array for SPADs, which is tailored for imaging dark, dynamic scenes. Results on simulated data, as well as real data captured with a fabricated color SPAD hardware prototype shows that the proposed method can reconstruct high-quality images with minimal color artifacts even for challenging low-light, HDR and fast-moving scenes. We hope that this paper, by adding color to computational single-photon imaging, spurs rapid adoption of SPADs for real-world passive imaging applications.	https://dl.acm.org/doi/abs/10.1145/3592438	Sizhuo Ma, Varun Sundar, Paul Mos, Claudio Bruschini, Edoardo Charbon, Mohit Gupta
SegAnimeChara: Segmenting Anime Characters Generated by AI	This work introduces SegAnimeChara, a novel system of transforming AI-generated anime images into game characters while retaining unique features. Using volume-based body pose segmentation, SegAnimeChara can efficiently, zero-shot, segment body parts from generative images based on OpenPose human skeleton. Furthermore, this system integrates a semantic segmentation pipeline based on the text prompts of the existing Text2Image workflow. The system conserves the game character's unique outfit and reduces the redundant duplicate text prompts for semantic segmentation.	https://dl.acm.org/doi/abs/10.1145/3588028.3603685	Andy Yu-Hsiang Tseng, Wen-Fan Wang, Bing-Yu Chen
Semantics and Scheduling for Machine Knitting Compilers	Machine knitting is a well-established fabrication technique for complex soft objects, and both companies and researchers have developed tools for generating machine knitting patterns. However, existing representations for machine knitted objects are incomplete (do not cover the complete domain of machine knittable objects) or overly specific (do not account for symmetries and equivalences among knitting instruction sequences). This makes it difficult to define correctness in machine knitting, let alone verify the correctness of a given program or program transformation. The major contribution of this work is a formal semantics for knitout, a low-level Domain Specific Language for knitting machines. We accomplish this by using what we call the , which extends concepts from knot theory to allow for a mathematical definition of knitting program equivalence that matches the intuition behind knit objects. Finally, using this formal representation, we prove the correctness of a sequence of rewrite rules; and demonstrate how these rewrite rules can form the foundation for higher-level tasks such as compiling a program for a specific machine and optimizing for time/reliability, all while provably generating the same knit object under our proposed semantics. By establishing formal definitions of correctness, this work provides a strong foundation for compiling and optimizing knit programs.	https://dl.acm.org/doi/abs/10.1145/3592449	Jenny Lin, Vidya Narayanan, Yuka Ikarashi, Jonathan Ragan-Kelley, Gilbert Bernstein, James McCann
Semi-supervised reference-based sketch extraction using a contrastive learning framework	Sketches reflect the drawing style of individual artists; therefore, it is important to consider their unique styles when extracting sketches from color images for various applications. Unfortunately, most existing sketch extraction methods are designed to extract sketches of a single style. Although there have been some attempts to generate various style sketches, the methods generally suffer from two limitations: low quality results and difficulty in training the model due to the requirement of a paired dataset. In this paper, we propose a novel multi-modal sketch extraction method that can imitate the style of a given reference sketch with unpaired data training in a semi-supervised manner. Our method outperforms state-of-the-art sketch extraction methods and unpaired image translation methods in both quantitative and qualitative evaluations.	https://dl.acm.org/doi/abs/10.1145/3592392	Chang Wook Seo, Amirsaman Ashtari, Junyong Noh
Shadow	21st of March 1945. You're the second wave of British bombers headed to Copenhagen to bomb Gestapo's headquarters. But as you approach the city with over 500 km an hour, you realize something isn't right. Nevertheless, your decision has to be made --- now.	https://dl.acm.org/doi/abs/10.1145/3577025.3584915	Juliette Chabrier
ShapeCoder: Discovering Abstractions for Visual Programs from Unstructured Primitives	We introduce ShapeCoder, the first system capable of taking a dataset of shapes, represented with unstructured primitives, and jointly discovering (i) useful functions and (ii) programs that use these abstractions to explain the input shapes. The discovered abstractions capture common patterns (both structural and parametric) across a dataset, so that programs rewritten with these abstractions are more compact, and suppress spurious degrees of freedom. ShapeCoder improves upon previous abstraction discovery methods, finding better abstractions, for more complex inputs, under less stringent input assumptions. This is principally made possible by two methodological advancements: (a) a shape-to-program recognition network that learns to solve sub-problems and (b) the use of e-graphs, augmented with a conditional rewrite scheme, to determine when abstractions with complex parametric expressions can be applied, in a tractable manner. We evaluate ShapeCoder on multiple datasets of 3D shapes, where primitive decompositions are either parsed from manual annotations or produced by an unsupervised cuboid abstraction method. In all domains, ShapeCoder discovers a library of abstractions that captures high-level relationships, removes extraneous degrees of freedom, and achieves better dataset compression compared with alternative approaches. Finally, we investigate how programs rewritten to use discovered abstractions prove useful for downstream tasks.	https://dl.acm.org/doi/abs/10.1145/3592416	R. Kenny Jones, Paul Guerrero, Niloy J. Mitra, Daniel Ritchie
Shortest Path to Boundary for Self-Intersecting Meshes	We introduce a method for efficiently computing the exact shortest path to the boundary of a mesh from a given internal point in the presence of self-intersections. We provide a formal definition of shortest boundary paths for self-intersecting objects and present a robust algorithm for computing the actual shortest boundary path. The resulting method offers an effective solution for collision and self-collision handling while simulating deformable volumetric objects, using fast simulation techniques that provide no guarantees on collision resolution. Our evaluation includes complex self-collision scenarios with a large number of active contacts, showing that our method can successfully handle them by introducing a relatively minor computational overhead.	https://dl.acm.org/doi/abs/10.1145/3592136	He Chen, Elie Diaz, Cem Yuksel
