title	abstract	url	authors
Learning to optimize halide with tree search and random programs	We propose a new modal sound synthesis method that rapidly estimates all acoustic transfer fields of a linear modal vibration model, and greatly reduces preprocessing costs. Instead of performing a separate frequency-domain Helmholtz radiation analysis for each mode, our method partitions vibration modes into using optimal , then performs a single time-domain wave simulation for each chord. We then perform on each chord's time-domain radiation field using a specialized QR solver, and thereby extract the frequency-domain transfer functions of each mode. The precomputed transfer functions are represented for fast far-field evaluation, e.g., using multipole expansions. In this paper, we propose to use a single scalar-valued Far-field Acoustic Transfer (FFAT) cube map. We describe a GPU-accelerated vector wavesolver that achieves high-throughput acoustic transfer computation at accuracy sufficient for sound synthesis. Our implementation, KleinPAT, can achieve hundred- to thousand-fold speedups compared to existing Helmholtz-based transfer solvers, thereby enabling large-scale generation of modal sound models for audio-visual applications.	https://dl.acm.org/authorize?N688177	Jui-Hsien Wang, Doug L. James
Level ex: tracing all kinds of rays... on mobile	Presented are new methods to raytrace and simulate raytracing of different types of rays through a range of different participating media in real-time, including: *SDF ray-tracing to recreated refractive physics-based viscous fluids that interface with a surrounding soft-body environment and other physics objects in the scene. SDFs are blended seamlessly with each other and environment objects. Special considerations are made to maximize cache and memory-coherence on tile-based mobile GPU architectures. *X-Rays - Which follow logarithmic attenuation functions and fresnel-like behaviors as they are absorbed and scattered through different materials on their way from the emitter to the detector plate. X-ray tracing behaves more like a transparent shadowing technique than anything else. * Ultrasonic Sound waves - Used in real-time ultrasound imaging, these rays break all the rules - you can't even rely on their propagation speed to stay constant. Dozens of different artifact types (shadows, ringing, etc.) must be simulated through the tracing behavior. For example - highly reflective objects outside of the ultrasound beam 'slice' may bounce back into the frame, creating the appearance of 'ghost' objects that aren't actually there. Various mobile-friendly thread bundling approaches are taken to cast and bounce rays in the scene. Worth noting The SDF ray-marching technique in Pulm Ex was shown last year but has been drastically improved with refractions, performance optimizations, and new SDF shapes, blends, and techniques.	https://dl.acm.org/authorize?N689128	Sam Glassenberg, Matthew Yaeger
Light pruning on Toy Story 4	DNEG is constantly improving its global tools and processes to make them more efficient and artist-friendly, while leveraging state-of-the-art technologies and trends in the industry. The special requirements for Sony Pictures' movie were the perfect opportunity for us to improve our Image Based Lighting (IBL) workflows. In this paper we present the a semi-automated system to allow fast and artist-friendly extraction of numerous lights from HDR images (HDRIs), using computer vision. The system uses , a USD-based implementation of light descriptions, to allow cross-DCC usage and pipeline integration.	https://dl.acm.org/authorize?N689318	Stefano Cieri, Alexander Schwank
Lighting design for stylized animation	This course will introduce students, researchers and digital artists to the recent results in perceptual research on virtual characters. It covers both how technical and artistic aspects that constitute the appearance of a virtual character influence human perception. We will report results of studies that addressed the influence of low-level cues like facial proportions, shading or level of detail and higher-level cues such as behavior or artistic stylization. We will place emphasis on aspects that are encountered during character development, animation, and achieving consistency between the visuals and storytelling. The insights that we present in this course will serve as an additional toolset to anticipate the effect of certain design decisions and to create more convincing characters, especially in the case where budgets or time are limited.	https://dl.acm.org/authorize?N689271	Dave Walvoord, DreamWorks Animation
Liquid printed pneumatics	Liquid Printed Pneumatics is a project developed by the MIT, Self-Assembly Lab and Swiss designer Christophe Guberan that focuses on the 3D printing of pneumatically activated objects. Rapid Liquid Printing (RLP), a new additive manufacturing process developed at the lab, is used to create shape changing devices and objects.	https://dl.acm.org/authorize?N688354	Bjorn Sparrman, Schendy Kernizan, Jared Laucks, Skylar Tibbits, Christophe Guberan
LiquidMask: utilizing liquid-based haptic for multiple tactile sensation in immersive virtual reality	We present LiquidMask, a liquid-based haptic device which can simultaneously produce thermal changes and vibration responses by filling liquid into the mask. To demonstrate our device, we also design a diving game to show the utility of LiquidMask.	https://dl.acm.org/authorize?N689255	Yi-Ya Liao, Ya-Fang Hong, Ping-Hsuan Han, Ju-Chun Ko
Local light field fusion: practical view synthesis with prescriptive sampling guidelines	We present a practical and robust deep learning solution for capturing and rendering novel views of complex real world scenes for virtual exploration. Previous approaches either require intractably dense view sampling or provide little to no guidance for how users should sample views of a scene to reliably render high-quality novel views. Instead, we propose an algorithm for view synthesis from an irregular grid of sampled views that first expands each sampled view into a local light field via a multiplane image (MPI) scene representation, then renders novel views by blending adjacent local light fields. We extend traditional plenoptic sampling theory to derive a bound that specifies precisely how densely users should sample views of a given scene when using our algorithm. In practice, we apply this bound to capture and render views of real world scenes that achieve the perceptual quality of Nyquist rate view sampling while using up to 4000X fewer views. We demonstrate our approach's practicality with an augmented reality smart-phone app that guides users to capture input images of a scene and viewers that enable realtime virtual exploration on desktop and mobile platforms.	https://dl.acm.org/authorize?N688074	Ben Mildenhall, Pratul P. Srinivasan, Rodrigo Ortiz-Cayon, Nima Khademi Kalantari, Ravi Ramamoorthi, Ren Ng, Abhishek Kar
Luminance-contrast-aware foveated rendering	Current rendering techniques struggle to fulfill quality and power efficiency requirements imposed by new display devices such as virtual reality headsets. A promising solution to overcome these problems is foveated rendering, which exploits gaze information to reduce rendering quality for the peripheral vision where the requirements of the human visual system are significantly lower. Most of the current solutions model the sensitivity as a function of eccentricity, neglecting the fact that it also is strongly influenced by the displayed content. In this work, we propose a new luminance-contrast-aware foveated rendering technique which demonstrates that the computational savings of foveated rendering can be significantly improved if local luminance contrast of the image is analyzed. To this end, we first study the resolution requirements at different eccentricities as a function of luminance patterns. We later use this information to derive a low-cost predictor of the foveated rendering parameters. Its main feature is the ability to predict the parameters using only a low-resolution version of the current frame, even though the prediction holds for high-resolution rendering. This property is essential for the estimation of required quality before the full-resolution image is rendered. We demonstrate that our predictor can efficiently drive the foveated rendering technique and analyze its benefits in a series of user experiments.	https://dl.acm.org/authorize?N688043	Okan Tarhan Tursun, Elena Arabadzhiyska-Koleva, Marek Wernikowski, Radosław Mantiuk, Hans-Peter Seidel, Karol Myszkowski, Piotr Didyk
Machine-learning denoising in feature film production	"We present our experience deploying and using machine learning denoising of Monte Carlo renders in the production of animated feature films such as Pixar's , Disney Animation's and Industrial Light & Magic's visual effects work on photo-realistic films such as We show what it took to move from an R&D implementation of ""Denoising with Kernel Prediction and Asymmetric Loss Functions"" [Vogels et al. 2018] to a practical tool in a production pipeline."	https://dl.acm.org/authorize?N689395	Henrik Dahlberg, David Adler, Jeremy Newlin
MagicPAPER: tabletop interactive projection device based on tangible interaction	This study proposes a tabletop projection device that can be implemented by combining physical objects with interactive projections. Users can interact on kraft papers using daily tools, such as marker pens, toothbrushes, colored blocks, and square wooden blocks. The input of the proposed device is a multifunction sensor, and the output is a tabletop projector. Using MagicPAPER, four types of interactions are implemented, namely drawing, gesture recognition, brushing, and building blocks. The abstract and poster discuss the design motivations and system descriptions of MagicPAPER.	https://dl.acm.org/doi/abs/abs/10.1145/3306214.3338575	Qin Wu, Jiayuan Wang, Sirui Wang, Tong Su, Chenmei Yu
MagniFinger: fingertip-mounted microscope for augmenting human perception	We propose , a fingertip-worn microscopy device that augments the limited abilities of human visual and tactile sensory systems in micrometer-scale environments. makes use of the finger's dexterous motor skills to achieve precise and intuitive control while allowing the user to observe the desired position simply by placing a fingertip. To implement the fingertip-sized device and its tactile display, we have built a system comprising a ball lens, an image sensor, and a thin piezoelectric actuator. Vibration-based tactile feedback is displayed based on the luminance of a magnified image, providing the user with the feeling of touching the magnified world.	https://dl.acm.org/doi/abs/abs/10.1145/3306214.3338563	Noriyasu Obushi, Sohei Wakisaka, Shunichi Kasahara, Atsushi Hiyama, Masahiko Inami
MagniFinger: magnified perception by a fingertip probe microscope	We propose , a fingertip-worn microscopy device that augments the limited abilities of human visual and tactile sensory systems in micrometer-scale environments. makes use of the finger's dexterous motor skills to achieve precise and intuitive control while allowing the user to observe the desired position simply by placing a fingertip. To implement the fingertip-sized device and its tactile display, we have built a system comprising a ball lens, an image sensor, and a thin piezoelectric actuator. Vibration-based tactile feedback is displayed based on the luminance of a magnified image, providing the user with the feeling of touching the magnified world.	https://dl.acm.org/authorize?N688365	Noriyasu Obushi, Sohei Wakisaka, Shunichi Kasahara, Atsushi Hiyama, Masahiko Inami
Marooned	"""Marooned"" tells the story of a cantankerous and selfish robot named C-0R13, stranded on an abandoned lunar outpost, who longs to return to Earth. With a partially built ship and his last power source, the determined robot will stop at nothing to achieve his goal."	https://dl.acm.org/authorize?N689350	Andrew Erekson
Mary and the monster: chapter one	"Mary and the Monster: Chapter One is a shared AR experience that brings to life ""Frankenstein"" through the eyes of a young Mary Shelley. Using Parallux technology and the Magic Leap One, audiences are immersed in the author's world as she conjures the most famous gothic tale of all time."	https://dl.acm.org/authorize?N689256	Kris Layng, Ken Perlin, Sebastian Herscher, Gabe Zetter
Massively parallel layout generation in real time	Conceiving an artwork requires designers to create assets and organize (or layout) them in a harmonious, self-orating story. While creativity is fundamental to both aspects, the latter can be bolstered with automated techniques. We present a first true SIMD formulation for the layout generation and leverage CUDA-enabled GPU to scan through millions of possible permutations and rank them on aesthetic appeal using weighted parameters such as symmetry, alignment, density, size balance, etc. The entire process happens in real-time using a GPU-accelerated implementation of replica exchange Monte Carlo Markov Chain method. The exploration of design space is rapidly narrowed by performing distant jumps from poorly ranked layouts, and fine tuning the highly ranked ones. Several iterations are carried out until desired rank or system convergence is achieved. In contrast to existing approaches, our technique generates aesthetically better layouts and runs more than two orders of magnitude faster.	https://dl.acm.org/doi/abs/abs/10.1145/3306214.3338596	Vineet Batra, Ankit Phogat, Tarun Beri
Matching prescription & visual acuity: towards AR for humans	An increasingly important part of usuable near-eye displays to allow use by users who use vision correction such as that provided by glasses and contact lenses. Recent research indicates that over 20% of world population is myopic, and this percentage is increasing [Holden et al. 2016]. Commercial prototypes have offered an additional prescription lens pair or a glasses-compatible design, but both of these approaches increase the size and weight of the device. Ideally, a user's prescription should be considered from the optical design stage for the smallest form factor.	https://dl.acm.org/authorize?N688366	Jonghyun Kim, Michael Stengel, Jui-Yi Wu, Ben Boudaoud, Josef Spjut, Kaan Akşit, Rachel Albert, Trey Greer, Youngmo Jeong, Ward Lopes, Zander Majercik, Peter Shirley, Morgan McGuire, David Luebke
Mayday - Final Chapter	We use pop-up book to present a person's life. Along with the increase of age, different choice leads us to the success, lost, fulfilled, or regret. Therefore, when the loved one leaves, the life from that day is called the rest of life.	https://dl.acm.org/authorize?N689241	Muh Chen
Meet in rain: a serious game to help the better appreciation of Chinese poems	is a serious game on Chinese poetry. While invoking various events, players must complete given tasks, which help them better appreciate the poems, by exploring imaginary sceneries that depict Chinese poems. Its visual design also mimics Chinese paintings in the era when the poems were created. As only a few serious games exist for Chinese poetry and they mostly focus on knowledge acquisition, our work provides a rare design exemplar of a serious game that is designed with the intention to foster aesthetic appreciation for a cultural subject.	https://dl.acm.org/doi/abs/abs/10.1145/3306214.3338587	Ye-Ning Jiang, Hiroki Nishino
Melody slot machine	"We developed an interactive music system called the ""Melody Slot Machine, "" which provides an experience of manipulating a music performance. The melodies used in the system are divided into multiple segments, and each segment has multiple variations of melodies. By turning the dials manually, users can switch the variations of melodies freely. When you pull the slot lever, the melody of all segments rotates, and melody segments are randomly selected. Since the performer displayed in a hologram moves in accordance with the selected variation of melody, users can enjoy the feeling of manipulating the performance."	https://dl.acm.org/authorize?N688367	Masatoshi Hamanaka, Takayuki Nakatsuka, Shigeo Morishima
Mesh wrap based on affine-invariant coordinates	We present a new technique to transfer the mesh connectivity between 3D models of different shapes. In contrast to prior work, our method is designed to wrap meshes under large, locally non-rigid deformations, which are commonly found in feature animations. To achieve this goal, we enrich the traditional iterative closest point scheme with mesh coordinates that parametrize the edge spans of a desired tessellation invariant to locally affine transformations. As a result, we produce surfaces that wrap a target geometry accurately, while resembling the patch layout of the source mesh. Our implementation also offers an interactive workflow to assist the authoring of curve correspondences. We employed this tool to wrap 600 humanoid assets to a reference mesh connectivity, spanning characters modeled over the last 15 years at Pixar.	https://dl.acm.org/authorize?N689370	Fernando de Goes, Alonso Martinez
Mesh-driven generation and animation of groomed feathers	This talk presents DreamWorks' , an environmental motion system for creating believable animation for grass, plants, and other vegetation. The system was used extensively on the complex and expansive sets in and is currently being used on more productions at DreamWorks.	https://dl.acm.org/authorize?N689335	Chris De St. Jeor, Chris Michael, Kurt Phillips, Arunachalam Somasundaram
MeshCNN: a network with an edge	Polygonal meshes provide an efficient representation for 3D shapes. They explicitly captureboth shape surface and topology, and leverage non-uniformity to represent large flat regions as well as sharp, intricate features. This non-uniformity and irregularity, however, inhibits mesh analysis efforts using neural networks that combine convolution and pooling operations. In this paper, we utilize the unique properties of the mesh for a direct analysis of 3D shapes using , a convolutional neural network designed specifically for triangular meshes. Analogous to classic CNNs, MeshCNN combines specialized convolution and pooling layers that operate on the mesh edges, by leveraging their intrinsic geodesic connections. Convolutions are applied on edges and the four edges of their incident triangles, and pooling is applied via an edge collapse operation that retains surface topology, thereby, generating new mesh connectivity for the subsequent convolutions. MeshCNN learns which edges to collapse, thus forming a task-driven process where the network exposes and expands the important features while discarding the redundant ones. We demonstrate the effectiveness of MeshCNN on various learning tasks applied to 3D meshes.	https://dl.acm.org/authorize?N688045	Rana Hanocka, Amir Hertz, Noa Fish, Raja Giryes, Shachar Fleishman, Daniel Cohen-Or
Meu	Meu allows users to connect to their inner emotional states and communicate them to others by providing customizable avatars along with unique algorithms that connect your movements to reactive music, visual effects, and haptics vibrations. Your body language and dances create a Meu that your friends can then experience.	https://dl.acm.org/authorize?N689147	Sarah Hashkes
Mica	In this experience you meet Mica, the human center of spatial computing and AI. Together, you develop an emotional connection and create artwork. Inspired by collaborative art practices, this experience establishes you and Mica as a unified force, working together to find meaning and create beauty.	https://dl.acm.org/authorize?N689257	John Monos
Mica: a photoreal character for spatial computing	Mica is an autonomous, photoreal human character that runs on the Magic Leap One spatial computing platform. The past ten years have seen tremendous improvements in virtual character technology on screen, in film and games. Spatial computing hardware such as Magic Leap One allows us to take the next step: interacting with virtual characters off the screen. We believe that virtual characters who are aware of and can interact directly with users in real-world environments will provide a uniquely compelling experience.	https://dl.acm.org/authorize?N689385	James Bancroft, Nafees Bin Zafar, Sean Comer, Takashi Kuribayashi, Jonathan Litt, Thomas Miller
MindPalace	"""Traveling While Black"" is a cinematic VR experience that immerses the viewer in the long history of restriction of movement for black Americans, and the creation of safe spaces in our communities."	https://dl.acm.org/authorize?N689375	Carl Krause, Dominik Stockhausen
Mixing sauces: a viscosity blending model for shear thinning fluids	The materials around us usually exist as of constituents, each constituent with possibly a different property. How can we describe the material property of such a mixture is the core question of this paper. We propose a nonlinear blending model that can capture intriguing flowing behaviors that can differ from that of the individual constituents (Fig. 1). We used a laboratory device, , to measure the flowing properties of various fluid-like foods, and found that an has nice agreements with the measured data even for the mixtures of these foods. We then constructed a blending model such that it qualitatively agrees with the measurements and is closed in the parameter space of the elastic Herschel-Bulkley model. We provide validations through comparisons between the measured and estimated properties using our model, and comparisons between simulated examples and captured footages. We show the utility of our model for producing interesting behaviors of various mixtures.	https://dl.acm.org/authorize?N688040	Kentaro Nagasawa, Takayuki Suzuki, Ryohei Seto, Masato Okada, Yonghao Yue
Mortal Kombat 11: high fidelity cached simulations in real-time	Mortal Kombat 11 introduces an Alembic-based asset pipeline that enables artists to leverage new workflows previously unattainable in real-time games. Blood and gore are the cornerstone of the franchise, and the art direction for our Fatalities and Fatal Blows focuses on close-up, high-fidelity, slow-motion shots showing extreme amounts of blood, which traditional sprite particles would struggle to achieve.	https://dl.acm.org/authorize?N689394	Jason Nadro, Matt Battaglia, Aren Voorhees
Multi-resolution approach to computing locally injective maps on meshes	Computing injective mappings with low distortions on meshes is an important problem for its wide range of practical applications in computer graphics, geometric modeling and physical simulations. Such tasks as surface parametrization or shape deformation are often reduced to minimizing non-convex and non-linear geometric energies defined over triangulated domains. These energies are commonly expressed in a finite element manner as a weighted sum of distortion densities over simplixes :[MATHS HERE]where (2) enforces to preserve orientation of each simplex, and ( ) is a linear system of the given positional constraints. The orientation constraints are particularly important in parametrization problems, since they avoid undesirable foldover artifacts in the texture, while positional constraints are widely used in shape deformation applications, such as point-to-point deformations, deformations with fixed anchors, and more.	https://dl.acm.org/doi/abs/abs/10.1145/3306214.3338591	Alexander Naitsat, Yehoshua Y. Zeevi
Multi-robot collaborative dense scene reconstruction	We present an autonomous scanning approach which allows multiple robots to perform collaborative scanning for dense 3D reconstruction of unknown indoor scenes. Our method plans scanning paths for several robots, allowing them to efficiently coordinate with each other such that the collective scanning coverage and reconstruction quality is maximized while the overall scanning effort is minimized. To this end, we define the problem as a dynamic task assignment and introduce a novel formulation based on Optimal Mass Transport (OMT). Given the currently scanned scene, a set of task views are extracted to cover scene regions which are either unknown or uncertain. These task views are assigned to the robots based on the OMT optimization. We then compute for each robot a smooth path over its assigned tasks by solving an approximate traveling salesman problem. In order to showcase our algorithm, we implement a multi-robot auto-scanning system. Since our method is computationally efficient, we can easily run it in real time on commodity hardware, and combine it with online RGB-D reconstruction approaches. In our results, we show several real-world examples of large indoor environments; in addition, we build a benchmark with a series of carefully designed metrics for quantitatively evaluating multi-robot autoscanning. Overall, we are able to demonstrate high-quality scanning results with respect to reconstruction quality and scanning efficiency, which significantly outperforms existing multi-robot exploration systems.	https://dl.acm.org/authorize?N688039	Siyan Dong, Kai Xu, Qiang Zhou, Andrea Tagliasacchi, Shiqing Xin, Matthias Nießner, Baoquan Chen
