title	abstract	url	authors
Dictionary Fields: Learning a Neural Basis Decomposition	We present Dictionary Fields, a novel neural representation which decomposes a signal into a product of factors, each represented by a classical or neural field representation, operating on transformed input coordinates. More specifically, we factorize a signal into a coefficient field and a basis field, and exploit periodic coordinate transformations to apply the same basis functions across multiple locations and scales. Our experiments show that Dictionary Fields lead to improvements in approximation quality, compactness, and training time when compared to previous fast reconstruction methods. Experimentally, our representation achieves better image approximation quality on 2D image regression tasks, higher geometric quality when reconstructing 3D signed distance fields, and higher compactness for radiance field reconstruction tasks. Furthermore, Dictionary Fields enable generalization to unseen images/3D scenes by sharing bases across signals during training which greatly benefits use cases such as image regression from partial observations and few-shot radiance field reconstruction.	https://dl.acm.org/doi/abs/10.1145/3592135	Anpei Chen, Zexiang Xu, Xinyue Wei, Siyu Tang, Hao Su, Andreas Geiger
Differentiable Stripe Patterns for Inverse Design of Structured Surfaces	Stripe patterns are ubiquitous in nature and everyday life. While the synthesis of these patterns has been thoroughly studied in the literature, their potential to control the mechanics of structured materials remains largely unexplored. In this work, we introduce Differentiable Stripe Patterns---a computational approach for automated design of physical surfaces structured with stripe-shaped bi-material distributions. Our method builds on the work by Knöppel and colleagues [2015] for generating globally-continuous and equally-spaced stripe patterns. To unlock the full potential of this design space, we propose a gradient-based optimization tool to automatically compute stripe patterns that best approximate macromechanical performance goals. Specifically, we propose a computational model that combines solid shell finite elements with XFEM for accurate and fully-differentiable modeling of elastic bi-material surfaces. To resolve non-uniqueness problems in the original method, we furthermore propose a robust formulation that yields unique and differentiable stripe patterns. We combine these components with equilibrium state derivatives into an end-to-end differentiable pipeline that enables inverse design of mechanical stripe patterns. We demonstrate our method on a diverse set of examples that illustrate the potential of stripe patterns as a design space for structured materials. Our simulation results are experimentally validated on physical prototypes.	https://dl.acm.org/doi/abs/10.1145/3592114	Juan Sebastian Montes Maestre, Yinwei Du, Ronan Hinchet, Stelian Coros, Bernhard Thomaszewski
Differential Operators on Sketches via Alpha Contours	A vector sketch is a popular and natural geometry representation depicting a 2D shape. When viewed from afar, the disconnected vector strokes of a sketch and the empty space around them visually merge into and , respectively. Positive and negative spaces are the key elements in the composition of a sketch and define what we perceive as the shape. Nevertheless, the notion of positive or negative space is mathematically ambiguous: While the strokes unambiguously indicate the interior or boundary of a 2D shape, the empty space may or may not belong to the shape's exterior. For standard discrete geometry representations, such as meshes or point clouds, some of the most robust pipelines rely on discretizations of differential operators, such as Laplace-Beltrami. Such discretizations are not available for vector sketches; defining them may enable numerous applications of classical methods on vector sketches. However, to do so, one needs to define the positive space of a vector sketch, or the Even though extracting this 2D sketch shape is mathematically ambiguous, we propose a robust algorithm, , constructing its conservative estimate: a 2D shape containing all the input strokes, which lie in its interior or on its boundary, and aligning tightly to a sketch. This allows us to define popular differential operators on vector sketches, such as Laplacian and Steklov operators. We demonstrate that our construction enables robust tools for vector sketches, such as As-Rigid-As-Possible sketch deformation and functional maps between sketches, as well as solving partial differential equations on a vector sketch.	https://dl.acm.org/doi/abs/10.1145/3592420	Mariia Myronova, William Neveu, Mikhail Bessmeltsev
Digital Dance Studio VR (DDS-VR): An innovative user-focused immersive software application for digital choreographic composition, planning, teaching, learning, and rehearsal.	The Digital Dance Studio VR (DDS-VR) is an innovative user-focused immersive software application for choreographic composition, planning, teaching, learning, and rehearsal. It offers a simple and intuitive immersive interface for creation and manipulation of choreographic sequences in virtual space, permitting exploration of spatial and temporal patterning, musical accompaniment, environment and design aesthetics, and allowing users to change the position, number, rhythm and orientation of dancers. It provides a suite of modular tools for choreographers, dancers, and anyone interested in exploring movement in a digital context – including Film and TV applications in blocking/storyboarding of fight and crowd sequences. The DDS-VR application can empower users to create, visualize, and share digital choreography outside of the physical studio, saving considerable time and money on studio and personnel hire, and bypassing the more professionalized use of real-time graphics software such as Unity and Unreal.	https://dl.acm.org/doi/abs/10.1145/3588027.3595602	Alexander Whitley, Sönke Kirchhof, Daniel Strutt
Dimix: A Cross-Dimensional Mixed Reality System Based on Latent Diffusion Model	Dimix is a system that integrates 2D images generated by Latent Diffusion Models (LDMs) [et al. 2022] with 3D and interactive Mixed Reality (MR) experiences. This system extracts regions from MR scenes based on panoramic images, adds optional mask images, and applies image-inpainting using LDMs to output an LDMs-generated image (LDMs image) that naturally extends the scene. Furthermore, by performing depth estimation on the images and reconstructing them as 3D scenes, the LDMs image can be treated in the same manner as 3D objects. This enables both basic features like occlusion and collision detection and highly interactive operations such as ink painting, achieving high immersion and realism. Additionally, the system incorporates real-time object detection to constrain the inpainting area, making the LDMs image more convincing. All processing is performed in real-time, allowing users to interact with the world in 3D without waiting for loading or any other preparation by simply uploading their preferred panorama image to the application. To our best knowledge, Dimix is the first system to seamlessly integrate LDMs images into interactive and three-dimensional MR experiences. Users can immerse themselves in an unprecedented space where the real world seamlessly blends with a world generated by a neural network, offering a glimpse into the future of MR experiences.	https://dl.acm.org/doi/abs/10.1145/3588027.3595592	Daiki Taniguchi
Down the Rabbit Hole:: Experiencing Alice in Wonderland Syndrome through Virtual Reality	Alice in Wonderland Syndrome (AIWS) is a rare perceptual disorder affecting visual processing, the perception of one's body and the experience of time. This condition can be congenital or result from various insults to the brain. There is growing interest in AIWS in providing a window into how different areas of the brain work together to construct reality. We developed a virtual reality (VR) simulation of this condition as a psychoeducational tool for students in the psychological and medical sciences and care givers to experience the different perceptual distortions common in AIWS and an opportunity to reflect on the nature of perception.	https://dl.acm.org/doi/abs/10.1145/3588028.3603678	Madeline Verheydt, Evan Staben, Kyle Carncross, Meredith Minear
DreamFace: Progressive Generation of Animatable 3D Faces under Text Guidance	Emerging Metaverse applications demand accessible, accurate and easy-to-use tools for 3D digital human creations in order to depict different cultures and societies as if in the physical world. Recent large-scale vision-language advances pave the way for novices to conveniently customize 3D content. However, the generated CG-friendly assets still cannot represent the desired facial traits for human characteristics. In this paper, we present Dream-Face, a progressive scheme to generate personalized 3D faces under text guidance. It enables layman users to naturally customize 3D facial assets that are compatible with CG pipelines, with desired shapes, textures and fine-grained animation capabilities. From a text input to describe the facial traits, we first introduce a coarse-to-fine scheme to generate the neutral facial geometry with a unified topology. We employ a selection strategy in the CLIP embedding space to generate coarse geometry, and subsequently optimize both the detailed displacements and normals using Score Distillation Sampling (SDS) from the generic Latent Diffusion Model (LDM). Then, for neutral appearance generation, we introduce a dual-path mechanism, which combines the generic LDM with a novel texture LDM to ensure both the diversity and textural specification in the UV space. We also employ a two-stage optimization to perform SDS in both the latent and image spaces to significantly provide compact priors for fine-grained synthesis. It also enables learning the mapping from the compact latent space into physically-based textures (diffuse albedo, specular intensity, normal maps, etc.). Our generated neutral assets naturally support blendshapes-based facial animations, thanks to the unified geometric topology. We further improve the animation ability with personalized deformation characteristics. To this end, we learn the universal expression prior in a latent space with neutral asset conditioning using the cross-identity hypernetwork, we subsequently train a neural facial tracker from video input space into the pre-trained expression space for personalized fine-grained animation. Extensive qualitative and quantitative experiments validate the effectiveness and generalizability of DreamFace. Notably, DreamFace can generate realistic 3D facial assets with physically-based rendering quality and rich animation ability from video footage, even for fashion icons or exotic characters in cartoons and fiction movies.	https://dl.acm.org/doi/abs/10.1145/3592094	Longwen Zhang, Qiwei Qiu, Hongyang Lin, Qixuan Zhang, Cheng Shi, Wei Yang, Ye Shi, Sibei Yang, Lan Xu, Jingyi Yu
ETER: Elastic Tessellation for Real-Time Pixel-Accurate Rendering of Large-Scale NURBS Models	We present ETER, an elastic tessellation framework for rendering large-scale NURBS models with pixel-accurate and crack-free quality at real-time frame rates. We propose a highly parallel adaptive tessellation algorithm to achieve pixel accuracy, measured by the screen space error between the exact surface and its triangulation. To resolve a bottleneck in NURBS rendering, we present a novel evaluation method based on uniform sampling grids and accelerated by GPU Tensor Cores. Compared to evaluation based on hardware tessellation, our method has achieved a significant speedup of 2.9 to 16.2 times depending on the degrees of the patches. We develop an efficient crack-filling algorithm based on conservative rasterization and visibility buffer to fill the tessellation-induced cracks while greatly reducing the jagged effect introduced by conservative rasterization. We integrate all our novel algorithms, implemented in CUDA, into a GPU NURBS rendering pipeline based on Mesh Shaders and hybrid software/hardware rasterization. Our performance data on a commodity GPU show that the rendering pipeline based on ETER is capable of rendering up to 3.7 million patches (0.25 billion tessellated triangles) in real-time (30FPS). With its advantages in performance, scalability, and visual quality in rendering large-scale NURBS models, a real-time tessellation solution based on ETER can be a powerful alternative or even a potential replacement for the existing pre-tessellation solution in CAD systems.	https://dl.acm.org/doi/abs/10.1145/3592419	Ruicheng Xiong, Yang Lu, Cong Chen, Jiaming Zhu, Yajun Zeng, Ligang Liu
Effect-based Multi-viewer Caching for Cloud-native Rendering	With cloud computing becoming ubiquitous, it appears as virtually everything can be offered However, real-time rendering in the cloud forms a notable exception, where the cloud adoption stops at running individual game instances in compute centers. In this paper, we explore whether a cloud-native rendering architecture is viable and scales to multi-client rendering scenarios. To this end, we propose world-space and on-surface caches to share rendering computations among viewers placed in the same virtual world. We discuss how caches can be utilized on an effect-basis and demonstrate that a large amount of computations can be saved as the number of viewers in a scene increases. Caches can easily be set up for various effects, including ambient occlusion, direct illumination, and diffuse global illumination. Our results underline that the image quality using cached rendering is on par with screen-space rendering and due to its simplicity and inherent coherence, cached rendering may even have advantages in single viewer setups. Analyzing the runtime and communication costs, we show that cached rendering is already viable in multi-GPU systems. Building on top of our research, cloud-native rendering may be just around the corner.	https://dl.acm.org/doi/abs/10.1145/3592431	Alexander Weinrauch, Wolfgang Tatzgern, Pascal Stadlbauer, Alexis Crickx, Jozef Hladky, Arno Coomans, Martin Winter, Joerg H. Mueller, Markus Steinberger
Efficient Embeddings in Exact Arithmetic	We provide a set of tools for generating planar embeddings of triangulated topological spheres. The algorithms make use of Schnyder labelings and realizers. A new representation of the realizer based on dual trees leads to a simple linear time algorithm mapping from weights per triangle to barycentric coordinates and, more importantly, also in the reverse direction. The algorithms can be implemented so that all coefficients involved are 1 or -1. This enables integer computation, making all computations exact. Being a Schnyder realizer, mapping from positive triangle weights guarantees that the barycentric coordinates form an embedding. The reverse direction enables an algorithm for fixing flipped triangles in planar realizations, by mapping from coordinates to weights and adjusting the weights (without forcing them to be positive). In a range of experiments, we demonstrate that all algorithms are orders of magnitude faster than existing robust approaches.	https://dl.acm.org/doi/abs/10.1145/3592445	Ugo Finnendahl, Dimitrios Bogiokas, Pablo Robles Cervantes, Marc Alexa
Efficient Rendering of Glossy Materials by Interpolating Prefiltered Environment Maps based on Primary Normals	We propose a method to improve the speed of the rendering of glossy surfaces including anisotropy reflection, using prefiltering. The key idea is to prefilter an environment light map for multiple primary normals. Furthermore, we propose an interpolation method to smoothly connect the boundaries generated by switching multiple prefiltered environment maps. As a result, we are able to render objects with glossy surface more accurately even in real-time.	https://dl.acm.org/doi/abs/10.1145/3588028.3603659	Shunya Motegi, Takuya Funatomi, Yasuhiro Mukaigawa, Aki Takayanagi, Hayato Kikuta, Hiroyuki Kubo
EgoLocate: Real-time Motion Capture, Localization, and Mapping with Sparse Body-mounted Sensors	Human and environment sensing are two important topics in Computer Vision and Graphics. Human motion is often captured by inertial sensors, while the environment is mostly reconstructed using cameras. We integrate the two techniques together in EgoLocate, a system that simultaneously performs human motion capture (mocap), localization, and mapping in real time from sparse body-mounted sensors, including 6 inertial measurement units (IMUs) and a monocular phone camera. On one hand, inertial mocap suffers from large translation drift due to the lack of the global positioning signal. EgoLo-cate leverages image-based simultaneous localization and mapping (SLAM) techniquesto locate the human in the reconstructed scene. Onthe other hand, SLAM often fails when the visual feature is poor. EgoLocate involves inertial mocap to provide a strong prior for the camera motion. Experiments show that localization, a key challenge for both two fields, is largely improved by our technique, compared with the state of the art of the two fields. Our codes are available for research at https://xinyu-yi.github.io/EgoLocate/.	https://dl.acm.org/doi/abs/10.1145/3592099	Xinyu Yi, Yuxiao Zhou, Marc Habermann, Vladislav Golyanik, Shaohua Pan, Christian Theobalt, Feng Xu
Elementary Paper Animatronics	Paper Animatronics is a new way for elementary school kids to engage with subject matter through project-based learning. We're upgrading the classic shoe box diorama, and empowering kids to bring it to life by adding servo motors, sound and lights to create compelling characters and shows. In this workshop designed for teachers, parents and other advocates for creative education, you will get to work hands-on with our new paper animatronics kits. These make it easy to create talking characters that you can voice in real-time or use in more complex, scripted shows where things move and light up on cue using a synchronized Arduino program. Through these activities, you will see how kids learn to be creative across both technical and artistic disciplines as they explore class subject matter.	https://dl.acm.org/doi/abs/10.1145/3588029.3599744	Paul H. Dietz
Encoder-based Domain Tuning for Fast Personalization of Text-to-Image Models	Text-to-image personalization aims to teach a pre-trained diffusion model to reason about novel, user provided concepts, embedding them into new scenes guided by natural language prompts. However, current personalization approaches struggle with lengthy training times, high storage requirements or loss of identity. To overcome these limitations, we propose an encoder-based approach. Our key insight is that by on a large set of concepts from a given domain, we can improve generalization and create a model that is more amenable to quickly adding novel concepts from the same domain. Specifically, we employ two components: First, an encoder that takes as an input a single image of a target concept from a given domain, a specific face, and learns to map it into a word-embedding representing the concept. Second, a set of regularized weight-offsets for the text-to-image model that learn how to effectively injest additional concepts. Together, these components are used to guide the learning of unseen concepts, allowing us to personalize a model using only a single image and as few as 5 training steps --- accelerating personalization from dozens of minutes to , while preserving quality. Code and trained encoders will be available at our project page.	https://dl.acm.org/doi/abs/10.1145/3592133	Rinon Gal, Moab Arar, Yuval Atzmon, Amit H. Bermano, Gal Chechik, Daniel Cohen-Or
End-to-end Procedural Material Capture with Proxy-Free Mixed-Integer Optimization	Node-graph-based procedural materials are vital to 3D content creation within the computer graphics industry. Leveraging the expressive representation of procedural materials, artists can effortlessly generate diverse appearances by altering the graph structure or node parameters. However, manually reproducing a specific appearance is a challenging task that demands extensive domain knowledge and labor. Previous research has sought to automate this process by converting artist-created material graphs into differentiable programs and optimizing node parameters against a photographed material appearance using gradient descent. These methods involve implementing differentiable filter nodes [Shi et al. 2020] and training differentiable neural proxies for generator nodes to optimize continuous and discrete node parameters [Hu et al. 2022a] jointly. Nevertheless, Neural Proxies exhibits critical limitations, such as long training times, inaccuracies, fixed resolutions, and confined parameter ranges, which hinder their scalability towards the broad spectrum of production-grade material graphs. These constraints fundamentally stem from the absence of faithful and efficient implementations of generic noise and pattern generator nodes, both differentiable and non-differentiable. Such deficiency prevents the direct optimization of continuous and discrete generator node parameters without relying on surrogate models. We present , an improved differentiable procedural material library, along with a fully-automated, end-to-end procedural material capture framework that combines gradient-based optimization and gradient-free parameter search to match existing production-grade procedural materials against user-taken flash photos. Diffmat v2 expands the range of differentiable material graph nodes in Diffmat [Shi et al. 2020] by adding generic noise/pattern generator nodes and user-customizable per-pixel filter nodes. This allows for the complete translation and optimization of procedural materials across various categories without the need for external proprietary tools or pre-cached noise patterns. Consequently, our method can capture a considerably broader array of materials, encompassing those with highly regular or stochastic geometries. We demonstrate that our end-to-end approach yields a closer match to the target than MATch [Shi et al. 2020] and Neural Proxies [Hu et al. 2022a] when starting from initially unmatched continuous and discrete parameters.	https://dl.acm.org/doi/abs/10.1145/3592132	Beichen Li, Liang Shi, Wojciech Matusik
Eventfulness for Interactive Video Alignment	Humans are remarkably sensitive to the alignment of visual events with other stimuli, which makes synchronization one of the hardest tasks in video editing. A key observation of our work is that most of the alignment we do involves salient localizable events that occur sparsely in time. By learning how to recognize these events, we can greatly reduce the space of possible synchronizations that an editor or algorithm has to consider. Furthermore, by learning descriptors of these events that capture additional properties of visible motion, we can build active tools that adapt their notion of eventfulness to a given task as they are being used. Rather than learning an automatic solution to one specific problem, our goal is to make a much broader class of interactive alignment tasks significantly easier and less time-consuming. We show that a suitable visual event descriptor can be learned entirely from stochastically-generated synthetic video. We then demonstrate the usefulness of learned and adaptive eventfulness by integrating it in novel interactive tools for applications including audio-driven time warping of video and the extraction and application of sound effects across different videos.	https://dl.acm.org/doi/abs/10.1145/3592118	Jiatian Sun, Longxiulin Deng, Triantafyllos Afouras, Andrew Owens, Abe Davis
Evolutionary Piecewise Developable Approximations	We propose a novel method to compute high-quality piecewise developable approximations for triangular meshes. Central to our approach is an evolutionary genetic algorithm for optimizing the combinatorial and discontinuous fitness function, including the approximation error, the number of patches, the patch boundary length, and the penalty for small patches and narrow regions within patches. The genetic algorithm's operations (i.e., initialization, selection, mutation, and crossover) are explicitly designed to minimize the fitness function. The main challenge is evaluating the fitness function's approximation error as it requires developable patches, which are difficult or time-consuming to obtain. Resolving the challenge is based on a critical observation: the approximation error and the mapping distortion between an input surface and its developable approximation are positively correlated empirically. To efficiently measure distortion without explicitly generating developable shapes, we creatively use conformal mapping techniques. Then, we control the mapping distortion at a relatively low level to achieve high shape similarity in the genetic algorithm. The feasibility and effectiveness of our method are demonstrated over 240 complex examples. Compared with the state-of-the-art methods, our results have much smaller approximation errors, fewer patches, shorter patch boundaries, and fewer small patches and narrow regions.	https://dl.acm.org/doi/abs/10.1145/3592140	Zheng-Yu Zhao, Mo Li, Zheng Zhang, Qing Fang, Ligang Liu, Xiao-Ming Fu
