title	abstract	url	authors
 displays	A key challenge of volumetric displays is presenting a 3D scene as if naturally existed in the physical space. However, the displayable scenes are limited because current volumetric displays do not have a substantial depth reconstruction capability to show scenes with significant depth. In this talk, we propose a dynamic depth compression method that modifies the 3D geometries of presented scenes while considering changes to the spectator's view point such that entire scenes are fitted within a smaller depth range while maintaining the perceptual quality. Extensive depth compression induces a feeling of unnaturalness in viewers, but the results of an evaluation experiment using a volumetric display simulator indicated that a depth of just 10 cm was needed to show scenes that originally had about 50 m without an unacceptable feeling of unnaturalness. We applied our method to a real volumetric display and validated our findings through an additional user study. The results suggest that our method works well as a virtual extender of a volumetric display's depth reconstruction capability, enabling hundreds of times larger depth reconstruction than that of current volumetric displays.	https://dl.acm.org/authorize?N689308	Yamato Miyashita, Yasuhito Sawahata, Miwa Katayama, Kazuteru Komine
 migration	Traditional snapshot hyperspectral imaging systems include various optical elements: a dispersive optical element (prism), a coded aperture, several relay lenses, and an imaging lens, resulting in an impractically large form factor. We seek an alternative, minimal form factor of snapshot spectral imaging based on recent advances in diffractive optical technology. We thereupon present a compact, diffraction-based snapshot hyperspectral imaging method, using only a novel diffractive optical element (DOE) in front of a conventional, bare image sensor. Our diffractive imaging method replaces the common optical elements in hyperspectral imaging with a single optical element. To this end, we tackle two main challenges: First, the traditional diffractive lenses are not suitable for color imaging under incoherent illumination due to severe chromatic aberration because the size of the point spread function (PSF) changes depending on the wavelength. By leveraging this wavelength-dependent property alternatively for hyperspectral imaging, we introduce a novel DOE design that generates an anisotropic shape of the spectrally-varying PSF. The PSF size remains virtually unchanged, but instead the PSF shape rotates as the wavelength of light changes. Second, since there is no dispersive element and no coded aperture mask, the ill-posedness of spectral reconstruction increases significantly. Thus, we propose an end-to-end network solution based on the unrolled architecture of an optimization procedure with a spatial-spectral prior, specifically designed for deconvolution-based spectral reconstruction. Finally, we demonstrate hyperspectral imaging with a fabricated DOE attached to a conventional DSLR sensor. Results show that our method compares well with other state-of-the-art hyperspectral imaging methods in terms of spectral accuracy and spatial resolution, while our compact, diffraction-based spectral imaging method uses only a single optical element on a bare image sensor.	https://dl.acm.org/authorize?N688162	Daniel S. Jeon, Seung-Hwan Baek, Shinyoung Yi, Qiang Fu, Xiong Dun, Wolfgang Heidrich, Min H. Kim
"""Birth of Planet Earth"" fulldome excerpt: photosynthesis in a chromatophore"	Scientific visualization of the energy harvesting process of an early photosynthetic organelle called a chromatophore.	https://dl.acm.org/authorize?N689238	Donna Cox
"""Reality vs illusion"" real-time ray tracing"	"We will discuss how we achieved the goals for the production of Unity's ""Reality vs illusion"" demo, as well as give an overview of using real-time ray tracing technology in a games production pipeline. Our system is built on the insights learned by extending the engine architecture to support realtime ray tracing APIs and incorporating the power of realtime ray tracing to increase realism for resulting renders at interactive 30 fps rendering on high-end consumer hardware. Rendered in real-time, this demo spotlights one real car and another powered by Unity's rendering technology. A real-world car (2019 BMW 8 Series Coupe) was filmed, and then the scene was recreated using the exact camera / lighting conditions in CG. Then we transition the shots from a real-world car to the ray traced car. This shows off some of the effect that we will cover - global reflections, multi-layer transparency with refraction, area lights, shadows, ambient occlusion and more. We will share state-of-the art techniques developed for achieving high-visual quality in real-time rendering with our hybrid ray tracing / rasterization render pipeline, built on top of Unity's high definition rendering pipeline. The presentation will demonstrate the technology developed to extend the original rasterization-based pipeline to provide higher-fidelity rendering through the efficient usage of real-time ray tracing, for example, by rendering primary ray visibility for higher-fidelity materials including multi-layer smooth transparency, describe advanced approaches for shadowed textured realtime area lights, support of dynamic indirect diffuse and specular lighting as well as other global effects, such as ambient occlusion, reflections, and others, taking advantage of ray tracing algorithms and touch on runtime performance, including runtime BVH update."	https://dl.acm.org/authorize?N689123	Natalie Burke, Arisa Scott, Natalya Tatarchuk, Sebastien Lagarde
"""Space Explorers: Life in Orbit"": filming VR in microgravity"	In December 2018, TIME and Felix & Paul Studios launched virtual reality cameras---built to operate in microgravity---to the International Space Station. Since then, filming has documented astronauts from several countries in their daring missions more than 250 miles above Earth, capturing life in space as viewers have never truly seen before, and culminating in the first-ever spacewalk in cinematic virtual reality. Join Felix & Paul Studios, along with collaborators from NASA and the ISS National Lab, as they share insights from one of the most ambitious VR projects ever undertaken. In this production session, we will discuss the background of how this partnership came to be, before diving into the technical challenges of capturing cinematic virtual reality on the ISS. How do you direct a scene in such a tight and constrained place, especially while down on Earth? How can you transfer terabytes of data from the cameras to Mission Control? And finally, what does it take to build and operate cameras that can capture a spacewalk? The team will explore the variety of challenges inherent in such a groundbreaking project, from building a camera that can capture an EVA (extra-vehicular activity) in the extreme environment of space, to tracking and crafting months of astronaut footage into a cohesive episodic narrative. Finally, the team will share never-before-seen early footage from the project.	https://dl.acm.org/authorize?N689205	Sebastian Sylwan, Michael Interbartolo, Liz Warren, Felix Lajeunesse
1Inch VR	Upon discovering the mysterious crystal, the size of the protagonist became smaller. Later, he is chased by the insects, and he starts the adventure...	https://dl.acm.org/authorize?N689367	Seok Nam Koong, Yong Hwan Kim
"2D animation in the VR clouds: the making of disney's ""a kite's tale"""	"The experimental animated virtual reality short ""a kite's tale"" required cgi and hand-drawn characters to interact in a highly art-directed environment made of spectacular clouds. In this talk we'll examine the workflows developed to create the short, with particular emphasis on the integration of hand-drawn animation and performant real-time cloud rendering."	https://dl.acm.org/authorize?N689389	Bruce Wright, Michael Anderson, Angela McBride, Henrik Falt, Daniel Peixe, Tony DeRosa
2nd Step	"""2nd Step"" is a soaring VR journey through space --- accentuated with the beautiful music of Debussy and Ravel --- in which the viewer gets an intense feeling of being in the middle of alien worlds while visiting some of the most thrilling settings of current and future space missions."	https://dl.acm.org/authorize?N689366	Joerg Courtial
360-degree transparent holographic screen display	"We propose a technique for creating a feeling of reality to 2D images. We have succeeded in fabricating a holographic screen with higher transparency and luminance compared to one based on conventional technology. With the combination of a 360-degree transparent holographic screen display and sensing technology using multiple high-speed cameras, the observer gets the feeling that an object is ""actually there"". Fusion of the background and the image increases the feeling of ""floating"" in the image by using a holographic screen, and the multiple highspeed cameras can make the motion parallax image according to the position of the observer in real time. Therefore, the image seems to be located at the center of the cylinder."	https://dl.acm.org/authorize?N688249	Tomoharu Nakamura, Tomoya Yano, Kohki Watanabe, Yui Ishii, Hideki Ono, Ippei Tambata, Nobuki Furue, Yuji Nakahata
3D aerial display with micro mirror array plate and reversed depth integral photography	We propose a new aerial imaging display in which autostereoscopic objects with horizontal and vertical parallax appear as if they are floating in the air. This system operates by displaying an integral photography image in which depth is reversed beforehand and by observing the image from the other side of a micro mirror array.	https://dl.acm.org/doi/abs/abs/10.1145/3306214.3338556	Nahomi Maki, Toshiaki Yamanouchi, Kazuhisa Yanaka
3D printing for mixed reality hands-on museum exhibit interaction	This work presents a combination of 3D printing with mixed reality to use the results in the context of museum exhibitions or for cultural heritage. While now priceless artefacts are encased in glass, kept safe and out of reach of the visitors, we present a new pipeline which would allow visitors hands-on interaction with realistic 3D printed replicas of the artefacts which are then digitally augmented to have the genuine artefacts' appearances.	https://dl.acm.org/doi/abs/abs/10.1145/3306214.3338609	Laura Mann, Oleg Fryazinov
A Kite's Tale	"Walt Disney Animation Studios presents ""a kite's tale,"" an experimental animated short combining classic hand-drawn animation with virtual reality. A kite with the spirit of a playful puppy tangles with a pompous dragon-kite in a short that brings the audience into a breathtaking world."	https://dl.acm.org/authorize?N689365	Bruce Wright
A Monte Carlo framework for rendering speckle statistics in scattering media	We present a Monte Carlo rendering framework for the physically-accurate simulation of speckle patterns arising from volumetric scattering of coherent waves. These noise-like patterns are characterized by strong statistical properties, such as the so-called memory effect. These properties are at the core of imaging techniques for applications as diverse as tissue imaging, motion tracking, and non-line-of-sight imaging. Our rendering framework can replicate these properties computationally, in a way that is orders of magnitude more efficient than alternatives based on directly solving the wave equations. At the core of our framework is a path-space formulation for the covariance of speckle patterns arising from a scattering volume, which we derive from first principles. We use this formulation to develop two Monte Carlo rendering algorithms, for computing speckle covariance as well as directly speckle fields. While approaches based on wave equation solvers require knowing the microscopic position of wavelength-sized scatterers, our approach takes as input only bulk parameters describing the statistical distribution of these scatterers inside a volume. We validate the accuracy of our framework by comparing against speckle patterns simulated using wave equation solvers, use it to simulate memory effect observations that were previously only possible through lab measurements, and demonstrate its applicability for computational imaging tasks.	https://dl.acm.org/authorize?N688084	Chen Bar, Marina Alterman, Ioannis Gkioulekas, Anat Levin
A compact retinal scan near-eye display	A compact full color laser beam scanning (LBS)-based Augmented Reality (AR) near-eye display has been developed. By the unique relay optical system adopting a novel holographic grating to compensate the color dispersion of holographic image combiner in front of the eye, we have achieved high resolution (1280x720p), large field of view (47degree diagonal), high transparency (over 85%) and hand-held miniaturization. The prototype implemented only two connectors of USB Type-C and HDMI Type-D to supply power and video signal of HDMI interface respectively from small control box using two cables.	https://dl.acm.org/authorize?N688240	Katsuyuki Akutsu, Susumu Seino, Yusuke Ogawa, Kenji Ohki, Atsushi Takahashi, Daisuke Ueda, Ryo Ogawa, Teppei Imamura, Akira Yoshikaie
A data-driven compression method for transient rendering	Monte Carlo methods for transient rendering have become a powerful instrument to generate reliable data in transient imaging applications, either for benchmarking, analysis, or as a source for data-driven approaches. However, due to the increased dimensionality of time-resolved renders, storage and data bandwidth are significant limiting constraints, where a single time-resolved render of a scene can take several hundreds of megabytes. In this work we propose a learning-based approach that makes use of deep encoder-decoder architectures to learn lower-dimensional feature vectors of time-resolved pixels. We demonstrate how our method is capable of compressing transient renders up to a factor of 32, and recover the full transient profile making use of a decoder. Additionally, we show how our learned features significantly mitigate variance on the recovered signal, addressing one of the pathological problems in transient rendering.	https://dl.acm.org/doi/abs/abs/10.1145/3306214.3338582	Yun Liang, Mingqin Chen, Zesheng Huang, Diego Gutierrez, Adolfo Muñoz, Julio Marco
A dataset for benchmarking time-resolved non-line-of-sight imaging	Time-resolved imaging has made it possible to by exploiting information from diffuse light bounces. While there have been successive improvements in the field since its conception, so far it has only been proven to work in very simple and controlled scenarios. We present a public dataset of synthetic time-resolved Non-Line-of-Sight (NLOS) scenes with varied complexity aimed at benchmarking reconstructions. It includes scenes that are common in the real world but remain a challenge for NLOS reconstruction methods due to the ambiguous nature of higher-order diffuse bounces naturally occurring in them. With over 300 reconstructible scenes, the dataset contains an order of magnitude more scenes than what is available currently. The final objective of the dataset it to boost NLOS research to take it closer to its real-world applications.	https://dl.acm.org/doi/abs/abs/10.1145/3306214.3338583	Miguel Galindo, Julio Marco, Matthew O'Toole, Gordon Wetzstein, Diego Gutierrez, Adrian Jarabo
A deep dive into universal scene description and hydra	Physics-based animation has emerged as a core area of computer graphics finding widespread application in the film and video game industries as well as in areas such as virtual surgery, virtual reality, and training simulations. This course introduces students and practitioners to fundamental concepts in physics-based animation, placing an emphasis on breadth of coverage and providing a foundation for pursuing more advanced topics and current research in the area. The course focuses on imparting practical knowledge and intuitive understanding rather than providing detailed derivations of the underlying mathematics. The course is suitable for someone with no background in physics-based animation---the only prerequisites are basic calculus, linear algebra, and introductory physics. We begin with a simple, and complete, example of a mass-spring system, introducing the principles behind physics-based animation: mathematical modeling and numerical integration. From there, we systematically present the mathematical models commonly used in physics-based animation beginning with Newton's laws of motion and conservation of mass, momentum, and energy. We then describe the underlying physical and mathematical models for animating rigid bodies, soft bodies, and fluids. Then we describe how these continuous models are discretized in space and time, covering Lagrangian and Eulerian formulations, spatial discretizations and interpolation, and explicit and implicit time integration. In the final section, we discuss commonly used constraint formulations and solution methods.	https://dl.acm.org/authorize?N689269	George Elkoura, Sebastian Grassia, Sunya Boonyatera, Alex Mohr, Pol Jeremias-Vila, Matt Kuruc
A design for optical cloaking display	In the graphics research context, optical cloaking that hides an object by relaying a light field is also a kind of display. Despite much interest in the cloaking, large-size cloaking has not been achieved without some limitations and/or assumptions. To solve this problem, a computational design method is proposed for an optical cloaking display via viewpoint transformation. The method uses two kinds of passive optical elements that transfer a point into a plane symmetric point. In the experiments, a novel passive display was developed that optically cloaks the object and transmits a light field properly. Experimental results for the multiviewpoint scene that was captured are presented.	https://dl.acm.org/authorize?N688241	Takahito Aoto, Yuta Itoh, Kazuki Otao, Kazuki Takazawa, Yoichi Ochiai
A formal process to design visual archetypes based on character taxonomies	"While there are many professional examples of successful character designs, there seems to be little academic formalization in standardizing a process to achieve consistent visual results. In this work, we present such a formal process to construct visual designs for character archetypes that are given by ""verbal descriptions"". This process is based on visual semiotics that are used for creating clear meaning behind design choices while still retaining a sense of aesthetic through principles of artistic design. Using this process, we have developed a set of encyclopedic references for a wide variety of psychology and literary archetypes to demonstrate the power of this approach. We also used this process successfully in a visual storytelling class."	https://dl.acm.org/doi/abs/abs/10.1145/3306214.3338579	Angela Wang, Anthony Dalton Eason, Ergun Akleman
A learned shape-adaptive subsurface scattering model	In this paper, we introduce BiMocq , an unconditionally stable, pure Eulerianbased advection scheme to efficiently preserve the advection accuracy of all physical quantities for long-term fluid simulations. Our approach is built upon the method of characteristic mapping (MCM). Instead of the costly evaluation of the temporal characteristic integral, we evolve the mapping function itself by solving an advection equation for the mappings. Dual mesh characteristics (DMC) method is adopted to more accurately update the mapping. Furthermore, to avoid visual artifacts like instant blur and temporal inconsistency introduced by re-initialization, we introduce multi-level mapping and back and forth error compensation. We conduct comprehensive 2D and 3D benchmark experiments to compare against alternative advection schemes. In particular, for the vortical flow and level set experiments, our method outperforms almost all state-of-art hybrid schemes, including FLIP, PolyPic and Particle-Level-Set, at the cost of only two Semi-Lagrangian advections. Additionally, our method does not rely on the particle-grid transfer operations, leading to a highly parallelizable pipeline. As a result, more than 45× performance acceleration can be achieved via even a straightforward porting of the code from CPU to GPU.	https://dl.acm.org/authorize?N688173	Ziyin Qu, Xinxin Zhang, Ming Gao, Chenfanfu Jiang, Baoquan Chen
A look into five years of locomotion in virtual reality	Survios, a virtual reality (VR) game developer dedicated to building active, immersive experiences that push the limits of VR innovation, developed a range of proprietary locomotion systems in VR to solve for simulator sickness and immersive gameplay.	https://dl.acm.org/authorize?N689374	Alex Silkin
A low-discrepancy sampler that distributes monte carlo errors as a blue noise in screen space	An image-space hierarchy is introduced to reduce artifacts from prematurely stopping in adaptive sampling in a Monte Carlo ray tracing context, while maintaining good performance and fitting into an existing sampling architecture.	https://dl.acm.org/authorize?N689332	Keith Jeffery
A method for rectifying inclination of panoramic images	We propose a method for transforming inclined panoramic images into upright posture as if they were captured up straight. The method rectifies images automatically using neither additional information nor external instructions, while it enables panoramic images of both indoor and outdoor scenes to stand upright robustly. It helps unskilled people to make high quality panoramic images used for widespread applications including city navigation and real estate easier.	https://dl.acm.org/doi/abs/abs/10.1145/3306214.3338558	Naoki Kawai
A null-scattering path integral formulation of light transport	Unbiased rendering of general, heterogeneous participating media currently requires using null-collision approaches for estimating transmittance and generating free-flight distances. A long-standing limitation of these approaches, however, is that the corresponding path pdfs cannot be computed due to the black-box nature of the null-collision rejection sampling process. These techniques therefore cannot be combined with other sampling techniques via multiple importance sampling (MIS), which significantly limits their robustness and generality. Recently, Galtier et al. [2013] showed how to derive these algorithms directly from the radiative transfer equation (RTE). We build off this generalized RTE to derive a formulation of null scattering, which reveals the sampling pdfs and allows us to devise new, express existing, and combine complementary unbiased techniques via MIS. We demonstrate the practicality of our theory by combining, for the first time, several path sampling techniques in spatially and spectrally varying media, generalizing and outperforming the prior state of the art.	https://dl.acm.org/authorize?N688099	Bailey Miller, Iliyan Georgiev, Wojciech Jarosz
A portal for managing reviews and beyond	In order to meet the rapidly evolving needs of the VFX industry, studios need to be able to adapt and upgrade quickly. However, the infrastructure stack at most companies is complex, usually set up over a number of years with significant customizations and proprietary software. Maintaining this stack requires dedicated teams. Upgrades can take months and are usually fraught with risk. The engineering team at MPC drastically reduced this time to deployment from months to a few days by using cloud native solutions. Built on a foundation of microservices, the infrastructure stack provides an asset management system, storage, sync and compute capabilities. Within the first year it was deployed across two sites in different timezones, supporting up to 200 artists. Thus proving the ability for VFX studios to scale rapidly.	https://dl.acm.org/authorize?N689312	Natasha Kelkar
A practical guide to thin film and drips simulation	The environments of are immersed in waterfalls, from lush Nordic islands to mysterious, submerged kingdoms of lakes and crystals. Because of the variety and complexity of these sets (about 4000 waterfalls had to be created), a traditional approach would have consumed too many artistic and rendering resources. We decided to develop a collection of tools named with a few goals in mind: streamlining the creative process by minimizing the time spent on simulations, iterating faster thanks to real-time feedback, and managing the large quantity of generated data. Using this system, artists were able to create all the water elements of an environment set, from misty calderas to foamy, aerated ponds.	https://dl.acm.org/authorize?N689346	Baptiste Van Opstal, Youxi Woo, Amaury Aubel
A procedural approach to creating second empire houses	In this work, we present a procedural approach to capture a variety of appearances of American Second Empire houses. To develop this procedural approach, we have identified the set of rules and similarities of Second Empire houses. Our procedural approach, therefore, captures the style differences of Second Empire houses with a relatively few numbers of parameters. Using our interface, we are able to generate virtual houses in a wide variety of styles of American Second Empire architecture. We have also developed a method to break up these virtual models into slices in order to efficiently and economically 3D print them. Using this approach we have created miniatures of two landmark buildings: the Hamilton-Turner Inn in Savannah and the Enoch Pratt House in Baltimore. Note that the virtual models still provide more details because of the limited resolution of 3D printing processes.	https://dl.acm.org/doi/abs/abs/10.1145/3306214.3338549	Madison Kramer, Ergun Akleman
