title	abstract	url	authors
"""F O R M S"" - Creating new visual perceptions of dance movement through machine learning"	"""FORMS"" is a new digital art concept that combines the fields of dance movement and machine learning techniques, specifically human pose detection, to create a real-time and interactive visual experience. This project aims to explore the relationship between dance and visual art by creating a framework that generates abstract and literal visual models from the dancers' movements. The main objective of this project is to enhance the perception of dance movement by providing a new layer of visual composition. The proposed framework provides different visual forms based on human pose detection, creating a novel and real-time visual expression of the dance movement. The human pose detection model used in this project is based on state-of-the-art deep learning techniques, which analyze the positions and movements of different parts of the human body in real-time. This model allows the framework to capture movements of the dancers and translate them into unique visual forms. The case study showcases the potential of ""FORMS"" by demonstrating how professional young dancers can use the framework to enrich their performance and create new visual perceptions of dance movement. This study contributes to the cultivation of body awareness, understanding of the dance movement and overall enrichment of the art experience. The use of machine learning techniques showcases the potential of technology to enhance and expand the boundaries of artistic expression. The ""FORMS"" project is a novel and interdisciplinary approach that bridges the fields of art and technology, providing a new way to experience and perceive the dance movement."	https://dl.acm.org/doi/abs/10.1145/3588028.3603673	Maria Rita Nogueira, João Braz Simões, Paulo Menezes
3D Character Motion Authoring From Temporally-Sparse Photos	This paper presents a neural network-based learning approach that enables seamless generation of 3D human motion in-between photos to accelerate the process of 3D character motion authoring. This new approach allows users to freely edit (replace, insert, or delete) input photos and specify the transition length to generate a kinematically coherent sequence of 3D human poses and shapes in-between the given photos. We demonstrate through qualitative and subjective evaluations that our approach is capable of generating high-fidelity, natural 3D pose and shape transitions.	https://dl.acm.org/doi/abs/10.1145/3588028.3603656	Jen-Chun Lin, Wen-Li Wei
3D Gaussian Splatting for Real-Time Radiance Field Rendering	Radiance Field methods have recently revolutionized novel-view synthesis of scenes captured with multiple photos or videos. However, achieving high visual quality still requires neural networks that are costly to train and render, while recent faster methods inevitably trade off speed for quality. For unbounded and complete scenes (rather than isolated objects) and 1080p resolution rendering, no current method can achieve real-time display rates. We introduce three key elements that allow us to achieve state-of-the-art visual quality while maintaining competitive training times and importantly allow high-quality real-time (≥ 30 fps) novel-view synthesis at 1080p resolution. First, starting from sparse points produced during camera calibration, we represent the scene with 3D Gaussians that preserve desirable properties of continuous volumetric radiance fields for scene optimization while avoiding unnecessary computation in empty space; Second, we perform interleaved optimization/density control of the 3D Gaussians, notably optimizing anisotropic covariance to achieve an accurate representation of the scene; Third, we develop a fast visibility-aware rendering algorithm that supports anisotropic splatting and both accelerates training and allows realtime rendering. We demonstrate state-of-the-art visual quality and real-time rendering on several established datasets.	https://dl.acm.org/doi/abs/10.1145/3592433	Bernhard Kerbl, Georgios Kopanas, Thomas Leimkuehler, George Drettakis
3DShape2VecSet: A 3D Shape Representation for Neural Fields and Generative Diffusion Models	We introduce 3DShape2VecSet, a novel shape representation for neural fields designed for generative diffusion models. Our shape representation can encode 3D shapes given as surface models or point clouds, and represents them as neural fields. The concept of neural fields has previously been combined with a global latent vector, a regular grid of latent vectors, or an irregular grid of latent vectors. Our new representation encodes neural fields on top of a set of vectors. We draw from multiple concepts, such as the radial basis function representation, and the cross attention and self-attention function, to design a learnable representation that is especially suitable for processing with transformers. Our results show improved performance in 3D shape encoding and 3D shape generative modeling tasks. We demonstrate a wide variety of generative applications: unconditioned generation, category-conditioned generation, text-conditioned generation, point-cloud completion, and image-conditioned generation. Code: https://1zb.github.io/3DShape2VecSet/.	https://dl.acm.org/doi/abs/10.1145/3592442	Biao Zhang, Jiapeng Tang, Matthias Nießner, Peter Wonka
50 Years of Changes–How to Brace Yourself!: SIGGRAPH 2023 Retrospective Panel	Having lived through the 50 years of changes, the panelists attempt to put them in calibrated perspective, not merely for the sake of fond reminiscence–and fun!–but as a guide to those who face the looming future changes.	https://dl.acm.org/doi/abs/10.1145/3587422.3597996	James F. Blinn, James D. Foley, Donald P. Greenberg, Alvy Ray Smith, Andries van Dam, John Turner Whitted
A Calling. From the Desert. To the Sea	Fearing that her younger sister will be wed off Just like she was, Ahlam lures Yasmin to run away with her by telling a story of a mythical sea that lies beyond the desolate desert and its mountains. Yasmin's childish curiosity overturns her father's apprehension and his warnings of the monster that resides beyond the borders of their house. In-search of this mystical sea, the two sisters journey away far from their home, predetermined fate and secluded life with their father. Along the way, young Yasmin is forced to face her inner demons and further her understanding of the world she lives in.	https://dl.acm.org/doi/abs/10.1145/3577024.3588640	Murad Abu Eisheh, Mario Bertsch
A Contact Proxy Splitting Method for Lagrangian Solid-Fluid Coupling	We present a robust and efficient method for simulating Lagrangian solid-fluid coupling based on a new operator splitting strategy. We use variational formulations to approximate fluid properties and solid-fluid interactions, and introduce a unified two-way coupling formulation for SPH fluids and FEM solids using interior point barrier-based frictional contact. We split the resulting optimization problem into a fluid phase and a solid-coupling phase using a novel time-splitting approach with augmented , and propose efficient custom linear solvers. Our technique accounts for fluids interaction with nonlinear hyperelastic objects of different geometries and codimensions, while maintaining an algorithmically guaranteed non-penetrating criterion. Comprehensive benchmarks and experiments demonstrate the efficacy of our method.	https://dl.acm.org/doi/abs/10.1145/3592115	Tianyi Xie, Minchen Li, Yin Yang, Chenfanfu Jiang
A Demonstration of Morphing Identity: Exploring Self-Other Identity Continuum through Interpersonal Facial Morphing	We explored continuous changes in self-other identity by designing an interpersonal facial morphing experience where the facial images of two users are blended and then swapped over time. To explore this with diverse social relationships, we conducted qualitative and quantitative investigations through public exhibitions. We found that there is a window of self-identification as well as a variety of interpersonal experiences in the facial morphing process. From these insights, we synthesized a Self-Other Continuum represented by a sense of agency and facial identity. This continuum has implications in terms of the social and subjective aspects of interpersonal communication, which enables further scenario design and could complement findings from research on interactive devices for remote communication.	https://dl.acm.org/doi/abs/10.1145/3588037.3595394	Kye Shimizu, Santa Naruse, Jun Nishida, Shunichi Kasahara
A Full-Wave Reference Simulator for Computing Surface Reflectance	Computing light reflection from rough surfaces is an important topic in computer graphics. Reflection models developed based on geometric optics fail to capture wave effects such as diffraction and interference, while existing models based on physical optics approximations give erroneous predictions under many circumstances (e.g. when multiple scattering from the surface cannot be ignored). We present a scalable 3D full-wave simulator for computing reference solutions to surface scattering problems, which can be used to evaluate and guide the development of approximate models for rendering. We investigate the range of validity for some existing wave optics based reflection models; our results confirm these models for low-roughness surfaces but also show that prior rendering methods do not accurately predict the scattering behavior of some types of surfaces. Our simulator is based on the boundary element method (BEM) and accelerated using the adaptive integral method (AIM), and is implemented to execute on modern GPUs. We demonstrate the simulator on domains up to 60 × 60 × 10 wavelengths, involving surface samples with significant height variations. Furthermore, we propose a new system for efficiently computing BRDF values for large numbers of incident and outgoing directions at once, by combining small simulations to characterize larger areas. Our simulator will be released as an open-source toolkit for computing surface scattering.	https://dl.acm.org/doi/abs/10.1145/3592414	Yunchen Yu, Mengqi Xia, Bruce Walter, Eric Michielssen, Steve Marschner
A Gentle Introduction to ReSTIR Path Reuse in Real-Time	"In recent years, reservoir-based spatiotemporal importance resampling (ReSTIR) algorithms appeared out of nowhere to take parts of the realtime rendering community by storm, with sample reuse speeding direct lighting from millions of dynamic lights [1], diffuse multi-bounce lighting [2], participating media [3], and even complex global illumination paths [4]. Highly optimized variants (e.g. [5]) can give 100x efficiency improvement over traditional ray- and path-tracing methods; this is key to achieve 30 or 60 Hz framerates. In production engines, tracing even one ray or path per pixel may only be feasible on the highest-end systems, so maximizing image quality per sample is vital. ReSTIR builds on the math in Talbot et al.'s [6] resampled importance sampling (RIS), which previously was not widely used or taught, leaving many practitioners missing key intuitions and theoretical grounding. A firm grounding is vital, as seemingly obvious ""optimizations"" arising during ReSTIR engine integration can silently introduce conditional probabilities and dependencies that, left ignored, add uncontrollable bias to the results. In this course, we plan to: 1. Provide concrete motivation and intuition for why ReSTIR works, where it applies, what assumptions it makes, and the limitations of today's theory and implementations; 2. Gently develop the theory, targeting attendees with basic Monte Carlo sampling experience but without prior knowledge of resampling algorithms (e.g., Talbot et al. [6]); 3. Give explicit algorithmic samples and pseudocode, pointing out easily-encountered pitfalls when implementing ReSTIR; 4. Discuss actual game integrations, highlighting the gotchas, challenges, and corner cases we encountered along the way, and highlighting ReSTIR's practical benefits."	https://dl.acm.org/doi/abs/10.1145/3587423.3595511	Chris Wyman, Markus Kettunen, Daqi Lin, Benedikt Bitterli, Cem Yuksel, Wojciech Jarosz, Pawel Kozlowski
A Practical Walk-on-Boundary Method for Boundary Value Problems	We introduce the (WoB) method for solving boundary value problems to computer graphics. WoB is a grid-free Monte Carlo solver for certain classes of second order partial differential equations. A similar Monte Carlo solver, the walk-on-spheres (WoS) method, has been recently popularized in computer graphics due to its advantages over traditional spatial discretization-based alternatives. We show that WoB's intrinsic properties yield further advantages beyond those of WoS. Unlike WoS, WoB naturally supports various boundary conditions (Dirichlet, Neumann, Robin, and mixed) for both interior and exterior domains. WoB builds upon boundary integral formulations, and it is mathematically more similar to light transport simulation in rendering than the random walk formulation of WoS. This similarity between WoB and rendering allows us to implement WoB on top of Monte Carlo ray tracing, and to incorporate advanced rendering techniques (e.g., bidirectional estimators with multiple importance sampling, the virtual point lights method, and Markov chain Monte Carlo) into WoB. WoB does not suffer from the intrinsic bias of WoS near the boundary and can estimate solutions precisely on the boundary. Our numerical results highlight the advantages of WoB over WoS as an attractive alternative to solve boundary value problems based on Monte Carlo.	https://dl.acm.org/doi/abs/10.1145/3592109	Ryusuke Sugimoto, Terry Chen, Yiti Jiang, Christopher Batty, Toshiya Hachisuka
A Practical Wave Optics Reflection Model for Hair and Fur	Traditional fiber scattering models, based on ray optics, are missing some important visual aspects of fiber appearance. Previous work [Xia et al. 2020] on wave scattering from ideal extrusions demonstrated that diffraction produces strong forward scattering and colorful effects that are missing from ray-based models. However, that work was unable to include some important surface characteristics such as surface roughness and tilted cuticle scales, which are known to be important for fiber appearance. In this work, we take an important step to study wave effects from rough fibers with arbitrary 3D microgeometry. While the full-wave simulation of realistic 3D fibers remains intractable, we developed a 3D wave optics simulator based on a physical optics approximation, using a GPU-based hierarchical algorithm to greatly accelerate the calculation. It simulates surface reflection and diffractive scattering, which are present in all fibers and typically dominate for darkly pigmented fibers. The simulation provides a detailed picture of first order scattering, but it is not practical to use for production rendering as this would require tabulation per fiber geometry. To practically handle geometry variations in the scene, we propose a model based on wavelet noise, capturing the important statistical features in the simulation results that are relevant for rendering. Both our simulation and practical model show similar granular patterns to those observed in optical measurement. Our compact noise model can be easily combined with existing scattering models to render hair and fur of various colors, introducing visually important colorful glints that were missing from all previous models.	https://dl.acm.org/doi/abs/10.1145/3592446	Mengqi Xia, Bruce Walter, Christophe Hery, Olivier Maury, Eric Michielssen, Steve Marschner
A Proposal of Acquiring and Analyzing Method for Distributed Litter on the Street using Smartphone Users as Passive Mobility Sensors	With increased environmental protection activities, smartphone-enabled cleaning activities to deter street littering are gaining attention. We propose a method to analyze litter-on-road images captured by a smartphone camera mounted on a bicycle for users who do not require conscious care (Fig. 1). First, the user mounts the smartphone on a bicycle and starts the developed application, which creates a still image by capturing videos. The still images were then categorized using machine learning, and the type of trash was annotated in the images. Finally, to predict the distribution of trash, the probability of its influence on the environment, such as convenience stores and bars, was calculated using the machine learning model. This paper discusses our developed system's efficacy for acquiring and analyzing methods on the road. As a fast effort, we verify the accuracy of tagging PET bottles, cans, food trays, and masks using a learning model generated by Detectron2.	https://dl.acm.org/doi/abs/10.1145/3588028.3603684	Hikaru Hagura, Ryuta Yamaguchi, Tomoki Yoshihisa, Shinji Shimojo, Yukiko Kawai
A Software-Agnostic Small Studio and Education Pipeline	Building a production pipeline from scratch that supports iteration and creative control, for a university or small studio, can be difficult to achieve with smaller budgets and major time constraints. We developed a USD pipeline that allows our production to work seamlessly between multiple production software packages, playing to the strengths of each. With these tools, we were able to build our entire animation pipeline in just months and adapt it on the fly to the needs of our production. This pipeline also allowed artists to choose different software based on the strength of each package, all while referencing the same asset and layout files.	https://dl.acm.org/doi/abs/10.1145/3587424.3595578	Zach Wood, Anna Hales, Seth Holladay, Craig Van Dyke, Matt Minson
A Temporal Coherent Topology Optimization Approach for Assembly Planning of Bespoke Frame Structures	We present a computational framework for planning the assembly sequence of bespoke frame structures. Frame structures are one of the most commonly used structural systems in modern architecture, providing resistance to gravitational and external loads. Building frame structures requires traversing through several partially built states. If the assembly sequence is planned poorly, these partial assemblies can exhibit substantial deformation due to self-weight, slowing down or jeopardizing the assembly process. Finding a good assembly sequence that minimizes intermediate deformations is an interesting yet challenging combinatorial problem that is usually solved by heuristic search algorithms. In this paper, we propose a new optimization-based approach that models sequence planning using a series of topology optimization problems. Our key insight is that enforcing temporal coherent constraints in the topology optimization can lead to sub-structures with small deformations while staying consistent with each other to form an assembly sequence. We benchmark our algorithm on a large data set and show improvements in both performance and computational time over greedy search algorithms. In addition, we demonstrate that our algorithm can be extended to handle assembly with static or dynamic supports. We further validate our approach by generating a series of results in multiple scales, including a real-world prototype with a mixed reality assistant using our computed sequence and a simulated example demonstrating a multi-robot assembly application.	https://dl.acm.org/doi/abs/10.1145/3592102	Ziqi Wang, Florian Kennel-Maushart, Yijiang Huang, Bernhard Thomaszewski, Stelian Coros
AI-Mediated 3D Video Conferencing	We present an AI-mediated 3D video conferencing system that can reconstruct and autostereoscopically display a life-sized talking head using consumer-grade compute resources and minimal capture equipment. Our 3D capture uses a novel 3D lifting method that encodes a given 2D input into an efficient triplanar neural representation of the user, which can be rendered from novel viewpoints in real-time. Our AI-based techniques drastically reduce the cost for 3D capture, while providing a high-fidelity 3D representation on the receiver's end at the cost of traditional 2D video streaming. Additional advantages of our AI-based approach include the ability to accommodate both photorealistic and stylized avatars, and the ability to enable mutual eye contact in multi-directional video conferencing. We demonstrate our system using a tracked stereo display for a personal viewing experience as well as a lightfield display for a room-scale multi-viewer experience.	https://dl.acm.org/doi/abs/10.1145/3588037.3595385	Michael Stengel, Koki Nagano, Chao Liu, Matthew Chan, Alex Trevithick, Shalini De Mello, Jonghyun Kim, David Luebke
Action-Origami Inspired Haptic Devices for Virtual Reality	Origami offers an innovative way to implement haptic interaction with minimum actuation, particularly in immersive encountered-type haptics and robotics. This paper presents two novel action-origami-inspired haptic devices for Virtual Reality (VR). The Zipper Flower Tube is a rigid-foldable origami structure that can provide different stiffness sensations to simulate the elastic response of a material. The Shiftly is a shape-shifting haptic display that employs origami to enable a real-time experience of different shapes and edges of virtual objects or the softness of materials. The modular approach of our action origami haptic devices provides a high-fidelity, energy-efficient and low-cost solution for interacting with virtual materials and objects in VR.	https://dl.acm.org/doi/abs/10.1145/3588037.3595393	Khrystyna Vasylevska, Tobias Batik, Hugo Brument, Kiumars Sharifmoghaddam, Georg Nawratil, Emanuel Vonach, Soroosh Mortezapoor, Hannes Kaufmann
Actualities: Seamless Live Performance with the Physical and Virtual Audiences in Multiverse	During the pandemic, the popularity of VR concerts increased, providing the audience with a novel experience of watching performances where performers and online attendees typically exist in different spaces and times. However, as the pandemic recovered gradually, people returned to live performances physically due to the diminished sense of co-presence experienced in VR concerts. We present Actualities, a seamless live performance consisting of onsite and online form with a multiverse interaction to create an engaging experience for all participants. By utilizing various sensors, we capture signals from the performance venue and digitalize all onsite elements into virtual scenes. The visual content is projected onto screens for the onsite audience, while being simultaneously broadcast via live-streaming to the online audience.	https://dl.acm.org/doi/abs/10.1145/3588027.3595594	Ke-Fan Lin, Yu-Chih Chou, Yu-Hsiang Weng, Yvone Tsai Chen, Zin-Yin Lim, Chi-Po Lin, Ping-Hsuan Han, Tse-Yu Pan
Airbnb Aircover	"Airbnb's new ""Aircover"" protection program has your backside (and money) covered during your booking experience and stay."	https://dl.acm.org/doi/abs/10.1145/3577024.3589022	Justin Cone
Alice in Gravityland: Augmenting Gravity Experiences with Around-the-Head Vibrotactile Feedback and Illusory Tactile Motion	Alice in Gravityland is a VR adventure exploring three gravity experiences with novel, around-the-head vibrotactile feedback using illusory tactile motion. Players are able to 1) change the direction of gravity, 2) navigate through zero gravity, and 3) defy gravity as they walk on walls. The haptic feedback helps improve players' sense of directionality to improve immersion when experiencing gravity events. Inspired by Lewis Carroll's Alice's Adventures in Wonderland (1865), the game invites players to alter gravity to solve puzzles and experience gravity in a unique way through this multi-sensory VR adventure.	https://dl.acm.org/doi/abs/10.1145/3588027.3595591	Luca E. Taglialatela, Chiao-Ju Chang, Shu-Wen Chen, Yi-Han Chang, Chang-Min Chen, Zih-Huei Yang, Tsung-Min Lin, Shih-Yu Ma, Neng-Hao Yu, Mike Y. Chen
An Extensible, Data-Oriented Architecture for High-Performance, Many-World Simulation	Training AI agents to perform complex tasks in simulated worlds requires millions to billions of steps of experience. To achieve high performance, today's fastest simulators for training AI agents adopt the idea of batch simulation: using a single simulation engine to simultaneously step many environments in parallel. We introduce a framework for productively authoring novel training environments (including custom logic for environment generation, environment time stepping, and generating agent observations and rewards) that execute as high-performance, GPU-accelerated batched simulators. Our key observation is that the entity-component-system (ECS) design pattern, popular for expressing CPU-side game logic today, is also well-suited for providing the structure needed for high-performance batched simulators. We contribute the first fully-GPU accelerated ECS implementation that natively supports batch environment simulation. We demonstrate how ECS abstractions impose structure on a training environment's logic and state that allows the system to efficiently manage state, amortize work, and identify GPU-friendly coherent parallel computations within and across different environments. We implement several learning environments in this framework, and demonstrate GPU speedups of two to three orders of magnitude over open source CPU baselines and 5-33× over strong baselines running on a 32-thread CPU. An implementation of the OpenAI hide and seek 3D environment written in our framework, which performs rigid body physics and ray tracing in each simulator step, achieves over 1.9 million environment steps per second on a single GPU.	https://dl.acm.org/doi/abs/10.1145/3592427	Brennan Shacklett, Luc Guy Rosenzweig, Zhiqiang Xie, Bidipta Sarkar, Andrew Szot, Erik Wijmans, Vladlen Koltun, Dhruv Batra, Kayvon Fatahalian
