title	abstract	url	authors
Demonstrating preemptive reaction: accelerating human reaction using electrical muscle stimulation without compromising agency	In this demonstration we enable preemptive force-feedback systems to speed up human reaction time without fully compromising the user's sense of agency. Typically these haptic systems speed up human reaction time by means of electrical muscle stimulation (EMS) or mechanical actuation (exoskeletons), which unfortunately, completely remove the users sense of agency. We address this by actuating the user's body, using EMS, within a particular time window (160 ms after visual stimulus), which we found to speed up reaction time by 80 ms, while retaining a sense of agency. Here, we demonstrate this at the example of two applications: (1) taking a picture of a high-speed moving object in mid-flight, or (2) hit baseball with a toy gun.	https://dl.acm.org/authorize?N688358	Jun Nishida, Shunichi Kasahara, Pedro Lopes
Depth boost: extended depth reconstruction capability on volumetric display	In this talk, we show how acoustic metamaterials can be used to build the acoustic equivalent of optical devices. We demonstrate two key devices: (1) an acoustic prism, used to send the different notes in a melody towards different directions, and (2) an auto-zoom lens, used to send sound to a moving target. We conclude, discussing potential applications and limitations.	https://dl.acm.org/authorize?N689309	Gianluca Memoli, Thomas J. Graham, Joshua T. Kybett, Arash Pouryazdan
Designing a full-body customizable haptic interface using two-dimensional signal transmission	"The concept of spatial computing has a high potential to augment our lives. We can imagine the expansion of the concept of spatial computing in the future as the expanded visual space will blend into our daily lives. In such a future, how do we feel and interact with another reality that overlaps with real space? We have researched this question from an approach using a haptic interface. We previously developed the Synesthesia Suit[Konishi et al. 2016]. This is a full body haptic suit that extends the VR experience of the game ""Rez Infinite"". It delivers the visual and musical experience of ""Rez"" to the whole body, and provides haptic feedback. However, the Synesthesia Suit is difficult to walk around in a physical space, due to the thick cables required for its operation. Basically it is especially suited for VR gaming and it was difficult to apply to spatial computing experience."	https://dl.acm.org/doi/abs/abs/10.1145/3306214.3338569	Taichi Furukawa, Nobuhisa Hanamitsu, Yoichi Kamiyama, Hideaki Nii, Charalampos Krekoukiotis, Kouta Minamizawa, Akihito Noda, Junko Yamada, Keiichi Kitamura, Daisuke Niwa, Yoshiaki Hirano
Designing chain reaction contraptions from causal graphs	Chain reaction contraptions, commonly referred to as Rube Goldberg machines, achieve simple tasks in an intentionally complex fashion via a cascading sequence of events. They are fun, engaging and satisfying to watch. Physically realizing them, however, involves hours or even days of manual trial-and-error effort. The main difficulties lie in predicting failure factors over long chains of events and robustly enforcing an expected causality between parallel chains, especially under perturbations of the layout. We present a computational framework to help design the layout of such contraptions by optimizing their robustness to possible assembly errors. Inspired by the active learning paradigm in machine learning, we propose a generic sampling-based method to progressively approximate the of a given scenario over the design space of possible scene layouts. The success or failure of any given simulation is determined from a user-specified causal graph enforcing a time ordering between expected events. Our method scales to complex causal graphs and high dimensional design spaces by dividing the graph and scene into simpler sub-scenarios. The aggregated success probability distribution is subsequently used to optimize the entire layout. We demonstrate the use of our framework through a range of real world examples of increasing complexity, and report significant improvements over alternative approaches. Code and fabrication diagrams are available on the project page.	https://dl.acm.org/authorize?N688098	Robin Roussel, Marie-Paule Cani, Jean-Claude Léon, Niloy J. Mitra
DiCE: dichoptic contrast enhancement for binocular displays	In stereoscopic displays, such as those used in VR/AR headsets, our two eyes are presented with different views. The disparity between the views is typically used to convey depth cues, but it could be used for other purposes. We devise a novel technique that takes advantage of binocular fusion to boost perceived local contrast and visual quality of images. Since the technique is based on fixed tone-curves, it has negligible computational cost and it is well suited for real-time applications, such as VR rendering. To control the trade-off between the level of enhancement and binocular rivalry, we conduct a series of experiments that lead to a new finding, explaining the factors that dominate the rivalry perception in a dichoptic presentation where two images of different contrasts are displayed. With this new inding, we demonstrate that the enhancement can be quantitatively measured and binocular rivalry is well controlled.	https://dl.acm.org/doi/abs/abs/10.1145/3306214.3338578	Fangeheng Zhong, George Alex Koulieris, George Drettakis, Martin S. Banks, Mathieu Chambe, Fredo Durand, Rafal Mantiuk
Differentiable graphics with TensorFlow 2.0	This course will cover the compact volume data structure and various tools available in the open source library OpenVDB. Since its release in 2012 it has set an industry standard and has been used for visual effects in over 150 feature movies. Last year this open source project was the first to be adopted by the new Academy Software Foundation (ASWF) and the Linux Foundation. This means that the project is now changing governance and more importantly has open up for numerous external contributions. We will describe this new governance, specifically what it means for would-be contributors, and of course what has already been added to the project since last time this course was offered at SIGGRAPH in 2017.	https://dl.acm.org/authorize?N689277	Paige Bailey, Sofien Bouaziz, Shan Carter, Josh Gordon, Christian Häne, Alexander Mordvintsev, Julien Valentin, Martin Wicke
Direct delta mush skinning and variants	"A significant fraction of the world's population have experienced virtual characters through games and movies, and the possibility of online VR social experiences may greatly extend this audience. At present, the skin deformation for interactive and real-time characters is typically computed using geometric skinning methods. These methods are efficient and simple to implement, but obtaining quality results requires considerable manual ""rigging"" effort involving trial-and-error weight painting, the addition of virtual helper bones, etc. The recently introduced Delta Mush algorithm largely solves this rig authoring problem, but its iterative computational approach has prevented direct adoption in real-time engines. This paper introduces Direct Delta Mush, a new algorithm that simultaneously improves on the efficiency and control of Delta Mush while generalizing previous algorithms. Specifically, we derive a direct rather than iterative algorithm that has the same ballpark computational form as some previous geometric weight blending algorithms. Straightforward variants of the algorithm are then proposed to further optimize computational and storage cost with insignificant quality losses. These variants are equivalent to special cases of several previous skinning algorithms. Our algorithm simultaneously satisfies the goals of reasonable efficiency, quality, and ease of authoring. Further, its explicit decomposition of rotational and translational effects allows independent control over bending versus twisting deformation, as well as a skin sliding effect."	https://dl.acm.org/authorize?N688168	Binh Huy Le, J P Lewis
"Directable stadium crowds from image based modelling for ""Bohemian Rhapsody"""	In Walt Disney Animation Studio's 57th animated feature , the vastness of the internet is imagined as a bustling city where websites are buildings, characters represent algorithms, and travel from site to site. The enormous scope of bringing the world of the internet to life required the Crowds department to rethink how we go about populating our scenes. We extended the Zootopia Crowd Pipeline [El-Ali et al. 2016] to support pose reuse based on level-of-detail, and developed a procedural workflow to populate the world with millions of agents and efficiently render only those visible to camera.	https://dl.acm.org/authorize?N689338	Josh Richards, Le Joyce Tong, Moe El-Ali, Tuan Nguyen
Disney presents: the making of The Lion King	In this production session, VFX Supervisors Robert Legato, ASC and Director of Photography Caleb Deschanel ASC will reveal how they worked with Director Jon Favreau and the VFX and Animation team at MPC Film (Moving Picture Company) to develop a new approach to filmmaking, harnessing the latest filmmaking technologies and creative talent to bring The Lion King to a new generation. As the sole provider of visual effects and animation, the MPC team was led by: MPC VFX supervisors Adam Valdez and Elliot Newman, whom worked closely with Legato, Deschanel and Animation Supervisor Andy Jones, crafting every photo-real frame of the movie.	https://dl.acm.org/authorize?N689291	Rob Legato, Caleb Deschanel
Display methods of projection augmented reality based on deep learning pose estimation	In this paper, we propose three display methods for projection-based augmented reality. In spatial augmented reality (SAR), determining where information, objects, or contents are to be displayed is a difficult and important issue. We use deep learning models to estimate user pose and suggest ways to solve the issue based on this data. Finally, each method can be appropriately applied according to various the applications and scenarios.	https://dl.acm.org/doi/abs/abs/10.1145/3306214.3338608	Hyocheol Ro, Yoon Jung Park, Jung-Hyun Byun, Tack-Don Han
Distortion-free wide-angle portraits on camera phones	Photographers take wide-angle shots to enjoy expanding views, group portraits that never miss anyone, or composite subjects with spectacular scenery background. In spite of the rapid proliferation of wide-angle cameras on mobile phones, a wider field-of-view (FOV) introduces a stronger perspective distortion. Most notably, faces are stretched, squished, and skewed, to look vastly different from real-life. Correcting such distortions requires professional editing skills, as trivial manipulations can introduce other kinds of distortions. This paper introduces a new algorithm to undistort faces without affecting other parts of the photo. Given a portrait as an input, we formulate an optimization problem to create a content-aware warping mesh which adapts to the stereographic projection on facial regions, and seamlessly evolves to the perspective projection over the background. Our new energy function performs effectively and reliably for a large group of subjects in the photo. The proposed algorithm is fully automatic and operates at an interactive rate on the mobile platform. We demonstrate promising results on a wide range of FOVs from 70° to 120°.	https://dl.acm.org/authorize?N688016	YiChang Shih, Wei-Sheng Lai, Chia-Kai Liang
Doctor Who: The Runaway	"Step inside the TARDIS with the Doctor in this beautiful, animated, interactive story from the ""Doctor Who"" team. You've been in a collision. You wake inside the TARDIS. The Doctor introduces you to the person, or thing, you collided with. He's a strange and magnificent ball of living energy called Volta. Part surly teenager, part bomb, Volta is very unstable. In fact, he's primed to explode. Big time. Unless he can be returned to his home planet, sharpish. The problem is, a squad of galactic busybodies has other plans for Volta. Bad ones. Drawn into a frantic chase, you become the Doctor's unlikely assistant as she races against time to get Volta home to his parents. Armed with a sonic screwdriver, it is down to you to help the Doctor as she faces the forces of evil, and teenage angst, in this animated, 13-minute VR adventure from the team behind ""Doctor Who"" Series 11."	https://dl.acm.org/authorize?N689352	Mathias Chelebourg
Drawing sound in MR space	What if we can draw sound in mid-air? We propose a multi-participant, interactive, audiovisual art experience using mixed reality (MR). In the MR space, participants can draw virtual lines in mid-air to create audiovisual effects.	https://dl.acm.org/authorize?N689143	Taku Ota, Ryo Komatsubara, Katsutoshi Hata, Takahisa Mitsumori, Hidefumi Ohmura, Ken Sonobe, Ryu Nakagawa
Dust and cobwebs for Toy Story 4	The Toy Story universe makes its home at small scales, with the camera sometimes just a few centimeters from surfaces where typical shader approaches are unable to provide the desired level of detail. For environments like the Second Chance Antiques Store for Toy Story 4, the Set Extensions team developed systems to generate dimensional, granular elements such as dust, small debris, and cobwebs to enhance storytelling and ambiance. In addition to improving realism, these elements help indicate how hidden or exposed an area is from human observation and elevated the sense of drama and history.	https://dl.acm.org/authorize?N689391	Hosuk Chang, David Luoh
Eclipse	Eclipse is a glimpse into the future of entertainment. A hyperreality experience, Eclipse provides a complete free roaming experience on a limited footprint with unique features, such as full body awareness and haptic floors. A collaborative sci-fi experience for two to four players.	https://dl.acm.org/authorize?N689144	Aymeric Favre, Flavien Galliot, Frederic Cussey, Frederic Plantard, Frederic Lecompte, Jonathan Astruc, Darrin Taylor, Paul Etienne Duclos
Effectiveness of facial animated avatar and voice transformer in elearning programming course	The advancement in technology brought about the introduction of eLearning to educational institutes. By supplementing traditional courses with eLearning materials, instructors are able to introduce new learning methods without completely deviating from standard education programs [Basogain et al. 2017]. Some of the most popular forms of E-Learning include online courses [Aparicio and Bacao 2013], [Goyal 2012], video clips of lectures, and gamification of courses and materials [Plessis 2017]. This paper introduces and evaluates the performance of eLearning videos featuring anime styled avatars (a.k.a VTuber) speaking in vocoder transformed audios and how they compare with the traditional lecturer videos.	https://dl.acm.org/doi/abs/abs/10.1145/3306214.3338540	Rex Hsieh, Akihiko Shirai, Hisashi Sato
Efficient and conservative fluids using bidirectional mapping	"We introduce variable thickness, viscous vortex filaments. These can model such varied phenomena as underwater bubble rings or the intricate ""chandeliers"" formed by ink dropping into fluid. Treating the evolution of such filaments as an instance of Newtonian dynamics on a Riemannian configuration manifold we are able to extend classical work in the dynamics of vortex filaments through inclusion of viscous drag forces. The latter must be accounted for in low Reynolds number flows where they lead to significant variations in filament thickness and form an essential part of the observed dynamics. We develop and document both the underlying theory and associated practical numerical algorithms."	https://dl.acm.org/authorize?N688174	Marcel Padilla, Albert Chern, Felix Knöppel, Ulrich Pinkall, Peter Schröder
Efficient mask expansion for green-screen keying using color distributions	Masks are heavily used in image and video processing, particularly in the context of green screen keying. Designing good masks is a difficult task that involves painting over small details of images. Usually, only a rough mask is created. We propose an algorithm to expand such a mask, using color similarity. Our approach is fast, even on 4K images, and compares favorably with standard tools used in keying.	https://dl.acm.org/doi/abs/abs/10.1145/3306214.3338595	Alexandre Derouet-Jourdan, Marc Salvati, Xiaoxiong Xing, Takuro Nishikawa
Eigen zoetrope	Zoetrope is an animation display that produces the illusion of motion via a displayed sequence of pictures; this device was invented in 1833. The traditional Zoetrope consists of a rotational disk and a strobe light. The disk has some plates that are pasted together showing sequential pictures and is rotated rapidly. The strobe light is emitted with synchronization to the rotation angle To display the animation. The Zoetrope has been improved and there are many kinds of the zoetropes in SIGGRAPH community: interactive zoetrope [Smoot et al. 2010], ZoeMatrope [Miyashita et al. 2016], and Magic Zoetrope [Yokota and Hashida 2018].	https://dl.acm.org/authorize?N688359	Gou Koutaki
Ellipsoidal path connections for time-gated rendering	During the last decade, we have been witnessing the continued development of new time-of-flight imaging devices, and their increased use in numerous and varied applications. However, physics-based rendering techniques that can accurately simulate these devices are still lacking: while existing algorithms are adequate for certain tasks, such as simulating transient cameras, they are very inefficient for simulating time-gated cameras because of the large number of wasted path samples. We take steps towards addressing these deficiencies, by introducing a procedure for efficiently sampling paths with a predetermined length, and incorporating it within rendering frameworks tailored towards simulating time-gated imaging. We use our open-source implementation of the above to empirically demonstrate improved rendering performance in a variety of applications, including simulating proximity sensors, imaging through occlusions, depth-selective cameras, transient imaging in dynamic scenes, and non-line-of-sight imaging.	https://dl.acm.org/authorize?N688083	Adithya Pediredla, Ashok Veeraraghavan, Ioannis Gkioulekas
Enhancement of CT images for visualization	Modern medical science strongly depends on imaging technologies for accurate diagnose and treatment planning. Raw medical images generally require post-processing - like edge and contrast enhancement, and noise removal - for visualization. In this paper, a clustering-based contrast enhancement technique is presented for computed tomography (CT) images.	https://dl.acm.org/doi/abs/abs/10.1145/3306214.3338602	Anam Mehmood, Ishtiaq Rasool Khan, Hassan Dawood, Hussain Dawood
Enhancing emotional intelligence in project management: strategies for better outcomes and community with limited financial overhead	"During the SIGGRAPH 2018 BOF ""Emphasizing Empathy in Pipeline Project Management,"" group consensus stated that highly effective project management can only be achieved when emphasis is placed on demonstrated empathy for any and all project contributors at the project management level and when challenges are framed as opportunities to enhance both the team and the project manager's own emotional intelligence. The reality faced in the industry, however, can present unique challenges, specifically relating to toxic cultural folkways, lack of leadership support, and lack of designated monetary resources. Based on subsequent discussions borne from the initial presentation with industry professionals and team leaders, it seems imperative to address not only the theories of Emotional Intelligence in greater depth, but also to acknowledge the potential obstacles in applying this basic theory in the real world. This talk aims to illuminate opportunities for individual production professionals to both challenge their own perceptions of the industry culture and make effective changes pertaining to their management and communication styles to affect positive change in their work environment, increase employee morale, and build community, barring financial allotment, to the overall benefit of their team members and their project health."	https://dl.acm.org/authorize?N689399	Claudia E. Davis
Expedition Reef for Educators	"An educational resource for K-12 teachers that leverage assets from the planetarium show ""Expedition Reef."""	https://dl.acm.org/authorize?N689242	Ryan Wyatt
Experiences of treating phantom limb pain using immersive virtual reality	Phantom limb pain (PLP) is a phenomenon that affects millions of amputees worldwide. Its causes are poorly understood, and traditional forms of pain relief are largely ineffective. For over a decade virtual reality (VR) has shown tantalising possibilities of treating or managing this debilitating condition. Until recently however, the cost, complexity and fragility of VR hardware made exploring this unorthodox approach at any meaningful scale challenging; patients have had to travel to the location of specialist equipment to participate in studies, and missed appointments, dropouts or broken hardware have hampered data-gathering. Improvements in 'consumer grade' VR headsets now makes larger trials of this visual approach to pain management viable. We describe a trial of a VR system for PLP reduction utilising lightweight, standalone and low-cost VR hardware suitable for independent home use.	https://dl.acm.org/authorize?N689381	James Marsh, Stephen Pettifer, Cliff Richardson, Jai Kulkarni
Exploration of using face tracking to reduce GPU rendering on current and future auto-stereoscopic displays	Future auto-stereoscopic displays offer us an amazing possibility of virtual reality without the need for head mounted displays. Since fundamentally though we only need to generate viewpoints for known observers, the classical approach to render all views at once is wasteful in terms of GPU resources and limits the scale of an auto-stereoscopic display. We present a technique that reduces GPU consumption when using an auto-stereoscopic displays by giving the display a context awareness of its observers. The technique was first applied to the Looking Glass device on the Unity3D platform. Rather than rendering 45 different views at the same time, for each observer, the framework only requires six views that are visible to both eyes based on the tracked eye positions. Given the current specifications of this device, the framework helps save 73% GPU consumption for Looking Glass if it was to render a 8 X 8 resolution scene, and the saved GPU consumption increases as the resolution increases. This technique can be applied to reduce future GPU requirements for auto-stereoscopic displays in the future.	https://dl.acm.org/doi/abs/abs/10.1145/3306214.3338577	Xingyu Pan, Mengya Zheng, Abraham Campbell
Exploring color variations for vector graphics	We propose a novel and intuitive method for exploring recoloring variations of vector graphics. Compared with existing methods, ours is specifically tailored for vector graphics, where color distributions are sparser and are explicitly stored using constructs like solid colors or gradients, independent from other semantical and spatial relationships. Our method tries to infer some of them before formulating color transfer as a transport problem between the weighted color distributions of the reference and the target vector graphics. We enable creative exploration by providing fine-grain control over the resulting transfer, allowing users to modify relative color distributions in real-time.	https://dl.acm.org/doi/abs/abs/10.1145/3306214.3338552	Sayan Ghosh, Jose Echevarria, Vineet Batra, Ankit Phogat
EyeHacker: gaze-based automatic reality manipulation	In this study, we introduce EyeHacker, which is an immersive virtual reality (VR) system that spatiotemporally mixes the live and recorded/edited scenes based on the measurement of the users' gaze. This system updates the transition risk in real time by utilizing the gaze information of the users (i.e., the locus of attention) and the optical flow of scenes. Scene transitions are allowed when the risk is less than the threshold, which is modulated by the head movement data of the users (i.e., the faster their head movement, the higher will be the threshold). Using this algorithm and experience scenario prepared in advance, visual reality can be manipulated without being noticed by users (i.e., eye hacking). For example, consider a situation in which the objects around the users perpetually disappear and appear. The users would often have a strange feeling that something was wrong and, sometimes, would even find what happened but only later; they cannot visually perceive the changes in real time. Further, with the other variant of risk algorithms, the system can implement a variety of experience scenarios, resulting in reality confusion.	https://dl.acm.org/authorize?N688350	Daichi Ito, Sohei Wakisaka, Atsushi Izumihara, Tomoya Yamaguchi, Atsushi Hiyama, Masahiko Inami
