title	abstract	url	authors
Practical Schemes for Finding Near-Stationary Points of Convex Finite-Sums	In convex optimization, the problem of finding near-stationary points has not been adequately studied yet, unlike other optimality measures such as the function value. Even in the deterministic case, the optimal method (OGM-G, due to Kim and Fessler (2021)) has just been discovered recently. In this work, we conduct a systematic study of algorithmic techniques for finding near-stationary points of convex finite-sums. Our main contributions are several algorithmic discoveries: (1) we discover a memory-saving variant of OGM-G based on the performance estimation problem approach (Drori and Teboulle, 2014); (2) we design a new accelerated SVRG variant that can simultaneously achieve fast rates for minimizing both the gradient norm and function value; (3) we propose an adaptively regularized accelerated SVRG variant, which does not require the knowledge of some unknown initial constants and achieves near-optimal complexities. We put an emphasis on the simplicity and practicality of the new schemes, which could facilitate future work.	http://proceedings.mlr.press/v151/zhou22a.html	Kaiwen Zhou, Lai Tian, Anthony Man-Cho So, James Cheng
Predicting the impact of treatments over time with uncertainty aware neural differential equations.	Predicting the impact of treatments from ob- servational data only still represents a major challenge despite recent significant advances in time series modeling. Treatment assignments are usually correlated with the predictors of the response, resulting in a lack of data support for counterfactual predictions and therefore in poor quality estimates. Developments in causal inference have lead to methods addressing this confounding by requiring a minimum level of overlap. However, overlap is difficult to assess and usually not satisfied in practice. In this work, we propose Counterfactual ODE (CF-ODE), a novel method to predict the impact of treatments continuously over time using Neural Ordinary Differential Equations equipped with uncertainty estimates. This allows to specifically assess which treatment outcomes can be reliably predicted. We demonstrate over several longitudinal datasets that CF-ODE provides more accurate predictions and more reliable uncertainty estimates than previously available methods.	http://proceedings.mlr.press/v151/de-brouwer22a.html	Edward De Brouwer, Javier Gonzalez, Stephanie Hyland
Predicting the utility of search spaces for black-box optimization: a simple, budget-aware approach	Black box optimization requires specifying a search space to explore for solutions, e.g. a d-dimensional compact space, and this choice is critical for getting the best results at a reasonable budget. Unfortunately, determining a high quality search space can be challenging in many applications. For example, when tuning hyperparameters for machine learning pipelines on a new problem given a limited budget, one must strike a balance between excluding potentially promising regions and keeping the search space small enough to be tractable. The goal of this work is to motivate—through example applications in tuning deep neural networks—the problem of predicting the quality of search spaces conditioned on budgets, as well as to provide a simple scoring method based on a utility function applied to a probabilistic response surface model, similar to Bayesian optimization. We show that the method we present can compute meaningful budget-conditional scores in a variety of situations. We also provide experimental evidence that accurate scores can be useful in constructing and pruning search spaces. Ultimately, we believe scoring search spaces should become standard practice in the experimental workflow for deep learning.	http://proceedings.mlr.press/v151/ariafar22a.html	Setareh Ariafar, Justin Gilmer, Zachary Nado, Jasper Snoek, Rodolphe Jenatton, George Dahl
Predictive variational Bayesian inference as risk-seeking optimization	Since the Bayesian inference works poorly under model misspecification, various solutions have been explored to counteract the shortcomings. Recently proposed predictive Bayes (PB) that directly optimizes the Kullback Leibler divergence between the empirical distribution and the approximate predictive distribution shows excellent performances not only under model misspecification but also for over-parametrized models. However, its behavior and superiority are still unclear, which limits the applications of PB. Specifically, the superiority of PB has been shown only in terms of the predictive test log-likelihood and the performance in the sense of parameter estimation has not been investigated yet. Also, it is not clear why PB is superior with misspecified and over-parameterized models. In this paper, we clarify these ambiguities by studying PB in the framework of risk-seeking optimization. To achieve this, first, we provide a consistency theory for PB and then present intuition of robustness of PB to model misspecification using a response function theory. Thereafter, we theoretically and numerically show that PB has an implicit regularization effect that leads to flat local minima in over-parametrized models.	http://proceedings.mlr.press/v151/futami22a.html	Futoshi Futami, Tomoharu Iwata, Naonori Ueda, Issei Sato, Masashi Sugiyama
Preference Exploration for Efficient Bayesian Optimization with Multiple Outcomes	We consider Bayesian optimization of expensive-to-evaluate experiments that generate vector-valued outcomes over which a decision-maker (DM) has preferences. These preferences are encoded by a utility function that is not known in closed form but can be estimated by asking the DM to express preferences over pairs of outcome vectors. To address this problem, we develop Bayesian optimization with preference exploration, a novel framework that alternates between interactive real-time preference learning with the DM via pairwise comparisons between outcomes, and Bayesian optimization with a learned compositional model of DM utility and outcomes. Within this framework, we propose preference exploration strategies specifically designed for this task, and demonstrate their performance via extensive simulation studies.	http://proceedings.mlr.press/v151/jerry-lin22a.html	Zhiyuan Jerry Lin, Raul Astudillo, Peter Frazier, Eytan Bakshy
Primal-Dual Stochastic Mirror Descent for MDPs	We consider the problem of learning the optimal policy for infinite-horizon Markov decision processes (MDPs). For this purpose, some variant of Stochastic Mirror Descent is proposed for convex programming problems with Lipschitz-continuous functionals. An important detail is the ability to use inexact values of functional constraints and compute the value of dual variables. We analyze this algorithm in a general case and obtain an estimate of the convergence rate that does not accumulate errors during the operation of the method. Using this algorithm, we get the first parallel algorithm for mixing average-reward MDPs with a generative model without reduction to discounted MDP. One of the main features of the presented method is low communication costs in a distributed centralized setting, even with very large networks.	http://proceedings.mlr.press/v151/tiapkin22a.html	Daniil Tiapkin, Alexander Gasnikov
Privacy Amplification by Decentralization	Analyzing data owned by several parties while achieving a good trade-off between utility and privacy is a key challenge in federated learning and analytics. In this work, we introduce a novel relaxation of local differential privacy (LDP) that naturally arises in fully decentralized algorithms, i.e., when participants exchange information by communicating along the edges of a network graph without central coordinator. This relaxation, that we call network DP, captures the fact that users have only a local view of the system. To show the relevance of network DP, we study a decentralized model of computation where a token performs a walk on the network graph and is updated sequentially by the party who receives it. For tasks such as real summation, histogram computation and optimization with gradient descent, we propose simple algorithms on ring and complete topologies. We prove that the privacy-utility trade-offs of our algorithms under network DP significantly improve upon what is achievable under LDP, and often match the utility of the trusted curator model. Our results show for the first time that formal privacy gains can be obtained from full decentralization. We also provide experiments to illustrate the improved utility of our approach for decentralized training with stochastic gradient descent.	http://proceedings.mlr.press/v151/cyffers22a.html	Edwige Cyffers, Aurélien Bellet
Privacy Amplification by Subsampling in Time Domain	Aggregate time-series data like traffic flow and site occupancy repeatedly sample statistics from a population across time. Such data can be profoundly useful for understanding trends within a given population, but also pose a significant privacy risk, potentially revealing e.g., who spends time where. Producing a private version of a time-series satisfying the standard definition of Differential Privacy (DP) is challenging due to the large influence a single participant can have on the sequence: if an individual can contribute to each time step, the amount of additive noise needed to satisfy privacy increases linearly with the number of time steps sampled. As such, if a signal spans a long duration or is oversampled, an excessive amount of noise must be added, drowning out underlying trends. However, in many applications an individual realistically cannot participate at every time step. When this is the case, we observe that the influence of a single participant (sensitivity) can be reduced by subsampling and/or filtering in time, while still meeting privacy requirements. Using a novel analysis, we show this significant reduction in sensitivity and propose a corresponding class of privacy mechanisms. We demonstrate the utility benefits of these techniques empirically with real-world and synthetic time-series data.	http://proceedings.mlr.press/v151/koga22a.html	Tatsuki Koga, Casey Meehan, Kamalika Chaudhuri
Private Sequential Hypothesis Testing for Statisticians: Privacy, Error Rates, and Sample Size	The sequential hypothesis testing problem is a class of statistical analyses where the sample size is not fixed in advance. Instead, the decision-process takes in new observations sequentially to make real-time decisions for testing an alternative hypothesis against a null hypothesis until some stopping criterion is satisfied. In many common applications of sequential hypothesis testing, the data can be highly sensitive and may require privacy protection; for example, sequential hypothesis testing is used in clinical trials, where doctors sequentially collect data from patients and must determine when to stop recruiting patients and whether the treatment is effective. The field of differential privacy has been developed to offer data analysis tools with strong privacy guarantees, and has been commonly applied to machine learning and statistical tasks. In this work, we study the sequential hypothesis testing problem under a slight variant of differential privacy, known as Renyi differential privacy. We present a new private algorithm based on Wald's Sequential Probability Ratio Test (SPRT) that also gives strong theoretical privacy guarantees. We provide theoretical analysis on statistical performance measured by Type I and Type II error as well as the expected sample size. We also empirically validate our theoretical results on several synthetic databases, showing that our algorithms also perform well in practice. Unlike previous work in private hypothesis testing that focused only on the classical fixed sample setting, our results in the sequential setting allow a conclusion to be reached much earlier, and thus saving the cost of collecting additional samples.	http://proceedings.mlr.press/v151/zhang22g.html	Wanrong Zhang, Yajun Mei, Rachel Cummings
Probabilistic Numerical Method of Lines for Time-Dependent Partial Differential Equations	This work develops a class of probabilistic algorithms for the numerical solution of nonlinear, time-dependent partial differential equations (PDEs). Current state-of-the-art PDE solvers treat the space- and time-dimensions separately, serially, and with black-box algorithms, which obscures the interactions between spatial and temporal approximation errors and misguides the quantification of the overall error. To fix this issue, we introduce a probabilistic version of a technique called method of lines. The proposed algorithm begins with a Gaussian process interpretation of finite difference methods, which then interacts naturally with filtering-based probabilistic ordinary differential equation (ODE) solvers because they share a common language: Bayesian inference. Joint quantification of space- and time-uncertainty becomes possible without losing the performance benefits of well-tuned ODE solvers. Thereby, we extend the toolbox of probabilistic programs for differential equation simulation to PDEs.	http://proceedings.mlr.press/v151/kramer22a.html	Nicholas Krämer, Jonathan Schmidt, Philipp Hennig
Probing GNN Explainers: A Rigorous Theoretical and Empirical Analysis of GNN Explanation Methods	As Graph Neural Networks (GNNs) are increasingly being employed in critical real-world applications, several methods have been proposed in recent literature to explain the predictions of these models. However, there has been little to no work on systematically analyzing the reliability of these methods. Here, we introduce the first-ever theoretical analysis of the reliability of state-of-the-art GNN explanation methods. More specifically, we theoretically analyze the behavior of various state-of-the-art GNN explanation methods with respect to several desirable properties (e.g., faithfulness, stability, and fairness preservation) and establish upper bounds on the violation of these properties. We also empirically validate our theoretical results using extensive experimentation with nine real-world graph datasets. Our empirical results further shed light on several interesting insights about the behavior of state-of-the-art GNN explanation methods.	http://proceedings.mlr.press/v151/agarwal22b.html	Chirag Agarwal, Marinka Zitnik, Himabindu Lakkaraju
Projection Predictive Inference for Generalized Linear and Additive Multilevel Models	Projection predictive inference is a decision theoretic Bayesian approach that decouples model estimation from decision making. Given a reference model previously built including all variables present in the data, projection predictive inference projects its posterior onto a constrained space of a subset of variables. Variable selection is then performed by sequentially adding relevant variables until predictive performance is satisfactory. Previously, projection predictive inference has been demonstrated only for generalized linear models (GLMs) and Gaussian processes (GPs) where it showed superior performance to competing variable selection procedures. In this work, we extend projection predictive inference to support variable and structure selection for generalized linear multilevel models (GLMMs) and generalized additive multilevel models (GAMMs). Our simulative and real-world experiments demonstrate that our method can drastically reduce the model complexity required to reach reference predictive performance and achieve good frequency properties.	http://proceedings.mlr.press/v151/catalina22a.html	Alejandro Catalina, Paul-Christian Bürkner, Aki Vehtari
Provable Adversarial Robustness for Fractional Lp Threat Models	"In recent years, researchers have extensively studied adversarial robustness in a variety of threat models, including L_0, L_1, L_2, and L_infinity-norm bounded adversarial attacks. However, attacks bounded by fractional L_p ""norms"" (quasi-norms defined by the L_p distance with 0<p have yet to be thoroughly considered. we proactively propose a defense with several desirable properties: it provides provable robustness scales imagenet and yields deterministic than high-probability certified guarantees when applied quantized data images our technique for fractional l_p constructs expressive deep classifiers that are globally lipschitz respect the metric any however method is even more general: can construct which defined as sum of concave functions components. approach builds on recent work levine feizi against l_1 attacks. demonstrate proposed highly non-vacuous compared trivial solution using directly applying norm inequalities.> Cite this Paper BibTeX @InProceedings{pmlr-v151-levine22a, title = { Provable Adversarial Robustness for Fractional Lp Threat Models }, author = {Levine, Alexander J. and Feizi, Soheil}, booktitle = {Proceedings of The 25th International Conference on Artificial Intelligence and Statistics}, pages = {9908--9942}, year = {2022}, editor = {Camps-Valls, Gustau and Ruiz, Francisco J. R. and Valera, Isabel}, volume = {151}, series = {Proceedings of Machine Learning Research}, month = {28--30 Mar}, publisher = {PMLR}, pdf = {https://proceedings.mlr.press/v151/levine22a/levine22a.pdf}, url = {https://proceedings.mlr.press/v151/levine22a.html}, abstract = { In recent years, researchers have extensively studied adversarial robustness in a variety of threat models, including L_0, L_1, L_2, and L_infinity-norm bounded adversarial attacks. However, attacks bounded by fractional L_p ""norms"" (quasi-norms defined by the L_p distance with 0<p have yet to be thoroughly considered. we proactively propose a defense with several desirable properties: it provides provable robustness scales imagenet and yields deterministic than high-probability certified guarantees when applied quantized data images our technique for fractional l_p constructs expressive deep classifiers that are globally lipschitz respect the metric any however method is even more general: can construct which defined as sum of concave functions components. approach builds on recent work levine feizi against l_1 attacks. demonstrate proposed highly non-vacuous compared trivial solution using directly applying norm inequalities.> <button class=""button"" id=""button-bibtex1"" onclick=""CopyToClipboard('bibtex'); ga('send', 'event', 'Ref Copy', 'CopyToClipboard', '/v151/pmlr-v151-levine22a.bib', 15);"">Copy to Clipboard <button class=""button"" id=""button-bibtex2"" onclick=""DownloadTexToFile('pmlr-v151-levine22a.bib', 'bibtex'); ga('send', 'event', 'Ref Downloads', 'Download', '/v151/pmlr-v151-levine22a.bib', 16);"">Download Endnote %0 Conference Paper %T Provable Adversarial Robustness for Fractional Lp Threat Models %A Alexander J. Levine %A Soheil Feizi %B Proceedings of The 25th International Conference on Artificial Intelligence and Statistics %C Proceedings of Machine Learning Research %D 2022 %E Gustau Camps-Valls %E Francisco J. R. Ruiz %E Isabel Valera %F pmlr-v151-levine22a %I PMLR %P 9908--9942 %U https://proceedings.mlr.press/v151/levine22a.html %V 151 %X In recent years, researchers have extensively studied adversarial robustness in a variety of threat models, including L_0, L_1, L_2, and L_infinity-norm bounded adversarial attacks. However, attacks bounded by fractional L_p ""norms"" (quasi-norms defined by the L_p distance with 0<p have yet to be thoroughly considered. we proactively propose a defense with several desirable properties: it provides provable robustness scales imagenet and yields deterministic than high-probability certified guarantees when applied quantized data images our technique for fractional l_p constructs expressive deep classifiers that are globally lipschitz respect the metric any however method is even more general: can construct which defined as sum of concave functions components. approach builds on recent work levine feizi against l_1 attacks. demonstrate proposed highly non-vacuous compared trivial solution using directly applying norm inequalities.> <button class=""button"" id=""button-endnote1"" onclick=""CopyToClipboard('endnote'); ga('send', 'event', 'Ref Copy', 'CopyToClipboard', '/v151/pmlr-v151-levine22a.enw', 15);"">Copy to Clipboard <button class=""button"" id=""button-endnote2"" onclick=""DownloadTexToFile('pmlr-v151-levine22a.enw', 'endnote'); ga('send', 'event', 'Ref Downloads', 'Download', '/v151/pmlr-v151-levine22a.enw', 16);"">Download APA Levine, A.J. &amp; Feizi, S.. (2022). Provable Adversarial Robustness for Fractional Lp Threat Models . Proceedings of The 25th International Conference on Artificial Intelligence and Statistics, in Proceedings of Machine Learning Research 151:9908-9942 Available from https://proceedings.mlr.press/v151/levine22a.html. <button class=""button"" id=""button-apa1"" onclick=""CopyToClipboard('apa'); ga('send', 'event', 'Ref Copy', 'CopyToClipboard', '/v151/pmlr-v151-levine22a.txt', 15);"">Copy to Clipboard <button class=""button"" id=""button-apa2"" onclick=""DownloadTexToFile('pmlr-v151-levine22a.txt', 'apa'); ga('send', 'event', 'Ref Downloads', 'Download', '/v151/pmlr-v151-levine22a.txt', 16);"">Download Related Material <a href=""https://proceedings.mlr.press/v151/levine22a/levine22a.pdf"" target=""_blank"" onclick=""ga('send', 'event', 'PDF Downloads', 'Download', 'https://proceedings.mlr.press/v151/levine22a/levine22a.pdf', 10);"">Download PDF <a href=""https://proceedings.mlr.press/v151/levine22a/levine22a-supp.zip"" target=""_blank"" onclick=""ga('send', 'event', 'Extra Downloads', 'Download', 'https://proceedings.mlr.press/v151/levine22a/levine22a-supp.zip', 12);"">Supplementary ZIP"	http://proceedings.mlr.press/v151/levine22a.html	Alexander J. Levine, Soheil Feizi
Provable Continual Learning via Sketched Jacobian Approximations	An important problem in machine learning is the ability to learn tasks in a sequential manner. If trained with standard first-order methods most models forget previously learned tasks when trained on a new task, which is often referred to as catastrophic forgetting. A popular approach to overcome forgetting is to regularize the loss function by penalizing models that perform poorly on previous tasks. For example, elastic weight consolidation (EWC) regularizes with a quadratic form involving a diagonal matrix build based on past data. While EWC works very well for some setups, we show that, even under otherwise ideal conditions, it can provably suffer catastrophic forgetting if the diagonal matrix is a poor approximation of the Hessian matrix of previous tasks. We propose a simple approach to overcome this: Regularizing training of a new task with sketches of the Jacobian matrix of past data. This provably enables overcoming catastrophic forgetting for linear models and for wide neural networks, at the cost of memory. The overarching goal of this paper is to provided insights on when regularization-based continual learning algorithms work and under what memory costs.	http://proceedings.mlr.press/v151/heckel22a.html	Reinhard Heckel
Provable Lifelong Learning of Representations	In lifelong learning, tasks (or classes) to be learned arrive sequentially over time in arbitrary order. During training, knowledge from previous tasks can be captured and transferred to subsequent ones to improve sample efficiency. We consider the setting where all target tasks can be represented in the span of a small number of unknown linear or nonlinear features of the input data. We propose a lifelong learning algorithm that maintains and refines the internal feature representation. We prove that for any desired accuracy on all tasks, the dimension of the representation remains close to that of the underlying representation. The resulting sample complexity improves significantly on existing bounds. In the setting of linear features, our algorithm is provably efficient and the sample complexity for input dimension $d$, $m$ tasks with $k$ features up to error $\epsilon$ is $\tilde{O}(dk^{1.5}/\epsilon+km/\epsilon)$. We also prove a matching lower bound for any lifelong learning algorithm that uses a single task learner as a black box. We complement our analysis with an empirical study, including a heuristic lifelong learning algorithm for deep neural networks. Our method performs favorably on challenging realistic image datasets compared to state-of-the-art continual learning methods.	http://proceedings.mlr.press/v151/cao22a.html	Xinyuan Cao, Weiyang Liu, Santosh Vempala
Provably Efficient Policy Optimization for Two-Player Zero-Sum Markov Games	Policy-based methods with function approximation are widely used for solving two-player zero-sum games with large state and/or action spaces. However, it remains elusive how to obtain optimization and statistical guarantees for such algorithms. We present a new policy optimization algorithm with function approximation and prove that under standard regularity conditions on the Markov game and the function approximation class, our algorithm finds a near-optimal policy within a polynomial number of samples and iterations. To our knowledge, this is the first provably efficient policy optimization algorithm with function approximation that solves two-player zero-sum Markov games.	http://proceedings.mlr.press/v151/zhao22b.html	Yulai Zhao, Yuandong Tian, Jason Lee, Simon Du
