title	abstract	url	authors
Look-Ahead Acquisition Functions for Bernoulli Level Set Estimation	Level set estimation (LSE) is the problem of identifying regions where an unknown function takes values above or below a specified threshold. Active sampling strategies for efficient LSE have primarily been studied in continuous-valued functions. Motivated by applications in human psychophysics where common experimental designs produce binary responses, we study LSE active sampling with Bernoulli outcomes. With Gaussian process classification surrogate models, the look-ahead model posteriors used by state-of-the-art continuous-output methods are intractable. However, we derive analytic expressions for look-ahead posteriors of sublevel set membership, and show how these lead to analytic expressions for a class of look-ahead LSE acquisition functions, including information-based methods. Benchmark experiments show the importance of considering the global look-ahead impact on the entire posterior. We demonstrate a clear benefit to using this new class of acquisition functions on benchmark problems, and on a challenging real-world task of estimating a high-dimensional contrast sensitivity function.	http://proceedings.mlr.press/v151/letham22a.html	Benjamin Letham, Phillip Guan, Chase Tymms, Eytan Bakshy, Michael Shvartsman
Loss as the Inconsistency of a Probabilistic Dependency Graph: Choose Your Model, Not Your Loss Function	"In a world blessed with a great diversity of loss functions, we argue that that choice between them is not a matter of taste or pragmatics, but of model. Probabilistic depencency graphs (PDGs) are probabilistic models that come equipped with a measure of ""inconsistency"". We prove that many standard loss functions arise as the inconsistency of a natural PDG describing the appropriate scenario, and use the same approach to justify a well-known connection between regularizers and priors. We also show that the PDG inconsistency captures a large class of statistical divergences, and detail benefits of thinking of them in this way, including an intuitive visual language for deriving inequalities between them. In variational inference, we find that the ELBO, a somewhat opaque objective for latent variable models, and variants of it arise for free out of uncontroversial modeling assumptions—as do simple graphical proofs of their corresponding bounds. Finally, we observe that inconsistency becomes the log partition function (free energy) in the setting where PDGs are factor graphs."	http://proceedings.mlr.press/v151/richardson22b.html	Oliver E. Richardson
Low-Pass Filtering SGD for Recovering Flat Optima in the Deep Learning Optimization Landscape	In this paper, we study the sharpness of a deep learning (DL) loss landscape around local minima in order to reveal systematic mechanisms underlying the generalization abilities of DL models. Our analysis is performed across varying network and optimizer hyper-parameters, and involves a rich family of different sharpness measures. We compare these measures and show that the low-pass filter based measure exhibits the highest correlation with the generalization abilities of DL models, has high robustness to both data and label noise, and furthermore can track the double descent behavior for neural networks. We next derive the optimization algorithm, relying on the low-pass filter (LPF), that actively searches the flat regions in the DL optimization landscape using SGD-like procedure. The update of the proposed algorithm, that we call LPF-SGD, is determined by the gradient of the convolution of the filter kernel with the loss function and can be efficiently computed using MC sampling. We empirically show that our algorithm achieves superior generalization performance compared to the common DL training strategies. On the theoretical front we prove that LPF-SGD converges to a better optimal point with smaller generalization error than SGD.	http://proceedings.mlr.press/v151/bisla22a.html	Devansh Bisla, Jing Wang, Anna Choromanska
MLDemon:Deployment Monitoring for Machine Learning Systems	Post-deployment monitoring of ML systems is critical for ensuring reliability, especially as new user inputs can differ from the training distribution. Here we propose a novel approach, MLDemon, for ML DEployment MONitoring. MLDemon integrates both unlabeled data and a small amount of on-demand labels to produce a real-time estimate of the ML model's current performance on a given data stream. Subject to budget constraints, MLDemon decides when to acquire additional, potentially costly, expert supervised labels to verify the model. On temporal datasets with diverse distribution drifts and models, MLDemon outperforms existing approaches. Moreover, we provide theoretical analysis to show that MLDemon is minimax rate optimal for a broad class of distribution drifts.	http://proceedings.mlr.press/v151/ginart22a.html	Tony Ginart, Martin Jinye Zhang, James Zou
MT3: Meta Test-Time Training for Self-Supervised Test-Time Adaption	An unresolved problem in Deep Learning is the ability of neural networks to cope with domain shifts during test-time, imposed by commonly fixing network parameters after training. Our proposed method Meta Test-Time Training (MT3), however, breaks this paradigm and enables adaption at test-time. We combine meta-learning, self-supervision and test-time training to learn to adapt to unseen test distributions. By minimizing the self-supervised loss, we learn task-specific model parameters for different tasks. A meta-model is optimized such that its adaption to the different task-specific models leads to higher performance on those tasks. During test-time a single unlabeled image is sufficient to adapt the meta-model parameters. This is achieved by minimizing only the self-supervised loss component resulting in a better prediction for that image. Our approach significantly improves the state-of-the-art results on the CIFAR-10-Corrupted image classification benchmark.	http://proceedings.mlr.press/v151/bartler22a.html	Alexander Bartler, Andre Bühler, Felix Wiewel, Mario Döbler, Bin Yang
Maillard Sampling: Boltzmann Exploration Done Optimally	The PhD thesis of Maillard (2013) presents a rather obscure algorithm for the $K$-armed bandit problem. This less-known algorithm, which we call Maillard sampling (MS), computes the probability of choosing each arm in a closed form, which is not true for Thompson sampling, a widely-adopted bandit algorithm in the industry. This means that the bandit-logged data from running MS can be readily used for counterfactual evaluation, unlike Thompson sampling. Motivated by such merit, we revisit MS and perform an improved analysis to show that it achieves both the asymptotical optimality and $\sqrt{KT\log{T}}$ minimax regret bound where $T$ is the time horizon, which matches the known bounds for asymptotically optimal UCB. We then propose a variant of MS called MS$^+$ that improves its minimax bound to $\sqrt{KT\log{K}}$. MS$^+$ can also be tuned to be aggressive (i.e., less exploration) without losing the asymptotic optimality, a unique feature unavailable from existing bandit algorithms. Our numerical evaluation shows the effectiveness of MS$^+$.	http://proceedings.mlr.press/v151/bian22a.html	Jie Bian, Kwang-Sung Jun
Many processors, little time: MCMC for partitions via optimal transport couplings	"Markov chain Monte Carlo (MCMC) methods are often used in clustering since they guarantee asymptotically exact expectations in the infinite-time limit. In finite time, though, slow mixing often leads to poor performance. Modern computing environments offer massive parallelism, but naive implementations of parallel MCMC can exhibit substantial bias. In MCMC samplers of continuous random variables, Markov chain couplings can overcome bias. But these approaches depend crucially on paired chains meetings after a small number of transitions. We show that straightforward applications of existing coupling ideas to discrete clustering variables fail to meet quickly. This failure arises from the ""label-switching problem"": semantically equivalent cluster relabelings impede fast meeting of coupled chains. We instead consider chains as exploring the space of partitions rather than partitions' (arbitrary) labelings. Using a metric on the partition space, we formulate a practical algorithm using optimal transport couplings. Our theory confirms our method is accurate and efficient. In experiments ranging from clustering of genes or seeds to graph colorings, we show the benefits of our coupling in the highly parallel, time-limited regime."	http://proceedings.mlr.press/v151/nguyen22a.html	Tin D. Nguyen, Brian L. Trippe, Tamara Broderick
Margin-distancing for safe model explanation	The growing use of machine learning models in consequential settings has highlighted an important and seemingly irreconcilable tension between transparency and vulnerability to gaming. While this has sparked sizable debate in legal literature, there has been comparatively less technical study of this contention. In this work, we propose a clean-cut formulation of this tension and a way to make the tradeoff between transparency and gaming. We identify the source of gaming as being points close to the decision boundary of the model. And we initiate an investigation on how to provide example-based explanations that are expansive and yet consistent with a version space that is sufficiently uncertain with respect to the boundary points' labels. Finally, we furnish our theoretical results with empirical investigations of this tradeoff on real-world datasets.	http://proceedings.mlr.press/v151/yan22a.html	Tom Yan, Chicheng Zhang
Marginalising over Stationary Kernels with Bayesian Quadrature	Marginalising over families of Gaussian Process kernels produces flexible model classes with well-calibrated uncertainty estimates. Existing approaches require likelihood evaluations of many kernels, rendering them prohibitively expensive for larger datasets. We propose a Bayesian Quadrature scheme to make this marginalisation more efficient and thereby more practical. Through use of maximum mean discrepancies between distributions, we define a kernel over kernels that captures invariances between Spectral Mixture (SM) Kernels. Kernel samples are selected by generalising an information-theoretic acquisition function for warped Bayesian Quadrature. We show that our framework achieves more accurate predictions with better calibrated uncertainty than state-of-the-art baselines, especially when given limited (wall-clock) time budgets.	http://proceedings.mlr.press/v151/hamid22a.html	Saad Hamid, Sebastian Schulze, Michael A. Osborne, Stephen Roberts
Marginalized Operators for Off-policy Reinforcement Learning	In this work, we propose marginalized operators, a new class of off-policy evaluation operators for reinforcement learning. Marginalized operators strictly generalize generic multi-step operators, such as Retrace, as special cases. Marginalized operators also suggest a form of sample-based estimates with potential variance reduction, compared to sample-based estimates of the original multi-step operators. We show that the estimates for marginalized operators can be computed in a scalable way, which also generalizes prior results on marginalized importance sampling as special cases. Finally, we empirically demonstrate that marginalized operators provide performance gains to off-policy evaluation problems and downstream policy optimization algorithms.	http://proceedings.mlr.press/v151/tang22a.html	Yunhao Tang, Mark Rowland, Remi Munos, Michal Valko
Masked Training of Neural Networks with Partial Gradients	State-of-the-art training algorithms for deep learning models are based on stochastic gradient descent (SGD). Recently, many variations have been explored: perturbing parameters for better accuracy (such as in Extragradient), limiting SGD updates to a subset of parameters for increased efficiency (such as meProp) or a combination of both (such as Dropout). However, the convergence of these methods is often not studied in theory. We propose a unified theoretical framework to study such SGD variants—encompassing the aforementioned algorithms and additionally a broad variety of methods used for communication efficient training or model compression. Our insights can be used as a guide to improve the efficiency of such methods and facilitate generalization to new applications. As an example, we tackle the task of jointly training networks, a version of which (limited to sub-networks) is used to create Slimmable Networks. By training a low-rank Transformer jointly with a standard one we obtain superior performance than when it is trained separately.	http://proceedings.mlr.press/v151/mohtashami22a.html	Amirkeivan Mohtashami, Martin Jaggi, Sebastian Stich
Mean Nyström Embeddings for Adaptive Compressive Learning	Compressive learning is an approach to efficient large scale learning based on sketching an entire dataset to a single mean embedding (the sketch), i.e. a vector of generalized moments. The learning task is then approximately solved as an inverse problem using an adapted parametric model. Previous works in this context have focused on sketches obtained by averaging random features, that while universal can be poorly adapted to the problem at hand. In this paper, we propose and study the idea of performing sketching based on data-dependent Nyström approximation. From a theoretical perspective we prove that the excess risk can be controlled under a geometric assumption relating the parametric model used to learn from the sketch and the covariance operator associated to the task at hand. Empirically, we show for k-means clustering and Gaussian modeling that for a fixed sketch size, Nyström sketches indeed outperform those built with random features.	http://proceedings.mlr.press/v151/chatalic22a.html	Antoine Chatalic, Luigi Carratino, Ernesto De Vito, Lorenzo Rosasco
Measuring the robustness of Gaussian processes to kernel choice	Gaussian processes (GPs) are used to make medical and scientific decisions, including in cardiac care and monitoring of carbon dioxide emissions. Notably, the choice of GP kernel is often somewhat arbitrary. In particular, uncountably many kernels typically align with qualitative prior knowledge (e.g. function smoothness or stationarity). But in practice, data analysts choose among a handful of convenient standard kernels (e.g. squared exponential). In the present work, we ask: Would decisions made with a GP differ under other, qualitatively interchangeable kernels? We show how to formulate this sensitivity analysis as a constrained optimization problem over a finite-dimensional space. We can then use standard optimizers to identify substantive changes in relevant decisions made with a GP. We demonstrate in both synthetic and real-world examples that decisions made with a GP can exhibit substantial sensitivity to kernel choice, even when prior draws are qualitatively interchangeable to a user.	http://proceedings.mlr.press/v151/stephenson22a.html	William T. Stephenson, Soumya Ghosh, Tin D. Nguyen, Mikhail Yurochkin, Sameer Deshpande, Tamara Broderick
Meta Learning MDPs with linear transition models	We study meta-learning in Markov Decision Processes (MDP) with linear transition models in the undiscounted episodic setting. Under a task sharedness metric based on model proximity we study task families characterized by a distribution over models specified by a bias term and a variance component. We then propose BUC-MatrixRL, a version of the UC-Matrix RL algorithm and show it can meaningfully leverage a set of sampled training tasks to quickly solve a test task sampled from the same task distribution by learning an estimator of the bias parameter of the task distribution. The analysis leverages and extends results in the learning to learn linear regression and linear bandit setting to the more general case of MDP's with linear transition models. We prove that compared to learning the tasks in isolation, BUC-Matrix RL provides significant improvements in the transfer regret for high bias low variance task distributions.	http://proceedings.mlr.press/v151/muller22a.html	Robert Müller, Aldo Pacchiano
Metalearning Linear Bandits by Prior Update	Fully Bayesian approaches to sequential decision-making assume that problem parameters are generated from a known prior. In practice, such information is often lacking. This problem is exacerbated in setups with partial information, where a misspecified prior may lead to poor exploration and performance. In this work we prove, in the context of stochastic linear bandits and Gaussian priors, that as long as the prior is sufficiently close to the true prior, the performance of the applied algorithm is close to that of the algorithm that uses the true prior. Furthermore, we address the task of learning the prior through metalearning, where a learner updates her estimate of the prior across multiple task instances in order to improve performance on future tasks. We provide an algorithm and regret bounds, demonstrate its effectiveness in comparison to an algorithm that knows the correct prior, and support our theoretical results empirically. Our theoretical results hold for a broad class of algorithms, including Thompson Sampling and Information Directed Sampling.	http://proceedings.mlr.press/v151/peleg22a.html	Amit Peleg, Naama Pearl, Ron Meir
Minimal Expected Regret in Linear Quadratic Control	We consider the problem of online learning in Linear Quadratic Control systems whose state transition and state-action transition matrices $A$ and $B$ may be initially unknown. We devise an online learning algorithm and provide guarantees on its expected regret. This regret at time $T$ is upper bounded (i) by $\widetilde{O}((d_u+d_x)\sqrt{d_xT})$ when $A$ and $B$ are unknown, (ii) by $\widetilde{O}(d_x^2\log(T))$ if only $A$ is unknown, and (iii) by $\widetilde{O}(d_x(d_u+d_x)\log(T))$ if only $B$ is unknown and under some mild non-degeneracy condition ($d_x$ and $d_u$ denote the dimensions of the state and of the control input, respectively). These regret scalings are minimal in $T$, $d_x$ and $d_u$ as they match existing lower bounds in scenario (i) when $d_x\le d_u$ [SF20], and in scenario (ii) [Lai86]. We conjecture that our upper bounds are also optimal in scenario (iii) (there is no known lower bound in this setting). Existing online algorithms proceed in epochs of (typically exponentially) growing durations. The control policy is fixed within each epoch, which considerably simplifies the analysis of the estimation error on $A$ and $B$ and hence of the regret. Our algorithm departs from this design choice: it is a simple variant of certainty-equivalence regulators, where the estimates of $A$ and $B$ and the resulting control policy can be updated as frequently as we wish, possibly at every step. Quantifying the impact of such a constantly-varying control policy on the performance of these estimates and on the regret constitutes one of the technical challenges tackled in this paper.	http://proceedings.mlr.press/v151/jedra22a.html	Yassir Jedra, Alexandre Proutiere
Minimax Kernel Machine Learning for a Class of Doubly Robust Functionals with Application to Proximal Causal Inference	Robins et al. (2008) introduced a class of influence functions (IFs) which could be used to obtain doubly robust moment functions for the corresponding parameters. However, that class does not include the IF of parameters for which the nuisance functions are solutions to integral equations. Such parameters are particularly important in the field of causal inference, specifically in the recently proposed proximal causal inference framework of Tchetgen Tchetgen et al. (2020), which allows for estimating the causal effect in the presence of latent confounders. In this paper, we first extend the class of Robins et al. to include doubly robust IFs in which the nuisance functions are solutions to integral equations. Then we demonstrate that the double robustness property of these IFs can be leveraged to construct estimating equations for the nuisance functions, which enables us to solve the integral equations without resorting to parametric models. We frame the estimation of the nuisance functions as a minimax optimization problem. We provide convergence rates for the nuisance functions and conditions required for asymptotic linearity of the estimator of the parameter of interest. The experiment results demonstrate that our proposed methodology leads to robust and high-performance estimators for average causal effect in the proximal causal inference framework.	http://proceedings.mlr.press/v151/ghassami22a.html	Amiremad Ghassami, Andrew Ying, Ilya Shpitser, Eric Tchetgen Tchetgen
Minimax Optimization: The Case of Convex-Submodular	Minimax optimization has been central in addressing various applications in machine learning, game theory, and control theory. Prior literature has thus far mainly focused on studying such problems in the continuous domain, e.g., convex-concave minimax optimization is now understood to a significant extent. Nevertheless, minimax problems extend far beyond the continuous domain to mixed continuous-discrete domains or even fully discrete domains. In this paper, we study mixed continuous-discrete minimax problems where the minimization is over a continuous variable belonging to Euclidean space and the maximization is over subsets of a given ground set. We introduce the class of convex-submodular minimax problems, where the objective is convex with respect to the continuous variable and submodular with respect to the discrete variable. Even though such problems appear frequently in machine learning applications, little is known about how to address them from algorithmic and theoretical perspectives. For such problems, we first show that obtaining saddle points are hard up to any approximation, and thus introduce new notions of (near-) optimality. We then provide several algorithmic procedures for solving convex and monotone-submodular minimax problems and characterize their convergence rates, computational complexity, and quality of the final solution according to our notions of optimally. Our proposed algorithms are iterative and combine tools from both discrete and continuous optimization. Finally, we provide numerical experiments to showcase the effectiveness of our purposed methods.	http://proceedings.mlr.press/v151/adibi22a.html	Arman Adibi, Aryan Mokhtari, Hamed Hassani
Mitigating Bias in Calibration Error Estimation	For an AI system to be reliable, the confidence it expresses in its decisions must match its accuracy. To assess the degree of match, examples are typically binned by confidence and the per-bin mean confidence and accuracy are compared. Most research in calibration focuses on techniques to reduce this empirical measure of calibration error, ECE_bin. We instead focus on assessing statistical bias in this empirical measure, and we identify better estimators. We propose a framework through which we can compute the bias of a particular estimator for an evaluation data set of a given size. The framework involves synthesizing model outputs that have the same statistics as common neural architectures on popular data sets. We find that binning-based estimators with bins of equal mass (number of instances) have lower bias than estimators with bins of equal width. Our results indicate two reliable calibration-error estimators: the debiased estimator (Brocker, 2012; Ferro and Fricker, 2012) and a method we propose, ECE_sweep, which uses equal-mass bins and chooses the number of bins to be as large as possible while preserving monotonicity in the calibration function. With these estimators, we observe improvements in the effectiveness of recalibration methods and in the detection of model miscalibration.	http://proceedings.mlr.press/v151/roelofs22a.html	Rebecca Roelofs, Nicholas Cain, Jonathon Shlens, Michael C. Mozer
Mode estimation on matrix manifolds: Convergence and robustness	Data on matrix manifolds are ubiquitous on a wide range of research fields. The key issue is estimation of the modes (i.e., maxima) of the probability density function underlying the data. For instance, local modes (i.e., local maxima) can be used for clustering, while the global mode (i.e., the global maximum) is a robust alternative to the Frechet mean. Previously, to estimate the modes, an iterative method has been proposed based on a Riemannian gradient estimator and empirically showed the superior performance in clustering (Ashizawa et al., 2017). However, it has not been theoretically investigated if the iterative method is able to capture the modes based on the gradient estimator. In this paper, we propose simple iterative methods for mode estimation on matrix manifolds based on the Euclidean metric. A key contribution is to perform theoretical analysis and establish sufficient conditions for the monotonic ascending and convergence of the proposed iterative methods. In addition, for the previous method, we prove the monotonic ascending property towards a mode. Thus, our work can be also regarded as compensating for the lack of theoretical analysis in the previous method. Furthermore, the robustness of the iterative methods is theoretically investigated in terms of the breakdown point. Finally, the proposed methods are experimentally demonstrated to work well in clustering and robust mode estimation on matrix manifolds.	http://proceedings.mlr.press/v151/sasaki22a.html	Hiroaki Sasaki, Jun-Ichiro Hirayama, Takafumi Kanamori
