title	abstract	url	authors
A Bandit Model for Human-Machine Decision Making with Private Information and Opacity	Applications of machine learning inform human decision makers in a broad range of tasks. The resulting problem is usually formulated in terms of a single decision maker. We argue that it should rather be described as a two-player learning problem where one player is the machine and the other the human. While both players try to optimize the final decision, the setup is often characterized by (1) the presence of private information and (2) opacity, that is imperfect understanding between the decision makers. We prove that both properties can complicate decision making considerably. A lower bound quantifies the worst-case hardness of optimally advising a decision maker who is opaque or has access to private information. An upper bound shows that a simple coordination strategy is nearly minimax optimal. More efficient learning is possible under certain assumptions on the problem, for example that both players learn to take actions independently. Such assumptions are implicit in existing literature, for example in medical applications of machine learning, but have not been described or justified theoretically.	http://proceedings.mlr.press/v151/bordt22a.html	Sebastian Bordt, Ulrike Von Luxburg
A Bayesian Approach for Stochastic Continuum-armed Bandit with Long-term Constraints	Despite many valuable advances in the domain of online convex optimization over the last decade, many machine learning and networking problems of interest do not fit into that framework due to their nonconvex objectives and the presence of constraints. This motivates us in this paper to go beyond convexity and study the problem of stochastic continuum-armed bandit with long-term constraints. For noiseless observations of constraint functions, we propose a generic method using a Bayesian approach based on a class of penalty functions, and prove that it can achieve a sublinear regret with respect to the global optimum and a sublinear constraint violation (CV), which can match the best results of previous methods. Additionally, we propose another method to deal with the case where constraint functions are observed with noise, which can achieve a sublinear regret and a sublinear CV with more assumptions. Finally, we use two experiments to compare our methods with two benchmark methods in online optimization and Bayesian optimization, which demonstrates the advantages of our algorithms.	http://proceedings.mlr.press/v151/shi22c.html	Zai Shi, Atilla Eryilmaz
A Bayesian Model for Online Activity Sample Sizes	In many contexts it is useful to predict the number of individuals in some population who will initiate a particular activity during a given period. For example, the number of users who will install a software update, the number of customers who will use a new feature on a website or who will participate in an A/B test. In practical settings, there is heterogeneity amongst individuals with regard to the distribution of time until they will initiate. For these reasons it is inappropriate to assume that the number of new individuals observed on successive days will be identically distributed. Given observations on the number of unique users participating in an initial period, we present a simple but novel Bayesian method for predicting the number of additional individuals who will participate during a subsequent period. We illustrate the performance of the method in predicting sample size in online experimentation.	http://proceedings.mlr.press/v151/richardson22a.html	Thomas S. Richardson, Yu Liu, James Mcqueen, Doug Hains
A Class of Geometric Structures in Transfer Learning: Minimax Bounds and Optimality	We study the problem of transfer learning, observing that previous efforts to understand its information-theoretic limits do not fully exploit the geometric structure of the source and target domains. In contrast, our study first illustrates the benefits of incorporating a natural geometric structure within a linear regression model, which corresponds to the generalized eigenvalue problem formed by the Gram matrices of both domains. We next establish a finite-sample minimax lower bound, propose a refined model interpolation estimator that enjoys a matching upper bound, and then extend our framework to multiple source domains and generalized linear models. Surprisingly, as long as information is available on the distance between the source and target parameters, negative-transfer does not occur. Simulation studies show that our proposed interpolation estimator outperforms state-of-the-art transfer learning methods in both moderate- and high-dimensional settings.	http://proceedings.mlr.press/v151/zhang22a.html	Xuhui Zhang, Jose Blanchet, Soumyadip Ghosh, Mark S. Squillante
A Complete Characterisation of ReLU-Invariant Distributions	We give a complete characterisation of families of probability distributions that are invariant under the action of ReLU neural network layers (in the same way that the family of Gaussian distributions is invariant to affine linear transformations). The need for such families arises during the training of Bayesian networks or the analysis of trained neural networks, e.g., in the context of uncertainty quantification (UQ) or explainable artificial intelligence (XAI). We prove that no invariant parametrised family of distributions can exist unless at least one of the following three restrictions holds: First, the network layers have a width of one, which is unreasonable for practical neural networks. Second, the probability measures in the family have finite support, which basically amounts to sampling distributions. Third, the parametrisation of the family is not locally Lipschitz continuous, which excludes all computationally feasible families. Finally, we show that these restrictions are individually necessary. For each of the three cases we can construct an invariant family exploiting exactly one of the restrictions but not the other two.	http://proceedings.mlr.press/v151/macdonald22a.html	Jan Macdonald, Stephan Wäldchen
A Contraction Theory Approach to Optimization Algorithms from Acceleration Flows	Much recent interest has focused on the design of optimization algorithms from the discretization of an associated optimization flow, i.e., a system of differential equations (ODEs) whose trajectories solve an associated optimization problem. Such a design approach poses an important problem: how to find a principled methodology to design and discretize appropriate ODEs. This paper aims to provide a solution to this problem through the use of contraction theory. We first introduce general mathematical results that explain how contraction theory guarantees the stability of the implicit and explicit Euler integration methods. Then, we propose a novel system of ODEs, namely the Accelerated-Contracting-Nesterov flow, and use contraction theory to establish it is an optimization flow with exponential convergence rate, from which the linear convergence rate of its associated optimization algorithm is immediately established. Remarkably, a simple explicit Euler discretization of this flow corresponds to the Nesterov acceleration method. Finally, we present how our approach leads to performance guarantees in the design of optimization algorithms for time-varying optimization problems.	http://proceedings.mlr.press/v151/cisneros-velarde22a.html	Pedro Cisneros-Velarde, Francesco Bullo
A Cramér Distance perspective on Quantile Regression based Distributional Reinforcement Learning	Distributional reinforcement learning (DRL) extends the value-based approach by approximating the full distribution over future returns instead of the mean only, providing a richer signal that leads to improved performances. Quantile Regression (QR)-based methods like QR-DQN project arbitrary distributions into a parametric subset of staircase distributions by minimizing the 1-Wasserstein distance. However, due to biases in the gradients, the quantile regression loss is used instead for training, guaranteeing the same minimizer and enjoying unbiased gradients. Non-crossing constraints on the quantiles have been shown to improve the performance of QR-DQN for uncertainty-based exploration strategies. The contribution of this work is in the setting of fixed quantile levels and is twofold. First, we prove that the Cramer distance yields a projection that coincides with the 1-Wasserstein one and that, under non-crossing constraints, the squared Cramer and the quantile regression losses yield collinear gradients, shedding light on the connection between these important elements of DRL. Second, we propose a low complexity algorithm to compute the Cramer distance.	http://proceedings.mlr.press/v151/lheritier22a.html	Alix Lheritier, Nicolas Bondoux
A Dimensionality Reduction Method for Finding Least Favorable Priors with a Focus on Bregman Divergence	A common way of characterizing minimax estimators in point estimation is by moving the problem into the Bayesian estimation domain and finding a least favorable prior distribution. The Bayesian estimator induced by a least favorable prior, under mild conditions, is then known to be minimax. However, finding least favorable distributions can be challenging due to inherent optimization over the space of probability distributions, which is infinite-dimensional. This paper develops a dimensionality reduction method that allows us to move the optimization to a finite-dimensional setting with an explicit bound on the dimension. The benefit of this dimensionality reduction is that it permits the use of popular algorithms such as projected gradient ascent to find least favorable priors. Throughout the paper, in order to make progress on the problem, we restrict ourselves to Bayesian risks induced by a relatively large class of loss functions, namely Bregman divergences.	http://proceedings.mlr.press/v151/dytso22a.html	Alex R. Dytso, Mario Goldenbaum, H. Vincent Poor, Shlomo Shamai
A Dual Approach to Constrained Markov Decision Processes with Entropy Regularization	We study entropy-regularized constrained Markov decision processes (CMDPs) under the soft-max parameterization, in which an agent aims to maximize the entropy-regularized value function while satisfying constraints on the expected total utility. By leveraging the entropy regularization, our theoretical analysis shows that its Lagrangian dual function is smooth and the Lagrangian duality gap can be decomposed into the primal optimality gap and the constraint violation. Furthermore, we propose an accelerated dual-descent method for entropy-regularized CMDPs. We prove that our method achieves the global convergence rate $\widetilde{\mathcal{O}}(1/T)$ for both the optimality gap and the constraint violation for entropy-regularized CMDPs. A discussion about a linear convergence rate for CMDPs with a single constraint is also provided.	http://proceedings.mlr.press/v151/ying22a.html	Donghao Ying, Yuhao Ding, Javad Lavaei
A Globally Convergent Evolutionary Strategy for Stochastic Constrained Optimization with Applications to Reinforcement Learning	Evolutionary strategies have recently been shown to achieve competing levels of performance for complex optimization problems in reinforcement learning. In such problems, one often needs to optimize an objective function subject to a set of constraints, including for instance constraints on the entropy of a policy or to restrict the possible set of actions or states accessible to an agent. Convergence guarantees for evolutionary strategies to optimize stochastic constrained problems are however lacking in the literature. In this work, we address this problem by designing a novel optimization algorithm with a sufficient decrease mechanism that ensures convergence and that is based only on estimates of the functions. We demonstrate the applicability of this algorithm on two types of experiments: i) a control task for maximizing rewards and ii) maximizing rewards subject to a non-relaxable set of constraints.	http://proceedings.mlr.press/v151/diouane22a.html	Youssef Diouane, Aurelien Lucchi, Vihang Prakash Patil
A Last Switch Dependent Analysis of Satiation and Seasonality in Bandits	Motivated by the fact that humans like some level of unpredictability or novelty, and might therefore get quickly bored when interacting with a stationary policy, we introduce a novel non-stationary bandit problem, where the expected reward of an arm is fully determined by the time elapsed since the arm last took part in a switch of actions. Our model generalizes previous notions of delay-dependent rewards, and also relaxes most assumptions on the reward function. This enables the modeling of phenomena such as progressive satiation and periodic behaviours. Building upon the Combinatorial Semi-Bandits (CSB) framework, we design an algorithm and prove a bound on its regret with respect to the optimal non-stationary policy (which is NP-hard to compute). Similarly to previous works, our regret analysis is based on defining and solving an appropriate trade-off between approximation and estimation. Preliminary experiments confirm the superiority of our algorithm over both the oracle greedy approach and a vanilla CSB solver.	http://proceedings.mlr.press/v151/laforgue22a.html	Pierre Laforgue, Giulia Clerici, Nicolò Cesa-Bianchi, Ran Gilad-Bachrach
A Manifold View of Adversarial Risk	The adversarial risk of a machine learning model has been widely studied. Most previous works assume that the data lies in the whole ambient space. We propose to take a new angle and take the manifold assumption into consideration. Assuming data lies in a manifold, we investigate two new types of adversarial risk, the normal adversarial risk due to perturbation along normal direction, and the in-manifold adversarial risk due to perturbation within the manifold. We prove that the classic adversarial risk can be bounded from both sides using the normal and in-manifold adversarial risks. We also show with a surprisingly pessimistic case that the standard adversarial risk can be nonzero even when both normal and in-manifold risks are zero. We finalize the paper with empirical studies supporting our theoretical results. Our results suggest the possibility of improving the robustness of a classifier by only focusing on the normal adversarial risk.	http://proceedings.mlr.press/v151/zhang22h.html	Wenjia Zhang, Yikai Zhang, Xiaoling Hu, Mayank Goswami, Chao Chen, Dimitris N. Metaxas
A New Notion of Individually Fair Clustering: $α$-Equitable $k$-Center	Clustering is a fundamental problem in unsupervised machine learning, and due to its numerous societal implications fair variants of it have recently received significant attention. In this work we introduce a novel definition of individual fairness for clustering problems. Specifically, in our model, each point $j$ has a set of other points $\mathcal{S}_j$ that it perceives as similar to itself, and it feels that it is being fairly treated if the quality of service it receives in the solution is $\alpha$-close (in a multiplicative sense, for some given $\alpha \geq 1$) to that of the points in $\mathcal{S}_j$. We begin our study by answering questions regarding the combinatorial structure of the problem, namely for what values of $\alpha$ the problem is well-defined, and what the behavior of the Price of Fairness (PoF) for it is. For the well-defined region of $\alpha$, we provide efficient and easily-implementable approximation algorithms for the $k$-center objective, which in certain cases also enjoy bounded-PoF guarantees. We finally complement our analysis by an extensive suite of experiments that validates the effectiveness of our theoretical results.	http://proceedings.mlr.press/v151/chakrabarti22a.html	Darshan Chakrabarti, John P. Dickerson, Seyed A. Esmaeili, Aravind Srinivasan, Leonidas Tsepenekas
A Non-asymptotic Approach to Best-Arm Identification for Gaussian Bandits	We propose a new strategy for best-arm identification with fixed confidence of Gaussian variables with bounded means and unit variance. This strategy, called Exploration-Biased Sampling, is not only asymptotically optimal: it is to the best of our knowledge the first strategy with non-asymptotic bounds that asymptotically matches the sample complexity. But the main advantage over other algorithms like Track-and-Stop is an improved behavior regarding exploration: Exploration-Biased Sampling is biased towards exploration in a subtle but natural way that makes it more stable and interpretable. These improvements are allowed by a new analysis of the sample complexity optimization problem, which yields a faster numerical resolution scheme and several quantitative regularity results that we believe of high independent interest.	http://proceedings.mlr.press/v151/barrier22a.html	Antoine Barrier, Aurélien Garivier, Tomáš Kocák
A Predictive Approach to Bayesian Nonparametric Survival Analysis	Bayesian nonparametric methods are a popular choice for analysing survival data due to their ability to flexibly model the distribution of survival times. These methods typically employ a nonparametric prior on the survival function that is conjugate with respect to right-censored data. Eliciting these priors, particularly in the presence of covariates, can be challenging and inference typically relies on computationally intensive Markov chain Monte Carlo schemes. In this paper, we build on recent work that recasts Bayesian inference as assigning a predictive distribution on the unseen values of a population conditional on the observed samples, thus avoiding the need to specify a complex prior. We describe a copula-based predictive update which admits a scalable sequential importance sampling algorithm to perform inference that properly accounts for right-censoring. We provide theoretical justification through an extension of Doob's consistency theorem and illustrate the method on a number of simulated and real data sets, including an example with covariates. Our approach enables analysts to perform Bayesian nonparametric inference through only the specification of a predictive distribution.	http://proceedings.mlr.press/v151/fong22a.html	Edwin Fong, Brieuc Lehmann
A Random Matrix Perspective on Mixtures of Nonlinearities in High Dimensions	One of the distinguishing characteristics of modern deep learning systems is their use of neural network architectures with enormous numbers of parameters, often in the millions and sometimes even in the billions. While this paradigm has inspired significant research on the properties of large networks, relatively little work has been devoted to the fact that these networks are often used to model large complex datasets, which may themselves contain millions or even billions of constraints. In this work, we focus on this high-dimensional regime in which both the dataset size and the number of features tend to infinity. We analyze the performance of random feature regression with features $F=f(WX+B)$ for a random weight matrix $W$ and bias vector $B$, obtaining exact formulae for the asymptotic training and test errors for data generated by a linear teacher model. The role of the bias can be understood as parameterizing a distribution over activation functions, and our analysis directly generalizes to such distributions, even those not expressible with a traditional additive bias. Intriguingly, we find that a mixture of nonlinearities can improve both the training and test errors over the best single nonlinearity, suggesting that mixtures of nonlinearities might be useful for approximate kernel methods or neural network architecture design.	http://proceedings.mlr.press/v151/adlam22a.html	Ben Adlam, Jake A. Levinson, Jeffrey Pennington
A Single-Timescale Method for Stochastic Bilevel Optimization	Stochastic bilevel optimization generalizes the classic stochastic optimization from the minimization of a single objective to the minimization of an objective function that depends on the solution of another optimization problem. Recently, bilevel optimization is regaining popularity in emerging machine learning applications such as hyper-parameter optimization and model-agnostic meta learning. To solve this class of optimization problems, existing methods require either double-loop or two-timescale updates, which are sometimes less efficient. This paper develops a new optimization method for a class of stochastic bilevel problems that we term Single-Timescale stochAstic BiLevEl optimization (STABLE) method. STABLE runs in a single loop fashion, and uses a single-timescale update with a fixed batch size. To achieve an $\epsilon$-stationary point of the bilevel problem, STABLE requires ${\cal O}(\epsilon^{-2})$ samples in total; and to achieve an $\epsilon$-optimal solution in the strongly convex case, STABLE requires ${\cal O}(\epsilon^{-1})$ samples. To the best of our knowledge, when STABLE was proposed, it is the first bilevel optimization algorithm achieving the same order of sample complexity as SGD for single-level stochastic optimization.	http://proceedings.mlr.press/v151/chen22e.html	Tianyi Chen, Yuejiao Sun, Quan Xiao, Wotao Yin
A Spectral Perspective of DNN Robustness to Label Noise	Deep networks usually require a massive amount of labeled data for their training. Yet, such data may include some mistakes in the labels. Interestingly, networks have been shown to be robust to such errors. This work uses spectral analysis of their learned mapping to provide an explanation for their robustness. In particular, we relate the smoothness regularization that usually exists in conventional training to the attenuation of high frequencies, which mainly characterize noise. By using a connection between the smoothness and the spectral norm of the network weights, we suggest that one may further improve robustness via spectral normalization. Empirical experiments validate our claims and show the advantage of this normalization for classification with label noise.	http://proceedings.mlr.press/v151/bar22a.html	Oshrat Bar, Amnon Drory, Raja Giryes
A Unified View of SDP-based Neural Network Verification through Completely Positive Programming	Verifying that input-output relationships of a neural network conform to prescribed operational specifications is a key enabler towards deploying these networks in safety-critical applications. Semidefinite programming (SDP)-based approaches to Rectified Linear Unit (ReLU) network verification transcribe this problem into an optimization problem, where the accuracy of any such formulation reflects the level of fidelity in how the neural network computation is represented, as well as the relaxations of intractable constraints. While the literature contains much progress on improving the tightness of SDP formulations while maintaining tractability, comparatively little work has been devoted to the other extreme, i.e., how to most accurately capture the original verification problem before SDP relaxation. In this work, we develop an exact, convex formulation of verification as a completely positive program (CPP), and provide analysis showing that our formulation is minimal–the removal of any constraint fundamentally misrepresents the neural network computation. We leverage our formulation to provide a unifying view of existing approaches, and give insight into the source of large relaxation gaps observed in some cases.	http://proceedings.mlr.press/v151/brown22b.html	Robin A. Brown, Edward Schmerling, Navid Azizan, Marco Pavone
A View of Exact Inference in Graphs from the Degree-4 Sum-of-Squares Hierarchy	Performing inference in graphs is a common task within several machine learning problems, e.g., image segmentation, community detection, among others. For a given undirected connected graph, we tackle the statistical problem of exactly recovering an unknown ground-truth binary labeling of the nodes from a single corrupted observation of each edge. Such problem can be formulated as a quadratic combinatorial optimization problem over the boolean hypercube, where it has been shown before that one can (with high probability and in polynomial time) exactly recover the ground-truth labeling of graphs that have an isoperimetric number that grows with respect to the number of nodes (e.g., complete graphs, regular expanders). In this work, we apply a powerful hierarchy of relaxations, known as the sum-of-squares (SoS) hierarchy, to the combinatorial problem. Motivated by empirical evidence on the improvement in exact recoverability, we center our attention on the degree-4 SoS relaxation and set out to understand the origin of such improvement from a graph theoretical perspective. We show that the solution of the dual of the relaxed problem is related to finding edge weights of the Johnson and Kneser graphs, where the weights fulfill the SoS constraints and intuitively allow the input graph to increase its algebraic connectivity. Finally, as byproduct of our analysis, we derive a novel Cheeger-type lower bound for the algebraic connectivity of graphs with signed edge weights.	http://proceedings.mlr.press/v151/bello22a.html	Kevin Bello, Chuyang Ke, Jean Honorio
