title	abstract	url	authors
Distributed Sparse Multicategory Discriminant Analysis	This paper proposes a convex formulation for sparse multicategory linear discriminant analysis and then extend it to the distributed setting when data are stored across multiple sites. The key observation is that for the purpose of classification it suffices to recover the discriminant subspace which is invariant to orthogonal transformations. Theoretically, we establish statistical properties ensuring that the distributed sparse multicategory linear discriminant analysis performs as good as the centralized version after a few rounds of communications. Numerical studies lend strong support to our methodology and theory.	http://proceedings.mlr.press/v151/chen22b.html	Hengchao Chen, Qiang Sun
Distributionally Robust Structure Learning for Discrete Pairwise Markov Networks	We consider the problem of learning the underlying structure of a general discrete pairwise Markov network. Existing approaches that rely on empirical risk minimization may perform poorly in settings with noisy or scarce data. To overcome these limitations, we propose a computationally efficient and robust learning method for this problem with near-optimal sample complexities. Our approach builds upon distributionally robust optimization (DRO) and maximum conditional log-likelihood. The proposed DRO estimator minimizes the worst-case risk over an ambiguity set of adversarial distributions within bounded transport cost or f-divergence of the empirical data distribution. We show that the primal minimax learning problem can be efficiently solved by leveraging sufficient statistics and greedy maximization in the ostensibly intractable dual formulation. Based on DRO's approximation to Lipschitz and variance regularization, we derive near-optimal sample complexities matching existing results. Extensive empirical evidence with different corruption models corroborates the effectiveness of the proposed methods.	http://proceedings.mlr.press/v151/li22f.html	Yeshu Li, Zhan Shi, Xinhua Zhang, Brian Ziebart
Diversified Sampling for Batched Bayesian Optimization with Determinantal Point Processes	In Bayesian Optimization (BO) we study black-box function optimization with noisy point evaluations and Bayesian priors. Convergence of BO can be greatly sped up by batching, where multiple evaluations of the black-box function are performed in a single round. The main difficulty in this setting is to propose at the same time diverse and informative batches of evaluation points. In this work, we introduce DPP-Batch Bayesian Optimization (DPP-BBO), a universal framework for inducing batch diversity in sampling based BO by leveraging the repulsive properties of Determinantal Point Processes (DPP) to naturally diversify the batch sampling procedure. We illustrate this framework by formulating DPP-Thompson Sampling (DPP-TS) as a variant of the popular Thompson Sampling (TS) algorithm and introducing a Markov Chain Monte Carlo procedure to sample from it. We then prove novel Bayesian simple regret bounds for both classical batched TS as well as our counterpart DPP-TS; with the latter bound being tighter. Our real-world, as well as synthetic, experiments demonstrate improved performance of DPP-BBO over classical batching methods with Gaussian process and Cox process models.	http://proceedings.mlr.press/v151/nava22a.html	Elvis Nava, Mojmir Mutny, Andreas Krause
Diversity and Generalization in Neural Network Ensembles	Ensembles are widely used in machine learning and, usually, provide state-of-the-art performance in many prediction tasks. From the very beginning, the diversity of an ensemble has been identified as a key factor for the superior performance of these models. But the exact role that diversity plays in ensemble models is poorly understood, specially in the context of neural networks. In this work, we combine and expand previously published results in a theoretically sound framework that describes the relationship between diversity and ensemble performance for a wide range of ensemble methods. More precisely, we provide sound answers to the following questions: how to measure diversity, how diversity relates to the generalization error of an ensemble, and how diversity is promoted by neural network ensemble algorithms. This analysis covers three widely used loss functions, namely, the squared loss, the cross-entropy loss, and the 0-1 loss; and two widely used model combination strategies, namely, model averaging and weighted majority vote. We empirically validate this theoretical analysis with neural network ensembles.	http://proceedings.mlr.press/v151/ortega22a.html	Luis A. Ortega, Rafael Cabañas, Andres Masegosa
Double Control Variates for Gradient Estimation in Discrete Latent Variable Models	Stochastic gradient-based optimisation for discrete latent variable models is challenging due to the high variance of gradients. We introduce a variance reduction technique for score function estimators that makes use of double control variates. These control variates act on top of a main control variate, and try to further reduce the variance of the overall estimator. We develop a double control variate for the REINFORCE leave-one-out estimator using Taylor expansions. For training discrete latent variable models, such as variational autoencoders with binary latent variables, our approach adds no extra computational cost compared to standard training with the REINFORCE leave-one-out estimator. We apply our method to challenging high-dimensional toy examples and for training variational autoencoders with binary latent variables. We show that our estimator can have lower variance compared to other state-of-the-art estimators.	http://proceedings.mlr.press/v151/titsias22a.html	Michalis Titsias, Jiaxin Shi
Doubly Mixed-Effects Gaussian Process Regression	We address the multi-task Gaussian process (GP) regression problem with the goal of decomposing input effects on outputs into components shared across or specific to tasks and samples. We propose a family of mixed-effects GPs, including doubly and translated mixed-effects GPs, that performs such a decomposition, while also modeling the complex task relationships. Instead of the tensor product widely used in multi-task GPs, we use the direct sum and Kronecker sum for Cartesian product to combine task and sample covariance functions. With this kernel, the overall input effects on outputs decompose into four components: fixed effects shared across tasks and across samples and random effects specific to each task and to each sample. We describe an efficient stochastic variational inference method for our proposed models that also significantly reduces the cost of inference for the existing mixed-effects GPs. On simulated and real-world data, we demonstrate that our approach provides higher test accuracy and interpretable decomposition.	http://proceedings.mlr.press/v151/ho-yoon22a.html	Jun Ho Yoon, Daniel P. Jeong, Seyoung Kim
Dropout as a Regularizer of Interaction Effects	We examine Dropout through the perspective of interactions. This view provides a symmetry to explain Dropout: given N variables, there are N choose k possible sets of k variables to form an interaction (i.e. O(N^k)); conversely, the probability an interaction of k variables survives Dropout at rate p is (1-p)^k (decaying with k). These rates effectively cancel, and so Dropout regularizes against higher-order interactions. We prove this perspective analytically and empirically. This perspective of Dropout as a regularizer against interaction effects has several practical implications: (1) higher Dropout rates should be used when we need stronger regularization against spurious high-order interactions, (2) caution should be exercised when interpreting Dropout-based explanations and uncertainty measures, and (3) networks trained with Input Dropout are biased estimators. We also compare Dropout to other regularizers and find that it is difficult to obtain the same selective pressure against high-order interactions with these methods.	http://proceedings.mlr.press/v151/lengerich22a.html	Benjamin J. Lengerich, Eric Xing, Rich Caruana
Dual-Level Adaptive Information Filtering for Interactive Image Segmentation	Image segmentation can be performed interactively by accepting user annotations to refine the segmentation. It seeks frequent feedback from humans, and the model is updated with a smaller batch of data in each iteration of the feedback loop. Such a training paradigm requires effective information filtering to guide the model so that it can encode vital information and avoid overfitting due to limited data and inherent heterogeneity and noises thereof. We propose an adaptive interactive segmentation framework to support user interaction while introducing dual-level information filtering to train a robust model. The framework integrates an encoder-decoder architecture with a style-aware augmentation module that applies augmentation to feature maps and customizes the segmentation prediction for different latent styles. It also applies a systematic label softening strategy to generate uncertainty-aware soft labels for model updates. Experiments on both medical and natural image segmentation tasks demonstrate the effectiveness of the proposed framework.	http://proceedings.mlr.press/v151/zheng22b.html	Ervine Zheng, Qi Yu, Rui Li, Pengcheng Shi, Anne Haake
Duel-based Deep Learning system for solving IQ tests	One of the relevant aspects of Artificial General Intelligence is the ability of machines to demonstrate abstract reasoning skills, for instance, through solving (human) IQ tests. This work presents a new approach to machine IQ tests solving formulated as Raven's Progressive Matrices (RPMs), called Duel-IQ. The proposed solution incorporates the concept of a tournament in which the best answer is chosen based on a set of duels between candidate RPM answers. The three relevant aspects are: (1) low computational and design complexity, (2) proposition of two schemes of pairing up candidate answers for the duels and (3) evaluation of the system on a dataset of shapes other than those used for training. Depending on a particular variant, the system reaches up to $82.8%$ accuracy on average in RPM tasks with 5 candidate answers and is on par with human performance and superior to other literature approaches of comparable complexity when training and test sets are from the same distribution.	http://proceedings.mlr.press/v151/tomaszewska22a.html	Paulina Tomaszewska, Adam Żychowski, Jacek Mańdziuk
Effective Nonlinear Feature Selection Method based on HSIC Lasso and with Variational Inference	HSIC Lasso is one of the most effective sparse nonlinear feature selection methods based on the Hilbert-Schmidt independence criterion. We propose an adaptive nonlinear feature selection method, which is based on the HSIC Lasso, that uses a stochastic model with a family of super-Gaussian prior distributions for sparsity enhancement. The method includes easily implementable closed-form update equations that are derived approximately from variational inference and can handle high-dimensional and large datasets. We applied the method to several synthetic datasets and real-world datasets and verified its effectiveness regarding redundancy, computational complexity, and classification and prediction accuracy using the selected features. The results indicate that the method can more effectively remove irrelevant features, leaving only relevant features. In certain problem settings, the method assigned non-zero importance only to the actually relevant features. This is an important characteristic for practical use.	http://proceedings.mlr.press/v151/koyama22a.html	Kazuki Koyama, Keisuke Kiritoshi, Tomomi Okawachi, Tomonori Izumitani
Efficient Algorithms for Extreme Bandits	In this paper, we contribute to the Extreme Bandits problem, a variant of Multi-Armed Bandits in which the learner seeks to collect the largest possible reward. We first study the concentration of the maximum of i.i.d random variables under mild assumptions on the tail of the rewards distributions. This analysis motivates the introduction of Quantile of Maxima (QoMax). The properties of QoMax are sufficient to build an Explore-Then-Commit (ETC) strategy, QoMax-ETC, achieving strong asymptotic guarantees despite its simplicity. We then propose and analyze a more adaptive, anytime algorithm, QoMax-SDA, which combines QoMax with a subsampling method recently introduced by Baudry et al. (2021). Both algorithms are more efficient than existing approaches in two senses: (1) they lead to better empirical performance (2) they enjoy a significant reduction of the storage and computational cost.	http://proceedings.mlr.press/v151/baudry22a.html	Dorian Baudry, Yoan Russac, Emilie Kaufmann
Efficient Hyperparameter Tuning for Large Scale Kernel Ridge Regression	Kernel methods provide a principled approach to nonparametric learning. While their basic implementations scale poorly to large problems, recent advances showed that approximate solvers can efficiently handle massive datasets. A shortcoming of these solutions is that hyperparameter tuning is not taken care of, and left for the user to perform. Hyperparameters are crucial in practice and the lack of automated tuning greatly hinders efficiency and usability. In this paper, we work to fill in this gap focusing on kernel ridge regression based on the Nyström approximation. After reviewing and contrasting a number of hyperparameter tuning strategies, we propose a complexity regularization criterion based on a data dependent penalty, and discuss its efficient optimization. Then, we proceed to a careful and extensive empirical evaluation highlighting strengths and weaknesses of the different tuning strategies. Our analysis shows the benefit of the proposed approach, that we hence incorporate in a library for large scale kernel methods to derive adaptively tuned solutions.	http://proceedings.mlr.press/v151/meanti22a.html	Giacomo Meanti, Luigi Carratino, Ernesto De Vito, Lorenzo Rosasco
Efficient Kernelized UCB for Contextual Bandits	In this paper, we tackle the computational efficiency of kernelized UCB algorithms in contextual bandits. While standard methods require a $\mathcal{O}(CT^3)$ complexity where $T$ is the horizon and the constant $C$ is related to optimizing the UCB rule, we propose an efficient contextual algorithm for large-scale problems. Specifically, our method relies on incremental Nyström approximations of the joint kernel embedding of contexts and actions. This allows us to achieve a complexity of $\mathcal{O}(CTm^2)$ where $m$ is the number of Nyström points. To recover the same regret as the standard kernelized UCB algorithm, $m$ needs to be of order of the effective dimension of the problem, which is at most $\mathcal{O}(\sqrt{T})$ and nearly constant in some cases.	http://proceedings.mlr.press/v151/zenati22a.html	Houssam Zenati, Alberto Bietti, Eustache Diemert, Julien Mairal, Matthieu Martin, Pierre Gaillard
Efficient Online Bayesian Inference for Neural Bandits	"In this paper we present a new algorithm for online (sequential) inference in Bayesian neural networks, and show its suitability for tackling contextual bandit problems. The key idea is to combine the extended Kalman filter (which locally linearizes the likelihood function at each time step) with a (learned or random) low-dimensional affine subspace for the parameters; the use of a subspace enables us to scale our algorithm to models with $\sim 1M$ parameters. While most other neural bandit methods need to store the entire past dataset in order to avoid the problem of ""catastrophic forgetting"", our approach uses constant memory. This is possible because we represent uncertainty about all the parameters in the model, not just the final linear layer. We show good results on the ""Deep Bayesian Bandit Showdown"" benchmark, as well as MNIST and a recommender system."	http://proceedings.mlr.press/v151/duran-martin22a.html	Gerardo Duran-Martin, Aleyna Kara, Kevin Murphy
Efficient and passive learning of networked dynamical systems driven by non-white exogenous inputs	We consider a networked linear dynamical system with p agents/nodes. We study the problem of learning the underlying graph of interactions/dependencies from observations of the nodal trajectories over a time-interval T. We present a regularized non-casual consistent estimator for this problem and analyze its sample complexity over two regimes: (a) where the interval T consists of n i.i.d. observation windows of length T/n (restart and record), and (b) where T is one continuous observation window (consecutive). Using the theory of M-estimators, we show that the estimator recovers the underlying interactions, in either regime, in a time-interval that is logarithmic in the system size p. To the best of our knowledge, this is the first work to analyze the sample complexity of learning linear dynamical systems driven by unobserved not-white wide-sense stationary (WSS) inputs.	http://proceedings.mlr.press/v151/doddi22a.html	Harish Doddi, Deepjyoti Deka, Saurav Talukdar, Murti Salapaka
Efficient computation of the the volume of a polytope in high-dimensions using Piecewise Deterministic Markov Processes	Computing the volume of a polytope in high dimensions is computationally challenging but has wide applications. Current state-of-the-art algorithms to compute such volumes rely on efficient sampling of a Gaussian distribution restricted to the polytope, using e.g. Hamiltonian Monte Carlo. We present a new sampling strategy that uses a Piecewise Deterministic Markov Process. Like Hamiltonian Monte Carlo, this new method involves simulating trajectories of a non-reversible process and inherits similar good mixing properties. However, importantly, the process can be simulated more easily due to its piecewise linear trajectories – and this leads to a reduction of the computational cost by a factor of the dimension of the space. Our experiments indicate that our method is numerically robust and is one order of magnitude faster (or better) than existing methods using Hamiltonian Monte Carlo. On a single core processor, we report computational time of a few minutes up to dimension 500.	http://proceedings.mlr.press/v151/chevallier22a.html	Augustin Chevallier, Frédéric Cazals, Paul Fearnhead
Efficient interventional distribution learning in the PAC framework	We consider the problem of efficiently inferring interventional distributions in a causal Bayesian network from a finite number of observations. Let P be a causal model on a set V of observable variables on a given causal graph G. For sets $X,Y \subseteq V$, and setting x to $X$, $P_x(Y)$ denotes the interventional distribution on Y with respect to an intervention x to variables X. Shpitser and Pearl (AAAI 2006), building on the work of Tian and Pearl (AAAI 2001), proved that the ID algorithm is sound and complete for recovering P_x(Y) from observations. We give the first provably efficient version of the ID algorithm. In particular, under natural assumptions, we give a polynomial-time algorithm that on input a causal graph G on observable variables V, a setting x of a set $X \subseteq V$ of bounded size, outputs succinct descriptions of both an evaluator and a generator for a distribution $\hat{P}$ that is epsilon-close (in total variation distance) to $P_x(Y)$ where $Y = V X$, if $P_x(Y)$ is identifiable. We also show that when Y is an arbitrary subset of $V X$, there is no efficient algorithm that outputs an evaluator of a distribution that is epsilon-close to $P_x(Y)$ unless all problems that have statistical zero-knowledge proofs, including the Graph Isomorphism problem, have efficient randomized algorithms.	http://proceedings.mlr.press/v151/bhattacharyya22a.html	Arnab Bhattacharyya, Sutanu Gayen, Saravanan Kandasamy, Vedant Raval, Vinodchandran N. Variyam
Embedded Ensembles: infinite width limit and operating regimes	A memory efficient approach to ensembling neural networks is to share most weights among the ensembled models by means of a single reference network. We refer to this strategy as Embedded Ensembling (EE); its particular examples are BatchEnsembles and Monte-Carlo dropout ensembles. In this paper we perform a systematic theoretical and empirical analysis of embedded ensembles with different number of models. Theoretically, we use a Neural-Tangent-Kernel-based approach to derive the wide network limit of the gradient descent dynamics. In this limit, we identify two ensemble regimes - independent and collective - depending on the architecture and initialization strategy of ensemble models. We prove that in the independent regime the embedded ensemble behaves as an ensemble of independent models. We confirm our theoretical prediction with a wide range of experiments with finite networks, and further study empirically various effects such as transition between the two regimes, scaling of ensemble performance with the network width and number of models, and dependence of performance on a number of architecture and hyperparameter choices.	http://proceedings.mlr.press/v151/velikanov22a.html	Maksim Velikanov, Roman V. Kail, Ivan Anokhin, Roman Vashurin, Maxim Panov, Alexey Zaytsev, Dmitry Yarotsky
Encrypted Linear Contextual Bandit	Contextual bandit is a general framework for online learning in sequential decision-making problems that has found application in a wide range of domains, including recommendation systems, online advertising, and clinical trials. A critical aspect of bandit methods is that they require to observe the contexts –i.e., individual or group-level data– and rewards in order to solve the sequential problem. The large deployment in industrial applications has increased interest in methods that preserve the users' privacy. In this paper, we introduce a privacy-preserving bandit framework based on homomorphic encryption which allows computations using encrypted data. The algorithm only observes encrypted information (contexts and rewards) and has no ability to decrypt it. Leveraging the properties of homomorphic encryption, we show that despite the complexity of the setting, it is possible to solve linear contextual bandits over encrypted data with a $\widetilde{O}(d\sqrt{T})$ regret bound in any linear contextual bandit problem, while keeping data encrypted.	http://proceedings.mlr.press/v151/garcelon22a.html	Evrard Garcelon, Matteo Pirotta, Vianney Perchet
Entropy Regularized Optimal Transport Independence Criterion	We introduce an independence criterion based on entropy regularized optimal transport. Our criterion can be used to test for independence between two samples. We establish non-asymptotic bounds for our test statistic and study its statistical behavior under both the null hypothesis and the alternative hypothesis. The theoretical results involve tools from U-process theory and optimal transport theory. We also offer a random feature type approximation for large-scale problems, as well as a differentiable program implementation for deep learning applications. We present experimental results on existing benchmarks for independence testing, illustrating the interest of the proposed criterion to capture both linear and nonlinear dependencies in synthetic data and real data.	http://proceedings.mlr.press/v151/liu22h.html	Lang Liu, Soumik Pal, Zaid Harchaoui
Entrywise Recovery Guarantees for Sparse PCA via Sparsistent Algorithms	Sparse Principal Component Analysis (PCA) is a prevalent tool across a plethora of subfield of applied statistics. While several results have characterized the recovery error of the principal eigenvectors, these are typically in spectral or Frobenius norms. In this paper, we provide entrywise $\ell_{2,\infty}$ bounds for Sparse PCA under a general high-dimensional subgaussian design. In particular, our bounds hold for any algorithm that selects the correct support with high probability, those that are sparsistent. Our bound improves upon known results by providing a finer characterization of the estimation error, and our proof uses techniques recently developed for entrywise subspace perturbation theory.	http://proceedings.mlr.press/v151/agterberg22a.html	Joshua Agterberg, Jeremias Sulam
Equivariance Discovery by Learned Parameter-Sharing	"Designing equivariance as an inductive bias into deep-nets has been a prominent approach to build effective models, e.g., a convolutional neural network incorporates translation equivariance. However, incorporating these inductive biases requires knowledge about the equivariance properties of the data, which may not be available, e.g., when encountering a new domain. To address this, we study how to ""discover interpretable equivariances"" from data. Specifically, we formulate this discovery process as an optimization problem over a model's parameter-sharing schemes. We propose to use the partition distance to empirically quantify the accuracy of the recovered equivariance. Also, we theoretically analyze the method for Gaussian data and provide a bound on the mean squared gap between the studied discovery scheme and the oracle scheme. Empirically, we show that the approach recovers known equivariances, such as permutations and shifts, on sum of numbers and spatially-invariant data."	http://proceedings.mlr.press/v151/yeh22b.html	Raymond A. Yeh, Yuan-Ting Hu, Mark Hasegawa-Johnson, Alexander Schwing
