title	abstract	url	authors
DeepVecFont: synthesizing high-quality vector fonts via dual-modality learning	Automatic font generation based on deep learning has aroused a lot of interest in the last decade. However, only a few recently-reported approaches are capable of directly generating vector glyphs and their results are still far from satisfactory. In this paper, we propose a novel method, DeepVecFont, to effectively resolve this problem. Using our method, for the first time, visually-pleasing vector glyphs whose quality and compactness are both comparable to human-designed ones can be automatically generated. The key idea of our DeepVecFont is to adopt the techniques of image synthesis, sequence modeling and differentiable rasterization to exhaustively exploit the dual-modality information (i.e., raster images and vector outlines) of vector fonts. The highlights of this paper are threefold. First, we design a dual-modality learning strategy which utilizes both image-aspect and sequence-aspect features of fonts to synthesize vector glyphs. Second, we provide a new generative paradigm to handle unstructured data (e.g., vector glyphs) by randomly sampling plausible synthesis results to get the optimal one which is further refined under the guidance of generated structured data (e.g., glyph images). Finally, qualitative and quantitative experiments conducted on a publicly-available dataset demonstrate that our method obtains high-quality synthesis results in the applications of vector font generation and interpolation, significantly outperforming the state of the art.	https://dl.acm.org/doi/abs/10.1145/3478513.3480488	Yizhi Wang, Zhouhui Lian
Dementia Eyes: Perceiving Dementia with Augmented Reality	Dementia is a global health crisis, of which there is a need to understand the patients' perception towards improving their quality of life. We propose Dementia Eyes, a mobile AR experience that simulates common visual symptoms of senile dementia based on the known pathology and caregivers' actual experience with patients. Leveraging an iPhone and a Head-Mounted Display (HMD), we developed a real-time application which allows users to see the world from the perspective of an Alzheimer's type of dementia (AD) patient. The experience was validated by professional medical workers in Japan, and the result advocates for the efficacy of the empathy we intended to bring to them.	https://dl.acm.org/doi/abs/10.1145/3478514.3487617	Ximing Shen, Yun Suen Pai, Dai Kiuchi, Kanoko Oishi, Kehan Bao, Tomomi Aoki, Kouta Minamizawa
Depth-Aware Dynamic Projection Mapping using High-speed RGB and IR Projectors	In this paper, we propose a strong system for dynamic projection mapping (DPM). It consists of a high-speed 500-fps camera, high-speed 24-bit 947-fps RGB projector, and newly developed 8-bit 2,880-fps infrared (IR) projector. This configuration allows us to capture the depth map and project the depth-aware image at a high frame rate. We also realize 0.4-ms markerless 3D pose tracking using the depth map by leveraging small inter-frame motions under high-frame-rate capture. We exploit these captured data and apply the depth-aware DPM to an entire scene with low latency, in a setting in which tracking-based and modelless mapping are combined and performed simultaneously.	https://dl.acm.org/doi/abs/10.1145/3476122.3484843	Sora Hisaichi, Kiwamu Sumino, Kunihiro Ueda, Hidenori Kasebe, Tohru Yamashita, Takeshi Yuasa, Uwe Lippmann, Petra Aswendt, Roland Höfling, Yoshihiro Watanabe
Depths of night	Depth of Nights is created by hand-draw brush style in digital 2D animation with some 3D animation and Sand stop motion animation. We would like to create a new and significant visual style. In the storytelling, we use an interesting way to present the dream's world, the real life world and the daydreaming world. It is really an enormous challenge to plan the transitions of linking up those 3 different worlds together.	https://dl.acm.org/doi/abs/10.1145/3463912.3482608	Step Cheung
Development of a Wearable Embedded System providing Tactile and Kinesthetic Haptics Feedback for 3D Interactive Applications	Existing haptic interfaces providing both tactile and kinesthetic feedback for virtual object manipulation are still bulky, expensive and often grounded, limiting users' motion. In this work, we present a wearable, lightweight and affordable embedded system aiming to provide both tactile and kinesthetic feedback in 3D applications. We created a PCB for the circuitry and used inexpensive components. The kinesthetic feedback is provided to the user's hand through a 3D-printed exoskeleton and five servo motors placed on the back of the glove. Tactile feedback is provided to the user's hand through fifteen coin vibration motors, placed in the inner side of the hand and vibrating at three levels. The system is ideal for prototyping and could be customized, thus, making it scalable and upgradable.	https://dl.acm.org/doi/abs/10.1145/3476124.3488653	Michael Roumeliotis, Katerina Mania
Differentiable simulation	Differentiable simulation is emerging as a fundamental building block for many cutting-edge applications in computer graphics, vision and robotics, among others. This course provides an introduction to this topic and an overview of state-of-the-art methods in this context. Starting with the basics of dynamic mechanical systems, we will present a general theoretical framework for differentiable simulation, which we will specialize to rigid bodies, deformable solids, and fluids. A particular focus will be on the different alternatives for computing simulation derivatives, ranging from analytical expressions via sensitivity analysis to reverse-mode automatic differentiation. As an important step towards real-world applications, we also present extensions to non-smooth phenomena such as frictional contact. Finally, we will discuss different ways of integrating differentiable simulation into machine learning frameworks. The material covered in this course is based on the author's own works and experience, complemented by a state-of-the-art review of this young but rapidly evolving field. It will be richly illustrated, annotated, and supported by examples ranging from robotic manipulation of deformable materials to simulation-based capture of dynamic fluids. The theoretical parts will be accompanied by source code examples that will be made available to participants prior to this course.	https://dl.acm.org/doi/abs/10.1145/3476117.3483433	Stelian Coros, Miles Macklin, Bernhard Thomaszewski, Nils Thürey
Differentiable surface triangulation	Triangle meshes remain the most popular data representation for surface geometry. This ubiquitous representation is essentially a hybrid one that decouples continuous from the discrete topological Unfortunately, the combinatorial nature of the triangulation prevents taking derivatives over the space of possible meshings of any given surface. As a result, to date, mesh processing and optimization techniques have been unable to truly take advantage of modular gradient descent components of modern optimization frameworks. In this work, we present a that enables optimization for any per-vertex or per-face differentiable objective function over the space of underlying surface triangulations. Our method builds on the result that 2D triangulation can be achieved by a suitably perturbed weighted Delaunay triangulation. We translate this result into a computational algorithm by proposing a soft relaxation of the classical weighted Delaunay triangulation and optimizing over vertex weights and vertex locations. We extend the algorithm to 3D by decomposing shapes into developable sets and differentiably meshing each set with suitable boundary constraints. We demonstrate the efficacy of our method on various planar and surface meshes on a range of difficult-to-optimize objective functions. Our code can be found online: https://github.com/mrakotosaon/diff-surface-triangulation.	https://dl.acm.org/doi/abs/10.1145/3478513.3480554	Marie-Julie Rakotosaona, Noam Aigerman, Niloy J. Mitra, Maks Ovsjanikov, Paul Guerrero
Differentiable time-gated rendering	The continued advancements of time-of-flight imaging devices have enabled new imaging pipelines with numerous applications. Consequently, several forward rendering techniques capable of accurately and efficiently simulating these devices have been introduced. However, general-purpose differentiable rendering techniques that estimate derivatives of time-of-flight images are still lacking. In this paper, we introduce a new theory of differentiable time-gated rendering that enjoys the generality of differentiating with respect to arbitrary scene parameters. Our theory also allows the design of advanced Monte Carlo estimators capable of handling cameras with near-delta or discontinuous time gates. We validate our theory by comparing derivatives generated with our technique and finite differences. Further, we demonstrate the usefulness of our technique using a few proof-of-concept inverse-rendering examples that simulate several time-of-flight imaging scenarios.	https://dl.acm.org/doi/abs/10.1145/3478513.3480489	Lifan Wu, Guangyan Cai, Ravi Ramamoorthi, Shuang Zhao
Differentiable transient rendering	Recent differentiable rendering techniques have become key tools to tackle many inverse problems in graphics and vision. Existing models, however, assume steady-state light transport, i.e., infinite speed of light. While this is a safe assumption for many applications, recent advances in ultrafast imaging leverage the wealth of information that can be extracted from the exact time of flight of light. In this context, physically-based transient rendering allows to efficiently simulate and analyze light transport considering that the speed of light is indeed finite. In this paper, we introduce a novel differentiable transient rendering framework, to help bring the potential of differentiable approaches into the transient regime. To differentiate the transient path integral we need to take into account that scattering events at path vertices are no longer independent; instead, tracking the time of flight of light requires treating such scattering events at path vertices jointly as a multidimensional, evolving manifold. We thus turn to the generalized transport theorem, and introduce a novel term, which links the time-integrated contribution of a path to its light throughput, and allows us to handle discontinuities in the light and sensor functions. Last, we present results in several challenging scenarios where the time of flight of light plays an important role such as optimizing indices of refraction, non-line-of-sight tracking with nonplanar relay walls, and non-line-of-sight tracking around two corners.	https://dl.acm.org/doi/abs/10.1145/3478513.3480498	Shinyoung Yi, Donggun Kim, Kiseok Choi, Adrian Jarabo, Diego Gutierrez, Min H. Kim
DroneStick: Flying Joystick as a Novel Type of Interface	DroneStick is a novel hands-free method for smooth interaction between a human and a robotic system via one of its agents, without training and any additional handheld or wearable device or infrastructure. A flying joystick (DroneStick), being a part of a multi-robot system, is composed of a flying drone and coiled wire with a vibration motor. By pulling on the coiled wire, the operator commands certain motions of the follower robotic system. The DroneStick system does not require the user to carry any equipment before or after performing the required interaction. DroneStick provides useful feedback to the operator in the form of force transferred through the wire, translation/rotation of the flying joystick, and motor vibrations at the fingertips. Feedback allows users to interact with different forms of robotic systems intuitively. A potential application can enhance an automated 'last mile' delivery when a recipient needs to guide a delivery drone/robot gently to a spot where a parcel has to be dropped.	https://dl.acm.org/doi/abs/10.1145/3476122.3484845	Evgeny Tsykunov, Aleksey Fedoseev, Ekaterina Dorzhieva, Ruslan Agishev, Roman Ibrahimov, Derek Vasquez, Luiza Labazanova, Dzmitry Tsetserukou
Dynamic Neural Face Morphing for Visual Effects	In this work we present a machine learning approach for face morphing in videos, between two or more identities. We devise an autoencoder architecture with distinct decoders for each identity, but with an underlying learnable linear basis for their weights. Each decoder has a learnable parameter that defines the interpolating weights (or ID weights) for the basis which can successfully decode its identity. During inference, the ID weights can be interpolated to produce a range of morphing identities. Our method produces temporally consistent results and allows blending different aspects of the identities by exposing the blending weights for each layer of the decoder network. We deploy our trained models to image compositors as 2D nodes with independent controls for the blending weights. Our approach has been successfully used in production, for the aging of David Beckham in the Malaria Must Die campaign.	https://dl.acm.org/doi/abs/10.1145/3478512.3488596	Lucio Moser, Jason Selfe, Darren Hendler, Doug Roble
Dynamic and Occlusion-Robust Light Field Illumination	There is high demand for dynamic and occlusion-robust illumination to improve lighting quality for portrait photography and assembly. Multiple projectors are required for the light field to achieve such illumination. This paper proposes a dynamic and occlusion-robust illumination technique by employing a light field formed by a lens array instead of using multiple projectors. Dynamic illumination is obtained by introducing a feedback system that follows the motion of the object. The designed lens array incorporates a wide viewing angle, making the system robust against occlusion. The proposed system was evaluated through projections onto a dynamic object.	https://dl.acm.org/doi/abs/10.1145/3476124.3488624	Masahiko Yasui, Yoshihiro Watanabe, Masatoshi Ishikawa
Dynamic neural garments	A vital task of the wider digital human effort is the creation of realistic garments on digital avatars, both in the form of characteristic fold patterns and wrinkles in static frames as well as richness of garment dynamics under avatars' motion. Existing workflow of modeling, simulation, and rendering closely replicates the physics behind real garments, but is tedious and requires repeating most of the workflow under changes to characters' motion, camera angle, or garment resizing. Although data-driven solutions exist, they either focus on static scenarios or only handle dynamics of tight garments. We present a solution that, at test time, takes in body joint motion to directly produce realistic dynamic garment image sequences. Specifically, given the target joint motion sequence of an avatar, we propose to synthesize plausible dynamic garment appearance from a desired viewpoint. Technically, our solution generates a coarse garment proxy sequence, learns deep dynamic features attached to this template, and neurally renders the features to produce appearance changes such as folds, wrinkles, and silhouettes. We demonstrate generalization behavior to both unseen motion and unseen camera views. Further, our network can be fine-tuned to adopt to new body shape and/or background images. We demonstrate our method on a wide range of real and synthetic garments. We also provide comparisons against existing neural rendering and image sequence translation approaches, and report clear quantitative and qualitative improvements. Project page: http://geometry.cs.ucl.ac.uk/projects/2021/DynamicNeuralGarments/	https://dl.acm.org/doi/abs/10.1145/3478513.3480497	Meng Zhang, Tuanfeng Y. Wang, Duygu Ceylan, Niloy J. Mitra
Efficient and robust discrete conformal equivalence with boundary	We describe an efficient algorithm to compute a discrete metric with prescribed Gaussian curvature at all interior vertices and prescribed geodesic curvature along the boundary of a mesh. The metric is (discretely) conformally equivalent to the input metric. Its construction is based on theory developed in [Gu et al. 2018b] and [Springborn 2020], relying on results on hyperbolic ideal Delaunay triangulations. Generality is achieved by considering the surface's intrinsic triangulation as a degree of freedom, and particular attention is paid to the proper treatment of surface boundaries. While via a double cover approach the case with boundary can be reduced to the case without boundary quite naturally, the implied symmetry of the setting causes additional challenges related to stable Delaunay-critical configurations that we address explicitly. We furthermore explore the numerical limits of the approach and derive continuous maps from the discrete metrics.	https://dl.acm.org/doi/abs/10.1145/3478513.3480557	Marcel Campen, Ryan Capouellez, Hanxiao Shen, Leyi Zhu, Daniele Panozzo, Denis Zorin
Efficient spherical harmonic shading for separable BRDF	Spherical Harmonics (SH) are commonly and widely used in computer graphics in order to speed up the evaluation of the rendering equation. With separable BRDF, the diffuse and specular contributions are traditionally computed separately. Our first contribution is to demonstrate that there is a simple relationship between both computations, but one-way, i.e. from specular to diffuse. We show how to deduce the diffuse contribution from the specular contribution, using a single multiplication. This replaces the use of tens of multiplications for some cases up to complex rotations for other cases. Our second contribution is an efficient way to compute the SH product between an arbitrary function and a clamped cosine, much less expensive than the traditional SH triple product.	https://dl.acm.org/doi/abs/10.1145/3478512.3488597	Pierre Mézières, Mathias Paulin
Emotion Guided Speech-Driven Facial Animation	The modern deep neural network has allowed an applicable level of speech-driven facial animation, simulating natural and precise 3D animation from speech data. Regardless, many of the works show weakness in drastic emotional expression and flexibility of the animation. In this work, we introduce emotion guided speech-driven facial animation, simultaneously proceeding with classification and regression from the speech data to generate a controllable level of evident emotional expression on facial animation. Performance using our method shows reasonable expressiveness of facial emotion with controllable flexibility. Extensive experiments indicate that our method generates more expressive facial animation with controllable flexibility compared to previous approaches.	https://dl.acm.org/doi/abs/10.1145/3476124.3488649	Sewhan Chun, Daegeun Choe, Shindong Kang, Shounan An, Youngbak Jo, Insoo Oh
Ensemble denoising for Monte Carlo renderings	Various denoising methods have been proposed to clean up the noise in Monte Carlo (MC) renderings, each having different advantages, disadvantages, and applicable scenarios. In this paper, we present , an optimization-based technique that combines multiple individual MC denoisers. The combined image is modeled as a per-pixel weighted sum of output images from the individual denoisers. Computation of the optimal weights is formulated as a constrained quadratic programming problem, where we apply a dual-buffer strategy to estimate the overall MSE. We further propose an iterative solver to overcome practical issues involved in the optimization. Besides nice theoretical properties, our ensemble denoiser is demonstrated to be effective and robust, and outperforms any individual denoiser across dozens of scenes and different levels of sample rates. We also perform a comprehensive analysis on the selection of individual denoisers to be combined, providing important and practical guides for users.	https://dl.acm.org/doi/abs/10.1145/3478513.3480510	Shaokun Zheng, Fengshi Zheng, Kun Xu, Ling-Qi Yan
EpiScope: Optical Separation of Reflected Components by Rotation of Polygonal Mirror	Separating reflection components is an important task in computer graphics and vision. Episcan3D has been proposed to separate the direct and indirect reflection components in real-time. This method uses a scanning laser projector and a rolling shutter camera, so it requires unmanageably precise geometric alignment and temporal synchronization. In this paper, we propose a novel optical system that achieves the same function without imaging devices. In this method, the ray directions of projection, observation, and presentation are optically and mechanically synchronized by a rotating polygonal mirror. The direct or indirect components can be selected by a mask-based light-field filter. Especially, the selected reflection components can be seen directly by our naked eye, and there are no restrictions on image quality or delays in presentation due to the number of pixels or frame rate of the imaging system.	https://dl.acm.org/doi/abs/10.1145/3478512.3488600	Ryota Maeda, Shinsaku Hiura
Exploration of Visuo-haptic Interactions to Support Learning Leopold's Maneuvers Process in Virtual Reality	We present Leopold's Maneuvers VR, a haptic-enabled virtual reality simulation in which a user determines the size, position, and weight of a fetus within a virtual patient by palpating the patient's abdomen. Users of the application receive corresponding haptic cues (force and vibration) as they touch the fetus through the patient's torso. The physical sensations generated by the SenseGlove, paired with the immersive visuals within the virtual environment, support to create a palpation experience similar to the real Leopold's Maneuvers activity. This application addresses a need in nursing education for an immersive virtual reality experience that integrates direct hand manipulation in the learning of assessment skills.	https://dl.acm.org/doi/abs/10.1145/3478514.3487615	Soo Wan Chun, Jinsil Hwaryoung Seo, Caleb Kicklighter, Elizabeth Wells-Beede, Jack Greene, Tomas Arguello
ExtraNet: real-time extrapolated rendering for low-latency temporal supersampling	Both the frame rate and the latency are crucial to the performance of realtime rendering applications such as video games. Spatial supersampling methods, such as the Deep Learning SuperSampling (DLSS), have been proven successful at decreasing the rendering time of each frame by rendering at a lower resolution. But temporal supersampling methods that directly aim at producing more frames on the fly are still not practically available. This is mainly due to both its own computational cost and the latency introduced by interpolating frames from the future. In this paper, we present ExtraNet, an efficient neural network that predicts accurate shading results on an extrapolated frame, to minimize both the performance overhead and the latency. With the help of the rendered auxiliary geometry buffers of the extrapolated frame, and the temporally reliable motion vectors, we train our ExtraNet to perform two tasks simultaneously: irradiance in-painting for regions that cannot find historical correspondences, and accurate ghosting-free shading prediction for regions where temporal information is available. We present a robust hole-marking strategy to automate the classification of these tasks, as well as the data generation from a series of high-quality production-ready scenes. Finally, we use lightweight gated convolutions to enable fast inference. As a result, our ExtraNet is able to produce plausibly extrapolated frames without easily noticeable artifacts, delivering a 1.5× to near 2× increase in frame rates with minimized latency in practice.	https://dl.acm.org/doi/abs/10.1145/3478513.3480531	Jie Guo, Xihao Fu, Liqiang Lin, Hengjun Ma, Yanwen Guo, Shiqiu Liu, Ling-Qi Yan
