title	abstract	url	authors
QuickETC2: Fast ETC2 texture compression using Luma differences	Compressed textures are indispensable in most 3D graphics applications to reduce memory traffic and increase performance. For higher-quality graphics, the number and size of textures in an application have continuously increased. Additionally, the ETC2 texture format, which is mandatory in OpenGL ES 3.0, OpenGL 4.3, and Android 4.3 (and later versions), requires more complex texture compression than the traditional ETC1 format. As a result, texture compression becomes more and more time-consuming. To accelerate ETC2 compression, we introduce two new compression techniques, named QuickETC2. The first technique is an early compression-mode decision scheme. Instead of testing all ETC1/2 modes to compress a texel block, we select proper modes for each block by exploiting the luma difference of the block to reduce unnecessary compression overhead. The second technique is a fast luma-based T- and H-mode compression method. When clustering each texel into two groups, we replace the 3D RGB space with the 1D luma space and quickly find the two groups that have the minimum luma differences. We also selectively perform the T- or H-mode and reduce its distance candidates, according to the luma differences of each group. We have implemented both techniques with AVX2 intrinsics to exploit SIMD parallelism. According to our experiments, QuickETC2 can compress more than 2000 1K×1K-sized images per second on an octa-core CPU.	https://dl.acm.org/doi/abs/10.1145/3414685.3417787	Jae-Ho Nah
RBF liquids: an adaptive PIC solver using RBF-FD	We introduce a novel liquid simulation approach that combines a spatially adaptive pressure projection solver with the Particle-in-Cell (PIC) method. The solver relies on a generalized version of the Finite Difference (FD) method to approximate the pressure field and its gradients in tree-based grid discretizations, possibly non-graded. In our approach, FD stencils are computed by using meshfree interpolations provided by a variant of Radial Basis Function (RBF), known as RBF-Finite-Difference (RBF-FD). This meshfree version of the FD produces differentiation weights on scattered nodes with high-order accuracy. Our method adapts a quadtree/octree dynamically in a narrow-band around the liquid interface, providing an adaptive particle sampling for the PIC advection step. Furthermore, RBF affords an accurate scheme for velocity transfer between the grid and particles, keeping the system's stability and avoiding numerical dissipation. We also present a data structure that connects the spatial subdivision of a quadtree/octree with the topology of its corresponding dual-graph. Our data structure makes the setup of stencils straightforward, allowing its updating without the need to rebuild it from scratch at each time-step. We show the effectiveness and accuracy of our solver by simulating incompressible inviscid fluids and comparing results with regular PIC-based solvers available in the literature.	https://dl.acm.org/doi/abs/10.1145/3414685.3417794	Rafael Nakanishi, Filipe Nascimento, Rafael Campos, Paulo Pagliosa, Afonso Paiva
RGB2Hands: real-time tracking of 3D hand interactions from monocular RGB video	Tracking and reconstructing the 3D pose and geometry of two hands in interaction is a challenging problem that has a high relevance for several human-computer interaction applications, including AR/VR, robotics, or sign language recognition. Existing works are either limited to simpler tracking settings ( , considering only a single hand or two spatially separated hands), or rely on less ubiquitous sensors, such as depth cameras. In contrast, in this work we present the first real-time method for motion capture of skeletal pose and 3D surface geometry of hands from a single RGB camera that explicitly considers close interactions. In order to address the inherent depth ambiguities in RGB data, we propose a novel multi-task CNN that regresses multiple complementary pieces of information, including segmentation, dense matchings to a 3D hand model, and 2D keypoint positions, together with newly proposed intra-hand relative depth and inter-hand distance maps. These predictions are subsequently used in a generative model fitting framework in order to estimate pose and shape parameters of a 3D hand model for both hands. We experimentally verify the individual components of our RGB two-hand tracking and 3D reconstruction pipeline through an extensive ablation study. Moreover, we demonstrate that our approach offers previously unseen two-hand tracking performance from RGB, and quantitatively and qualitatively outperforms existing RGB-based methods that were not explicitly designed for two-hand interactions. Moreover, our method even performs on-par with depth-based real-time methods.	https://dl.acm.org/doi/abs/10.1145/3414685.3417852	Jiayi Wang, Franziska Mueller, Florian Bernard, Suzanne Sorli, Oleksandr Sotnychenko, Neng Qian, Miguel A. Otaduy, Dan Casas, Christian Theobalt
Rainbow tunnel	A still photo from artificial life, this is a frozen moment from the movement of simple shapes. Repeated geometric forms were rotated and transformed over time and complex interwoven abstract patterns emerged. These unexpected forms are born from motion and feedback. Initial graphical parameters were predefined and the patterned evolution was set in motion. When the motion is paused the cellular beauty of individual frames is revealed. Chance plays its part in this phenomenon. Individual parameters are predetermined but the end result is indeterminate. The space between known quantities is where the unexpected patterns and lights emerge.	https://dl.acm.org/doi/abs/10.1145/3414686.3427109	Dave Payling
Real-time rendering of decorative sound textures for soundscapes	Audio recordings contain rich information about sound sources and their properties such as the location, loudness, and frequency of events. One prevalent component in sound recordings is the sound texture, which contains a massive number of events. In such a texture, there can be some distinct and repeated sounds that we term as a foreground sound. Birds chirping in the wind is one such decorative sound texture with the chirping as a foreground sound and the wind as a background texture. To render these decorative sound textures in real-time and with high quality, we create two-layer Markov Models to enable smooth transitions from sound grain to sound grain and propose a hierarchical scheme to generate Head-Related Transfer Function filters for localization cues of sounds represented as area/volume sources. Moreover, during the synthesis stage, we provide control over the frequency and intensity of sounds for customization. Lastly, foreground sounds are often blended into background textures such as the sound of rain splats on car surfaces becoming submerged in the background rain. We develop an extraction component that outperforms existing learning-based methods to facilitate our synthesis with perceptible foreground sounds and well-defined textures.	https://dl.acm.org/doi/abs/10.1145/3414685.3417875	Jinta Zheng, Shih-Hsuan Hung, Kyle Hiebel, Yue Zhang
Realistic Volumetric 3D Display Using Physical Materials	Conventional swept volumetric displays can provide accurate physical cues for depth perception. However, the quality of texture reproduction is not high because these displays use high-speed projectors with low bit depth and low resolution. In this study, to address this limitation of swept volumetric displays while retaining their advantages, a new swept volumetric three-dimensional (3D) display is designed using physical materials as screens. Physical materials are directly used to reproduce textures on a displayed 3D surface. Further, our system can achieve hidden-surface removal based on real-time viewpoint tracking.	https://dl.acm.org/doi/abs/10.1145/3415255.3422879	Ray Asahina, Takashi Nomoto, Takatoshi Yoshida, Yoshihiro Watanabe
Reinforced FDM: multi-axis filament alignment with controlled anisotropic strength	The anisotropy of mechanical strength on a 3D printed model can be controlled in a multi-axis 3D printing system as materials can be accumulated along dynamically varied directions. In this paper, we present a new computational framework to generate specially designed layers and toolpaths of multi-axis 3D printing for strengthening a model by aligning filaments along the directions with large stresses. The major challenge comes from how to effectively decompose a solid into a sequence of strength-aware and collision-free working surfaces. We formulate it as a problem to compute an optimized governing field together with a selected orientation of fabrication setup. Iso-surfaces of the governing field are extracted as working surface layers for filament alignment. Supporting structures in curved layers are constructed by extrapolating the governing field to enable the fabrication of overhangs. Compared with planar-layer based Fused Deposition Modeling (FDM) technology, models fabricated by our method can withstand up to 6 35× loads in experimental tests.	https://dl.acm.org/doi/abs/10.1145/3414685.3417834	Guoxin Fang, Tianyu Zhang, Sikai Zhong, Xiangjia Chen, Zichun Zhong, Charlie C. L. Wang
Rendering near-field speckle statistics in scattering media	We introduce rendering algorithms for the simulation of speckle statistics observed in scattering media under coherent near-field imaging conditions. Our work is motivated by the recent proliferation of techniques that use speckle correlations for tissue imaging applications: The ability to simulate the image measurements used by these speckle imaging techniques in a physically-accurate and computationally-efficient way can facilitate the widespread adoption and improvement of these techniques. To this end, we draw inspiration from recently-introduced Monte Carlo algorithms for rendering speckle statistics under far-field conditions (collimated sensor and illumination). We derive variants of these algorithms that are better suited to the near-field conditions (focused sensor and illumination) required by tissue imaging applications. Our approach is based on using Gaussian apodization to approximate the sensor and illumination aperture, as well as von Mises-Fisher functions to approximate the phase function of the scattering material. We show that these approximations allow us to derive closed-form expressions for the focusing operations involved in simulating near-field speckle patterns. As we demonstrate in our experiments, these approximations accelerate speckle rendering simulations by a few orders of magnitude compared to previous techniques, at the cost of negligible bias. We validate the accuracy of our algorithms by reproducing ground truth speckle statistics simulated using wave-optics solvers, and real-material measurements available in the literature. Finally, we use our algorithms to simulate biomedical imaging techniques for focusing through tissue.	https://dl.acm.org/doi/abs/10.1145/3414685.3417813	Chen Bar, Ioannis Gkioulekas, Anat Levin
River's edge	"""River's Edge"" is the title of a series of collage artworks created from images obtained via the Internet through the medium of generative programming. In this series of images, the artist used a keyword associated with his childhood memory ""River's Edge""to conduct an in-depth search for and gather associated images, which he then assembled into vivid and visually appealing collages. In the ""River's Edge"" artwork, blue, gray, and green sections of the collected images were associated with water, stone, and sky. Pieces from hundreds of images were extracted from the Internet in data form, processed, and emplaced in the images. The creative process was based on an algorithm that examined the collected images, extracted appealing sections, subjected them to a limited set of modifications, and then emplaced them into the artwork. Although the algorithm's functionalities are limited to magnification, rotation, and choosing the areas to extract from the collected imagery, the process made it possible to create a wide variety of collages. In the numerous trials that were conducted to develop this art form, several new expressions were identified, and many beautiful patterns were created."	https://dl.acm.org/doi/abs/10.1145/3414686.3427103	Takuya Yamauchi
Roads in you	Roads in You is an interactive biometric-data artwork that allows participants to scan their veins and find the roads that match their vein lines. The vein data as one of the fascinating forms of biometric data contain uniquely complicated lines that resemble the roads and paths surrounding us. The roads resemble how our vein lines are interconnected and how the blood circulates in our bodies in various directions, at various speeds, and in different conditions. This artwork explores the line segmentation and the structure of veins and compares them to roads in the real world. The participants can also export the data and keep them as a personalized souvenir (3d printed sculptures) as part of the artistic experience. Through this project, users can explore the correlation between individuals and environments using the hidden patterns under the skin and vein recognition techniques and image processing. This project also has the potential to lead the way in the interpretation of complicated datasets while providing aesthetically beautiful and mesmerizing visualizations.	https://dl.acm.org/doi/abs/10.1145/3414686.3427143	Yoon Chung Han, Ryan Cottone, Anusha
RoboGrammar: graph grammar for terrain-optimized robot design	We present , a fully automated approach for generating optimized robot structures to traverse given terrains. In this framework, we represent each robot design as a graph, and use a graph grammar to express possible arrangements of physical robot assemblies. Each robot design can then be expressed as a sequence of grammar rules. Using only a small set of rules our grammar can describe hundreds of thousands of possible robot designs. The construction of the grammar limits the design space to designs that can be fabricated. For a given input terrain, the design space is searched to find the top performing robots and their corresponding controllers. We introduce Graph Heuristic Search - a novel method for efficient search of combinatorial design spaces. In Graph Heuristic Search, we explore the design space while simultaneously learning a function that maps incomplete designs (e.g., nodes in the combinatorial search tree) to the best performance values that can be achieved by expanding these incomplete designs. Graph Heuristic Search prioritizes exploration of the most promising branches of the design space. To test our method we optimize robots for a number of challenging and varied terrains. We demonstrate that can successfully generate nontrivial robots that are optimized for a single terrain or a combination of terrains.	https://dl.acm.org/doi/abs/10.1145/3414685.3417831	Allan Zhao, Jie Xu, Mina Konaković-Luković, Josephine Hughes, Andrew Spielberg, Daniela Rus, Wojciech Matusik
Room view	Room View is a piece documenting the view outside of my room in Manhattan, from April to March 2020. I recorded the sound in 30 days of quarantine (including radio, sirens, people clapping for the essential workers, etc.), and several views of the Chrysler Building in different weather conditions. The melting of photographs or videos is triggered by the sounds. Depicting the state of mind when I was absorbed by the view, quiet and slow. As time passing by, the sound became a way I rely on to know what is happening outside my room - in the real world. The portrait mode of the photographs inherits from the idea of how we receive and send out the information through mobile devices. The virtual view becomes our new reality.	https://dl.acm.org/doi/abs/10.1145/3414686.3427122	Yalan Wen
Scan	Scan was inspired by an accident I encountered in 2019. After my arm was injured, I barely remember the details of the accident. Through this work, I'd like to explore the relationship between our body memory and the memory we fill up with our own imaginations. As the strips reveal the scar, the memory of the event is not clear anymore, it's filled with our own interpretation.	https://dl.acm.org/doi/abs/10.1145/3414686.3427123	Yalan Wen
Scene mover: automatic move planning for scene arrangement by deep reinforcement learning	We propose a novel approach for automatically generating a move plan for scene arrangement. Given a scene like an apartment with many furniture objects, to transform its layout into another layout, one would need to determine a collision-free move plan. It could be challenging to design this plan manually because the furniture objects may block the way of each other if not moved properly; and there is a large complex search space of move action sequences that grow exponentially with the number of objects. To tackle this challenge, we propose a learning-based approach to generate a move plan automatically. At the core of our approach is a Monte Carlo tree that encodes possible states of the layout, based on which a search is performed to move a furniture object appropriately in the current layout. We trained a policy neural network embedded with a LSTM module for estimating the best actions to take in the expansion step and simulation step of the Monte Carlo tree search process. Leveraging the power of deep reinforcement learning, the network learned how to make such estimations through millions of trials of moving objects. We demonstrated our approach for moving objects under different scenarios and constraints. We also evaluated our approach on synthetic and real-world layouts, comparing its performance with that of humans and other baseline approaches.	https://dl.acm.org/doi/abs/10.1145/3414685.3417788	Hanqing Wang, Wei Liang, Lap-Fai Yu
Screen-space blue-noise diffusion of monte carlo sampling error via hierarchical ordering of pixels	We present a novel technique for diffusing Monte Carlo sampling error as a blue noise in screen space. We show that automatic diffusion of sampling error can be achieved by ordering the pixels in a way that preserves locality, such as Morton's Z-ordering, and assigning the samples to the pixels from successive sub-sequences of a single low-discrepancy sequence, thus securing well-distributed samples for each pixel, local neighborhoods, and the whole image. We further show that a blue-noise distribution of the error is attainable by scrambling the Z-ordering to induce isotropy. We present an efficient technique to implement this hierarchical scrambling by defining a context-free grammar that describes infinite self-similar lookup trees. Our concept is scalable to arbitrary image resolutions, sample dimensions, and sample count, and supports progressive and adaptive sampling.	https://dl.acm.org/doi/abs/10.1145/3414685.3417881	Abdalla G. M. Ahmed, Peter Wonka
Searching all sources of white	Searching All Sources of White presents the error as the landscape. It is an interactive video installation examining the idea of the limitation of seeing. The projector projects a blue screen while a white spot falls in the middle. Blue is often seen in a digital display namely default screen, calibration screen, sleep mode, and 'Blue Screen of Death'. In an exhibition setting, this work gives the impression of a failure in the display when the projector displays a blue, standbymode. Standby is a component mode in which a system is kept readily available in case an unexpected event occurs. A system may be on standby in case of failure, shortage, or other similar events. The interaction is analogue rather than digital. The work invites the audience's body movement as a variation in the scene. The blue landscape is an illusion to the audience that the display device is having a malfunction situation. The switching text on the bottom first misleads the audience that it is a common standby mode text searching for the input source. It invites the audience to step into the projection area. When the blue light source from the projector is blocked by a body, a yellow light appears. The white spot in the middle is never a white light source. The white results from the addition of complementary-colour light source - yellow and blue. In the RGB colour system, mixing the primary colour blue with the complementary colour yellow would produce the colour white. There is a limitation of the human eyes which cannot analyse a mixture of complementary-colour light, results in perceiving it in white. The malfunction scene and the illusion of colour in human eyes encourage the audience to reflect on the limitations in the spectrum of human visual perception.	https://dl.acm.org/doi/abs/10.1145/3414686.3427131	Gi Wai Echo Hui
Selfie + code III: melancholy	"A selfie is a form of art. Over 1 million selfies are now taken every day. Selfies are not always as spontaneous as they seem. They can be a communication tool like any other that can be manipulated for purposes. Selfie + CODE III is a collection of generative selfie series by using computer algorithms. The algorithmic processes expend the concepts of traditional self-portraits to generative and expressive selfies delivering thought or feeling. The artist started taking her generative selfies in 2015 to raise awareness of Asian female faculty being isolated and marginal in a predominantly white institution (http://www.socialhomelessness.com). Her generative selfies have captured psychological moments to express those individual identities are devalued and deconstructed by a homogeneous institution in the United States. It has been shared by social media. The virtual supporting system at Facebook, ""Like,"" by her diverse mentors and friends, helped her to persist and survive in a regionally isolated and exclusive community. Eventually, It has brought her psychological reconciliation and healing to succeed in dealing with difficulties."	https://dl.acm.org/doi/abs/10.1145/3414686.3427128	Yeohyun Ahn
Semi-analytic boundary handling below particle resolution for smoothed particle hydrodynamics	In this paper, we present a novel semi-analytical boundary handling method for spatially adaptive and divergence-free smoothed particle hydrodynamics (SPH) simulations, including two-way coupling. Our method is consistent under varying particle resolutions and allows for the treatment of boundary features below the particle resolution. We achieve this by first introducing an analytic solution to the interaction of SPH particles with planar boundaries, in 2D and 3D, which we extend to arbitrary boundary geometries using signed distance fields (SDF) to construct locally planar boundaries. Using this boundary-integral-based approach, we can directly evaluate boundary contributions, for any quantity, allowing an easy integration into state of the art simulation methods. Overall, our method improves interactions with small boundary features, readily handles spatially adaptive fluids, preserves particle-boundary interactions across varying resolutions, can directly be implemented in existing SPH methods, and, for non-adaptive simulations, provides a reduction in memory consumption as well as an up to 2× speedup relative to current particle-based boundary handling approaches.	https://dl.acm.org/doi/abs/10.1145/3414685.3417829	Rene Winchenbach, Rustam Akhunov, Andreas Kolb
Seoul landscape	See the scenery of the city through Korean traditional music. 'object' exists with time. We sometimes bring the 'object' of the past to reproduce the time of the past. 'object' becomes the music of Korean traditional music. What we are trying to reproduce is nature. What is nature? Nature is a phenomenon itself. For people in the modern world, is nature an urban ecosystem? We find the way back to nature through the 'object' called 'Korean traditional music'. It looks at nature as the whole being, not as an individual who only has the impression of passing through without a clear form.	https://dl.acm.org/doi/abs/10.1145/3414686.3427170	Dohee Jeon, Hannah Kim
Shadow play: tales of urbanization	Over the past few decades, China has been undergoing urbanization at an astounding pace. In 2013, the national leadership raised the process to a new gear when it unveiled its plan of converting 70 percent of the population to a cityoriented lifestyle by 2025. Such a significant change would undoubtedly transform the character of a country that has been largely agrarian throughout its millennia of history. One may wonder how, and to what extent, the landscape, culture and the daily being of the nation's people may be altered. As artists, we are compelled to explore and reflect upon the various phases of this historic undertaking while questioning how people are positioned during this monumental social transformation. Through fieldwork in China, we collect the ingredients necessary for a multimedia production that combines traditional artistic expressions with emerging technologies. Weaving three interfaces, namely virtual reality (VR) in cyberspace, a series of painting on canvases and traditional shadow play imagery, the multimedia art project visualizes the metamorphosis that results from the urbanization process. With a retrospective into the past through time-honored imagery and a reflection of the present through immersion in the realities of the modern China, we seek to present stories of everyday people to the conscience of a worldwide audience.	https://dl.acm.org/doi/abs/10.1145/3414686.3427102	Xiying Yang, Honglei Li, He Li
