title	abstract	url	authors
A Liquid Sound Retrieval using History of Velocities in Physically-based Simulation	This paper presents a novel method for synthesizing sound effects for fluid animation. Previous approaches synthesize the sound for fluids by physically-based simulation, but these approaches need a huge computational cost. To address this, we propose a data-driven method for synthesizing sound effects for fluids. In this paper, we focus on liquid sound. A liquid sound database which consists of a set of recorded sound clips is prepared in advance, and then the most suitable sound clip for an input liquid motion is automatically retrieved from the database. The retrieval is achieved by comparing a waveform of the sound and a history of velocity of the liquid motion computed by the simulation. The velocity history is computed for the regions where the liquid sound is expected to occur. Then, a distance between the velocity history and the waveform of each sound clip in the database is calculated, and our system chooses the clip with the minimum distance. Our method achieves fast synthesis of liquid sound for simulated liquid motion, once the database is prepared. In this paper, we use a small database containing a few sound clips and evaluate the effectiveness of our retrieval approach, as a preliminary experiment of this research.	https://dl.acm.org/doi/abs/10.1145/3476124.3488643	Hyuga Saito, Syuhei Sato, Yoshinori Dobashi
A Multi-Stage Advanced Deep Learning Graphics Pipeline	In this paper we propose the Advanced Deep Learning Graphics Pipeline (ADLGP). ADLGP is a novel approach that uses existing deep learning architectures to convert scene data into rendered images. Our goal of generating frames from semantic data has produced successful renderings with similar structures and composition as target frames. We demonstrate the success of ADLGP with side-by-side comparisons of frames generated through standard rendering procedures. We assert that a fully implemented ADLGP framework would reduce the time spent in visualizing 3D environments, and help selectively offload the requirements of the current graphics rendering pipeline.	https://dl.acm.org/doi/abs/10.1145/3478512.3488609	Mark Wesley Harris, Sudhanshu Kumar Semwal
A Procedural MatCap System for Cel-Shaded Japanese Animation Production	MatCap is an expressive approach to shade 3D models and is promising for the production of typical Japanese-style cel-shaded animations. However, we experienced an asset management problem in our previous short film production; we needed to manually create many MatCap assets to achieve variations shot by shot or even frame by frame. In this work, we identify requirements for shading systems in Japanese animation production and describe our procedural MatCap system, which satisfies the requirements. Procedural MatCap generates customizable MatCap assets fully procedurally in run time, which drastically improves the asset manageability.	https://dl.acm.org/doi/abs/10.1145/3476124.3488620	Yuki Koyama, Takeshi Tsuruta, Heisuke Saito, Daisuke Takizawa, Hiroshi Moriguchi
A Robust Display Delay Compensation Technique Considering User's Head Motion Direction for Cloud XR	Conventionally, it has been difficult to realize both photorealistic and geometrically consistent 3DCG rendering on head mounted displays (HMDs), due to the trade-off between rendering quality and low motion-to-photon latency (M2PL). In order to solve this problem, we propose a novel rendering framework, where the server renders RGB-D images of a 3D model with the optimally arranged rendering viewpoints, and the client HMD realizes geometric compensation of M2PL by employing depth image based rendering (DIBR). Experiments with real smart glasses show that the proposed method can display binocular images closer to the ground truth than the conventional approaches.	https://dl.acm.org/doi/abs/10.1145/3476124.3488648	Tatsuya Kobayashi, Tomoaki Konno, Haruhisa Kato
A Walk Alone: Triggering Fear and Simulating Empathy to Raise Awareness about the Dangers Women Face when Walking Alone at Night: Triggering Fear and Simulating Empathy to Raise Awareness about the Dangers Women Face when Walking Alone at Night	A Walk Alone is a virtual reality experience that simulates what it feels like to walk alone at night as a woman. The concept is inspired by the kidnapping and murder of Sarah Everard, a 33-year-old woman who went missing during her walk home from her friend's apartment in March 2021. It is one thing to discuss this universal issue and highlight the precautions women take when walking alone, but it is another thing to experience it. A Walk Alone focuses on displaying the vulnerability of the user by triggering multiple senses in the virtual reality environment. The experience is centered around a linear story involving (1) one night-city environment, (2) the user in first person point-of-view, (3) eerie sound design, and (5) dim street lighting.	https://dl.acm.org/doi/abs/10.1145/3478514.3487627	Eman Al-Zubeidi, Jinsil Hwaryoung Seo, Julia DeLaney, Dominic Nguyen, Jonathan Konderla, Jaime Diaz
A material point method for nonlinearly magnetized materials	We propose a novel numerical scheme to simulate interactions between a magnetic field and nonlinearly magnetized objects immersed in it. Under our nonlinear magnetization framework, the strength of magnetic forces is effectively saturated to produce stable simulations without requiring any parameter tuning. The mathematical model of our approach is based upon Langevin's nonlinear theory of paramagnetism, which bridges microscopic structures and macroscopic equations after a statistical derivation. We devise a hybrid Eulerian-Lagrangian numerical approach to simulating this strongly nonlinear process by leveraging the discrete material points to transfer both material properties and the number density of magnetic micro-particles in the simulation domain. The magnetic equations can then be built and solved efficiently on a background Cartesian grid, followed by a finite difference method to incorporate magnetic forces. The multi-scale coupling can be processed naturally by employing the established particle-grid interpolation schemes in a conventional MLS-MPM framework. We demonstrate the efficacy of our approach with a host of simulation examples governed by magnetic-mechanical coupling effects, ranging from magnetic deformable bodies to magnetic viscous fluids with nonlinear elastic constitutive laws.	https://dl.acm.org/doi/abs/10.1145/3478513.3480541	Yuchen Sun, Xingyu Ni, Bo Zhu, Bin Wang, Baoquan Chen
A parallel guaranteed projector-camera system for dual videography	Thanks to the optical duality between a projector and a camera, an image from the viewpoint of the projector can be computationally generated using camera images;however, to achieve dual photography in real time, the geometric configuration of the projector and the camera must be strongly constrained. In this research, to substantially relax this constraint, we improved the optical components of the projector–camera system by employing a stabilizer to guarantee that both epipolar planes are parallel. As a result, it is possible to move the projector to change the synthesized virtual viewpoint more freely in real–time.	https://dl.acm.org/doi/abs/10.1145/3476124.3488621	Yushi Yamagiwa, Hiroyuki Kubo
ARMixer: Live Stage Monitor Mixing through Gestural Interaction in Augmented Reality	Existing stage monitor mixing systems are inefficient and cannot accommodate the communication between the musicians and sound engineers. We introduce ARMixer, which allows musicians to perform self-stage monitor mixing through gestures in augmented reality to provide an intuitive mixing experience. We performed two usability tests and found that ARMixer is acceptable to the user and has excellent psychoacoustic intuitiveness in terms of mixing parameter controls by gestures and identifying mixing target.	https://dl.acm.org/doi/abs/10.1145/3476124.3488632	Weihan Huang, Stephanie Bourgeois, Yun Suen Pai, Kouta Minamizawa
ARinVR: Bringing Mobile AR into VR	Augmented Reality (AR) and Virtual Reality (VR) techniques are widely used for people to experience and interact with 3D digital content. However, the user has to choose either AR or VR separately with different devices for different interaction modalities. This work presents ARinVR, a novel concept that seamlessly and synchronously integrates handheld mobile AR and head-worn VR to allow users to see an augmented scenario on a phone screen and in a VR space at the same time. We developed a prototype system that enabled users to operate a smartphone and observe mobile AR scenarios in VR environment as naturally as in the real world. The system extends the AR space and occludes the physical surroundings, enabling users to stay focused on task performance and enhancing spatial perception.	https://dl.acm.org/doi/abs/10.1145/3476124.3488636	Li Zhang, Weiping He, Yizhe Liu, Qianyuan Zou, Huidong Bai, Mark Billinghurst
AdaptiBrush: adaptive general and predictable VR ribbon brush	Virtual reality drawing applications let users draw 3D shapes using brushes that form shaped, or ruled-surface, strokes. Each ribbon is uniquely defined by its user-specified ruling length, path, and the ruling directions at each point along this path. Existing brushes use the trajectory of a handheld controller in 3D space as the ribbon path, and compute the ruling directions using a mapping from a specific controller coordinate-frame axis. This fixed mapping forces users to rotate the controller and thus their wrists to change ribbon normal or ruling directions, and requires substantial physical effort to draw even medium complexity ribbons. Since human ability to rotate their wrists continuously is heavily restricted, the space of ribbon geometries users can comfortably draw using these brushes is limited. These brushes can be unpredictable, producing ribbons with unexpectedly varying width or flipped and wobbly normals in response to seemingly natural hand gestures. Our ribbon brush system dramatically extends the space of ribbon geometries users can comfortably draw while enabling them to accurately predict the ribbon shape that a given hand motion produces. We achieve this by introducing a novel ruling direction computation method, enabling users to easily change ribbon ruling and normal orientation using predominantly translational controller, and thus wrist, motion. We facilitate ease-of-use by computing predictable ruling directions that smoothly change in both world and controller coordinate systems, and facilitate ease-of-learning by prioritizing ruling directions which are well-aligned with one of the controller coordinate system axes. Our comparative user studies confirm that our more general and predictable ruling computation leads to significant improvements in brush usability and effectiveness compared to all prior brushes; in a head to head comparison users preferred AdaptiBrush over the next-best brush by a margin of 2 to 1.	https://dl.acm.org/doi/abs/10.1145/3478513.3480511	Enrique Rosales, Chrystiano Araújo, Jafet Rodriguez, Nicholas Vining, Dongwook Yoon, Alla Sheffer
Aerial path planning for online real-time exploration and offline high-quality reconstruction of large-scale urban scenes	Existing approaches have shown that, through carefully planning flight trajectories, images captured by Unmanned Aerial Vehicles (UAVs) can be used to reconstruct high-quality 3D models for real environments. These approaches greatly simplify and cut the cost of large-scale urban scene reconstruction. However, to properly capture height discontinuities in urban scenes, all state-of-the-art methods require prior knowledge on scene geometry and hence, additional prepossessing steps are needed before performing the actual image acquisition flights. To address this limitation and to make urban modeling techniques even more accessible, we present algorithm that does not require any prior knowledge for the scenes. Using only captured 2D images, we estimate 3D bounding boxes for buildings on-the-fly and use them to guide online path planning for both scene exploration and building observation. Experimental results demonstrate that the aerial paths planned by our algorithm in realtime for unknown environments support reconstructing 3D models with comparable qualities and lead to shorter flight air time.	https://dl.acm.org/doi/abs/10.1145/3478513.3480491	Yilin Liu, Ruiqi Cui, Ke Xie, Minglun Gong, Hui Huang
Aesthetic-guided outward image cropping	Image cropping is a commonly used post-processing operation for adjusting the scene composition of an input photography, therefore improving its aesthetics. Existing automatic image cropping methods are all bounded by the image border, thus have very limited freedom for aesthetics improvement if the original scene composition is far from ideal, e.g. the main object is too close to the image border. In this paper, we propose a novel, aesthetic-guided method. It can go beyond the image border to create a desirable composition that is unachievable using previous cropping methods. Our method first evaluates the input image to determine how much the content of the image should be extrapolated by a field of view (FOV) evaluation model. We then synthesize the image content in the extrapolated region, and seek an optimal aesthetic crop within the expanded FOV, by jointly considering the aesthetics of the cropped view, and the local image quality of the extrapolated image content. Experimental results show that our method can generate more visually pleasing image composition in cases that are difficult for previous image cropping tools due to the border constraint, and can also automatically degrade to an inward method when high quality image extrapolation is infeasible.	https://dl.acm.org/doi/abs/10.1145/3478513.3480566	Lei Zhong, Feng-Heng Li, Hao-Zhi Huang, Yong Zhang, Shao-Ping Lu, Jue Wang
Ah les Crocodiles…	A little girl is released in the universe of a Pop-Up book tale managed by a crocodile who won't hesitate to have a discriminatory behavior against women.	https://dl.acm.org/doi/abs/10.1145/3463912.3477194	Agathe Sénéchal, Elise Debruyne, Cérine Raouraoua, William Defrance, Agatha Sip
An Abstract Drawing Method for Same Shaped but Densely Arranged Many Objects	We propose a hierarchical abstract drawing method for many 3D objects which are densely arranged and have almost the same shape. First, an abstract drawing of all the 3D objects is drawn based on a couple of the primal colors, which is one of the global properties of all the 3D objects. Then, an abstract painting is added focusing on a part of each object as local properties. Several results of abstractly rendered scenes are shown, and are confirmed the effectiveness of our method.	https://dl.acm.org/doi/abs/10.1145/3476124.3488651	Reika Yagi, Shuhei Kodama, Tokiichiro Takahashi
Anime Character Colorization using Few-shot Learning	In this paper, we propose an automatic Anime-style colorization method using only a small number of colorized reference images manually colorized by artists. To accomplish this, we introduce a few-shot patch-based learning method considering the characteristics of Anime line-drawing. To streamline the learning process, we derive optimal settings with acceptable colorization accuracy and training time for a production pipeline. We demonstrate that the proposed method helps to reduce manual labor for artists.	https://dl.acm.org/doi/abs/10.1145/3478512.3488604	Akinobu Maejima, Hiroyuki Kubo, Seitaro Shinagawa, Takuya Funatomi, Tatsuo Yotsukura, Satoshi Nakamura, Yasuhiro Mukaigawa
Associating Real Objects with Virtual Models for VR Interaction	In this paper, we present a prototype system that is capable of associating real objects with virtual models and turning the table top into imaginary virtual scenes. A user can interact with these objects when she or he is immersed in the virtual environment. To accomplish this goal, a vision-based system is developed to online recognize and track the real objects in the scene. The corresponding virtual models are retrieved based on their tactile shapes. They are displayed and moved on a head-mounted display (HMD) according to tracked object poses. The experiment demonstrates that our prototype system can find reasonable association between real and virtual objects, and users are interested in the novel interaction.	https://dl.acm.org/doi/abs/10.1145/3476124.3488654	Wan-Ting Hsu, I-Chen Lin
AutoMate: a dataset and learning approach for automatic mating of CAD assemblies	Assembly modeling is a core task of computer aided design (CAD), comprising around one third of the work in a CAD workflow. Optimizing this process therefore represents a huge opportunity in the design of a CAD system, but current research of assembly based modeling is not directly applicable to modern CAD systems because it eschews the dominant data structure of modern CAD: parametric boundary representations (BREPs). CAD assembly modeling defines assemblies as a system of pairwise constraints, called , between parts, which are defined relative to BREP topology rather than in world coordinates common to existing work. We propose SB-GCN, a representation learning scheme on BREPs that retains the topological structure of parts, and use these learned representations to predict CAD type mates. To train our system, we compiled the first large scale dataset of BREP CAD assemblies, which we are releasing along with benchmark mate prediction tasks. Finally, we demonstrate the compatibility of our model with an existing commercial CAD system by building a tool that assists users in mate creation by suggesting mate completions, with 72.2% accuracy.	https://dl.acm.org/doi/abs/10.1145/3478513.3480562	Benjamin Jones, Dalton Hildreth, Duowen Chen, Ilya Baran, Vladimir G. Kim, Adriana Schulz
Autocomplete Repetitive Stroking with Image Guidance	Image-guided drawing can compensate for the lack of skills but often requires a significant number of repetitive strokes to create textures. Existing automatic stroke synthesis methods are usually limited to predefined styles or require indirect manipulation that may break the spontaneous flow of drawing. We present a method to autocomplete repetitive short strokes during users' normal drawing process. Users can draw over a reference image as usual. At the same time, our system silently analyzes the input strokes and the reference to infer strokes that follow users' input style when certain repetition is detected. Our key idea is to jointly analyze image regions and operation history for detecting and predicting repetitions. The proposed system can reduce tedious repetitive inputs while being fully under user control.	https://dl.acm.org/doi/abs/10.1145/3478512.3488595	Yilan Chen, Kin Chung Kwan, Li-Yi Wei, Hongbo Fu
Avant Card	Ernst is figure on a postcard, which is in a card stand with many other motives. While the other cards are eagerly bought, no one is interested in his card and Ernst becomes increasingly discontented. Almost he is also bought - but then he is put back crooked again. This brings his world into imbalance and he falls out. For him a colorful journey full of different styles of representation begins - whether 2D, 3D, Real film and Stop-motion.	https://dl.acm.org/doi/abs/10.1145/3463912.3478277	Stella Raith, Josephine Roß
Awkward	A day full of socially awkward moments.	https://dl.acm.org/doi/abs/10.1145/3463912.3475842	Nata Metlukh
Barbershop: GAN-based image compositing using segmentation masks	Seamlessly blending features from multiple images is extremely challenging because of complex relationships in lighting, geometry, and partial occlusion which cause coupling between different parts of the image. Even though recent work on GANs enables synthesis of realistic hair or faces, it remains difficult to combine them into a single, coherent, and plausible image rather than a disjointed set of image patches. We present a novel solution to image blending, particularly for the problem of hairstyle transfer, based on GAN-inversion. We propose a novel latent space for image blending which is better at preserving detail and encoding spatial information, and propose a new GAN-embedding algorithm which is able to slightly modify images to conform to a common segmentation mask. Our novel representation enables the transfer of the visual properties from multiple reference images including specific details such as moles and wrinkles, and because we do image blending in a latent-space we are able to synthesize images that are coherent. Our approach avoids blending artifacts present in other approaches and finds a globally consistent image. Our results demonstrate a significant improvement over the current state of the art in a user study, with users preferring our blending solution over 95 percent of the time. Source code for the new approach is available at https://zpdesu.github.io/Barbershop.	https://dl.acm.org/doi/abs/10.1145/3478513.3480537	Peihao Zhu, Rameen Abdal, John Femiani, Peter Wonka
Barking Orders	After being bossed around by the royal guard his whole life, the Queen's corgi's luck changes when the entire British Royal family dies, leaving the corgi next in line for the throne. He takes charge of England with an iron fist, but when things get over his head, he finds himself panic-stricken, way in over his head with the future of Europe in his hands. When the guard finds him, he is able to talk the corgi down from the ledge but not without some unexpected, devastating consequences.	https://dl.acm.org/doi/abs/10.1145/3463912.3467957	Alexander Tullo
Beat	"The Story Incubated from Your heartbeats. Concept: You can share your own heartbeat with a robot, and you can feel its growth together. Main Character: A robot boy called ""Maruboro"" honest robot, who is not yet familiar with ""life"".. He has been left in an old factory quietly. One day, the viewer comes over and gives his/her heart as life to him. Viewers can project themselves into the characters and enjoy the story. Logline: The viewer gives his/her heart to Maruboro and breathes a life into him. Maruboro wants to become friends with another robot called Kakuboro, but Maruboro doesn't know how to interact with others. It makes Kakuboro angry. However, Maruboro desperately wants to make friends and he starts to think from Kakuboro's point of view. Kakuboro finally opens up his heart to Maruboro. Story: ""Beat"" is a story elaborated from your ""Heart"". Viewers can experience the work with their hearts in their hands. The heart in the animation vibrates at the same pace at viewers' heartbeat. The setting of the story is an old factory. Viewers encounter a rusted robot called Maruboro, it was absolutely static. He doesn't have a ""heart"" to move. Viewers can grant Maruboro a new heart by putting theirs on the robot. He then stands up and starts to move, expressing joy to live out all his strength. Maruboro looks a little lonely. When he finds that other robots open their hearts and connect with each other, he starts to search for friends. However, when Maruboro meets with new robots, he doesn't know how to communicate properly. He tries to open up his heart to another robot called Kakuboro. While in Maruboro's disturbance, Kakuboro dropped an important component of his factory. Kakuboro becomes angry and tries to gets rid of Maruboro. He broke Maruboro's heart accidentally. Maruboro is so depressed, but he tries to work with the viewer to search for the lost component. Finally, Maruboro finds it and give that back to Kakuboro. Kakuboro uses that to run the factory. The factory then starts to operate and sets off big fireworks. The hearts of the two robots eventually come together. Maruboro's heart starts to beat again. ""Heart"" becomes the key to move the story forward. The story aims to arouse consciousness of ""Heart"" via the growth of the robot."	https://dl.acm.org/doi/abs/10.1145/3478514.3487616	Keisuke Itoh, Hiroko Fujioka, Katsutoshi Machiba, Tetsuya Ohashi
BeeWave: Creta swarm kinetic movement using by SMA display and embedded cellular automata-based mechanism	"""Bee Wave"" is a kinetic art sculpture driven by a shaped memory alloy. It is driven by the material properties of the memory alloy, which is heated and contracted to pull the lever on the drive to pull the acrylic wings, making them sway like the wings of a bee in nature (Figure 1). Since no motor is used, it is quiet and elegant; the cell of the triangular cone is like a cellular automata, which has a mechanism to receive, store and process signals transmitted between cells and cells, and can influence the neighboring cells, from the individual triangular cone to influence the three neighboring cells, through the rule of triggering all the way to the group, like a wave cycle; and in the process of implementation into the nature of the existence of In the process of the actual work, the biological characteristics and appearance of the bionic design are incorporated, such as the adoption of a biological appearance, the mechanism of the bee to capture the hidden audio conversion behavior, the memory alloy of the shape like a living creature, and the function of the cellular automaton to transmit signals in the game of life [Conway 1970], and the above mechanisms are ""mixed"" to create this creation (Bee Wave)."	https://dl.acm.org/doi/abs/10.1145/3476124.3488635	Hsin-Fu Chen, Scottie Chih-Chieh Huang
