title	abstract	url	authors
Guided Image Weathering using Image-to-Image Translation	In this paper, we present a guided image weathering method that allows the user to generate the weathering process. The core of our method is a three-step method to generate textures at different time steps of the weathering process. The input texture is analyzed first to obtain the weathering degree (age map) for each pixel, then we train a conditional adversarial network to generate texture patches with diverse weathering effects. Once the training is finished, new weathering results can be generated by manipulating the age map, such as automatic interpolation and manually modified by the user.	https://dl.acm.org/doi/abs/10.1145/3478512.3488603	Li-Yu Chen, I-Chao Shen, Bing-Yu Chen
HWAuth: Handwriting-Based Socially-Inclusive Authentication	Small, local group of users who share private resources (e.g., families, university labs, business departments) usually have limited usable authentication needs. For these entities, existing authentication solutions either require excessive personal information (e.g., biometrics), do not distinguish each user (e.g., shared passwords), or lack security measures when the access key is compromised (e.g., physical keys). We propose an alternative solution by designing HWAuth: an inclusive group authentication system with a shared text that is uniquely identifiable for each user. Each user shares the same textual password, but individual handwriting styles of the text are used to distinguish each user. We evaluated the usability and security of our design through a user study with 30 participants. Our results suggest that (1) users who enter the same shared passwords are discernible from one another, and (2) that users were able to consistently login using HWAuth.	https://dl.acm.org/doi/abs/10.1145/3476124.3488638	Joon Kuy Han, Byungkon Kang, Dennis Wong
HoloBurner:: Mixed Reality Equipment for Learning Flame Color Reaction by using Aerial Imaging Display	The HoloBurner system is a mixed reality instrument of chemistry experiments for learning flame color reaction. It can provide users with the sense and enjoyment of performing experiments in a laboratory. Flame color reaction is a phenomenon which can identify an element by its unique color, with which students can learn that substances are comprised with various different elements. The HoloBurner system provide users a real feeling of operating a burner, and realistic image of flame with an aerial imaging display. Students can experience flame color reaction using the HoloBurner safely in natural way same as with real instruments.	https://dl.acm.org/doi/abs/10.1145/3476122.3484846	Toshikazu Ohshima, Kai Nishimoto
How Can I Swing Like Pro?: Golf Swing Analysis Tool for Self Training	In this work, we present an analysis tool to help golf beginners compare their swing motion to the swing motion of experts. The proposed application synchronizes videos with different swing phase timings using the latent features extracted by a neural network-based encoder and detects key frames where discrepant motions occur. We visualize synchronized image frames and 3D poses that help users recognize the differences and key factors that can be important for their swing skill improvement.	https://dl.acm.org/doi/abs/10.1145/3476124.3488645	Chen-Chieh Liao, Dong-Hyun Hwang, Hideki Koike
Human dynamics from monocular video with dynamic camera movements	We propose a new method that reconstructs 3D human motion from in-the-wild video by making full use of prior knowledge on the laws of physics. Previous studies focus on reconstructing joint angles and positions in the body local coordinate frame. Body translations and rotations in the global reference frame are partially reconstructed only when the video has a static camera view. We are interested in overcoming this static view limitation to deal with dynamic view videos. The camera may pan, tilt, and zoom to track the moving subject. Since we do not assume any limitations on camera movements, body translations and rotations from the video do not correspond to absolute positions in the reference frame. The key technical challenge is inferring body translations and rotations from a sequence of 3D full-body poses, assuming the absence of root motion. This inference is possible because human motion obeys the law of physics. Our reconstruction algorithm produces a control policy that simulates 3D human motion imitating the one in the video. Our algorithm is particularly useful for reconstructing highly dynamic movements, such as sports, dance, gymnastics, and parkour actions.	https://dl.acm.org/doi/abs/10.1145/3478513.3480504	Ri Yu, Hwangpil Park, Jehee Lee
HyperNeRF: a higher-dimensional representation for topologically varying neural radiance fields	"Neural Radiance Fields (NeRF) are able to reconstruct scenes with unprecedented fidelity, and various recent works have extended NeRF to handle dynamic scenes. A common approach to reconstruct such non-rigid scenes is through the use of a learned deformation field mapping from coordinates in each input image into a canonical template coordinate space. However, these deformation-based approaches struggle to model changes in topology, as topological changes require a discontinuity in the deformation field, but these deformation fields are necessarily continuous. We address this limitation by lifting NeRFs into a higher dimensional space, and by representing the 5D radiance field corresponding to each individual input image as a slice through this ""hyper-space"". Our method is inspired by level set methods, which model the evolution of surfaces as slices through a higher dimensional surface. We evaluate our method on two tasks: (i) interpolating smoothly between ""moments"", i.e., configurations of the scene, seen in the input images while maintaining visual plausibility, and (ii) novel-view synthesis at fixed moments. We show that our method, which we dub , outperforms existing methods on both tasks. Compared to Nerfies, HyperNeRF reduces average error rates by 4.1% for interpolation and 8.6% for novel-view synthesis, as measured by LPIPS. Additional videos, results, and visualizations are available at hypernerf.github.io."	https://dl.acm.org/doi/abs/10.1145/3478513.3480487	Keunhong Park, Utkarsh Sinha, Peter Hedman, Jonathan T. Barron, Sofien Bouaziz, Dan B Goldman, Ricardo Martin-Brualla, Steven M. Seitz
ICTree: automatic perceptual metrics for tree models	Many algorithms for virtual tree generation exist, but the visual realism of the 3D models is unknown. This problem is usually addressed by performing limited user studies or by a side-by-side visual comparison. We introduce an automated system for realism assessment of the tree model based on their perception. We conducted a user study in which 4,000 participants compared over one million pairs of images to collect subjective perceptual scores of a large dataset of virtual trees. The scores were used to train two neural-network-based predictors. A view independent ICTreeF uses the tree model's geometric features that are easy to extract from any model. The second is ICTreeI that estimates the perceived visual realism of a tree from its image. Moreover, to provide an insight into the problem, we deduce intrinsic attributes and evaluate which features make trees look like real trees. In particular, we show that branching angles, length of branches, and widths are critical for perceived realism. We also provide three datasets: carefully curated 3D tree geometries and tree skeletons with their perceptual scores, multiple views of the tree geometries with their scores, and a large dataset of images with scores suitable for training deep neural networks.	https://dl.acm.org/doi/abs/10.1145/3478513.3480519	Tomas Polasek, David Hrusa, Bedrich Benes, Martin Čadík
Indefinately:Indefinately	"This work ""indefinitely"" tells the epitome of the earth and future urban pollution. In contemporary society, high walls have been built between people, and people living in cities are basically replicas. We use VR technology to create a surreal world in VR helmets, focusing on spiritual pollution and environmental pollution. In this ambiguous world, how can people find themselves in the bustling maze of nothingness? Through the three scenes of tomb forest, acid rain wasteland and hazy village, the experimenter uses the handle to understand human diseases, disasters and pollution in the past[Ypsilanti et al., 2018].They also picked up the photo fragments of ""Lucas"" representing hope and felt the fear of being lost in the spiritual maze. In this scene, they become poor people who are lost and polluted in their souls. At the end of the scene, the experimenter found a door full of hope, picked up all the fragments of Lucas, took a group photo of Lucas and his daughter before departure, and ended the journey."	https://dl.acm.org/doi/abs/10.1145/3478514.3487626	Chenxin Zhang, Lesi Hu
Integer coordinates for intrinsic geometry processing	This paper describes a numerically robust data structure for encoding intrinsic triangulations of polyhedral surfaces. Many applications demand a correspondence between the intrinsic triangulation and the input surface, but existing data structures either rely on floating point values to encode correspondence, or do not support remeshing operations beyond basic edge flips. We instead provide an integer-based data structure that guarantees valid correspondence, even for meshes with near-degenerate elements. Our starting point is the framework of from geometric topology, which we extend to the broader set of operations needed for mesh processing (vertex insertion, edge splits, ). The resulting data structure can be used as a drop-in replacement for earlier schemes, automatically improving reliability across a wide variety of applications. As a stress test, we successfully compute an intrinsic Delaunay refinement and associated subdivision for all manifold meshes in the Thingi10k dataset. In turn, we can compute reliable and highly accurate solutions to partial differential equations even on extremely low-quality meshes.	https://dl.acm.org/doi/abs/10.1145/3478513.3480522	Mark Gillespie, Nicholas Sharp, Keenan Crane
Integration of stereoscopic laser-based geometry into 3D video using DLP Link synchronisation	Stereoscopic video projection using active shuatter glasses is a mature technology employed in multi-person immersive virtual reality environments such as CAVE systems. On the other hand, non-stereoscopic laser projectors are popular in the entertainment industry because they can display graphics at greater distances and cover larger areas. However, stereoscopic-capable laser-based vector graphics could enhance video-based immersive 3D experiences, due to their unique visual characteristics including extremely high contrast and arbitrarily extended gamut through the use of multiple laser sources. Their virtually infinite depth of field also allows for easy installation compared with video projectors, regardless of the size of the augmented space. In this work, we demonstrate a system integrating 3D laser-based vector graphics into a dynamic scene generated by a conventional stereoscopic video projection system.	https://dl.acm.org/doi/abs/10.1145/3476122.3484833	Jayson Haebich, Christian Sandor, Alvaro Cassinelli
Interactive Manga Colorization with Fast Flat Coloring	This paper proposes an interactive semi-automatic system for manga colorization. In our system, users can colorize monochrome manga images interactively by scribbling the desired colors. The proposed method creates a high quality colorized image by inputting the original monochrome image after grayscale adjustment and the flat colored image generated from the scribbles to a colorization network. Experiments show that the colorized results yielded by the proposed method are much better than existing methods.	https://dl.acm.org/doi/abs/10.1145/3476124.3488628	Delong Ouyang, Ryosuke Furuta, Yugo Shimizu, Yukinobu Taniguchi, Ryota Hinami, Shonosuke Ishiwatari
Interactive all-hex meshing via cuboid decomposition	Standard PolyCube-based hexahedral (hex) meshing methods aim to deform the input domain into an axis-aligned PolyCube volume with integer corners; if this deformation is bijective, then applying the inverse map to the voxelized PolyCube yields a valid hex mesh. A key challenge in these methods is to maintain the bijectivity of the PolyCube deformation, thus reducing the robustness of these algorithms. In this work, we present an interactive pipeline for hex meshing that sidesteps this challenge by using a new representation of PolyCubes as unions of cuboids. We begin by deforming the input tetrahedral mesh into a near-PolyCube domain whose faces are loosely aligned to the major axis directions. We then build a PolyCube by optimizing the layout of a set of cuboids with user guidance to closely fit the deformed domain. Finally, we construct an inversion-free pullback map from the voxelized PolyCube to the input domain while optimizing for mesh quality metrics. We allow extensive user control over each stage, such as editing the voxelized PolyCube, positioning surface vertices, and exploring the trade-off among competing quality metrics, while also providing automatic alternatives. We validate our method on over one hundred shapes, including models that are challenging for past PolyCube-based and frame-field-based methods. Our pipeline reliably produces hex meshes with quality on par with or better than state-of-the-art. We additionally conduct a user study with 21 participants in which the majority prefer hex meshes they make using our tool to the ones from automatic state-of-the-art methods. This demonstrates the need for intuitive interactive hex meshing tools where the user can dictate the priorities of their mesh.	https://dl.acm.org/doi/abs/10.1145/3478513.3480568	Lingxiao Li, Paul Zhang, Dmitriy Smirnov, S. Mazdak Abulnaga, Justin Solomon
Interactive cutting and tearing in projective dynamics with progressive cholesky updates	We propose a new algorithm for updating a Cholesky factorization which speeds up Projective Dynamics simulations with topological changes. Our approach addresses an important limitation of the original Projective Dynamics, i.e., that topological changes such as cutting, fracturing, or tearing require full refactorization which compromises computation speed, especially in real-time applications. Our method progressively modifies the Cholesky factor of the system matrix in the global step instead of computing it from scratch. Only a small amount of overhead is added since most of the topological changes in typical simulations are continuous and gradual. Our method is based on the update and downdate routine in CHOLMOD, but unlike recent related work, supports dynamic sizes of the system matrix and the addition of new vertices. Our approach allows us to introduce clean cuts and perform interactive remeshing. Our experiments show that our method works particularly well in simulation scenarios involving cutting, tearing, and local remeshing operations.	https://dl.acm.org/doi/abs/10.1145/3478513.3480505	Jing Li, Tiantian Liu, Ladislav Kavan, Baoquan Chen
Intuitive and efficient roof modeling for reconstruction and synthesis	We propose a novel and flexible roof modeling approach that can be used for constructing planar 3D polygon roof meshes. Our method uses a graph structure to encode roof topology and enforces the roof validity by optimizing a simple but effective planarity metric we propose. This approach is significantly more efficient than using general purpose 3D modeling tools such as 3ds Max or SketchUp, and more powerful and expressive than specialized tools such as the straight skeleton. Our optimization-based formulation is also flexible and can accommodate different styles and user preferences for roof modeling. We showcase two applications. The first application is an interactive roof editing framework that can be used for roof design or roof reconstruction from aerial images. We highlight the efficiency and generality of our approach by constructing a mesh-image paired dataset consisting of 2539 roofs. Our second application is a generative model to synthesize new roof meshes from scratch. We use our novel dataset to combine machine learning and our roof optimization techniques, by using transformers and graph convolutional networks to model roof topology, and our roof optimization methods to enforce the planarity constraint.	https://dl.acm.org/doi/abs/10.1145/3478513.3480494	Jing Ren, Biao Zhang, Bojian Wu, Jianqiang Huang, Lubin Fan, Maks Ovsjanikov, Peter Wonka
Inverse Free-form Deformation for interactive UV map editing	Free-form deformation (FFD) is useful for manual 2D texture mapping in a 2D domain. The user first places a coarse regular grid in the texture space, and then adjusts the positions of the grid points in the image space. In this paper, we consider the inverse way of this problem, namely, inverse FFD. In this problem setting, we assume that an initial image-to-texture dense mapping is already obtained by some automatic method, such as a data-driven inference. However, this initial dense mapping may not be satisfactory, so the user may want to modify it. Nonetheless, it is difficult to manually edit the dense mapping due to its huge degrees of freedom. We thus convert the dense mapping to a coarse FFD mapping to facilitate manual editing of the mapping. Inverse FFD is formulated as a least-squares optimization, so one can solve it very efficiently.	https://dl.acm.org/doi/abs/10.1145/3478512.3488614	Seung-Tak Noh, Takeo Igarashi
I♥LA: compilable markdown for linear algebra	Communicating linear algebra in written form is challenging: mathematicians must choose between writing in languages that produce well-formatted but semantically-underdefined representations such as LaTeX; or languages with well-defined semantics but notation unlike conventional math, such as C++/Eigen. In both cases, the underlying linear algebra is obfuscated by the requirements of esoteric language syntax (as in LaTeX) or awkward APIs due to language semantics (as in C++). The gap between representations results in communication challenges, including underspecified and irrepro-ducible research results, difficulty teaching math concepts underlying complex numerical code, as well as repeated, redundant, and error-prone translations from communicated linear algebra to executable code. We introduce I♥LA, a language with syntax designed to closely mimic conventionally-written linear algebra, while still ensuring an unambiguous, compilable interpretation. Inspired by Markdown, a language for writing naturally-structured plain text files that translate into valid HTML, I♥LA allows users to write linear algebra in text form and compile the same source into LaTeX, C++/Eigen, Python/NumPy/SciPy, and MATLAB, with easy extension to further math programming environments. We outline the principles of our language design and highlight design decisions that balance between readability and precise semantics, and demonstrate through case studies the ability for I♥LA to bridge the semantic gap between conventionally-written linear algebra and unambiguous interpretation in math programming environments.	https://dl.acm.org/doi/abs/10.1145/3478513.3480506	Yong Li, Shoaib Kamil, Alec Jacobson, Yotam Gingold
Joint Augmented Reality Video Analytics and Artificial Intelligence Supervision	Augmented Reality (AR) and Artificial Intelligence (AI) technologies have become ubiquitous in the public's daily lives. In the AR space, many notable industry players are engaged in bringing smaller, more ergonomic, and more powerful AR headsets and smart-glasses to the market, with the eventual goal of these devices to replace mobile phones for a wide variety of tasks. With the improvements in computing power on AR devices, a similar surge in AI-powered technologies running on these devices is also evident. In this work, we present an AR application that explores Human-AI interaction in a computer vision context by providing an integrated platform for video analytics and AI model fine-tuning.	https://dl.acm.org/doi/abs/10.1145/3476124.3488652	Benjamin Sho, Ryan Anthony De Belen, Rowan T Hughes, Tomasz Bednarz
Joint computational design of workspaces and workplans	Humans assume different production roles in a workspace. On one hand, humans design workplans to complete tasks as efficiently as possible in order to improve productivity. On the other hand, a nice workspace is essential to facilitate teamwork. In this way, workspace design and workplan design complement each other. Inspired by such observations, we propose an automatic approach to jointly design a workspace and a workplan. Taking staff properties, a space, and work equipment as input, our approach jointly optimizes a workspace and a workplan, considering performance factors such as time efficiency and congestion avoidance, as well as workload factors such as walk effort, turn effort, and workload balances. To enable exploration of design trade-offs, our approach generates a set of Pareto-optimal design solutions with strengths on different objectives, which can be adopted for different work scenarios. We apply our approach to synthesize workspaces and workplans for different workplaces such as a fast food kitchen and a supermarket. We also extend our approach to incorporate other common work considerations such as dynamic work demands and accommodating staff members with different physical capabilities. Evaluation experiments with simulations validate the efficacy of our approach for synthesizing effective workspaces and workplans.	https://dl.acm.org/doi/abs/10.1145/3478513.3480500	Yongqi Zhang, Haikun Huang, Erion Plaku, Lap-Fai Yu
Julian Tuwim: To Everyman	To Everyman is a visual rendition of Julian Tuwim's poem of the same name and a manifesto seeking to expose the techniques and tactics of political propaganda. The film uncovers the array of manipulations that paint war as necessary and make it palatable for society. This animated short shows a never-ending circle and can be seamlessly looped. It begins with a spark igniting the conflict and seems to end with a remembrance of the fallen. If played continuously, however, the story simply moves to another hotbed of tension.	https://dl.acm.org/doi/abs/10.1145/3463912.3482628	Cezary Albinski, Katarzyna Dubinska
Kaleidoscopic structured light	Full surround 3D imaging for shape acquisition is essential for generating digital replicas of real-world objects. Surrounding an object we seek to scan with a kaleidoscope, that is, a configuration of multiple planar mirrors, produces an image of the object that encodes information from a combinatorially large number of virtual viewpoints. This information is practically useful for the full surround 3D reconstruction of the object, but cannot be used directly, as we do not know what virtual viewpoint each image pixel corresponds---the pixel label. We introduce a structured light system that combines a projector and a camera with a kaleidoscope. We then prove that we can accurately determine the labels of projector and camera pixels, for arbitrary kaleidoscope configurations, using the projector-camera epipolar geometry. We use this result to show that our system can serve as a multi-view structured light system with hundreds of virtual projectors and cameras. This makes our system capable of scanning complex shapes precisely and with full coverage. We demonstrate the advantages of the kaleidoscopic structured light system by scanning objects that exhibit a large range of shapes and reflectances.	https://dl.acm.org/doi/abs/10.1145/3478513.3480524	Byeongjoo Ahn, Ioannis Gkioulekas, Aswin C. Sankaranarayanan
Keypoint-driven line drawing vectorization via PolyVector flow	Line drawing vectorization is a daily task in graphic design, computer animation, and engineering, necessary to convert raster images to a set of curves for editing and geometry processing. Despite recent progress in the area, automatic vectorization tools often produce spurious branches or incorrect connectivity around curve junctions; or smooth out sharp corners. These issues detract from the use of such vectorization tools, both from an aesthetic viewpoint and for feasibility of downstream applications (e.g., automatic coloring or inbetweening). We address these problems by introducing a novel line drawing vectorization algorithm that splits the task into three components: (1) finding keypoints, i.e., curve endpoints, junctions, and sharp corners; (2) extracting drawing topology, i.e., finding connections between keypoints; and (3) computing the geometry of those connections. We compute the optimal geometry of the connecting curves via a novel geometric flow --- --- that aligns the curves to the drawing, disambiguating directions around Y-, X-, and T-junctions. We show that our system robustly infers both the geometry and topology of detailed complex drawings. We validate our system both quantitatively and qualitatively, demonstrating that our method visually outperforms previous work.	https://dl.acm.org/doi/abs/10.1145/3478513.3480529	Ivan Puhachov, William Neveu, Edward Chien, Mikhail Bessmeltsev
