title	abstract	url	authors
Polarimetric spatio-temporal light transport probing	Light emitted from a source into a scene can undergo complex interactions with multiple scene surfaces of different material types before being reflected towards a detector. During this transport, every surface reflection and propagation is encoded in the properties of the photons that ultimately reach the detector, including travel time, direction, intensity, wavelength and polarization. Conventional imaging systems capture intensity by integrating over all other dimensions of the incident light into a single quantity, hiding this rich scene information in these aggregate measurements. Existing methods are capable of untangling these measurements into their spatial and temporal dimensions, fueling geometric scene understanding tasks. However, examining polarimetric material properties jointly with geometric properties is an open challenge that could enable unprecedented capabilities beyond geometric scene understanding, allowing for material-dependent scene understanding and imaging through complex transport, such as macroscopic scattering. In this work, we close this gap, and propose a computational light transport imaging method that captures the spatially- and temporally-resolved complete polarimetric response of a scene, which encodes rich material properties. Our method hinges on a novel 7D tensor theory of light transport. We discover low-rank structure in the polarimetric tensor dimension and propose a data-driven rotating ellipsometry method that learns to exploit redundancy of polarimetric structure. We instantiate our theory with two imaging prototypes: spatio-polarimetric imaging and coaxial temporal-polarimetric imaging. This allows us, for the first time, to decompose scene light transport into temporal, spatial, and complete polarimetric dimensions that unveil scene properties hidden to conventional methods. We validate the applicability of our method on diverse tasks, including shape reconstruction with subsurface scattering, seeing through scattering media, untangling multi-bounce light transport, breaking metamerism with polarization, and spatio-polarimetric decomposition of crystals.	https://dl.acm.org/doi/abs/10.1145/3478513.3480517	Seung-Hwan Baek, Felix Heide
Pose with style: detail-preserving pose-guided image synthesis with conditional StyleGAN	We present an algorithm for re-rendering a person from a single image under arbitrary poses. Existing methods often have difficulties in hallucinating occluded contents photo-realistically while preserving the identity and fine details in the source image. We first learn to inpaint the correspondence field between the body surface texture and the source image with a human body symmetry prior. The inpainted correspondence field allows us to transfer/warp local features extracted from the source to the target view even under large pose changes. Directly mapping the warped local features to an RGB image using a simple CNN decoder often leads to visible artifacts. Thus, we extend the StyleGAN generator so that it takes pose as input (for controlling poses) and introduces a spatially varying modulation for the latent space using the warped local features (for controlling appearances). We show that our method compares favorably against the state-of-the-art algorithms in both quantitative evaluation and visual comparison.	https://dl.acm.org/doi/abs/10.1145/3478513.3480559	Badour Albahar, Jingwan Lu, Jimei Yang, Zhixin Shu, Eli Shechtman, Jia-Bin Huang
Practical pigment mixing for digital painting	There is a significant flaw in today's painting software: the colors do not mix like actual paints. E.g., blue and yellow make gray instead of green. This is because the software is built around the RGB representation, which models the mixing of colored lights. Paints, however, get their color from pigments, whose mixing behavior is predicted by the Kubelka-Munk model (K-M). Although it was introduced to computer graphics almost 30 years ago, the K-M model has never been adopted by painting software in practice as it would require giving up the RGB representation, growing the number of per-pixel channels substantially, and depriving the users of painting with arbitrary RGB colors. In this paper, we introduce a practical approach that enables mixing colors with K-M while keeping everything in RGB. We achieve this by establishing a latent color space, where RGB colors are represented as mixtures ofprimary pigments together with additive residuals. The latents can be manipulated with linear operations, leading to expected, plausible results. We describe the conversion between RGB and our latent representation, and show how to implement it efficiently.	https://dl.acm.org/doi/abs/10.1145/3478513.3480549	Šárka Sochorová, Ondřej Jamriška
Predicting high-resolution turbulence details in space and time	Predicting the fine and intricate details of a turbulent flow field in both space and time from a coarse input remains a major challenge despite the availability of modern machine learning tools. In this paper, we present a simple and effective dictionary-based approach to spatio-temporal upsampling of fluid simulation. We demonstrate that our neural network approach can reproduce the visual complexity of turbulent flows from spatially and temporally coarse velocity fields even when using a generic training set. Moreover, since our method generates finer spatial and/or temporal details through embarrassingly-parallel upsampling of small local patches, it can efficiently predict high-resolution turbulence details across a variety of grid resolutions. As a consequence, our method offers a whole range of applications varying from fluid flow upsampling to fluid data compression. We demonstrate the efficiency and generalizability of our method for synthesizing turbulent flows on a series of complex examples, highlighting dramatically better results in spatio-temporal upsampling and flow data compression than existing methods as assessed by both qualitative and quantitative comparisons.	https://dl.acm.org/doi/abs/10.1145/3478513.3480492	Kai Bai, Chunhao Wang, Mathieu Desbrun, Xiaopei Liu
Procedural people in Pixar's Presto: new workflows for interactive crowds	Pixar's Presto Crowd Framework (Pcf) has taken interactive crowd scalability to new heights by harnessing the power of Presto's scalable execution framework for procedurally rigged crowds. Pcf is a vectorized and highly parallelized crowd system that represents an entire crowd as an aggregate model. Prior to Pcf, Presto crowds used a model per agent, via the Mf (model framework), and only scaled to around thousand agents, even with fast GPU based linear blend skinning. Pcf CrowdPrims by contrast can scale to tens and even hundreds of thousands of agents using the same underlying data while maintaining interactive frame rates. Pcf was also designed from the ground up to import from and export to USD to make pipeline deployment seamless. Pcf Crowd Prims use procedural implementations for crowd techniques that are traditionally simulated, like Finite State Machines, making the results deterministic and pipeline friendly. Taken together, our Real-Time Live Demo will prove to the audience that they do not need to settle for the long execution times and history dependent nature of simulated crowds, and that with sufficiently a vectorized/parallelized framework, even stadium sized crowds can be generated/choreographed interactively.	https://dl.acm.org/doi/abs/10.1145/3478511.3491308	Paul Kanyuk
Project starline: a high-fidelity telepresence system	We present a real-time bidirectional communication system that lets two people, separated by distance, experience a face-to-face conversation as if they were copresent. It is the first telepresence system that is demonstrably better than 2D videoconferencing, as measured using participant ratings (e.g., presence, attentiveness, reaction-gauging, engagement), meeting recall, and observed nonverbal behaviors (e.g., head nods, eyebrow movements). This milestone is reached by maximizing audiovisual fidelity and the sense of copresence in all design elements, including physical layout, lighting, face tracking, multi-view capture, microphone array, multi-stream compression, loudspeaker output, and lenticular display. Our system achieves key 3D audiovisual cues (stereopsis, motion parallax, and spatialized audio) and enables the full range of communication cues (eye contact, hand gestures, and body language), yet does not require special glasses or body-worn microphones/headphones. The system consists of a head-tracked autostereoscopic display, high-resolution 3D capture and rendering subsystems, and network transmission using compressed color and depth video streams. Other contributions include a novel image-based geometry fusion algorithm, free-space dereverberation, and talker localization.	https://dl.acm.org/doi/abs/10.1145/3478513.3480490	Jason Lawrence, Danb Goldman, Supreeth Achar, Gregory Major Blascovich, Joseph G. Desloge, Tommy Fortes, Eric M. Gomez, Sascha Häberling, Hugues Hoppe, Andy Huibers, Claude Knaus, Brian Kuschak, Ricardo Martin-Brualla, Harris Nover, Andrew Ian Russell, Steven M. Seitz, Kevin Tong
Q-zip: singularity editing primitive for quad meshes	Singularity editing of a quadrangle mesh consists in shifting singularities around for either improving the quality of the mesh elements or canceling extraneous singularities, so as to increase mesh regularity. However, the particular structure of a quad mesh renders the exploration of allowable connectivity changes non-local and hard to automate. In this paper, we introduce a simple, principled, and general with which pairs of arbitrarily distant singularities can be efficiently displaced around a mesh through a deterministic and reversible chain of local topological operations with a minimal footprint. Dubbed Q-zip as it acts as a zipper opening up and collapsing down quad strips, our practical mesh operator for singularity editing can be easily implemented via parallel transport of a reference compass between any two irregular vertices. Batches of Q-zips performed in parallel can then be used for efficient singularity editing.	https://dl.acm.org/doi/abs/10.1145/3478513.3480523	Leman Feng, Yiying Tong, Mathieu Desbrun
Real-Time Prediction-Driven Dynamics Simulation to Mitigate Frame Time Variation	This work introduces a prediction-driven real-time dynamics method that uses a graph-based state buffer to minimize the cost of mispredictions. Our technique reduces the average time needed for dynamics computation on the main thread by running the solver pipeline on a separate thread, enabling interactive multimedia applications to increase the computational budget for graphics at no cost perceptible to the end user.	https://dl.acm.org/doi/abs/10.1145/3476124.3488633	Mackinnon Buck, Christian Eckhardt
Real-time Image-based Virtual Try-on with Measurement Garment	Virtual try-on technology that replaces a customer's wearing with arbitrary garments can significantly improve the online cloth shopping experience [anonymous 2021; Han et al. 2018; Yang et al. 2020]. In this work, we present a real-time image-based virtual try-on system composed of two parts, i.e., photo-realistic clothed person image synthesis for the customers to experience the try-on result and garment capturing for the retailers to capture the rich deformations of the target garment. Distinguished from previous image-based virtual try-on works, we formulate the problem as a supervised image-to-image translation problem using a measurement garment, and we capture the training data with a custom actuated mannequin.	https://dl.acm.org/doi/abs/10.1145/3476122.3484832	Toby Chong, I-Chao Shen, Yinfei Qian, Nobuyuki Umetani, Takeo Igarashi
RealitySketch: augmented reality sketching for real-time embedded and responsive visualizations	In this Real-Time Live, we demonstrate RealitySketch, an augmented reality interface for sketching interactive graphics and visualizations [Suzuki et al. 2020]. In recent years, an increasing number of AR sketching tools enable users to draw and embed sketches in the real world. However, with the current tools, sketched contents are inherently static, floating in mid air without responding to the real world. This paper introduces a new way to embed and graphics in the real world. In RealitySketch, the user draws graphical elements on a mobile AR screen and binds them with physical objects in real-time and improvisational ways, so that the sketched elements dynamically move with the corresponding physical motion. The user can also quickly visualize and analyze real-world phenomena through responsive graph plots or interactive visualizations. This paper contributes to a set of interaction techniques that enable capturing, parameterizing, and visualizing real-world motion without pre-defined programs and configurations. Finally, we demonstrate our tool with several application scenarios, including physics education, sports training, and in-situ tangible interfaces.	https://dl.acm.org/doi/abs/10.1145/3478511.3491313	Ryo Suzuki, Rubaiat Habib Kazi, Li-Yi Wei, Stephen DiVerdi, Wilmot Li, Daniel Leithinger
Recognition of Gestures over Textiles with Acoustic Signatures	We demonstrate a method capable of turning textured surfaces (in particular textile patches) into opportunistic input interfaces thanks to a machine learning model pre-trained on acoustic signals generated by scratching different fabrics. A single short audio recording is then sufficient to characterize both a gesture and the textures substrate. The sensing method does not require intervention on the fabric (no special coating, additional sensors or wires). It is passive (no acoustic or RF signal injected) and works well using regular microphones, such as those embedded in smartphones. Our prototype yields 93.86% accuracy on simultaneous texture/gesture recognition on a test matrix formed by eight textures and eight gestures as long as the microphone is close enough (e.g. under the fabric), or when the patch is attached to a solid body transmitting sound waves. Preliminary results also show that the system recognizes the manipulation of Velcro straps, zippers, or the taping or scratching of plastic cloth buttons over the air when the microphone is in personal space. This research paves the way for a fruitful collaboration between wearables researchers and fashion designers that could lead to an interaction dictionary for common textile patterns or guidelines for the design of signature-robust stitched patches not compromising aesthetic elements.	https://dl.acm.org/doi/abs/10.1145/3476122.3484835	Pui Chung Wong, Christian Sandor, Alvaro Cassinelli
Rendering of Synthetic Underwater Images Towards Restoration	In this paper, we propose to render synthetic underwater images considering revised image formation model, towards modeling restoration. Underwater images suffer from low contrast, color cast and haze due to dynamically varying properties of water, floating particles and submerged sediments. Due to this, light reaching the object, from the surface is subjected to direct scattering, backscattering and forward scattering. We propose to model this varying nature of light to render synthetic underwater images based on depth information and inherent optical properties of Jerlov water types.	https://dl.acm.org/doi/abs/10.1145/3476124.3488637	Chaitra Desai, Ramesh Ashok Tabib, Sai Sudheer Reddy, Ujwala Patil, Uma Mudenagudi
Rendering with style: combining traditional and neural approaches for high-quality face rendering	For several decades, researchers have been advancing techniques for creating and rendering 3D digital faces, where a lot of the effort has gone into geometry and appearance capture, modeling and rendering techniques. This body of research work has largely focused on facial skin, with much less attention devoted to peripheral components like hair, eyes and the interior of the mouth. As a result, even with the best technology for facial capture and rendering, in most high-end productions a lot of artist time is still spent modeling the missing components and fine-tuning the rendering parameters to combine everything into photo-real digital renders. In this work we propose to combine incomplete, high-quality renderings showing only facial skin with recent methods for neural rendering of faces, in order to automatically and seamlessly create photo-realistic full-head portrait renders from captured data without the need for artist intervention. Our method begins with traditional face rendering, where the skin is rendered with the desired appearance, expression, viewpoint, and illumination. These skin renders are then projected into the latent space of a pre-trained neural network that can generate arbitrary photo-real face images (StyleGAN2). The result is a sequence of realistic face images that match the identity and appearance of the 3D character at the skin level, but is completed naturally with synthesized hair, eyes, inner mouth and surroundings. Notably, we present the first method for projection into this latent space, allowing photo-realistic rendering and preservation of the identity of the digital human over an animated performance sequence, which can depict different expressions, lighting conditions and viewpoints. Our method can be used in new face rendering pipelines and, importantly, in other deep learning applications that require large amounts of realistic training data with ground-truth 3D geometry, appearance maps, lighting, and viewpoint.	https://dl.acm.org/doi/abs/10.1145/3478513.3480509	Prashanth Chandran, Sebastian Winberg, Gaspard Zoss, Jérémy Riviere, Markus Gross, Paulo Gotardo, Derek Bradley
Reproducing reality with a high-dynamic-range multi-focal stereo display	With well-established methods for producing photo-realistic results, the next big challenge of graphics and display technologies is to achieve perceptual realism --- producing imagery indistinguishable from real-world 3D scenes. To deliver all necessary visual cues for perceptual realism, we built a High-Dynamic-Range Multi-Focal Stereo Display that achieves high resolution, accurate color, a wide dynamic range, and most depth cues, including binocular presentation and a range of focal depth. The display and associated imaging system have been designed to capture and reproduce a small near-eye three-dimensional object and to allow for a direct comparison between virtual and real scenes. To assess our reproduction of realism and demonstrate the capability of the display and imaging system, we conducted an experiment in which the participants were asked to discriminate between a virtual object and its physical counterpart. Our results indicate that the participants can only detect the discrepancy with a probability of 0.44. With such a level of perceptual realism, our display apparatus can facilitate a range of visual experiments that require the highest fidelity of reproduction while allowing for the full control of the displayed stimuli.	https://dl.acm.org/doi/abs/10.1145/3478513.3480513	Fangcheng Zhong, Akshay Jindal, Ali Özgür Yöntem, Param Hanji, Simon J. Watt, Rafał K. Mantiuk
Repulsive surfaces	Functionals that penalize bending or stretching of a surface play a key role in geometric and scientific computing, but to date have ignored a very basic requirement: in many situations, surfaces must not pass through themselves or each other. This paper develops a numerical framework for optimization of surface geometry while avoiding (self-)collision. The starting point is the , which effectively pushes apart pairs of points that are close in space but distant along the surface. We develop a discretization of this energy for triangle meshes, and introduce a novel acceleration scheme based on a fractional Sobolev inner product. In contrast to similar schemes developed for curves, we avoid the complexity of building a multiresolution mesh hierarchy by decomposing our preconditioner into two ordinary Poisson equations, plus forward application of a fractional differential operator. We further accelerate this scheme via hierarchical approximation, and describe how to incorporate a variety of constraints (on area, volume, ). Finally, we explore how this machinery might be applied to problems in mathematical visualization, geometric modeling, and geometry processing.	https://dl.acm.org/doi/abs/10.1145/3478513.3480521	Chris Yu, Caleb Brakensiek, Henrik Schumacher, Keenan Crane
Resident Evil - Village	The animation provides a cinematic introduction, as well as an ending, to the latest game in the Resident Evil series. The film is a fairy-tale metaphor for the events from the game. The project was entirely created by Platige Image, from the initial concept and script, through character design, graphic design, and all stages of animation, to the final audio layer. The uniqueness of the project required us to adopt an unconventional work style. We did a lot of preparation related to texturing, shaders and lighting to make the final animation look like a paper cut-out with many layers. Also, to get an effect similar to a traditional shadow theater game, we decided to use stop-motion animation instead of the motion capture technique. Add to this unique mâché paper and cut-outs, from which we made the characters and scenography, and we have a dark story, which only seemed to be directed to children. Moreover, all characters in the film are original creations designed by the director and are the fairy-tale alter egos of the characters from of the cult game Resident Evil.	https://dl.acm.org/doi/abs/10.1145/3463912.3481884	Jakub Jabłoński, Piotr Prokop
Room Tilt Stick	Room Tilt Stick is an interactive head-mounted display (HMD) system that provides an illusory experience of tilting a room using a stick and of walking on an acutely inclined slope. In the proposed system, the tilting velocity of a three-dimensional modeled room in the HMD's view is correlated with the degree of force transferred to the wall or ground with a specially designed stick. Here a weight scale (i.e., a Wii Balance Board) monitors to what degree the participant's weight is rested against the wall (through a tiltable platform) or ground. After the illusory tilt of the room is completed, participants are instructed to walk on a two meter long wooden slope. The degree of physical inclination is gradually increased according to the walking distance, and the walking slope corresponds to an illusory wall in the HMD's view. The system was tested in our laboratory exhibition, and 87 out of 100 participants reported a strong sensation of the room tilting by pressing the wall or ground with the stick.	https://dl.acm.org/doi/abs/10.1145/3478514.3487613	Kousuke Motohashi, Koyo Mori, Kenri Kodaka
SKII - Kasumi Ishikawa 'VS Pressure	"The main character of 'VS Pressure' is table tennis star, Kasumi Ishikawa. In a neon-lit futuristic city, plagued by questions, she must fight the most important battle of her career - against her self-doubt and social pressure. The animation is part of an anthology featuring the stories of six exceptional female medalists from various sports. The film is highly stylized and surreal. Producing such images requires improvisation, searching for new forms, and departing from photorealistic assumptions. While cheating the laws of physics in our animated film, we had to be careful not to make it look grotesque. It was a very artistic process based on close collaboration between animators and our director. We did not use Motion Capture Motion Capture techniques. We animated the characters using a ""on twos"" technique, based on methods known from classical animation. In combination with hand-animated 2D effects such as smoke, streaks, or sparks, we created a coherent, highly stylized image."	https://dl.acm.org/doi/abs/10.1145/3463912.3480844	Damian Nenow, Artur Zicz
Self-Shape-Sensing Device with Flexible Mechanical Axes for Deformable Input Interface	We propose a novel device that is capable of sensing its own shape, structured around a flexible mechanical axis that allows for its deformation within a wider degree of freedom and enables its tangible and intuitive control by hand. This device has a 5 x 5 axis structure consisting of a spherical joint that rotates between ± 45° and a slide shaft whose length can be varied from 50 to 71 mm. We developed a signal-processing algorithm which can work on the micro controller unit (MCU) of the device and use built-in sensors to not only reconstruct deformations in real-time, but also directly use such reconstructions in 3D graphics applications. As a result, we achieved an intuitive and interactive 3D experience using volumetric displays.	https://dl.acm.org/doi/abs/10.1145/3476122.3484839	Hideki Mori, Yoshihisa Takahashi, Koichi Shiono, Hirofumi Kaneko, Hiroya Matsugami, Masaomi Nishidate
Self-Stylized Neural Painter	This work introduces Self-Stylized Neural Painter (SSNP) creating stylized artworks in a stroke-by-stroke manner. SSNP consists of digit artist, canvas, style-stroke generator (SSG). By using SSG to generate style strokes, SSNP creates different styles paintings based on the given images. We design SSG as a three-player game based on a generative adversarial network to produce pure-color strokes that are crucial for mimicking the physical strokes. Furthermore, the digital artist adjusts parameters of strokes (shape, size, transparency, and color) to reconstruct as much detailed content of the reference image as possible to improve the fidelity.	https://dl.acm.org/doi/abs/10.1145/3476124.3488617	Qian Wang, Cai Guo, Hong-Ning Dai, Ping Li
