title	abstract	url	authors
MeshWalker: deep mesh understanding by random walks	"Most attempts to represent 3D shapes for deep learning have focused on volumetric grids, multi-view images and point clouds. In this paper we look at the most popular representation of 3D shapes in computer graphics---a triangular mesh---and ask how it can be utilized within deep learning. The few attempts to answer this question propose to adapt convolutions & pooling to suit This paper proposes a very different approach, termed to learn the shape directly from a given mesh. The key idea is to represent the mesh by random walks along the surface, which ""explore"" the mesh's geometry and topology. Each walk is organized as a list of vertices, which in some manner imposes regularity on the mesh. The walk is fed into a that ""remembers"" the history of the walk. We show that our approach achieves state-of-the-art results for two fundamental shape analysis tasks: shape classification and semantic segmentation. Furthermore, even a very small number of examples suffices for learning. This is highly important, since large datasets of meshes are difficult to acquire."	https://dl.acm.org/doi/abs/10.1145/3414685.3417806	Alon Lahav, Ayellet Tal
Mixed integer ink selection for spectral reproduction	We introduce a novel ink selection method for spectral printing. The ink selection algorithm takes a spectral image and a set of inks as input, and selects a subset of those inks that results in optimal spectral reproduction. We put forward an optimization formulation that searches a huge combinatorial space based on mixed integer programming. We show that solving this optimization in the conventional reflectance space is intractable. The main insight of this work is to solve our problem in the spectral absorbance space with a linearized formulation. The proposed ink selection copes with large-size problems for which previous methods are hopeless. We demonstrate the effectiveness of our method in a concrete setting by lifelike reproduction of handmade paintings. For a successful spectral reproduction of high-resolution paintings, we explore their spectral absorbance estimation, efficient coreset representation, and accurate data-driven reproduction.	https://dl.acm.org/doi/abs/10.1145/3414685.3417761	Navid Ansari, Omid Alizadeh-Mousavi, Hans-Peter Seidel, Vahid Babaei
MoGlow: probabilistic and controllable motion synthesis using normalising flows	Data-driven modelling and synthesis of motion is an active research area with applications that include animation, games, and social robotics. This paper introduces a new class of probabilistic, generative, and controllable motion-data models based on normalising flows. Models of this kind can describe highly complex distributions, yet can be trained efficiently using exact maximum likelihood, unlike GANs or VAEs. Our proposed model is autoregressive and uses LSTMs to enable arbitrarily long time-dependencies. Importantly, is is also causal, meaning that each pose in the output sequence is generated without access to poses or control inputs from future time steps; this absence of algorithmic latency is important for interactive applications with real-time motion control. The approach can in principle be applied to any type of motion since it does not make restrictive, task-specific assumptions regarding the motion or the character morphology. We evaluate the models on motion-capture datasets of human and quadruped locomotion. Objective and subjective results show that randomly-sampled motion from the proposed method outperforms task-agnostic baselines and attains a motion quality close to recorded motion capture.	https://dl.acm.org/doi/abs/10.1145/3414685.3417836	Gustav Eje Henter, Simon Alexanderson, Jonas Beskow
Modular primitives for high-performance differentiable rendering	We present a modular differentiable renderer design that yields performance superior to previous methods by leveraging existing, highly optimized hardware graphics pipelines. Our design supports all crucial operations in a modern graphics pipeline: rasterizing large numbers of triangles, attribute interpolation, filtered texture lookups, as well as user-programmable shading and geometry processing, all in high resolutions. Our modular primitives allow custom, high-performance graphics pipelines to be built directly within automatic differentiation frameworks such as PyTorch or TensorFlow. As a motivating application, we formulate facial performance capture as an inverse rendering problem and show that it can be solved efficiently using our tools. Our results indicate that this simple and straightforward approach achieves excellent geometric correspondence between rendered results and reference imagery.	https://dl.acm.org/doi/abs/10.1145/3414685.3417861	Samuli Laine, Janne Hellsten, Tero Karras, Yeongho Seol, Jaakko Lehtinen, Timo Aila
Monolith: a monolithic pressure-viscosity-contact solver for strong two-way rigid-rigid rigid-fluid coupling	"We propose , a monolithic pressure-viscosity-contact solver for more accurately, robustly, and efficiently simulating non-trivial two-way interactions of rigid bodies with inviscid, viscous, or non-Newtonian liquids. Our solver simultaneously handles incompressibility and (optionally) implicit viscosity integration for liquids, contact resolution for rigid bodies, and mutual interactions between liquids and rigid bodies by carefully formulating these as a single unified minimization problem. This monolithic approach reduces or eliminates an array of problematic artifacts, including liquid volume loss, solid interpenetrations, simulation instabilities, artificial ""melting"" of viscous liquid, and incorrect slip at liquid-solid interfaces. In the absence of solid-solid friction, our minimization problem is a Quadratic Program (QP) with a symmetric positive definite (SPD) matrix and can be treated with a single Linear Complementarity Problem (LCP) solve. When friction is present, we decouple the unified minimization problem into two subproblems so that it can be effectively handled via staggered projections with alternating LCP solves. We also propose a complementary approach for non-Newtonian fluids which can be seamlessly integrated and addressed during the staggered projections. We demonstrate the critical importance of a , unified treatment of fluid-solid coupling and the effectiveness of our proposed Monolith solver in a wide range of practical scenarios."	https://dl.acm.org/doi/abs/10.1145/3414685.3417798	Tetsuya Takahashi, Christopher Batty
Mononizing binocular videos	This paper presents the idea of binocular videos and a framework to effectively realize it. Mono-nize means we purposely convert a binocular video into a regular monocular video with the stereo information implicitly encoded in a visual but nearly-imperceptible form. Hence, we can impartially distribute and show the mononized video as an ordinary monocular video. Unlike ordinary monocular videos, we can restore from it the original binocular video and show it on a stereoscopic display. To start, we formulate an encoding-and-decoding framework with the pyramidal deformable fusion module to exploit long-range correspondences between the left and right views, a quantization layer to suppress the restoring artifacts, and the compression noise simulation module to resist the compression noise introduced by modern video codecs. Our framework is self-supervised, as we articulate our objective function with loss terms defined on the input: a monocular term for creating the mononized video, an invertibility term for restoring the original video, and a temporal term for frame-to-frame coherence. Further, we conducted extensive experiments to evaluate our generated mononized videos and restored binocular videos for diverse types of images and 3D movies. Quantitative results on both standard metrics and user perception studies show the effectiveness of our method.	https://dl.acm.org/doi/abs/10.1145/3414685.3417764	Wenbo Hu, Menghan Xia, Chi-Wing Fu, Tien-Tsin Wong
Monster mash: a single-view approach to casual 3D modeling and animation	We present a new framework for sketch-based modeling and animation of 3D organic shapes that can work entirely in an intuitive 2D domain, enabling a playful, casual experience. Unlike previous sketch-based tools, our approach does not require a tedious part-based multi-view workflow with the explicit specification of an animation rig. Instead, we combine 3D inflation with a novel rigidity-preserving, layered deformation model, ARAP-L, to produce a smooth 3D mesh that is immediately ready for animation. Moreover, the resulting model can be animated from a single viewpoint --- and without the need to handle unwanted inter-penetrations, as required by previous approaches. We demonstrate the benefit of our approach on a variety of examples produced by inexperienced users as well as professional animators. For less experienced users, our single-view approach offers a simpler modeling and animating experience than working in a 3D environment, while for professionals, it offers a quick and casual workspace for ideation.	https://dl.acm.org/doi/abs/10.1145/3414685.3417805	Marek Dvorožňák, Daniel Sýkora, Cassidy Curtis, Brian Curless, Olga Sorkine-Hornung, David Salesin
NORAA [machinic doodles]	How does machine learning contribute to our understanding of how ideas are communicated through drawing? Specifically, how can networks capable of exhibiting dynamic temporal behaviour for time sequences be used for the generation of line (vector) drawings? Can machine-learning algorithms reveal something about the way we draw? Can we better understand the way we encode ideas into drawings from these algorithms? While simple pen strokes may not resemble reality as captured by more sophisticated visual representations, they do tell us something about how people represent and reconstruct the world around them. The ability to immediately recognise, depict objects and even emotions from a few marks, strokes and lines, is something that humans learn as children. Machinic Doodles is interested in the semantics of lines, the patterns that emerge in how people around the world draw - what governs the rule of geometry that makes us draw from one point to another in a specific order? The order, speedpace and expression of a line, its constructed and semantic associations are of primary interest, generated figures are simply the means and the record of the interaction, not the final motivation. The installation is essentially a game of human-robot Pictionary: you draw, the machine takes a guess, and then draws something back in response. The project demonstrates how a drawing game based on a recurrent-neural-network, combined with real-time human drawing interaction, can be used to generate a sequence of human- machine doodle drawings. As the number of classification models is greater than the generational models (i.e. ability to identify is higher than drawing ability), the work inherently explores this gap in the machine's knowledge, as well as creative possibilities afforded by misinterpretations of the machine. Drawings are not just for guessing, but analysed for spatial and temporal characteristics to inform drawing generation.	https://dl.acm.org/doi/abs/10.1145/3414686.3427106	Jessica In, George Profenza, Sam Price
Narcissus	Narcissus was a hunter in Greek mythology who fell in love with his own reflection in the water. Narcissus is the origin of the term narcissism. This artwork, as its name suggests, is based on the myth of Narcissus. A narcissistic ego that conceals the weakness of the individual, focuses energy only on itself. Everyone has narcissism even if a little. Excessive narcissism causes lots of problems from isolation because fascinating by the perfection of oneself makes relationship with the others closed. Sensing the brainwave of an appreciator, creates an interaction that the higher concentration on the reflection on the surface of water, the more blurred observation. Through this interaction, the viewer is interrupted from being deeply immersed in oneself. That experience reflects the reverse of the Narcissus story and expresses that mirrored image of the participant could not exist as complete subject. Also, this artwork is referred to the 'Mirror stage' hypothesized by Jacques Lacan(1901--1981). Unlike the ego-psychologists' assertion that we should strengthen our ego, Jacques Lacan points out the narcissistic ego which is imaginary in human beings and says that we can grow up as a healthy subject through acknowledging that we are lacking ego not just strengthening the ego.	https://dl.acm.org/doi/abs/10.1145/3414686.3427152	Seol Lee
Nebula go	In NEBULA GO, you can see many nebulae and stars being born and losing, and glimpse the secrets that arise in space. In this NEBULA GO, the universe is expressed through Go, and since ancient times, Go was invented as a tool for observing and studying the movement of celestial bodies. In this work, the artist harmonizes the secrets that occur in the universe by using the act of placing a Go in a square space, various fights caused by it, domain creation, and movement of forces. Looking at NEBULA GO, unlike Go, where victory or defeat is determined, you can observe the numerous planets visible in the universe when all actions have been completed and the changes caused by these planets. Also, by focusing on the birth origin of astronomical observation, actors can appreciate their own microcosm through their actions.	https://dl.acm.org/doi/abs/10.1145/3414686.3427166	Jungho Kim, Youngho Kim, Taekyung Yoo
Neural control variates	We propose neural control variates (NCV) for unbiased variance reduction in parametric Monte Carlo integration. So far, the core challenge of applying the method of control variates has been finding a good approximation of the integrand that is cheap to integrate. We show that a set of neural networks can face that challenge: a normalizing flow that approximates the shape of the integrand and another neural network that infers the solution of the integral equation. We also propose to leverage a neural importance sampler to estimate the difference between the original integrand and the learned control variate. To optimize the resulting parametric estimator, we derive a theoretically optimal, variance-minimizing loss function, and propose an alternative, composite loss for stable online training in practice. When applied to light transport simulation, neural control variates are capable of matching the state-of-the-art performance of other unbiased approaches, while providing means to develop more performant, practical solutions. Specifically, we show that the learned light-field approximation is of sufficient quality for high-order bounces, allowing us to omit the error correction and thereby dramatically reduce the noise at the cost of negligible visible bias.	https://dl.acm.org/doi/abs/10.1145/3414685.3417804	Thomas Müller, Fabrice Rousselle, Alexander Keller, Jan Novák
Neural crossbreed: neural based image metamorphosis	We propose Neural Crossbreed, a feed-forward neural network that can learn a semantic change of input images in a latent space to create the morphing effect. Because the network learns a semantic change, a sequence of meaningful intermediate images can be generated without requiring the user to specify explicit correspondences. In addition, the semantic change learning makes it possible to perform the morphing between the images that contain objects with significantly different poses or camera views. Furthermore, just as in conventional morphing techniques, our morphing network can handle shape and appearance transitions separately by disentangling the content and the style transfer for rich usability. We prepare a training dataset for morphing using a pre-trained BigGAN, which generates an intermediate image by interpolating two latent vectors at an intended morphing value. This is the first attempt to address image morphing using a pre-trained generative model in order to learn semantic transformation. The experiments show that Neural Crossbreed produces high quality morphed images, overcoming various limitations associated with conventional approaches. In addition, Neural Crossbreed can be further extended for diverse applications such as multi-image morphing, appearance transfer, and video frame interpolation.	https://dl.acm.org/doi/abs/10.1145/3414685.3417797	Sanghun Park, Kwanggyoon Seo, Junyong Noh
Neural holography with camera-in-the-loop training	Holographic displays promise unprecedented capabilities for direct-view displays as well as virtual and augmented reality applications. However, one of the biggest challenges for computer-generated holography (CGH) is the fundamental tradeoff between algorithm runtime and achieved image quality, which has prevented high-quality holographic image synthesis at fast speeds. Moreover, the image quality achieved by most holographic displays is low, due to the mismatch between the optical wave propagation of the display and its simulated model. Here, we develop an algorithmic CGH framework that achieves unprecedented image fidelity and real-time framerates. Our framework comprises several parts, including a novel camera-in-the-loop optimization strategy that allows us to either optimize a hologram directly or train an interpretable model of the optical wave propagation and a neural network architecture that represents the first CGH algorithm capable of generating full-color high-quality holographic images at 1080p resolution in real time.	https://dl.acm.org/doi/abs/10.1145/3414685.3417802	Yifan Peng, Suyeon Choi, Nitish Padmanaban, Gordon Wetzstein
Neural light field 3D printing	Modern 3D printers are capable of printing large-size light-field displays at high-resolutions. However, optimizing such displays in full 3D volume for a given light-field imagery is still a challenging task. Existing light field displays optimize over relatively small resolutions using a few co-planar layers in a 2.5D fashion to keep the problem tractable. In this paper, we propose a novel end-to-end optimization approach that encodes input light field imagery as a continuous-space implicit representation in a neural network. This allows fabricating high-resolution, attenuation-based volumetric displays that exhibit the target light fields. In addition, we incorporate the physical constraints of the material to the optimization such that the result can be printed in practice. Our simulation experiments demonstrate that our approach brings significant visual quality improvement compared to the multilayer and uniform grid-based approaches. We validate our simulations with fabricated prototypes and demonstrate that our pipeline is flexible enough to allow fabrications of both planar and non-planar displays.	https://dl.acm.org/doi/abs/10.1145/3414685.3417879	Quan Zheng, Vahid Babaei, Gordon Wetzstein, Hans-Peter Seidel, Matthias Zwicker, Gurprit Singh
Nonlinear spectral geometry processing via the TV transform	We introduce a novel computational framework for digital geometry processing, based upon the derivation of a nonlinear operator associated to the total variation functional. Such an operator admits a generalized notion of spectral decomposition, yielding a convenient multiscale representation akin to Laplacian-based methods, while at the same time avoiding undesirable over-smoothing effects typical of such techniques. Our approach entails accurate, decomposition and manipulation of 3D shape geometry while taking an especially intuitive form: non-local semantic details are well separated into different bands, which can then be filtered and re-synthesized with a straightforward linear step. Our computational framework is flexible, can be applied to a variety of signals, and is easily adapted to different geometry representations, including triangle meshes and point clouds. We showcase our method through multiple applications in graphics, ranging from surface and signal denoising to enhancement, detail transfer, and cubic stylization.	https://dl.acm.org/doi/abs/10.1145/3414685.3417849	Marco Fumero, Michael Möller, Emanuele Rodolà
Offsite aerial path planning for efficient urban scene reconstruction	With rapid development in UAV technologies, it is now possible to reconstruct large-scale outdoor scenes using only images captured by low-cost drones. The problem, however, becomes how to plan the aerial path for a drone to capture images so that two conflicting goals are optimized: maximizing the reconstruction quality and minimizing mid-air image acquisition effort. Existing approaches either resort to pre-defined dense and thus inefficient view sampling strategy, or plan the path adaptively but require two onsite flight passes and intensive computation in-between. Hence, using these methods to capture and reconstruct large-scale scenes can be tedious. In this paper, we present an adaptive aerial path planning algorithm that can be done before the site visit. Using only a 2D map and a satellite image of the to-be-reconstructed area, we first compute a coarse 2.5D model for the scene based on the relationship between buildings and their shadows. A novel Max-Min optimization is then proposed to select a minimal set of viewpoints that maximizes the reconstructability under the the same number of viewpoints. Experimental results on benchmark show that our planning approach can effectively reduce the number of viewpoints needed than the previous state-of-the-art method, while maintaining comparable reconstruction quality. Since no field computation or a second visit is needed, and the view number is also minimized, our approach significantly reduces the time required in the field as well as the off-line computation cost for multi-view stereo reconstruction, making it possible to reconstruct a large-scale urban scene in a short time with moderate effort.	https://dl.acm.org/doi/abs/10.1145/3414685.3417791	Xiaohui Zhou, Ke Xie, Kai Huang, Yilin Liu, Yang Zhou, Minglun Gong, Hui Huang
OmniPhotos: Casual 360° VR Photography with Motion Parallax	Until now, immersive 360° VR panoramas could not be captured casually and reliably at the same time as state-of-the-art approaches involve time-consuming or expensive capture processes that prevent the casual capture of real-world VR environments. Existing approaches are also often limited in their supported range of head motion. We introduce OmniPhotos, a novel approach for casually and reliably capturing high-quality 360° VR panoramas. Our approach only requires a single sweep of a consumer 360° video camera as input, which takes less than 3 seconds with a rotating selfie stick. The captured video is transformed into a hybrid scene representation consisting of a coarse scene-specific proxy geometry and optical flow between consecutive video frames, enabling 5-DoF real-world VR experiences. The large capture radius and 360° field of view significantly expand the range of head motion compared to previous approaches. Among all competing methods, ours is the simplest, and fastest by an order of magnitude. We have captured more than 50 OmniPhotos and show video results for a large variety of scenes. We will make our code and datasets publicly available.	https://dl.acm.org/doi/abs/10.1145/3415255.3422884	Tobias Bertel, Mingze Yuan, Reuben Lindroos, Christian Richardt
OmniPhotos: casual 360° VR photography	Virtual reality headsets are becoming increasingly popular, yet it remains difficult for casual users to capture immersive 360° VR panoramas. State-of-the-art approaches require capture times of usually far more than a minute and are often limited in their supported range of head motion. We introduce OmniPhotos, a novel approach for quickly and casually capturing high-quality 360° panoramas with motion parallax. Our approach requires a single sweep with a consumer 360° video camera as input, which takes less than 3 seconds to capture with a rotating selfie stick or 10 seconds handheld. This is the fastest capture time for any VR photography approach supporting motion parallax by an order of magnitude. We improve the visual rendering quality of our OmniPhotos by alleviating vertical distortion using a novel deformable proxy geometry, which we fit to a sparse 3D reconstruction of captured scenes. In addition, the 360° input views significantly expand the available viewing area, and thus the range of motion, compared to previous approaches. We have captured more than 50 OmniPhotos and show video results for a large variety of scenes. We will make our code available.	https://dl.acm.org/doi/abs/10.1145/3414685.3417770	Tobias Bertel, Mingze Yuan, Reuben Lindroos, Christian Richardt
Opening and closing surfaces	We propose a new type of curvature flow for curves in 2D and surfaces in 3D. The flow is inspired by the mathematical morphology and operations. These operations are classically defined by composition of dilation and erosion operations. In practice, existing methods implemented this way will result in re-discretizing the entire shape, even if some parts of the surface do not change. Instead, our surface-only curvature-based flow moves the surface selectively in areas that should be repositioned. In our triangle mesh discretization, vertices in regions unaffected by the opening or closing will remain exactly in place and do not affect our method's complexity, which is output-sensitive.	https://dl.acm.org/doi/abs/10.1145/3414685.3417778	Silvia Sellán, Jacob Kesten, Ang Yan Sheng, Alec Jacobson
