title	abstract	url	authors
Differentiable vector graphics rasterization for editing and learning	We introduce a differentiable rasterizer that bridges the vector graphics and raster image domains, enabling powerful raster-based loss functions, optimization procedures, and machine learning techniques to edit and generate vector content. We observe that vector graphics rasterization is differentiable after pixel prefiltering. Our differentiable rasterizer offers two prefiltering options: an analytical prefiltering technique and a multisampling anti-aliasing technique. The analytical variant is faster but can suffer from artifacts such as conflation. The multisampling variant is still efficient, and can render high-quality images while computing unbiased gradients for each pixel with respect to curve parameters. We demonstrate that our rasterizer enables new applications, including a vector graphics editor guided by image metrics, a painterly rendering algorithm that fits vector primitives to an image by minimizing a deep perceptual loss function, new vector graphics editing algorithms that exploit well-known image processing methods such as seam carving, and deep generative models that generate vector content from raster-only supervision under a VAE or GAN training objective.	https://dl.acm.org/doi/abs/10.1145/3414685.3417871	Tzu-Mao Li, Michal Lukáč, Michaël Gharbi, Jonathan Ragan-Kelley
"Digital being: ""hello, world!"""	"As we all feel as of 2020, most things in the world are reorganized around digital technology and the influence is strong. This technology is rapidly changing toward AI and M2M, where hardware is becoming nanoscale and software is less human intervention in order to process data flooding more efficiently and quickly. For this reason, we were the discoverers of this technology, but we feel a gap where we no longer know how it works. And I think it provides an opportunity for digital life, Digital Being, to emerge from that gap. I have been looking for an invisible and formless creature born out of abandoned technology for 10 years in New York City. I call it, ""Digital Being,"" and it is also the title of my hypothetical story. This creature has atypical movements or other interactions depending on the machine it dominates. Also in this story, the entity can transmit itself over the network. Digital Being: ""Hello, World!,"" a primitive version of the digital being family, has arrived into LCD touch screens through the network. There seems to be no physical connection, but you can guess by seeing the Wi-Fi indicator briefly appear in the right corner of the screen every time I boot it up. I don't know why, but, after arriving, it started to create a flag image by constantly collecting small pixels. To me, this action seems like a process similar to how people co-evolved the state. Please come closer and see what it is doing by touching the screen."	https://dl.acm.org/doi/abs/10.1145/3414686.3427138	Taezoo Park
Discovering pattern structure using differentiable compositing	Patterns, which are collections of elements arranged in regular or near-regular arrangements, are an important graphic art form and widely used due to their elegant simplicity and aesthetic appeal. When a pattern is encoded as a flat image without the underlying structure, manually editing the pattern is tedious and challenging as one has to both preserve the individual element shapes and their original relative arrangements. State-of-the-art deep learning frameworks that operate at the pixel level are unsuitable for manipulating such patterns. Specifically, these methods can easily disturb the shapes of the individual elements or their arrangement, and thus fail to preserve the latent structures of the input patterns. We present a novel differentiable operator using pattern elements and use it to discover structures, in the form of a layered representation of graphical objects, directly from raw pattern images. This operator allows us to adapt current deep learning based image methods to effectively handle patterns. We evaluate our method on a range of patterns and demonstrate superiority in the context of pattern manipulations when compared against state-of-the-art pixel- or point-based alternatives.	https://dl.acm.org/doi/abs/10.1145/3414685.3417830	Pradyumna Reddy, Paul Guerrero, Matt Fisher, Wilmot Li, Niloy J. Mitra
Distance music: preferred population density for the acoustic hygiene	"""Distance Music: Preferred Population Density for The Acoustic Hygiene"" is an interactive ambient music installation, which interacts with the number of listeners in the installation. The installation consists of three parts, which is the music engine, sensor, and a video loop. While people watch some archives of vintage government educational videos about social hygiene inside the room, the sensor will measure density of the room and send it to the pre-recorded music engine, which will interact with the data from density sensor, evolving into more intense music as the population density rises. As a result, people will hear unpleasant noise the more they are close to each other. This installation is inspired from 'social distancing', a global experience during this ongoing pandemic era, as some of the music engine process represents and simulates 'distancing alarm' for social distancing, therefore acts as an experiment of public alarm for social distancing. We believe that the people's memory with this unprecedented worldwide incident will resonate efficiently with the installation, and a great deal of inspiration as well."	https://dl.acm.org/doi/abs/10.1145/3414686.3427134	Sunggun Jang, DongMin Kim
Don't worry, be happy	Can we look at a person's face and determine how they feel? AI emotion recognition systems are designed to detect faces and return confidence levels across a set of emotions such as anger, contempt, disgust, fear, happiness, sadness and surprise. Such systems already operate in our environment and might have the capacity to seriously impact our lives. In the live performance 'Don't Worry, Be Happy', the artist is strapped to an electric chair. Her face is constantly detected by an emotion recognition AI system. As long as she is detected as 'Happy' she is safe. However, each time any other emotion is observed, she receives an electric shock to both her arms. During the performance the artist changes her apparent behavior in order to free herself from the 'punishment' that the AI system delivers. Yet, under the threat of getting shocked, for how long can she perform this exaggerated facial expression so that the machine continues to 'read' her as 'Happy'? The apparatus presented in this performance utilizes the electric chair as a reminder of the use of new technologies as instruments of the law. Such tools initially appeared as legitimate solutions and was later own understood as problematic and inhumane. The performance aims to remind the viewers that we are not powerless when we are confronted with AI algorithms that are looking at us. The artist resists the emotion recognition system by faking a smile. This performative engagement points out to a future of a post-algorithmic society in which we change our behavior in order to align it with algorithms in our environment.	https://dl.acm.org/doi/abs/10.1145/3414686.3427151	Avital Meshi
Dreaming with dandelion	"In this robotic art project, we developing a series of autonomous behavior as fictional design to mimic that robot has its own conscious. We make robot holding a pencil for drawing line-based illustration, metaphor robot is dreaming, according to in ""Do Androids Dream of Electric Sheep?"", whether you can dream is used as a romantic question to test between life and artificial life. In the system, the industrial robot independently explores the Environmental Information through the depth sensor and AI system in exhibition space. And then the detected data will used to input into Dandelion-like Generative System(DGS), which made by algorithmic data structures from fractal tree and L-system for mimic nature phototropism mechanism and growing processes. Finally, we used grasshopper develop a mechanism to convert the linebase dandelion diagram into robotic painting by manipulation paths and gripper's act, to make robot physically holding the pencil to draw it out on a paper. This installation will painting an unique dandelion illustration per day, it can also see as specific data visualization by its dynamical physical environment. This stroking processes and its painted outcome can see as a hybrid creation combining computational aesthetics and Robotic Stroking."	https://dl.acm.org/doi/abs/10.1145/3414686.3427158	Scottie Chih-Chieh Huang, Chi-Li Cheng
Dual Body: Method of Tele-Cooperative Avatar Robot with Passive Sensation Feedback to Reduce Latency Perception	Dual Body was developed to be a telexistence or telepresence system, one in which the user does not need to continuously operate an avatar robot but is still able to passively perceive feedback sensations when the robot performs actions. This system can recognize user speech commands, and the robot performs the task cooperatively. The system that we propose, in which passive sensation feedback and cooperation of the robot are used, highly reduces the perception of latency and the feeling of fatigue, which increases the quality of experience and task efficiency. In the demo experience, participants will be able to command the robot from individual rooms via a URL and RoomID, and they will perceive sound and visual feedback, such as images or landscapes of the campus of Tokyo Metropolitan University, from the robot as it travels.	https://dl.acm.org/doi/abs/10.1145/3415255.3422893	Vibol Yem, Kentaro Yamaoka, Gaku Sueta, Yasushi Ikei
Dynamic Projection Mapping with Networked Multi-projectors Based on Pixel-parallel Intensity Control	We present a new method of mapping projections onto dynamic scenes by using multiple high-speed projectors. The proposed method controls the intensity in a pixel-parallel manner for each projector. As each projected image is updated in real time with low latency, adaptive shadow removal can be achieved for a projected image even in a complicated dynamic scene. Additionally, our pixel-parallel calculation method allows a distributed system configuration so that the number of projectors can be increased by networked connections for high scalability. We demonstrated seamless mapping onto dynamic scenes at 360 fps by using ten cameras and four projectors.	https://dl.acm.org/doi/abs/10.1145/3415255.3422888	Takashi Nomoto, Wanlong Li, Hao-Lun Peng, Yoshihiro Watanabe
Dynamic facial asset and rig generation from a single scan	The creation of high-fidelity computer-generated (CG) characters for films and games is tied with intensive manual labor, which involves the creation of comprehensive facial assets that are often captured using complex hardware. To simplify and accelerate this digitization process, we propose a framework for the automatic generation of high-quality dynamic facial models, including rigs which can be readily deployed for artists to polish. Our framework takes a single scan as input to generate a set of personalized blendshapes, dynamic textures, as well as secondary facial components ( , teeth and eyeballs). Based on a facial database with over 4, 000 scans with pore-level details, varying expressions and identities, we adopt a self-supervised neural network to learn personalized blendshapes from a set of template expressions. We also model the joint distribution between identities and expressions, enabling the inference of a full set of personalized blendshapes with dynamic appearances from a single neutral input scan. Our generated personalized face rig assets are seamlessly compatible with professional production pipelines for facial animation and rendering. We demonstrate a highly robust and effective framework on a wide range of subjects, and showcase high-fidelity facial animations with automatically generated personalized dynamic textures.	https://dl.acm.org/doi/abs/10.1145/3414685.3417817	Jiaman Li, Zhengfei Kuang, Yajie Zhao, Mingming He, Karl Bladin, Hao Li
Egocentric videoconferencing	We introduce a method for egocentric videoconferencing that enables hands-free video calls, for instance by people wearing smart glasses or other mixed-reality devices. Videoconferencing portrays valuable non-verbal communication and face expression cues, but usually requires a front-facing camera. Using a frontal camera in a hands-free setting when a person is on the move is impractical. Even holding a mobile phone camera in the front of the face while sitting for a long duration is not convenient. To overcome these issues, we propose a low-cost wearable egocentric camera setup that can be integrated into smart glasses. Our goal is to mimic a classical video call, and therefore, we transform the egocentric perspective of this camera into a front facing video. To this end, we employ a conditional generative adversarial neural network that learns a transition from the highly distorted egocentric views to frontal views common in videoconferencing. Our approach learns to transfer expression details directly from the egocentric view without using a complex intermediate parametric expressions model, as it is used by related face reenactment methods. We successfully handle subtle expressions, not easily captured by parametric blendshape-based solutions, e.g., tongue movement, eye movements, eye blinking, strong expressions and depth varying movements. To get control over the rigid head movements in the target view, we condition the generator on synthetic renderings of a moving neutral face. This allows us to synthesis results at different head poses. Our technique produces temporally smooth video-realistic renderings in real-time using a video-to-video translation network in conjunction with a temporal discriminator. We demonstrate the improved capabilities of our technique by comparing against related state-of-the art approaches.	https://dl.acm.org/doi/abs/10.1145/3414685.3417808	Mohamed Elgharib, Mohit Mendiratta, Justus Thies, Matthias Niessner, Hans-Peter Seidel, Ayush Tewari, Vladislav Golyanik, Christian Theobalt
Empathy wall	"Empathy Wall is a work that starts with the question of whether when human-to-person communication is applied to human-to-technical communication, it can produce feelings close to the ""sympathy"" that occur between people. Empathy Wall wanted to develop human-to-human communication into human-to-object communication using the latest IT technology, and we wanted to expand this into empathy and familiarity between technology and humans. In other words, through the work of art called Empathy Wall, we are trying to extend human-to-human consensus to human-to-technical consensus formation. In the Empathy Wall, the two audiences in each room divided by walls cannot see each other, and an image appears on the wall. The two audiences are given the same subject and question, and if they talk about it freely, their emotions will be analyzed through AI algorithms according to the story, and images based on Kandinsky's theoretical rules will appear on the screen. At this time, the images from the emotional analysis of the stories of the two audiences are all mixed and appear on the walls of the room. Through this process, the audience will be able to see images automatically generated regardless of their own story being expressed on the same screen, in addition to images that respond to their stories. At this time, you can think of images as images of audiences in other rooms, or you can think that the walls themselves create images. During the experience of the Empathy Wall, the audience can feel emotions by looking at images that respond to their stories, and can feel emotions with other audiences as they automatically appear and mix with their own images regardless of their own stories, and furthermore, people and walls can feel empathy."	https://dl.acm.org/doi/abs/10.1145/3414686.3427167	Joon Seok Moon
Face identity disentanglement via latent space mapping	Learning disentangled representations of data is a fundamental problem in artificial intelligence. Specifically, disentangled latent representations allow generative models to control and compose the disentangled factors in the synthesis process. Current methods, however, require extensive supervision and training, or instead, noticeably compromise quality. In this paper, we present a method that learns how to represent data in a disentangled way, with minimal supervision, manifested solely using available pre-trained networks. Our key insight is to decouple the processes of disentanglement and synthesis, by employing a leading pre-trained unconditional image generator, such as StyleGAN. By learning to map into its latent space, we leverage both its state-of-the-art quality, and its rich and expressive latent space, without the burden of training it. We demonstrate our approach on the complex and high dimensional domain of human heads. We evaluate our method qualitatively and quantitatively, and exhibit its success with de-identification operations and with temporal identity coherency in image sequences. Through extensive experimentation, we show that our method successfully disentangles identity from other facial attributes, surpassing existing methods, even though they require more training and supervision.	https://dl.acm.org/doi/abs/10.1145/3414685.3417826	Yotam Nitzan, Amit Bermano, Yangyan Li, Daniel Cohen-Or
Facebook art	Drama mask culture is a classification in the long history of Chinese traditional culture. But now many young people had been almost forgotten this kind of culture, our purpose is to think through a can make young people more likely to focus on a way, the opera masks appear in public, utilizing new media in this work, we break the traditional opera masks, allow the user to the style of be fond of according to oneself design their own opera masks, generated by AI technology will play facebook elements (eyes nose mouth lines) into various styles: Pixel style, style and line fault style more popular modern fashion elements, such as the user side/tablet and mobile phone use through the program can design their own opera masks, and then click send projection on the wall, appreciation of their own design art show facebook generation process and form, get belongs to own a new opera masks media work. This work wants to let you know: in fact, traditional culture has not been outdated, and can be very cool.	https://dl.acm.org/doi/abs/10.1145/3414686.3427125	Yunqing Xu, Yi Ji, Jingxin Lan, Qiaoling Zhong
Fast and robust mesh arrangements using floating-point arithmetic	We introduce a novel algorithm to transform any generic set of triangles in 3D space into a well-formed simplicial complex. Intersecting elements in the input are correctly identified, subdivided, and connected to arrange a valid configuration, leading to a topologically sound partition of the space into piece-wise linear cells. Our approach does not require the exact coordinates of intersection points to calculate the resulting complex. We represent any intersection point as an unevaluated combination of input vertices. We then extend the recently introduced concept of [Attene 2020] to define all the necessary geometric tests that, by construction, are both exact and efficient since they fully exploit the floating-point hardware. This design makes our method robust and guaranteed correct, while being virtually as fast as non-robust floating-point based implementations. Compared with existing robust methods, our algorithm offers a number of advantages: it is much faster, has a better memory layout, scales well on extremely challenging models, and allows fully exploiting modern multi-core hardware with a parallel implementation. We thoroughly tested our method on thousands of meshes, concluding that it consistently outperforms prior art. We also demonstrate its usefulness in various applications, such as computing efficient mesh booleans, Minkowski sums, and volume meshes.	https://dl.acm.org/doi/abs/10.1145/3414685.3417818	Gianmarco Cherchi, Marco Livesu, Riccardo Scateni, Marco Attene
Freeform quad-based kirigami	Kirigami, the traditional Japanese art of paper cutting and folding generalizes origami and has initiated new research in material science as well as graphics. In this paper we use its capabilities to perform geometric modeling with corrugated surface representations possessing an isometric unfolding into a planar domain after appropriate cuts are made. We initialize our box-based kirigami structures from orthogonal networks of curves, compute a first approximation of their unfolding via mappings between meshes, and complete the process by global optimization. Besides the modeling capabilities we also study the interesting geometry of special kirigami structures from the theoretical side. This experimental paper strives to relate unfoldable checkerboard arrangements of boxes to principal meshes, to the transformation theory of discrete differential geometry, and to a version of the Gauss theorema egregium.	https://dl.acm.org/doi/abs/10.1145/3414685.3417844	Caigui Jiang, Florian Rist, Helmut Pottmann, Johannes Wallner
Freely orientable microstructures for designing deformable 3D prints	Nature offers a marvel of astonishing and rich deformation behaviors. Yet, most of the objects we fabricate are comparatively rather inexpressive, either rigid or exhibiting simple homogeneous deformations when interacted with. We explore the synthesis and fabrication of novel microstructures that mimic the effects of having oriented rigid fibers in an otherwise flexible material: the result is extremely rigid along a transverse direction while being comparatively very flexible in the locally orthogonal plane. By allowing free gradation of the rigidity direction orientation within the object, the microstructures can be designed such that, under deformation, distances along fibers in the volume are preserved while others freely change. Through a simple painting tool, this allows a designer to influence the way the volume reshapes when deformed, and results in a wide range of novel possibilities. Many gradations are possible: local free orientation of the fibers; local control of the overall material rigidity (structure density); local canceling of the effect of the fibers, obtaining a more isotropic material. Our algorithm to synthesize the structures builds upon procedural texturing. It produces a cellular geometry that can be fabricated reliably despite 3D printing walls at a minimal thickness, allowing prints to be very flexible. The synthesis algorithm is efficient and scales to large volumes.	https://dl.acm.org/doi/abs/10.1145/3414685.3417790	Thibault Tricard, Vincent Tavernier, Cédric Zanni, Jonàs Martínez, Pierre-Alexandre Hugron, Fabrice Neyret, Sylvain Lefebvre
Frequency-domain smoke guiding	We propose a simple and efficient method for guiding an Eulerian smoke simulation to match the behavior of a specified velocity field, such as a low-resolution animation of the same scene, while preserving the rich, turbulent details arising in the simulated fluid. Our method works by simply combining the high-frequency component of the simulated fluid velocity with the low-frequency component of the input guiding field. We show how to eliminate the grid-aligned artifacts that appear in naive guiding approaches, and provide a frequency-domain analysis that motivates the use of ideal low-pass and high-pass filters to prevent artificial dissipation of small-scale details. We demonstrate our method on many scenes including those with static and moving obstacles, and show that it produces high-quality results with very little computational overhead.	https://dl.acm.org/doi/abs/10.1145/3414685.3417842	Zahra Forootaninia, Rahul Narain
Functional optimization of fluidic devices with differentiable stokes flow	We present a method for performance-driven optimization of fluidic devices. In our approach, engineers provide a high-level specification of a device using parametric surfaces for the fluid-solid boundaries. They also specify desired flow properties for inlets and outlets of the device. Our computational approach optimizes the boundary of the fluidic device such that its steady-state flow matches desired flow at outlets. In order to deal with computational challenges of this task, we propose an efficient, differentiable Stokes flow solver. Our solver provides explicit access to gradients of performance metrics with respect to the parametric boundary representation. This key feature allows us to couple the solver with efficient gradient-based optimization methods. We demonstrate the efficacy of this approach on designs of five complex 3D fluidic systems. Our approach makes an important step towards practical computational design tools for high-performance fluidic devices.	https://dl.acm.org/doi/abs/10.1145/3414685.3417795	Tao Du, Kui Wu, Andrew Spielberg, Wojciech Matusik, Bo Zhu, Eftychios Sifakis
Futility	The author noted the surrounding environment for creating gentrification using culture and arts in Munrae-dong. The author wanted to express the author's view of the situation in Munrae-dong, where gentrification is taking place, and the image of the person be used and consumed in this situation through partial visualization of four-dimensional space.	https://dl.acm.org/doi/abs/10.1145/3414686.3427126	Sang wook Lee
