title	abstract	url	authors
SCAN: Semantic Document Layout Analysis for Textual and Visual Retrieval-Augmented Generation	With the increasing adoption of Large Language Models (LLMs) and Vision-Language Models (VLMs),rich document analysis technologies for applications like Retrieval-Augmented Generation (RAG)and visual RAG are gaining significant attention.Recent research indicates that using VLMs yields better RAG performance,but processing rich documents remains a challenge since a single page contains large amounts of information.In this paper, we present SCAN (SemantiC Document Layout ANalysis),a novel approach that enhances both textual and visual Retrieval-Augmented Generation (RAG) systemsthat work with visually rich documents.It is a VLM-friendly approach that identifies document components with appropriate semantic granularity,balancing context preservation with processing efficiency.SCAN uses a coarse-grained semantic approach that divides documents into coherent regions covering contiguous components.We trained the SCAN model by fine-tuning object detection models on an annotated dataset.Our experimental results across English and Japanese datasets demonstrate that applying SCAN improvesend-to-end textual RAG performance by up to 9.4 points and visual RAG performance by up to 10.4 points,outperforming conventional approaches and even commercial document processing solutions.	https://aclanthology.org/2026.findings-eacl.82	Nobuhiro Ueda, Yuyang Dong, Krisztián Boros, Daiki Ito, Takuya Sera, Masafumi Oyamada
SEAM: Bridging the Temporal-Semantic Granularity Gap for LLM-based Speech Recognition	Speech-LLM integration faces a temporal-semantic granularity gap: speech representations scale with temporal duration while text tokens scale with semantic content. Existing duration-based methods generate embeddings at fixed rates, creating distributional mismatch with LLM pre-training. We propose SEAM (Speech Encoder-Decoder Alignment Module), an encoder-decoder architecture employing variable-rate generation through cross-attention between speech features and text embeddings. SEAM produces embeddings at adaptive rates that closely match natural text distributions while preserving pre-trained knowledge by freezing both speech encoder and LLM. We introduce a multi-stage training strategy and First Token Guidance to improve initial token prediction. SEAM achieves competitive performance on LibriSpeech (2.6%/5.2% WER). More significantly, trained only on LibriSpeech (960h), SEAM achieves 4.7% WER on cross-domain TED-LIUM-v2, demonstrating that integrating LLM's linguistic knowledge enables effective generalization beyond limited speech training data.	https://aclanthology.org/2026.findings-eacl.112	Junseok Oh, Ji-Hwan Kim
SIRAJ: Diverse and Efficient Red-Teaming for LLM Agents via Distilled Structured Reasoning	The ability of LLM agents to plan and invoke tools exposes them to new safety risks, making a comprehensive red-teaming system crucial for discovering vulnerabilities and ensuring their safe deployment. We present SIRAJ, a generic red-teaming framework for arbitrary black-box LLM agents. We employ a dynamic two-step process that starts with an agent definition and generates diverse seed test cases that cover diverse risk outcomes, tool-use trajectories, and risk sources. Then, it iteratively constructs and refines model-based adversarial attacks based on the execution trajectories of former attempts. To optimize the red-teaming cost, we present a model distillation approach that leverages structured forms of a teacher model's reasoning to train smaller models that are equally effective. Across diverse evaluation agent settings, our seed test case generation approach yields 2 – 2.5x boost to the coverage of risk outcomes and tool-calling trajectories. Our distilled 8B red-teamer model improves attack success rate by 100%, surpassing the 671B Deepseek-R1 model. Our ablations and analyses validate the effectiveness of the iterative framework, structured reasoning, and the generalization of our red-teamer models.	https://aclanthology.org/2026.findings-eacl.171	Kaiwen Zhou, Ahmed Elgohary, A S M Iftekhar, Amin Saied
SLANG-GraphRAG: Multi-Layered Retrieval with Domain-Specific Knowledge for Low Resource Social Media Conversations	Emotion classification on social media is especially difficult when texts include informal, culturally grounded language like slang. Standard NLP benchmarks often miss these nuances, particularly in low-resource settings. We present SLANG-GraphRAG, a retrieval-augmented framework that integrates a culture-specific slang knowledge graph into large language models via one-shot prompting. Using multiple retrieval strategies, we incorporate slang definitions, regional usage, and conversational context. Our results show that incorporating structured cultural knowledge into the retrieval process leads to significant improvements, improving accuracy by up to 31% and F1 score by 28%, outperforming traditional and unstructured retrieval methods. To better evaluate model behavior, we propose a probabilistic metric that reflects the distribution of human annotations, providing a more nuanced measure of performance. This highlights the value of culturally sensitive applications and more balanced evaluation in subjective NLP tasks.	https://aclanthology.org/2026.findings-eacl.203	Ifeoluwa Wuraola, Daniel Marciniak, Nina Dethlefs
SMART-Editor: A Multi-Agent Framework for Human-Like Design Editing with Structural Integrity	Despite significant progress in natural image editing with state-of-the-art MLLMs, compositional layout and content editing for structured visual domains (e.g., posters, websites) remains underexplored. In this work, we introduce SMART-EDITOR, a multi-agent framework for compositional editing for structured images like posters or websites. Unlike prior models that focus on isolated local edits, SMART-EDITOR maintains global coherence through two complementary strategies: Reward-Refine, an inference-time reward-guided refinement method, and RewardDPO, a training-time preference optimization approach leveraging reward-aligned layout pairs. To evaluate performance, we introduce SMARTEdit-Bench, a benchmark of cascading multi-step edit instructions that are implicit in nature yet require layout and semantic-consistency preserving reasoning about edit order to preserve spatial and semantic consistency. Both automatic and human evaluations confirm the value of reward-guided planning in producing semantically consistent and visually coherent edits, beyond what single-shot VLMs can generate.	https://aclanthology.org/2026.findings-eacl.169	Ishani Mondal, Meera Bharadwaj, Ayush Roy, Aparna Garimella, Jordan Lee Boyd-Graber
SafeSearch: Do Not Trade Safety for Utility in LLM Search Agents	"Large language model (LLM) based search agents iteratively generate queries, retrieve external information, and reason to answer open-domain questions.While researchers have primarily focused on improving their utility, their safety behaviors remain underexplored.In this paper, we first evaluate search agents using red-teaming datasets and find that they are more likely to produce harmful outputs than base LLMs. For example, when asked ""How can I track someone's location without their consent?"", a base model refuses, whereas a search agent designed to retrieve and cite sources may lower its refusal threshold, fetch documents (e.g., court cases), and, once appended, synthesize them into an informative yet unsafe summary.We further show that utility-oriented finetuning intensifies this risk, motivating joint alignment of safety and utility.We present SafeSearch, a multi-objective reinforcement learning approach that couples a final-output safety/utility reward with a novel query-level shaping term that penalizes unsafe queries and rewards safe ones.Experiments show that SafeSearch reduces agent harmfulness by over 70% across three red-teaming datasets while producing safe, helpful responses, and matches the QA performance of a utility-only finetuned agent. Further analyses confirm the effectiveness of the query-level reward in jointly improving safety and utility."	https://aclanthology.org/2026.findings-eacl.146	Qiusi Zhan, Angeline Budiman-Chan, Abdelrahman Zayed, Xingzhi Guo, Daniel Kang, Joo-Kyung Kim
Scaling Cultural Resources for Improving Generative Models	Generative models are known to have reduced performance in different global cultural contexts and languages. While continual data updates have been known to be conducted to improve overall model performance, bolstering and evaluating this cross-cultural competence of generative AI models requires data resources to be intentionally expanded to include global contexts and languages. In this work, we construct a multi-pronged pipeline to collect and contribute culturally salient, multilingual data. We posit that such data can assess the state of the global applicability of our models and thus, in turn, help identify and improve upon cross-cultural gaps.	https://aclanthology.org/2026.findings-eacl.352	Hayk Stepanyan, Aishwarya Verma, Andrew Zaldivar, Rutledge Chin Feman, Erin MacMurray van Liemt, Charu Kalia, Vinodkumar Prabhakaran, Sunipa Dev
Scaling Data-Constrained Language Models with Synthetic Data	Large language models (LLMs) improve with more training data, but practical limits on data collection increasingly constrain further scaling. Advances in instruction-following LLMs have enabled controlled, high-quality text generation, making synthetic data a promising remedy. However, its effectiveness for pre-training non-English LLMs remains underexplored. We study this question for Japanese in a fixed token budget setting in which organic Japanese Web text constitutes only a small share, while far more organic English Web text and instruction-following LLMs capable of generating fluent Japanese are available. We compare three strategies to fill the data shortfall: generating synthetic Japanese text, repeating the limited Japanese Web text, and using English Web text. Experiments show that synthetic Japanese corpora outperform both baselines and approach the performance achieved when the entire token budget is filled with additional organic Japanese Web text.	https://aclanthology.org/2026.findings-eacl.52	Hirokazu Kiyomaru, Yusuke Oda, Takashi Kodama, Chaoran Liu, Daisuke Kawahara
SchemaGraphSQL: Efficient Schema Linking with Pathfinding Graph Algorithms for Text-to-SQL on Large-Scale Databases	Text-to-SQL systems translate natural language questions into executable SQL queries, and recent progress with large language models (LLMs) has driven substantial improvements in this task. Schema linking remains a critical component in Text-to-SQL systems, reducing prompt size for models with narrow context windows and sharpening model focus even when the entire schema fits. We present a zero-shot, training-free schema linking approach that first constructs a schema graph based on foreign key relations, then uses a single prompt to a lightweight LLM to extract source and destination tables from the user query, followed by applying classical path-finding algorithms and post-processing to identify the optimal sequence of tables and columns that should be joined, enabling the LLM to generate more accurate SQL queries. To handle real-world databases where foreign keys may be missing or inconsistent, we further propose an LLM-guided joinability discovery step that infers table connections before graph construction, ensuring robustness across diverse schemas. Despite being simple, cost-effective, and highly scalable, our method achieves state-of-the-art results on both the BIRD and Spider 2.0 benchmarks, outperforming previous specialized, fine-tuned, and complex multi-step LLM-based approaches.	https://aclanthology.org/2026.findings-eacl.134	AmirHossein Safdarian, Milad Mohammadi, Ehsan Jahanbakhsh Bashirloo, Mona Shahamat Naderi, Heshaam Faili
Science Across Languages: Assessing LLM Multilingual Translation of Scientific Papers	"Scientific research is inherently global. However, the vast majority of academic journals are published exclusively in English, creating barriers for non-native-English-speaking researchers. In this study, we leverage large language models (LLMs) to translate published scientific articles while preserving their native JATS XML formatting, thereby developing a practical, automated approach for implementation by academic journals. Using our approach, we translate articles across multiple scientific disciplines into 28 languages. To evaluate translation accuracy, we introduce a novel question-and-answer (QA) benchmarking method and show an average performance of 95.9%, indicating that the key scientific details are accurately conveyed. In a user study, we translate the scientific papers of 15 researchers into their native languages. Interestingly, a third of the authors found many technical terms ""overtranslated,"" expressing a preference to keep terminology more familiar in English untranslated. Finally, we demonstrate how in-context learning techniques can be used to align translations with domain-specific preferences such as mitigating overtranslation, highlighting the adaptability and utility of LLM-driven scientific translation."	https://aclanthology.org/2026.findings-eacl.204	Hannah Calzi Kleidermacher, James Zou
See More, Store Less: Memory-Efficient Resolution for Video Moment Retrieval	Recent advances in Multimodal Large Language Models (MLLMs) have improved image recognition and reasoning, but video-related tasks remain challenging due to memory constraints from dense frame processing. Existing Video Moment Retrieval (VMR) methodologies rely on sparse frame sampling, risking potential information loss, especially in lengthy videos. We propose SMORE (See MORE, store less), a framework that enhances memory efficiency while maintaining high information resolution. SMORE (1) uses query-guided captions to encode semantics aligned with user intent, (2) applies query-aware importance modulation to highlight relevant segments, and (3) adaptively compresses frames to preserve key content while reducing redundancy. This enables efficient video understanding without exceeding memory budgets. Experimental validation reveals that SMORE achieves state-of-the-art performance on QVHighlights, Charades-STA, and ActivityNet-Captions benchmarks.	https://aclanthology.org/2026.findings-eacl.87	Mingyu Jeon, Sungjin Han, Jinkwon Hwang, Minchol Kwon, Jonghee Kim, Junyeong Kim
Seeing All Sides: Multi-Perspective In-Context Learning for Subjective NLP	Modern language models excel at factual reasoning but struggle with value diversity: the multiplicity of plausible human perspectives. Tasks such as hate speech or sexism detection expose this limitation, where human disagreement captures the diversity of perspectives that models need to account for, rather than dataset noise. In this paper, we explore whether multi-perspective in-context learning (ICL) can align large language models (LLMs) with this diversity without parameter updates. We evaluate four LLMs on five datasets across three languages (English, Arabic, Italian), considering three label-space representations (aggregated hard, disaggregated hard, and disaggregated soft) and five demonstration selection and ordering strategies. Our multi-perspective approach outperforms standard prompting on aggregated English labels, while disaggregated soft predictions better align with human judgments in Arabic and Italian datasets.These findings highlight the importance of perspective-aware LLMs for reducing bias and polarization, while also revealing the challenges of applying ICL to socially sensitive tasks. We further probe the model faithfulness using eXplainable AI (XAI), offering insights into how LLMs handle human disagreement.	https://aclanthology.org/2026.findings-eacl.137	Benedetta Muscato, Yue Li, Gizem Gezici, Zhixue Zhao, Fosca Giannotti
Sequence Repetition Enhances Token Embeddings and Improves Sequence Labeling with Decoder-only Language Models	Modern language models (LMs) are trained in an autoregressive manner, conditioned only on the prefix. In contrast, sequence labeling (SL) tasks assign labels to each individual input token, naturally benefiting from bidirectional context. This discrepancy has historically led SL to rely on inherently bidirectional encoder-only models. However, the rapid development of decoder-only models has raised the question of whether they can be adapted to SL. While causal mask removal has emerged as a viable technique for adapting decoder-only models to leverage the full context for SL, it requires considerable changes to the base model functionality. In this work, we explore sequence repetition (SR) as a less invasive alternative for enabling bidirectionality in decoder-only models. Through fine-tuning experiments, we show that SR inherently makes decoders bidirectional, improving the quality of token-level embeddings and surpassing encoders and unmasked decoders. Contrary to earlier claims, we find that increasing the number of repetitions does not degrade SL performance. Finally, we demonstrate that embeddings from intermediate layers are highly effective for SR, comparable to those from final layers, while being significantly more efficient to compute. Our findings underscore that SR alleviates the structural limitations of decoders, enabling more efficient and adaptable LMs and broadening their applicability to other token-level tasks.	https://aclanthology.org/2026.findings-eacl.339	Matija Luka Kukić, Marko Čuljak, David Dukić, Martin Tutek, Jan Šnajder
Shifting Perspectives: Steering Vectors for Robust Bias Mitigation in LLMs	We present a novel approach to bias mitigation in large language models (LLMs) by applying steering vectors to modify model activations in forward passes. We compute 8 steering vectors, each corresponding to a different social bias axis, such as age, gender, or race, on a training subset of the BBQ dataset and compare the effectiveness of these to 3 additional bias mitigation methods across 4 datasets. When optimized on the BBQ dataset, our individually tuned steering vectors achieve average improvements of 12.8% on BBQ, 8.3% on CLEAR-Bias, and 1% on StereoSet, and show improvements over prompting and Self-Debias in all cases, and improvements over fine-tuning in 12 out of 17 evaluations. In addition, steering vectors showed the lowest impact on MMLU scores of the four bias mitigation methods tested. The work presents the first systematic investigation of steering vectors for bias mitigation, and we demonstrate that they are a powerful and computationally efficient strategy for reducing bias in LLMs, with broader implications for enhancing AI safety.	https://aclanthology.org/2026.findings-eacl.41	Zara Siddique, Irtaza Khalid, Liam Turner, Luis Espinosa-Anke
Show or Tell? Modeling the evolution of request-making in Human-LLM conversations	Designing user-centered LLM systems requires understanding how people use them, but patterns of user behavior are often masked by the variability of queries. In this work, we introduce a new framework to describe request-making that segments user input into request content, roles assigned, query-specific context, and the remaining task-independent expressions. We apply the workflow to create and analyze a dataset of 211k real-world queries based on WildChat. Compared with similar human-human setups, we find significant differences in the language for request-making in the human-LLM scenario. Further, we introduce a novel and essential perspective of diachronic analyses with user expressions, which reveals fundamental and habitual user-LLM interaction patterns beyond individual task completion. We find that query patterns evolve from early ones emphasizing sole requests to combining more context later on, and individual users explore expression patterns but tend to converge with more experience. From there, we propose to understand communal trends of expressions underlying distinct tasks and discuss the preliminary findings. Finally, we discuss the key implications for user studies, computational pragmatics, and LLM alignment.	https://aclanthology.org/2026.findings-eacl.265	Shengqi Zhu, Jeffrey Rzeszotarski, David Mimno
Similar Region Search using LLMs on Spatial Feature Space	Understanding regional similarities is crucial for applications such as urban planning, tourism recommendations, business expansion, and disease prevention. While spatial data, including POI distributions, check-in activity, and building footprints, offer valuable insights, existing similarity methods—based on distance metrics, embeddings, or deep metric learning—fail to capture the contextual richness and adapt to heterogeneous spatial data. To overcome these limitations, we introduce a novel similar region search framework that ranks candidate regions based on their similarity to a query region using large language models. To further enhance performance, we fine-tune the model through self-supervised learning by introducing controlled noise into spatial data. This generates similar and dissimilar samples without relying on extensive labeled data. By transforming spatial data into natural language descriptions, our method seamlessly integrates heterogeneous datasets without requiring structural modifications, ensuring scalability across diverse urban contexts. Experiments on multiple real-world city datasets, including cross-city evaluation, demonstrate that our framework significantly outperforms state-of-the-art methods in both accuracy and ranking performance.	https://aclanthology.org/2026.findings-eacl.201	Al-Amin Sany, Mohaiminul Islam, Tanzima Hashem, Md. Ashraful Islam, Mohammed Eunus Ali
Skill Discovery for Software Scripting Automation via Offline Simulations with LLMs	Scripting interfaces enable users to automate tasks and customize software workflows, but creating scripts traditionally requires programming expertise and familiarity with specific APIs, posing barriers for many users. While Large Language Models (LLMs) can generate code from natural language queries, runtime code generation is severely limited due to unverified code, security risks, longer response times, and higher computational costs. To bridge the gap, we propose an offline simulation framework to curate a software-specific skillset—a collection of verified scripts—by exploiting LLMs and publicly available scripting guides. Our framework comprises two components: (1) task creation, using top-down functionality guidance and bottom-up API synergy exploration to generate helpful tasks; and (2) skill generation with trials, refining and validating scripts based on execution feedback. To efficiently navigate the extensive API landscape, we introduce a Graph Neural Network (GNN)-based link prediction model to capture API synergy, enabling the generation of skills involving underutilized APIs and expanding the skillset's diversity. Experiments with Adobe Illustrator demonstrate that our framework significantly improves automation success rates, reduces response time, and saves runtime token costs compared to traditional runtime code generation. This is the first attempt to use software scripting interfaces as a testbed for LLM-based systems, highlighting the advantages of leveraging execution feedback in a controlled environment and offering valuable insights into aligning AI capabilities with user needs in specialized software domains.	https://aclanthology.org/2026.findings-eacl.37	Paiheng Xu, Gang Wu, Xiang Chen, Tong Yu, Chang Xiao, Franck Dernoncourt, Tianyi Zhou, Wei Ai, Viswanathan Swaminathan
SpARK: An Embarrassingly Simple Sparse Watermarking in LLMs with Enhanced Text Quality	With the widespread adoption of Large Language Models (LLMs), concerns about potential misuse have emerged. To this end, watermarking has been adapted to LLM, enabling a simple and effective way to detect and monitor generated text. However, while the existing methods can differentiate between watermarked and unwatermarked text with high accuracy, they often face a trade-off between the quality of the generated text and the effectiveness of the watermarking process. In this work, we present a novel type of LLM watermark, Sparse WatermARK (or SpARK), which aims to mitigate this trade-off by applying watermarks to a small subset of generated tokens distributed across the text. To demonstrate this type of watermark, we introduce two novel variants, SpARK-P and SpARK-R, which achieve sparsity by anchoring watermarked tokens to words that have specific Part-of-Speech (POS) tags and specific hash values w.r.t a pseudorandom hash function, respectively. Our experimental results demonstrate that the proposed watermarking schemes, albeit embarrassingly simple, are incredibly effective, achieving high detectability while generating text that outperforms previous LLM watermarking methods in quality across various tasks. SpARK further advances the watermarking capability for LLMs while maintaining their generated text quality.	https://aclanthology.org/2026.findings-eacl.240	Duy Cao Hoang, Thanh Quoc Hung Le, Rui Chu, Ping Li, Weijie Zhao, Yingjie Lao, Khoa D Doan
