title	abstract	url	authors
MemeWeaver: Inter-Meme Graph Reasoning for Sexism and Misogyny Detection	Women are twice as likely as men to face online harassment due to their gender. Despite recent advances in multimodal content moderation, most approaches still overlook the social dynamics behind this phenomenon, where perpetrators reinforce prejudices and group identity within like-minded communities. Graph-based methods offer a promising way to capture such interactions, yet existing solutions remain limited by heuristic graph construction, shallow modality fusion, and instance-level reasoning. In this work, we present MemeWeaver, an end-to-end trainable multimodal framework for detecting sexism and misogyny through a novel inter-meme graph reasoning mechanism. We systematically evaluate multiple visual-textual fusion strategies and show that our approach consistently outperforms state-of-the-art baselines on the MAMI and EXIST benchmarks, while achieving faster training convergence. Further analyses reveal that the learned graph structure captures semantically meaningful patterns, offering valuable insights into the relational nature of online hate.	https://aclanthology.org/2026.findings-eacl.111	Paolo Italiani, David Gimeno-Gómez, Luca Ragazzi, Gianluca Moro, Paolo Rosso
Mitigating Causal Bias in LLMs via Potential Outcomes Framework and Actual Causality Theory	Event Causality Identification (ECI) aims to identify causal relationships between events, which is essential for root cause analysis. While recent studies reveal that Large Language Models (LLMs) exhibit significant causal hallucination, a systematic evaluation of their document-level ECI performance across varied structural characteristics and a corresponding dataset is currently lacking. To fill this gap, we first construct a structure-controlled dataset to comprehensively assess their document-level ECI performance across texts with various structural characteristics that influence the causal behaviors in ECI. We find that different LLMs exhibit divergent causal bias across texts with varied structures, ranging from consistent hallucination or neglect to structure-dependent shifts between the two. To mitigate the bias, furthermore, we formulate ECI as a causal inference problem and propose a causality identification framework grounded in the potential outcomes and the Halpern–Pearl (HP) definition of actual causality theory. Experimental results demonstrate that our framework significantly reduces the causal bias associated with directly using LLMs on ECI, while also achieving superior performance.	https://aclanthology.org/2026.findings-eacl.220	Yiheng Zhao, Yuanliang Li, Shreya Savant, Jun Yan
Mitigating Copy Bias in In-Context Learning through Neuron Pruning	Large language models (LLMs) have demonstrated impressive few-shot in-context learning (ICL) abilities. Still, we show that they are sometimes prone to a 'copying bias', where they copy answers from provided examples instead of learning the underlying patterns. In this work, we propose a novel and simple method to mitigate such copying bias. First, we create a synthetic task and use the Integrated Gradients method to identify neurons that prioritize copying over generalization. We demonstrate that pruning these neurons consistently improves performance across a diverse set of ICL tasks, including both single-token and multi-token scenarios, while maintaining or even improving the model's general capabilities. We also show that our method is applicable across various LLM architectures, including Transformers and State-Space Models, without requiring modifications. In our analysis, we adopt a task-recognition perspective on ICL and examine task vectors (Hendel et al., 2023) induced by the model. We find that pruning enhances the quality of these vectors, suggesting that the pruned neurons previously hindered effective task recognition.	https://aclanthology.org/2026.findings-eacl.13	Ameen Ali Ali, Lior Wolf, Ivan Titov
Modeling Turn-Taking with Semantically Informed Gestures	In conversation, humans use multimodal cues, such as speech, gestures, and gaze, to manage turn-taking. While linguistic and acoustic features are informative, gestures provide complementary cues for modeling these transitions. To study this, we introduce DnD Gesture++, an extension of the multi-party DnD Gesture corpus enriched with 2,663 semantic gesture annotations spanning iconic, metaphoric, deictic, and discourse types. Using this dataset, we model turn-taking prediction through a Mixture-of-Experts framework integrating text, audio, and gestures. Experiments show that incorporating semantically guided gestures yields consistent performance gains over baselines, demonstrating their complementary role in multimodal turn-taking.	https://aclanthology.org/2026.findings-eacl.106	Varsha Suresh, M. Hamza Mughal, Christian Theobalt, Vera Demberg
Multi-Agent Procedural Graph Extraction with Structural and Logical Refinement	Automatically extracting workflows as procedural graphs from natural language is a promising yet underexplored task that requires ensuring both structural validity and logical alignment. Recent advances in large language models (LLMs) show potential for graph extraction, but often yield ill-formed structures or misinterpret logical constructs such as gateways. We introduce , a multi-agent framework that treats procedural graph extraction as a multi-round reasoning process with structural and logical refinement agents. The framework operates in three iterative stages: (1) an LLM-based graph extraction phase, (2) a structural feedback phase where a simulation agent diagnoses and explains structural issues, and (3) a logical feedback phase where a semantic agent aligns semantics between flow logic and linguistic cues in the source text. Important feedback is prioritized and expressed in natural language, which is injected into the next-round prompt, enabling interpretable and controllable refinement. This modular design allows agents to target distinct error types without supervision or parameter updates. Experiments demonstrate that achieves substantial improvements in both structural correctness and logical consistency over strong baselines.	https://aclanthology.org/2026.findings-eacl.158	Wangyang Ying, Yanchi Liu, Xujiang Zhao, Wei Cheng, Zhengzhang Chen, Wenchao Yu, Yanjie Fu, Haifeng Chen
Multi-Hall-SA: A Cross-lingual Benchmark for Multi-Type Hallucination Detection in Low-Resource South African Languages	Hallucinations generated by Large Language Models (LLMs) pose significant challenges for their application to low-resource languages. We present Multi-Hall-SA, a cross-lingual benchmark for hallucination detection spanning English and four low-resource South African languages: isiZulu, isiXhosa, Sepedi, and Sesotho. Derived from government texts, this benchmark categorizes hallucinations into four types aligned with established taxonomies of factual errors: temporal shifts, entity errors, numerical inaccuracies, and location mistakes. Human validation confirms the quality and cross-lingual alignment of our synthetically generated hallucinations. Our cross-lingual alignment methodology enables direct performance comparison between high-resource and low-resource languages, revealing notable gaps in detection capabilities. Evaluation across four state-of-the-art models shows they detect up to 23.6% fewer hallucinations in South African languages compared to English. Knowledge augmentation reduces this disparity, decreasing cross-lingual performance gaps by 59.4% on average. Beyond introducing a validated resource for low-resource languages, Multi-Hall-SA provides a framework for evaluating and improving factual reliability across linguistic boundaries, advancing more inclusive and equitable AI development.	https://aclanthology.org/2026.findings-eacl.330	Sello Ralethe, Jan Buys
MultiCW: A Large-Scale Balanced Benchmark Dataset for Training Robust Check-Worthiness Detection Models	Large language models (LLMs) are beginning to reshape how media professionals verify information, yet automated support for detecting check-worthy claims—a key step in the fact-checking process—remains limited. We introduce the Multi-Check-Worthy (MultiCW) dataset, a balanced multilingual benchmark for check-worthy claim detection spanning 16 languages, six topical domains, and two writing styles. It consists of 123,722 samples, evenly distributed between noisy (informal) and structured (formal) texts, with balanced representation of check-worthy and non-check-worthy classes across all languages. To probe robustness, we also introduce an equally balanced out-of-distribution evaluation set of 27,761 samples in 4 additional languages. To provide baselines, we benchmark three common fine-tuned multilingual transformers against a diverse set of 15 commercial and open LLMs under zero-shot settings. Our findings show that fine-tuned models consistently outperform zero-shot LLMs on claim classification and show strong out-of-distribution generalization across languages, domains, and styles. MultiCW provides a rigorous multilingual resource for advancing automated fact-checking and enables systematic comparisons between fine-tuned models and cutting-edge LLMs on the check-worthy claim detection task.	https://aclanthology.org/2026.findings-eacl.194	Martin Hyben, Sebastian Kula, Jan Cegin, Jakub Simko, Ivan Srba, Robert Moro
Multilingual Retrieval-Augmented Generation for Knowledge-Intensive Question Answering Task	Retrieval-augmented generation (RAG) has become a cornerstone of contemporary NLP, enhancing large language models (LLMs) by allowing them to access richer factual contexts through in-context retrieval. While effective in monolingual settings, especially in English, its use in multilingual tasks remains unexplored. This paper investigates the effectiveness of RAG across multiple languages by proposing novel approaches for multilingual open-domain question-answering. We evaluate the performance of various multilingual RAG strategies, including question-translation (tRAG), which translates questions into English before retrieval, and Multilingual RAG (MultiRAG), where retrieval occurs directly across multiple languages. Our findings reveal that tRAG, while useful, suffers from limited coverage. In contrast, MultiRAG improves efficiency by enabling multilingual retrieval but introduces inconsistencies due to cross-lingual variations in the retrieved content. To address these issues, we propose Crosslingual RAG (CrossRAG), a method that translates retrieved documents into a common language (e.g., English) before generating the response. Our experiments show that CrossRAG significantly enhances performance on knowledge-intensive tasks, benefiting both high-resource and low-resource languages	https://aclanthology.org/2026.findings-eacl.35	Leonardo Ranaldi
Multilingual Self-Taught Faithfulness Evaluators	The growing use of large language models (LLMs) has increased the need for automatic evaluation systems, particularly to address the challenge of information hallucination. Although existing faithfulness evaluation approaches have shown promise, they are predominantly English-focused and often require expensive human-labeled training data for fine-tuning specialized models. As LLMs see increased adoption in multilingual contexts, there is a need for accurate faithfulness evaluators that can operate across languages without extensive labeled data. This paper presents STEMF (Self-Taught Evaluators for Multilingual Faithfulness), a framework that learns exclusively from synthetic multilingual data while leveraging cross-lingual transfer learning. Through experiments comparing language-specific and mixed-language fine-tuning approaches, we demonstrate a consistent relationship between an LLM's general language capabilities and its performance in language-specific evaluation tasks. Our framework shows improvements over existing baselines, including state-of-the-art English evaluators and machine translation-based approaches.	https://aclanthology.org/2026.findings-eacl.266	Carlo Alfano, Aymen Al Marjani, Zeno Jonke, Amin Mantrach, Saab Mansour, Marcello Federico
Multilingual-To-Multimodal (M2M): Unlocking New Languages with Monolingual Text	Multimodal models excel in English, supported by abundant image-text and audio-text data, but performance drops sharply for other languages due to limited multilingual multimodal resources. Existing solutions rely on machine translation, while advances in multilingual text modeling remain underutilized. We introduce M2M, a lightweight alignment method that learns only a few linear layers–using English text alone–to map multilingual text embeddings into multimodal space. Despite its simplicity, M2M matches baseline performance in English (94.9% Recall@10) and achieves strong zero-shot transfer (89.5% Recall@10 averaged across 11 languages, 10 unseen) on XTD Text-to-Image retrieval. Qualitative t-SNE visualizations show that multilingual embeddings align tightly with multimodal representations, while weight analysis reveals that the transformation reshapes embedding geometry rather than performing trivial rotations. Beyond image-text retrieval, M2M demonstrates robustness across datasets and tasks, extending to Audio-Text retrieval and Text-to-Image generation. We release [code and checkpoints](https://github.com/piyushsinghpasi/M2M) along with multilingual evaluation datasets: [MSCOCO Multilingual 30K](https://huggingface.co/datasets/piyushsinghpasi/mscoco-multilingual-30k), [AudioCaps Multilingual](https://huggingface.co/datasets/piyushsinghpasi/audiocaps-multilingual), and [Clotho Multilingual](https://huggingface.co/datasets/piyushsinghpasi/clotho-multilingual).	https://aclanthology.org/2026.findings-eacl.143	Piyush Singh Pasi
NL2Logic: AST-Guided Translation of Natural Language into First-Order Logic with Large Language Models	Automated reasoning is critical in domains such as law and governance, where verifying claims against facts in documents requires both accuracy and interpretability.Recent work has adopted a structured reasoning paradigm that parses first-order logic (FOL) rules from natural language and delegates inference to automated solvers.With the rise of large language models (LLMs), methods such as GCD and CODE4LOGIC leverage their reasoning and code generation capabilities to enhance logic parsing.However, these approaches suffer from (1) fragile syntax control, due to weak enforcement of global grammar consistency, and (2) low semantic faithfulness, as they lack fine-grained clause-level semantic understanding.To address these challenges, we propose , a FOL translation framework that uses an AST as an intermediate layer, combining a recursive LLM-based semantic parser with an AST-guided generator that deterministically produces solver-ready code.On the FOLIO, LogicNLI, and ProofWriter benchmarks, attains 99% syntactic accuracy and improves semantic correctness by 30% over state-of-the-art baselines.Moreover, integrating into Logic-LM yields near-perfect executability and improves downstream reasoning accuracy by ~31% over Logic-LM's original few-shot unconstrained FOL translation module.	https://aclanthology.org/2026.findings-eacl.317	Rizky Ramadhana Putra, Raihan Sultan Pasha Basuki, Yutong Cheng, Peng Gao
NLP Privacy Risk Identification in Social Media (NLP-PRISM): A Survey	Natural Language Processing (NLP) is integral to social media analytics but often processes content containing Personally Identifiable Information (PII), behavioral cues, and metadata raising privacy risks such as surveillance, profiling, and targeted advertising. To systematically assess these risks, we review 203 peer-reviewed papers and propose the NLP Privacy Risk Identification in Social Media (NLP-PRISM) framework, which evaluates vulnerabilities across six dimensions: data collection, preprocessing, visibility, fairness, computational risk, and regulatory compliance. Our analysis shows that transformer models achieve F1-scores ranging from 0.58–0.84, but incur a 1% - 23% drop under privacy-preserving fine-tuning. Using NLP-PRISM, we examine privacy coverage in six NLP tasks: sentiment analysis (16), emotion detection (14), offensive language identification (19), code-mixed processing (39), native language identification (29), and dialect detection (24) revealing substantial gaps in privacy research. We further found a (↓ 2%-9% ) trade-off in model utility, MIA AUC (membership inference attacks) 0.81, AIA accuracy 0.75 (attribute inference attacks). Finally, we advocate for stronger anonymization, privacy-aware learning, and fairness-driven training to enable ethical NLP in social media contexts.	https://aclanthology.org/2026.findings-eacl.78	Dhiman Goswami, Jai Kruthunz Naveen Kumar, Sanchari Das
Negative Sampling Techniques in Dense Retrieval: A Survey	Information Retrieval (IR) is fundamental to many modern NLP applications. The rise of dense retrieval (DR), using neural networks to learn semantic vector representations, has significantly advanced IR performance. Central to training effective dense retrievers through contrastive learning is the selection of informative negative samples. Synthesizing 35 seminal papers, this survey provides a comprehensive and up-to-date overview of negative sampling techniques in dense IR. Our unique contribution is the focus on modern NLP applications and the inclusion of recent Large Language Model (LLM)-driven methods, an area absent in prior reviews. We propose a taxonomy that categorizes techniques, including random, static/dynamically mined, and synthetic datasets. We then analyze these approaches with respect to trade-offs between effectiveness, computational cost, and implementation difficulty. The survey concludes by outlining current challenges and promising future directions for the use of LLM-generated synthetic data.	https://aclanthology.org/2026.findings-eacl.157	Laurin Wischounig, Abdelrahman Abdallah, Adam Jatowt
Negative-Aware Diffusion Process for Temporal Knowledge Graph Extrapolation	Temporal Knowledge Graph (TKG) reasoning seeks to predict future missing facts from historical evidence. While diffusion models (DM) have recently gained attention for their ability to capture complex predictive distributions, two gaps remain: (i) the generative path is conditioned only on positive evidence, overlooking informative negative context, and (ii) training objectives are dominated by cross-entropy ranking, which improves candidate ordering but provides little supervision over the calibration of the denoised embedding. To bridge this gap, we introduce **N**egative-**A**ware **D**iffusion model for TKG **Ex**trapolation (**NADEx**). Specifically, NADEx encodes subject-centric histories of entities, relations and temporal intervals into sequential embeddings. NADEx perturbs the query object in the forward process and reconstructs it in reverse with a Transformer denoiser conditioned on the temporal-relational context. We further derive a cosine-alignment regularizer derived from batch-wise negative prototypes, which tightens the decision boundary against implausible candidates. Comprehensive experiments on four public TKG benchmarks demonstrate that NADEx delivers state-of-the-art performance.	https://aclanthology.org/2026.findings-eacl.175	Yanglei Gan, Peng He, Yuxiang Cai, Run Lin, Guanyu Zhou, Qiao Liu
Neural network embeddings recover value dimensions from psychometric survey items on par with human data	"We demonstrate that embeddings derived from large language models, when processed with ""Survey and Questionnaire Item Embeddings Differentials"" (SQuID), can recover the structure of human values obtained from human rater judgments on the Revised Portrait Value Questionnaire (PVQ-RR). We compare multiple embedding models across a number of evaluation metrics including internal consistency, dimension correlations and multidimensional scaling configurations. Unlike previous approaches, SQuID addresses the challenge of obtaining negative correlations between dimensions without requiring domain-specific fine-tuning or training data re-annotation. Quantitative analysis reveals that our embedding-based approach explains 55% of variance in dimension-dimension similarities compared to human data. Multidimensional scaling configurations show alignment with pooled human data from 49 different countries. Generalizability tests across three personality inventories (IPIP, BFI-2, HEXACO) demonstrate that SQuID consistently increases correlation ranges, suggesting applicability beyond value theory. These results show that semantic embeddings can effectively replicate psychometric structures previously established through extensive human surveys. The approach offers substantial advantages in cost, scalability and flexibility while maintaining comparable quality to traditional methods. Our findings have significant implications for psychometrics and social science research, providing a complementary methodology that could expand the scope of human behavior and experience represented in measurement tools."	https://aclanthology.org/2026.findings-eacl.303	Max Pellert, Clemens M Lechner, Indira Sen, Markus Strohmaier
Nuanced Toxicity Detection in Spanish: A New Corpus and Benchmark Study	The rise of toxic content on digital platforms has intensified the demand for automatic moderation tools. While English has benefited from large-scale annotated corpora, Spanish remains under-resourced, particularly for nuanced cases of toxicity such as irony, sarcasm, or indirect aggression. We present an extended version of the NECOS-TOX corpus, comprising 4,011 Spanish comments collected from 16 major news outlets. Each comment is annotated across three levels of toxicity (Non-Toxic, Slightly Toxic, and Toxic), following an iterative annotation protocol that achieved substantial inter-annotator agreement (k = 0.74). To reduce annotation costs while maintaining quality, we employed a human-in-the-loop active learning strategy, with manual correction of model pre-labels. We benchmarked the dataset with traditional machine learning (ML) methods, domain-specific transformers, and instruction-tuned large language models (LLMs). Results show that compact encoder models (e.g., RoBERTa-base-bne, 125M parameters) perform on par with much larger models (e.g., LLaMA-3.1-8B), underscoring the value of in-domain adaptation over raw scale. Our error analysis highlights persistent challenges in distinguishing subtle forms of toxicity, especially sarcasm and implicit insults, and reveals entity-related biases that motivate anonymization strategies. The dataset and trained models are released publicly.	https://aclanthology.org/2026.findings-eacl.100	Alba María Mármol-Romero, Robiert Sepúlveda-Torres, Estela Saquete, María-Teresa Martín-Valdivia, L. Alfonso Ureña
ORSO QGen: Odds-Ratio Steerable Optimization for Controlling Question Generation	Question generation plays an important role in educational applications, enabling automated assessment and reading comprehension support. Attribute-controlled question generation aims to produce questions that fit predefined characteristics such as difficulty, focus, or coverage. Existing methods predominantly rely on supervised fine-tuning, which often fails to impose a strong adherence to attribute values, resulting in weak coupling between prompt specifications and model outputs. We introduce Odds-Ratio Steerable Optimization (ORSO), a framework designed to enhance attribute sensitivity in question generation models. Building upon preference-based learning techniques without requiring human-curated preference sets, ORSO employs input-level perturbations to create contrastive training signals. Empirical evaluations on both exhaustive and expert-validated attribute configurations indicate that ORSO performs better in enforcing attribute conformity while maintaining output quality. These results argue for the benefits of explicit attribute-aware optimization in controllable question generation tasks.	https://aclanthology.org/2026.findings-eacl.277	Andreea Dutulescu, Stefan Ruseti, Mihai Dascalu, Danielle S McNamara
On the Interplay between Human Label Variation and Model Fairness	The impact of human label variation (HLV) on model fairness is an unexplored topic. This paper examines the interplay by comparing training on majority-vote labels with a range of HLV methods. Our experiments show that without explicit debiasing, HLV training methods have a positive impact on fairness under certain configurations.	https://aclanthology.org/2026.findings-eacl.50	Kemal Kurniawan, Meladel Mistica, Timothy Baldwin, Jey Han Lau
One Sentence, Two Embeddings: Contrastive Learning of Explicit and Implicit Semantic Representations	Sentence embedding methods have made remarkable progress, yet they still struggle to capture the implicit semantics within sentences. This can be attributed to the inherent limitations of conventional sentence embedding methods that assign only a single vector per sentence. To overcome this limitation, we propose DualCSE, a sentence embedding method that assigns two embeddings to each sentence: one representing the explicit semantics and the other representing the implicit semantics. These embeddings coexist in the shared space, enabling the selection of the desired semantics for specific purposes such as information retrieval and text classification. Experimental results demonstrate that DualCSE can effectively encode both explicit and implicit meanings and improve the performance of the downstream task.	https://aclanthology.org/2026.findings-eacl.74	Kohei Oda, Po-Min Chuang, Kiyoaki Shirai, Natthawut Kertkeidkachorn
