title	abstract	url	authors
A Comprehensive Evaluation of Multilingual Chain-of-Thought Reasoning: Performance, Consistency, and Faithfulness Across Languages	Large reasoning models (LRMs) increasingly rely on step-by-step Chain-of-Thought (CoT) reasoning to improve task performance, particularly in high-resource languages such as English. While recent work has examined final-answer accuracy in multilingual settings, the thinking traces themselves, i.e., the intermediate steps that lead to the final answer, remain underexplored. In this paper, we present a comprehensive study of multilingual CoT reasoning, evaluating three key dimensions: performance, consistency, and faithfulness. We begin by measuring language compliance, answer accuracy, and answer consistency when LRMs are explicitly instructed or prompt-hacked to think in a target language, revealing strong language preferences and divergent performance across languages. Next, we assess crosslingual consistency of thinking traces by interchanging them between languages. We find that the quality and effectiveness of thinking traces vary substantially depending on the prompt language. Finally, we adapt perturbation-based techniques – i.e., truncation and error injection – to probe the faithfulness of thinking traces across languages, showing that models rely on traces to varying degrees. We release our code and data to support future research.	https://aclanthology.org/2026.findings-eacl.276	Raoyuan Zhao, Yihong Liu, Hinrich Schuetze, Michael A. Hedderich
A Domain-Specific Curated Benchmark for Entity and Document-Level Relation Extraction	Information Extraction (IE), encompassing Named Entity Recognition (NER), Named Entity Linking (NEL), and Relation Extraction (RE), is critical for transforming the rapidly growing volume of scientific publications into structured, actionable knowledge. This need is especially evident in fast-evolving biomedical fields such as the gut-brain axis, where research investigates complex interactions between the gut microbiota and brain-related disorders. Existing biomedical IE benchmarks, however, are often narrow in scope and rely heavily on distantly supervised or automatically generated annotations, limiting their utility for advancing robust IE methods. We introduce GutBrainIE, a benchmark based on more than 1,600 PubMed abstracts, manually annotated by biomedical and terminological experts with fine-grained entities, concept-level links, and relations. While grounded in the gut-brain axis, the benchmark's rich schema, multiple tasks, and combination of highly curated and weakly supervised data make it broadly applicable to the development and evaluation of biomedical IE systems across domains.	https://aclanthology.org/2026.findings-eacl.301	Marco Martinelli, Stefano Marchesin, Vanessa Bonato, Giorgio Di Nunzio, Nicola Ferro, Ornella Irrera, Laura Menotti, Federica Vezzani, Gianmaria Silvello
A Multi-Task Learning Framework for Modeling Engagement and Topic-Sensitive Responses in Arabic Women's Discourse	Predicting how audiences react to Arabic social media posts requires reasoning beyond textual sentiment: reactions emerge from collective interpretation moderated by engagement dynamics and topical context. We present a multi-task learning (MTL) framework that jointly learns (i) audience reaction classification (Love, Haha, Angry, Sad, Care, Wow), (ii) engagement magnitude regression (six reactions, comments, shares), and (iii) non-engagement detection. On a corpus of 158k Arabic Facebook posts spanning women's rights, gender debates, and economic empowerment, our model achieves a test macro-F1 of 72.4 and weighted-F1 of 89.1.	https://aclanthology.org/2026.findings-eacl.253	Mabrouka Bessghaier, Md. Rafiul Biswas, Shimaa Ibrahim, Wajdi Zaghouani
A Scalable Framework for Automated NER Annotation Correction in Low-Resource Languages	Poor quality or noisy annotations in Named Entity Recognition (NER), as in any other NLP task, make it challenging to achieve state-of-the-art performance. In this paper, we present a multi-step framework to enhance the annotation quality of NER datasets by employing automated techniques. We propose a frequency-based iterative approach that leverages self-training and a dual-threshold mechanism to enhance inference confidence. Experimental evaluations on different NER datasets demonstrate significant improvements in NER performance with respect to the original datasets. This work further explores the potential of generative Large Language Models (LLMs) to perform NER for low-resource languages.	https://aclanthology.org/2026.findings-eacl.215	Toqeer Ehsan, Thamar Solorio
A Simple and Efficient Learning-Style Prompting for LLM Jailbreaking	This study reveals a critical safety blind spot in modern LLMs: learning-style queries, which closely resemble ordinary educational questions, can reliably elicit harmful responses.The learning-style queries are constructed by a novel reframing paradigm: HILL (Hiding Intention by Learning from LLMs). The deterministic, model-agnostic reframing framework is composed of 4 conceptual components: 1) key concept, 2) exploratory transformation, 3) detail-oriented inquiry, and optionally 4) hypotheticality.Further, new metrics are introduced to thoroughly evaluate the efficiency and harmfulness of jailbreak methods.Experiments on the AdvBench dataset across a wide range of models demonstrate HILL's strong generalizability. It achieves top attack success rates on the majority of models and across malicious categories while maintaining high efficiency with concise prompts. On the other hand, results of various defense methods show the robustness of HILL, with most defenses having mediocre effects or even increasing the attack success rates. In addition, the assessment of defenses on the constructed safe prompts reveals inherent limitations of LLMs' safety mechanisms and flaws in the defense methods. This work exposes significant vulnerabilities of safety measures against learning-style elicitation, highlighting a critical challenge of fulfilling both helpfulness and safety alignments.	https://aclanthology.org/2026.findings-eacl.124	Xuan Luo, Yue Wang, Zefeng He, Geng Tu, Jing Li, Ruifeng Xu
AGIC: Attention-Guided Image Captioning to Improve Caption Relevance	Despite significant progress in image captioning, generating accurate and descriptive captions remains a long-standing challenge. In this study, we propose Attention-Guided Image Captioning (AGIC), which amplifies salient visual regions directly in the feature space to guide caption generation. We further introduce a hybrid decoding strategy that combines deterministic and probabilistic sampling to balance fluency and diversity. To evaluate AGIC, we conduct extensive experiments on the Flickr8k, Flickr30k and MSCOCO datasets. The results show that AGIC matches or surpasses several state-of-the-art models while achieving faster inference. Moreover, AGIC demonstrates strong performance across multiple evaluation metrics, offering a scalable and interpretable solution for image captioning.	https://aclanthology.org/2026.findings-eacl.342	L D M S Sai Teja, Ashok Urlana, Pruthwik Mishra
ART: Adaptive Reasoning Trees for Explainable Claim Verification	Large Language Models (LLMs) are powerful candidates for complex decision-making, leveraging vast encoded knowledge and remarkable zero-shot abilities. However, their adoption in high-stakes environments is hindered by their opacity; their outputs lack faithful explanations and cannot be effectively contested to correct errors, undermining trustworthiness. In this paper, we propose ART (Adaptive Reasoning Trees), a hierarchical method for claim verification. The process begins with a root claim, which branches into supporting and attacking child arguments. An argument's strength is determined bottom-up via a pairwise tournament of its children, adjudicated by a judge LLM, allowing a final, transparent and contestable verdict to be systematically derived which is missing in methods like Chain-of-Thought (CoT). We empirically validate ART on multiple datasets, analyzing different argument generators and comparison strategies. Our findings show that ART's structured reasoning outperforms strong baselines, establishing a new benchmark for explainable claim verification which is more reliable and ensures clarity in the overall decision making step.	https://aclanthology.org/2026.findings-eacl.28	Sahil Wadhwa, Himanshu Kumar, Guanqun Yang, Abbaas Alif Mohamed Nishar, Pranab Mohanty, Swapnil Shinde, Yue Wu
ART: Attention-Regularized Transformers for Multi-Modal Robustness	Transformers have become the standard in Natural Language Processing (NLP) and Computer Vision (CV) due to their strong performance, yet they remain highly sensitive to small input changes, often referred to as adversarial attacks, such as synonym swaps in text or pixel-level perturbations in images. These adversarial attacks can mislead predictions, while existing defenses are often domain-specific or lack formal robustness guarantees. We propose the Attention-Regularized Transformer (ART), a framework that enhances robustness across modalities. ART builds on the Attention Sensitivity Tensor (AST), which quantifies the effect of input perturbations on attention outputs. By incorporating an AST-based regularizer into training, ART encourages stable attention maps under adversarial perturbations in both text and image tasks. We evaluate ART on IMDB, QNLI, CIFAR-10, CIFAR-100, and Imagenette. Results show consistent robustness gains over strong baselines such as FreeLB and DSRM: up to +36.9% robust accuracy on IMDB and QNLI, and +5 –25% on image benchmarks across multiple Vision Transformer (ViT) architectures, while maintaining or improving clean accuracy. ART is also highly efficient, training over 10× faster than adversarial methods on text and requiring only 1.25× the cost of standard training on images, compared to 1.5–5.5× for recent robust ViTs. Codes are available at [https://github.com/cliclab-um6p/ART](https://github.com/cliclab-um6p/ART)	https://aclanthology.org/2026.findings-eacl.292	Mohammed Bouri, Mohammed Erradi, Adnane Saoud
ATOM: AdapTive and OptiMized dynamic temporal knowledge graph construction using LLMs	"In today's rapidly expanding data landscape, knowledge extraction from unstructured text is vital for real-time analytics, temporal inference, and dynamic memory frameworks. However, traditional static knowledge graph (KG) construction often overlooks the dynamic and time-sensitive nature of real-world data, limiting adaptability to continuous changes. Moreover, recent zero- or few-shot approaches that avoid domain-specific fine-tuning or reliance on prebuilt ontologies often suffer from instability across multiple runs, as well as incomplete coverage of key facts. To address these challenges, we introduce ATOM (AdapTive and OptiMized), a few-shot and scalable approach that builds and continuously updates Temporal Knowledge Graphs (TKGs) from unstructured texts. ATOM splits input documents into minimal, self-contained ""atomic"" facts, improving extraction exhaustivity and stability. Then, it constructs atomic TKGs from these facts, employing a dual-time modeling that distinguishes between when information is observed and when it is valid. The resulting atomic TKGs are subsequently merged in parallel. Empirical evaluations demonstrate that ATOM achieves 18% higher exhaustivity, 33% better stability, and over 90% latency reduction compared to baseline methods, demonstrating a strong scalability potential for dynamic TKG construction."	https://aclanthology.org/2026.findings-eacl.49	Yassir Lairgi, Ludovic Moncla, Khalid Benabdeslem, Rémy Cazabet, Pierre Cléau
Active Learning with Non-Uniform Costs for African Natural Language Processing	Labeling datasets for African languages poses substantial challenges due to the diverse settings in which annotations are collected, leading to highly variable labeling costs. These costs vary with task complexity, annotator expertise, and data availability. Yet, most active learning (AL) frameworks assume uniform annotation costs, limiting their applicability in real-world, resource-constrained scenarios. To address this, we introduce KnapsackBALD, a novel cost-aware active learning method that integrates the BatchBALD acquisition strategy with a 0-1 Knapsack optimization objective to select informative and budget-efficient samples. We evaluate KnapsackBALD on the MasakhaNEWS dataset, a multilingual news classification benchmark covering 11 African languages. Our method consistently outperforms seven strong active learning baselines, including BALD, BatchBALD, and stochastic sampling variants such as PowerBALD and Softmax-BALD, across all three cost scenarios. The performance gap widens as annotation cost imbalances become more extreme, demonstrating the robustness of KnapsackBALD in different cost settings. These findings show that when annotation costs are explicitly heterogeneous, cost-sensitive acquisition is critical for effective active learning, as demonstrated in African Languages NLP and similar settings. Our code base is open-sourced here.	https://aclanthology.org/2026.findings-eacl.349	Bonaventure F. P. Dossou, Ines Arous, Audrey Durand, Jackie Chi Kit Cheung
Actors, Frames and Arguments: A Multi-Decade Computational Analysis of Climate Discourse in Financial News using Large Language Models	We curate a 980,061-article corpus of climate-related financial news from the Dow Jones Newswire (2000–2023) and introduce a three-stage Actor–Frame–Argument (AFA) pipeline that uses large language models to extract actors, stances, frames, and argumentative structures. We conduct AFA extraction on a stratified, uncertainty-enriched sample of 4,143 articles that preserves the temporal and thematic distributions of the full corpus. Reliability is established with a 2,000-article human-annotated gold standard and a Decompositional Verification Framework (DVF) that decomposes evaluation into completeness, faithfulness, coherence, and relevance, with multi-judge scoring calibrated against human ratings. Our longitudinal analysis uncovers a structural shift after 2015: coverage transitions from risk and regulatory-burden frames toward economic opportunity and technological innovation; financial institutions and companies increasingly deploy opportunity-centered arguments, while NGOs emphasize environmental urgency and governments stress compliance. Methodologically, we provide a replicable paradigm for longitudinal media analysis with LLMs. For high-stake domain insights, we map how the financial sector has internalized and reframed the climate crisis across two decades.	https://aclanthology.org/2026.findings-eacl.104	Ruiran Su, Markus Leippold, Janet B. Pierrehumbert
Adversarial Decoding: Generating Readable Documents for Adversarial Objectives	We design, implement, and evaluate adversarial decoding, a new, generic text generation technique that produces readable documents for adversarial objectives such as RAG poisoning, jailbreaking, and evasion of defensive filters. Prior generation methods either produce easily detectable gibberish (even methods that optimize for low perplexity), or cannot handle objectives that include embedding similarity. In particular, they cannot produce readable adversarial documents that (1) are retrieved by RAG systems in response to broad classes of queries, and (2) adversarially influence subsequent generation. We measure the effectiveness of adversarial decoding for different objectives and demonstrate that it outperforms existing methods while producing adversarial documents that cannot be automatically distinguished from natural documents by fluency and readability.	https://aclanthology.org/2026.findings-eacl.108	Collin Zhang, Tingwei Zhang, Vitaly Shmatikov
AfriMMT-EA: Multi-domain Machine Translation for Low-Resource East African Languages	Despite remarkable progress in multilingual machine translation (MT), the majority of African—especially East African—languages remain significantly underrepresented both in benchmark datasets and state-of-the-art (SOTA) MT models. This persistent exclusion from mainstream technologies not only limits equitable access, but constrains the development of tools that accurately reflect the region's linguistic and cultural diversity. Recent advances in open-source large language models have demonstrated strong multilingual MT capabilities through data-efficient adaptation strategies. However, little work has explored their potential for low-resource African languages. We introduce AfriMMT-EA, the first highly multilingual benchmark and MT dataset for East African languages. Our datasets comprise 54 local languages across five East African countries. We used these data to fine-tune two multilingual versions of Gemma-3. We compare models' performance on these languages with larger off-the-shelf baselines. We release our data and models, in the interest of advancing MT for these low-resource languages and their communities.	https://aclanthology.org/2026.findings-eacl.179	Naome A Etori, Kelechi Ezema, Nathaniel Romney Robinson, Davis David, Alfred Malengo Kondoro, Elisha Ondieki Makori, Michael Samwel Mollel, Maria Gini
Aggregating Crowd of LLMs for Cost-Effective Data Annotation	Recent advancements in Large Language Models (LLMs) have shown promise for automated data annotation, yet reliance on expensive commercial models like GPT-4 limits accessibility. This paper rigorously evaluates the potential of open-source smaller LLMs (sLLMs) as a cost-effective alternative. We introduce a new benchmark dataset, Multidisciplinary Open Research Data (MORD), comprising 12,277 annotated sentence segments from 1,500 schoolarly articles across five research domains, to systematically assess sLLM performance. Our experiments demonstrate that sLLMs achieve annotation quality surpassing Amazon MTurk workers and approach GPT-4's accuracy at significantly lower costs. We further propose to build the Crowd of LLMs, which aggregates annotations from multiple sLLMs using label aggregation algorithms. This approach not only outperforms individual sLLMs but also reveals that combining sLLM annotations with human crowd labels yields superior results compared to either method alone. Our findings highlight the viability of sLLMs for democratizing high-quality data annotation while underscoring the need for tailored aggregation methods to fully realize their potential.	https://aclanthology.org/2026.findings-eacl.125	Jiacheng Liu, Xiaofeng Hou
Analyzing LLM Instruction Optimization for Tabular Fact Verification	Instruction optimization provides a lightweight, model-agnostic approach to enhancing the reasoning performance of large language models (LLMs). This paper presents the first systematic comparison of instruction optimization, based on the DSPy optimization framework, for tabular fact verification. We evaluate four out-of-the-box prompting techniques that cover both text-only prompting and code use: direct prediction, Chain-of-Thought (CoT), ReAct with SQL tools, and CodeAct with Python execution. We study three optimizers from the DSPy framework—COPRO, MiPROv2, and SIMBA—across four benchmarks and three model families. We find that instruction optimization consistently improves verification accuracy, with MiPROv2 yielding the most stable gains for CoT, and SIMBA providing the largest benefits for ReAct agents, particularly at larger model scales. Behavioral analyses reveal that SIMBA encourages more direct reasoning paths by applying heuristics, thereby improving numerical comparison abilities in CoT reasoning and helping avoid unnecessary tool calls in ReAct agents. Across different prompting techniques, CoT remains effective for tabular fact checking, especially with smaller models. Although ReAct agents built with larger models can achieve competitive performance, they require careful instruction optimization.	https://aclanthology.org/2026.findings-eacl.161	Xiaotang Du, Giwon Hong, Wai-Chung Kwan, Rohit Saxena, Ivan Titov, Pasquale Minervini, Emily Allaway
Are Multimodal LLMs Movie Buffs?	No. While Multimodal Large Language Models (MLLMs) have been shown to perform very well on general video data, we systematically show that their performance on movies lags behind. This is surprising as MLLMs are increasingly used for movie understanding. To measure the performance of MLLMs on movies, we explore three pillars of movie mastery: movie knowledge, cinematographic knowledge, and critical analysis. Through a combination of quantitative and in-depth qualitative evaluations, we identify where MLLMs show promise and, in particular, where they fail. Our findings show that in small-scale settings involving factual knowledge, MLLMs are able to outperform existing methods. However, once cinematographic and critical analysis is required, MLLMs are insufficiently able to extract meaningful information from the visual modality to be able to provide useful insights. The data and project page are available at https://carlobretti.github.io/moviebuff.	https://aclanthology.org/2026.findings-eacl.139	Carlo Bretti, Pascal Mettes, Nanne Van Noord
Argument Component Segmentation with Fine-Tuned Large Language Models	Argument Mining (AM) aims to identify and interpret argumentative structures in unstructured text, with Argument Component Classification (ACC) as a core task. Despite significant advances, most ACC approaches rely on manually pre-segmented inputs, an assumption that rarely holds in practice due to the high cost and effort of expert human annotation, creating a major bottleneck for scalable AM systems. In this work, we focus on the foundation Argument Component Segmentation (ACS) task by proposing a fine-grained, paired-tag annotation schema that explicitly distinguishes between relevant and surrounding content, thus overcoming the limitations of previous single-separator approaches. Leveraging small and open Large Language Models (LLMs) fine-tuned on our paired-tag annotation schema, we can perform ACS with quality comparable to human expert annotators across multiple benchmark datasets. We further validate our approach on the downstream ACC task, showing that automated segmentation with fine-tuned LLMs yields ACC performances comparable to pipelines relying on human annotations. These findings suggest that reliable automated ACS via LLMs is both feasible and effective, paving the way for more scalable AM pipelines without human intervention.	https://aclanthology.org/2026.findings-eacl.272	Ettore Caputo, Sergio Greco, Lucio La Cava
Argument-Based Consistency in Toxicity Explanations of LLMs	The discourse around toxicity and LLMs in NLP largely revolves around detection tasks. This work shifts the focus to evaluating LLMs' *reasoning* about toxicity—from their explanations that justify a stance—to enhance their trustworthiness in downstream tasks. Despite extensive research on explainability, it is not straightforward to adopt existing methods to evaluate free-form toxicity explanation due to their over-reliance on input text perturbations, among other challenges. To account for these, we propose a novel, theoretically-grounded multi-dimensional criterion, **Argument-based Consistency (ArC)**, that measures the extent to which LLMs' free-form toxicity explanations reflect an ideal and logical argumentation process. Based on uncertainty quantification, we develop six metrics for ArC to comprehensively evaluate the (in)consistencies in LLMs' toxicity explanations. We conduct several experiments on three Llama models (of size up to 70B) and an 8B Ministral model on five diverse toxicity datasets. Our results show that while LLMs generate plausible explanations to simple prompts, their reasoning about toxicity breaks down when prompted about the nuanced relations between the complete set of reasons, the individual reasons, and their toxicity stances, resulting in inconsistent and irrelevant responses. We open-source our [code](https://github.com/uofthcdslab/ArC) and [LLM-generated explanations](https://huggingface.co/collections/uofthcdslab/arc) for future works.	https://aclanthology.org/2026.findings-eacl.310	Ramaravind Kommiya Mothilal, Joanna Roy, Syed Ishtiaque Ahmed, Shion Guha
Ask Me Again Differently: GRAS for Measuring Bias in Vision Language Models on Gender, Race, Age, and Skin Tone	As Vision Language Models (VLMs) become integral to real-world applications, understanding their demographic biases is critical. We introduce GRAS, a benchmark for uncovering demographic biases in VLMs across gender, race, age, and skin tone, offering the most diverse coverage to date. We further propose the GRAS Bias Score, an interpretable metric for quantifying bias. We benchmark five state-of-the-art VLMs and reveal concerning bias levels, with the least biased model attaining a GRAS Bias Score of 98, far from the unbiased ideal of 0. Our findings also reveal a methodological insight: evaluating bias in VLMs with visual question answering (VQA) requires considering multiple formulations of a question. Our code, data, and evaluation results are publicly available at https://github.com/shaivimalik/gras_bias_bench	https://aclanthology.org/2026.findings-eacl.123	Shaivi Malik, Hasnat Md Abdullah, Sriparna Saha, Amit Sheth
