title	abstract	url	authors
Don't Judge Code by Its Cover: Exploring Biases in LLM Judges for Code Evaluation	With the growing use of large language models (LLMs) as evaluators, their application has expanded to code evaluation tasks, where they assess the correctness of generated code without relying on reference implementations. While this offers scalability and flexibility, it also raises a critical, unresolved question: Can LLM judges fairly and robustly evaluate semantically equivalent code with superficial variations? Functionally correct code often exhibits variations—such as differences in variable names, comments, or formatting—that should not influence its correctness. Yet, whether LLM judges can reliably handle these variations remains unclear. We present the first comprehensive study of this issue, defining six types of potential bias in code evaluation and revealing their systematic impact on LLM judges. Across five programming languages and multiple LLMs, we empirically demonstrate that all tested LLM judges are susceptible to both positive and negative biases, resulting in inflated or unfairly low scores. Moreover, we observe that LLM judges remain vulnerable to these biases even when prompted to generate test cases before scoring, highlighting the need for more robust code evaluation method.	https://aclanthology.org/2026.findings-eacl.70	Jiwon Moon, Yerin Hwang, Dongryeol Lee, Taegwan Kang, Yongil Kim, Kyomin Jung
DuFFin: A Dual-Level Fingerprinting Framework for LLMs IP Protection	Large language models (LLMs) are considered valuable Intellectual Properties (IP) due to the enormous computational cost of training, making their protection against malicious stealing or unauthorized deployment crucial.Despite efforts in watermarking and fingerprinting, existing methods either affect text generation or rely on white-box access, limiting practicality.To address this, we propose DuFFin, a novel Dual-Level Fingerprinting framework for black-box ownership verification.DuFFin jointly extracts trigger patterns and knowledge-level fingerprints to identify the source of a suspect model.We conduct experiments on diverse open-source models, including four popular base LLMs and their fine-tuned, quantized, and safety-aligned variants released by large companies, start-ups, and individuals.Results show that DuFFin accurately verifies the copyright of protected LLMs on their variants, achieving an IP-ROC greater than 0.99.Our code is available at https://github.com/yuliangyan0807/llm-fingerprint.	https://aclanthology.org/2026.findings-eacl.273	Yuliang Yan, Haochun Tang, Shuo Yan, Enyan Dai
ETOM: A Five-Level Benchmark for Evaluating Tool Orchestration within the MCP Ecosystem	"We introduce ETOM, a five-level benchmark for evaluating multi-hop, end-to-end tool orchestration by LLM agents within a hierarchical Model-Context Protocol (MCP) ecosystem. Existing benchmarks often assess tools in isolation, overlooking challenges such as functional overlap and cross-server orchestration, which can lead to overly optimistic evaluations. ETOM addresses these gaps by constructing ground truth through ""equal function sets"", enabling objective metrics such as F1 score and reducing reliance on LLM-as-a-judge evaluation. Its five-level curriculum systematically tests agent capabilities, from single-tool orchestration to complex cross-server planning, as well as robustness to out-of-scope requests. Experiments reveal that rigid hierarchies can hinder performance without co-designed strategies, and even state-of-the-art agents exhibit systemic weaknesses in robustness. ETOM provides a diagnostic framework to expose these limitations and guide the development of more capable and efficient tool-using agents."	https://aclanthology.org/2026.findings-eacl.75	Jia-Kai Dong, I-Wei Huang, Chun-Tin Wu, Yi-tien Tsai
Efficient Table Retrieval and Understanding with Multimodal Large Language Models	Tabular data is frequently captured in image form across a wide range of real-world scenarios such as financial reports, handwritten records, and document scans. These visual representations pose unique challenges for machine understanding, as they combine both structural and visual complexities. While recent advances in Multimodal Large Language Models (MLLMs) show promising results in table understanding, they typically assume the relevant table is readily available. However, a more practical scenario involves identifying and reasoning over relevant tables from large-scale collections to answer user queries. To address this gap, we propose , a framework that enables MLLMs to answer queries over large collections of table images. Our approach first retrieves candidate tables using jointly trained visual-text foundation models, then leverages MLLMs to perform fine-grained reranking of these candidates, and finally employs MLLMs to reason over the selected tables for answer generation. Through extensive experiments on a newly constructed dataset comprising 88,161 training and 9,819 testing samples across 8 benchmarks with 48,504 unique tables, we demonstrate that our framework significantly outperforms existing methods by 7.0% in retrieval recall and 6.1% in answer accuracy, offering a practical solution for real-world table understanding tasks.	https://aclanthology.org/2026.findings-eacl.226	Zhuoyan Xu, Haoyang Fang, Boran Han, Bonan Min, Bernie Wang, Cuixiong Hu, Shuai Zhang
Emotion Recognition in Multi-Speaker Conversations through Speaker Identification, Knowledge Distillation, and Hierarchical Fusion	Emotion recognition in multi-speaker conversations faces significant challenges due to speaker ambiguity and severe class imbalance. We propose a novel framework that addresses these issues through three key innovations: (1) a speaker identification module that leverages audio-visual synchronization to accurately identify the active speaker, (2) a knowledge distillation strategy that transfers superior textual emotion understanding to audio and visual modalities, and (3) hierarchical attention fusion with composite loss functions to handle class imbalance. Comprehensive evaluations on MELD and IEMOCAP datasets demonstrate superior performance, achieving 67.75% and 72.44% weighted F1 scores respectively, with particularly notable improvements on minority emotion classes.	https://aclanthology.org/2026.findings-eacl.212	Li Xiao, Kotaro Funakoshi, Manabu Okumura
Enabling Autoregressive Models to Fill In Masked Tokens	Historically, LLMs have been trained using either autoregressive (AR) or masked language modeling (MLM) objectives, with AR models gaining dominance in recent years. However, AR models are inherently incapable of masked infilling, which is the ability to predict masked tokens between past and future context. In contrast, MLM models suffer from intrinsic computational inefficiencies during both training and inference that hinder their scalability. This work introduces MARIA (Masked and Autoregressive Infilling Architecture), a novel approach that leverages the strengths of both paradigms to achieve state-of-the-art masked infilling performance. MARIA combines a pre-trained MLM and AR model by training a linear decoder that takes their concatenated hidden states as input. This minimal modification enables the AR model to perform infilling while retaining its inherent advantages in terms of faster inference with KV caching. Our results demonstrate that MARIA significantly outperforms existing methods, namely discrete diffusion models, on masked infilling tasks.	https://aclanthology.org/2026.findings-eacl.260	Daniel Mingyi Israel, Aditya Grover, Guy Van den Broeck
Enhancing Reliability in Community Question Answering with an Expert-Oriented RAG System	In recent years, pre-trained large language models (LLMs) have become a cornerstone for automatically generating answers in question-and-answer (Q A) communities, significantly reducing user wait times and improving response quality. However, these models require substantial computational resources and are prone to generating hallucinated or unreliable content. To overcome these limitations, we propose an advanced expert-oriented Retrieval-Augmented Generation (RAG) framework as a cost-effective and reliable alternative. Central to our approach is a user-aware question entailment recognition module, which leverages user modeling to identify archived questions with answers that fully or partially address the user's new query. This user modeling significantly improves retrieval relevance, resulting in reduced hallucination and enhanced answer quality. The framework synthesizes expert-written answers from similar questions to generate unified responses. Experimental results on the CQADupStack and SE-PQA datasets show the superiority of our user-aware approach over its user-agnostic counterpart, with ROUGE-1 gains of 3.6% and 0.9%. Both human and AI evaluations confirm the effectiveness of incorporating user modeling in minimizing hallucination and delivering contextually appropriate answers, demonstrating its potential for real-world Q A systems. The code and data are available on a GitHub repository at https://anonymous.4open.science/r/User-Oriented-RAG-CQA.	https://aclanthology.org/2026.findings-eacl.132	Seyyede Zahra Aftabi, Saeed Farzi
Ensemble Privacy Defense for Knowledge-Intensive LLMs against Membership Inference Attacks	Retrieval-Augmented Generation (RAG) and Supervised Finetuning (SFT) have become the predominant paradigms for equipping Large Language Models (LLMs) with external knowledge for diverse, knowledge-intensive tasks. However, while such knowledge injection improves performance, it also exposes new attack surfaces. Membership Inference Attacks (MIAs), which aim to determine whether a given data sample was included in a model's training set, pose serious threats to privacy and trust in sensitive domains. To this end, we first systematically evaluate the vulnerability of RAG- and SFT-based LLMs to various MIAs. Then, to address the privacy risk, we further introduce a novel, model-agnostic defense framework, Ensemble Privacy Defense (EPD), which aggregates and evaluates the outputs of a knowledge-injected LLM, a base LLM, and a dedicated judge model to enhance resistance against MIAs. Comprehensive experiments show that, on average, EPD reduces MIA success by up to 27.8% for SFT and 526.3% for RAG compared to inference-time baseline, while maintaining answer quality.	https://aclanthology.org/2026.findings-eacl.145	Haowei Fu, Bo Ni, Han Xu, Kunpeng Liu, Dan Lin, Tyler Derr
Entity-aware Cross-lingual Claim Detection for Automated Fact-checking	Identifying claims requiring verification is a critical task in automated fact-checking, especially given the proliferation of misinformation on social media platforms. Despite notable progress, challenges remain—particularly in handling multilingual data prevalent in online discourse. Recent efforts have focused on fine-tuning pre-trained multilingual language models to address this. While these models can handle multiple languages, their ability to effectively transfer cross-lingual knowledge for detecting claims spreading on social media remains under-explored. In this paper, we introduce EX-Claim, an entity-aware cross-lingual claim detection model that generalizes well to handle multilingual claims. The model leverages entity information derived from named entity recognition and entity linking techniques to improve the language-level performance of both seen and unseen languages during training. Extensive experiments conducted on three datasets from different social media platforms demonstrate that our proposed model stands out as an effective solution, demonstrating consistent performance gains across 27 languages and robust knowledge transfer between languages seen and unseen during training.	https://aclanthology.org/2026.findings-eacl.2	Rrubaa Panchendrarajan, Arkaitz Zubiaga
Evaluating Morphological Plausibility of Subword Tokenization via Statistical Alignment with Morpho-Syntactic Features	We present a novel metric for the evaluation of morphological plausibility of subword segmentation.Unlike the typically used morpheme boundary or retrieval F-score, which requires gold segmentation data that is either unavailable or of inconsistent quality across many languages, our approach utilizes morpho-syntactic features.These are available in resources such as Universal Dependencies or UniMorph for a much wider range of languages.The metric works by probabilistically aligning subwords with morphological features through an IBM Model 1.Our experiments show that the metric correlates well with traditional morpheme boundary recall while being more broadly applicable across languages with different morphological systems.	https://aclanthology.org/2026.findings-eacl.196	Abishek Stephen, Jindřich Libovický
Evaluating Multi-Hop Reasoning in Large Language Models: A Chemistry-Centric Benchmark	We introduce ChemComp, the first chemistry-focused benchmark for evaluating compositional multi-hop reasoning in large language models (LLMs). Our automated pipeline constructs benchmarks from proprietary or public data by integrating generative reasoning models, chemical named-entity recognition, and external knowledge bases to build knowledge graphs. Applied to recent chemistry literature, this approach minimizes overlap with LLM pretraining data. The resulting dataset comprises 1,188 multi-hop questions, refined through domain-expert feedback and robust evaluation protocols.Using ChemComp, we systematically compare LLM performance with and without retrieval augmentation, including an idealized gold-context scenario. Our results show that even state-of-the-art models struggle with compositional reasoning: retrieval significantly improves accuracy, yet reasoning errors persist even under perfect retrieval. These findings highlight the limitations of current LLMs and the critical role of retrieval-augmented methods in scientific reasoning. Furthermore, our pipeline is generalizable with fine-tuning, enabling the creation of challenging multi-hop reasoning benchmarks across domains and proprietary datasets.	https://aclanthology.org/2026.findings-eacl.322	Mohammad Khodadad, Ali Shiraee Kasmaee, Mahdi Astaraki, Nicholas Sherck, Hamidreza Mahyar, Soheila Samiee
Evaluating Sparse Autoencoders for Monosemantic Representation	A key barrier to interpreting large language models is polysemanticity, where neurons activate for multiple unrelated concepts. Sparse autoencoders (SAEs) have been proposed to mitigate this issue by transforming dense activations into sparse, more interpretable features. While prior work suggests that SAEs promote monosemanticity, no quantitative comparison has examined how concept activation distributions differ between SAEs and their base models. This paper provides the first systematic evaluation of SAEs against base models through activation distribution lens. We introduce a fine-grained concept separability score based on the Jensen–Shannon distance, which captures how distinctly a neuron's activation distributions vary across concepts. Using two large language models (Gemma-2-2B and DeepSeek-R1) and multiple SAE variants across five datasets (including word-level and sentence-level), we show that SAEs reduce polysemanticity and achieve higher concept separability. To assess practical utility, we evaluate concept-level interventions using two strategies: full neuron masking and partial suppression. We find that, compared to base models, SAEs enable more precise concept-level control when using partial suppression. Building on this, we propose Attenuation via Posterior Probabilities (APP), a new intervention method that uses concept-conditioned activation distributions for targeted suppression. APP achieves the smallest perplexity increase while remaining highly effective at concept removal.	https://aclanthology.org/2026.findings-eacl.313	Moghis Fereidouni, Muhammad Umair Haider, Peizhong Ju, A.b. Siddique
Event Detection with a Context-Aware Encoder and LoRA for Improved Performance on Long-Tailed Classes	The current state of event detection research has two notable re-occurring limitations that we investigate in this study. First, the unidirectional nature of decoder-only LLMs presents a fundamental architectural bottleneck for natural language understanding tasks that depend on rich, bidirectional context. Second, we confront the conventional reliance on Micro-F1 scores in event detection literature, which systematically inflates performance by favoring majority classes. Instead, we focus on Macro-F1 as a more representative measure of a model's ability across the long-tail of event types. Our experiments demonstrate that models enhanced with sentence context achieve superior performance over canonical decoder-only baselines. Using Low-Rank Adaptation (LoRA) during finetuning provides a substantial boost in Macro-F1 scores in particular, especially for the decoder-only models, showing that LoRA can be an effective tool to enhance LLMs' performance on long-tailed event classes.	https://aclanthology.org/2026.findings-eacl.314	Abdullah Al Monsur, Nitesh Vamshi Bommisetty, Gene Louis Kim
Examining the Utility of Self-disclosure Types for Modeling Annotators of Social Norms	Recent work has explored the use of personal information in the form of persona sentences or self-disclosures to improve modeling of individual characteristics and prediction of annotator labels for subjective tasks. The volume of personal information has historically been restricted and thus little exploration has gone into understanding what kind of information is most informative for predicting annotator labels. In this work, we categorize self-disclosures and use them to build annotator models for predicting judgments of social norms. We perform several ablations and analyses to examine the impact of the type of information on our ability to predict annotation patterns. Contrary to previous work, only a small number of comments related to the original post are needed. Lastly, a more diverse sample of annotator self-disclosures did not lead to the best performance. Sampling from a larger pool of comments without filtering still yields the best performance, suggesting that there is still much to uncover in terms of what information about an annotator is most useful for verdict prediction.	https://aclanthology.org/2026.findings-eacl.8	Kieran Henderson, Kian Omoomi, Vasudha Varadarajan, Allison Lahnala, Charles Welch
Exploring Iterative Controllable Summarization with Large Language Models	Large language models (LLMs) have demonstrated remarkable performance in abstractive summarization tasks. However, their ability to precisely control summary attributes (e.g., length or topic) remains underexplored, limiting their adaptability to specific user preferences. In this paper, we systematically explore the controllability of LLMs. To this end, we revisit summary attribute measurements and introduce iterative evaluation metrics, failure rate and average iteration count, to more precisely evaluate controllability beyond assessment of errors. Our findings show that LLMs struggle more with numerical attributes than with linguistic attributes. To address this challenge, we propose a guide-to-explain framework (GTE) for controllable summarization. GTE enables the model to identify misaligned attributes in the initial draft and guides it to self-explain errors in the previous output. By encouraging reflection on attribute misalignment, GTE generates well-adjusted summaries that satisfy the desired attributes with robust effectiveness while requiring surprisingly fewer iterations than other iterative approaches.	https://aclanthology.org/2026.findings-eacl.26	Sangwon Ryu, Heejin Do, Daehui Kim, Hwanjo Yu, Dongwoo Kim, Yunsu Kim, Gary Lee, Jungseul Ok
ExpressivityBench: Can LLMs Communicate Implicitly?	Human communication is often implicit, conveying tone, identity, and intent beyond literal meanings. While large language models have achieved strong performance on explicit tasks such as summarization and reasoning, their capacity for expressivity, or implicit communication, remains underexplored. We introduce ExpressivityBench, a framework for evaluating the expressivity of LLMs using information-theoretic communication models. Our approach quantifies how well LLM-generated text communicates target properties without explicit mention, across nine tasks spanning emotion, identity, and tone. To enable scalable and reproducible evaluation, we employ LLM-based graders validated against human judgments. Our results reveal that while models are adept at expressing affective content, they struggle with sociolinguistic signals, lagging behind human baselines. This study provides a necessary step to evaluate human-like implicit communication, with implications for applications such as education, mental health support, and socially-aware dialogue systems. We provide code and data for our benchmark alongside our paper.	https://aclanthology.org/2026.findings-eacl.235	Joshua Tint, Som Sagar, Aditya Taparia, Kelly Raines, Bimsara Pathiraja, Caleb Liu, Ransalu Senanayake
FINEST: Improving LLM Responses to Sensitive Topics Through Fine-Grained Evaluation	Large Language Models (LLMs) often default to overly cautious and vague responses when handling sensitive topics, sacrificing helpfulness for safety. Existing evaluation frameworks lack systematic methods to identify and address specific weaknesses in responses to sensitive topics, making it difficult to improve both safety and helpfulness simultaneously. To address this, we introduce FINEST, a FINE-grained response evaluation taxonomy for Sensitive Topics, which breaks down helpfulness and harmlessness into errors across three main categories: Content, Logic, and Appropriateness. Experiments on a Korean-sensitive question dataset demonstrate that our score- and error-based improvement pipeline, guided by FINEST, significantly improves the model responses across all three categories, outperforming refinement without guidance. Notably, score-based improvement—providing category-specific scores and justifications—yields the most significant gains, reducing the error sentence ratio for Appropriateness by up to 33.09%. This work lays the foundation for a more explainable and comprehensive evaluation and improvement of LLM responses to sensitive questions.	https://aclanthology.org/2026.findings-eacl.327	Juhyun Oh, Nayeon Lee, Chani Jung, Jiho Jin, Junho Myung, Jongwon Lee, Taieui Song, Alice Oh
FLAT-LLM: Fine-grained Low-rank Activation Space Transformation for Large Language Model Compression	Large Language Models (LLMs) have enabled remarkable progress in natural language processing, yet their high computational and memory demands pose challenges for deployment in resource-constrained environments. Although recent low-rank decomposition methods offer a promising path for structural compression, they often suffer from accuracy degradation, expensive calibration procedures, and result in inefficient model architectures that hinder real-world inference speedups. In this paper, we propose FLAT-LLM, a fast and accurate, training-free structural compression method based on fine-grained low-rank transformations in the activation space. Specifically, we reduce the hidden dimension by transforming the weights using truncated eigenvectors computed via head-wise Principal Component Analysis, and employ a greedy budget redistribution strategy to adaptively allocate ranks across decoders. FLAT-LLM achieves efficient and effective weight compression without recovery fine-tuning, which could complete the calibration within a few minutes.Evaluated across 5 models and 11 datasets, FLAT-LLM outperforms structural pruning baselines in generalization and downstream performance, while delivering inference speedups over decomposition-based methods.	https://aclanthology.org/2026.findings-eacl.156	Jiayi Tian, Ryan Solgi, Jinming Lu, Yifan Yang, Hai Li, Zheng Zhang
FLUKE: A Linguistically-Driven and Task-Agnostic Framework for Robustness Evaluation	We present FLUKE (Framework for LingUistically-driven and tasK-agnostic robustness Evaluation), a framework for assessing model robustness through systematic minimal variations of test data. FLUKE introduces controlled variations across linguistic levels — from orthography to dialect and style — and leverages large language models (LLMs) with human validation to generate modifications. We demonstrate FLUKE's utility by evaluating both fine-tuned models and LLMs across six diverse NLP tasks (four classification and two generation tasks), and reveal that (1) the impact of linguistic variations is highly task-dependent, with some tests being critical for certain tasks but irrelevant for others; (2) LLMs still exhibit significant brittleness to certain linguistic variations, with reasoning LLMs surprisingly showing less robustness on some tasks compared to base models, and scaling improving robustness only for surface-level modifications; (3) models are overall more brittle to natural, fluent modifications such as syntax or style changes (and especially to negation), compared to corruption-style tests such as letter flipping; (4) the ability of a model to use a linguistic feature in generation does not correlate to its robustness to this feature on downstream tasks. These findings highlight the importance of systematic robustness testing for understanding model behaviors.	https://aclanthology.org/2026.findings-eacl.269	Yulia Otmakhova, Thinh Hung Truong, Rahmad Mahendra, Zenan Zhai, Rongxin Zhu, Daniel Beck, Jey Han Lau
