title	abstract	url	authors
Differentiable Reasoning on Large Knowledge Bases and Natural Language	Download PDF	https://ojs.aaai.org/index.php/AAAI/article/view/05182-differentiable-reasoning-on-large-knowledge-bases-and-natural-language	Pasquale Minervini, Matko Bošnjak, Tim Rocktäschel, Sebastian Riedel, Edward Grefenstette
Differential Equation Units: Learning Functional Forms of Activation Functions from Data	Download PDF	https://ojs.aaai.org/index.php/AAAI/article/view/06030-differential-equation-units-learning-functional-forms-of-activation-functions-from-data	MohamadAli Torkamani, Shiv Shankar, Amirmohammad Rooshenas, Phillip Wallis
Differentially Private Learning with Small Public Data	Download PDF	https://ojs.aaai.org/index.php/AAAI/article/view/06219-differentially-private-learning-with-small-public-data	Jun Wang, Zhi-Hua Zhou
Differentially Private and Fair Classification via Calibrated Functional Mechanism	Download PDF	https://ojs.aaai.org/index.php/AAAI/article/view/00622-differentially-private-and-fair-classification-via-calibrated-functional-mechanism	Jiahao Ding, Xinyue Zhang, Xiaohuan Li, Junyi Wang, Rong Yu, Miao Pan
Discontinuous Constituent Parsing with Pointer Networks	Download PDF	https://ojs.aaai.org/index.php/AAAI/article/view/07724-discontinuous-constituent-parsing-with-pointer-networks	Daniel Fernández-González, Carlos Gómez-Rodríguez
Discourse Level Factors for Sentence Deletion in Text Simplification	Download PDF	https://ojs.aaai.org/index.php/AAAI/article/view/09709-discourse-level-factors-for-sentence-deletion-in-text-simplification	Yang Zhong, Chao Jiang, Wei Xu, Junyi Jessy Li
Discovering New Intents via Constrained Deep Adaptive Clustering with Cluster Refinement	Download PDF	https://ojs.aaai.org/index.php/AAAI/article/view/08360-discovering-new-intents-via-constrained-deep-adaptive-clustering-with-cluster-refinement	Ting-En Lin, Hua Xu, Hanlei Zhang
Discovery News: A Generic Framework for Financial News Recommendation	Download PDF	https://ojs.aaai.org/index.php/AAAI/article/view/13390-discovery-news-a-generic-framework-for-financial-news-recommendation	Chong Wang, Lisa Kim, Grace Bang, Himani Singh, Russell Kociuba, Steven Pomerville, Xiaomo Liu
Discretizing Continuous Action Space for On-Policy Optimization	Download PDF	https://ojs.aaai.org/index.php/AAAI/article/view/05981-discretizing-continuous-action-space-for-on-policy-optimization	Yunhao Tang, Shipra Agrawal
Discriminating Cognitive Disequilibrium and Flow in Problem Solving: A Semi-Supervised Approach Using Involuntary Dynamic Behavioral Signals	Download PDF	https://ojs.aaai.org/index.php/AAAI/article/view/00420-discriminating-cognitive-disequilibrium-and-flow-in-problem-solving-a-semi-supervised-approach-using-involuntary-dynamic-behavioral-signals	Mononito Goswami, Lujie Chen, Artur Dubrawski
Discriminative Adversarial Domain Adaptation	Download PDF	https://ojs.aaai.org/index.php/AAAI/article/view/05940-discriminative-adversarial-domain-adaptation	Hui Tang, Kui Jia
Discriminative Sentence Modeling for Story Ending Prediction	Download PDF	https://ojs.aaai.org/index.php/AAAI/article/view/07602-discriminative-sentence-modeling-for-story-ending-prediction	Yiming Cui, Wanxiang Che, Wei-Nan Zhang, Ting Liu, Shijin Wang, Guoping Hu
Discriminative and Robust Online Learning for Siamese Visual Tracking	Download PDF	https://ojs.aaai.org/index.php/AAAI/article/view/13017-discriminative-and-robust-online-learning-for-siamese-visual-tracking	Jinghao Zhou, Peng Wang, Haoyang Sun
Distance-Based Equilibria in Normal-Form Games	Download PDF	https://ojs.aaai.org/index.php/AAAI/article/view/01750-distance-based-equilibria-in-normal-form-games	Erman Acar, Reshef Meir
Distance-IoU Loss: Faster and Better Learning for Bounding Box Regression	Download PDF	https://ojs.aaai.org/index.php/AAAI/article/view/12993-distance-iou-loss-faster-and-better-learning-for-bounding-box-regression	Zhaohui Zheng, Ping Wang, Wei Liu, Jinze Li, Rongguang Ye, Dongwei Ren
Distill BERT to Traditional Models in Chinese Machine Reading Comprehension (Student Abstract)	Download PDF	https://ojs.aaai.org/index.php/AAAI/article/view/13901-distill-bert-to-traditional-models-in-chinese-machine-reading-comprehension-student-abstract	Xingkai Ren, Ronghua Shi, Fangfang Li
Distilling Knowledge from Well-Informed Soft Labels for Neural Relation Extraction	Download PDF	https://ojs.aaai.org/index.php/AAAI/article/view/09620-distilling-knowledge-from-well-informed-soft-labels-for-neural-relation-extraction	Zhenyu Zhang, Xiaobo Shu, Bowen Yu, Tingwen Liu, Jiapeng Zhao, Quangang Li, Li Guo
Distilling Portable Generative Adversarial Networks for Image Translation	Download PDF	https://ojs.aaai.org/index.php/AAAI/article/view/03585-distilling-portable-generative-adversarial-networks-for-image-translation	Hanting Chen, Yunhe Wang, Han Shu, Changyuan Wen, Chunjing Xu, Boxin Shi, Chao Xu, Chang Xu
Distraction-Aware Feature Learning for Human Attribute Recognition via Coarse-to-Fine Attention Mechanism	Download PDF	https://ojs.aaai.org/index.php/AAAI/article/view/12394-distraction-aware-feature-learning-for-human-attribute-recognition-via-coarse-to-fine-attention-mechanism	Mingda Wu, Di Huang, Yuanfang Guo, Yunhong Wang
Distributed Machine Learning through Heterogeneous Edge Systems	Download PDF	https://ojs.aaai.org/index.php/AAAI/article/view/07179-distributed-machine-learning-through-heterogeneous-edge-systems	Hanpeng Hu, Dan Wang, Chuan Wu
Distributed Primal-Dual Optimization for Online Multi-Task Learning	Download PDF	https://ojs.aaai.org/index.php/AAAI/article/view/06631-distributed-primal-dual-optimization-for-online-multi-task-learning	Peng Yang, Ping Li
Distributed Representations for Arithmetic Word Problems	Download PDF	https://ojs.aaai.org/index.php/AAAI/article/view/09000-distributed-representations-for-arithmetic-word-problems	Sowmya S Sundaram, Deepak P, Savitha Sam Abraham
Distributed Stochastic Gradient Descent with Event-Triggered Communication	Download PDF	https://ojs.aaai.org/index.php/AAAI/article/view/07169-distributed-stochastic-gradient-descent-with-event-triggered-communication	Jemin George, Prudhvi Gurram
Distributionally Robust Counterfactual Risk Minimization	Download PDF	https://ojs.aaai.org/index.php/AAAI/article/view/03850-distributionally-robust-counterfactual-risk-minimization	Louis Faury, Ugo Tanielian, Elvis Dohmatob, Elena Smirnova, Flavian Vasile
Diversified Bayesian Nonnegative Matrix Factorization	Download PDF	https://ojs.aaai.org/index.php/AAAI/article/view/05420-diversified-bayesian-nonnegative-matrix-factorization	Qiao Maoying, Yu Jun, Liu Tongliang, Wang Xinchao, Tao Dacheng
Diversified Interactive Recommendation with Implicit Feedback	Download PDF	https://ojs.aaai.org/index.php/AAAI/article/view/04932-diversified-interactive-recommendation-with-implicit-feedback	Yong Liu, Yingtai Xiao, Qiong Wu, Chunyan Miao, Juyong Zhang, Binqiang Zhao, Haihong Tang
Diversity Transfer Network for Few-Shot Learning	Download PDF	https://ojs.aaai.org/index.php/AAAI/article/view/10559-diversity-transfer-network-for-few-shot-learning	Mengting Chen, Yuxin Fang, Xinggang Wang, Heng Luo, Yifeng Geng, Xinyu Zhang, Chang Huang, Wenyu Liu, Bo Wang
Divide and Conquer: Question-Guided Spatio-Temporal Contextual Attention for Video Question Answering	Download PDF	https://ojs.aaai.org/index.php/AAAI/article/view/11101-divide-and-conquer-question-guided-spatio-temporal-contextual-attention-for-video-question-answering	Jianwen Jiang, Ziqiang Chen, Haojie Lin, Xibin Zhao, Yue Gao
Divide-and-Conquer Learning with Nyström: Optimal Rate and Algorithm	Download PDF	https://ojs.aaai.org/index.php/AAAI/article/view/06696-divide-and-conquer-learning-with-nystrom-optimal-rate-and-algorithm	Rong Yin, Yong Liu, Lijing Lu, Weiping Wang, Dan Meng
Do Not Have Enough Data? Deep Learning to the Rescue!	Download PDF	https://ojs.aaai.org/index.php/AAAI/article/view/07383-do-not-have-enough-data-deep-learning-to-the-rescue	Ateret Anaby-Tavor, Boaz Carmeli, Esther Goldbraich, Amir Kantor, George Kour, Segev Shlomov, Naama Tepper, Naama Zwerdling
Do Subsampled Newton Methods Work for High-Dimensional Data?	Download PDF	https://ojs.aaai.org/index.php/AAAI/article/view/04723-do-subsampled-newton-methods-work-for-high-dimensional-data	Xiang Li, Shusen Wang, Zhihua Zhang
Doc2Dial: A Framework for Dialogue Composition Grounded in Documents	Download PDF	https://ojs.aaai.org/index.php/AAAI/article/view/13604-doc2dial-a-framework-for-dialogue-composition-grounded-in-documents	Song Feng, Kshitij Fadnis, Q. Vera Liao, Luis A. Lastras
Doctor2Vec: Dynamic Doctor Representation Learning for Clinical Trial Recruitment	Download PDF	https://ojs.aaai.org/index.php/AAAI/article/view/00557-doctor2vec-dynamic-doctor-representation-learning-for-clinical-trial-recruitment	Siddharth Biswal, Cao Xiao, Lucas M. Glass, Elizabeth Milkovits, Jimeng Sun
Document Summarization with VHTM: Variational Hierarchical Topic-Aware Mechanism	Download PDF	https://ojs.aaai.org/index.php/AAAI/article/view/07740-document-summarization-with-vhtm-variational-hierarchical-topic-aware-mechanism	Xiyan Fu, Jun Wang, Jinghan Zhang, Jinmao Wei, Zhenglu Yang
Does Speech Enhancement of Publicly Available Data Help Build Robust Speech Recognition Systems? (Student Abstract)	Download PDF	https://ojs.aaai.org/index.php/AAAI/article/view/13793-does-speech-enhancement-of-publicly-available-data-help-build-robust-speech-recognition-systems-student-abstract	Bhavya Ghai, Buvana Ramanan, Klaus Mueller
Domain Adaptive Attention Learning for Unsupervised Person Re-Identification	Download PDF	https://ojs.aaai.org/index.php/AAAI/article/view/11069-domain-adaptive-attention-learning-for-unsupervised-person-re-identification	Yangru Huang, Peixi Peng, Yi Jin, Yidong Li, Junliang Xing
Domain Conditioned Adaptation Network	Download PDF	https://ojs.aaai.org/index.php/AAAI/article/view/11386-domain-conditioned-adaptation-network	Shuang Li, Chi Liu, Qiuxia Lin, Binhui Xie, Zhengming Ding, Gao Huang, Jian Tang
Domain Generalization Using a Mixture of Multiple Latent Domains	Download PDF	https://ojs.aaai.org/index.php/AAAI/article/view/11749-domain-generalization-using-a-mixture-of-multiple-latent-domains	Toshihiko Matsuura, Tatsuya Harada
Domain Knowledge-Assisted Automatic Diagnosis of Idiopathic Pulmonary Fibrosis (IPF) Using High Resolution Computed Tomography (HRCT) (Student Abstract)	Download PDF	https://ojs.aaai.org/index.php/AAAI/article/view/13979-domain-knowledge-assisted-automatic-diagnosis-of-idiopathic-pulmonary-fibrosis-ipf-using-high-resolution-computed-tomography-hrct-student-abstract	Wenxi Yu, Hua Zhou, Jonathan G. Goldin, Grace Hyun J. Kim
Double-Oracle Sampling Method for Stackelberg Equilibrium Approximation in General-Sum Extensive-Form Games	Download PDF	https://ojs.aaai.org/index.php/AAAI/article/view/02054-double-oracle-sampling-method-for-stackelberg-equilibrium-approximation-in-general-sum-extensive-form-games	Jan Karwowski, Jacek Mańdziuk
Draft and Edit: Automatic Storytelling Through Multi-Pass Hierarchical Conditional Variational Autoencoder	Download PDF	https://ojs.aaai.org/index.php/AAAI/article/view/01741-draft-and-edit-automatic-storytelling-through-multi-pass-hierarchical-conditional-variational-autoencoder	Meng-Hsuan Yu, Juntao Li, Danyang Liu, Dongyan Zhao, Rui Yan, Bo Tang, Haisong Zhang
Draining the Water Hole: Mitigating Social Engineering Attacks with CyberTWEAK	Download PDF	https://ojs.aaai.org/index.php/AAAI/article/view/13363-draining-the-water-hole-mitigating-social-engineering-attacks-with-cybertweak	Zheyuan Ryan Shi, Aaron Schlenker, Brian Hay, Daniel Bittleston, Siyu Gao, Emily Peterson, John Trezza, Fei Fang
Dual Adversarial Co-Learning for Multi-Domain Text Classification	Download PDF	https://ojs.aaai.org/index.php/AAAI/article/view/06438-dual-adversarial-co-learning-for-multi-domain-text-classification	Yuan Wu, Yuhong Guo
Dual Relation Semi-Supervised Multi-Label Learning	Download PDF	https://ojs.aaai.org/index.php/AAAI/article/view/06227-dual-relation-semi-supervised-multi-label-learning	Lichen Wang, Yunyu Liu, Can Qin, Gan Sun, Yun Fu
DualVD: An Adaptive Dual Encoding Model for Deep Visual Understanding in Visual Dialogue	Download PDF	https://ojs.aaai.org/index.php/AAAI/article/view/11125-dualvd-an-adaptive-dual-encoding-model-for-deep-visual-understanding-in-visual-dialogue	Xiaoze Jiang, Jing Yu, Zengchang Qin, Yingying Zhuang, Xingxing Zhang, Yue Hu, Qi Wu
Dynamic Control of Probabilistic Simple Temporal Networks	Download PDF	https://ojs.aaai.org/index.php/AAAI/article/view/09851-dynamic-control-of-probabilistic-simple-temporal-networks	Michael Gao, Lindsay Popowski, Jim Boerkoel
Dynamic Embedding on Textual Networks via a Gaussian Process	Download PDF	https://ojs.aaai.org/index.php/AAAI/article/view/07562-dynamic-embedding-on-textual-networks-via-a-gaussian-process	Pengyu Cheng, Yitong Li, Xinyuan Zhang, Liqun Chen, David Carlson, Lawrence Carin
Dynamic Graph Representation for Occlusion Handling in Biometrics	Download PDF	https://ojs.aaai.org/index.php/AAAI/article/view/11940-dynamic-graph-representation-for-occlusion-handling-in-biometrics	Min Ren, Yunlong Wang, Zhenan Sun, Tieniu Tan
Dynamic Instance Normalization for Arbitrary Style Transfer	Download PDF	https://ojs.aaai.org/index.php/AAAI/article/view/04369-dynamic-instance-normalization-for-arbitrary-style-transfer	Yongcheng Jing, Xiao Liu, Yukang Ding, Xinchao Wang, Errui Ding, Mingli Song, Shilei Wen
Dynamic Knowledge Routing Network for Target-Guided Open-Domain Conversation	Download PDF	https://ojs.aaai.org/index.php/AAAI/article/view/08657-dynamic-knowledge-routing-network-for-target-guided-open-domain-conversation	Jinghui Qin, Zheng Ye, Jianheng Tang, Xiaodan Liang
Dynamic Malware Analysis with Feature Engineering and Feature Learning	Download PDF	https://ojs.aaai.org/index.php/AAAI/article/view/01210-dynamic-malware-analysis-with-feature-engineering-and-feature-learning	Zhaoqi Zhang, Panpan Qi, Wei Wang
Dynamic Network Pruning with Interpretable Layerwise Channel Selection	Download PDF	https://ojs.aaai.org/index.php/AAAI/article/view/06299-dynamic-network-pruning-with-interpretable-layerwise-channel-selection	Yulong Wang, Xiaolu Zhang, Xiaolin Hu, Bo Zhang, Hang Su
Dynamic Programming for Predict+Optimise	Download PDF	https://ojs.aaai.org/index.php/AAAI/article/view/01444-dynamic-programming-for-predict-optimise	Emir Demirovi?, Peter J. Stuckey, Tias Guns, James Bailey, Christopher Leckie, Kotagiri Ramamohanarao, Jeffrey Chan
Dynamic Reward-Based Dueling Deep Dyna-Q: Robust Policy Learning in Noisy Environments	Download PDF	https://ojs.aaai.org/index.php/AAAI/article/view/09676-dynamic-reward-based-dueling-deep-dyna-q-robust-policy-learning-in-noisy-environments	Yangyang Zhao, Zhenyu Wang, Kai Yin, Rui Zhang, Zhenhua Huang, Pei Wang
Dynamic Sampling Network for Semantic Segmentation	Download PDF	https://ojs.aaai.org/index.php/AAAI/article/view/10794-dynamic-sampling-network-for-semantic-segmentation	Bin Fu, Junjun He, Zhengfu Zhang, Yu Qiao
Dynamical System Inspired Adaptive Time Stepping Controller for Residual Network Families	Download PDF	https://ojs.aaai.org/index.php/AAAI/article/view/06648-dynamical-system-inspired-adaptive-time-stepping-controller-for-residual-network-families	Yibo Yang, Jianlong Wu, Hongyang Li, Xia Li, Tiancheng Shen, Zhouchen Lin
EAC-Net: Efficient and Accurate Convolutional Network for Video Recognition	Download PDF	https://ojs.aaai.org/index.php/AAAI/article/view/11149-eac-net-efficient-and-accurate-convolutional-network-for-video-recognition	Bowei Jin, Zhuo Xu
EC-GAN: Inferring Brain Effective Connectivity via Generative Adversarial Networks	Download PDF	https://ojs.aaai.org/index.php/AAAI/article/view/04852-ec-gan-inferring-brain-effective-connectivity-via-generative-adversarial-networks	Jinduo Liu, Junzhong Ji, Guangxu Xun, Liuyi Yao, Mengdi Huai, Aidong Zhang
ECGadv: Generating Adversarial Electrocardiogram to Misguide Arrhythmia Classification System	Download PDF	https://ojs.aaai.org/index.php/AAAI/article/view/03446-ecgadv-generating-adversarial-electrocardiogram-to-misguide-arrhythmia-classification-system	Huangxun Chen, Chenyu Huang, Qianyi Huang, Qian Zhang, Wei Wang
EEMEFN: Low-Light Image Enhancement via Edge-Enhanced Multi-Exposure Fusion Network	Download PDF	https://ojs.aaai.org/index.php/AAAI/article/view/13106-eemefn-low-light-image-enhancement-via-edge-enhanced-multi-exposure-fusion-network	Minfeng Zhu, Pingbo Pan, Wei Chen, Yi Yang
EFANet: Exchangeable Feature Alignment Network for Arbitrary Style Transfer	Download PDF	https://ojs.aaai.org/index.php/AAAI/article/view/12305-efanet-exchangeable-feature-alignment-network-for-arbitrary-style-transfer	Zhijie Wu, Chunjin Song, Yang Zhou, Minglun Gong, Hui Huang
EHSOD: CAM-Guided End-to-End Hybrid-Supervised Object Detection with Cascade Refinement	Download PDF	https://ojs.aaai.org/index.php/AAAI/article/view/10778-ehsod-cam-guided-end-to-end-hybrid-supervised-object-detection-with-cascade-refinement	Linpu Fang, Hang Xu, Zhili Liu, Sarah Parisot, Zhenguo Li
EMSContExt: EMS Protocol-Driven Concept Extraction for Cognitive Assistance in Emergency Response	Download PDF	https://ojs.aaai.org/index.php/AAAI/article/view/13350-emscontext-ems-protocol-driven-concept-extraction-for-cognitive-assistance-in-emergency-response	Sarah Masud Preum, Sile Shu, Homa Alemzadeh, John A. Stankovic
EPOC: Efficient Perception via Optimal Communication	Download PDF	https://ojs.aaai.org/index.php/AAAI/article/view/04107-epoc-efficient-perception-via-optimal-communication	Masoumeh Heidari Kapourchali, Bonny Banerjee
ERLP: Ensembles of Reinforcement Learning Policies (Student Abstract)	Download PDF	https://ojs.aaai.org/index.php/AAAI/article/view/13905-erlp-ensembles-of-reinforcement-learning-policies-student-abstract	Rohan Saphal, Balaraman Ravindran, Dheevatsa Mudigere, Sasikanth Avancha, Bharat Kaul
ERNIE 2.0: A Continual Pre-Training Framework for Language Understanding	Download PDF	https://ojs.aaai.org/index.php/AAAI/article/view/08968-ernie-2-0-a-continual-pre-training-framework-for-language-understanding	Yu Sun, Shuohuan Wang, Yukun Li, Shikun Feng, Hao Tian, Hua Wu, Haifeng Wang
ESAS: Towards Practical and Explainable Short Answer Scoring (Student Abstract)	Download PDF	https://ojs.aaai.org/index.php/AAAI/article/view/13797-esas-towards-practical-and-explainable-short-answer-scoring-student-abstract	Palak Goenka, Mehak Piplani, Ramit Sawhney, Puneet Mathur, Rajiv Ratn Shah
Effective AER Object Classification Using Segmented Probability-Maximization Learning in Spiking Neural Networks	Download PDF	https://ojs.aaai.org/index.php/AAAI/article/view/01308-effective-aer-object-classification-using-segmented-probability-maximization-learning-in-spiking-neural-networks	Qianhui Liu, Haibo Ruan, Dong Xing, Huajin Tang, Gang Pan
Effective Data Augmentation with Multi-Domain Learning GANs	Download PDF	https://ojs.aaai.org/index.php/AAAI/article/view/06566-effective-data-augmentation-with-multi-domain-learning-gans	Shin'ya Yamaguchi, Sekitoshi Kanai, Takeharu Eda
Effective Decoding in Graph Auto-Encoder Using Triadic Closure	Download PDF	https://ojs.aaai.org/index.php/AAAI/article/view/00906-effective-decoding-in-graph-auto-encoder-using-triadic-closure	Han Shi, Haozheng Fan, James T. Kwok
Effective Modeling of Encoder-Decoder Architecture for Joint Entity and Relation Extraction	Download PDF	https://ojs.aaai.org/index.php/AAAI/article/view/08528-effective-modeling-of-encoder-decoder-architecture-for-joint-entity-and-relation-extraction	Tapas Nayak, Hwee Tou Ng
Efficient Algorithms for Generating Provably Near-Optimal Cluster Descriptors for Explainability	Download PDF	https://ojs.aaai.org/index.php/AAAI/article/view/01636-efficient-algorithms-for-generating-provably-near-optimal-cluster-descriptors-for-explainability	Prathyush Sambaturu, Aparna Gupta, Ian Davidson, S. S. Ravi, Anil Vullikanti, Andrew Warren
Efficient Automatic CASH via Rising Bandits	Download PDF	https://ojs.aaai.org/index.php/AAAI/article/view/04763-efficient-automatic-cash-via-rising-bandits	Yang Li, Jiawei Jiang, Jinyang Gao, Yingxia Shao, Ce Zhang, Bin Cui
Efficient Facial Feature Learning with Wide Ensemble-Based Convolutional Neural Networks	Download PDF	https://ojs.aaai.org/index.php/AAAI/article/view/05800-efficient-facial-feature-learning-with-wide-ensemble-based-convolutional-neural-networks	Henrique Siqueira, Sven Magg, Stefan Wermter
Efficient Heterogeneous Collaborative Filtering without Negative Sampling for Recommendation	Download PDF	https://ojs.aaai.org/index.php/AAAI/article/view/00019-efficient-heterogeneous-collaborative-filtering-without-negative-sampling-for-recommendation	Chong Chen, Min Zhang, Yongfeng Zhang, Weizhi Ma, Yiqun Liu, Shaoping Ma
Efficient Inference of Optimal Decision Trees	Download PDF	https://ojs.aaai.org/index.php/AAAI/article/view/03195-efficient-inference-of-optimal-decision-trees	Florent Avellaneda
Efficient Model-Based Diagnosis of Sequential Circuits	Download PDF	https://ojs.aaai.org/index.php/AAAI/article/view/02814-efficient-model-based-diagnosis-of-sequential-circuits	Alexander Feldman, Ingo Pill, Franza Wotawa, Ion Matei, Johan de Kleer
Efficient Neural Architecture Search via Proximal Iterations	Download PDF	https://ojs.aaai.org/index.php/AAAI/article/view/06664-efficient-neural-architecture-search-via-proximal-iterations	Quanming Yao, Ju Xu, Wei-Wei Tu, Zhanxing Zhu
Efficient Predictive Uncertainty Estimators for Deep Probabilistic Models	Download PDF	https://ojs.aaai.org/index.php/AAAI/article/view/13740-efficient-predictive-uncertainty-estimators-for-deep-probabilistic-models	Julissa Villanueva Llerena, Denis Deratani Maua
Efficient Projection-Free Online Methods with Stochastic Recursive Gradient	Download PDF	https://ojs.aaai.org/index.php/AAAI/article/view/06446-efficient-projection-free-online-methods-with-stochastic-recursive-gradient	Jiahao Xie, Zebang Shen, Chao Zhang, Boyu Wang, Hui Qian
Efficient Querying from Weighted Binary Codes	Download PDF	https://ojs.aaai.org/index.php/AAAI/article/view/12346-efficient-querying-from-weighted-binary-codes	Zhenyu Weng, Yuesheng Zhu
Efficient Residual Dense Block Search for Image Super-Resolution	Download PDF	https://ojs.aaai.org/index.php/AAAI/article/view/12007-efficient-residual-dense-block-search-for-image-super-resolution	Dehua Song, Chang Xu, Xu Jia, Yiyi Chen, Chunjing Xu, Yunhe Wang
Efficient Spatial-Temporal Rebalancing of Shareable Bikes (Student Abstract)	Download PDF	https://ojs.aaai.org/index.php/AAAI/article/view/13775-efficient-spatial-temporal-rebalancing-of-shareable-bikes-student-abstract	Zichao Deng, Anqi Tu, Zelei Liu, Han Yu
Efficient Verification of ReLU-Based Neural Networks via Dependency Analysis	Download PDF	https://ojs.aaai.org/index.php/AAAI/article/view/03291-efficient-verification-of-relu-based-neural-networks-via-dependency-analysis	Elena Botoeva, Panagiotis Kouvaros, Jan Kronqvist, Alessio Lomuscio, Ruth Misener
Efficiently Enumerating Substrings with Statistically Significant Frequencies of Locally Optimal Occurrences in Gigantic String	Download PDF	https://ojs.aaai.org/index.php/AAAI/article/view/05240-efficiently-enumerating-substrings-with-statistically-significant-frequencies-of-locally-optimal-occurrences-in-gigantic-string	Atsuyoshi Nakamura, Ichigaku Takigawa, Hiroshi Mamitsuka
Eigenvalue Normalized Recurrent Neural Networks for Short Term Memory	Download PDF	https://ojs.aaai.org/index.php/AAAI/article/view/04115-eigenvalue-normalized-recurrent-neural-networks-for-short-term-memory	Kyle Helfrich, Qiang Ye
ElGolog: A High-Level Programming Language with Memory of the Execution History	Download PDF	https://ojs.aaai.org/index.php/AAAI/article/view/02806-elgolog-a-high-level-programming-language-with-memory-of-the-execution-history	Giuseppe De Giacomo, Yves Lespérance, Eugenia Ternovska
Electing Successive Committees: Complexity and Algorithms	Download PDF	https://ojs.aaai.org/index.php/AAAI/article/view/01846-electing-successive-committees-complexity-and-algorithms	Robert Bredereck, Andrzej Kaczmarczyk, Rolf Niedermeier
Election Control in Social Networks via Edge Addition or Removal	Download PDF	https://ojs.aaai.org/index.php/AAAI/article/view/01878-election-control-in-social-networks-via-edge-addition-or-removal	Matteo Castiglioni, Diodato Ferraioli, Nicola Gatti
ElixirNet: Relation-Aware Network Architecture Adaptation for Medical Lesion Detection	Download PDF	https://ojs.aaai.org/index.php/AAAI/article/view/11093-elixirnet-relation-aware-network-architecture-adaptation-for-medical-lesion-detection	Chenhan Jiang, Shaoju Wang, Xiaodan Liang, Hang Xu, Nong Xiao
Embedding Compression with Isotropic Iterative Quantization	Download PDF	https://ojs.aaai.org/index.php/AAAI/article/view/08336-embedding-compression-with-isotropic-iterative-quantization	Siyu Liao, Jie Chen, Yanzhi Wang, Qinru Qiu, Bo Yuan
Embedding Convolution Neural Network-Based Defect Finder for Deployed Vision Inspector in Manufacturing Company Frontec	Download PDF	https://ojs.aaai.org/index.php/AAAI/article/view/13164-embedding-convolution-neural-network-based-defect-finder-for-deployed-vision-inspector-in-manufacturing-company-frontec	Kyoung Jun Lee, Jun Woo Kwon, Soohong Min, Jungho Yoon
Embedding High-Level Knowledge into DQNs to Learn Faster and More Safely	Download PDF	https://ojs.aaai.org/index.php/AAAI/article/view/13608-embedding-high-level-knowledge-into-dqns-to-learn-faster-and-more-safely	Zihang Gao, Fangzhen Lin, Yi Zhou, Hao Zhang, Kaishun Wu, Haodi Zhang
Emergence of Writing Systems through Multi-Agent Cooperation (Student Abstract)	Download PDF	https://ojs.aaai.org/index.php/AAAI/article/view/13941-emergence-of-writing-systems-through-multi-agent-cooperation-student-abstract	Shresth Verma, Joydip Dhar
