title	abstract	url	authors
LATTE: Latent Type Modeling for Biomedical Entity Linking	Download PDF	https://ojs.aaai.org/index.php/AAAI/article/view/09757-latte-latent-type-modeling-for-biomedical-entity-linking	Ming Zhu, Busra Celikkaya, Parminder Bhatia, Chandan K. Reddy
LCD: Learned Cross-Domain Descriptors for 2D-3D Matching	Download PDF	https://ojs.aaai.org/index.php/AAAI/article/view/11856-lcd-learned-cross-domain-descriptors-for-2d-3d-matching	Quang-Hieu Pham, Mikaela Angelina Uy, Binh-Son Hua, Duc Thanh Nguyen, Gemma Roig, Sai-Kit Yeung
LGML: Logic Guided Machine Learning (Student Abstract)	Download PDF	https://ojs.aaai.org/index.php/AAAI/article/view/13909-lgml-logic-guided-machine-learning-student-abstract	Joseph Scott, Maysum Panju, Vijay Ganesh
LMLFM: Longitudinal Multi-Level Factorization Machine	Download PDF	https://ojs.aaai.org/index.php/AAAI/article/view/04811-lmlfm-longitudinal-multi-level-factorization-machine	Junjie Liang, Dongkuan Xu, Yiwei Sun, Vasant Honavar
LS-Tree: Model Interpretation When the Data Are Linguistic	Download PDF	https://ojs.aaai.org/index.php/AAAI/article/view/03454-ls-tree-model-interpretation-when-the-data-are-linguistic	Jianbo Chen, Michael Jordan
LTLƒ Synthesis with Fairness and Stability Assumptions	Download PDF	https://ojs.aaai.org/index.php/AAAI/article/view/03088-ltl%c6%92-synthesis-with-fairness-and-stability-assumptions	Shufang Zhu, Giuseppe De Giacomo, Geguang Pu, Moshe Y. Vardi
Label Enhancement with Sample Correlations via Low-Rank Representation	Download PDF	https://ojs.aaai.org/index.php/AAAI/article/view/05932-label-enhancement-with-sample-correlations-via-low-rank-representation	Haoyu Tang, Jihua Zhu, Qinghai Zheng, Jun Wang, Shanmin Pang, Zhongyu Li
Label Error Correction and Generation through Label Relationships	Download PDF	https://ojs.aaai.org/index.php/AAAI/article/view/03693-label-error-correction-and-generation-through-label-relationships	Zijun Cui, Yong Zhang, Qiang Ji
Ladder Loss for Coherent Visual-Semantic Embedding	Download PDF	https://ojs.aaai.org/index.php/AAAI/article/view/13050-ladder-loss-for-coherent-visual-semantic-embedding	Mo Zhou, Zhenxing Niu, Le Wang, Zhanning Gao, Qilin Zhang, Gang Hua
Large-Scale Multi-View Subspace Clustering in Linear Time	Download PDF	https://ojs.aaai.org/index.php/AAAI/article/view/04412-large-scale-multi-view-subspace-clustering-in-linear-time	Zhao Kang, Wangtao Zhou, Zhitong Zhao, Junming Shao, Meng Han, Zenglin Xu
LatRec: Recognizing Goals in Latent Space (Student Abstract)	Download PDF	https://ojs.aaai.org/index.php/AAAI/article/view/13747-latrec-recognizing-goals-in-latent-space-student-abstract	Leonardo Amado, Felipe Meneguzzi
Latent Emotion Memory for Multi-Label Emotion Classification	Download PDF	https://ojs.aaai.org/index.php/AAAI/article/view/07692-latent-emotion-memory-for-multi-label-emotion-classification	Hao Fei, Yue Zhang, Yafeng Ren, Donghong Ji
Latent Opinions Transfer Network for Target-Oriented Opinion Words Extraction	Download PDF	https://ojs.aaai.org/index.php/AAAI/article/view/09298-latent-opinions-transfer-network-for-target-oriented-opinion-words-extraction	Zhen Wu, Fei Zhao, Xin-Yu Dai, Shujian Huang, Jiajun Chen
Latent Relation Language Models	Download PDF	https://ojs.aaai.org/index.php/AAAI/article/view/07911-latent-relation-language-models	Hiroaki Hayashi, Zecong Hu, Chenyan Xiong, Graham Neubig
Latent-Variable Non-Autoregressive Neural Machine Translation with Deterministic Inference Using a Delta Posterior	Download PDF	https://ojs.aaai.org/index.php/AAAI/article/view/08846-latent-variable-non-autoregressive-neural-machine-translation-with-deterministic-inference-using-a-delta-posterior	Raphael Shu, Jason Lee, Hideki Nakayama, Kyunghyun Cho
Layerwise Sparse Coding for Pruned Deep Neural Networks with Extreme Compression Ratio	Download PDF	https://ojs.aaai.org/index.php/AAAI/article/view/04900-layerwise-sparse-coding-for-pruned-deep-neural-networks-with-extreme-compression-ratio	Xiao Liu, Wenbin Li, Jing Huo, Lili Yao, Yang Gao
LeDeepChef Deep Reinforcement Learning Agent for Families of Text-Based Games	Download PDF	https://ojs.aaai.org/index.php/AAAI/article/view/07342-ledeepchef-deep-reinforcement-learning-agent-for-families-of-text-based-games	Leonard Adolphs, Thomas Hofmann
Leakage-Robust Classifier via Mask-Enhanced Training (Student Abstract)	Download PDF	https://ojs.aaai.org/index.php/AAAI/article/view/13923-leakage-robust-classifier-via-mask-enhanced-training-student-abstract	Damian Stachura, Christopher Galias, Konrad Żołna
LearnIt: On-Demand Rapid Customization for Event-Event Relation Extraction	Download PDF	https://ojs.aaai.org/index.php/AAAI/article/view/13630-learnit-on-demand-rapid-customization-for-event-event-relation-extraction	Bonan Min, Manaj Srivastava, Haoling Qiu, Prasannakumar Muthukumar, Joshua Fasching
Learned Video Compression via Joint Spatial-Temporal Correlation Exploration	Download PDF	https://ojs.aaai.org/index.php/AAAI/article/view/11580-learned-video-compression-via-joint-spatial-temporal-correlation-exploration	Haojie Liu, Han Shen, Lichao Huang, Ming Lu, Tong Chen, Zhan Ma
Learning 2D Temporal Adjacent Networks for Moment Localization with Natural Language	Download PDF	https://ojs.aaai.org/index.php/AAAI/article/view/12870-learning-2d-temporal-adjacent-networks-for-moment-localization-with-natural-language	Songyang Zhang, Houwen Peng, Jianlong Fu, Jiebo Luo
Learning Agent Communication under Limited Bandwidth by Message Pruning	Download PDF	https://ojs.aaai.org/index.php/AAAI/article/view/05142-learning-agent-communication-under-limited-bandwidth-by-message-pruning	Hangyu Mao, Zhengchao Zhang, Zhen Xiao, Zhibo Gong, Yan Ni
Learning Attentive Pairwise Interaction for Fine-Grained Classification	Download PDF	https://ojs.aaai.org/index.php/AAAI/article/view/13130-learning-attentive-pairwise-interaction-for-fine-grained-classification	Peiqin Zhuang, Yali Wang, Yu Qiao
Learning Conceptual-Contextual Embeddings for Medical Text	Download PDF	https://ojs.aaai.org/index.php/AAAI/article/view/09579-learning-conceptual-contextual-embeddings-for-medical-text	Xiao Zhang, Dejing Dou, Ji Wu
Learning Counterfactual Representations for Estimating Individual Dose-Response Curves	Download PDF	https://ojs.aaai.org/index.php/AAAI/article/view/05612-learning-counterfactual-representations-for-estimating-individual-dose-response-curves	Patrick Schwab, Lorenz Linhardt, Stefan Bauer, Joachim M. Buhmann, Walter Karlen
Learning Cross-Aligned Latent Embeddings for Zero-Shot Cross-Modal Retrieval	Download PDF	https://ojs.aaai.org/index.php/AAAI/article/view/11515-learning-cross-aligned-latent-embeddings-for-zero-shot-cross-modal-retrieval	Kaiyi Lin, Xing Xu, Lianli Gao, Zheng Wang, Heng Tao Shen
Learning Cross-Modal Context Graph for Visual Grounding	Download PDF	https://ojs.aaai.org/index.php/AAAI/article/view/11645-learning-cross-modal-context-graph-for-visual-grounding	Yongfei Liu, Bo Wan, Xiaodan Zhu, Xuming He
Learning Deep Relations to Promote Saliency Detection	Download PDF	https://ojs.aaai.org/index.php/AAAI/article/view/10510-learning-deep-relations-to-promote-saliency-detection	Changrui Chen, Xin Sun, Yang Hua, Junyu Dong, Hongwei Xv
Learning Directional Sentence-Pair Embedding for Natural Language Reasoning (Student Abstract)	Download PDF	https://ojs.aaai.org/index.php/AAAI/article/view/13825-learning-directional-sentence-pair-embedding-for-natural-language-reasoning-student-abstract	Yuchen Jiang, Zhenxin Xiao, Kai-Wei Chang
Learning Diverse Stochastic Human-Action Generators by Learning Smooth Latent Transitions	Download PDF	https://ojs.aaai.org/index.php/AAAI/article/view/12281-learning-diverse-stochastic-human-action-generators-by-learning-smooth-latent-transitions	Zhenyi Wang, Ping Yu, Yang Zhao, Ruiyi Zhang, Yufan Zhou, Junsong Yuan, Changyou Chen
Learning Efficient Representations for Fake Speech Detection	Download PDF	https://ojs.aaai.org/index.php/AAAI/article/view/05859-learning-efficient-representations-for-fake-speech-detection	Nishant Subramani, Delip Rao
Learning End-to-End Scene Flow by Distilling Single Tasks Knowledge	Download PDF	https://ojs.aaai.org/index.php/AAAI/article/view/10435-learning-end-to-end-scene-flow-by-distilling-single-tasks-knowledge	Filippo Aleotti, Matteo Poggi, Fabio Tosi, Stefano Mattoccia
Learning Fair Naive Bayes Classifiers by Discovering and Eliminating Discrimination Patterns	Download PDF	https://ojs.aaai.org/index.php/AAAI/article/view/10077-learning-fair-naive-bayes-classifiers-by-discovering-and-eliminating-discrimination-patterns	YooJung Choi, Golnoosh Farnadi, Behrouz Babaki, Guy Van den Broeck
Learning Feature Interactions with Lorentzian Factorization Machine	Download PDF	https://ojs.aaai.org/index.php/AAAI/article/view/06470-learning-feature-interactions-with-lorentzian-factorization-machine	Canran Xu, Ming Wu
Learning General Latent-Variable Graphical Models with Predictive Belief Propagation	Download PDF	https://ojs.aaai.org/index.php/AAAI/article/view/06118-learning-general-latent-variable-graphical-models-with-predictive-belief-propagation	Borui Wang, Geoffrey Gordon
Learning Geo-Contextual Embeddings for Commuting Flow Prediction	Download PDF	https://ojs.aaai.org/index.php/AAAI/article/view/00808-learning-geo-contextual-embeddings-for-commuting-flow-prediction	Zhicheng Liu, Fabio Miranda, Weiting Xiong, Junyan Yang, Qiao Wang, Claudio Silva
Learning Graph Convolutional Network for Skeleton-Based Human Action Recognition by Neural Searching	Download PDF	https://ojs.aaai.org/index.php/AAAI/article/view/02669-learning-graph-convolutional-network-for-skeleton-based-human-action-recognition-by-neural-searching	Wei Peng, Xiaopeng Hong, Haoyu Chen, Guoying Zhao
Learning Hierarchy-Aware Knowledge Graph Embeddings for Link Prediction	Download PDF	https://ojs.aaai.org/index.php/AAAI/article/view/03065-learning-hierarchy-aware-knowledge-graph-embeddings-for-link-prediction	Zhanqiu Zhang, Jianyu Cai, Yongdong Zhang, Jie Wang
Learning Higher-Order Programs through Predicate Invention	Download PDF	https://ojs.aaai.org/index.php/AAAI/article/view/13655-learning-higher-order-programs-through-predicate-invention	Andrew Cropper, Rolf Morel, Stephen H. Muggleton
Learning Inverse Depth Regression for Multi-View Stereo with Correlation Cost Volume	Download PDF	https://ojs.aaai.org/index.php/AAAI/article/view/12508-learning-inverse-depth-regression-for-multi-view-stereo-with-correlation-cost-volume	Qingshan Xu, Wenbing Tao
Learning Light Field Angular Super-Resolution via a Geometry-Aware Network	Download PDF	https://ojs.aaai.org/index.php/AAAI/article/view/11141-learning-light-field-angular-super-resolution-via-a-geometry-aware-network	Jing Jin, Junhui Hou, Hui Yuan, Sam Kwong
Learning Long- and Short-Term User Literal-Preference with Multimodal Hierarchical Transformer Network for Personalized Image Caption	Download PDF	https://ojs.aaai.org/index.php/AAAI/article/view/09571-learning-long-and-short-term-user-literal-preference-with-multimodal-hierarchical-transformer-network-for-personalized-image-caption	Wei Zhang, Yue Ying, Pan Lu, Hongyuan Zha
Learning MAX-SAT from Contextual Examples for Combinatorial Optimisation	Download PDF	https://ojs.aaai.org/index.php/AAAI/article/view/04493-learning-max-sat-from-contextual-examples-for-combinatorial-optimisation	Mohit Kumar, Samuel Kolb, Stefano Teso, Luc De Raedt
Learning Meta Model for Zero- and Few-Shot Face Anti-Spoofing	Download PDF	https://ojs.aaai.org/index.php/AAAI/article/view/11916-learning-meta-model-for-zero-and-few-shot-face-anti-spoofing	Yunxiao Qin, Chenxu Zhao, Xiangyu Zhu, Zezheng Wang, Zitong Yu, Tianyu Fu, Feng Zhou, Jingping Shi, Zhen Lei
Learning Multi-Level Dependencies for Robust Word Recognition	Download PDF	https://ojs.aaai.org/index.php/AAAI/article/view/09250-learning-multi-level-dependencies-for-robust-word-recognition	Zhiwei Wang, Hui Liu, Jiliang Tang, Songfan Yang, Gale Yan Huang, Zitao Liu
Learning Multi-Modal Biomarker Representations via Globally Aligned Longitudinal Enrichments	Download PDF	https://ojs.aaai.org/index.php/AAAI/article/view/00817-learning-multi-modal-biomarker-representations-via-globally-aligned-longitudinal-enrichments	Lyujian Lu, Saad Elbeleidy, Lauren Zoe Baker, Hua Wang
Learning Optimal Decision Trees Using Caching Branch-and-Bound Search	Download PDF	https://ojs.aaai.org/index.php/AAAI/article/view/03146-learning-optimal-decision-trees-using-caching-branch-and-bound-search	Gaël Aglin, Siegfried Nijssen, Pierre Schaus
Learning Part Generation and Assembly for Structure-Aware Shape Synthesis	Download PDF	https://ojs.aaai.org/index.php/AAAI/article/view/11362-learning-part-generation-and-assembly-for-structure-aware-shape-synthesis	Jun Li, Chengjie Niu, Kai Xu
Learning Query Inseparable εℒℋ Ontologies	Download PDF	https://ojs.aaai.org/index.php/AAAI/article/view/02959-learning-query-inseparable-%ce%b5%e2%84%92%e2%84%8b-ontologies	Ana Ozaki, Cosimo Persia, Andrea Mazzullo
Learning Relationships between Text, Audio, and Video via Deep Canonical Correlation for Multimodal Language Analysis	Download PDF	https://ojs.aaai.org/index.php/AAAI/article/view/08992-learning-relationships-between-text-audio-and-video-via-deep-canonical-correlation-for-multimodal-language-analysis	Zhongkai Sun, Prathusha Sarma, William Sethares, Yingyu Liang
Learning Saliency-Free Model with Generic Features for Weakly-Supervised Semantic Segmentation	Download PDF	https://ojs.aaai.org/index.php/AAAI/article/view/11717-learning-saliency-free-model-with-generic-features-for-weakly-supervised-semantic-segmentation	Wenfeng Luo, Meng Yang
Learning Sense Representation from Word Representation for Unsupervised Word Sense Disambiguation (Student Abstract)	Download PDF	https://ojs.aaai.org/index.php/AAAI/article/view/13947-learning-sense-representation-from-word-representation-for-unsupervised-word-sense-disambiguation-student-abstract	Jie Wang, Zhenxin Fu, Moxin Li, Haisong Zhang, Dongyan Zhao, Rui Yan
Learning Signed Network Embedding via Graph Attention	Download PDF	https://ojs.aaai.org/index.php/AAAI/article/view/04772-learning-signed-network-embedding-via-graph-attention	Yu Li, Yuan Tian, Jiawei Zhang, Yi Chang
Learning Sparse Sharing Architectures for Multiple Tasks	Download PDF	https://ojs.aaai.org/index.php/AAAI/article/view/08936-learning-sparse-sharing-architectures-for-multiple-tasks	Tianxiang Sun, Yunfan Shao, Xiaonan Li, Pengfei Liu, Hang Yan, Xipeng Qiu, Xuanjing Huang
Learning Student Networks with Few Data	Download PDF	https://ojs.aaai.org/index.php/AAAI/article/view/04469-learning-student-networks-with-few-data	Shumin Kong, Tianyu Guo, Shan You, Chang Xu
Learning Transferable Adversarial Examples via Ghost Networks	Download PDF	https://ojs.aaai.org/index.php/AAAI/article/view/11458-learning-transferable-adversarial-examples-via-ghost-networks	Yingwei Li, Song Bai, Yuyin Zhou, Cihang Xie, Zhishuai Zhang, Alan Yuille
Learning Triple Embeddings from Knowledge Graphs	Download PDF	https://ojs.aaai.org/index.php/AAAI/article/view/03874-learning-triple-embeddings-from-knowledge-graphs	Valeria Fionda, Giuseppe Pirrò
Learning Weighted Model Integration Distributions	Download PDF	https://ojs.aaai.org/index.php/AAAI/article/view/05224-learning-weighted-model-integration-distributions	Paolo Morettin, Samuel Kolb, Stefano Teso, Andrea Passerini
Learning and Reasoning for Robot Sequential Decision Making under Uncertainty	Download PDF	https://ojs.aaai.org/index.php/AAAI/article/view/02726-learning-and-reasoning-for-robot-sequential-decision-making-under-uncertainty	Saeid Amiri, Mohammad Shokrolah Shirazi, Shiqi Zhang
Learning from Easy to Complex: Adaptive Multi-Curricula Learning for Neural Dialogue Generation	Download PDF	https://ojs.aaai.org/index.php/AAAI/article/view/07472-learning-from-easy-to-complex-adaptive-multi-curricula-learning-for-neural-dialogue-generation	Hengyi Cai, Hongshen Chen, Cheng Zhang, Yonghao Song, Xiaofang Zhao, Yangxi Li, Dongsheng Duan, Dawei Yin
Learning from Interventions Using Hierarchical Policies for Safe Learning	Download PDF	https://ojs.aaai.org/index.php/AAAI/article/view/10352-learning-from-interventions-using-hierarchical-policies-for-safe-learning	Jing Bi, Vikas Dhiman, Tianyou Xiao, Chenliang Xu
Learning from Positive and Unlabeled Data without Explicit Estimation of Class Prior	Download PDF	https://ojs.aaai.org/index.php/AAAI/article/view/06762-learning-from-positive-and-unlabeled-data-without-explicit-estimation-of-class-prior	Chenguang Zhang, Yuexian Hou, Yan Zhang
Learning from Weak-Label Data: A Deep Forest Expedition	Download PDF	https://ojs.aaai.org/index.php/AAAI/article/view/06251-learning-from-weak-label-data-a-deep-forest-expedition	Qian-Wei Wang, Liang Yang, Yu-Feng Li
Learning from the Past: Continual Meta-Learning with Bayesian Graph Neural Networks	Download PDF	https://ojs.aaai.org/index.php/AAAI/article/view/05021-learning-from-the-past-continual-meta-learning-with-bayesian-graph-neural-networks	Yadan Luo, Zi Huang, Zheng Zhang, Ziwei Wang, Mahsa Baktashmotlagh, Yang Yang
Learning on the Job: Online Lifelong and Continual Learning	Download PDF	https://ojs.aaai.org/index.php/AAAI/article/view/13544-learning-on-the-job-online-lifelong-and-continual-learning	Bing Liu
Learning the Graphical Structure of Electronic Health Records with Graph Convolutional Transformer	Download PDF	https://ojs.aaai.org/index.php/AAAI/article/view/00606-learning-the-graphical-structure-of-electronic-health-records-with-graph-convolutional-transformer	Edward Choi, Zhen Xu, Yujia Li, Michael Dusenberry, Gerardo Flores, Emily Xue, Andrew Dai
Learning the Value of Teamwork to Form Efficient Teams	Download PDF	https://ojs.aaai.org/index.php/AAAI/article/view/07063-learning-the-value-of-teamwork-to-form-efficient-teams	Ryan Beal, Narayan Changder, Timothy Norman, Sarvapali Ramchurn
Learning to Auto Weight: Entirely Data-Driven and Highly Efficient Weighting Framework	Download PDF	https://ojs.aaai.org/index.php/AAAI/article/view/04788-learning-to-auto-weight-entirely-data-driven-and-highly-efficient-weighting-framework	Zhenmao Li, Yichao Wu, Ken Chen, Yudong Wu, Shunfeng Zhou, Jiaheng Liu, Jiaheng Liu, Junjie Yan
Learning to Classify the Wrong Answers for Multiple Choice Question Answering (Student Abstract)	Download PDF	https://ojs.aaai.org/index.php/AAAI/article/view/13843-learning-to-classify-the-wrong-answers-for-multiple-choice-question-answering-student-abstract	Hyeondey Kim, Pascale Fung
Learning to Communicate Implicitly by Actions	Download PDF	https://ojs.aaai.org/index.php/AAAI/article/view/07261-learning-to-communicate-implicitly-by-actions	Zheng Tian, Shihao Zou, Ian Davies, Tim Warr, Lisheng Wu, Haitham Bou Ammar, Jun Wang
Learning to Compare for Better Training and Evaluation of Open Domain Natural Language Generation Models	Download PDF	https://ojs.aaai.org/index.php/AAAI/article/view/09717-learning-to-compare-for-better-training-and-evaluation-of-open-domain-natural-language-generation-models	Wangchunshu Zhou, Ke Xu
Learning to Crawl	Download PDF	https://ojs.aaai.org/index.php/AAAI/article/view/06046-learning-to-crawl	Utkarsh Upadhyay, Robert Busa-Fekete, Wojciech Kotlowski, David Pal, Balazs Szorenyi
Learning to Deblur Face Images via Sketch Synthesis	Download PDF	https://ojs.aaai.org/index.php/AAAI/article/view/11523-learning-to-deblur-face-images-via-sketch-synthesis	Songnan Lin, Jiawei Zhang, Jinshan Pan, Yicun Liu, Yongtian Wang, Jing Chen, Jimmy Ren
Learning to Follow Directions in Street View	Download PDF	https://ojs.aaai.org/index.php/AAAI/article/view/11773-learning-to-follow-directions-in-street-view	Karl Moritz Hermann, Mateusz Malinowski, Piotr Mirowski, Andras Banki-Horvath, Keith Anderson, Raia Hadsell
Learning to Generate Maps from Trajectories	Download PDF	https://ojs.aaai.org/index.php/AAAI/article/view/00890-learning-to-generate-maps-from-trajectories	Sijie Ruan, Cheng Long, Jie Bao, Chunyang Li, Zisheng Yu, Ruiyuan Li, Yuxuan Liang, Tianfu He, Yu Zheng
Learning to Incorporate Structure Knowledge for Image Inpainting	Download PDF	https://ojs.aaai.org/index.php/AAAI/article/view/12605-learning-to-incorporate-structure-knowledge-for-image-inpainting	Jie Yang, Zhiquan Qi, Yong Shi
Learning to Interactively Learn and Assist	Download PDF	https://ojs.aaai.org/index.php/AAAI/article/view/02535-learning-to-interactively-learn-and-assist	Mark Woodward, Chelsea Finn, Karol Hausman
Learning to Learn Morphological Inflection for Resource-Poor Languages	Download PDF	https://ojs.aaai.org/index.php/AAAI/article/view/08058-learning-to-learn-morphological-inflection-for-resource-poor-languages	Katharina Kann, Samuel R. Bowman, Kyunghyun Cho
Learning to Map Frequent Phrases to Sub-Structures of Meaning Representation for Neural Semantic Parsing	Download PDF	https://ojs.aaai.org/index.php/AAAI/article/view/07546-learning-to-map-frequent-phrases-to-sub-structures-of-meaning-representation-for-neural-semantic-parsing	Bo Chen, Xianpei Han, Ben He, Le Sun
Learning to Match on Graph for Fashion Compatibility Modeling	Download PDF	https://ojs.aaai.org/index.php/AAAI/article/view/00287-learning-to-match-on-graph-for-fashion-compatibility-modeling	Xun Yang, Xiaoyu Du, Meng Wang
Learning to Model Opponent Learning (Student Abstract)	Download PDF	https://ojs.aaai.org/index.php/AAAI/article/view/13771-learning-to-model-opponent-learning-student-abstract	Ian Davies, Zheng Tian, Jun Wang
Learning to Optimize Computational Resources: Frugal Training with Generalization Guarantees	Download PDF	https://ojs.aaai.org/index.php/AAAI/article/view/03227-learning-to-optimize-computational-resources-frugal-training-with-generalization-guarantees	Maria-Florina Balcan, Tuomas Sandholm, Ellen Vitercik
Learning to Optimize Variational Quantum Circuits to Solve Combinatorial Problems	Download PDF	https://ojs.aaai.org/index.php/AAAI/article/view/02367-learning-to-optimize-variational-quantum-circuits-to-solve-combinatorial-problems	Sami Khairy, Ruslan Shaydulin, Lukasz Cincio, Yuri Alexeev, Prasanna Balaprakash
Learning to Reason: Leveraging Neural Networks for Approximate DNF Counting	Download PDF	https://ojs.aaai.org/index.php/AAAI/article/view/03097-learning-to-reason-leveraging-neural-networks-for-approximate-dnf-counting	Ralph Abboud, Ismail Ceylan, Thomas Lukasiewicz
Learning to Select Bi-Aspect Information for Document-Scale Text Content Manipulation	Download PDF	https://ojs.aaai.org/index.php/AAAI/article/view/07716-learning-to-select-bi-aspect-information-for-document-scale-text-content-manipulation	Xiaocheng Feng, Yawei Sun, Bing Qin, Heng Gong, Yibo Sun, Wei Bi, XiaoJiang Liu, Ting Liu
Learning to Transfer: Unsupervised Domain Translation via Meta-Learning	Download PDF	https://ojs.aaai.org/index.php/AAAI/article/view/11507-learning-to-transfer-unsupervised-domain-translation-via-meta-learning	Jianxin Lin, Yijun Wang, Zhibo Chen, Tianyu He
Learning with Unsure Responses	Download PDF	https://ojs.aaai.org/index.php/AAAI/article/view/00230-learning-with-unsure-responses	Kunihiro Takeoka, Yuyang Dong, Masafumi Oyamada
Learning-Based Efficient Graph Similarity Computation via Multi-Scale Convolutional Set Matching	Download PDF	https://ojs.aaai.org/index.php/AAAI/article/view/03219-learning-based-efficient-graph-similarity-computation-via-multi-scale-convolutional-set-matching	Yunsheng Bai, Hao Ding, Ken Gu, Yizhou Sun, Wei Wang
Least General Generalizations in Description Logic: Verification and Existence	Download PDF	https://ojs.aaai.org/index.php/AAAI/article/view/02854-least-general-generalizations-in-description-logic-verification-and-existence	Jean Christoph Jung, Carsten Lutz, Frank Wolter
Less Is Better: Unweighted Data Subsampling via Influence Function	Download PDF	https://ojs.aaai.org/index.php/AAAI/article/view/06340-less-is-better-unweighted-data-subsampling-via-influence-function	Zifeng Wang, Hong Zhu, Zhenhua Dong, Xiuqiang He, Shao-Lun Huang
Lessons Learned from Teaching Machine Learning and Natural Language Processing to High School Students	Download PDF	https://ojs.aaai.org/index.php/AAAI/article/view/13397-lessons-learned-from-teaching-machine-learning-and-natural-language-processing-to-high-school-students	Narges Norouzi, Snigdha Chaturvedi, Matthew Rutledge
Let's Learn Their Language? A Case for Planning with Automata-Network Languages from Model Checking	Download PDF	https://ojs.aaai.org/index.php/AAAI/article/view/13569-let-s-learn-their-language-a-case-for-planning-with-automata-network-languages-from-model-checking	Jorg Hoffmann, Holger Hermanns, Michaela Klauck, Marcel Steinmetz, Erez Karpas, Daniele Magazzeni
Leveraging BERT with Mixup for Sentence Classification (Student Abstract)	Download PDF	https://ojs.aaai.org/index.php/AAAI/article/view/13829-leveraging-bert-with-mixup-for-sentence-classification-student-abstract	Amit Jindal, Dwaraknath Gnaneshwar, Ramit Sawhney, Rajiv Ratn Shah
Leveraging Multi-Token Entities in Document-Level Named Entity Recognition	Download PDF	https://ojs.aaai.org/index.php/AAAI/article/view/07961-leveraging-multi-token-entities-in-document-level-named-entity-recognition	Anwen Hu, Zhicheng Dou, Jian-Yun Nie, Ji-Rong Wen
Leveraging Multi-View Image Sets for Unsupervised Intrinsic Image Decomposition and Highlight Separation	Download PDF	https://ojs.aaai.org/index.php/AAAI/article/view/12685-leveraging-multi-view-image-sets-for-unsupervised-intrinsic-image-decomposition-and-highlight-separation	Renjiao Yi, Ping Tan, Stephen Lin
Leveraging Title-Abstract Attentive Semantics for Paper Recommendation	Download PDF	https://ojs.aaai.org/index.php/AAAI/article/view/00067-leveraging-title-abstract-attentive-semantics-for-paper-recommendation	Guibing Guo, Bowei Chen, Xiaoyan Zhang, Zhirong Liu, Zhenhua Dong, Xiuqiang He
