title	abstract	url	authors
Planning and Acting with Non-Deterministic Events: Navigating between Safe States	Download PDF	https://ojs.aaai.org/index.php/AAAI/article/view/09802-planning-and-acting-with-non-deterministic-events-navigating-between-safe-states	Lukas Chrpa, Jakub Gemrot, Martin Pilat
Planning with Abstract Learned Models While Learning Transferable Subtasks	Download PDF	https://ojs.aaai.org/index.php/AAAI/article/view/09992-planning-with-abstract-learned-models-while-learning-transferable-subtasks	John Winder, Stephanie Milani, Matthew Landen, Erebus Oh, Shane Parr, Shawn Squire, Marie desJardins, Cynthia Matuszek
Plug-in, Trainable Gate for Streamlining Arbitrary Neural Networks	Download PDF	https://ojs.aaai.org/index.php/AAAI/article/view/04452-plug-in-trainable-gate-for-streamlining-arbitrary-neural-networks	Jaedeok Kim, Chiyoun Park, Hyun-Joo Jung, Yoonsuck Choe
Point-Based Methods for Model Checking in Partially Observable Markov Decision Processes	Download PDF	https://ojs.aaai.org/index.php/AAAI/article/view/10061-point-based-methods-for-model-checking-in-partially-observable-markov-decision-processes	Maxime Bouton, Jana Tumova, Mykel J. Kochenderfer
Point2Node: Correlation Learning of Dynamic-Node for Point Cloud Feature Modeling	Download PDF	https://ojs.aaai.org/index.php/AAAI/article/view/10925-point2node-correlation-learning-of-dynamic-node-for-point-cloud-feature-modeling	Wenkai Han, Chenglu Wen, Cheng Wang, Xin Li, Qing Li
Pointwise Rotation-Invariant Network with Adaptive Sampling and 3D Spherical Voxel Convolution	Download PDF	https://ojs.aaai.org/index.php/AAAI/article/view/12717-pointwise-rotation-invariant-network-with-adaptive-sampling-and-3d-spherical-voxel-convolution	Yang You, Yujing Lou, Qi Liu, Yu-Wing Tai, Lizhuang Ma, Cewu Lu, Weiming Wang
Policy Search by Target Distribution Learning for Continuous Control	Download PDF	https://ojs.aaai.org/index.php/AAAI/article/view/06770-policy-search-by-target-distribution-learning-for-continuous-control	Chuheng Zhang, Yuanqi Li, Jian Li
Polynomial Matrix Completion for Missing Data Imputation and Transductive Learning	Download PDF	https://ojs.aaai.org/index.php/AAAI/article/view/03842-polynomial-matrix-completion-for-missing-data-imputation-and-transductive-learning	Jicong Fan, Yuqian Zhang, Madeleine Udell
Pose-Assisted Multi-Camera Collaboration for Active Object Tracking	Download PDF	https://ojs.aaai.org/index.php/AAAI/article/view/00759-pose-assisted-multi-camera-collaboration-for-active-object-tracking	Jing Li, Jing Xu, Fangwei Zhong, Xiangyu Kong, Yu Qiao, Yizhou Wang
Pose-Guided Multi-Granularity Attention Network for Text-Based Person Search	Download PDF	https://ojs.aaai.org/index.php/AAAI/article/view/11189-pose-guided-multi-granularity-attention-network-for-text-based-person-search	Ya Jing, Chenyang Si, Junbo Wang, Wei Wang, Liang Wang, Tieniu Tan
Position-Based Social Choice Methods for Intransitive Incomplete Pairwise Vote Sets (Student Abstract)	Download PDF	https://ojs.aaai.org/index.php/AAAI/article/view/14001-position-based-social-choice-methods-for-intransitive-incomplete-pairwise-vote-sets-student-abstract	Julian Zucker
Posterior-GAN: Towards Informative and Coherent Response Generation with Posterior Generative Adversarial Network	Download PDF	https://ojs.aaai.org/index.php/AAAI/article/view/07708-posterior-gan-towards-informative-and-coherent-response-generation-with-posterior-generative-adversarial-network	Shaoxiong Feng, Hongshen Chen, Kan Li, Dawei Yin
Posterior-Guided Neural Architecture Search	Download PDF	https://ojs.aaai.org/index.php/AAAI/article/view/06973-posterior-guided-neural-architecture-search	Yizhou Zhou, Xiaoyan Sun, Chong Luo, Zheng-Jun Zha, Wenjun Zeng
Potential Passenger Flow Prediction: A Novel Study for Urban Transportation Development	Download PDF	https://ojs.aaai.org/index.php/AAAI/article/view/04020-potential-passenger-flow-prediction-a-novel-study-for-urban-transportation-development	Yongshun Gong, Zhibin Li, Jian Zhang, Wei Liu, Jinfeng Yi
Practical Federated Gradient Boosting Decision Trees	Download PDF	https://ojs.aaai.org/index.php/AAAI/article/view/04642-practical-federated-gradient-boosting-decision-trees	Qinbin Li, Zeyi Wen, Bingsheng He
Practical Frank–Wolfe Method with Decision Diagrams for Computing Wardrop Equilibrium of Combinatorial Congestion Games	Download PDF	https://ojs.aaai.org/index.php/AAAI/article/view/02200-practical-frank-wolfe-method-with-decision-diagrams-for-computing-wardrop-equilibrium-of-combinatorial-congestion-games	Kengo Nakamura, Shinsaku Sakaue, Norihito Yasuda
Predicting AC Optimal Power Flows: Combining Deep Learning and Lagrangian Dual Methods	Download PDF	https://ojs.aaai.org/index.php/AAAI/article/view/00630-predicting-ac-optimal-power-flows-combining-deep-learning-and-lagrangian-dual-methods	Ferdinando Fioretto, Terrence W.K. Mak, Pascal Van Hentenryck
Predicting Opioid Overdose Crude Rates with Text-Based Twitter Features (Student Abstract)	Download PDF	https://ojs.aaai.org/index.php/AAAI/article/view/13787-predicting-opioid-overdose-crude-rates-with-text-based-twitter-features-student-abstract	Nupoor Gandhi, Alex Morales, Sally Man-Pui Chan, Dolores Albarracin, ChengXiang Zhai
Predicting Propositional Satisfiability via End-to-End Learning	Download PDF	https://ojs.aaai.org/index.php/AAAI/article/view/03324-predicting-propositional-satisfiability-via-end-to-end-learning	Chris Cameron, Rex Chen, Jason Hartford, Kevin Leyton-Brown
Predicting Students' Attention Level with Interpretable Facial and Head Dynamic Features in an Online Tutoring System (Student Abstract)	Download PDF	https://ojs.aaai.org/index.php/AAAI/article/view/13895-predicting-students-attention-level-with-interpretable-facial-and-head-dynamic-features-in-an-online-tutoring-system-student-abstract	Shimeng Peng, Lujie Chen, Chufan Gao, Richard Jiarui Tong
Predictive Engagement: An Efficient Metric for Automatic Evaluation of Open-Domain Dialogue Systems	Download PDF	https://ojs.aaai.org/index.php/AAAI/article/view/07789-predictive-engagement-an-efficient-metric-for-automatic-evaluation-of-open-domain-dialogue-systems	Sarik Ghazarian, Ralph Weischedel, Aram Galstyan, Nanyun Peng
Predictive Student Modeling in Educational Games with Multi-Task Learning	Download PDF	https://ojs.aaai.org/index.php/AAAI/article/view/00654-predictive-student-modeling-in-educational-games-with-multi-task-learning	Michael Geden, Andrew Emerson, Jonathan Rowe, Roger Azevedo, James Lester
PresentationTrainer: Oral Presentation Support System for Impression-Related Feedback	Download PDF	https://ojs.aaai.org/index.php/AAAI/article/view/13644-presentationtrainer-oral-presentation-support-system-for-impression-related-feedback	Shengzhou Yi, Hiroshi Yumoto, Xueting Wang, Toshihiko Yamasaki
Preserving Ordinal Consensus: Towards Feature Selection for Unlabeled Data	Download PDF	https://ojs.aaai.org/index.php/AAAI/article/view/00075-preserving-ordinal-consensus-towards-feature-selection-for-unlabeled-data	Jun Guo, Heng Chang, Wenwu Zhu
Preventing Arbitrage from Collusion When Eliciting Probabilities	Download PDF	https://ojs.aaai.org/index.php/AAAI/article/view/01958-preventing-arbitrage-from-collusion-when-eliciting-probabilities	Rupert Freeman, David M. Pennock, Dominik Peters, Bo Waggoner
Price of Fairness in Budget Division and Probabilistic Social Choice	Download PDF	https://ojs.aaai.org/index.php/AAAI/article/view/02184-price-of-fairness-in-budget-division-and-probabilistic-social-choice	Marcin Michorzewski, Dominik Peters, Piotr Skowron
Privacy Enhanced Multimodal Neural Representations for Emotion Recognition	Download PDF	https://ojs.aaai.org/index.php/AAAI/article/view/07985-privacy-enhanced-multimodal-neural-representations-for-emotion-recognition	Mimansa Jaiswal, Emily Mower Provost
Privacy-Preserving Gaussian Process Regression – A Modular Approach to the Application of Homomorphic Encryption	Download PDF	https://ojs.aaai.org/index.php/AAAI/article/view/03866-privacy-preserving-gaussian-process-regression-a-modular-approach-to-the-application-of-homomorphic-encryption	Peter Fenner, Edward Pyzer-Knapp
Privacy-Preserving Gradient Boosting Decision Trees	Download PDF	https://ojs.aaai.org/index.php/AAAI/article/view/00784-privacy-preserving-gradient-boosting-decision-trees	Qinbin Li, Zhaomin Wu, Zeyi Wen, Bingsheng He
Private Bayesian Persuasion with Sequential Games	Download PDF	https://ojs.aaai.org/index.php/AAAI/article/view/01886-private-bayesian-persuasion-with-sequential-games	Andrea Celli, Stefano Coniglio, Nicola Gatti
Probabilistic Inference for Predicate Constraint Satisfaction	Download PDF	https://ojs.aaai.org/index.php/AAAI/article/view/01644-probabilistic-inference-for-predicate-constraint-satisfaction	Yuki Satake, Hiroshi Unno, Hinata Yanagi
Probabilistic Reasoning Across the Causal Hierarchy	Download PDF	https://ojs.aaai.org/index.php/AAAI/article/view/10170-probabilistic-reasoning-across-the-causal-hierarchy	Duligur Ibeling, Thomas Icard
Probabilistic Super Resolution for Mineral Spectroscopy	Download PDF	https://ojs.aaai.org/index.php/AAAI/article/view/13241-probabilistic-super-resolution-for-mineral-spectroscopy	Alberto Candela, David R. Thompson, David Wettergreen, Kerry Cawse-Nicholson, Sven Geier, Michael L. Eastwood, Robert O. Green
Probing Brain Activation Patterns by Dissociating Semantics and Syntax in Sentences	Download PDF	https://ojs.aaai.org/index.php/AAAI/article/view/09201-probing-brain-activation-patterns-by-dissociating-semantics-and-syntax-in-sentences	Shaonan Wang, Jiajun Zhang, Nan Lin, Chengqing Zong
Probing Natural Language Inference Models through Semantic Fragments	Download PDF	https://ojs.aaai.org/index.php/AAAI/article/view/08713-probing-natural-language-inference-models-through-semantic-fragments	Kyle Richardson, Hai Hu, Lawrence Moss, Ashish Sabharwal
Progressive Bi-C3D Pose Grammar for Human Pose Estimation	Download PDF	https://ojs.aaai.org/index.php/AAAI/article/view/13033-progressive-bi-c3d-pose-grammar-for-human-pose-estimation	Lu Zhou, Yingying Chen, Jinqiao Wang, Hanqing Lu
Progressive Boundary Refinement Network for Temporal Action Detection	Download PDF	https://ojs.aaai.org/index.php/AAAI/article/view/11612-progressive-boundary-refinement-network-for-temporal-action-detection	Qinying Liu, Zilei Wang
Progressive Feature Polishing Network for Salient Object Detection	Download PDF	https://ojs.aaai.org/index.php/AAAI/article/view/12128-progressive-feature-polishing-network-for-salient-object-detection	Bo Wang, Quan Chen, Min Zhou, Zhiqiang Zhang, Xiaogang Jin, Kun Gai
Projective Quadratic Regression for Online Learning	Download PDF	https://ojs.aaai.org/index.php/AAAI/article/view/05093-projective-quadratic-regression-for-online-learning	Wenye Ma
Proportional Belief Merging	Download PDF	https://ojs.aaai.org/index.php/AAAI/article/view/02822-proportional-belief-merging	Adrian Haret, Martin Lackner, Andreas Pfandler, Johannes P. Wallner
Protecting Geolocation Privacy of Photo Collections	Download PDF	https://ojs.aaai.org/index.php/AAAI/article/view/00524-protecting-geolocation-privacy-of-photo-collections	Jinghan Yang, Ayan Chakrabarti, Yevgeniy Vorobeychik
Providing Uncertainty-Based Advice for Deep Reinforcement Learning Agents (Student Abstract)	Download PDF	https://ojs.aaai.org/index.php/AAAI/article/view/13913-providing-uncertainty-based-advice-for-deep-reinforcement-learning-agents-student-abstract	Felipe Leno Da Silva, Pablo Hernandez-Leal, Bilal Kartal, Matthew E. Taylor
Proximal Distilled Evolutionary Reinforcement Learning	Download PDF	https://ojs.aaai.org/index.php/AAAI/article/view/03283-proximal-distilled-evolutionary-reinforcement-learning	Cristian Bodnar, Ben Day, Pietro Lió
Proximity Preserving Binary Code Using Signed Graph-Cut	Download PDF	https://ojs.aaai.org/index.php/AAAI/article/view/04535-proximity-preserving-binary-code-using-signed-graph-cut	Inbal Lavi, Shai Avidan, Yoram Singer, Yacov Hel-Or
Pruning from Scratch	Download PDF	https://ojs.aaai.org/index.php/AAAI/article/view/12273-pruning-from-scratch	Yulong Wang, Xiaolu Zhang, Lingxi Xie, Jun Zhou, Hang Su, Bo Zhang, Xiaolin Hu
PsyNet: Self-Supervised Approach to Object Localization Using Point Symmetric Transformation	Download PDF	https://ojs.aaai.org/index.php/AAAI/article/view/10451-psynet-self-supervised-approach-to-object-localization-using-point-symmetric-transformation	Kyungjune Baek, Minhyun Lee, Hyunjung Shim
PulseSatellite: A Tool Using Human-AI Feedback Loops for Satellite Image Analysis in Humanitarian Contexts	Download PDF	https://ojs.aaai.org/index.php/AAAI/article/view/13628-pulsesatellite-a-tool-using-human-ai-feedback-loops-for-satellite-image-analysis-in-humanitarian-contexts	Tomaz Logar, Joseph Bullock, Edoardo Nemni, Lars Bromley, John A. Quinn, Miguel Luengo-Oroz
Pursuit of Low-Rank Models of Time-Varying Matrices Robust to Sparse and Measurement Noise	Download PDF	https://ojs.aaai.org/index.php/AAAI/article/view/03171-pursuit-of-low-rank-models-of-time-varying-matrices-robust-to-sparse-and-measurement-noise	Albert Akhriev, Jakub Marecek, Andrea Simonetto
Pyramid Attention Aggregation Network for Semantic Segmentation of Surgical Instruments	Download PDF	https://ojs.aaai.org/index.php/AAAI/article/view/11782-pyramid-attention-aggregation-network-for-semantic-segmentation-of-surgical-instruments	Zhen-Liang Ni, Gui-Bin Bian, Guan-An Wang, Xiao-Hu Zhou, Zeng-Guang Hou, Hua-Bin Chen, Xiao-Liang Xie
Pyramid Constrained Self-Attention Network for Fast Video Salient Object Detection	Download PDF	https://ojs.aaai.org/index.php/AAAI/article/view/10869-pyramid-constrained-self-attention-network-for-fast-video-salient-object-detection	Yuchao Gu, Lijuan Wang, Ziqin Wang, Yun Liu, Ming-Ming Cheng, Shao-Ping Lu
Q-BERT: Hessian Based Ultra Low Precision Quantization of BERT	Download PDF	https://ojs.aaai.org/index.php/AAAI/article/view/08815-q-bert-hessian-based-ultra-low-precision-quantization-of-bert	Sheng Shen, Zhen Dong, Jiayu Ye, Linjian Ma, Zhewei Yao, Amir Gholami, Michael W. Mahoney, Kurt Keutzer
QASC: A Dataset for Question Answering via Sentence Composition	Download PDF	https://ojs.aaai.org/index.php/AAAI/article/view/08082-qasc-a-dataset-for-question-answering-via-sentence-composition	Tushar Khot, Peter Clark, Michal Guerquin, Peter Jansen, Ashish Sabharwal
Quadruply Stochastic Gradient Method for Large Scale Nonlinear Semi-Supervised Ordinal Regression AUC Optimization	Download PDF	https://ojs.aaai.org/index.php/AAAI/article/view/05734-quadruply-stochastic-gradient-method-for-large-scale-nonlinear-semi-supervised-ordinal-regression-auc-optimization	Wanli Shi, Bin Gu, Xiang Li, Heng Huang
Quantized Compressive Sampling of Stochastic Gradients for Efficient Communication in Distributed Deep Learning	Download PDF	https://ojs.aaai.org/index.php/AAAI/article/view/03105-quantized-compressive-sampling-of-stochastic-gradients-for-efficient-communication-in-distributed-deep-learning	Afshin Abdi, Faramarz Fekri
Quantum Probabilistic Models Using Feynman Diagram Rules for Better Understanding the Information Diffusion Dynamics in Online Social Networks	Download PDF	https://ojs.aaai.org/index.php/AAAI/article/view/13730-quantum-probabilistic-models-using-feynman-diagram-rules-for-better-understanding-the-information-diffusion-dynamics-in-online-social-networks	Ece C. Mutlu
Query Answering with Guarded Existential Rules under Stable Model Semantics	Download PDF	https://ojs.aaai.org/index.php/AAAI/article/view/03017-query-answering-with-guarded-existential-rules-under-stable-model-semantics	Hai Wan, Guohui Xiao, Chenglin Wang, Xianqiao Liu, Junhong Chen, Zhe Wang
Query Rewriting for Ontology-Mediated Conditional Answers	Download PDF	https://ojs.aaai.org/index.php/AAAI/article/view/02734-query-rewriting-for-ontology-mediated-conditional-answers	Medina Andresel, Magdalena Ortiz, Mantas Simkus
Query-Driven Multi-Instance Learning	Download PDF	https://ojs.aaai.org/index.php/AAAI/article/view/04158-query-driven-multi-instance-learning	Yen-Chi Hsu, Cheng-Yao Hong, Ming-Sui Lee, Tyng-Luh Liu
Querying to Find a Safe Policy under Uncertain Safety Constraints in Markov Decision Processes	Download PDF	https://ojs.aaai.org/index.php/AAAI/article/view/02552-querying-to-find-a-safe-policy-under-uncertain-safety-constraints-in-markov-decision-processes	Shun Zhang, Edmund Durfee, Satinder Singh
Question Quality Improvement: Deep Question Understanding for Incident Management in Technical Support Domain	Download PDF	https://ojs.aaai.org/index.php/AAAI/article/view/13196-question-quality-improvement-deep-question-understanding-for-incident-management-in-technical-support-domain	Anupama Ray, Pooja Aggarwal, Csaba Hadhazi, Gargi Dasgupta, Amit Paradkar
Question-Driven Purchasing Propensity Analysis for Recommendation	Download PDF	https://ojs.aaai.org/index.php/AAAI/article/view/00035-question-driven-purchasing-propensity-analysis-for-recommendation	Long Chen, Ziyu Guan, Qibin Xu, Qiong Zhang, Huan Sun, Guangyue Lu, Deng Cai
RDSNet: A New Deep Architecture forReciprocal Object Detection and Instance Segmentation	Download PDF	https://ojs.aaai.org/index.php/AAAI/article/view/12208-rdsnet-a-new-deep-architecture-forreciprocal-object-detection-and-instance-segmentation	Shaoru Wang, Yongchao Gong, Junliang Xing, Lichao Huang, Chang Huang, Weiming Hu
REST: Performance Improvement of a Black Box Model via RL-Based Spatial Transformation	Download PDF	https://ojs.aaai.org/index.php/AAAI/article/view/11262-rest-performance-improvement-of-a-black-box-model-via-rl-based-spatial-transformation	Jae Myung Kim, Hyungjin Kim, Chanwoo Park, Jungwoo Lee
RIS-GAN: Explore Residual and Illumination with Generative Adversarial Networks for Shadow Removal	Download PDF	https://ojs.aaai.org/index.php/AAAI/article/view/12829-ris-gan-explore-residual-and-illumination-with-generative-adversarial-networks-for-shadow-removal	Ling Zhang, Chengjiang Long, Xiaolong Zhang, Chunxia Xiao
RL-Duet: Online Music Accompaniment Generation Using Deep Reinforcement Learning	Download PDF	https://ojs.aaai.org/index.php/AAAI/article/view/00710-rl-duet-online-music-accompaniment-generation-using-deep-reinforcement-learning	Nan Jiang, Sheng Jin, Zhiyao Duan, Changshui Zhang
RPM-Oriented Query Rewriting Framework for E-commerce Keyword-Based Sponsored Search (Student Abstract)	Download PDF	https://ojs.aaai.org/index.php/AAAI/article/view/13769-rpm-oriented-query-rewriting-framework-for-e-commerce-keyword-based-sponsored-search-student-abstract	Xiuying Chen, Daorui Xiao, Shen Gao, Guojun Liu, Wei Lin, Bo Zheng, Dongyan Zhao, Rui Yan
RTN: Reparameterized Ternary Network	Download PDF	https://ojs.aaai.org/index.php/AAAI/article/view/04780-rtn-reparameterized-ternary-network	Yuhang Li, Xin Dong, Sai Qian Zhang, Haoli Bai, Yuanpeng Chen, Wei Wang
Radial and Directional Posteriors for Bayesian Deep Learning	Download PDF	https://ojs.aaai.org/index.php/AAAI/article/view/05298-radial-and-directional-posteriors-for-bayesian-deep-learning	Changyong Oh, Kamil Adamczewski, Mijung Park
Random Erasing Data Augmentation	Download PDF	https://ojs.aaai.org/index.php/AAAI/article/view/13001-random-erasing-data-augmentation	Zhun Zhong, Liang Zheng, Guoliang Kang, Shaozi Li, Yi Yang
Random Fourier Features via Fast Surrogate Leverage Weighted Sampling	Download PDF	https://ojs.aaai.org/index.php/AAAI/article/view/04844-random-fourier-features-via-fast-surrogate-leverage-weighted-sampling	Fanghui Liu, Xiaolin Huang, Yudong Chen, Jie Yang, Johan Suykens
Random Intersection Graphs and Missing Data	Download PDF	https://ojs.aaai.org/index.php/AAAI/article/view/05579-random-intersection-graphs-and-missing-data	Dror Salti, Yakir Berchenko
Random Projections and α-Shape to Support the Kernel Design (Student Abstract)	Download PDF	https://ojs.aaai.org/index.php/AAAI/article/view/13877-random-projections-and-%ce%b1-shape-to-support-the-kernel-design-student-abstract	Daniel Moreira Cestari, Rodrigo Fernandes de Mello
Rank Aggregation via Heterogeneous Thurstone Preference Models	Download PDF	https://ojs.aaai.org/index.php/AAAI/article/view/04353-rank-aggregation-via-heterogeneous-thurstone-preference-models	Tao Jin, Pan Xu, Quanquan Gu, Farzad Farnoud
Rank3DGAN: Semantic Mesh Generation Using Relative Attributes	Download PDF	https://ojs.aaai.org/index.php/AAAI/article/view/05586-rank3dgan-semantic-mesh-generation-using-relative-attributes	Yassir Saquil, Qun-Ce Xu, Yong-Liang Yang, Peter Hall
Ranking and Rating Rankings and Ratings	Download PDF	https://ojs.aaai.org/index.php/AAAI/article/view/13704-ranking-and-rating-rankings-and-ratings	Jingyan Wang, Nihar B. Shah
Ranking-Based Semantics for Sets of Attacking Arguments	Download PDF	https://ojs.aaai.org/index.php/AAAI/article/view/03033-ranking-based-semantics-for-sets-of-attacking-arguments	Bruno Yun, Srdjan Vesic, Madalina Croitoru
Rare Words: A Major Problem for Contextualized Embeddings and How to Fix it by Attentive Mimicking	Download PDF	https://ojs.aaai.org/index.php/AAAI/article/view/08766-rare-words-a-major-problem-for-contextualized-embeddings-and-how-to-fix-it-by-attentive-mimicking	Timo Schick, Hinrich Schütze
Rception: Wide and Deep Interaction Networks for Machine Reading Comprehension (Student Abstract)	Download PDF	https://ojs.aaai.org/index.php/AAAI/article/view/13987-rception-wide-and-deep-interaction-networks-for-machine-reading-comprehension-student-abstract	Xuanyu Zhang, Zhichun Wang
Re-Attention for Visual Question Answering	Download PDF	https://ojs.aaai.org/index.php/AAAI/article/view/00091-re-attention-for-visual-question-answering	Wenya Guo, Ying Zhang, Xiaoping Wu, Jufeng Yang, Xiangrui Cai, Xiaojie Yuan
Re-Thinking LiDAR-Stereo Fusion Frameworks (Student Abstract)	Download PDF	https://ojs.aaai.org/index.php/AAAI/article/view/13827-re-thinking-lidar-stereo-fusion-frameworks-student-abstract	Qilin Jin, Parasara Sridhar Duggirala
ReCO: A Large Scale Chinese Reading Comprehension Dataset on Opinion	Download PDF	https://ojs.aaai.org/index.php/AAAI/article/view/09146-reco-a-large-scale-chinese-reading-comprehension-dataset-on-opinion	Bingning Wang, Ting Yao, Qi Zhang, Jingfang Xu, Xiaochuan Wang
Real-Time Emotion Recognition via Attention Gated Hierarchical Memory Network	Download PDF	https://ojs.aaai.org/index.php/AAAI/article/view/08002-real-time-emotion-recognition-via-attention-gated-hierarchical-memory-network	Wenxiang Jiao, Michael Lyu, Irwin King
Real-Time Object Tracking via Meta-Learning: Efficient Model Adaptation and One-Shot Channel Pruning	Download PDF	https://ojs.aaai.org/index.php/AAAI/article/view/11205-real-time-object-tracking-via-meta-learning-efficient-model-adaptation-and-one-shot-channel-pruning	Ilchae Jung, Kihyun You, Hyeonwoo Noh, Minsu Cho, Bohyung Han
Real-Time Route Search by Locations	Download PDF	https://ojs.aaai.org/index.php/AAAI/article/view/00574-real-time-route-search-by-locations	Lisi Chen, Shuo Shang, Tao Guo
Real-Time Scene Text Detection with Differentiable Binarization	Download PDF	https://ojs.aaai.org/index.php/AAAI/article/view/11474-real-time-scene-text-detection-with-differentiable-binarization	Minghui Liao, Zhaoyi Wan, Cong Yao, Kai Chen, Xiang Bai
Realistic Face Reenactment via Self-Supervised Disentangling of Identity and Pose	Download PDF	https://ojs.aaai.org/index.php/AAAI/article/view/12757-realistic-face-reenactment-via-self-supervised-disentangling-of-identity-and-pose	Xianfang Zeng, Yusu Pan, Mengmeng Wang, Jiangning Zhang, Yong Liu
Reasoning about Political Bias in Content Moderation	Download PDF	https://ojs.aaai.org/index.php/AAAI/article/view/13669-reasoning-about-political-bias-in-content-moderation	Shan Jiang, Ronald E. Robertson, Christo Wilson
Reasoning on Knowledge Graphs with Debate Dynamics	Download PDF	https://ojs.aaai.org/index.php/AAAI/article/view/04123-reasoning-on-knowledge-graphs-with-debate-dynamics	Marcel Hildebrandt, Jorge Andres Quintero Serna, Yunpu Ma, Martin Ringsquandl, Mitchell Joblin, Volker Tresp
Reasoning with Heterogeneous Graph Alignment for Video Question Answering	Download PDF	https://ojs.aaai.org/index.php/AAAI/article/view/11109-reasoning-with-heterogeneous-graph-alignment-for-video-question-answering	Pin Jiang, Yahong Han
Reborn Filters: Pruning Convolutional Neural Networks with Limited Data	Download PDF	https://ojs.aaai.org/index.php/AAAI/article/view/05972-reborn-filters-pruning-convolutional-neural-networks-with-limited-data	Yehui Tang, Shan You, Chang Xu, Jin Han, Chen Qian, Boxin Shi, Chao Xu, Changshui Zhang
Recognizing Instagram Filtered Images with Feature De-Stylization	Download PDF	https://ojs.aaai.org/index.php/AAAI/article/view/12418-recognizing-instagram-filtered-images-with-feature-de-stylization	Zhe Wu, Zuxuan Wu, Bharat Singh, Larry Davis
Recovering Causal Structures from Low-Order Conditional Independencies	Download PDF	https://ojs.aaai.org/index.php/AAAI/article/view/10302-recovering-causal-structures-from-low-order-conditional-independencies	Marcel Wienöbst, Maciej Liskiewicz
Recurrent Nested Model for Sequence Generation	Download PDF	https://ojs.aaai.org/index.php/AAAI/article/view/11117-recurrent-nested-model-for-sequence-generation	Wenhao Jiang, Lin Ma, Wei Lu
Recursively Binary Modification Model for Nested Named Entity Recognition	Download PDF	https://ojs.aaai.org/index.php/AAAI/article/view/08164-recursively-binary-modification-model-for-nested-named-entity-recognition	Bing Li, Shifeng Liu, Yifang Sun, Wei Wang, Xiang Zhao
Reduction and Local Search for Weighted Graph Coloring Problem	Download PDF	https://ojs.aaai.org/index.php/AAAI/article/view/02433-reduction-and-local-search-for-weighted-graph-coloring-problem	Yiyuan Wang, Shaowei Cai, Shiwei Pan, Ximing Li, Monghao Yin
