title	abstract	url	authors
Fast Abnormal Event Detection.	Fast abnormal event detection meets the growing demand to process an enormous number of surveillance videos. Based on the inherent redundancy of video structures, we propose an efficient sparse combination learning framework with both batch and online solvers. It achieves decent performance in the detection phase without compromising result quality. The extremely fast execution speed is guaranteed owing to the fact that our method effectively turns the original complicated problem into a few small-scale least square optimizations. Our method reaches high detection rates on benchmark datasets at a speed of 1000–1200 frames per second on average when computing on an ordinary single core desktop PC using MATLAB.	https://doi.org/10.1007/s11263-018-1129-8	Cewu Lu, Jianping Shi, Weiming Wang, Jiaya Jia
Fast Diffeomorphic Image Registration via Fourier-Approximated Lie Algebras.	This paper introduces Fourier-approximated Lie algebras for shooting (FLASH), a fast geodesic shooting algorithm for diffeomorphic image registration. We approximate the infinite-dimensional Lie algebra of smooth vector fields, i.e., the tangent space at the identity of the diffeomorphism group, with a low-dimensional, bandlimited space. We show that most of the computations for geodesic shooting can be carried out entirely in this low-dimensional space. Our algorithm results in dramatic savings in time and memory over traditional large-deformation diffeomorphic metric mapping algorithms, which require dense spatial discretizations of vector fields. To validate the effectiveness of FLASH, we run pairwise image registration on both 2D synthetic data and real 3D brain images and compare with the state-of-the-art geodesic shooting methods. Experimental results show that our algorithm dramatically reduces the computational cost and memory footprint of diffemorphic image registration with little or no loss of accuracy.	https://doi.org/10.1007/s11263-018-1099-x	Miaomiao Zhang, P. Thomas Fletcher
From BoW to CNN: Two Decades of Texture Representation for Texture Classification.	Texture is a fundamental characteristic of many types of images, and texture representation is one of the essential and challenging problems in computer vision and pattern recognition which has attracted extensive research attention over several decades. Since 2000, texture representations based on Bag of Words and on Convolutional Neural Networks have been extensively studied with impressive performance. Given this period of remarkable evolution, this paper aims to present a comprehensive survey of advances in texture representation over the last two decades. More than 250 major publications are cited in this survey covering different aspects of the research, including benchmark datasets and state of the art results. In retrospect of what has been achieved so far, the survey discusses open challenges and directions for future research.	https://doi.org/10.1007/s11263-018-1125-z	Li Liu, Jie Chen, Paul W. Fieguth, Guoying Zhao, Rama Chellappa, Matti Pietikäinen
Fusing Visual and Inertial Sensors with Semantics for 3D Human Pose Estimation.	We propose an approach to accurately estimate 3D human pose by fusing multi-viewpoint video (MVV) with inertial measurement unit (IMU) sensor data, without optical markers, a complex hardware setup or a full body model. Uniquely we use a multi-channel 3D convolutional neural network to learn a pose embedding from visual occupancy and semantic 2D pose estimates from the MVV in a discretised volumetric probabilistic visual hull. The learnt pose stream is concurrently processed with a forward kinematic solve of the IMU data and a temporal model (LSTM) exploits the rich spatial and temporal long range dependencies among the solved joints, the two streams are then fused in a final fully connected layer. The two complementary data sources allow for ambiguities to be resolved within each sensor modality, yielding improved accuracy over prior methods. Extensive evaluation is performed with state of the art performance reported on the popular Human 3.6M dataset (Ionescu et al. in Intell IEEE Trans Pattern Anal Mach 36(7):1325–1339, 2014), the newly released TotalCapture dataset and a challenging set of outdoor videos TotalCaptureOutdoor. We release the new hybrid MVV dataset (TotalCapture) comprising of multi-viewpoint video, IMU and accurate 3D skeletal joint ground truth derived from a commercial motion capture system. The dataset is available online at http://cvssp.org/data/totalcapture/.	https://doi.org/10.1007/s11263-018-1118-y	Andrew Gilbert, Matthew Trumble, Charles Malleson, Adrian Hilton, John P. Collomosse
Group Collaborative Representation for Image Set Classification.	With significant advances in imaging technology, multiple images of a person or an object are becoming readily available in a number of real-life scenarios. In contrast to single images, image sets can capture a broad range of variations in the appearance of a single face or object. Recognition from these multiple images (i.e., image set classification) has gained significant attention in the area of computer vision. Unlike many existing approaches, which assume that only the images in the same set affect each other, this work develops a group collaborative representation (GCR) model which makes no such assumption, and which can effectively determine the hidden structure among image sets. Specifically, GCR takes advantage of the relationship between image sets to capture the inter- and intra-set variations, and it determines the characteristic subspaces of all the gallery sets. In these subspaces, individual gallery images and each probe set can be effectively represented via a self-representation learning scheme, which leads to increased discriminative ability and enhances robustness and efficiency of the prediction process. By conducting extensive experiments and comparing with state-of-the-art, we demonstrated the superiority of the proposed method on set-based face recognition and object categorization tasks.	https://doi.org/10.1007/s11263-018-1088-0	Bo Liu, Liping Jing, Jia Li, Jian Yu, Alex Gittens, Michael W. Mahoney
Hierarchical Attention for Part-Aware Face Detection.	Expressive representations for characterizing face appearances are essential for accurate face detection. Due to different poses, scales, illumination, occlusion, etc, face appearances generally exhibit substantial variations, and the contents of each local region (facial part) vary from one face to another. Current detectors, however, particularly those based on convolutional neural networks, apply identical operations (e.g. convolution or pooling) to all local regions on each face for feature aggregation (in a generic sliding-window configuration), and take all local features as equally effective for the detection task. In such methods, not only is each local feature suboptimal due to ignoring region-wise distinctions, but also the overall face representations are semantically inconsistent. To address the issue, we design a hierarchical attention mechanism to allow adaptive exploration of local features. Given a face proposal, part-specific attention modeled as learnable Gaussian kernels is proposed to search for proper positions and scales of local regions to extract consistent and informative features of facial parts. Then face-specific attention predicted with LSTM is introduced to model relations between the local parts and adjust their contributions to the detection tasks. Such hierarchical attention leads to a part-aware face detector, which forms more expressive and semantically consistent face representations. Extensive experiments are performed on three challenging face detection datasets to demonstrate the effectiveness of our hierarchical attention and make comparisons with state-of-the-art methods.	https://doi.org/10.1007/s11263-019-01157-5	Shuzhe Wu, Meina Kan, Shiguang Shan, Xilin Chen
Identity-Preserving Face Recovery from Stylized Portraits.	Given an artistic portrait, recovering the latent photorealistic face that preserves the subject's identity is challenging because the facial details are often distorted or fully lost in artistic portraits. We develop an Identity-preserving Face Recovery from Portraits method that utilizes a Style Removal network (SRN) and a Discriminative Network (DN). Our SRN, composed of an autoencoder with residual block-embedded skip connections, is designed to transfer feature maps of stylized images to the feature maps of the corresponding photorealistic faces. Owing to the Spatial Transformer Network, SRN automatically compensates for misalignments of stylized portraits to output aligned realistic face images. To ensure the identity preservation, we promote the recovered and ground truth faces to share similar visual features via a distance measure which compares features of recovered and ground truth faces extracted from a pre-trained FaceNet network. DN has multiple convolutional and fully-connected layers, and its role is to enforce recovered faces to be similar to authentic faces. Thus, we can recover high-quality photorealistic faces from unaligned portraits while preserving the identity of the face in an image. By conducting extensive evaluations on a large-scale synthesized dataset and a hand-drawn sketch dataset, we demonstrate that our method achieves superior face recovery and attains state-of-the-art results. In addition, our method can recover photorealistic faces from unseen stylized portraits, artistic paintings, and hand-drawn sketches.	https://doi.org/10.1007/s11263-019-01169-1	Fatemeh Shiri, Xin Yu, Fatih Porikli, Richard Hartley, Piotr Koniusz
Joint Estimation of Camera Orientation and Vanishing Points from an Image Sequence in a Non-Manhattan World.	A widely used approach for estimating camera orientation is to use the points at infinity, i.e., the vanishing points (VPs). Enforcement of the orthogonal constraint between the VPs, known as the Manhattan world constraint, enables an estimation of the drift-free camera orientation to be achieved. However, in practical applications, this approach is neither effective (because of noisy parallel line segments) nor performable in non-Manhattan world scenes. To overcome these limitations, we propose a novel method that jointly estimates the VPs and camera orientation based on sequential Bayesian filtering. The proposed method does not require the Manhattan world assumption, and can perform a highly accurate estimation of camera orientation. In order to enhance the robustness of the joint estimation, we propose a keyframe-based feature management technique that removes false positives from parallel line clusters and detects new parallel line sets using geometric properties such as the orthogonality and rotational dependence for a VP, a line, and the camera rotation. In addition, we propose a 3-line camera rotation estimation method that does not require the Manhattan world assumption. The 3-line method is applied to the RANSAC-based outlier rejection technique to eliminate outlier measurements; therefore, the proposed method achieves accurate and robust estimation of the camera orientation and VPs in general scenes with non-orthogonal parallel lines. We demonstrate the superiority of the proposed method by conducting an extensive evaluation using synthetic and real datasets and by comparison with other state-of-the-art methods.	https://doi.org/10.1007/s11263-019-01196-y	Jeong-Kyun Lee, Kuk-Jin Yoon
Joint Face Hallucination and Deblurring via Structure Generation and Detail Enhancement.	We address the problem of restoring a high-resolution face image from a blurry low-resolution input. This problem is difficult as super-resolution and deblurring need to be tackled simultaneously. Moreover, existing algorithms cannot handle face images well as low-resolution face images do not have much texture which is especially critical for deblurring. In this paper, we propose an effective algorithm by utilizing the domain-specific knowledge of human faces to recover high-quality faces. We first propose a facial component guided deep Convolutional Neural Network (CNN) to restore a coarse face image, which is denoted as the base image where the facial component is automatically generated from the input face image. However, the CNN based method cannot handle image details well. We further develop a novel exemplar-based detail enhancement algorithm via facial component matching. Extensive experiments show that the proposed method outperforms the state-of-the-art algorithms both quantitatively and qualitatively.	https://doi.org/10.1007/s11263-019-01148-6	Yibing Song, Jiawei Zhang, Lijun Gong, Shengfeng He, Linchao Bao, Jinshan Pan, Qingxiong Yang, Ming-Hsuan Yang
Kernel Cuts: Kernel and Spectral Clustering Meet Regularization.	This work bridges the gap between two popular methodologies for data partitioning: kernel clustering and regularization-based segmentation. While addressing closely related practical problems, these general methodologies may seem very different based on how they are covered in the literature. The differences may show up in motivation, formulation, and optimization, e.g. spectral relaxation versus max-flow. We explain how regularization and kernel clustering can work together and why this is useful. Our joint energy combines standard regularization, e.g. MRF potentials, and kernel clustering criteria like normalized cut. Complementarity of such terms is demonstrated in many applications using our bound optimization Kernel Cut algorithm for the joint energy (code is publicly available). While detailing combinatorial move-making, our main focus are new linear kernel and spectral bounds for kernel clustering criteria allowing their integration with any regularization objectives with existing discrete or continuous solvers.	https://doi.org/10.1007/s11263-018-1115-1	Meng Tang, Dmitrii Marin, Ismail Ben Ayed, Yuri Boykov
LCEval: Learned Composite Metric for Caption Evaluation.	Automatic evaluation metrics hold a fundamental importance in the development and fine-grained analysis of captioning systems. While current evaluation metrics tend to achieve an acceptable correlation with human judgements at the system level, they fail to do so at the caption level. In this work, we propose a neural network-based learned metric to improve the caption-level caption evaluation. To get a deeper insight into the parameters which impact a learned metric's performance, this paper investigates the relationship between different linguistic features and the caption-level correlation of the learned metrics. We also compare metrics trained with different training examples to measure the variations in their evaluation. Moreover, we perform a robustness analysis, which highlights the sensitivity of learned and handcrafted metrics to various sentence perturbations. Our empirical analysis shows that our proposed metric not only outperforms the existing metrics in terms of caption-level correlation but it also shows a strong system-level correlation against human assessments.	https://doi.org/10.1007/s11263-019-01206-z	Naeha Sharif, Lyndon White, Mohammed Bennamoun, Wei Liu, Syed Afaq Ali Shah
Large-Scale Bisample Learning on ID Versus Spot Face Recognition.	In real-world face recognition applications, there is a tremendous amount of data with two images for each person. One is an ID photo for face enrollment, and the other is a probe photo captured on spot. Most existing methods are designed for training data with limited breadth (a relatively small number of classes) and sufficient depth (many samples for each class). They would meet great challenges on ID versus Spot (IvS) data, including the under-represented intra-class variations and an excessive demand on computing devices. In this paper, we propose a deep learning based large-scale bisample learning (LBL) method for IvS face recognition. To tackle the bisample problem with only two samples for each class, a classification–verification–classification training strategy is proposed to progressively enhance the IvS performance. Besides, a dominant prototype softmax is incorporated to make the deep learning scalable on large-scale classes. We conduct LBL on a IvS face dataset with more than two million identities. Experimental results show the proposed method achieves superior performance to previous ones, validating the effectiveness of LBL on IvS face recognition.	https://doi.org/10.1007/s11263-019-01162-8	Xiangyu Zhu, Hao Liu, Zhen Lei, Hailin Shi, Fan Yang, Dong Yi, Guojun Qi, Stan Z. Li
Learning Discriminative Aggregation Network for Video-Based Face Recognition and Person Re-identification.	In this paper, we propose a discriminative aggregation network method for video-based face recognition and person re-identification, which aims to integrate information from video frames for feature representation effectively and efficiently. Unlike existing video aggregation methods, our method aggregates raw video frames directly instead of the features obtained by complex processing. By combining the idea of metric learning and adversarial learning, we learn an aggregation network to generate more discriminative images compared to the raw input frames. Our framework reduces the number of image frames per video to be processed and significantly speeds up the recognition procedure. Furthermore, low-quality frames containing misleading information can be well filtered and denoised during the aggregation procedure, which makes our method more robust and discriminative. Experimental results on several widely used datasets show that our method can generate discriminative images from video clips and improve the overall recognition performance in both the speed and the accuracy for video-based face recognition and person re-identification.	https://doi.org/10.1007/s11263-018-1135-x	Yongming Rao, Jiwen Lu, Jie Zhou
Learning Human Pose Models from Synthesized Data for Robust RGB-D Action Recognition.	We propose Human Pose Models that represent RGB and depth images of human poses independent of clothing textures, backgrounds, lighting conditions, body shapes and camera viewpoints. Learning such universal models requires training images where all factors are varied for every human pose. Capturing such data is prohibitively expensive. Therefore, we develop a framework for synthesizing the training data. First, we learn representative human poses from a large corpus of real motion captured human skeleton data. Next, we fit synthetic 3D humans with different body shapes to each pose and render each from 180 camera viewpoints while randomly varying the clothing textures, background and lighting. Generative Adversarial Networks are employed to minimize the gap between synthetic and real image distributions. CNN models are then learned that transfer human poses to a shared high-level invariant space. The learned CNN models are then used as invariant feature extractors from real RGB and depth frames of human action videos and the temporal variations are modelled by Fourier Temporal Pyramid. Finally, linear SVM is used for classification. Experiments on three benchmark human action datasets show that our algorithm outperforms existing methods by significant margins for RGB only and RGB-D action recognition.	https://doi.org/10.1007/s11263-019-01192-2	Jian Liu, Hossein Rahmani, Naveed Akhtar, Ajmal Mian
Learning Transparent Object Matting.	This paper addresses the problem of image matting for transparent objects. Existing approaches often require tedious capturing procedures and long processing time, which limit their practical use. In this paper, we formulate transparent object matting as a refractive flow estimation problem, and propose a deep learning framework, called TOM-Net, for learning the refractive flow. Our framework comprises two parts, namely a multi-scale encoder-decoder network for producing a coarse prediction, and a residual network for refinement. At test time, TOM-Net takes a single image as input, and outputs a matte (consisting of an object mask, an attenuation mask and a refractive flow field) in a fast feed-forward pass. As no off-the-shelf dataset is available for transparent object matting, we create a large-scale synthetic dataset consisting of 178 K images of transparent objects rendered in front of images sampled from the Microsoft COCO dataset. We also capture a real dataset consisting of 876 samples using 14 transparent objects and 60 background images. Besides, we show that our method can be easily extended to handle the cases where a trimap or a background image is available. Promising experimental results have been achieved on both synthetic and real data, which clearly demonstrate the effectiveness of our approach.	https://doi.org/10.1007/s11263-019-01202-3	Guanying Chen, Kai Han, Kwan-Yee K. Wong
Learning from Longitudinal Face Demonstration - Where Tractable Deep Modeling Meets Inverse Reinforcement Learning.	This paper presents a novel subject-dependent deep aging path (SDAP), which inherits the merits of both generative probabilistic modeling and inverse reinforcement learning to model the facial structures and the longitudinal face aging process of a given subject. The proposed SDAP is optimized using tractable log-likelihood objective functions with convolutional neural networks (CNNs) based deep feature extraction. Instead of applying a fixed aging development path for all input faces and subjects, SDAP is able to provide the most appropriate aging development path for individual subject that optimizes the reward aging formulation. Unlike previous methods that can take only one image as the input, SDAP further allows multiple images as inputs, i.e. all information of a subject at either the same or different ages, to produce the optimal aging path for the given subject. Finally, SDAP allows efficiently synthesizing in-the-wild aging faces. The proposed model is experimented in both tasks of face aging synthesis and cross-age face verification. The experimental results consistently show SDAP achieves the state-of-the-art performance on numerous face aging databases, i.e. FG-NET, MORPH, aging faces in the wild (AGFW), and cross-age celebrity dataset (CACD). Furthermore, we also evaluate the performance of SDAP on large-scale Megaface challenge to demonstrate the advantages of the proposed solution.	https://doi.org/10.1007/s11263-019-01165-5	Chi Nhan Duong, Kha Gia Quach, Khoa Luu, T. Hoang Ngan Le, Marios Savvides, Tien D. Bui
Learning to Predict 3D Surfaces of Sculptures from Single and Multiple Views.	The objective of this work is to reconstruct the 3D surfaces of sculptures from one or more images using a view-dependent representation. To this end, we train a network, SiDeNet, to predict the Silhouette and Depth of the surface given a variable number of images; the silhouette is predicted at a different viewpoint from the inputs (e.g. from the side), while the depth is predicted at the viewpoint of the input images. This has three benefits. First, the network learns a representation of shape beyond that of a single viewpoint, as the silhouette forces it to respect the visual hull, and the depth image forces it to predict concavities (which don't appear on the visual hull). Second, as the network learns about 3D using the proxy tasks of predicting depth and silhouette images, it is not limited by the resolution of the 3D representation. Finally, using a view-dependent representation (e.g. additionally encoding the viewpoint with the input image) improves the network's generalisability to unseen objects. Additionally, the network is able to handle the input views in a flexible manner. First, it can ingest a different number of views during training and testing, and it is shown that the reconstruction performance improves as additional views are added at test-time. Second, the additional views do not need to be photometrically consistent. The network is trained and evaluated on two synthetic datasets—a realistic sculpture dataset (SketchFab), and ShapeNet. The design of the network is validated by comparing to state of the art methods for a set of tasks. It is shown that (i) passing the input viewpoint (i.e. using a view-dependent representation) improves the network's generalisability at test time. (ii) Predicting depth/silhouette images allows for higher quality predictions in 2D, as the network is not limited by the chosen latent 3D representation. (iii) On both datasets the method of combining views in a global manner performs better than a local method. Finally, we show that the trained network generalizes to real images, and probe how the network has encoded the latent 3D shape.	https://doi.org/10.1007/s11263-018-1124-0	Olivia Wiles, Andrew Zisserman
