title	abstract	url	authors
Robust and Optimal Registration of Image Sets and Structured Scenes via Sum-of-Squares Polynomials.	This paper addresses the problem of registering a known structured 3D scene, typically a 3D scan, and its metric Structure-from-Motion (SfM) counterpart. The proposed registration method relies on a prior plane segmentation of the 3D scan. Alignment is carried out by solving either the point-to-plane assignment problem, should the SfM reconstruction be sparse, or the plane-to-plane one in case of dense SfM. A Polynomial Sum-of-Squares optimization theory framework is employed for identifying point-to-plane and plane-to-plane mismatches, i.e. outliers, with certainty. An inlier set maximization approach within a Branch-and-Bound search scheme is adopted to iteratively build potential inlier sets and converge to the solution satisfied by the largest number of assignments. Plane visibility conditions and vague camera locations may be incorporated for better efficiency without sacrificing optimality. The registration problem is solved in two cases: (i) putative correspondences (with possibly overwhelmingly many outliers) are provided as input and (ii) no initial correspondences are available. Our approach yields outstanding results in terms of robustness and optimality.	https://doi.org/10.1007/s11263-018-1114-2	Danda Pani Paudel, Adlane Habed, Cédric Demonceaux, Pascal Vasseur
Second-order Temporal Pooling for Action Recognition.	Deep learning models for video-based action recognition usually generate features for short clips (consisting of a few frames); such clip-level features are aggregated to video-level representations by computing statistics on these features. Typically zero-th (max) or the first-order (average) statistics are used. In this paper, we explore the benefits of using second-order statistics.Specifically, we propose a novel end-to-end learnable feature aggregation scheme, dubbed temporal correlation pooling that generates an action descriptor for a video sequence by capturing the similarities between the temporal evolution of clip-level CNN features computed across the video. Such a descriptor, while being computationally cheap, also naturally encodes the co-activations of multiple CNN features, thereby providing a richer characterization of actions than their first-order counterparts. We also propose higher-order extensions of this scheme by computing correlations after embedding the CNN features in a reproducing kernel Hilbert space. We provide experiments on benchmark datasets such as HMDB-51 and UCF-101, fine-grained datasets such as MPII Cooking activities and JHMDB, as well as the recent Kinetics-600. Our results demonstrate the advantages of higher-order pooling schemes that when combined with hand-crafted features (as is standard practice) achieves state-of-the-art accuracy.	https://doi.org/10.1007/s11263-018-1111-5	Anoop Cherian, Stephen Gould
Semantic Understanding of Scenes Through the ADE20K Dataset.	Semantic understanding of visual scenes is one of the holy grails of computer vision. Despite efforts of the community in data collection, there are still few image datasets covering a wide range of scenes and object categories with pixel-wise annotations for scene understanding. In this work, we present a densely annotated dataset ADE20K, which spans diverse annotations of scenes, objects, parts of objects, and in some cases even parts of parts. Totally there are 25k images of the complex everyday scenes containing a variety of objects in their natural spatial context. On average there are 19.5 instances and 10.5 object classes per image. Based on ADE20K, we construct benchmarks for scene parsing and instance segmentation. We provide baseline performances on both of the benchmarks and re-implement state-of-the-art models for open source. We further evaluate the effect of synchronized batch normalization and find that a reasonably large batch size is crucial for the semantic segmentation performance. We show that the networks trained on ADE20K are able to segment a wide variety of scenes and objects.	https://doi.org/10.1007/s11263-018-1140-0	Bolei Zhou, Hang Zhao, Xavier Puig, Tete Xiao, Sanja Fidler, Adela Barriuso, Antonio Torralba
Single-Shot Scale-Aware Network for Real-Time Face Detection.	In this work, we describe a single-shot scale-aware convolutional neural network based face detector (SFDet). In comparison with the state-of-the-art anchor-based face detection methods, the main advantages of our method are summarized in four aspects. (1) We propose a scale-aware detection network using a wide scale range of layers associated with appropriate scales of anchors to handle faces with various scales, and describe a new equal density principle to ensure anchors with different scales to be evenly distributed on the image. (2) To improve the recall rates of faces with certain scales (e.g., the scales of the faces are quite different from the scales of designed anchors), we design a new anchor matching strategy with scale compensation. (3) We introduce an IoU-aware weighting scheme for each training sample in classification loss calculation to encode samples accurately in training process. (4) Considering the class imbalance issue, a max-out background strategy is used to reduce false positives. Several experiments are conducted on public challenging face detection datasets, i.e., WIDER FACE, AFW, PASCAL Face, FDDB, and MAFA, to demonstrate that the proposed method achieves the state-of-the-art results and runs at 82.1 FPS for the VGA-resolution images.	https://doi.org/10.1007/s11263-019-01159-3	Shifeng Zhang, Longyin Wen, Hailin Shi, Zhen Lei, Siwei Lyu, Stan Z. Li
Slanted Stixels: A Way to Represent Steep Streets.	This work presents and evaluates a novel compact scene representation based on Stixels that infers geometric and semantic information. Our approach overcomes the previous rather restrictive geometric assumptions for Stixels by introducing a novel depth model to account for non-flat roads and slanted objects. Both semantic and depth cues are used jointly to infer the scene representation in a sound global energy minimization formulation. Furthermore, a novel approximation scheme is introduced in order to significantly reduce the computational complexity of the Stixel algorithm, and then achieve real-time computation capabilities. The idea is to first perform an over-segmentation of the image, discarding the unlikely Stixel cuts, and apply the algorithm only on the remaining Stixel cuts. This work presents a novel over-segmentation strategy based on a fully convolutional network, which outperforms an approach based on using local extrema of the disparity map. We evaluate the proposed methods in terms of semantic and geometric accuracy as well as run-time on four publicly available benchmark datasets. Our approach maintains accuracy on flat road scene datasets while improving substantially on a novel non-flat road dataset.	https://doi.org/10.1007/s11263-019-01226-9	Daniel Hernández Juárez, Lukas Schneider, Pau Cebrian, Antonio Espinosa, David Vázquez, Antonio M. López, Uwe Franke, Marc Pollefeys, Juan C. Moure
Stochastic Quantization for Learning Accurate Low-Bit Deep Neural Networks.	Low-bit deep neural networks (DNNs) become critical for embedded applications due to their low storage requirement yet high computing efficiency. However, they suffer much from the non-negligible accuracy drop. This paper proposes the stochastic quantization (SQ) algorithm for learning accurate low-bit DNNs. The motivation is due to the following observation. Existing training algorithms approximate the real-valued weights with low-bit representation all together in each iteration. The quantization error may be small for some elements/filters, while is remarkable for others, which leads to inappropriate gradient directions during training, and thus brings notable accuracy drop. Instead, SQ quantizes a portion of elements/filters to low-bit values with a stochastic probability inversely proportional to the quantization error, while keeping the other portion unchanged with full precision. The quantized and full precision portions are updated with their corresponding gradients separately in each iteration. The SQ ratio, which measures the ratio of the quantized weights to all weights, is gradually increased until the whole network is quantized. This procedure can greatly compensate for the quantization error and thus yield better accuracy for low-bit DNNs. Experiments show that SQ can consistently and significantly improve the accuracy for different low-bit DNNs on various datasets and various network structures, no matter whether activation values are quantized or not.	https://doi.org/10.1007/s11263-019-01168-2	Yinpeng Dong, Renkun Ni, Jianguo Li, Yurong Chen, Hang Su, Jun Zhu
Structural Constraint Data Association for Online Multi-object Tracking.	Online two-dimensional (2D) multi-object tracking (MOT) is a challenging task when the objects of interest have similar appearances. In that case, the motion of objects is another helpful cue for tracking and discriminating multiple objects. However, when using a single moving camera for online 2D MOT, observable motion cues are contaminated by global camera movements and, thus, are not always predictable. To deal with unexpected camera motion, we propose a new data association method that effectively exploits structural constraints in the presence of large camera motion. In addition, to reduce incorrect associations with mis-detections and false positives, we develop a novel event aggregation method to integrate assignment costs computed by structural constraints. We also utilize structural constraints to track missing objects when they are re-detected again. By doing this, identities of the missing objects can be retained continuously. Experimental results validated the effectiveness of the proposed data association algorithm under unexpected camera motions. In addition, tracking results on a large number of benchmark datasets demonstrated that the proposed MOT algorithm performs robustly and favorably against various online methods in terms of several quantitative metrics, and that its performance is comparable to offline methods.	https://doi.org/10.1007/s11263-018-1087-1	Ju Hong Yoon, Chang-Ryeol Lee, Ming-Hsuan Yang, Kuk-Jin Yoon
Superpixel-Guided Two-View Deterministic Geometric Model Fitting.	"Geometric model fitting is a fundamental research topic in computer vision and it aims to fit and segment multiple-structure data. In this paper, we propose a novel superpixel-guided two-view geometric model fitting method (called SDF), which can obtain reliable and consistent results for real images. Specifically, SDF includes three main parts: a deterministic sampling algorithm, a model hypothesis updating strategy and a novel model selection algorithm. The proposed deterministic sampling algorithm generates a set of initial model hypotheses according to the prior information of superpixels. Then the proposed updating strategy further improves the quality of model hypotheses. After that, by analyzing the properties of the updated model hypotheses, the proposed model selection algorithm extends the conventional ""fit-and-remove"" framework to estimate model instances in multiple-structure data. The three parts are tightly coupled to boost the performance of SDF in both speed and accuracy, and SDF has the deterministic nature. Experimental results show that the proposed SDF has significant advantages over several state-of-the-art fitting methods when it is applied to real images with single-structure and multiple-structure data."	https://doi.org/10.1007/s11263-018-1100-8	Guobao Xiao, Hanzi Wang, Yan Yan, David Suter
Synthesis of High-Quality Visible Faces from Polarimetric Thermal Faces using Generative Adversarial Networks.	The large domain discrepancy between faces captured in polarimetric (or conventional) thermal and visible domains makes cross-domain face verification a highly challenging problem for human examiners as well as computer vision algorithms. Previous approaches utilize either a two-step procedure (visible feature estimation and visible image reconstruction) or an input-level fusion technique, where different Stokes images are concatenated and used as a multi-channel input to synthesize the visible image given the corresponding polarimetric signatures. Although these methods have yielded improvements, we argue that input-level fusion alone may not be sufficient to realize the full potential of the available Stokes images. We propose a generative adversarial networks based multi-stream feature-level fusion technique to synthesize high-quality visible images from polarimetric thermal images. The proposed network consists of a generator sub-network, constructed using an encoder–decoder network based on dense residual blocks, and a multi-scale discriminator sub-network. The generator network is trained by optimizing an adversarial loss in addition to a perceptual loss and an identity preserving loss to enable photo realistic generation of visible images while preserving discriminative characteristics. An extended dataset consisting of polarimetric thermal facial signatures of 111 subjects is also introduced. Multiple experiments evaluated on different experimental protocols demonstrate that the proposed method achieves state-of-the-art performance. Code will be made available at https://github.com/hezhangsprinter.	https://doi.org/10.1007/s11263-019-01175-3	He Zhang, Benjamin S. Riggan, Shuowen Hu, Nathaniel J. Short, Vishal M. Patel
Tensor Decomposition and Non-linear Manifold Modeling for 3D Head Pose Estimation.	Head pose estimation is a challenging computer vision problem with important applications in different scenarios such as human–computer interaction or face recognition. In this paper, we present a 3D head pose estimation algorithm based on non-linear manifold learning. A key feature of the proposed approach is that it allows modeling the underlying 3D manifold that results from the combination of rotation angles. To do so, we use tensor decomposition to generate separate subspaces for each variation factor and show that each of them has a clear structure that can be modeled with cosine functions from a unique shared parameter per angle. Such representation provides a deep understanding of data behavior. We show that the proposed framework can be applied to a wide variety of input features and can be used for different purposes. Firstly, we test our system on a publicly available database, which consists of 2D images and we show that the cosine functions can be used to synthesize rotated versions from an object from which we see only a 2D image at a specific angle. Further, we perform 3D head pose estimation experiments using other two types of features: automatic landmarks and histogram-based 3D descriptors. We evaluate our approach on two publicly available databases, and demonstrate that angle estimations can be performed by optimizing the combination of these cosine functions to achieve state-of-the-art performance.	https://doi.org/10.1007/s11263-019-01208-x	Dmytro Derkach, Adria Ruiz, Federico M. Sukno
The Devil is in the Decoder: Classification, Regression and GANs.	Many machine vision applications, such as semantic segmentation and depth prediction, require predictions for every pixel of the input image. Models for such problems usually consist of encoders which decrease spatial resolution while learning a high-dimensional representation, followed by decoders who recover the original input resolution and result in low-dimensional predictions. While encoders have been studied rigorously, relatively few studies address the decoder side. This paper presents an extensive comparison of a variety of decoders for a variety of pixel-wise tasks ranging from classification, regression to synthesis. Our contributions are: (1) decoders matter: we observe significant variance in results between different types of decoders on various problems. (2) We introduce new residual-like connections for decoders. (3) We introduce a novel decoder: bilinear additive upsampling. (4) We explore prediction artifacts.	https://doi.org/10.1007/s11263-019-01170-8	Zbigniew Wojna, Vittorio Ferrari, Sergio Guadarrama, Nathan Silberman, Liang-Chieh Chen, Alireza Fathi, Jasper R. R. Uijlings
The Menpo Benchmark for Multi-pose 2D and 3D Facial Landmark Localisation and Tracking.	In this article, we present the Menpo 2D and Menpo 3D benchmarks, two new datasets for multi-pose 2D and 3D facial landmark localisation and tracking. In contrast to the previous benchmarks such as 300W and 300VW, the proposed benchmarks contain facial images in both semi-frontal and profile pose. We introduce an elaborate semi-automatic methodology for providing high-quality annotations for both the Menpo 2D and Menpo 3D benchmarks. In Menpo 2D benchmark, different visible landmark configurations are designed for semi-frontal and profile faces, thus making the 2D face alignment full-pose. In Menpo 3D benchmark, a united landmark configuration is designed for both semi-frontal and profile faces based on the correspondence with a 3D face model, thus making face alignment not only full-pose but also corresponding to the real-world 3D space. Based on the considerable number of annotated images, we organised Menpo 2D Challenge and Menpo 3D Challenge for face alignment under large pose variations in conjunction with CVPR 2017 and ICCV 2017, respectively. The results of these challenges demonstrate that recent deep learning architectures, when trained with the abundant data, lead to excellent results. We also provide a very simple, yet effective solution, named Cascade Multi-view Hourglass Model, to 2D and 3D face alignment. In our method, we take advantage of all 2D and 3D facial landmark annotations in a joint way. We not only capitalise on the correspondences between the semi-frontal and profile 2D facial landmarks but also employ joint supervision from both 2D and 3D facial landmarks. Finally, we discuss future directions on the topic of face alignment.	https://doi.org/10.1007/s11263-018-1134-y	Jiankang Deng, Anastasios Roussos, Grigorios Chrysos, Evangelos Ververas, Irene Kotsia, Jie Shen, Stefanos Zafeiriou
Understanding Image Representations by Measuring Their Equivariance and Equivalence.	Despite the importance of image representations such as histograms of oriented gradients and deep Convolutional Neural Networks (CNN), our theoretical understanding of them remains limited. Aimed at filling this gap, we investigate two key mathematical properties of representations: equivariance and equivalence. Equivariance studies how transformations of the input image are encoded by the representation, invariance being a special case where a transformation has no effect. Equivalence studies whether two representations, for example two different parameterizations of a CNN, two different layers, or two different CNN architectures, share the same visual information or not. A number of methods to establish these properties empirically are proposed, including introducing transformation and stitching layers in CNNs. These methods are then applied to popular representations to reveal insightful aspects of their structure, including clarifying at which layers in a CNN certain geometric invariances are achieved and how various CNN architectures differ. We identify several predictors of geometric and architectural compatibility, including the spatial resolution of the representation and the complexity and depth of the models. While the focus of the paper is theoretical, direct applications to structured-output regression are demonstrated too.	https://doi.org/10.1007/s11263-018-1098-y	Karel Lenc, Andrea Vedaldi
Understanding and Improving Kernel Local Descriptors.	We propose a multiple-kernel local-patch descriptor based on efficient match kernels from pixel gradients. It combines two parametrizations of gradient position and direction, each parametrization provides robustness to a different type of patch mis-registration: polar parametrization for noise in the patch dominant orientation detection, Cartesian for imprecise location of the feature point. Combined with whitening of the descriptor space, that is learned with or without supervision, the performance is significantly improved. We analyze the effect of the whitening on patch similarity and demonstrate its semantic meaning. Our unsupervised variant is the best performing descriptor constructed without the need of labeled data. Despite the simplicity of the proposed descriptor, it competes well with deep learning approaches on a number of different tasks.	https://doi.org/10.1007/s11263-018-1137-8	Arun Mukundan, Giorgos Tolias, Andrei Bursuc, Hervé Jégou, Ondrej Chum
Unsupervised Binary Representation Learning with Deep Variational Networks.	Learning to hash is regarded as an efficient approach for image retrieval and many other big-data applications. Recently, deep learning frameworks are adopted for image hashing, suggesting an alternative way to formulate the encoding function other than the conventional projections. Although deep learning has been proved to be successful in supervised hashing, existing unsupervised deep hashing techniques still cannot produce leading performance compared with the non-deep methods, as it is hard to unveil the intrinsic structure of the whole sample space by simply regularizing the output codes within each single training batch. To tackle this problem, in this paper, we propose a novel unsupervised deep hashing model, named deep variational binaries (DVB). The conditional auto-encoding variational Bayesian networks are introduced in this work to exploit the feature space structure of the training data using the latent variables. Integrating the probabilistic inference process with hashing objectives, the proposed DVB model estimates the statistics of data representations, and thus produces compact binary codes. Experimental results on three benchmark datasets, i.e., CIFAR-10, SUN-397 and NUS-WIDE, demonstrate that DVB outperforms state-of-the-art unsupervised hashing methods with significant margins.	https://doi.org/10.1007/s11263-019-01166-4	Yuming Shen, Li Liu, Ling Shao
Unsupervised Learning of Foreground Object Segmentation.	Unsupervised learning represents one of the most interesting challenges in computer vision today. The task has an immense practical value with many applications in artificial intelligence and emerging technologies, as large quantities of unlabeled images and videos can be collected at low cost. In this paper, we address the unsupervised learning problem in the context of segmenting the main foreground objects in single images. We propose an unsupervised learning system, which has two pathways, the teacher and the student, respectively. The system is designed to learn over several generations of teachers and students. At every generation the teacher performs unsupervised object discovery in videos or collections of images and an automatic selection module picks up good frame segmentations and passes them to the student pathway for training. At every generation multiple students are trained, with different deep network architectures to ensure a better diversity. The students at one iteration help in training a better selection module, forming together a more powerful teacher pathway at the next iteration. In experiments, we show that the improvement in the selection power, the training of multiple students and the increase in unlabeled data significantly improve segmentation accuracy from one generation to the next. Our method achieves top results on three current datasets for object discovery in video, unsupervised image segmentation and saliency detection. At test time, the proposed system is fast, being one to two orders of magnitude faster than published unsupervised methods. We also test the strength of our unsupervised features within a well known transfer learning setup and achieve competitive performance, proving that our unsupervised approach can be reliably used in a variety of computer vision tasks.	https://doi.org/10.1007/s11263-019-01183-3	Ioana Croitoru, Simion-Vlad Bogolin, Marius Leordeanu
Video Enhancement with Task-Oriented Flow.	Many video enhancement algorithms rely on optical flow to register frames in a video sequence. Precise flow estimation is however intractable; and optical flow itself is often a sub-optimal representation for particular video processing tasks. In this paper, we propose task-oriented flow (TOFlow), a motion representation learned in a self-supervised, task-specific manner. We design a neural network with a trainable motion estimation component and a video processing component, and train them jointly to learn the task-oriented flow. For evaluation, we build Vimeo-90K, a large-scale, high-quality video dataset for low-level video processing. TOFlow outperforms traditional optical flow on standard benchmarks as well as our Vimeo-90K dataset in three video processing tasks: frame interpolation, video denoising/deblocking, and video super-resolution.	https://doi.org/10.1007/s11263-018-01144-2	Tianfan Xue, Baian Chen, Jiajun Wu, Donglai Wei, William T. Freeman
