title	abstract	url	authors
Deep Affect Prediction in-the-Wild: Aff-Wild Database and Challenge, Deep Architectures, and Beyond.	Automatic understanding of human affect using visual signals is of great importance in everyday human–machine interactions. Appraising human emotional states, behaviors and reactions displayed in real-world settings, can be accomplished using latent continuous dimensions (e.g., the circumplex model of affect). Valence (i.e., how positive or negative is an emotion) and arousal (i.e., power of the activation of the emotion) constitute popular and effective representations for affect. Nevertheless, the majority of collected datasets this far, although containing naturalistic emotional states, have been captured in highly controlled recording conditions. In this paper, we introduce the Aff-Wild benchmark for training and evaluating affect recognition algorithms. We also report on the results of the First Affect-in-the-wild Challenge (Aff-Wild Challenge) that was recently organized in conjunction with CVPR 2017 on the Aff-Wild database, and was the first ever challenge on the estimation of valence and arousal in-the-wild. Furthermore, we design and extensively train an end-to-end deep neural architecture which performs prediction of continuous emotion dimensions based on visual cues. The proposed deep learning architecture, AffWildNet, includes convolutional and recurrent neural network layers, exploiting the invariant properties of convolutional features, while also modeling temporal dynamics that arise in human behavior via the recurrent layers. The AffWildNet produced state-of-the-art results on the Aff-Wild Challenge. We then exploit the AffWild database for learning features, which can be used as priors for achieving best performances both for dimensional, as well as categorical emotion recognition, using the RECOLA, AFEW-VA and EmotiW 2017 datasets, compared to all other methods designed for the same goal. The database and emotion recognition models are available at http://ibug.doc.ic.ac.uk/resources/first-affect-wild-challenge.	https://doi.org/10.1007/s11263-019-01158-4	Dimitrios Kollias, Panagiotis Tzirakis, Mihalis A. Nicolaou, Athanasios Papaioannou, Guoying Zhao, Björn W. Schuller, Irene Kotsia, Stefanos Zafeiriou
Deep Appearance Models: A Deep Boltzmann Machine Approach for Face Modeling.	"The ""interpretation through synthesis"" approach to analyze face images, particularly Active Appearance Models (AAMs) method, has become one of the most successful face modeling approaches over the last two decades. AAM models have ability to represent face images through synthesis using a controllable parameterized Principal Component Analysis (PCA) model. However, the accuracy and robustness of the synthesized faces of AAMs are highly depended on the training sets and inherently on the generalizability of PCA subspaces. This paper presents a novel Deep Appearance Models (DAMs) approach, an efficient replacement for AAMs, to accurately capture both shape and texture of face images under large variations. In this approach, three crucial components represented in hierarchical layers are modeled using the Deep Boltzmann Machines (DBM) to robustly capture the variations of facial shapes and appearances. DAMs are therefore superior to AAMs in inferencing a representation for new face images under various challenging conditions. The proposed approach is evaluated in various applications to demonstrate its robustness and capabilities, i.e. facial super-resolution reconstruction, facial off-angle reconstruction or face frontalization, facial occlusion removal and age estimation using challenging face databases, i.e. Labeled Face Parts in the Wild, Helen and FG-NET. Comparing to AAMs and other deep learning based approaches, the proposed DAMs achieve competitive results in those applications, thus this showed their advantages in handling occlusions, facial representation, and reconstruction."	https://doi.org/10.1007/s11263-018-1113-3	Chi Nhan Duong, Khoa Luu, Kha Gia Quach, Tien D. Bui
Deep Learning Approach in Aerial Imagery for Supporting Land Search and Rescue Missions.	In this paper, we propose a novel approach to person detection in UAV aerial images for search and rescue tasks in Mediterranean and Sub-Mediterranean landscapes. Person detection in very high spatial resolution images involves target objects that are relatively small and often camouflaged within the environment; thus, such detection is a challenging and demanding task. The proposed method starts by reducing the search space through a visual attention algorithm that detects the salient or most prominent segments in the image. To reduce the number of non-relevant salient regions, we selected those regions most likely to contain a person using pre-trained and fine-tuned convolutional neural networks (CNNs) for detection. We established a special database called HERIDAL to train and test our model. This database was compiled for training purposes, and it contains over 68,750 image patches of wilderness acquired from an aerial perspective as well as approximately 500 labelled full-size real-world images intended for testing purposes. The proposed method achieved a detection rate of 88.9% and a precision of 34.8%, which demonstrates better effectiveness than the system currently used by Croatian Mountain search and rescue (SAR) teams (IPSAR), which is based on mean-shift segmentation. We also used the HERIDAL database to train and test a state-of-the-art region proposal network, Faster R-CNN (Ren et al. in Faster R-CNN: towards real-time object detection with region proposal networks, 2015. CoRR arXiv:1506.01497), which achieved comparable but slightly worse results than those of our proposed method.	https://doi.org/10.1007/s11263-019-01177-1	Dunja Bozic-Stulic, Zeljko Marusic, Sven Gotovac
Deep Supervised Hashing for Fast Image Retrieval.	"In this paper, we present a new hashing method to learn compact binary codes for highly efficient image retrieval on large-scale datasets. While the complex image appearance variations still pose a great challenge to reliable retrieval, in light of the recent progress of Convolutional Neural Networks (CNNs) in learning robust image representation on various vision tasks, this paper proposes a novel Deep Supervised Hashing method to learn compact similarity-preserving binary code for the huge body of image data. Specifically, we devise a CNN architecture that takes pairs/triplets of images as training inputs and encourages the output of each image to approximate discrete values (e.g.
/
). To this end, the loss functions are elaborately designed to maximize the discriminability of the output space by encoding the supervised information from the input image pairs/triplets, and simultaneously imposing regularization on the real-valued outputs to approximate the desired discrete values. For image retrieval, new-coming query images can be easily encoded by forward propagating through the network and then quantizing the network outputs to binary codes representation. Extensive experiments on three large scale datasets CIFAR-10, NUS-WIDE, and SVHN show the promising performance of our method compared with the state-of-the-arts."	https://doi.org/10.1007/s11263-019-01174-4	Haomiao Liu, Ruiping Wang, Shiguang Shan, Xilin Chen
Deep, Landmark-Free FAME: Face Alignment, Modeling, and Expression Estimation.	We present a novel method for modeling 3D face shape, viewpoint, and expression from a single, unconstrained photo. Our method uses three deep convolutional neural networks to estimate each of these components separately. Importantly, unlike others, our method does not use facial landmark detection at test time; instead, it estimates these properties directly from image intensities. In fact, rather than using detectors, we show how accurate landmarks can be obtained as a by-product of our modeling process. We rigorously test our proposed method. To this end, we raise a number of concerns with existing practices used in evaluating face landmark detection methods. In response to these concerns, we propose novel paradigms for testing the effectiveness of rigid and non-rigid face alignment methods without relying on landmark detection benchmarks. We evaluate rigid face alignment by measuring its effects on face recognition accuracy on the challenging IJB-A and IJB-B benchmarks. Non-rigid, expression estimation is tested on the CK+ and EmotiW'17 benchmarks for emotion classification. We do, however, report the accuracy of our approach as a landmark detector for 3D landmarks on AFLW2000-3D and 2D landmarks on 300W and AFLW-PIFA. A surprising conclusion of these results is that better landmark detection accuracy does not necessarily translate to better face processing. Parts of this paper were previously published by Tran et al. (2017) and Chang et al. (2017, 2018).	https://doi.org/10.1007/s11263-019-01151-x	Feng-Ju Chang, Anh Tuan Tran, Tal Hassner, Iacopo Masi, Ram Nevatia, Gérard G. Medioni
Detecting and Mitigating Adversarial Perturbations for Robust Face Recognition.	Deep neural network (DNN) architecture based models have high expressive power and learning capacity. However, they are essentially a black box method since it is not easy to mathematically formulate the functions that are learned within its many layers of representation. Realizing this, many researchers have started to design methods to exploit the drawbacks of deep learning based algorithms questioning their robustness and exposing their singularities. In this paper, we attempt to unravel three aspects related to the robustness of DNNs for face recognition: (i) assessing the impact of deep architectures for face recognition in terms of vulnerabilities to attacks, (ii) detecting the singularities by characterizing abnormal filter response behavior in the hidden layers of deep networks; and (iii) making corrections to the processing pipeline to alleviate the problem. Our experimental evaluation using multiple open-source DNN-based face recognition networks, and three publicly available face databases demonstrates that the performance of deep learning based face recognition algorithms can suffer greatly in the presence of such distortions. We also evaluate the proposed approaches on four existing quasi-imperceptible distortions: DeepFool, Universal adversarial perturbations, \(l_2\), and Elastic-Net (EAD). The proposed method is able to detect both types of attacks with very high accuracy by suitably designing a classifier using the response of the hidden layers in the network. Finally, we present effective countermeasures to mitigate the impact of adversarial attacks and improve the overall robustness of DNN-based face recognition.	https://doi.org/10.1007/s11263-019-01160-w	Gaurav Goswami, Akshay Agarwal, Nalini K. Ratha, Richa Singh, Mayank Vatsa
Disentangling Geometry and Appearance with Regularised Geometry-Aware Generative Adversarial Networks.	Deep generative models have significantly advanced image generation, enabling generation of visually pleasing images with realistic texture. Apart from the texture, it is the shape geometry of objects that strongly dictates their appearance. However, currently available generative models do not incorporate geometric information into the image generation process. This often yields visual objects of degenerated quality. In this work, we propose a regularized Geometry-Aware Generative Adversarial Network (GAGAN) which disentangles appearance and shape in the latent space. This regularized GAGAN enables the generation of images with both realistic texture and shape. Specifically, we condition the generator on a statistical shape prior. The prior is enforced through mapping the generated images onto a canonical coordinate frame using a differentiable geometric transformation. In addition to incorporating geometric information, this constrains the search space and increases the model's robustness. We show that our approach is versatile, able to generalise across domains (faces, sketches, hands and cats) and sample sizes (from as little as \(\sim \, 200{-}30{,}000\) to more than 200, 000). We demonstrate superior performance through extensive quantitative and qualitative experiments in a variety of tasks and settings. Finally, we leverage our model to automatically and accurately detect errors or drifting in facial landmarks detection and tracking in-the-wild.	https://doi.org/10.1007/s11263-019-01155-7	Linh Tran, Jean Kossaifi, Yannis Panagakis, Maja Pantic
Efficient Feature Matching via Nonnegative Orthogonal Relaxation.	Feature matching problem that incorporates pair-wise constraints can be formulated as an Integer Quadratic Programming (IQP) problem with one-to-one matching constraint. Since it is NP-hard, relaxation models are required. One main challenge for optimizing IQP matching is how to incorporate the discrete one-to-one matching constraint in IQP matching optimization. In this paper, we present a new feature matching relaxation model, called Nonnegative Orthogonal Relaxation (NOR), that aims to optimize IQP matching problem in nonnegative orthogonal domain. One important benefit of the proposed NOR model is that it can naturally incorporate the discrete one-to-one matching constraint in its optimization and can return a desired sparse (approximate discrete) solution for the problem. An efficient and effective update algorithm has been developed to solve the proposed NOR model. Promising experimental results on several benchmark datasets demonstrate the effectiveness and efficiency of the proposed NOR method.	https://doi.org/10.1007/s11263-019-01185-1	Bo Jiang, Jin Tang, Bin Luo
Efficiently Annotating Object Images with Absolute Size Information Using Mobile Devices.	The projection of a real world scenery to a planar image sensor inherits the loss of information about the 3D structure as well as the absolute dimensions of the scene. For image analysis and object classification tasks, however, absolute size information can make results more accurate. Today, the creation of size annotated image datasets is effort intensive and typically requires measurement equipment not available to public image contributors. In this paper, we propose an effective annotation method that utilizes the camera within smart mobile devices to capture the missing size information along with the image. The approach builds on the fact that with a camera, calibrated to a specific object distance, lengths can be measured in the object's plane. We use the camera's minimum focus distance as calibration distance and propose an adaptive feature matching process for precise computation of the scale change between two images facilitating measurements on larger object distances. Eventually, the measured object is segmented and its size information is annotated for later analysis. A user study showed that humans are able to retrieve the calibration distance with a low variance. The proposed approach facilitates a measurement accuracy comparable to manual measurement with a ruler and outperforms state-of-the-art methods in terms of accuracy and repeatability. Consequently, the proposed method allows in-situ size annotation of objects in images without the need for additional equipment or an artificial reference object in the scene.	https://doi.org/10.1007/s11263-018-1093-3	Martin Hofmann, Marco Seeland, Patrick Mäder
End-to-End Learning of Latent Deformable Part-Based Representations for Object Detection.	Object detection methods usually represent objects through rectangular bounding boxes from which they extract features, regardless of their actual shapes. In this paper, we apply deformations to regions in order to learn representations better fitted to objects. We introduce DP-FCN, a deep model implementing this idea by learning to align parts to discriminative elements of objects in a latent way, i.e. without part annotation. This approach has two main assets: it builds invariance to local transformations, thus improving recognition, and brings geometric information to describe objects more finely, leading to a more accurate localization. We further develop both features in a new model named DP-FCN2.0 by explicitly learning interactions between parts. Alignment is done with an in-network joint optimization of all parts based on a CRF with custom potentials, and deformations are influencing localization through a bilinear product. We validate our models on PASCAL VOC and MS COCO datasets and show significant gains. DP-FCN2.0 achieves state-of-the-art results of 83.3 and 81.2% on VOC 2007 and 2012 with VOC data only.	https://doi.org/10.1007/s11263-018-1109-z	Taylor Mordan, Nicolas Thome, Gilles Hénaff, Matthieu Cord
Equivalent Constraints for Two-View Geometry: Pose Solution/Pure Rotation Identification and 3D Reconstruction.	Two-view relative pose estimation and structure reconstruction is a classical problem in computer vision. The typical methods usually employ the singular value decomposition of the essential matrix to get multiple solutions of the relative pose, from which the right solution is picked out by reconstructing the three-dimension (3D) feature points and imposing the constraint of positive depth. This paper revisits the two-view geometry problem and discovers that the two-view imaging geometry is equivalently governed by a Pair of new Pose-Only (PPO) constraints: the same-side constraint and the intersection constraint. From the perspective of solving equation, the complete pose solutions of the essential matrix are explicitly derived and we rigorously prove that the orientation part of the pose can still be recovered in the case of pure rotation. The PPO constraints are simplified and formulated in the form of inequalities to directly identify the right pose solution with no need of 3D reconstruction and the 3D reconstruction can be analytically achieved from the identified right pose. Furthermore, the intersection inequality also enables a robust criterion for pure rotation identification. Experiment results validate the correctness of analyses and the robustness of the derived pose solution/pure rotation identification and analytical 3D reconstruction.	https://doi.org/10.1007/s11263-018-1136-9	Qi Cai, Yuanxin Wu, Lilian Zhang, Peike Zhang
Estimation of 3D Category-Specific Object Structure: Symmetry, Manhattan and/or Multiple Images.	Many man-made objects have intrinsic symmetries and often Manhattan structure. By assuming an orthographic or a weak perspective projection model, this paper addresses the estimation of 3D structures and camera projection using symmetry and/or Manhattan structure cues, for the two cases when the input is a single image or multiple images from the same category, e.g. multiple different cars from various viewpoints. More specifically, analysis on the single image case shows that Manhattan alone is sufficient to recover the camera projection and then the 3D structure can be reconstructed uniquely by exploiting symmetry. But Manhattan structure can be hard to observe from a single image due to occlusion. Hence, we extend to the multiple-image case which can also exploit symmetry but does not require Manhattan structure. We propose novel structure from motion methods for both rigid and non-rigid object deformations, which exploit symmetry and use multiple images from the same object category as input. We perform experiments on the Pascal3D+ dataset with either human labeled 2D keypoints or with 2D keypoints localized from a convolutional neural network. The results show that our methods which exploit symmetry significantly outperform the baseline methods.	https://doi.org/10.1007/s11263-019-01195-z	Yuan Gao, Alan L. Yuille
Exploiting the Anisotropy of Correlation Filter Learning for Visual Tracking.	Correlation filtering based tracking model has received significant attention and achieved great success in terms of both tracking accuracy and computational complexity. However, due to the limitation of the loss function, current correlation filtering paradigm could not reliably respond to the abrupt appearance changes of the target object. This study focuses on improving the robustness of the correlation filter learning. An anisotropy of the filter response is observed and analyzed for the correlation filtering based tracking model, through which the overfitting issue of previous methods is alleviated. Three sparsity related loss functions are proposed to exploit the anisotropy, leading to three implementations of visual trackers, correspondingly resulting in improved overall tracking performance. A large number of experiments are conducted and these experimental results demonstrate that the proposed approach greatly improves the robustness of the learned correlation filter. The proposed trackers performs comparably against state-of-the-art tracking methods on four latest standard tracking benchmark datasets.	https://doi.org/10.1007/s11263-019-01156-6	Yao Sui, Ziming Zhang, Guanghui Wang, Yafei Tang, Li Zhang
Face Mask Extraction in Video Sequence.	Inspired by the recent development of deep network-based methods in semantic image segmentation, we introduce an end-to-end trainable model for face mask extraction in video sequence. Comparing to landmark-based sparse face shape representation, our method can produce the segmentation masks of individual facial components, which can better reflect their detailed shape variations. By integrating convolutional LSTM (ConvLSTM) algorithm with fully convolutional networks (FCN), our new ConvLSTM-FCN model works on a per-sequence basis and takes advantage of the temporal correlation in video clips. In addition, we also propose a novel loss function, called segmentation loss, to directly optimise the intersection over union (IoU) performances. In practice, to further increase segmentation accuracy, one primary model and two additional models were trained to focus on the face, eyes, and mouth regions, respectively. Our experiment shows the proposed method has achieved a 16.99% relative improvement (from 54.50 to 63.76% mean IoU) over the baseline FCN model on the 300 Videos in the Wild (300VW) dataset.	https://doi.org/10.1007/s11263-018-1130-2	Yujiang Wang, Bingnan Luo, Jie Shen, Maja Pantic
Face-Specific Data Augmentation for Unconstrained Face Recognition.	We identify two issues as key to developing effective face recognition systems: maximizing the appearance variations of training images and minimizing appearance variations in test images. The former is required to train the system for whatever appearance variations it will ultimately encounter and is often addressed by collecting massive training sets with millions of face images. The latter involves various forms of appearance normalization for removing distracting nuisance factors at test time and making test faces easier to compare. We describe novel, efficient face-specific data augmentation techniques and show them to be ideally suited for both purposes. By using knowledge of faces, their 3D shapes, and appearances, we show the following: (a) We can artificially enrich training data for face recognition with face-specific appearance variations. (b) This synthetic training data can be efficiently produced online, thereby reducing the massive storage requirements of large-scale training sets and simplifying training for many appearance variations. Finally, (c) The same, fast data augmentation techniques can be applied at test time to reduce appearance variations and improve face representations. Together, with additional technical novelties, we describe a highly effective face recognition pipeline which, at the time of submission, obtains state-of-the-art results across multiple benchmarks. Portions of this paper were previously published by Masi et al. (European conference on computer vision, Springer, pp 579–596, 2016b, International conference on automatic face and gesture recognition, 2017).	https://doi.org/10.1007/s11263-019-01178-0	Iacopo Masi, Anh Tuan Tran, Tal Hassner, Gozde Sahin, Gérard G. Medioni
Facial Landmark Detection: A Literature Survey.	"The locations of the fiducial facial landmark points around facial components and facial contour capture the rigid and non-rigid facial deformations due to head movements and facial expressions. They are hence important for various facial analysis tasks. Many facial landmark detection algorithms have been developed to automatically detect those key points over the years, and in this paper, we perform an extensive review of them. We classify the facial landmark detection algorithms into three major categories: holistic methods, Constrained Local Model (CLM) methods, and the regression-based methods. They differ in the ways to utilize the facial appearance and shape information. The holistic methods explicitly build models to represent the global facial appearance and shape information. The CLMs explicitly leverage the global shape model but build the local appearance models. The regression based methods implicitly capture facial shape and appearance information. For algorithms within each category, we discuss their underlying theories as well as their differences. We also compare their performances on both controlled and in the wild benchmark datasets, under varying facial expressions, head poses, and occlusion. Based on the evaluations, we point out their respective strengths and weaknesses. There is also a separate section to review the latest deep learning based algorithms. The survey also includes a listing of the benchmark databases and existing software. Finally, we identify future research directions, including combining methods in different categories to leverage their respective strengths to solve landmark detection ""in-the-wild""."	https://doi.org/10.1007/s11263-018-1097-z	Yue Wu, Qiang Ji
