title	abstract	url	authors
A Comprehensive Study on Center Loss for Deep Face Recognition.	Deep convolutional neural networks (CNNs) trained with the softmax loss have achieved remarkable successes in a number of close-set recognition problems, e.g. object recognition, action recognition, etc. Unlike these close-set tasks, face recognition is an open-set problem where the testing classes (persons) are usually different from those in training. This paper addresses the open-set property of face recognition by developing the center loss. Specifically, the center loss simultaneously learns a center for each class, and penalizes the distances between the deep features of the face images and their corresponding class centers. Training with the center loss enables CNNs to extract the deep features with two desirable properties: inter-class separability and intra-class compactness. In addition, we extend the center loss in two aspects. First, we adopt parameter sharing between the softmax loss and the center loss, to reduce the extra parameters introduced by centers. Second, we generalize the concept of center from a single point to a region in embedding space, which further allows us to account for intra-class variations. The advanced center loss significantly enhances the discriminative power of deep features. Experimental results show that our method achieves high accuracies on several important face recognition benchmarks, including Labeled Faces in the Wild, YouTube Faces, IJB-A Janus, and MegaFace Challenging 1.	https://doi.org/10.1007/s11263-018-01142-4	Yandong Wen, Kaipeng Zhang, Zhifeng Li, Yu Qiao
A Differential Approach to Shape from Polarisation: A Level-Set Characterisation.	Despite the longtime research aimed at retrieving geometrical information of an object from polarimetric imaging, physical limitations in the polarisation phenomena constrain current approaches to provide ambiguous depth estimation. As an additional constraint, polarimetric imaging formulation differs when light is reflected off the object specularly or diffusively. This introduces another source of ambiguity that current formulations cannot overcome. With the aim of deriving a formulation capable of dealing with as many heterogeneous effects as possible, we propose a differential formulation of the Shape from Polarisation problem that depends only on polarimetric images. This allows the direct geometrical characterisation of the level-set of the object keeping consistent mathematical formulation for diffuse and specular reflection. We show via synthetic and real-world experiments that diffuse and specular reflection can be easily distinguished in order to extract meaningful geometrical features from just polarimetric imaging. The inherent ambiguity of the Shape from Polarization problem becomes evident through the impossibility of reconstructing the whole surface with this differential approach. To overcome this limitation, we consider shading information elegantly embedding this new formulation into a two-light calibrated photometric stereo approach..	https://doi.org/10.1007/s11263-018-1127-x	Fotios Logothetis, Roberto Mecca, Fiorella Sgallari, Roberto Cipolla
A Robust Monocular 3D Object Tracking Method Combining Statistical and Photometric Constraints.	Both region-based methods and direct methods have become popular in recent years for tracking the 6-dof pose of an object from monocular video sequences. Region-based methods estimate the pose of the object by maximizing the discrimination between statistical foreground and background appearance models, while direct methods aim to minimize the photometric error through direct image alignment. In practice, region-based methods only care about the pixels within a narrow band of the object contour due to the level-set-based probabilistic formulation, leaving the foreground pixels beyond the evaluation band unused. On the other hand, direct methods only utilize the raw pixel information of the object, but ignore the statistical properties of foreground and background regions. In this paper, we find it beneficial to combine these two kinds of methods together. We construct a new probabilistic formulation for 3D object tracking by combining statistical constraints from region-based methods and photometric constraints from direct methods. In this way, we take advantage of both statistical property and raw pixel values of the image in a complementary manner. Moreover, in order to achieve better performance when tracking heterogeneous objects in complex scenes, we propose to increase the distinctiveness of foreground and background statistical models by partitioning the global foreground and background regions into a small number of sub-regions around the object contour. We demonstrate the effectiveness of the proposed novel strategies on a newly constructed real-world dataset containing different types of objects with ground-truth poses. Further experiments on several challenging public datasets also show that our method obtains competitive or even superior tracking results compared to previous works. In comparison with the recent state-of-art region-based method, the proposed hybrid method is proved to be more stable under silhouette pose ambiguities with a slightly lower tracking accuracy.	https://doi.org/10.1007/s11263-018-1119-x	Leisheng Zhong, Li Zhang
A Spatiotemporal Convolutional Neural Network for Automatic Pain Intensity Estimation from Facial Dynamics.	Devising computational models for detecting abnormalities reflective of diseases from facial structures is a novel and emerging field of research in automatic face analysis. In this paper, we focus on automatic pain intensity estimation from faces. This has a paramount potential diagnosis values in healthcare applications. In this context, we present a novel 3D deep model for dynamic spatiotemporal representation of faces in videos. Using several convolutional layers with diverse temporal depths, our proposed model captures a wide range of spatiotemporal variations in the faces. Moreover, we introduce a cross-architecture knowledge transfer technique for training 3D convolutional neural networks using a pre-trained 2D architecture. This strategy is a practical approach for training 3D models, especially when the size of the database is relatively small. Our extensive experiments and analysis on two benchmarking and publicly available databases, namely the UNBC-McMaster shoulder pain and the BioVid, clearly show that our proposed method consistently outperforms many state-of-the-art methods in automatic pain intensity estimation.	https://doi.org/10.1007/s11263-019-01191-3	Mohammad Tavakolian, Abdenour Hadid
An Adversarial Neuro-Tensorial Approach for Learning Disentangled Representations.	"Several factors contribute to the appearance of an object in a visual scene, including pose, illumination, and deformation, among others. Each factor accounts for a source of variability in the data, while the multiplicative interactions of these factors emulate the entangled variability, giving rise to the rich structure of visual object appearance. Disentangling such unobserved factors from visual data is a challenging task, especially when the data have been captured in uncontrolled recording conditions (also referred to as ""in-the-wild"") and label information is not available. In this paper, we propose a pseudo-supervised deep learning method for disentangling multiple latent factors of variation in face images captured in-the-wild. To this end, we propose a deep latent variable model, where the multiplicative interactions of multiple latent factors of variation are explicitly modelled by means of multilinear (tensor) structure. We demonstrate that the proposed approach indeed learns disentangled representations of facial expressions and pose, which can be used in various applications, including face editing, as well as 3D face reconstruction and classification of facial expression, identity and pose."	https://doi.org/10.1007/s11263-019-01163-7	Mengjiao Wang, Zhixin Shu, Shiyang Cheng, Yannis Panagakis, Dimitris Samaras, Stefanos Zafeiriou
An Approximate Shading Model with Detail Decomposition for Object Relighting.	We present an object relighting system that allows an artist to select an object from an image and insert it into a target scene. Through simple interactions, the system can adjust illumination on the inserted object so that it appears naturally in the scene. To support image-based relighting, we build object model from the image, and propose a perceptually-inspired approximate shading model for the relighting. It decomposes the shading field into (a) a rough shape term that can be reshaded, (b) a parametric shading detail that encodes missing features from the first term, and (c) a geometric detail term that captures fine-scale material properties. With this decomposition, the shading model combines 3D rendering and image-based composition and allows more flexible compositing than image-based methods. Quantitative evaluation and a set of user studies suggest our method is a promising alternative to existing methods of object insertion.	https://doi.org/10.1007/s11263-018-1090-6	Zicheng Liao, Kevin Karsch, Hongyi Zhang, David A. Forsyth
An Exact Robust Method to Localize a Known Sphere by Means of One Image.	In this article we provide a very robust algorithm to compute the position of the center of a sphere with known radius from one image by a calibrated camera. To our knowledge it is the first time that an exact sphere localization formula is published that only uses the (pixel) area and the ellipse center of the sphere image. Other authors either derived an approximation formula or followed the less robust and more time consuming procedure of fitting an ellipse through the detected edge pixels. Our method is analytic and deterministic, making use of the unique positive real tool of a cubic equation. We observe that the proposed area method is significantly more accurate and precise than an ellipse fitting method. Furthermore, we investigate in what conditions for sphere images the proposed exact method is preferable to the robust approximation method. These observations are validated by virtual, synthetic and real experiments.	https://doi.org/10.1007/s11263-018-1139-6	Rudi Penne, Bart Ribbens, Pedro Roios
Blended Emotion in-the-Wild: Multi-label Facial Expression Recognition Using Crowdsourced Annotations and Deep Locality Feature Learning.	Comprehending different categories of facial expressions plays a great role in the design of computational model analyzing human perceived and affective state. Authoritative studies have revealed that facial expressions in human daily life are in multiple or co-occurring mental states. However, due to the lack of valid datasets, most previous studies are still restricted to basic emotions with single label. In this paper, we present a novel multi-label facial expression database, RAF-ML, along with a new deep learning algorithm, to address this problem. Specifically, a crowdsourcing annotation of 1.2 million labels from 315 participants was implemented to identify the multi-label expressions collected from social network, then EM algorithm was designed to filter out unreliable labels. For all we know, RAF-ML is the first database in the wild that provides with crowdsourced cognition for multi-label expressions. Focusing on the ambiguity and continuity of blended expressions, we propose a new deep manifold learning network, called Deep Bi-Manifold CNN, to learn the discriminative feature for multi-label expressions by jointly preserving the local affinity of deep features and the manifold structures of emotion labels. Furthermore, a deep domain adaption method is leveraged to extend the deep manifold features learned from RAF-ML to other expression databases under various imaging conditions and cultures. Extensive experiments on the RAF-ML and other diverse databases (JAFFE, CK\(+\), SFEW and MMI) show that the deep manifold feature is not only superior in multi-label expression recognition in the wild, but also captures the elemental and generic components that are effective for a wide range of expression recognition tasks.	https://doi.org/10.1007/s11263-018-1131-1	Li Shang, Weihong Deng
Blind Image Deblurring via Deep Discriminative Priors.	We present an effective blind image deblurring method based on a data-driven discriminative prior. Our work is motivated by the fact that a good image prior should favor sharp images over blurred ones. In this work, we formulate the image prior as a binary classifier using a deep convolutional neural network. The learned prior is able to distinguish whether an input image is sharp or not. Embedded into the maximum a posterior framework, it helps blind deblurring in various scenarios, including natural, face, text, and low-illumination images, as well as non-uniform deblurring. However, it is difficult to optimize the deblurring method with the learned image prior as it involves a non-linear neural network. In this work, we develop an efficient numerical approach based on the half-quadratic splitting method and gradient descent algorithm to optimize the proposed model. Furthermore, we extend the proposed model to handle image dehazing. Both qualitative and quantitative experimental results show that our method performs favorably against the state-of-the-art algorithms as well as domain-specific image deblurring approaches.	https://doi.org/10.1007/s11263-018-01146-0	Lerenhan Li, Jinshan Pan, Wei-Sheng Lai, Changxin Gao, Nong Sang, Ming-Hsuan Yang
CU-Net: Component Unmixing Network for Textile Fiber Identification.	Image-based nondestructive textile fiber identification is a challenging computer vision problem, that is practically useful in fashion, decoration, and design. Although deep learning now outperforms humans in many scenarios such as face and object recognition, image-based fiber identification is still an open problem for deep learning given imbalanced sample and small sample size samples. In this paper, we propose the Component Unmixing Network (CU-Net) for nondestructive textile fiber identification. CU-Net learns effective representations given imbalanced sample and small sample size samples to achieve high-performance textile fiber identification. CU-Net comprises a Deep Feature Extraction Module (DFE-Module) and a Component Unmixing Module (CU-Module). Initially, mixed deep features are extracted by DFE-Module from the input textile patches. Then, CU-Module is employed to extract unmixed representations of different fibers from the mixed deep features. In CU-Module, we introduce a self-interchange and a restraining loss to reduce the mixture between representations of different fibers. Furthermore, we extend CU-Net to the proportion analysis task with very good effect. Extensive experiments demonstrate that: (1) self-interchange and the restraining loss effectively unmix different fiber representations and improve fiber identification accuracy; and (2) CU-Net achieves more accurate fiber identification than the current state-of-the-art multi-label classification methods.	https://doi.org/10.1007/s11263-019-01199-9	Zunlei Feng, Weixin Liang, Daocheng Tao, Li Sun, Anxiang Zeng, Mingli Song
Click Carving: Interactive Object Segmentation in Images and Videos with Point Clicks.	We present a novel form of interactive object segmentation called Click Carving which enables accurate segmentation of objects in images and videos with only a few point clicks. Whereas conventional interactive pipelines take the user's initialization as a starting point, we show the value in the system taking lead even in initialization. In particular, for a given image or a video frame, the system precomputes a ranked list of thousands of possible segmentation hypotheses (also referred to as object region proposals) using appearance and motion cues. Then, the user looks at the top ranked proposals, and clicks on the object boundary to carve away erroneous ones. This process iterates (typically 2–3 times), and each time the system revises the top ranked proposal set, until the user is satisfied with a resulting segmentation mask. In the case of images, this mask is considered as the final object segmentation. However in the case of videos, the object region proposals rely on motion as well, and the resulting segmentation mask in the first frame is further propagated across the video to obtain a complete spatio-temporal object tube. On six challenging image and video datasets, we provide extensive comparisons with both existing work and simpler alternative methods. In all, the proposed Click Carving approach strikes an excellent of accuracy and human effort. It outperforms all similarly fast methods, and is competitive or better than those requiring 2–12 times the effort.	https://doi.org/10.1007/s11263-019-01184-2	Suyog Dutt Jain, Kristen Grauman
Combining Multiple Cues for Visual Madlibs Question Answering.	This paper presents an approach for answering fill-in-the-blank multiple choice questions from the Visual Madlibs dataset. Instead of generic and commonly used representations trained on the ImageNet classification task, our approach employs a combination of networks trained for specialized tasks such as scene recognition, person activity classification, and attribute prediction. We also present a method for localizing phrases from candidate answers in order to provide spatial support for feature extraction. We map each of these features, together with candidate answers, to a joint embedding space through normalized canonical correlation analysis (nCCA). Finally, we solve an optimization problem to learn to combine scores from nCCA models trained on multiple cues to select the best answer. Extensive experimental results show a significant improvement over the previous state of the art and confirm that answering questions from a wide range of types benefits from examining a variety of image cues and carefully choosing the spatial support for feature extraction.	https://doi.org/10.1007/s11263-018-1096-0	Tatiana Tommasi, Arun Mallya, Bryan A. Plummer, Svetlana Lazebnik, Alexander C. Berg, Tamara L. Berg
Complete 3D Scene Parsing from an RGBD Image.	One major goal of vision is to infer physical models of objects, surfaces, and their layout from sensors. In this paper, we aim to interpret indoor scenes from one RGBD image. Our representation encodes the layout of orthogonal walls and the extent of objects, modeled with CAD-like 3D shapes. We parse both the visible and occluded portions of the scene and all observable objects, producing a complete 3D parse. Such a scene interpretation is useful for robotics and visual reasoning, but difficult to produce due to the well-known challenge of segmentation, the high degree of occlusion, and the diversity of objects in indoor scenes. We take a data-driven approach, generating sets of potential object regions, matching to regions in training images, and transferring and aligning associated 3D models while encouraging fit to observations and spatial consistency. We use support inference to aid interpretation and propose a retrieval scheme that uses convolutional neural networks to classify regions and retrieve objects with similar shapes. We demonstrate the performance of our method on our newly annotated NYUd v2 dataset (Silberman et al., in: Computer vision-ECCV, 2012, pp 746–760, 2012) with detailed 3D shapes.	https://doi.org/10.1007/s11263-018-1133-z	Chuhang Zou, Ruiqi Guo, Zhizhong Li, Derek Hoiem
Context-Based Path Prediction for Targets with Switching Dynamics.	Anticipating future situations from streaming sensor data is a key perception challenge for mobile robotics and automated vehicles. We address the problem of predicting the path of objects with multiple dynamic modes. The dynamics of such targets can be described by a Switching Linear Dynamical System (SLDS). However, predictions from this probabilistic model cannot anticipate when a change in dynamic mode will occur. We propose to extract various types of cues with computer vision to provide context on the target's behavior, and incorporate these in a Dynamic Bayesian Network (DBN). The DBN extends the SLDS by conditioning the mode transition probabilities on additional context states. We describe efficient online inference in this DBN for probabilistic path prediction, accounting for uncertainty in both measurements and target behavior. Our approach is illustrated on two scenarios in the Intelligent Vehicles domain concerning pedestrians and cyclists, so-called Vulnerable Road Users (VRUs). Here, context cues include the static environment of the VRU, its dynamic environment, and its observed actions. Experiments using stereo vision data from a moving vehicle demonstrate that the proposed approach results in more accurate path prediction than SLDS at the relevant short time horizon (1 s). It slightly outperforms a computationally more demanding state-of-the-art method.	https://doi.org/10.1007/s11263-018-1104-4	Julian F. P. Kooij, Fabian Flohr, Ewoud A. I. Pool, Dariu M. Gavrila
Contrast Invariant SNR and Isotonic Regressions.	We design an image quality measure independent of contrast changes, which are defined as a set of transformations preserving an order between the level lines of an image. This problem can be expressed as an isotonic regression problem. Depending on the definition of a level line, the partial order between adjacent regions can be defined through chains, polytrees or directed acyclic graphs. We provide a few analytic properties of the minimizers and design original optimization procedures together with a full complexity analysis. The methods worst case complexities range from O(n) for chains, to O(n\log n ) for polytrees and O(\frac{n^2}{\sqrt{\epsilon }}) for directed acyclic graphs, where n is the number of pixels and \epsilon is a relative precision. The proposed algorithms have potential applications in change detection, stereo-vision, image registration, color image processing or image fusion. A C++ implementation with Matlab headers is available at https://github.com/pierre-weiss/contrast_invariant_snr.	https://doi.org/10.1007/s11263-019-01161-9	Pierre Weiss, Paul Escande, Gabriel Bathie, Yiqiu Dong
Cross-Domain Image Matching with Deep Feature Maps.	We investigate the problem of automatically determining what type of shoe left an impression found at a crime scene. This recognition problem is made difficult by the variability in types of crime scene evidence (ranging from traces of dust or oil on hard surfaces to impressions made in soil) and the lack of comprehensive databases of shoe outsole tread patterns. We find that mid-level features extracted by pre-trained convolutional neural nets are surprisingly effective descriptors for this specialized domains. However, the choice of similarity measure for matching exemplars to a query image is essential to good performance. For matching multi-channel deep features, we propose the use of multi-channel normalized cross-correlation and analyze its effectiveness. Our proposed metric significantly improves performance in matching crime scene shoeprints to laboratory test impressions. We also show its effectiveness in other cross-domain image retrieval problems: matching facade images to segmentation labels and aerial photos to map images. Finally, we introduce a discriminatively trained variant and fine-tune our system through our proposed metric, obtaining state-of-the-art performance.	https://doi.org/10.1007/s11263-018-01143-3	Bailey Kong, James Steven Supancic III, Deva Ramanan, Charless C. Fowlkes
