title	abstract	url	authors
A Baseline for Detecting Misclassified and Out-of-Distribution Examples in Neural Networks	We consider the two related problems of detecting if an example is misclassified or out-of-distribution. We present a simple baseline that utilizes probabilities from softmax distributions. Correctly classified examples tend to have greater maximum softmax probabilities than erroneously classified and out-of-distribution examples, allowing for their detection. We assess performance by defining several tasks in computer vision, natural language processing, and automatic speech recognition, showing the effectiveness of this baseline across all. We then show the baseline can sometimes be surpassed, demonstrating the room for future research on these underexplored detection tasks.	https://openreview.net/forum?id=Hkg4TI9xl	Dan Hendrycks, Kevin Gimpel
A Compare-Aggregate Model for Matching Text Sequences	"Many NLP tasks including machine comprehension, answer selection and text entailment require the comparison between sequences. Matching the important units between sequences is a key to solve these problems. In this paper, we present a general ""compare-aggregate"" framework that performs word-level matching followed by aggregation using Convolutional Neural Networks. We particularly focus on the different comparison functions we can use to match two vectors. We use four different datasets to evaluate the model. We find that some simple comparison functions based on element-wise operations can work better than standard neural network and neural tensor network."	https://openreview.net/forum?id=HJTzHtqee	Shuohang Wang, Jing Jiang
A Compositional Object-Based Approach to Learning Physical Dynamics	We present the Neural Physics Engine (NPE), a framework for learning simulators of intuitive physics that naturally generalize across variable object count and different scene configurations. We propose a factorization of a physical scene into composable object-based representations and a neural network architecture whose compositional structure factorizes object dynamics into pairwise interactions. Like a symbolic physics engine, the NPE is endowed with generic notions of objects and their interactions; realized as a neural network, it can be trained via stochastic gradient descent to adapt to specific object properties and dynamics of different worlds. We evaluate the efficacy of our approach on simple rigid body dynamics in two-dimensional worlds. By comparing to less structured architectures, we show that the NPE's compositional representation of the structure in physical interactions improves its ability to predict movement, generalize across variable object count and different scene configurations, and infer latent properties of objects such as mass.	https://openreview.net/forum?id=Bkab5dqxe	Michael Chang, Tomer Ullman, Antonio Torralba, Joshua Tenenbaum
A Contextual Discretization framework for compressing Recurrent Neural Networks	In this paper, we address the issue of training Recurrent Neural Networks with binary weights and introduce a novel Contextualized Discretization (CD) framework and showcase its effectiveness across multiple RNN architectures and two disparate tasks. We also propose a modified GRU architecture that allows harnessing the CD method and reclaim the exclusive usage of weights in $\{-1, 1\}$, which in turn reduces the number of power-two bit multiplications from $O(n^3)$ to $O(n^2)$.	https://openreview.net/forum?id=SJGIC1BFe	Aidan Clark, Vinay Uday Prabhu, John Whaley
A Differentiable Physics Engine for Deep Learning in Robotics	One of the most important fields in robotics is the optimization of controllers. Currently, robots are often treated as a black box in this optimization process, which is the reason why derivative-free optimization methods such as evolutionary algorithms or reinforcement learning are omnipresent. When gradient-based methods are used, models are kept small or rely on finite difference approximations for the Jacobian. This method quickly grows expensive with increasing numbers of parameters, such as found in deep learning. We propose an implementation of a modern physics engine, which can differentiate control parameters. This engine is implemented for both CPU and GPU. Firstly, this paper shows how such an engine speeds up the optimization process, even for small problems. Furthermore, it explains why this is an alternative approach to deep Q-learning, for using deep learning in robotics. Finally, we argue that this is a big step for deep learning in robotics, as it opens up new possibilities to optimize robots, both in hardware and software.	https://openreview.net/forum?id=SyEiHNKxx	Jonas Degrave, Michiel Hermans, Joni Dambre, Francis wyffels
A Learned Representation For Artistic Style	The diversity of painting styles represents a rich visual vocabulary for the construction of an image. The degree to which one may learn and parsimoniously capture this visual vocabulary measures our understanding of the higher level features of paintings, if not images in general. In this work we investigate the construction of a single, scalable deep network that can parsimoniously capture the artistic style of a diversity of paintings. We demonstrate that such a network generalizes across a diversity of artistic styles by reducing a painting to a point in an embedding space. Importantly, this model permits a user to explore new painting styles by arbitrarily combining the styles learned from individual paintings. We hope that this work provides a useful step towards building rich models of paintings and offers a window on to the structure of the learned representation of artistic style.	https://openreview.net/forum?id=BJO-BuT1g	Vincent Dumoulin, Jonathon Shlens, Manjunath Kudlur
A Note on Deep Variational Models for Unsupervised Clustering	Recently, the Gaussian Mixture Variational Autoencoder (GMVAE) has been introduced to handle unsupervised clustering (Dilokthanakul et al., 2016). However, the existing formulation requires the introduction of the free bits term into the objective function in order to overcome the effects of the uniform prior imposed on the latent categorical variable. By considering our choice of generative and inference models, we propose a simple variation on the GMVAE that performs well empirically without modifying the variational objective function.	https://openreview.net/forum?id=rydQ6CEKl	Rui Shu, James Brofos, Curtis Langlotz
A Priori Modeling of Information and Intelligence	This workshop explores primitive structural fundaments in information, and then intelligence, as a model of 'thinking like nature' (natural informatics). It examines the task of designing a general adaptive intelligence from a low-order (non- anthropic) perspective, to arrive at a least-ambiguous and most-general computa- tional/developmental foundation.	https://openreview.net/forum?id=r1FbV6NYe	Marcus Abundis
A Quantitative Measure of Generative Adversarial Network Distributions	We introduce a new measure for evaluating the quality of distributions learned by Generative Adversarial Networks (GANs). This measure computes the Kullback-Leibler divergence from a GAN-generated image set to a real image set. Since our measure utilizes a GAN's whole distribution, our measure penalizes outputs lacking in diversity, and it contrasts with evaluating GANs based upon a few cherry-picked examples. We demonstrate the measure's efficacy on the MNIST, SVHN, and CIFAR-10 datasets.	https://openreview.net/forum?id=SJgabgBFl	Dan Hendrycks*, Steven Basart*
A STRUCTURED SELF-ATTENTIVE SENTENCE EMBEDDING	This paper proposes a new model for extracting an interpretable sentence embedding by introducing self-attention. Instead of using a vector, we use a 2-D matrix to represent the embedding, with each row of the matrix attending on a different part of the sentence. We also propose a self-attention mechanism and a special regularization term for the model. As a side effect, the embedding comes with an easy way of visualizing what specific parts of the sentence are encoded into the embedding. We evaluate our model on 3 different tasks: author profiling, sentiment classification and textual entailment. Results show that our model yields a significant performance gain compared to other sentence embedding methods in all of the 3 tasks.	https://openreview.net/forum?id=BJC_jUqxe	Zhouhan Lin, Minwei Feng, Cicero Nogueira dos Santos, Mo Yu, Bing Xiang, Bowen Zhou, Yoshua Bengio
A Simple but Tough-to-Beat Baseline for Sentence Embeddings	"The success of neural network methods for computing word embeddings has motivated methods for generating semantic embeddings of longer pieces of text, such as sentences and paragraphs. Surprisingly, Wieting et al (ICLR'16) showed that such complicated methods are outperformed, especially in out-of-domain (transfer learning) settings, by simpler methods involving mild retraining of word embeddings and basic linear regression. The method of Wieting et al. requires retraining with a substantial labeled dataset such as Paraphrase Database (Ganitkevitch et al., 2013). The current paper goes further, showing that the following completely unsupervised sentence embedding is a formidable baseline: Use word embeddings computed using one of the popular methods on unlabeled corpus like Wikipedia, represent the sentence by a weighted average of the word vectors, and then modify them a bit using PCA/SVD. This weighting improves performance by about 10% to 30% in textual similarity tasks, and beats sophisticated supervised methods including RNN's and LSTM's. It even improves Wieting et al.'s embeddings. This simple method should be used as the baseline to beat in future, especially when labeled training data is scarce or nonexistent. The paper also gives a theoretical explanation of the success of the above unsupervised method using a latent variable generative model for sentences, which is a simple extension of the model in Arora et al. (TACL'16) with new ""smoothing"" terms that allow for words occurring out of context, as well as high probabilities for words like and, not in all contexts."	https://openreview.net/forum?id=SyK00v5xx	Sanjeev Arora, Yingyu Liang, Tengyu Ma
A Smooth Optimisation Perspective on Training Feedforward Neural Networks	We present a smooth optimisation perspective on training multilayer Feedforward Neural Networks (FNNs) in the supervised learning setting. By characterising the critical point conditions of an FNN based optimisation problem, we identify the conditions to eliminate local optima of the cost function. By studying the Hessian structure of the cost function at the global minima, we develop an approximate Newton FNN algorithm, which demonstrates promising convergence properties.	https://openreview.net/forum?id=S1nFVFNYx	Hao Shen
A Theoretical Framework for Robustness of (Deep) Classifiers against Adversarial Samples	Most machine learning classifiers, including deep neural networks, are vulnerable to adversarial examples. Such inputs are typically generated by adding small but purposeful modifications that lead to incorrect outputs while imperceptible to human eyes. The goal of this paper is not to introduce a single method, but to make theoretical steps toward fully understanding adversarial examples. By using concepts from topology, our theoretical analysis brings forth the key reasons why an adversarial example can fool a classifier ($f_1$) and adds its oracle ($f_2$, like human eyes) in such analysis. By investigating the topological relationship between two (pseudo)metric spaces corresponding to predictor $f_1$ and oracle $f_2$, we develop necessary and sufficient conditions that can determine if $f_1$ is always robust (strong-robust) against adversarial examples according to $f_2$. Interestingly our theorems indicate that just one unnecessary feature can make $f_1$ not strong-robust, and the right feature representation learning is the key to getting a classifier that is both accurate and strong robust.	https://openreview.net/forum?id=SywUHFcge	Beilun Wang, Ji Gao, Yanjun Qi
A recurrent neural network without chaos	We introduce an exceptionally simple gated recurrent neural network (RNN) that achieves performance comparable to well-known gated architectures, such as LSTMs and GRUs, on the word-level language modeling task. We prove that our model has simple, predicable and non-chaotic dynamics. This stands in stark contrast to more standard gated architectures, whose underlying dynamical systems exhibit chaotic behavior.	https://openreview.net/forum?id=S1dIzvclg	Thomas Laurent, James von Brecht
Accelerating Eulerian Fluid Simulation With Convolutional Networks	Efficient simulation of the Navier-Stokes equations for fluid flow is a long standing problem in applied mathematics, for which state-of-the-art methods require large compute resources. In this work, we propose a data-driven approach that leverages the approximation power of deep-learning with the precision of standard solvers to obtain fast and highly realistic simulations. Our method solves the incompressible Euler equations using the standard operator splitting method, in which a large linear system with many free-parameters must be solved. We use a Convolutional Network with a highly tailored architecture, trained using a novel unsupervised learning framework to solve the linear system. We present real-time 2D and 3D simulations that outperform recently proposed data-driven methods; the obtained results are realistic and show good generalization properties.	https://openreview.net/forum?id=ByH2gxrKl	Jonathan Tompson, Kristofer Schlachter, Pablo Sprechmann, Ken Perlin
Accelerating SGD for Distributed Deep-Learning Using an Approximted Hessian Matrix	We introduce a novel method to compute a rank $m$ approximation of the inverse of the Hessian matrix, in the distributed regime. By leveraging the differences in gradients and parameters of multiple Workers, we are able to efficiently implement a distributed approximation of the Newton-Raphson method. We also present preliminary results which underline advantages and challenges of second-order methods for large stochastic optimization problems. In particular, our work suggests that novel strategies for combining gradients will provide further information on the loss surface.	https://openreview.net/forum?id=B1lpelBYl	Sebastien Arnold, Chunming Wang
Adapting distance	domain adaptation	https://openreview.net/forum?id=ryZkZmNte	woojin lee
Adaptive Feature Abstraction for Translating Video to Language	Previous models for video captioning often use the output from a specific layer of a Convolutional Neural Network (CNN) as video representations, preventing them from modeling rich, varying context-dependent semantics in video descriptions. In this paper, we propose a new approach to generating adaptive spatiotemporal representations of videos for a captioning task. For this purpose, novel attention mechanisms with spatiotemporal alignment is employed to adaptively and sequentially focus on different layers of CNN features (levels of feature ``abstraction''), as well as local spatiotemporal regions of the feature maps at each layer. Our approach is evaluated on three benchmark datasets: YouTube2Text, M-VAD and MSR-VTT. Along with visualizing the results and how the model works, these experiments quantitatively demonstrate the effectiveness of the proposed adaptive spatiotemporal feature abstraction for translating videos to sentences with rich semantics.	https://openreview.net/forum?id=ByG4hz5le	Yunchen Pu, Martin Renqiang Min, Zhe Gan, Lawrence Carin
Adjusting for Dropout Variance in Batch Normalization and Weight Initialization	We show how to adjust for the variance introduced by dropout with corrections to weight initialization and Batch Normalization, yielding higher accuracy. Though dropout can preserve the expected input to a neuron between train and test, the variance of the input differs. We thus propose a new weight initialization by correcting for the influence of dropout rates and an arbitrary nonlinearity's influence on variance through simple corrective scalars. Since Batch Normalization trained with dropout estimates the variance of a layer's incoming distribution with some inputs dropped, the variance also differs between train and test. After training a network with Batch Normalization and dropout, we simply update Batch Normalization's variance moving averages with dropout off and obtain state of the art on CIFAR-10 and CIFAR-100 without data augmentation.	https://openreview.net/forum?id=S1AtgaPug	Dan Hendrycks, Kevin Gimpel
Adversarial Attacks on Neural Network Policies	Machine learning classifiers are known to be vulnerable to inputs maliciously constructed by adversaries to force misclassification. Such adversarial examples have been extensively studied in the context of computer vision applications. In this work, we show adversarial attacks are also effective when targeting neural network policies in reinforcement learning. Specifically, we show existing adversarial example crafting techniques can be used to significantly degrade test-time performance of trained policies. Our threat model considers adversaries capable of introducing small perturbations to the raw input of the policy. We characterize the degree of vulnerability across tasks and training algorithms, for a subclass of adversarial-example attacks in white-box and black-box settings. Regardless of the learned task or training algorithm, we observe a significant drop in performance, even with small adversarial perturbations that do not interfere with human perception. Videos are available at http://rll.berkeley.edu/adversarial .	https://openreview.net/forum?id=ryvlRyBKl	Sandy Huang, Nicolas Papernot, Ian Goodfellow, Yan Duan, Pieter Abbeel
Adversarial Autoencoders for Novelty Detection	In this paper, we address the problem of novelty detection, \textit{i.e} recognizing at test time if a data item comes from the training data distribution or not. We focus on Adversarial autoencoders (AAE) that have the advantage to explicitly control the distribution of the known data in the feature space. We show that when they are trained in a (semi-)supervised way, they provide consistent novelty detection improvements compared to a classical autoencoder. We further improve their performance by introducing an explicit rejection class in the prior distribution coupled with random input images to the autoencoder.	https://openreview.net/forum?id=SyuncaEKx	Valentin Leveau, Alexis Joly
Adversarial Discriminative Domain Adaptation (workshop extended abstract)	Domain adversarial approaches have been at the core of many recent unsupervised domain adaptation algorithms. However, each new algorithm is presented independently with limited or no connections mentioned across the works. Instead, in this work we propose a unified view of adversarial adaptation methods. We show how to describe a variety of state-of-the-art adaptation methods within our framework and furthermore use our generalized view in order to better understand the similarities and differences between these recent approaches. In turn, this framework facilitates the development of new adaptation methods through modeling choices that combine the desirable properties of multiple existing methods. In this way, we propose a novel adversarial adaptation method that is effective yet considerably simpler than other competing methods. We demonstrate the promise of our approach by achieving state-of-the-art unsupervised adaptation results on the standard Office dataset.	https://openreview.net/forum?id=B1Vjl1Stl	Eric Tzeng, Judy Hoffman, Kate Saenko, Trevor Darrell
Adversarial Examples for Semantic Image Segmentation	Machine learning methods in general and Deep Neural Networks in particular have shown to be vulnerable to adversarial perturbations. So far this phenomenon has mainly been studied in the context of whole-image classification. In this contribution, we analyse how adversarial perturbations can affect the task of semantic segmentation. We show how existing adversarial attackers can be transferred to this task and that it is possible to create imperceptible adversarial perturbations that lead a deep network to misclassify almost all pixels of a chosen class while leaving network prediction nearly unchanged outside this class.	https://openreview.net/forum?id=S1SED1MYe	Volker Fischer, Mummadi Chaithanya Kumar, Jan Hendrik Metzen, Thomas Brox
Adversarial Feature Learning	"The ability of the Generative Adversarial Networks (GANs) framework to learn generative models mapping from simple latent distributions to arbitrarily complex data distributions has been demonstrated empirically, with compelling results showing generators learn to ""linearize semantics"" in the latent space of such models. Intuitively, such latent spaces may serve as useful feature representations for auxiliary problems where semantics are relevant. However, in their existing form, GANs have no means of learning the inverse mapping -- projecting data back into the latent space. We propose Bidirectional Generative Adversarial Networks (BiGANs) as a means of learning this inverse mapping, and demonstrate that the resulting learned feature representation is useful for auxiliary supervised discrimination tasks, competitive with contemporary approaches to unsupervised and self-supervised feature learning."	https://openreview.net/forum?id=BJtNZAFgg	Jeff Donahue, Philipp Krähenbühl, Trevor Darrell
Adversarial Machine Learning at Scale	Adversarial examples are malicious inputs designed to fool machine learning models. They often transfer from one model to another, allowing attackers to mount black box attacks without knowledge of the target model's parameters. Adversarial training is the process of explicitly training a model on adversarial examples, in order to make it more robust to attack or to reduce its test error on clean inputs. So far, adversarial training has primarily been applied to small problems. In this research, we apply adversarial training to ImageNet. Our contributions include: (1) recommendations for how to succesfully scale adversarial training to large models and datasets, (2) the observation that adversarial training confers robustness to single-step attack methods, (3) the finding that multi-step attack methods are somewhat less transferable than single-step attack methods, so single-step attacks are the best for mounting black-box attacks, and (4) resolution of a ``label leaking'' effect that causes adversarially trained models to perform better on adversarial examples than on clean examples, because the adversarial example construction process uses the true label and the model can learn to exploit regularities in the construction process.	https://openreview.net/forum?id=BJm4T4Kgx	Alexey Kurakin, Ian J. Goodfellow, Samy Bengio
Adversarial Training Methods for Semi-Supervised Text Classification	Adversarial training provides a means of regularizing supervised learning algorithms while virtual adversarial training is able to extend supervised learning algorithms to the semi-supervised setting. However, both methods require making small perturbations to numerous entries of the input vector, which is inappropriate for sparse high-dimensional inputs such as one-hot word representations. We extend adversarial and virtual adversarial training to the text domain by applying perturbations to the word embeddings in a recurrent neural network rather than to the original input itself. The proposed method achieves state of the art results on multiple benchmark semi-supervised and purely supervised tasks. We provide visualizations and analysis showing that the learned word embeddings have improved in quality and that while training, the model is less prone to overfitting.	https://openreview.net/forum?id=r1X3g2_xl	Takeru Miyato, Andrew M. Dai, Ian Goodfellow
Adversarial examples for generative models	We explore methods of producing adversarial examples on deep generative models such as the variational autoencoder (VAE) and the VAE-GAN. Deep learning architectures are known to be vulnerable to adversarial examples, but previous work has focused on the application of adversarial examples to classification tasks. Deep generative models have recently become popular due to their ability to model input data distributions and generate realistic examples from those distributions. We present two classes of attacks on the VAE-GAN architecture and demonstrate them against networks trained on MNIST, SVHN, and CelebA. Our first attack directly uses the VAE loss function to generate a target reconstruction image from the adversarial example. Our second attack moves beyond relying on the standard loss for computing the gradient and directly optimizes against differences in source and target latent representations. We additionally present an interesting visualization, which gives insight into how adversarial examples appear in generative models.	https://openreview.net/forum?id=By1eEXVFg	Jernej Kos, Ian Fischer, Dawn Song
