title	abstract	url	authors
Learning to Discover Sparse Graphical Models	We consider structure discovery of undirected graphical models from observational data. Inferring likely structures from few examples is a complex task often requiring the formulation of priors and sophisticated inference procedures. In the setting of Gaussian Graphical Models (GGMs) a popular estimator is a maximum likelihood objective with a penalization on the precision matrix. Adapting this estimator to capture domain-specific knowledge as priors or a new data likelihood requires great effort. In addition, structure recovery is an indirect consequence of the data-fit term. By contrast, it may be easier to generate training samples of data that arise from graphs with the desired structure properties. We propose here to leverage this latter source of information as training data to learn a function mapping from empirical covariance matrices to estimated graph structures. Learning this function brings two benefits: it implicitly models the desired structure or sparsity properties to form suitable priors, and it can be tailored to the specific problem of edge structure discovery, rather than maximizing data likelihood. We apply this framework to several real-world problems in structure discovery and show that it can be competitive to standard approaches such as graphical lasso, at a fraction of the execution speed. We use convolutional neural networks to parametrize our estimators due to the compositional structure of the problem. Experimentally, our learnable graph-discovery method trained on synthetic data generalizes well to different data: identifying relevant edges in real data, completely unknown at training time. We find that on genetics, brain imaging, and simulation data we obtain competitive(and generally superior) performance, compared with analytical methods.	https://openreview.net/forum?id=HJOZBvcel	Eugene Belilovsky, Kyle Kastner, Gael Varoquaux, Matthew B. Blaschko
Learning to Draw Samples: With Application to Amortized MLE for Generative Adversarial Learning	We propose a simple algorithm to train stochastic neural networks to draw samples from given target distributions for probabilistic inference. Our method is based on iteratively adjusting the neural network parameters so that the output changes along a Stein variational gradient that maximumly decreases the KL divergence with the target distribution. Our method works for any target distribution specified by their unnormalized density function, and can train any black-box architectures that are differentiable in terms of the parameters we want to adapt. As an application of our method, we propose an amortized MLE algorithm for training deep energy model, where a neural sampler is adaptively trained to approximate the likelihood function. Our method mimics an adversarial game between the deep energy model and the neural sampler, and obtains realistic-looking images competitive with the state-of-the-art results.	https://openreview.net/forum?id=H1oRQDqlg	Dilin Wang, Qiang Liu
Learning to Generate Samples from Noise through Infusion Training	In this work, we investigate a novel training procedure to learn a generative model as the transition operator of a Markov chain, such that, when applied repeatedly on an unstructured random noise sample, it will denoise it into a sample that matches the target distribution from the training set. The novel training procedure to learn this progressive denoising operation involves sampling from a slightly different chain than the model chain used for generation in the absence of a denoising target. In the training chain we infuse information from the training target example that we would like the chains to reach with a high probability. The thus learned transition operator is able to produce quality and varied samples in a small number of steps. Experiments show competitive results compared to the samples generated with a basic Generative Adversarial Net.	https://openreview.net/forum?id=BJAFbaolg	Florian Bordes, Sina Honari, Pascal Vincent
Learning to Navigate in Complex Environments	Learning to navigate in complex environments with dynamic elements is an important milestone in developing AI agents. In this work we formulate the navigation question as a reinforcement learning problem and show that data efficiency and task performance can be dramatically improved by relying on additional auxiliary tasks to bootstrap learning. In particular we consider jointly learning the goal-driven reinforcement learning problem with an unsupervised depth prediction task and a self-supervised loop closure classification task. Using this approach we can learn to navigate from raw sensory input in complicated 3D mazes, approaching human-level performance even under conditions where the goal location changes frequently. We provide detailed analysis of the agent behaviour, its ability to localise, and its network activity dynamics, that show that the agent implicitly learns key navigation abilities, with only sparse rewards and without direct supervision.	https://openreview.net/forum?id=SJMGPrcle	Piotr Mirowski, Razvan Pascanu, Fabio Viola, Hubert Soyer, Andy Ballard, Andrea Banino, Misha Denil, Ross Goroshin, Laurent Sifre, Koray Kavukcuoglu, Dharshan Kumaran, Raia Hadsell
Learning to Optimize	Algorithm design is a laborious process and often requires many iterations of ideation and validation. In this paper, we explore automating algorithm design and present a method to learn an optimization algorithm. We approach this problem from a reinforcement learning perspective and represent any particular optimization algorithm as a policy. We learn an optimization algorithm using guided policy search and demonstrate that the resulting algorithm outperforms existing hand-engineered algorithms in terms of convergence speed and/or the final objective value.	https://openreview.net/forum?id=ry4Vrt5gl	Ke Li, Jitendra Malik
Learning to Perform Physics Experiments via Deep Reinforcement Learning	When encountering novel objects, humans are able to infer a wide range of physical properties such as mass, friction and deformability by interacting with them in a goal driven way. This process of active interaction is in the same spirit as a scientist performing experiments to discover hidden facts. Recent advances in artificial intelligence have yielded machines that can achieve superhuman performance in Go, Atari, natural language processing, and complex control problems; however, it is not clear that these systems can rival the scientific intuition of even a young child. In this work we introduce a basic set of tasks that require agents to estimate properties such as mass and cohesion of objects in an interactive simulated environment where they can manipulate the objects and observe the consequences. We found that deep reinforcement learning methods can learn to perform the experiments necessary to discover such hidden properties. By systematically manipulating the problem difficulty and the cost incurred by the agent for performing experiments, we found that agents learn different strategies that balance the cost of gathering information against the cost of making mistakes in different situations. We also compare our learned experimentation policies to randomized baselines and show that the learned policies lead to better predictions.	https://openreview.net/forum?id=r1nTpv9eg	Misha Denil, Pulkit Agrawal, Tejas D Kulkarni, Tom Erez, Peter Battaglia, Nando de Freitas
Learning to Play in a Day: Faster Deep Reinforcement Learning by Optimality Tightening	We propose a novel training algorithm for reinforcement learning which combines the strength of deep Q-learning with a constrained optimization approach to tighten optimality and encourage faster reward propagation. Our novel technique makes deep reinforcement learning more practical by drastically reducing the training time. We evaluate the performance of our approach on the 49 games of the challenging Arcade Learning Environment, and report significant improvements in both training time and accuracy.	https://openreview.net/forum?id=rJ8Je4clg	Frank S.He, Yang Liu, Alexander G. Schwing, Jian Peng
Learning to Query, Reason, and Answer Questions On Ambiguous Texts	"A key goal of research in conversational systems is to train an interactive agent to help a user with a task. Human conversation, however, is notoriously incomplete, ambiguous, and full of extraneous detail. To operate effectively, the agent must not only understand what was explicitly conveyed but also be able to reason in the presence of missing or unclear information. When unable to resolve ambiguities on its own, the agent must be able to ask the user for the necessary clarifications and incorporate the response in its reasoning. Motivated by this problem we introduce QRAQ (""crack""; Query, Reason, and Answer Questions), a new synthetic domain, in which a User gives an Agent a short story and asks a challenge question. These problems are designed to test the reasoning and interaction capabilities of a learning-based Agent in a setting that requires multiple conversational turns. A good Agent should ask only non-deducible, relevant questions until it has enough information to correctly answer the User's question. We use standard and improved reinforcement learning based memory-network architectures to solve QRAQ problems in the difficult setting where the reward signal only tells the Agent if its final answer to the challenge question is correct or not. To provide an upper-bound to the RL results we also train the same architectures using supervised information that tells the Agent during training which variables to query and the answer to the challenge question. We evaluate our architectures on four QRAQ dataset types, and scale the complexity for each along multiple dimensions."	https://openreview.net/forum?id=rJ0-tY5xe	Xiaoxiao Guo, Tim Klinger, Clemens Rosenbaum, Joseph P. Bigus, Murray Campbell, Ban Kawas, Kartik Talamadupula, Gerry Tesauro, Satinder   Singh
Learning to Remember Rare Events	Despite recent advances, memory-augmented deep neural networks are still limited when it comes to life-long and one-shot learning, especially in remembering rare events. We present a large-scale life-long memory module for use in deep learning. The module exploits fast nearest-neighbor algorithms for efficiency and thus scales to large memory sizes. Except for the nearest-neighbor query, the module is fully differentiable and trained end-to-end with no extra supervision. It operates in a life-long manner, i.e., without the need to reset it during training. Our memory module can be easily added to any part of a supervised neural network. To show its versatility we add it to a number of networks, from simple convolutional ones tested on image classification to deep sequence-to-sequence and recurrent-convolutional models. In all cases, the enhanced network gains the ability to remember and do life-long one-shot learning. Our module remembers training examples shown many thousands of steps in the past and it can successfully generalize from them. We set new state-of-the-art for one-shot learning on the Omniglot dataset and demonstrate, for the first time, life-long one-shot learning in recurrent neural networks on a large-scale machine translation task.	https://openreview.net/forum?id=SJTQLdqlg	Lukasz Kaiser, Ofir Nachum, Aurko Roy, Samy Bengio
Learning to Repeat: Fine Grained Action Repetition for Deep Reinforcement Learning	Reinforcement Learning algorithms can learn complex behavioral patterns for sequential decision making tasks wherein an agent interacts with an environment and acquires feedback in the form of rewards sampled from it. Traditionally, such algorithms make decisions, i.e., select actions to execute, at every single time step of the agent-environment interactions. In this paper, we propose a novel framework, Fine Grained Action Repetition (FiGAR), which enables the agent to decide the action as well as the time scale of repeating it. FiGAR can be used for improving any Deep Reinforcement Learning algorithm which maintains an explicit policy estimate by enabling temporal abstractions in the action space and implicitly enabling planning through sequences of repetitive macro-actions. We empirically demonstrate the efficacy of our framework by showing performance improvements on top of three policy search algorithms in different domains: Asynchronous Advantage Actor Critic in the Atari 2600 domain, Trust Region Policy Optimization in Mujoco domain and Deep Deterministic Policy Gradients in the TORCS car racing domain.	https://openreview.net/forum?id=B1GOWV5eg	Sahil Sharma, Aravind S. Lakshminarayanan, Balaraman Ravindran
Learning to superoptimize programs	Code super-optimization is the task of transforming any given program to a more efficient version while preserving its input-output behaviour. In some sense, it is similar to the paraphrase problem from natural language processing where the intention is to change the syntax of an utterance without changing its semantics. Code-optimization has been the subject of years of research that has resulted in the development of rule-based transformation strategies that are used by compilers. More recently, however, a class of stochastic search based methods have been shown to outperform these strategies. This approach involves repeated sampling of modifications to the program from a proposal distribution, which are accepted or rejected based on whether they preserve correctness, and the improvement they achieve. These methods, however, neither learn from past behaviour nor do they try to leverage the semantics of the program under consideration. Motivated by this observation, we present a novel learning based approach for code super-optimization. Intuitively, our method works by learning the proposal distribution using unbiased estimators of the gradient of the expected improvement. Experiments on benchmarks comprising of automatically generated as well as existing (``Hacker's Delight'') programs show that the proposed method is able to significantly outperform state of the art approaches for code super-optimization.	https://openreview.net/forum?id=r1rz6U5lg	Rudy Bunel, Alban Desmaison, M. Pawan Kumar, Philip H.S. Torr, Pushmeet Kohli
Lie-Access Neural Turing Machines	External neural memory structures have recently become a popular tool for algorithmic deep learning (Graves et al. 2014; Weston et al. 2014). These models generally utilize differentiable versions of traditional discrete memory-access structures (random access, stacks, tapes) to provide the storage necessary for computational tasks. In this work, we argue that these neural memory systems lack specific structure important for relative indexing, and propose an alternative model, Lie-access memory, that is explicitly designed for the neural setting. In this paradigm, memory is accessed using a continuous head in a key-space manifold. The head is moved via Lie group actions, such as shifts or rotations, generated by a controller, and memory access is performed by linear smoothing in key space. We argue that Lie groups provide a natural generalization of discrete memory structures, such as Turing machines, as they provide inverse and identity operators while maintaining differentiability. To experiment with this approach, we implement a simplified Lie-access neural Turing machine (LANTM) with different Lie groups. We find that this approach is able to perform well on a range of algorithmic tasks.	https://openreview.net/forum?id=Byiy-Pqlx	Greg Yang, Alexander Rush
Lifelong Perceptual Programming By Example	We introduce and develop solutions for the problem of Lifelong Perceptual Programming By Example (LPPBE). The problem is to induce a series of programs that require understanding perceptual data like images or text. LPPBE systems learn from weak supervision (input-output examples) and incrementally construct a shared library of components that grows and improves as more tasks are solved. Methodologically, we extend differentiable interpreters to operate on perceptual data and to share components across tasks. Empirically we show that this leads to a lifelong learning system that transfers knowledge to new tasks more effectively than baselines, and the performance on earlier tasks continues to improve even as the system learns on new, different tasks.	https://openreview.net/forum?id=HJStZKqel	Alexander L. Gaunt, Marc Brockschmidt, Nate Kushman, Daniel Tarlow
Loss is its own Reward: Self-Supervision for Reinforcement Learning	Reinforcement learning, driven by reward, addresses tasks by optimizing policies for expected return. Need the supervision be so narrow? Reward is delayed and sparse for many tasks, so we argue that reward alone is a noisy and impoverished signal for end-to-end optimization. To augment reward, we consider self-supervised tasks that incorporate states, actions, and successors to provide auxiliary losses. These losses offer ubiquitous and instantaneous supervision for representation learning even in the absence of reward. Self-supervised pre-training improves the data efficiency and returns of end-to-end reinforcement learning on Atari.	https://openreview.net/forum?id=S15PPJStl	Evan Shelhamer, Parsa Mahmoudieh, Max Argus, Trevor Darrell
Loss-aware Binarization of Deep Networks	Deep neural network models, though very powerful and highly successful, are computationally expensive in terms of space and time. Recently, there have been a number of attempts on binarizing the network weights and activations. This greatly reduces the network size, and replaces the underlying multiplications to additions or even XNOR bit operations. However, existing binarization schemes are based on simple matrix approximations and ignore the effect of binarization on the loss. In this paper, we propose a proximal Newton algorithm with diagonal Hessian approximation that directly minimizes the loss w.r.t. the binarized weights. The underlying proximal step has an efficient closed-form solution, and the second-order information can be efficiently obtained from the second moments already computed by the Adam optimizer. Experiments on both feedforward and recurrent networks show that the proposed loss-aware binarization algorithm outperforms existing binarization schemes, and is also more robust for wide and deep networks.	https://openreview.net/forum?id=S1oWlN9ll	Lu Hou, Quanming Yao, James T. Kwok
Lossy Image Compression with Compressive Autoencoders	We propose a new approach to the problem of optimizing autoencoders for lossy image compression. New media formats, changing hardware technology, as well as diverse requirements and content types create a need for compression algorithms which are more flexible than existing codecs. Autoencoders have the potential to address this need, but are difficult to optimize directly due to the inherent non-differentiabilty of the compression loss. We here show that minimal changes to the loss are sufficient to train deep autoencoders competitive with JPEG 2000 and outperforming recently proposed approaches based on RNNs. Our network is furthermore computationally efficient thanks to a sub-pixel architecture, which makes it suitable for high-resolution images. This is in contrast to previous work on autoencoders for compression using coarser approximations, shallower architectures, computationally expensive methods, or focusing on small images.	https://openreview.net/forum?id=rJiNwv9gg	Lucas Theis, Wenzhe Shi, Andrew Cunningham, Ferenc Huszár
Machine Comprehension Using Match-LSTM and Answer Pointer	Machine comprehension of text is an important problem in natural language processing. A recently released dataset, the Stanford Question Answering Dataset (SQuAD), offers a large number of real questions and their answers created by humans through crowdsourcing. SQuAD provides a challenging testbed for evaluating machine comprehension algorithms, partly because compared with previous datasets, in SQuAD the answers do not come from a small set of candidate answers and they have variable lengths. We propose an end-to-end neural architecture for the task. The architecture is based on match-LSTM, a model we proposed previously for textual entailment, and Pointer Net, a sequence-to-sequence model proposed by Vinyals et al. (2015) to constrain the output tokens to be from the input sequences. We propose two ways of using Pointer Net for our tasks. Our experiments show that both of our two models substantially outperform the best results obtained by Rajpurkar et al. (2016) using logistic regression and manually crafted features. Besides, our boundary model also achieves the best performance on the MSMARCO dataset (Nguyen et al. 2016).	https://openreview.net/forum?id=B1-q5Pqxl	Shuohang Wang, Jing Jiang
Making Neural Programming Architectures Generalize via Recursion	Empirically, neural networks that attempt to learn programs from data have exhibited poor generalizability. Moreover, it has traditionally been difficult to reason about the behavior of these models beyond a certain level of input complexity. In order to address these issues, we propose augmenting neural architectures with a key abstraction: recursion. As an application, we implement recursion in the Neural Programmer-Interpreter framework on four tasks: grade-school addition, bubble sort, topological sort, and quicksort. We demonstrate superior generalizability and interpretability with small amounts of training data. Recursion divides the problem into smaller pieces and drastically reduces the domain of each neural network component, making it tractable to prove guarantees about the overall system's behavior. Our experience suggests that in order for neural architectures to robustly learn program semantics, it is necessary to incorporate a concept like recursion.	https://openreview.net/forum?id=BkbY4psgg	Jonathon Cai, Richard Shin, Dawn Song
Maximum Entropy Flow Networks	Maximum entropy modeling is a flexible and popular framework for formulating statistical models given partial knowledge. In this paper, rather than the traditional method of optimizing over the continuous density directly, we learn a smooth and invertible transformation that maps a simple distribution to the desired maximum entropy distribution. Doing so is nontrivial in that the objective being maximized (entropy) is a function of the density itself. By exploiting recent developments in normalizing flow networks, we cast the maximum entropy problem into a finite-dimensional constrained optimization, and solve the problem by combining stochastic optimization with the augmented Lagrangian method. Simulation results demonstrate the effectiveness of our method, and applications to finance and computer vision show the flexibility and accuracy of using maximum entropy flow networks.	https://openreview.net/forum?id=H1acq85gx	Gabriel Loaiza-Ganem *, Yuanjun Gao *, John P. Cunningham
Mean teachers are better role models: Weight-averaged consistency targets improve semi-supervised deep learning results	The recently proposed Temporal Ensembling has achieved state-of-the-art results in several semi-supervised learning benchmarks. It maintains an exponential moving average of label predictions on each training example, and penalizes predictions that are inconsistent with this target. However, because the targets change only once per epoch, Temporal Ensembling becomes unwieldy when learning large datasets. To overcome this problem, we propose Mean Teacher, a method that averages model weights instead of label predictions. As an additional benefit, Mean Teacher improves test accuracy and enables training with fewer labels than Temporal Ensembling. Mean Teacher achieves error rate 4.35% on SVHN with 250 labels, better than Temporal Ensembling does with 1000 labels.	https://openreview.net/forum?id=ry8u21rtl	Antti Tarvainen, Harri Valpola
Memory Matching Networks for Genomic Sequence Classification	"When analyzing the genome, researchers have discovered that proteins bind to DNA based on certain patterns on the DNA sequence known as ""motifs"". However, it is difficult to manually construct motifs for protein binding location prediction due to their complexity. Recently, external learned memory models have proven to be effective methods for reasoning over inputs and supporting sets. In this work, we present memory matching networks (MMN) for classifying DNA sequences as protein binding sites. Our model learns a memory bank of encoded motifs, which are dynamic memory modules, and then matches a new test sequence to each of the motifs to classify the sequence as a binding or non-binding site."	https://openreview.net/forum?id=ryh9ZySFg	Jack Lanchantin, Ritambhara Singh, Yanjun Qi
