title	abstract	url	authors
Do Deep Convolutional Nets Really Need to be Deep and Convolutional?	Yes, they do. This paper provides the first empirical demonstration that deep convolutional models really need to be both deep and convolutional, even when trained with methods such as distillation that allow small or shallow models of high accuracy to be trained. Although previous research showed that shallow feed-forward nets sometimes can learn the complex functions previously learned by deep nets while using the same number of parameters as the deep models they mimic, in this paper we demonstrate that the same methods cannot be used to train accurate models on CIFAR-10 unless the student models contain multiple layers of convolution. Although the student models do not have to be as deep as the teacher model they mimic, the students need multiple convolutional layers to learn functions of comparable accuracy as the deep convolutional teacher.	https://openreview.net/forum?id=r10FA8Kxg	Gregor Urban, Krzysztof J. Geras, Samira Ebrahimi Kahou, Ozlem Aslan, Shengjie Wang, Abdelrahman Mohamed, Matthai Philipose, Matt Richardson, Rich Caruana
Dropout with Expectation-linear Regularization	Dropout, a simple and effective way to train deep neural networks, has led to a number of impressive empirical successes and spawned many recent theoretical investigations. However, the gap between dropout's training and inference phases, introduced due to tractability considerations, has largely remained under-appreciated. In this work, we first formulate dropout as a tractable approximation of some latent variable model, leading to a clean view of parameter sharing and enabling further theoretical analysis. Then, we introduce (approximate) expectation-linear dropout neural networks, whose inference gap we are able to formally characterize. Algorithmically, we show that our proposed measure of the inference gap can be used to regularize the standard dropout training objective, resulting in an explicit control of the gap. Our method is as simple and efficient as standard dropout. We further prove the upper bounds on the loss in accuracy due to expectation-linearization, describe classes of input distributions that expectation-linearize easily. Experiments on three image classification benchmark datasets demonstrate that reducing the inference gap can indeed improve the performance consistently.	https://openreview.net/forum?id=rkGabzZgl	Xuezhe Ma, Yingkai Gao, Zhiting Hu, Yaoliang Yu, Yuntian Deng, Eduard Hovy
Dynamic Coattention Networks For Question Answering	Several deep learning models have been proposed for question answering. How- ever, due to their single-pass nature, they have no way to recover from local maxima corresponding to incorrect answers. To address this problem, we introduce the Dynamic Coattention Network (DCN) for question answering. The DCN first fuses co-dependent representations of the question and the document in order to focus on relevant parts of both. Then a dynamic pointer decoder iterates over potential answer spans. This iterative procedure enables the model to recover from initial local maxima corresponding to incorrect answers. On the Stanford question answering dataset, a single DCN model improves the previous state of the art from 71.0% F1 to 75.9%, while a DCN ensemble obtains 80.4% F1.	https://openreview.net/forum?id=rJeKjwvclx	Caiming Xiong, Victor Zhong, Richard Socher
EPOpt: Learning Robust Neural Network Policies Using Model Ensembles	Sample complexity and safety are major challenges when learning policies with reinforcement learning for real-world tasks, especially when the policies are represented using rich function approximators like deep neural networks. Model-based methods where the real-world target domain is approximated using a simulated source domain provide an avenue to tackle the above challenges by augmenting real data with simulated data. However, discrepancies between the simulated source domain and the target domain pose a challenge for simulated training. We introduce the EPOpt algorithm, which uses an ensemble of simulated source domains and a form of adversarial training to learn policies that are robust and generalize to a broad range of possible target domains, including to unmodeled effects. Further, the probability distribution over source domains in the ensemble can be adapted using data from the target domain and approximate Bayesian methods, to progressively make it a better approximation. Thus, learning on a model ensemble, along with source domain adaptation, provides the benefit of both robustness and learning.	https://openreview.net/forum?id=SyWvgP5el	Aravind Rajeswaran, Sarvjeet Ghotra, Balaraman Ravindran, Sergey Levine
Early Methods for Detecting Adversarial Images	Many machine learning classifiers are vulnerable to adversarial perturbations. An adversarial perturbation modifies an input to change a classifier's prediction without causing the input to seem substantially different to human perception. We deploy three methods to detect adversarial images. Adversaries trying to bypass our detectors must make the adversarial image less pathological or they will fail trying. Our best detection method reveals that adversarial images place abnormal emphasis on the lower-ranked principal components from PCA. Other detectors and a colorful saliency map are in an appendix.	https://openreview.net/forum?id=B1dexpDug	Dan Hendrycks, Kevin Gimpel
Efficient Representation of Low-Dimensional Manifolds using Deep Networks	We consider the ability of deep neural networks to represent data that lies near a low-dimensional manifold in a high-dimensional space. We show that deep networks can efficiently extract the intrinsic, low-dimensional coordinates of such data. Specifically we show that the first two layers of a deep network can exactly embed points lying on a monotonic chain, a special type of piecewise linear manifold, mapping them to a low-dimensional Euclidean space. Remarkably, the network can do this using an almost optimal number of parameters. We also show that this network projects nearby points onto the manifold and then embeds them with little error. Experiments demonstrate that training with stochastic gradient descent can indeed find efficient representations similar to the one presented in this paper.	https://openreview.net/forum?id=BJ3filKll	Ronen Basri, David W. Jacobs
Efficient Softmax Approximation for GPUs	We propose an approximate strategy to efficiently train neural network based language models over very large vocabularies. Our approach, called adaptive softmax, circumvents the linear dependency on the vocabulary size by exploiting the unbalanced word distribution to form clusters that explicitly minimize the expectation of computational complexity. Our approach further reduces the computational cost by exploiting the specificities of modern architectures and matrix-matrix vector operations, making it particularly suited for graphical processing units. Our experiments carried out on standard benchmarks, such as EuroParl and One Billion Word, show that our approach brings a large gain in efficiency over standard approximations while achieving an accuracy close to that of the full softmax.	https://openreview.net/forum?id=rkmDI85ge	Édouard Grave, Armand Joulin, Moustapha Cissé, David Grangier, Hervé Jégou
Efficient Sparse-Winograd Convolutional Neural Networks	"Convolutional Neural Networks (CNNs) are compute intensive which limits their application on mobile devices. Their energy is dominated by the number of multiplies needed to perform the convolutions. Winograd's minimal filtering algorithm (Lavin (2015)) and network pruning (Han et al. (2015)) reduce the operation count. Unfortunately, these two methods cannot be combined—because applying theWinograd transform fills in the sparsity in both the weights and the activations. We propose two modifications to Winograd-based CNNs to enable these methods to exploit sparsity. First, we prune the weights in the ""Winograd domain"" (after the transform) to exploit static weight sparsity. Second, we move the ReLU operation into the ""Winograd domain"" to improve the sparsity of the transformed activations. On CIFAR-10, our method reduces the number of multiplications in the VGG-nagadomi model by 10.2x with no loss of accuracy."	https://openreview.net/forum?id=r1rqJyHKg	Xingyu Liu, Song Han, Huizi Mao, William J. Dally
Efficient Vector Representation for Documents through Corruption	We present an efficient document representation learning framework, Document Vector through Corruption (Doc2VecC). Doc2VecC represents each document as a simple average of word embeddings. It ensures a representation generated as such captures the semantic meanings of the document during learning. A corruption model is included, which introduces a data-dependent regularization that favors informative or rare words while forcing the embeddings of common and non-discriminative ones to be close to zero. Doc2VecC produces significantly better word embeddings than Word2Vec. We compare Doc2VecC with several state-of-the-art document representation learning algorithms. The simple model architecture introduced by Doc2VecC matches or out-performs the state-of-the-art in generating high-quality document representations for sentiment analysis, document classification as well as semantic relatedness tasks. The simplicity of the model enables training on billions of words per hour on a single machine. At the same time, the model is very efficient in generating representations of unseen documents at test time.	https://openreview.net/forum?id=B1Igu2ogg	Minmin Chen
Efficient variational Bayesian neural network ensembles for outlier detection	In this work we perform outlier detection using ensembles of neural networks obtained by variational approximation of the posterior in a Bayesian neural network setting. The variational parameters are obtained by sampling from the true posterior by gradient descent. We show our outlier detection results are comparable to those obtained using other efficient ensembling methods.	https://openreview.net/forum?id=Hy-po5NFx	Nick Pawlowski, Miguel Jaques, Ben Glocker
Embracing Data Abundance	There is a practically unlimited amount of natural language data available. Still, recent work in text comprehension has focused on datasets which are small relative to current computing possibilities. This article is making a case for the community to move to larger data and is offering the BookTest dataset as a step in that direction.	https://openreview.net/forum?id=H1U4mhVFe	Ondrej Bajgar, Rudolf Kadlec and Jan Kleindienst
Emergence of Language with Multi-agent Games: Learning to Communicate with Sequences of Symbols	Learning to communicate through interaction, rather than relying on explicit supervision, is often considered a prerequisite for developing a general AI. We study a setting where two agents engage in playing a referential game and, from scratch, develop a communication protocol necessary to succeed in this game. We require that messages they exchange, both at train and test time, are in the form of a language (i.e. sequences of discrete symbols). As the ultimate goal is to ensure that communication is accomplished in natural language, we perform preliminary experiments where we inject prior information about natural language into our model and study properties of the resulting protocol.	https://openreview.net/forum?id=SkaxnKEYg	Serhii Havrylov, Ivan Titov
Emergence of foveal image sampling from learning to attend in visual scenes	We describe a neural attention model with a learnable retinal sampling lattice. The model is trained on a visual search task requiring the classification of an object embedded in a visual scene amidst background distractors using the smallest number of fixations. We explore the tiling properties that emerge in the model's retinal sampling lattice after training. Specifically, we show that this lattice resembles the eccentricity dependent sampling lattice of the primate retina, with a high resolution region in the fovea surrounded by a low resolution periphery. Furthermore, we find conditions where these emergent properties are amplified or eliminated providing clues to their function.	https://openreview.net/forum?id=SJJKxrsgl	Brian Cheung, Eric Weiss, Bruno Olshausen
Encoding and Decoding Representations with Sum- and Max-Product Networks	Sum-Product Networks (SPNs) are deep density estimators allowing exact and tractable inference. While up to now SPNs have been employed as black-box inference machines, we exploit them as feature extractors for unsupervised Representation Learning. Representations learned by SPNs are rich probabilistic and hierarchical part-based features. SPNs converted into Max-Product Networks (MPNs) provide a way to decode these representations back to the original input space. In extensive experiments, SPN and MPN encoding and decoding schemes prove highly competitive for Multi-Label Classification tasks.	https://openreview.net/forum?id=rkndY2VYx	Antonio Vergari, Robert Peharz, Nicola Di Mauro, Floriana Esposito
End-to-end Optimized Image Compression	We describe an image compression method, consisting of a nonlinear analysis transformation, a uniform quantizer, and a nonlinear synthesis transformation. The transforms are constructed in three successive stages of convolutional linear filters and nonlinear activation functions. Unlike most convolutional neural networks, the joint nonlinearity is chosen to implement a form of local gain control, inspired by those used to model biological neurons. Using a variant of stochastic gradient descent, we jointly optimize the entire model for rate-distortion performance over a database of training images, introducing a continuous proxy for the discontinuous loss function arising from the quantizer. Under certain conditions, the relaxed loss function may be interpreted as the log likelihood of a generative model, as implemented by a variational autoencoder. Unlike these models, however, the compression model must operate at any given point along the rate-distortion curve, as specified by a trade-off parameter. Across an independent set of test images, we find that the optimized method generally exhibits better rate-distortion performance than the standard JPEG and JPEG 2000 compression methods. More importantly, we observe a dramatic improvement in visual quality for all images at all bit rates, which is supported by objective quality estimates using MS-SSIM.	https://openreview.net/forum?id=rJxdQ3jeg	Johannes Ballé, Valero Laparra, Eero P. Simoncelli
Energy-based Generative Adversarial Networks	"We introduce the ""Energy-based Generative Adversarial Network"" model (EBGAN) which views the discriminator as an energy function that attributes low energies to the regions near the data manifold and higher energies to other regions. Similar to the probabilistic GANs, a generator is seen as being trained to produce contrastive samples with minimal energies, while the discriminator is trained to assign high energies to these generated samples. Viewing the discriminator as an energy function allows to use a wide variety of architectures and loss functionals in addition to the usual binary classifier with logistic output. Among them, we show one instantiation of EBGAN framework as using an auto-encoder architecture, with the energy being the reconstruction error, in place of the discriminator. We show that this form of EBGAN exhibits more stable behavior than regular GANs during training. We also show that a single-scale architecture can be trained to generate high-resolution images."	https://openreview.net/forum?id=ryh9pmcee	Junbo Zhao, Michael Mathieu, Yann LeCun
Entropy-SGD: Biasing Gradient Descent Into Wide Valleys	This paper proposes a new optimization algorithm called Entropy-SGD for training deep neural networks that is motivated by the local geometry of the energy landscape. Local extrema with low generalization error have a large proportion of almost-zero eigenvalues in the Hessian with very few positive or negative eigenvalues. We leverage upon this observation to construct a local-entropy-based objective function that favors well-generalizable solutions lying in large flat regions of the energy landscape, while avoiding poorly-generalizable solutions located in the sharp valleys. Conceptually, our algorithm resembles two nested loops of SGD where we use Langevin dynamics in the inner loop to compute the gradient of the local entropy before each update of the weights. We show that the new objective has a smoother energy landscape and show improved generalization over SGD using uniform stability, under certain assumptions. Our experiments on convolutional and recurrent neural networks demonstrate that Entropy-SGD compares favorably to state-of-the-art techniques in terms of generalization error and training time.	https://openreview.net/forum?id=B1YfAfcgl	Pratik Chaudhari, Anna Choromanska, Stefano Soatto, Yann LeCun, Carlo Baldassi, Christian Borgs, Jennifer Chayes, Levent Sagun, Riccardo Zecchina
Episode-Based Active Learning with Bayesian Neural Networks	We investigate different strategies for active learning with Bayesian deep neural networks. We focus our analysis on scenarios where new, unlabeled data is obtained episodically, such as commonly encountered in mobile robotics applications. An evaluation of different strategies for acquisition, updating, and final training on the CIFAR-10 dataset shows that incremental network updates with final training on the accumulated acquisition set are essential for best performance, while limiting the amount of required human labeling labor.	https://openreview.net/forum?id=r1bMV7Ntg	Feras Dayoub, Niko Suenderhauf, Peter Corke
Episodic Exploration for Deep Deterministic Policies for StarCraft Micromanagement	We consider scenarios from the real-time strategy game StarCraft as benchmarks for reinforcement learning algorithms. We focus on micromanagement, that is, the short-term, low-level control of team members during a battle. We propose several scenarios that are challenging for reinforcement learning algorithms because the state- action space is very large, and there is no obvious feature representation for the value functions. We describe our approach to tackle the micromanagement scenarios with deep neural network controllers from raw state features given by the game engine. We also present a heuristic reinforcement learning algorithm which combines direct exploration in the policy space and backpropagation. This algorithm collects traces for learning using deterministic policies, which appears much more efficient than, e.g., ε-greedy exploration. Experiments show that this algorithm allows to successfully learn non-trivial strategies for scenarios with armies of up to 15 agents, where both Q-learning and REINFORCE struggle.	https://openreview.net/forum?id=r1LXit5ee	Nicolas Usunier, Gabriel Synnaeve, Zeming Lin, Soumith Chintala
Evaluating Dimensionality Reduction of 2D Histogram Data from Truck On-board Sensors	This work presents evaluation of several approaches for unsupervised mapping of raw sensor data from Volvo trucks into low-dimensional representation. The overall goal is to extract general features which are suitable for more than one task. Comparison of techniques based on t-distributed stochastic neighbor embedding (t-SNE) and convolutional autoencoders (CAE) is performed in a supervised fashion over 74 different 1-vs-Rest tasks using random forest. Multiple distance metrics for t-SNE and multiple architectures for CAE were considered. The results show that t-SNE is most effective for 2D and 3D, while CAE could be recommended for 10D representations. Fine-tuning the best convolutional architecture improved low-dimensional representation to the point where it slightly outperformed the original data representation.	https://openreview.net/forum?id=HJOuEn7Fx	Evaldas Vaiciukynas, Matej Ulicny, Sepideh Pashami, Slawomir Nowaczyk
Explaining the Learning Dynamics of Direct Feedback Alignment	"Two recently developed methods, Feedback Alignment (FA) and Direct Feedback Alignment (DFA), have been shown to obtain surprising performance on vision tasks by replacing the traditional backpropagation update with a random feedback update. However, it is still not clear what mechanisms allow learning to happen with these random updates. In this work we argue that DFA can be viewed as a noisy variant of a layer-wise training method we call Linear Aligned Feedback Systems (LAFS). We support this connection theoretically by comparing the update rules for the two methods. We additionally empirically verify that the random update matrices used in DFA work effectively as readout matrices, and that strong correlations exist between the error vectors used in the DFA and LAFS updates. With this new connection between DFA and LAFS we are able to explain why the ""alignment"" happens in DFA."	https://openreview.net/forum?id=HkXKUTVFl	Justin Gilmer, Colin Raffel, Samuel S. Schoenholz, Maithra Raghu, and Jascha Sohl-Dickstein
Exploring LOTS in Deep Neural Networks	Deep neural networks have recently demonstrated excellent performance on various tasks. Despite recent advances, our understanding of these learning models is still incomplete, at least, as their unexpected vulnerability to imperceptibly small, non-random perturbations revealed. The existence of these so-called adversarial examples presents a serious problem of the application of vulnerable machine learning models. In this paper, we introduce the layerwise origin-target synthesis (LOTS) that can serve multiple purposes. First, we can use it as a visualization technique that gives us insights into the function of any intermediate feature layer by showing the notion of a particular input in deep neural networks. Second, our approach can be applied to assess the invariance of the learned features captured at any layer with respect to the class of the particular input. Third, we can also utilize LOTS as a general way of producing a vast amount of diverse adversarial examples that can be used for training to further improve the robustness and performance of machine learning models. However, we show that the improvement with respect to adversarial robustness to different adversarial types varies and highly depends on the type used for training - some adversarial generation techniques can be almost completely immune to adversarial training.	https://openreview.net/forum?id=SJOQPR7Yl	Andras Rozsa, Manuel Gunther, Terrance E. Boult
Exploring Sparsity in Recurrent Neural Networks	Recurrent neural networks (RNN) are widely used to solve a variety of problems and as the quantity of data and the amount of available compute have increased, so have model sizes. The number of parameters in recent state-of-the-art networks makes them hard to deploy, especially on mobile phones and embedded devices. The challenge is due to both the size of the model and the time it takes to evaluate it. In order to deploy these RNNs efficiently, we propose a technique to reduce the parameters of a network by pruning weights during the initial training of the network. At the end of training, the parameters of the network are sparse while accuracy is still close to the original dense neural network. The network size is reduced by 8× and the time required to train the model remains constant. Additionally, we can prune a larger dense network to achieve better than baseline performance while still reducing the total number of parameters significantly. Pruning RNNs reduces the size of the model and can also help achieve significant inference time speed-up using sparse GEMMs. Benchmarks show that using our technique model size can be reduced by 90% and speed-up is around 2× to 7×.	https://openreview.net/forum?id=BylSPv9gx	Sharan Narang, Greg Diamos, Shubho Sengupta, Erich Elsen
Exploring loss function topology with cyclical learning rates	We present observations and discussion of previously unreported phenomena discovered while training residual networks. The goal of this work is to better understand the nature of neural networks through the examination of these new empirical results. These behaviors were identified through the application of Cyclical Learning Rates (CLR) and linear network interpolation. Among these behaviors are counterintuitive increases and decreases in training loss and instances of rapid training. For example, we demonstrate how CLR can produce greater testing accuracy than traditional training despite using large learning rates.	https://openreview.net/forum?id=H1PMaa1Yg	Leslie N. Smith, Nicholay Topin
