title	abstract	url	authors
Recurrent Mixture Density Network for Spatiotemporal Visual Attention	In many computer vision tasks, the relevant information to solve the problem at hand is mixed to irrelevant, distracting information. This has motivated researchers to design attentional models that can dynamically focus on parts of images or videos that are salient, e.g., by down-weighting irrelevant pixels. In this work, we propose a spatiotemporal attentional model that learns where to look in a video directly from human fixation data. We model visual attention with a mixture of Gaussians at each frame. This distribution is used to express the probability of saliency for each pixel. Time consistency in videos is modeled hierarchically by: 1) deep 3D convolutional features to represent spatial and short-term time relations and 2) a long short-term memory network on top that aggregates the clip-level representation of sequential clips and therefore expands the temporal domain from few frames to seconds. The parameters of the proposed model are optimized via maximum likelihood estimation using human fixations as training data, without knowledge of the action in each video. Our experiments on Hollywood2 show state-of-the-art performance on saliency prediction for video. We also show that our attentional model trained on Hollywood2 generalizes well to UCF101 and it can be leveraged to improve action classification accuracy on both datasets.	https://openreview.net/forum?id=SJRpRfKxx	Loris Bazzani, Hugo Larochelle, Lorenzo Torresani
Recurrent Normalization Propagation	We propose a LSTM parametrization that preserves the means and variances of the hidden states and memory cells across time. While having training benefits similar to Recurrent Batch Normalization and Layer Normalization, it does not need to estimate statistics at each time step, therefore, requiring fewer computations overall. We also investigate the parametrization impact on the gradient flows and present a way of initializing the weights accordingly. We evaluate our proposal on language modelling and image generative modelling tasks. We empirically show that it performs similarly or better than other recurrent normalization approaches, while being faster to execute.	https://openreview.net/forum?id=r1GKzP5xx	César Laurent, Nicolas Ballas, Pascal Vincent
Recursive Regression with Neural Networks: Approximating the HJI PDE Solution	Most machine learning applications using neural networks seek to approximate some function g(x) by minimizing some cost criterion. In the simplest case, if one has access to pairs of the form (x, y) where y = g(x), the problem can be framed as a regression problem. Beyond this family of problems, we find many cases where the unavailability of data pairs makes this approach unfeasible. However, similar to what we find in the reinforcement learning literature, if we have some known properties of the function we are seeking to approximate, there is still hope to frame the problem as a regression problem. In this context, we present an algorithm that approximates the solution to a partial differential equation known as the Hamilton-Jacobi-Isaacs PDE and compare it to current state of the art tools. This PDE, which is found in the fields of control theory and robotics, is of particular importance in safety critical systems where guarantees of performance are a must.	https://openreview.net/forum?id=HJTXaw9gx	Vicenç Rubies Royo, Claire Tomlin
Regularizing CNNs with Locally Constrained Decorrelations	Regularization is key for deep learning since it allows training more complex models while keeping lower levels of overfitting. However, the most prevalent regularizations do not leverage all the capacity of the models since they rely on reducing the effective number of parameters. Feature decorrelation is an alternative for using the full capacity of the models but the overfitting reduction margins are too narrow given the overhead it introduces. In this paper, we show that regularizing negatively correlated features is an obstacle for effective decorrelation and present OrthoReg, a novel regularization technique that locally enforces feature orthogonality. As a result, imposing locality constraints in feature decorrelation removes interferences between negatively correlated feature weights, allowing the regularizer to reach higher decorrelation bounds, and reducing the overfitting more effectively. In particular, we show that the models regularized with OrthoReg have higher accuracy bounds even when batch normalization and dropout are present. Moreover, since our regularization is directly performed on the weights, it is especially suitable for fully convolutional neural networks, where the weight space is constant compared to the feature map space. As a result, we are able to reduce the overfitting of state-of-the-art CNNs on CIFAR-10, CIFAR-100, and SVHN.	https://openreview.net/forum?id=ByOvsIqeg	Pau Rodríguez, Jordi Gonzàlez, Guillem Cucurull, Josep M. Gonfaus, Xavier Roca
Regularizing Neural Networks by Penalizing Confident Output Distributions	We propose regularizing neural networks by penalizing low entropy output distributions. We show that penalizing low entropy output distributions, which has been shown to improve exploration in reinforcement learning, acts as a strong regularizer in supervised learning. We connect our confidence penalty to label smoothing through the direction of the KL divergence between networks output distribution and the uniform distribution. We exhaustively evaluate our proposed confidence penalty and label smoothing (uniform and unigram) on 6 common benchmarks: image classification (MNIST and Cifar-10), language modeling (Penn Treebank), machine translation (WMT'14 English-to-German), and speech recognition (TIMIT and WSJ). We find that both label smoothing and our confidence penalty improve state-of-the-art models across benchmarks without modifying existing hyper-parameters.	https://openreview.net/forum?id=HyhbYrGYe	Gabriel Pereyra, George Tucker, Jan Chorowski, Lukasz Kaiser, Geoffrey Hinton
Reinforcement Learning through Asynchronous Advantage Actor-Critic on a GPU	We introduce a hybrid CPU/GPU version of the Asynchronous Advantage Actor-Critic (A3C) algorithm, currently the state-of-the-art method in reinforcement learning for various gaming tasks. We analyze its computational traits and concentrate on aspects critical to leveraging the GPU's computational power. We introduce a system of queues and a dynamic scheduling strategy, potentially helpful for other asynchronous algorithms as well. Our hybrid CPU/GPU version of A3C, based on TensorFlow, achieves a significant speed up compared to a CPU implementation; we make it publicly available to other researchers at https://github.com/NVlabs/GA3C.	https://openreview.net/forum?id=r1VGvBcxl	Mohammad Babaeizadeh, Iuri Frosio, Stephen Tyree, Jason Clemons, Jan Kautz
Reinforcement Learning with Unsupervised Auxiliary Tasks	Deep reinforcement learning agents have achieved state-of-the-art results by directly maximising cumulative reward. However, environments contain a much wider variety of possible training signals. In this paper, we introduce an agent that also maximises many other pseudo-reward functions simultaneously by reinforcement learning. All of these tasks share a common representation that, like unsupervised learning, continues to develop in the absence of extrinsic rewards. We also introduce a novel mechanism for focusing this representation upon extrinsic rewards, so that learning can rapidly adapt to the most relevant aspects of the actual task. Our agent significantly outperforms the previous state-of-the-art on Atari, averaging 880\% expert human performance, and a challenging suite of first-person, three-dimensional \emph{Labyrinth} tasks leading to a mean speedup in learning of 10$\times$ and averaging 87\% expert human performance on Labyrinth.	https://openreview.net/forum?id=SJ6yPD5xg	Max Jaderberg, Volodymyr Mnih, Wojciech Marian Czarnecki, Tom Schaul, Joel Z Leibo, David Silver, Koray Kavukcuoglu
Reinterpreting Importance-Weighted Autoencoders	The standard interpretation of importance-weighted autoencoders is that they maximize a tighter lower bound on the marginal likelihood. We give an alternate interpretation of this procedure: that it optimizes the standard variational lower bound, but using a more complex distribution. We formally derive this result, and visualize the implicit importance-weighted approximate posterior.	https://openreview.net/forum?id=Syw2ZgrFx	Chris Cremer, Quaid Morris, David Duvenaud
RenderGAN: Generating Realistic Labeled Data	Deep Convolutional Neuronal Networks (DCNNs) are showing remarkable performance on many computer vision tasks. Due to their large parameter space, they require many labeled samples when trained in a supervised setting. The costs of annotating data manually can render the use of DCNNs infeasible. We present a novel framework called RenderGAN that can generate large amounts of realistic, labeled images by combining a 3D model and the Generative Adversarial Network framework. In our approach, image augmentations (e.g. lighting, background, and detail) are learned from unlabeled data such that the generated images are strikingly realistic while preserving the labels known from the 3D model. We apply the RenderGAN framework to generate images of barcode-like markers that are attached to honeybees. Training a DCNN on data generated by the RenderGAN yields considerably better performance than training it on various baselines.	https://openreview.net/forum?id=BkGakb9lx	Leon Sixt, Benjamin Wild, Tim Landgraf
Restricted Boltzmann Machines provide an accurate metric for retinal responses to visual stimuli	How to discriminate visual stimuli based on the activity they evoke in sensory neurons is still an open challenge. To measure discriminability power, we search for a neural metric that preserves distances in stimulus space, so that responses to different stimuli are far apart and responses to the same stimulus are close. Here, we show that Restricted Boltzmann Machines (RBMs) provide such a distance-preserving neural metric. Even when learned in a unsupervised way, RBM-based metric can discriminate stimuli with higher resolution than classical metrics.	https://openreview.net/forum?id=Sk1OOnNFx	Christophe Gardella, Olivier Marre, Thierry Mora
Revisiting Batch Normalization For Practical Domain Adaptation	Deep neural networks (DNN) have shown unprecedented success in various computer vision applications such as image classification and object detection. However, it is still a common annoyance during the training phase, that one has to prepare at least thousands of labeled images to fine-tune a network to a specific domain. Recent study shows that a DNN has strong dependency towards the training dataset, and the learned features cannot be easily transferred to a different but relevant task without fine-tuning. In this paper, we propose a simple yet powerful remedy, called Adaptive Batch Normalization (AdaBN) to increase the generalization ability of a DNN. By modulating the statistics from the source domain to the target domain in all Batch Normalization layers across the network, our approach achieves deep adaptation effect for domain adaptation tasks. In contrary to other deep learning domain adaptation methods, our method does not require additional components, and is parameter-free. It archives state-of-the-art performance despite its surprising simplicity. Furthermore, we demonstrate that our method is complementary with other existing methods. Combining AdaBN with existing domain adaptation treatments may further improve model performance.	https://openreview.net/forum?id=Hk6dkJQFx	Yanghao Li, Naiyan Wang, Jianping Shi, Jiaying Liu, Xiaodi Hou
Revisiting Classifier Two-Sample Tests	The goal of two-sample tests is to assess whether two samples, $S_P \sim P^n$ and $S_Q \sim Q^m$, are drawn from the same distribution. Perhaps intriguingly, one relatively unexplored method to build two-sample tests is the use of binary classifiers. In particular, construct a dataset by pairing the $n$ examples in $S_P$ with a positive label, and by pairing the $m$ examples in $S_Q$ with a negative label. If the null hypothesis ``$P = Q$'' is true, then the classification accuracy of a binary classifier on a held-out subset of this dataset should remain near chance-level. As we will show, such \emph{Classifier Two-Sample Tests} (C2ST) learn a suitable representation of the data on the fly, return test statistics in interpretable units, have a simple null distribution, and their predictive uncertainty allow to interpret where $P$ and $Q$ differ. The goal of this paper is to establish the properties, performance, and uses of C2ST. First, we analyze their main theoretical properties. Second, we compare their performance against a variety of state-of-the-art alternatives. Third, we propose their use to evaluate the sample quality of generative models with intractable likelihoods, such as Generative Adversarial Networks (GANs). Fourth, we showcase the novel application of GANs together with C2ST for causal discovery.	https://openreview.net/forum?id=SJkXfE5xx	David Lopez-Paz, Maxime Oquab
Robustness to Adversarial Examples through an Ensemble of Specialists	We are proposing to use an ensemble of diverse specialists, where speciality is defined according to the confusion matrix. Indeed, we observed that for adversarial instances originating from a given class, labeling tend to be done into a small subset of (incorrect) classes. Therefore, we argue that an ensemble of specialists should be better able to identify and reject fooling instances, with a high entropy (i.e., disagreement) over the decisions in the presence of adversaries. Experimental results obtained confirm that interpretation, opening a way to make the system more robust to adversarial examples through a rejection mechanism, rather than trying to classify them properly at any cost.	https://openreview.net/forum?id=S1cYxlSFx	Mahdieh Abbasi, Christian Gagne
SGDR: Stochastic Gradient Descent with Warm Restarts	Restart techniques are common in gradient-free optimization to deal with multimodal functions. Partial warm restarts are also gaining popularity in gradient-based optimization to improve the rate of convergence in accelerated gradient schemes to deal with ill-conditioned functions. In this paper, we propose a simple warm restart technique for stochastic gradient descent to improve its anytime performance when training deep neural networks. We empirically study its performance on the CIFAR-10 and CIFAR-100 datasets, where we demonstrate new state-of-the-art results at 3.14\% and 16.21\%, respectively. We also demonstrate its advantages on a dataset of EEG recordings and on a downsampled version of the ImageNet dataset. Our source code is available at \\ \url{https://github.com/loshchil/SGDR}	https://openreview.net/forum?id=Skq89Scxx	Ilya Loshchilov, Frank Hutter
Sample Efficient Actor-Critic with  Experience Replay	This paper presents an actor-critic deep reinforcement learning agent with experience replay that is stable, sample efficient, and performs remarkably well on challenging environments, including the discrete 57-game Atari domain and several continuous control problems. To achieve this, the paper introduces several innovations, including truncated importance sampling with bias correction, stochastic dueling network architectures, and a new trust region policy optimization method.	https://openreview.net/forum?id=HyM25Mqel	Ziyu Wang, Victor Bapst, Nicolas Heess, Volodymyr Mnih, Remi Munos, Koray Kavukcuoglu, Nando de Freitas
SampleRNN: An Unconditional End-to-End Neural Audio Generation Model	In this paper we propose a novel model for unconditional audio generation task that generates one audio sample at a time. We show that our model which profits from combining memory-less modules, namely autoregressive multilayer perceptron, and stateful recurrent neural networks in a hierarchical structure is de facto powerful to capture the underlying sources of variations in temporal domain for very long time on three datasets of different nature. Human evaluation on the generated samples indicate that our model is preferred over competing models. We also show how each component of the model contributes to the exhibited performance.	https://openreview.net/forum?id=SkxKPDv5xl	Soroush Mehri, Kundan Kumar, Ishaan Gulrajani, Rithesh Kumar, Shubham Jain, Jose Sotelo, Aaron Courville, Yoshua Bengio
Semantic embeddings for program behaviour patterns	In this paper, we propose a new feature extraction technique for program execution logs. First, we automatically extract complex patterns from a program's behaviour graph. Then, we embed these patterns into a continuous space by training an autoencoder. We evaluate the proposed features on a real-world malicious software detection task. We also find that the embedding space captures interpretable structures in the space of pattern parts.	https://openreview.net/forum?id=BJ_X2yHFe	Alexander Chistyakov, Ekaterina Lobacheva, Arseny Kuznetsov, Alexey Romanenko
Semi-Supervised Classification with Graph Convolutional Networks	We present a scalable approach for semi-supervised learning on graph-structured data that is based on an efficient variant of convolutional neural networks which operate directly on graphs. We motivate the choice of our convolutional architecture via a localized first-order approximation of spectral graph convolutions. Our model scales linearly in the number of graph edges and learns hidden layer representations that encode both local graph structure and features of nodes. In a number of experiments on citation networks and on a knowledge graph dataset we demonstrate that our approach outperforms related methods by a significant margin.	https://openreview.net/forum?id=SJU4ayYgl	Thomas N. Kipf, Max Welling
Semi-supervised Knowledge Transfer for Deep Learning from Private Training Data	Some machine learning applications involve training data that is sensitive, such as the medical histories of patients in a clinical trial. A model may inadvertently and implicitly store some of its training data; careful analysis of the model may therefore reveal sensitive information. To address this problem, we demonstrate a generally applicable approach to providing strong privacy guarantees for training data: Private Aggregation of Teacher Ensembles (PATE). The approach combines, in a black-box fashion, multiple models trained with disjoint datasets, such as records from different subsets of users. Because they rely directly on sensitive data, these models are not published, but instead used as ''teachers'' for a ''student'' model. The student learns to predict an output chosen by noisy voting among all of the teachers, and cannot directly access an individual teacher or the underlying data or parameters. The student's privacy properties can be understood both intuitively (since no single teacher and thus no single dataset dictates the student's training) and formally, in terms of differential privacy. These properties hold even if an adversary can not only query the student but also inspect its internal workings. Compared with previous work, the approach imposes only weak assumptions on how teachers are trained: it applies to any model, including non-convex models like DNNs. We achieve state-of-the-art privacy/utility trade-offs on MNIST and SVHN thanks to an improved privacy analysis and semi-supervised learning.	https://openreview.net/forum?id=HkwoSDPgg	Nicolas Papernot, Martín Abadi, Úlfar Erlingsson, Ian Goodfellow, Kunal Talwar
Semi-supervised deep learning by metric embedding	Deep networks are successfully used as classification models yielding state-of-the-art results when trained on a large number of labeled samples. These models, however, are usually much less suited for semi-supervised problems because of their tendency to overfit easily when trained on small amounts of data. In this work we will explore a new training objective that is targeting a semi-supervised regime with only a small subset of labeled data. This criterion is based on a deep metric embedding over distance relations within the set of labeled samples, together with constraints over the embeddings of the unlabeled set. The final learned representations are discriminative in euclidean space, and hence can be used with subsequent nearest-neighbor classification using the labeled samples.	https://openreview.net/forum?id=r1R5Z19le	Elad Hoffer, Nir Ailon
Shake-Shake regularization of 3-branch residual networks	The method introduced in this paper aims at helping computer vision practitioners faced with an overfit problem. The idea is to replace, in a 3-branch ResNet, the standard summation of residual branches by a stochastic affine combination. The largest tested model improves on the best single shot published result on CIFAR-10 by reaching 2.86% test error. Code is available at https://github.com/xgastaldi/shake-shake	https://openreview.net/forum?id=HkO-PCmYl	Xavier Gastaldi
Shift Aggregate Extract Networks	The Shift Aggregate Extract Network SAEN is an architecture for learning representations on social network data. SAEN decomposes input graphs into hierarchies made of multiple strata of objects. Vector representations of each object are learnt by applying 'shift', 'aggregate' and 'extract' operations on the vector representations of its parts. We propose an algorithm for domain compression which takes advantage of symmetries in hierarchical decompositions to reduce the memory usage and obtain significant speedups. Our method is empirically evaluated on real world social network datasets, outperforming the current state of the art.	https://openreview.net/forum?id=S1Y0td9ee	Francesco Orsini, Daniele Baracchi, Paolo Frasconi
Short and Deep: Sketching and Neural Networks	Data-independent methods for dimensionality reduction such as random projections, sketches, and feature hashing have become increasingly popular in recent years. These methods often seek to reduce dimensionality while preserving the hypothesis class, resulting in inherent lower bounds on the size of projected data. For example, preserving linear separability requires $\Omega(1/\gamma^2)$ dimensions, where $\gamma$ is the margin, and in the case of polynomial functions, the number of required dimensions has an exponential dependence on the polynomial degree. Despite these limitations, we show that the dimensionality can be reduced further while maintaining performance guarantees, using improper learning with a slightly larger hypothesis class. In particular, we show that any sparse polynomial function of a sparse binary vector can be computed from a compact sketch by a single-layer neural network, where the sketch size has a logarithmic dependence on the polynomial degree. A practical consequence is that networks trained on sketched data are compact, and therefore suitable for settings with memory and power constraints. We empirically show that our approach leads to networks with fewer parameters than related methods such as feature hashing, at equal or better performance.	https://openreview.net/forum?id=r1br_2Kge	Amit Daniely, Nevena Lazic, Yoram Singer, Kunal Talwar
Sigma Delta Quantized Networks	Deep neural networks can be obscenely wasteful. When processing video, a convolutional network expends a fixed amount of computation for each frame with no regard to the similarity between neighbouring frames. As a result, it ends up repeatedly doing very similar computations. To put an end to such waste, we introduce Sigma-Delta networks. With each new input, each layer in this network sends a discretized form of its change in activation to the next layer. Thus the amount of computation that the network does scales with the amount of change in the input and layer activations, rather than the size of the network. We introduce an optimization method for converting any pre-trained deep network into an optimally efficient Sigma-Delta network, and show that our algorithm, if run on the appropriate hardware, could cut at least an order of magnitude from the computational cost of processing video data.	https://openreview.net/forum?id=HkNRsU5ge	Peter O'Connor, Max Welling
Similarity preserving compressions of high dimensional sparse data	The rise of internet has resulted in an explosion of data consisting of millions of articles, images, songs, and videos. Most of this data is high dimensional and sparse, where the standard compression schemes, such as LSH, become in- efficient due to at least one of the following reasons: 1. Compression length is nearly linear in the dimension and grows inversely with the sparsity 2. Randomness used grows linearly with the product of dimension and compression length. We propose an efficient compression scheme mapping binary vectors into binary vectors and simultaneously preserving Hamming distance and Inner Product. Our schemes avoid all the above mentioned drawbacks for high dimensional sparse data. The length of our compression depends only on the sparsity and is indepenent of the dimension of the data, and our schemes work in the streaming setting as well. We generalize our scheme for real-valued data and obtain compressions for Euclidean distance, Inner Product, and k-way Inner Product.	https://openreview.net/forum?id=BJNXJgVKg	Raghav Kulkarni, Rameshwar Pratap
