title	abstract	url	authors
Hate Speech and Offensive Language Detection in Bengali	Social media often serves as a breeding ground for various hateful and offensive content. Identifying such content on social media is crucial due to its impact on the race, gender, or religion in an unprejudiced society. However, while there is extensive research in hate speech detection in English, there is a gap in hateful content detection in low-resource languages like Bengali. Besides, a current trend on social media is the use of Romanized Bengali for regular interactions. To overcome the existing research's limitations, in this study, we develop an annotated dataset of 10K Bengali posts consisting of 5K actual and 5K Romanized Bengali tweets. We implement several baseline models for the classification of such hateful posts. We further explore the interlingual transfer mechanism to boost classification performance. Finally, we perform an in-depth error analysis by looking into the misclassified posts by the models. While training actual and Romanized datasets separately, we observe that XLM-Roberta performs the best. Further, we witness that on joint training and few-shot training, MuRIL outperforms other models by interpreting the semantic expressions better. We make our code and dataset public for others.	https://aclanthology.org/2022.aacl-main.23	Mithun Das, Somnath Banerjee, Punyajoy Saha, Animesh Mukherjee
CrowdChecked: Detecting Previously Fact-Checked Claims in Social Media	While there has been substantial progress in developing systems to automate fact-checking, they still lack credibility in the eyes of the users. Thus, an interesting approach has emerged: to perform automatic fact-checking by verifying whether an input claim has been previously fact-checked by professional fact-checkers and to return back an article that explains their decision. This is a sensible approach as people trust manual fact-checking, and as many claims are repeated multiple times. Yet, a major issue when building such systems is the small number of known tweet–verifying article pairs available for training. Here, we aim to bridge this gap by making use of crowd fact-checking, i.e., mining claims in social media for which users have responded with a link to a fact-checking article. In particular, we mine a large-scale collection of 330,000 tweets paired with a corresponding fact-checking article. We further propose an end-to-end framework to learn from this noisy data based on modified self-adaptive training, in a distant supervision scenario. Our experiments on the CLEF'21 CheckThat! test set show improvements over the state of the art by two points absolute. Our code and datasets are available at https://github.com/mhardalov/crowdchecked-claims	https://aclanthology.org/2022.aacl-main.22	Momchil Hardalov, Anton Chernyavskiy, Ivan Koychev, Dmitry Ilvovsky, Preslav Nakov
Who did what to Whom? Language models and humans respond diversely to features affecting argument hierarchy construction	"Pre-trained transformer-based language models have achieved state-of-the-art performance in many areas of NLP. It is still an open question whether the models are capable of integrating syntax and semantics in language processing like humans. This paper investigates if models and humans construct argument hierarchy similarly with the effects from telicity, agency, and individuation, using the Chinese structure ""NP1+BA/BEI+NP2+VP"". We present both humans and six transformer-based models with prepared sentences and analyze their preference between BA (view NP1 as an agent) and BEI (NP2 as an agent). It is found that the models and humans respond to (non-)agentive features in telic context and atelic feature very similarly. However, the models show insufficient sensitivity to both pragmatic function in expressing undesirable events and different individuation degrees represented by human common nouns vs. proper names. By contrast, humans rely heavily on these cues to establish the thematic relation between two arguments NP1 and NP2. Furthermore, the models tend to interpret the subject as an agent, which is not the case for humans who align agents independently of subject position in Mandarin Chinese."	https://aclanthology.org/2022.aacl-main.21	Xiaonan Xu, Haoshuo Chen
Towards Unified Representations of Knowledge Graph and Expert Rules for Machine Learning and Reasoning	With a knowledge graph and a set of if-then rules, can we reason about the conclusions given a set of observations? In this work, we formalize this question as the cognitive inference problem, and introduce the Cognitive Knowledge Graph (CogKG) that unifies two representations of heterogeneous symbolic knowledge: expert rules and relational facts. We propose a general framework in which the unified knowledge representations can perform both learning and reasoning. Specifically, we implement the above framework in two settings, depending on the availability of labeled data. When no labeled data are available for training, the framework can directly utilize symbolic knowledge as the decision basis and perform reasoning. When labeled data become available, the framework casts symbolic knowledge as a trainable neural architecture and optimizes the connection weights among neurons through gradient descent. Empirical study on two clinical diagnosis benchmarks demonstrates the superiority of the proposed method over time-tested knowledge-driven and data-driven methods, showing the great potential of the proposed method in unifying heterogeneous symbolic knowledge, i.e., expert rules and relational facts, as the substrate of machine learning and reasoning models.	https://aclanthology.org/2022.aacl-main.20	Zhepei Wei, Yue Wang, Jinnan Li, Zhining Liu, Erxin Yu, Yuan Tian, Xin Wang, Yi Chang
AGRank: Augmented Graph-based Unsupervised Keyphrase Extraction	Keywords or keyphrases are often used to highlight a document's domains or main topics. Unsupervised keyphrase extraction (UKE) has always been highly anticipated because no labeled data is needed to train a model. This paper proposes an augmented graph-based unsupervised model to identify keyphrases from a document by integrating graph and deep learning methods. The proposed model utilizes mutual attention extracted from the pre-trained BERT model to build the candidate graph and augments the graph with global and local context nodes to improve the performance. The proposed model is evaluated on four publicly available datasets against thirteen UKE baselines. The results show that the proposed model is an effective and robust UKE model for long and short documents. Our source code is available on GitHub.	https://aclanthology.org/2022.aacl-main.19	Haoran Ding, Xiao Luo
Neural Text Sanitization with Explicit Measures of Privacy Risk	We present a novel approach for text sanitization, which is the task of editing a document to mask all (direct and indirect) personal identifiers and thereby conceal the identity of the individuals(s) mentioned in the text. In contrast to previous work, the approach relies on explicit measures of privacy risk, making it possible to explicitly control the trade-off between privacy protection and data utility. The approach proceeds in three steps. A neural, privacy-enhanced entity recognizer is first employed to detect and classify potential personal identifiers. We then determine which entities, or combination of entities, are likely to pose a re-identification risk through a range of privacy risk assessment measures. We present three such measures of privacy risk, respectively based on (1) span probabilities derived from a BERT language model, (2) web search queries and (3) a classifier trained on labelled data. Finally, a linear optimization solver decides which entities to mask to minimize the semantic loss while simultaneously ensuring that the estimated privacy risk remains under a given threshold. We evaluate the approach both in the absence and presence of manually annotated data. Our results highlight the potential of the approach, as well as issues specific types of personal data can introduce to the process.	https://aclanthology.org/2022.aacl-main.18	Anthi Papadopoulou, Yunhao Yu, Pierre Lison, Lilja Øvrelid
Semantic Shift Stability: Efficient Way to Detect Performance Degradation of Word Embeddings and Pre-trained Language Models	"Word embeddings and pre-trained language models have become essential technical elements in natural language processing. While the general practice is to use or fine-tune publicly available models, there are significant advantages in creating or pre-training unique models that match the domain. The performance of the models degrades as language changes or evolves continuously, but the high cost of model building inhibits regular re-training, especially for the language models. This study proposes an efficient way to detect time-series performance degradation of word embeddings and pre-trained language models by calculating the degree of semantic shift. Monitoring performance through the proposed method supports decision-making as to whether a model should be re-trained. The experiments demonstrated that the proposed method can identify time-series performance degradation in two datasets, Japanese and English. The source code is available at <a href=""https://github.com/Nikkei/semantic-shift-stability"" class=""acl-markup-url"">https://github.com/Nikkei/semantic-shift-stability ."	https://aclanthology.org/2022.aacl-main.17	Shotaro Ishihara, Hiromu Takahashi, Hono Shirai
Arabic Dialect Identification with a Few Labeled Examples Using Generative Adversarial Networks	Given the challenges and complexities introduced while dealing with Dialect Arabic (DA) variations, Transformer based models, e.g., BERT, outperformed other models in dealing with the DA identification task. However, to fine-tune these models, a large corpus is required. Getting a large number high quality labeled examples for some Dialect Arabic classes is challenging and time-consuming. In this paper, we address the Dialect Arabic Identification task. We extend the transformer-based models, ARBERT and MARBERT, with unlabeled data in a generative adversarial setting using Semi-Supervised Generative Adversarial Networks (SS-GAN). Our model enabled producing high-quality embeddings for the Dialect Arabic examples and aided the model to better generalize for the downstream classification task given few labeled examples. Experimental results showed that our model reached better performance and faster convergence when only a few labeled examples are available.	https://aclanthology.org/2022.aacl-main.16	Mahmoud Yusuf, Marwan Torki, Nagwa El-Makky
Cross-lingual Similarity of Multilingual Representations Revisited	"Related works used indexes like CKA and variants of CCA to measure the similarity of cross-lingual representations in multilingual language models. In this paper, we argue that assumptions of CKA/CCA align poorly with one of the motivating goals of cross-lingual learning analysis, i.e., explaining zero-shot cross-lingual transfer. We highlight what valuable aspects of cross-lingual similarity these indexes fail to capture and provide a motivating case study demonstrating the problem empirically. Then, we introduce Average Neuron-Wise Correlation (ANC) as a straightforward alternative that is exempt from the difficulties of CKA/CCA and is good specifically in a cross-lingual context. Finally, we use ANC to construct evidence that the previously introduced ""first align, then predict"" pattern takes place not only in masked language models (MLMs) but also in multilingual models with causal language modeling objectives (CLMs). Moreover, we show that the pattern extends to the scaled versions of the MLMs and CLMs (up to 85x original mBERT). Our code is publicly available at https://github.com/TartuNLP/xsim"	https://aclanthology.org/2022.aacl-main.15	Maksym Del, Mark Fishel
This Patient Looks Like That Patient: Prototypical Networks for Interpretable Diagnosis Prediction from Clinical Text	The use of deep neural models for diagnosis prediction from clinical text has shown promising results. However, in clinical practice such models must not only be accurate, but provide doctors with interpretable and helpful results. We introduce ProtoPatient, a novel method based on prototypical networks and label-wise attention with both of these abilities. ProtoPatient makes predictions based on parts of the text that are similar to prototypical patients—providing justifications that doctors understand. We evaluate the model on two publicly available clinical datasets and show that it outperforms existing baselines. Quantitative and qualitative evaluations with medical doctors further demonstrate that the model provides valuable explanations for clinical decision support.	https://aclanthology.org/2022.aacl-main.14	Betty van Aken, Jens-Michalis Papaioannou, Marcel Naik, Georgios Eleftheriadis, Wolfgang Nejdl, Felix Gers, Alexander Loeser
Grammatical Error Correction Systems for Automated Assessment: Are They Susceptible to Universal Adversarial Attacks?	Grammatical error correction (GEC) systems are a useful tool for assessing a learner's writing ability. These systems allow the grammatical proficiency of a candidate's text to be assessed without requiring an examiner or teacher to read the text. A simple summary of a candidate's ability can be measured by the total number of edits between the input text and the GEC system output: the fewer the edits the better the candidate. With advances in deep learning, GEC systems have become increasingly powerful and accurate. However, deep learning systems are susceptible to adversarial attacks, in which a small change at the input can cause large, undesired changes at the output. In the context of GEC for automated assessment, the aim of an attack can be to deceive the system into not correcting (concealing) grammatical errors to create the perception of higher language ability. An interesting aspect of adversarial attacks in this scenario is that the attack needs to be simple as it must be applied by, for example, a learner of English. The form of realistic attack examined in this work is appending the same phrase to each input sentence: a concatenative universal attack. The candidate only needs to learn a single attack phrase. State-of-the-art GEC systems are found to be susceptible to this form of simple attack, which transfers to different test sets as well as system architectures,	https://aclanthology.org/2022.aacl-main.13	Vyas Raina, Yiting Lu, Mark Gales
S+PAGE: A Speaker and Position-Aware Graph Neural Network Model for Emotion Recognition in Conversation	Emotion recognition in conversation (ERC) has attracted much attention in recent years for its necessity in widespread applications. With the development of graph neural network (GNN), recent state-of-the-art ERC models mostly use GNN to embed the intrinsic structure information of a conversation into the utterance features. In this paper, we propose a novel GNN-based model for ERC, namely S+PAGE, to better capture the speaker and position-aware conversation structure information. Specifically, we add the relative positional encoding and speaker dependency encoding in the representations of edge weights and edge types respectively to acquire a more reasonable aggregation algorithm for ERC. Besides, a two-stream conversational Transformer is presented to extract both the self and inter-speaker contextual features for each utterance. Extensive experiments are conducted on four ERC benchmarks with state-of-the-art models employed as baselines for comparison, whose results demonstrate the superiority of our model.	https://aclanthology.org/2022.aacl-main.12	Chen Liang, Jing Xu, Yangkun Lin, Chong Yang, Yongliang Wang
SPARQL-to-Text Question Generation for Knowledge-Based Conversational Applications	This paper focuses on the generation of natural language questions based on SPARQL queries, with an emphasis on conversational use cases (follow-up question-answering). It studies what can be achieved so far based on current deep learning models (namely pretrained T5 and BART models). To do so, 4 knowledge-based QA corpora have been homogenized for the task and a new challenge set is introduced. A first series of experiments analyzes the impact of different training setups, while a second series seeks to understand what is still difficult for these models. The results from automatic metrics and human evaluation show that simple questions and frequent templates of SPARQL queries are usually well processed whereas complex questions and conversational dimensions (coreferences and ellipses) are still difficult to handle. The experimental material is publicly available on https://github.com/Orange-OpenSource/sparql-to-text .	https://aclanthology.org/2022.aacl-main.11	Gwénolé Lecorvé, Morgan Veyret, Quentin Brabant, Lina M. Rojas Barahona
Missing Modality meets Meta Sampling (M3S): An Efficient Universal Approach for Multimodal Sentiment Analysis with Missing Modality	Multimodal sentiment analysis (MSA) is an important way of observing mental activities with the help of data captured from multiple modalities. However, due to the recording or transmission error, some modalities may include incomplete data. Most existing works that address missing modalities usually assume a particular modality is completely missing and seldom consider a mixture of missing across multiple modalities. In this paper, we propose a simple yet effective meta-sampling approach for multimodal sentiment analysis with missing modalities, namely Missing Modality-based Meta Sampling (M3S). To be specific, M3S formulates a missing modality sampling strategy into the modal agnostic meta-learning (MAML) framework. M3S can be treated as an efficient add-on training component on existing models and significantly improve their performances on multimodal data with a mixture of missing modalities. We conduct experiments on IEMOCAP, SIMS and CMU-MOSI datasets, and superior performance is achieved compared with recent state-of-the-art methods.	https://aclanthology.org/2022.aacl-main.10	Haozhe Chi, Minghua Yang, Junhao Zhu, Guanhong Wang, Gaoang Wang
WAX: A New Dataset for Word Association eXplanations	Word associations are among the most common paradigms to study the human mental lexicon. While their structure and types of associations have been well studied, surprisingly little attention has been given to the question of why participants produce the observed associations. Answering this question would not only advance understanding of human cognition, but could also aid machines in learning and representing basic commonsense knowledge. This paper introduces a large, crowd-sourced data set of English word associations with explanations, labeled with high-level relation types. We present an analysis of the provided explanations, and design several tasks to probe to what extent current pre-trained language models capture the underlying relations. Our experiments show that models struggle to capture the diversity of human associations, suggesting WAX is a rich benchmark for commonsense modeling and generation.	https://aclanthology.org/2022.aacl-main.9	Chunhua Liu, Trevor Cohn, Simon De Deyne, Lea Frermann
An Embarrassingly Simple Approach for Intellectual Property Rights Protection on Recurrent Neural Networks	Capitalise on deep learning models, offering Natural Language Processing (NLP) solutions as a part of the Machine Learning as a Service (MLaaS) has generated handsome revenues. At the same time, it is known that the creation of these lucrative deep models is non-trivial. Therefore, protecting these inventions' intellectual property rights (IPR) from being abused, stolen and plagiarized is vital. This paper proposes a practical approach for the IPR protection on recurrent neural networks (RNN) without all the bells and whistles of existing IPR solutions. Particularly, we introduce the Gatekeeper concept that resembles the recurrent nature in RNN architecture to embed keys. Also, we design the model training scheme in a way such that the protected RNN model will retain its original performance iff a genuine key is presented. Extensive experiments showed that our protection scheme is robust and effective against ambiguity and removal attacks in both white-box and black-box protection schemes on different RNN variants. Code is available at https://github.com/zhiqin1998/RecurrentIPR.	https://aclanthology.org/2022.aacl-main.8	Zhi Qin Tan, Hao Shan Wong, Chee Seng Chan
Graph-augmented Learning to Rank for Querying Large-scale Knowledge Graph	Knowledge graph question answering (KGQA) based on information retrieval aims to answer a question by retrieving answer from a large-scale knowledge graph. Most existing methods first roughly retrieve the knowledge subgraphs (KSG) that may contain candidate answer, and then search for the exact answer in the KSG. However, the KSG may contain thousands of candidate nodes since the knowledge graph involved in querying is often of large scale, thus decreasing the performance of answer selection. To tackle this problem, we first propose to partition the retrieved KSG to several smaller sub-KSGs via a new subgraph partition algorithm and then present a graph-augmented learning to rank model to select the top-ranked sub-KSGs from them. Our proposed model combines a novel subgraph matching networks to capture global interactions in both question and subgraphs and an Enhanced Bilateral Multi-Perspective Matching model to capture local interactions. Finally, we apply an answer selection model on the full KSG and the top-ranked sub-KSGs respectively to validate the effectiveness of our proposed graph-augmented learning to rank method. The experimental results on multiple benchmark datasets have demonstrated the effectiveness of our approach.	https://aclanthology.org/2022.aacl-main.7	Hanning Gao, Lingfei Wu, Po Hu, Zhihua Wei, Fangli Xu, Bo Long
Systematic Evaluation of Predictive Fairness	Mitigating bias in training on biased datasets is an important open problem. Several techniques have been proposed, however the typical evaluation regime is very limited, considering very narrow data conditions. For instance, the effect of target class imbalance and stereotyping is under-studied. To address this gap, we examine the performance of various debiasing methods across multiple tasks, spanning binary classification (Twitter sentiment), multi-class classification (profession prediction), and regression (valence prediction). Through extensive experimentation, we find that data conditions have a strong influence on relative model performance, and that general conclusions cannot be drawn about method efficacy when evaluating only on standard datasets, as is current practice in fairness research.	https://aclanthology.org/2022.aacl-main.6	Xudong Han, Aili Shen, Trevor Cohn, Timothy Baldwin, Lea Frermann
Leveraging Key Information Modeling to Improve Less-Data Constrained News Headline Generation via Duality Fine-Tuning	Recent language generative models are mostly trained on large-scale datasets, while in some real scenarios, the training datasets are often expensive to obtain and would be small-scale. In this paper we investigate the challenging task of less-data constrained generation, especially when the generated news headlines are short yet expected by readers to keep readable and informative simultaneously. We highlight the key information modeling task and propose a novel duality fine-tuning method by formally defining the probabilistic duality constraints between key information prediction and headline generation tasks. The proposed method can capture more information from limited data, build connections between separate tasks, and is suitable for less-data constrained generation tasks. Furthermore, the method can leverage various pre-trained generative regimes, e.g., autoregressive and encoder-decoder models. We conduct extensive experiments to demonstrate that our method is effective and efficient to achieve improved performance in terms of language modeling metric and informativeness correctness metric on two public datasets.	https://aclanthology.org/2022.aacl-main.5	Zhuoxuan Jiang, Lingfeng Qiao, Di Yin, Shanshan Feng, Bo Ren
CNN for Modeling Sanskrit Originated Bengali and Hindi Language	Though recent works have focused on modeling high resource languages, the area is still unexplored for low resource languages like Bengali and Hindi. We propose an end to end trainable memory efficient CNN architecture named CoCNN to handle specific characteristics such as high inflection, morphological richness, flexible word order and phonetical spelling errors of Bengali and Hindi. In particular, we introduce two learnable convolutional sub-models at word and at sentence level that are end to end trainable. We show that state-of-the-art (SOTA) Transformer models including pretrained BERT do not necessarily yield the best performance for Bengali and Hindi. CoCNN outperforms pretrained BERT with 16X less parameters and achieves much better performance than SOTA LSTMs on multiple real-world datasets. This is the first study on the effectiveness of different architectures from Convolution, Recurrent, and Transformer neural net paradigm for modeling Bengali and Hindi.	https://aclanthology.org/2022.aacl-main.4	Chowdhury Rahman, MD. Hasibur Rahman, Mohammad Rafsan, Mohammed Eunus Ali, Samiha Zakir, Rafsanjani Muhammod
