title	abstract	url	authors
Neural Readability Pairwise Ranking for Sentences in Italian Administrative Language	Automatic Readability Assessment aims at assigning a complexity level to a given text, which could help improve the accessibility to information in specific domains, such as the administrative one. In this paper, we investigate the behavior of a Neural Pairwise Ranking Model (NPRM) for sentence-level readability assessment of Italian administrative texts. To deal with data scarcity, we experiment with cross-lingual, cross- and in-domain approaches, and test our models on Admin-It, a new parallel corpus in the Italian administrative language, containing sentences simplified using three different rewriting strategies. We show that NPRMs are effective in zero-shot scenarios (~0.78 ranking accuracy), especially with ranking pairs containing simplifications produced by overall rewriting at the sentence-level, and that the best results are obtained by adding in-domain data (achieving perfect performance for such sentence pairs). Finally, we investigate where NPRMs failed, showing that the characteristics of the training data, rather than its size, have a bigger effect on a model's performance.	https://aclanthology.org/2022.aacl-main.63	Martina Miliani, Serena Auriemma, Fernando Alva-Manchego, Alessandro Lenci
Some Languages are More Equal than Others: Probing Deeper into the Linguistic Disparity in the NLP World	Linguistic disparity in the NLP world is a problem that has been widely acknowledged recently. However, different facets of this problem, or the reasons behind this disparity are seldom discussed within the NLP community. This paper provides a comprehensive analysis of the disparity that exists within the languages of the world. We show that simply categorising languages considering data availability may not be always correct. Using an existing language categorisation based on speaker population and vitality, we analyse the distribution of language data resources, amount of NLP/CL research, inclusion in multilingual web-based platforms and the inclusion in pre-trained multilingual models. We show that many languages do not get covered in these resources or platforms, and even within the languages belonging to the same language group, there is wide disparity. We analyse the impact of family, geographical location, GDP and the speaker population of languages and provide possible reasons for this disparity, along with some suggestions to overcome the same.	https://aclanthology.org/2022.aacl-main.62	Surangika Ranathunga, Nisansa de Silva
Domain-aware Self-supervised Pre-training for Label-Efficient Meme Analysis	Existing self-supervised learning strategies are constrained to either a limited set of objectives or generic downstream tasks that predominantly target uni-modal applications. This has isolated progress for imperative multi-modal applications that are diverse in terms of complexity and domain-affinity, such as meme analysis. Here, we introduce two self-supervised pre-training methods, namely Ext-PIE-Net and MM-SimCLR that (i) employ off-the-shelf multi-modal hate-speech data during pre-training and (ii) perform self-supervised learning by incorporating multiple specialized pretext tasks, effectively catering to the required complex multi-modal representation learning for meme analysis. We experiment with different self-supervision strategies, including potential variants that could help learn rich cross-modality representations and evaluate using popular linear probing on the Hateful Memes task. The proposed solutions strongly compete with the fully supervised baseline via label-efficient training while distinctly outperforming them on all three tasks of the Memotion challenge with 0.18%, 23.64%, and 0.93% performance gain, respectively. Further, we demonstrate the generalizability of the proposed solutions by reporting competitive performance on the HarMeme task. Finally, we empirically establish the quality of the learned representations by analyzing task-specific learning, using fewer labeled training samples, and arguing that the complexity of the self-supervision strategy and downstream task at hand are correlated. Our efforts highlight the requirement of better multi-modal self-supervision methods involving specialized pretext tasks for efficient fine-tuning and generalizable performance.	https://aclanthology.org/2022.aacl-main.60	Shivam Sharma, Mohd Khizir Siddiqui, Md. Shad Akhtar, Tanmoy Chakraborty
A Prompt Array Keeps the Bias Away: Debiasing Vision-Language Models with Adversarial Learning	Vision-language models can encode societal biases and stereotypes, but there are challenges to measuring and mitigating these multimodal harms due to lacking measurement robustness and feature degradation. To address these challenges, we investigate bias measures and apply ranking metrics for image-text representations. We then investigate debiasing methods and show that prepending learned embeddings to text queries that are jointly trained with adversarial debiasing and a contrastive loss, reduces various bias measures with minimal degradation to the image-text representation.	https://aclanthology.org/2022.aacl-main.61	Hugo Berg, Siobhan Hall, Yash Bhalgat, Hannah Kirk, Aleksandar Shtedritski, Max Bain
Cross-lingual Few-Shot Learning on Unseen Languages	Large pre-trained language models (LMs) have demonstrated the ability to obtain good performance on downstream tasks with limited examples in cross-lingual settings. However, this was mostly studied for relatively resource-rich languages, where at least enough unlabeled data is available to be included in pre-training a multilingual language model. In this paper, we explore the problem of cross-lingual transfer in unseen languages, where no unlabeled data is available for pre-training a model. We use a downstream sentiment analysis task across 12 languages, including 8 unseen languages, to analyze the effectiveness of several few-shot learning strategies across the three major types of model architectures and their learning dynamics. We also compare strategies for selecting languages for transfer and contrast findings across languages seen in pre-training compared to those that are not. Our findings contribute to the body of knowledge on cross-lingual models for low-resource settings that is paramount to increasing coverage, diversity, and equity in access to NLP technology. We show that, in few-shot learning, linguistically similar and geographically similar languages are useful for cross-lingual adaptation, but taking the context from a mixture of random source languages is surprisingly more effective. We also compare different model architectures and show that the encoder-only model, XLM-R, gives the best downstream task performance.	https://aclanthology.org/2022.aacl-main.59	Genta Winata, Shijie Wu, Mayank Kulkarni, Thamar Solorio, Daniel Preotiuc-Pietro
KESA: A Knowledge Enhanced Approach To Sentiment Analysis	Though some recent works focus on injecting sentiment knowledge into pre-trained language models, they usually design mask and reconstruction tasks in the post-training phase. This paper aims to integrate sentiment knowledge in the fine-tuning stage. To achieve this goal, we propose two sentiment-aware auxiliary tasks named sentiment word selection and conditional sentiment prediction and, correspondingly, integrate them into the objective of the downstream task. The first task learns to select the correct sentiment words from the given options. The second task predicts the overall sentiment polarity, with the sentiment polarity of the word given as prior knowledge. In addition, two label combination methods are investigated to unify multiple types of labels in each auxiliary task. Experimental results demonstrate that our approach consistently outperforms baselines (achieving a new state-of-the-art) and is complementary to existing sentiment-enhanced post-trained models.	https://aclanthology.org/2022.aacl-main.58	Qinghua Zhao, Shuai Ma, Shuo Ren
Unsupervised Domain Adaptation for Sparse Retrieval by Filling Vocabulary and Word Frequency Gaps	IR models using a pretrained language model significantly outperform lexical approaches like BM25. In particular, SPLADE, which encodes texts to sparse vectors, is an effective model for practical use because it shows robustness to out-of-domain datasets. However, SPLADE still struggles with exact matching of low-frequency words in training data. In addition, domain shifts in vocabulary and word frequencies deteriorate the IR performance of SPLADE. Because supervision data are scarce in the target domain, addressing the domain shifts without supervision data is necessary. This paper proposes an unsupervised domain adaptation method by filling vocabulary and word-frequency gaps. First, we expand a vocabulary and execute continual pretraining with a masked language model on a corpus of the target domain. Then, we multiply SPLADE-encoded sparse vectors by inverse document frequency weights to consider the importance of documents with low-frequency words. We conducted experiments using our method on datasets with a large vocabulary gap from a source domain. We show that our method outperforms the present state-of-the-art domain adaptation method. In addition, our method achieves state-of-the-art results, combined with BM25.	https://aclanthology.org/2022.aacl-main.57	Hiroki Iida, Naoaki Okazaki
Low-Resource Multilingual and Zero-Shot Multispeaker TTS	While neural methods for text-to-speech (TTS) have shown great advances in modeling multiple speakers, even in zero-shot settings, the amount of data needed for those approaches is generally not feasible for the vast majority of the world's over 6,000 spoken languages. In this work, we bring together the tasks of zero-shot voice cloning and multilingual low-resource TTS. Using the language agnostic meta learning (LAML) procedure and modifications to a TTS encoder, we show that it is possible for a system to learn speaking a new language using just 5 minutes of training data while retaining the ability to infer the voice of even unseen speakers in the newly learned language. We show the success of our proposed approach in terms of intelligibility, naturalness and similarity to target speaker using objective metrics as well as human studies and provide our code and trained models open source.	https://aclanthology.org/2022.aacl-main.56	Florian Lux, Julia Koch, Ngoc Thang Vu
Re-contextualizing Fairness in NLP: The Case of India	Recent research has revealed undesirable biases in NLP data and models. However, these efforts focus of social disparities in West, and are not directly portable to other geo-cultural contexts. In this paper, we focus on NLP fairness in the context of India. We start with a brief account of the prominent axes of social disparities in India. We build resources for fairness evaluation in the Indian context and use them to demonstrate prediction biases along some of the axes. We then delve deeper into social stereotypes for Region and Religion, demonstrating its prevalence in corpora and models. Finally, we outline a holistic research agenda to re-contextualize NLP fairness research for the Indian context, accounting for Indian societal context, bridging technological gaps in NLP capabilities and resources, and adapting to Indian cultural values. While we focus on India, this framework can be generalized to other geo-cultural contexts.	https://aclanthology.org/2022.aacl-main.55	Shaily Bhatt, Sunipa Dev, Partha Talukdar, Shachi Dave, Vinodkumar Prabhakaran
Enhancing Tabular Reasoning with Pattern Exploiting Training	Recent methods based on pre-trained language models have exhibited superior performance over tabular tasks (e.g., tabular NLI), despite showing inherent problems such as not using the right evidence and inconsistent predictions across inputs while reasoning over the tabular data (Gupta et al., 2021). In this work, we utilize Pattern-Exploiting Training (PET) (i.e., strategic MLM) on pre-trained language models to strengthen these tabular reasoning models' pre-existing knowledge and reasoning abilities. Our upgraded model exhibits a superior understanding of knowledge facts and tabular reasoning compared to current baselines. Additionally, we demonstrate that such models are more effective for underlying downstream tasks of tabular inference on INFOTABS. Furthermore, we show our model's robustness against adversarial sets generated through various character and word level perturbations.	https://aclanthology.org/2022.aacl-main.54	Abhilash Shankarampeta, Vivek Gupta, Shuo Zhang
Contrastive Video-Language Learning with Fine-grained Frame Sampling	Despite recent progress in video and language representation learning, the weak or sparse correspondence between the two modalities remains a bottleneck in the area. Most video-language models are trained via pair-level loss to predict whether a pair of video and text is aligned. However, even in paired video-text segments, only a subset of the frames are semantically relevant to the corresponding text, with the remainder representing noise; where the ratio of noisy frames is higher for longer videos. We propose FineCo (Fine-grained Contrastive Loss for Frame Sampling), an approach to better learn video and language representations with a fine-grained contrastive objective operating on video frames. It helps distil a video by selecting the frames that are semantically equivalent to the text, improving cross-modal correspondence. Building on the well established VideoCLIP model as a starting point, FineCo achieves state-of-the-art performance on YouCookII, a text-video retrieval benchmark with long videos. FineCo also achieves competitive results on text-video retrieval (MSR-VTT), and video question answering datasets (MSR-VTT QA and MSR-VTT MC) with shorter videos.	https://aclanthology.org/2022.aacl-main.53	Zixu Wang, Yujie Zhong, Yishu Miao, Lin Ma, Lucia Specia
Analogy-Guided Evolutionary Pretraining of Binary Word Embeddings	"As we begin to see low-powered computing paradigms (Neuromorphic Computing, Spiking Neural Networks, etc.) becoming more popular, learning binary word embeddings has become increasingly important for supporting NLP applications at the edge. Existing binary word embeddings are mostly derived from pretrained real-valued embeddings through different simple transformations, which often break the semantic consistency and the so-called ""arithmetic"" properties learned by the original, real-valued embeddings. This paper aims to address this limitation by introducing a new approach to learn binary embeddings from scratch, preserving the semantic relationships between words as well as the arithmetic properties of the embeddings themselves. To achieve this, we propose a novel genetic algorithm to learn the relationships between words from existing word analogy data-sets, carefully making sure that the arithmetic properties of the relationships are preserved. Evaluating our generated 16, 32, and 64-bit binary word embeddings on Mikolov's word analogy task shows that more than 95% of the time, the best fit for the analogy is ranked in the top 5 most similar words in terms of cosine similarity."	https://aclanthology.org/2022.aacl-main.52	R. Alexander Knipper, Md. Mahadi Hassan, Mehdi Sadi, Shubhra Kanti Karmaker Santu
Construction Repetition Reduces Information Rate in Dialogue	Speakers repeat constructions frequently in dialogue. Due to their peculiar information-theoretic properties, repetitions can be thought of as a strategy for cost-effective communication. In this study, we focus on the repetition of lexicalised constructions—i.e., recurring multi-word units—in English open-domain spoken dialogues. We hypothesise that speakers use construction repetition to mitigate information rate, leading to an overall decrease in utterance information content over the course of a dialogue. We conduct a quantitative analysis, measuring the information content of constructions and that of their containing utterances, estimating information content with an adaptive neural language model. We observe that construction usage lowers the information content of utterances. This facilitating effect (i) increases throughout dialogues, (ii) is boosted by repetition, (iii) grows as a function of repetition frequency and density, and (iv) is stronger for repetitions of referential constructions.	https://aclanthology.org/2022.aacl-main.51	Mario Giulianelli, Arabella Sinclair, Raquel Fernández
Food Knowledge Representation Learning with Adversarial Substitution	Knowledge graph embedding (KGE) has been well-studied in general domains, but has not been examined for food computing. To fill this gap, we perform knowledge representation learning over a food knowledge graph (KG). We employ a pre-trained language model to encode entities and relations, thus emphasizing contextual information in food KGs. The model is trained on two tasks – predicting a masked entity from a given triple from the KG and predicting the plausibility of a triple. Analysis of food substitutions helps in dietary choices for enabling healthier eating behaviors. Previous work in food substitutions mainly focuses on semantic similarity while ignoring the context. It is also hard to evaluate the substitutions due to the lack of an adequate validation set, and further, the evaluation is subjective based on perceived purpose. To tackle this problem, we propose a collection of adversarial sample generation strategies for different food substitutions over our learnt KGE. We propose multiple strategies to generate high quality context-aware recipe and ingredient substitutions and also provide generalized ingredient substitutions to meet different user needs. The effectiveness and efficiency of the proposed knowledge graph learning method and the following attack strategies are verified by extensive evaluations on a large-scale food KG.	https://aclanthology.org/2022.aacl-main.50	Diya Li, Mohammed J Zaki
The Lifecycle of “Facts”: A Survey of Social Bias in Knowledge Graphs	Knowledge graphs are increasingly used in a plethora of downstream tasks or in the augmentation of statistical models to improve factuality. However, social biases are engraved in these representations and propagate downstream. We conducted a critical analysis of literature concerning biases at different steps of a knowledge graph lifecycle. We investigated factors introducing bias, as well as the biases that are rendered by knowledge graphs and their embedded versions afterward. Limitations of existing measurement and mitigation strategies are discussed and paths forward are proposed.	https://aclanthology.org/2022.aacl-main.49	Angelie Kraft, Ricardo Usbeck
SBERT studies Meaning Representations: Decomposing Sentence Embeddings into Explainable Semantic Features	Models based on large-pretrained language models, such as S(entence)BERT, provide effective and efficient sentence embeddings that show high correlation to human similarity ratings, but lack interpretability. On the other hand, graph metrics for graph-based meaning representations (e.g., Abstract Meaning Representation, AMR) can make explicit the semantic aspects in which two sentences are similar. However, such metrics tend to be slow, rely on parsers, and do not reach state-of-the-art performance when rating sentence similarity. In this work, we aim at the best of both worlds, by learning to induce Semantically Structured Sentence BERT embeddings (S 3 BERT). Our S 3 BERT embeddings are composed of explainable sub-embeddings that emphasize various sentence meaning features (e.g., semantic roles, negation, or quantification). We show how to i) learn a decomposition of the sentence embeddings into meaning features, through approximation of a suite of interpretable semantic AMR graph metrics, and how to ii) preserve the overall power of the neural embeddings by controlling the decomposition learning process with a second objective that enforces consistency with the similarity ratings of an SBERT teacher model. In our experimental studies, we show that our approach offers interpretability – while preserving the effectiveness and efficiency of the neural sentence embeddings.	https://aclanthology.org/2022.aacl-main.48	Juri Opitz, Anette Frank
Multimodal Generation of Radiology Reports using Knowledge-Grounded Extraction of Entities and Relations	Automated reporting has the potential to assist radiologists with the time-consuming procedure of generating text radiology reports. Most existing approaches generate the report directly from the radiology image, however we observe that the resulting reports exhibit realistic style but lack clinical accuracy. Therefore, we propose a two-step pipeline that subdivides the problem into factual triple extraction followed by free-text report generation. The first step comprises supervised extraction of clinically relevant structured information from the image, expressed as triples of the form (entity1, relation, entity2). In the second step, these triples are input to condition the generation of the radiology report. In particular, we focus our work on Chest X-Ray (CXR) radiology report generation. The proposed framework shows state-of-the-art results on the MIMIC-CXR dataset according to most of the standard text generation metrics that we employ (BLEU, METEOR, ROUGE) and to clinical accuracy metrics (recall, precision and F1 assessed using the CheXpert labeler), also giving a 23% reduction in the total number of errors and a 29% reduction in critical clinical errors as assessed by expert human evaluation. In future, this solution can easily integrate more advanced model architectures - to both improve the triple extraction and the report generation - and can be applied to other complex image captioning tasks, such as those found in the medical domain.	https://aclanthology.org/2022.aacl-main.47	Francesco Dalla Serra, William Clackett, Hamish MacKinnon, Chaoyang Wang, Fani Deligianni, Jeff Dalton, Alison Q. O’Neil
A Decade of Knowledge Graphs in Natural Language Processing: A Survey	In pace with developments in the research field of artificial intelligence, knowledge graphs (KGs) have attracted a surge of interest from both academia and industry. As a representation of semantic relations between entities, KGs have proven to be particularly relevant for natural language processing (NLP), experiencing a rapid spread and wide adoption within recent years. Given the increasing amount of research work in this area, several KG-related approaches have been surveyed in the NLP research community. However, a comprehensive study that categorizes established topics and reviews the maturity of individual research streams remains absent to this day. Contributing to closing this gap, we systematically analyzed 507 papers from the literature on KGs in NLP. Our survey encompasses a multifaceted review of tasks, research types, and contributions. As a result, we present a structured overview of the research landscape, provide a taxonomy of tasks, summarize our findings, and highlight directions for future work.	https://aclanthology.org/2022.aacl-main.46	Phillip Schneider, Tim Schopf, Juraj Vladika, Mikhail Galkin, Elena Simperl, Florian Matthes
Toward Implicit Reference in Dialog: A Survey of Methods and Data	Communicating efficiently in natural language requires that we often leave information implicit, especially in spontaneous speech. This frequently results in phenomena of incompleteness, such as omitted references, that pose challenges for language processing. In this survey paper, we review the state of the art in research regarding the automatic processing of such implicit references in dialog scenarios, discuss weaknesses with respect to inconsistencies in task definitions and terminologies, and outline directions for future work. Among others, these include a unification of existing tasks, addressing data scarcity, and taking into account model and annotator uncertainties.	https://aclanthology.org/2022.aacl-main.45	Lindsey Vanderlyn, Talita Anthonio, Daniel Ortega, Michael Roth, Ngoc Thang Vu
SAPGraph: Structure-aware Extractive Summarization for Scientific Papers with Heterogeneous Graph	Scientific paper summarization is always challenging in Natural Language Processing (NLP) since it is hard to collect summaries from such long and complicated text. We observe that previous works tend to extract summaries from the head of the paper, resulting in information incompleteness. In this work, we present SAPGraph to utilize paper structure for solving this problem. SAPGraph is a scientific paper extractive summarization framework based on a structure-aware heterogeneous graph, which models the document into a graph with three kinds of nodes and edges based on structure information of facets and knowledge. Additionally, we provide a large-scale dataset of COVID-19-related papers, CORD-SUM. Experiments on CORD-SUM and ArXiv datasets show that SAPGraph generates more comprehensive and valuable summaries compared to previous works.	https://aclanthology.org/2022.aacl-main.44	Siya Qi, Lei Li, Yiyang Li, Jin Jiang, Dingxin Hu, Yuze Li, Yingqi Zhu, Yanquan Zhou, Marina Litvak, Natalia Vanetik
