title	abstract	url	authors
The Battlefront of Combating Misinformation and Coping with Media Bias	Misinformation is a pressing issue in modern society. It arouses a mixture of anger, distrust, confusion, and anxiety that cause damage on our daily life judgments and public policy decisions. While recent studies have explored various fake news detection and media bias detection techniques in attempts to tackle the problem, there remain many ongoing challenges yet to be addressed, as can be witnessed from the plethora of untrue and harmful content present during the COVID-19 pandemic and the international crises of late. In this tutorial, we provide researchers and practitioners with a systematic overview of the frontier in fighting misinformation. Specifically, we dive into the important research questions of how to (i) develop a robust fake news detection system, which not only fact-check information pieces provable by background knowledge but also reason about the consistency and the reliability of subtle details for emerging events; (ii) uncover the bias and agenda of news sources to better characterize misinformation; as well as (iii) correct false information and mitigate news bias, while allowing diverse opinions to be expressed. Moreover, we discuss the remaining challenges, future research directions, and exciting opportunities to help make this world a better place, with safer and more harmonic information sharing.	https://aclanthology.org/2022.aacl-tutorials.5	Yi Fung, Kung-Hsiang Huang, Preslav Nakov, Heng Ji
Grounding Meaning Representation for Situated Reasoning	"As natural language technology becomes ever-present in everyday life, people will expect artificial agents to understand language use as humans do. Nevertheless, most advanced neural AI systems fail at some types of interactions that are trivial for humans (e.g., ask a smart system ""What am I pointing at?""). One critical aspect of human language understanding is situated reasoning, where inferences make reference to the local context, perceptual surroundings, and contextual groundings from the interaction. In this cutting-edge tutorial, we bring to the NLP/CL community a synthesis of multimodal grounding and meaning representation techniques with formal and computational models of embodied reasoning. We will discuss existing approaches to multimodal language grounding and meaning representations, discuss the kind of information each method captures and their relative suitability to situated reasoning tasks, and demon- strate how to construct agents that conduct situated reasoning by embodying a simulated environment. In doing so, these agents also represent their human interlocutor(s) within the simulation, and are represented through their virtual embodiment in the real world, enabling true bidirectional communication with a computer using multiple modalities."	https://aclanthology.org/2022.aacl-tutorials.4	Nikhil Krishnaswamy, James Pustejovsky
When Cantonese NLP Meets Pre-training: Progress and Challenges	"Cantonese is an influential Chinese variant with a large population of speakers worldwide. However, it is under-resourced in terms of the data scale and diversity, excluding Cantonese Natural Language Processing (NLP) from the stateof-the-art (SOTA) ""pre-training and fine-tuning"" paradigm. This tutorial will start with a substantially review of the linguistics and NLP progress for shaping language specificity, resources, and methodologies. It will be followed by an introduction to the trendy transformerbased pre-training methods, which have been largely advancing the SOTA performance of a wide range of downstream NLP tasks in numerous majority languages (e.g., English and Chinese). Based on the above, we will present the main challenges for Cantonese NLP in relation to Cantonese language idiosyncrasies of colloquialism and multilingualism, followed by the future directions to line NLP for Cantonese and other low-resource languages up to the cutting-edge pre-training practice."	https://aclanthology.org/2022.aacl-tutorials.3	Rong Xiang, Hanzhuo Tan, Jing Li, Mingyu Wan, Kam-Fai Wong
Recent Advances in Pre-trained Language Models: Why Do They Work and How Do They Work	Pre-trained language models (PLMs) are language models that are pre-trained on large-scaled corpora in a self-supervised fashion. These PLMs have fundamentally changed the natural language processing community in the past few years. In this tutorial, we aim to provide a broad and comprehensive introduction from two perspectives: why those PLMs work, and how to use them in NLP tasks. The first part of the tutorial shows some insightful analysis on PLMs that partially explain their exceptional downstream performance. The second part first focuses on emerging pre-training methods that enable PLMs to perform diverse downstream tasks and then illustrates how one can apply those PLMs to downstream tasks under different circumstances. These circumstances include fine-tuning PLMs when under data scarcity, and using PLMs with parameter efficiency. We believe that attendees of different backgrounds would find this tutorial informative and useful.	https://aclanthology.org/2022.aacl-tutorials.2	Cheng-Han Chiang, Yung-Sung Chuang, Hung-yi Lee
Efficient and Robust Knowledge Graph Construction	Knowledge graph construction which aims to extract knowledge from the text corpus, has appealed to the NLP community researchers. Previous decades have witnessed the remarkable progress of knowledge graph construction on the basis of neural models; however, those models often cost massive computation or labeled data resources and suffer from unstable inference accounting for biased or adversarial samples. Recently, numerous approaches have been explored to mitigate the efficiency and robustness issues for knowledge graph construction, such as prompt learning and adversarial training. In this tutorial, we aim to bring interested NLP researchers up to speed on the recent and ongoing techniques for efficient and robust knowledge graph construction. Additionally, our goal is to provide a systematic and up-to-date overview of these methods and reveal new research opportunities to the audience.	https://aclanthology.org/2022.aacl-tutorials.1	Ningyu Zhang, Tao Gui, Guoshun Nan
A Tour of Explicit Multilingual Semantics: Word Sense Disambiguation, Semantic Role Labeling and Semantic Parsing	The recent advent of modern pretrained language models has sparked a revolution in Natural Language Processing (NLP), especially in multilingual and cross-lingual applications. Today, such language models have become the de facto standard for providing rich input representations to neural systems, achieving unprecedented results in an increasing range of benchmarks. However, questions that often arise are: firstly, whether current language models are, indeed, able to capture explicit, symbolic meaning; secondly, if they are, to what extent; thirdly, and perhaps more importantly, whether current approaches are capable of scaling across languages. In this cutting-edge tutorial, we will review recent efforts that have aimed at shedding light on meaning in NLP, with a focus on three key open problems in lexical and sentence-level semantics: Word Sense Disambiguation, Semantic Role Labeling, and Semantic Parsing. After a brief introduction, we will spotlight how state-of-the-art models tackle these tasks in multiple languages, showing where they excel and where they fail. We hope that this tutorial will broaden the audience interested in multilingual semantics and inspire researchers to further advance the field.	https://aclanthology.org/2022.aacl-tutorials.6	Roberto Navigli, Edoardo Barba, Simone Conia, Rexhina Blloshmi
UKP-SQuARE v2: Explainability and Adversarial Attacks for Trustworthy QA	Question Answering (QA) systems are increasingly deployed in applications where they support real-world decisions. However, state-of-the-art models rely on deep neural networks, which are difficult to interpret by humans. Inherently interpretable models or post hoc explainability methods can help users to comprehend how a model arrives at its prediction and, if successful, increase their trust in the system. Furthermore, researchers can leverage these insights to develop new methods that are more accurate and less biased. In this paper, we introduce SQuARE v2, the new version of SQuARE, to provide an explainability infrastructure for comparing models based on methods such as saliency maps and graph-based explanations. While saliency maps are useful to inspect the importance of each input token for the model's prediction, graph-based explanations from external Knowledge Graphs enable the users to verify the reasoning behind the model prediction. In addition, we provide multiple adversarial attacks to compare the robustness of QA models. With these explainability methods and adversarial attacks, we aim to ease the research on trustworthy QA models. SQuARE is available on https://square.ukp-lab.de.	https://aclanthology.org/2022.aacl-demo.4	Rachneet Sachdeva, Haritz Puerto, Tim Baumgärtner, Sewin Tariverdian, Hao Zhang, Kexin Wang, Hossain Shaikh Saadi, Leonardo F. R. Ribeiro, Iryna Gurevych
PicTalky: Augmentative and Alternative Communication for Language Developmental Disabilities	Children with language disabilities face communication difficulties in daily life. They are often deprived of the opportunity to participate in social activities due to their difficulty in understanding or using natural language. In this regard, Augmentative and Alternative Communication (AAC) can be a practical means of communication for children with language disabilities. In this study, we propose PicTalky, which is an AI-based AAC system that helps children with language developmental disabilities to improve their communication skills and language comprehension abilities. PicTalky can process both text and pictograms more accurately by connecting a series of neural-based NLP modules. Additionally, we perform quantitative and qualitative analyses on the modules of PicTalky. By using this service, it is expected that those suffering from language problems will be able to express their intentions or desires more easily and improve their quality of life. We have made the models freely available alongside a demonstration of the web interface. Furthermore, we implemented robotics AAC for the first time by applying PicTalky to the NAO robot.	https://aclanthology.org/2022.aacl-demo.3	Chanjun Park, Yoonna Jang, Seolhwa Lee, Jaehyung Seo, Kisu Yang, Heuiseok Lim
TexPrax: A Messaging Application for Ethical, Real-time Data Collection and Annotation	Collecting and annotating task-oriented dialog data is difficult, especially for highly specific domains that require expert knowledge. At the same time, informal communication channels such as instant messengers are increasingly being used at work. This has led to a lot of work-relevant information that is disseminated through those channels and needs to be post-processed manually by the employees. To alleviate this problem, we present TexPrax, a messaging system to collect and annotate _problems_, _causes_, and _solutions_ that occur in work-related chats. TexPrax uses a chatbot to directly engage the employees to provide lightweight annotations on their conversation and ease their documentation work. To comply with data privacy and security regulations, we use an end-to-end message encryption and give our users full control over their data which has various advantages over conventional annotation tools. We evaluate TexPrax in a user-study with German factory employees who ask their colleagues for solutions on problems that arise during their daily work. Overall, we collect 202 task-oriented German dialogues containing 1,027 sentences with sentence-level expert annotations. Our data analysis also reveals that real-world conversations frequently contain instances with code-switching, varying abbreviations for the same entity, and dialects which NLP systems should be able to handle.	https://aclanthology.org/2022.aacl-demo.2	Lorenz Stangier, Ji-Ung Lee, Yuxi Wang, Marvin Müller, Nicholas Frick, Joachim Metternich, Iryna Gurevych
VScript: Controllable Script Generation with Visual Presentation	In order to offer a customized script tool and inspire professional scriptwriters, we present VScript. It is a controllable pipeline that generates complete scripts, including dialogues and scene descriptions, as well as presents visually using video retrieval. With an interactive interface, our system allows users to select genres and input starting words that control the theme and development of the generated script. We adopt a hierarchical structure, which first generates the plot, then the script and its visual presentation. A novel approach is also introduced to plot-guided dialogue generation by treating it as an inverse dialogue summarization. The experiment results show that our approach outperforms the baselines on both automatic and human evaluations, especially in genre control.	https://aclanthology.org/2022.aacl-demo.1	Ziwei Ji, Yan Xu, I-Tsun Cheng, Samuel Cahyawijaya, Rita Frieske, Etsuko Ishii, Min Zeng, Andrea Madotto, Pascale Fung
Meeting Decision Tracker: Making Meeting Minutes with De-Contextualized Utterances	Meetings are a universal process to make decisions in business and project collaboration. The capability to automatically itemize the decisions in daily meetings allows for extensive tracking of past discussions. To that end, we developed Meeting Decision Tracker, a prototype system to construct decision items comprising decision utterance detector (DUD) and decision utterance rewriter (DUR). We show that DUR makes a sizable contribution to improving the user experience by dealing with utterance collapse in natural conversation. An introduction video of our system is also available at https://youtu.be/TG1pJJo0Iqo.	https://aclanthology.org/2022.aacl-demo.10	Shumpei Inoue, Hy Nguyen, Hoang Pham, Tsungwei Liu, Minh-Tien Nguyen
Text Characterization Toolkit (TCT)	We present a tool, Text Characterization Toolkit (TCT), that researchers can use to study characteristics of large datasets. Furthermore, such properties can lead to understanding the influence of such attributes on models' behaviour. Traditionally, in most NLP research, models are usually evaluated by reporting single-number performance scores on a number of readily available benchmarks, without much deeper analysis. Here, we argue that – especially given the well-known fact that benchmarks often contain biases, artefacts, and spurious correlations – deeper results analysis should become the de-facto standard when presenting new models or benchmarks. TCT aims at filling this gap by facilitating such deeper analysis for datasets at scale, where datasets can be for training/development/evaluation. TCT includes both an easy-to-use tool, as well as off-the-shelf scripts that can be used for specific analyses. We also present use-cases from several different domains. TCT is used to predict difficult examples for given well-known trained models; TCT is also used to identify (potentially harmful) biases present in a dataset.	https://aclanthology.org/2022.aacl-demo.9	Daniel Simig, Tianlu Wang, Verna Dankers, Peter Henderson, Khuyagbaatar Batsuren, Dieuwke Hupkes, Mona Diab
BiomedCurator: Data Curation for Biomedical Literature	We present BiomedCurator1, a web application that extracts the structured data from scientific articles in PubMed and ClinicalTrials.gov. BiomedCurator uses state-of-the-art natural language processing techniques to fill the fields pre-selected by domain experts in the relevant biomedical area. The BiomedCurator web application includes: text generation based model for relation extraction, entity detection and recognition, text classification model for extracting several fields, information retrieval from external knowledge base to retrieve IDs, and a pattern-based extraction approach that can extract several fields using regular expressions over the PubMed and ClinicalTrials.gov datasets. Evaluation results show that different approaches of BiomedCurator web application system are effective for automatic data curation in the biomedical domain.	https://aclanthology.org/2022.aacl-demo.8	Mohammad Golam Sohrab, Khoa N.A. Duong, Ikeda Masami, Goran Topić, Yayoi Natsume-Kitatani, Masakata Kuroda, Mari Nogami Itoh, Hiroya Takamura
Concreteness vs. Abstractness: A Selectional Preference Perspective	Concrete words refer to concepts that are strongly experienced through human senses (banana, chair, salt, etc.), whereas abstract concepts are less perceptually salient (idea, glory, justice, etc.). A clear definition of abstractness is crucial for the understanding of human cognitive processes and for the development of natural language applications such as figurative language detection. In this study, we investigate selectional preferences as a criterion to distinguish between concrete and abstract concepts and words: we hypothesise that abstract and concrete verbs and nouns differ regarding the semantic classes of their arguments. Our study uses a collection of 5,438 nouns and 1,275 verbs to exploit selectional preferences as a salient characteristic in classifying English abstract vs. concrete words, and in predicting their concreteness scores. We achieve an f1-score of 0.84 for nouns and 0.71 for verbs in classification, and Spearman's ρ correlation of 0.86 for nouns and 0.59 for verbs.	https://aclanthology.org/2022.aacl-srw.13	Tarun Tater, Diego Frassinelli, Sabine Schulte im Walde
PIEKM: ML-based Procedural Information Extraction and Knowledge Management System for Materials Science Literature	The published materials science literature contains abundant description information about synthesis procedures that can help discover new material areas, deepen the study of materials synthesis, and accelerate its automated planning. Nevertheless, this information is expressed in unstructured text, and manually processing and assimilating useful information is expensive and time-consuming for researchers. To address this challenge, we develop a Machine Learning-based procedural information extraction and knowledge management system (PIEKM) that extracts procedural information recipe steps, figures, and tables from materials science articles, and provides information retrieval capability and the statistics visualization functionality. Our system aims to help researchers to gain insights and quickly understand the connections among massive data. Moreover, we demonstrate that the machine learning-based system performs well in low-resource scenarios (i.e., limited annotated data) for domain adaption.	https://aclanthology.org/2022.aacl-demo.7	Huichen Yang, Carlos Aguirre, William Hsu
How to tackle an emerging topic? Combining strong and weak labels for Covid news NER	Being able to train Named Entity Recognition (NER) models for emerging topics is crucial for many real-world applications especially in the medical domain where new topics are continuously evolving out of the scope of existing models and datasets. For a realistic evaluation setup, we introduce a novel COVID-19 news NER dataset (COVIDNEWS-NER) and release 3000 entries of hand annotated strongly labelled sentences and 13000 auto-generated weakly labelled sentences. Besides the dataset, we propose CONTROSTER, a recipe to strategically combine weak and strong labels in improving NER in an emerging topic through transfer learning. We show the effectiveness of CONTROSTER on COVIDNEWS-NER while providing analysis on combining weak and strong labels for training. Our key findings are: (1) Using weak data to formulate an initial backbone before tuning on strong data outperforms methods trained on only strong or weak data. (2) A combination of out-of-domain and in-domain weak label training is crucial and can overcome saturation when being training on weak labels from a single source.	https://aclanthology.org/2022.aacl-short.60	Aleksander Ficek, Fangyu Liu, Nigel Collier
COFAR: Commonsense and Factual Reasoning in Image Search	"One characteristic that makes humans superior to modern artificially intelligent models is the ability to interpret images beyond what is visually apparent. Consider the following two natural language search queries – (i) ""a queue of customers patiently waiting to buy ice cream"" and (ii) ""a queue of tourists going to see a famous Mughal architecture in India"". Interpreting these queries requires one to reason with (i) Commonsense such as interpreting people as customers or tourists, actions as waiting to buy or going to see; and (ii) Fact or world knowledge associated with named visual entities, for example, whether the store in the image sells ice cream or whether the landmark in the image is a Mughal architecture located in India. Such reasoning goes beyond just visual recognition. To enable both commonsense and factual reasoning in the image search, we present a unified framework namely Knowledge Retrieval-Augmented Multimodal Transformer (KRAMT) that treats the named visual entities in an image as a gateway to encyclopedic knowledge and leverages them along with natural language query to ground relevant knowledge. Further, KRAMT seamlessly integrates visual content and grounded knowledge to learn alignment between images and search queries. This unified framework is then used to perform image search requiring commonsense and factual reasoning. The retrieval performance of KRAMT is evaluated and compared with related approaches on a new dataset we introduce – namely COFAR."	https://aclanthology.org/2022.aacl-main.87	Prajwal Gatti, Abhirama Subramanyam Penamakuri, Revant Teotia, Anand Mishra, Shubhashis Sengupta, Roshni Ramnani
Underspecification in Scene Description-to-Depiction Tasks	Questions regarding implicitness, ambiguity and underspecification are crucial for understanding the task validity and ethical concerns of multimodal image+text systems, yet have received little attention to date. This position paper maps out a conceptual framework to address this gap, focusing on systems which generate images depicting scenes from scene descriptions. In doing so, we account for how texts and images convey meaning differently. We outline a set of core challenges concerning textual and visual ambiguity, as well as risks that may be amplified by ambiguous and underspecified elements. We propose and discuss strategies for addressing these challenges, including generating visually ambiguous images, and generating a set of diverse images.	https://aclanthology.org/2022.aacl-main.86	Ben Hutchinson, Jason Baldridge, Vinodkumar Prabhakaran
Higher-Order Dependency Parsing for Arc-Polynomial Score Functions via Gradient-Based Methods and Genetic Algorithm	We present a novel method for higher-order dependency parsing which takes advantage of the general form of score functions written as arc-polynomials, a general framework which encompasses common higher-order score functions, and includes new ones. This method is based on non-linear optimization techniques, namely coordinate ascent and genetic search where we iteratively update a candidate parse. Updates are formulated as gradient-based operations, and are efficiently computed by auto-differentiation libraries. Experiments show that this method obtains results matching the recent state-of-the-art second order parsers on three standard datasets.	https://aclanthology.org/2022.aacl-main.85	Xudong Zhang, Joseph Le Roux, Thierry Charnois
Whodunit? Learning to Contrast for Authorship Attribution	Authorship attribution is the task of identifying the author of a given text. The key is finding representations that can differentiate between authors. Existing approaches typically use manually designed features that capture a dataset's content and style, but these approaches are dataset-dependent and yield inconsistent performance across corpora. In this work, we propose to learn author-specific representations by fine-tuning pre-trained generic language representations with a contrastive objective (Contra-X). We show that Contra-X learns representations that form highly separable clusters for different authors. It advances the state-of-the-art on multiple human and machine authorship attribution benchmarks, enabling improvements of up to 6.8% over cross-entropy fine-tuning. However, we find that Contra-X improves overall accuracy at the cost of sacrificing performance for some authors. Resolving this tension will be an important direction for future work. To the best of our knowledge, we are the first to integrate contrastive learning with pre-trained language model fine-tuning for authorship attribution.	https://aclanthology.org/2022.aacl-main.84	Bo Ai, Yuchen Wang, Yugin Tan, Samson Tan
Identifying Weaknesses in Machine Translation Metrics Through Minimum Bayes Risk Decoding: A Case Study for COMET	Neural metrics have achieved impressive correlation with human judgements in the evaluation of machine translation systems, but before we can safely optimise towards such metrics, we should be aware of (and ideally eliminate) biases toward bad translations that receive high scores. Our experiments show that sample-based Minimum Bayes Risk decoding can be used to explore and quantify such weaknesses. When applying this strategy to COMET for en-de and de-en, we find that COMET models are not sensitive enough to discrepancies in numbers and named entities. We further show that these biases are hard to fully remove by simply training on additional synthetic data and release our code and data for facilitating further experiments.	https://aclanthology.org/2022.aacl-main.83	Chantal Amrhein, Rico Sennrich
