title	abstract	url	authors
Extractive Entity-Centric Summarization as Sentence Selection using Bi-Encoders	Entity-centric summarization is a type of controllable summarization that aims to produce a summary of a document that is specific to a given target entity. Extractive summaries possess multiple advantages over abstractive ones such as preserving factuality and can be directly used in downstream tasks like target-based sentiment analysis or incorporated into search applications. In this paper, we explore methods to solve this task by recasting it as a sentence selection task, as supported by the EntSUM data set. We use methods inspired by information retrieval, where the input to the model is a pair representing a sentence from the original document and the target entity, in place of the query. We explore different architecture variants and loss functions in this framework with results showing an up to 5.8 F1 improvement over past state-of-the-art and outperforming the competitive entity-centric Lead 3 heuristic by 1.1 F1. In addition, we also demonstrate similarly strong results on the related task of salient sentence selection for an entity.	https://aclanthology.org/2022.aacl-short.40	Ella Hofmann-Coyle, Mayank Kulkarni, Lingjue Xie, Mounica Maddela, Daniel Preotiuc-Pietro
Towards Simple and Efficient Task-Adaptive Pre-training for Text Classification	Language models are pre-trained using large corpora of generic data like book corpus, com- mon crawl and Wikipedia, which is essential for the model to understand the linguistic characteristics of the language. New studies suggest using Domain Adaptive Pre-training (DAPT) and Task-Adaptive Pre-training (TAPT) as an intermediate step before the final finetuning task. This step helps cover the target domain vocabulary and improves the model performance on the downstream task. In this work, we study the impact of training only the embedding layer on the model's performance during TAPT and task-specific finetuning. Based on our study, we propose a simple approach to make the in- termediate step of TAPT for BERT-based mod- els more efficient by performing selective pre-training of BERT layers. We show that training only the BERT embedding layer during TAPT is sufficient to adapt to the vocabulary of the target domain and achieve comparable performance. Our approach is computationally efficient, with 78% fewer parameters trained during TAPT. The proposed embedding layer finetuning approach can also be an efficient domain adaptation technique.	https://aclanthology.org/2022.aacl-short.39	Arnav Ladkat, Aamir Miyajiwala, Samiksha Jagadale, Rekha A. Kulkarni, Raviraj Joshi
Demographic-Aware Language Model Fine-tuning as a Bias Mitigation Technique	BERT-like language models (LMs), when exposed to large unstructured datasets, are known to learn and sometimes even amplify the biases present in such data. These biases generally reflect social stereotypes with respect to gender, race, age, and others. In this paper, we analyze the variations in gender and racial biases in BERT, a large pre-trained LM, when exposed to different demographic groups. Specifically, we investigate the effect of fine-tuning BERT on text authored by historically disadvantaged demographic groups in comparison to that by advantaged groups. We show that simply by fine-tuning BERT-like LMs on text authored by certain demographic groups can result in the mitigation of social biases in these LMs against various target groups.	https://aclanthology.org/2022.aacl-short.38	Aparna Garimella, Rada Mihalcea, Akhash Amarnath
CSS: Combining Self-training and Self-supervised Learning for Few-shot Dialogue State Tracking	Few-shot dialogue state tracking (DST) is a realistic problem that trains the DST model with limited labeled data. Existing few-shot methods mainly transfer knowledge learned from external labeled dialogue data (e.g., from question answering, dialogue summarization, machine reading comprehension tasks, etc.) into DST, whereas collecting a large amount of external labeled data is laborious, and the external data may not effectively contribute to the DST-specific task. In this paper, we propose a few-shot DST framework called CSS, which Combines Self-training and Self-supervised learning methods. The unlabeled data of the DST task is incorporated into the self-training iterations, where the pseudo labels are predicted by a DST model trained on limited labeled data in advance. Besides, a contrastive self-supervised method is used to learn better representations, where the data is augmented by the dropout operation to train the model. Experimental results on the MultiWOZ dataset show that our proposed CSS achieves competitive performance in several few-shot scenarios.	https://aclanthology.org/2022.aacl-short.37	Haoning Zhang, Junwei Bao, Haipeng Sun, Huaishao Luo, Wenye Li, Shuguang Cui
Transformer-based Localization from Embodied Dialog with Large-scale Pre-training	We address the challenging task of Localization via Embodied Dialog (LED). Given a dialog from two agents, an Observer navigating through an unknown environment and a Locator who is attempting to identify the Observer's location, the goal is to predict the Observer's final location in a map. We develop a novel LED-Bert architecture and present an effective pretraining strategy. We show that a graph-based scene representation is more effective than the top-down 2D maps used in prior works. Our approach outperforms previous baselines.	https://aclanthology.org/2022.aacl-short.36	Meera Hahn, James M. Rehg
Local Structure Matters Most in Most Languages	Many recent perturbation studies have found unintuitive results on what does and does not matter when performing Natural Language Understanding (NLU) tasks in English. Coding properties, such as the order of words, can often be removed through shuffling without impacting downstream performances. Such insight may be used to direct future research into English NLP models. As many improvements in multilingual settings consist of wholesale adaptation of English approaches, it is important to verify whether those studies replicate or not in multilingual settings. In this work, we replicate a study on the importance of local structure, and the relative unimportance of global structure, in a multilingual setting. We find that the phenomenon observed on the English language broadly translates to over 120 languages, with a few caveats.	https://aclanthology.org/2022.aacl-short.35	Louis Clouatre, Prasanna Parthasarathi, Amal Zouaq, Sarath Chandar
NepBERTa: Nepali Language Model Trained in a Large Corpus	Nepali is a low-resource language with more than 40 million speakers worldwide. It is written in Devnagari script and has rich semantics and complex grammatical structure. To this date, multilingual models such as Multilingual BERT, XLM and XLM-RoBERTa haven't been able to achieve promising results in Nepali NLP tasks, and there does not exist any such a large-scale monolingual corpus. This study presents NepBERTa, a BERT-based Natural Language Understanding (NLU) model trained on the most extensive monolingual Nepali corpus ever. We collected a dataset of 0.8B words from 36 different popular news sites in Nepal and introduced the model. This data set is 3 folds times larger than the previous publicly available corpus. We evaluated the performance of NepBERTa in multiple Nepali-specific NLP tasks, including Named-Entity Recognition, Content Classification, POS Tagging, and Sequence Pair Similarity. We also introduce two different datasets for two new downstream tasks and benchmark four diverse NLU tasks altogether. We bring all these four tasks under the first-ever Nepali Language Understanding Evaluation (Nep-gLUE) benchmark. We will make Nep-gLUE along with the pre-trained model and data sets publicly available for research.	https://aclanthology.org/2022.aacl-short.34	Sulav Timilsina, Milan Gautam, Binod Bhattarai
BanglaParaphrase: A High-Quality Bangla Paraphrase Dataset	In this work, we present BanglaParaphrase, a high-quality synthetic Bangla Paraphrase dataset curated by a novel filtering pipeline. We aim to take a step towards alleviating the low resource status of the Bangla language in the NLP domain through the introduction of BanglaParaphrase, which ensures quality by preserving both semantics and diversity, making it particularly useful to enhance other Bangla datasets. We show a detailed comparative analysis between our dataset and models trained on it with other existing works to establish the viability of our synthetic paraphrase data generation pipeline. We are making the dataset and models publicly available at https://github.com/csebuetnlp/banglaparaphrase to further the state of Bangla NLP.	https://aclanthology.org/2022.aacl-short.33	Ajwad Akil, Najrin Sultana, Abhik Bhattacharjee, Rifat Shahriyar
Seeking Diverse Reasoning Logic: Controlled Equation Expression Generation for Solving Math Word Problems	To solve Math Word Problems, human students leverage diverse reasoning logic that reaches different possible equation solutions. However, the mainstream sequence-to-sequence approach of automatic solvers aims to decode a fixed solution equation supervised by human annotation. In this paper, we propose a controlled equation generation solver by leveraging a set of control codes to guide the model to consider certain reasoning logic and decode the corresponding equations expressions transformed from the human reference. The empirical results suggest that our method universally improves the performance on single-unknown (Math23K) and multiple-unknown (DRAW1K, HMWP) benchmarks, with substantial improvements up to 13.2% accuracy on the challenging multiple-unknown datasets.	https://aclanthology.org/2022.aacl-short.32	Yibin Shen, Qianying Liu, Zhuoyuan Mao, Zhen Wan, Fei Cheng, Sadao Kurohashi
Performance-Efficiency Trade-Offs in Adapting Language Models to Text Classification Tasks	Pre-trained language models (LMs) obtain state-of-the-art performance when adapted to text classification tasks. However, when using such models in real world applications, efficiency considerations are paramount. In this paper, we study how different training procedures that adapt LMs to text classification perform, as we vary model and train set size. More specifically, we compare standard fine-tuning, prompting, and knowledge distillation (KD) when the teacher was trained with either fine-tuning or prompting. Our findings suggest that even though fine-tuning and prompting work well to train large LMs on large train sets, there are more efficient alternatives that can reduce compute or data cost. Interestingly, we find that prompting combined with KD can reduce compute and data cost at the same time.	https://aclanthology.org/2022.aacl-short.31	Laura Aina, Nikos Voskarides, Roi Blanco
Risk-graded Safety for Handling Medical Queries in Conversational AI	Conversational AI systems can engage in unsafe behaviour when handling users' medical queries that may have severe consequences and could even lead to deaths. Systems therefore need to be capable of both recognising the seriousness of medical inputs and producing responses with appropriate levels of risk. We create a corpus of human written English language medical queries and the responses of different types of systems. We label these with both crowdsourced and expert annotations. While individual crowdworkers may be unreliable at grading the seriousness of the prompts, their aggregated labels tend to agree with professional opinion to a greater extent on identifying the medical queries and recognising the risk types posed by the responses. Results of classification experiments suggest that, while these tasks can be automated, caution should be exercised, as errors can potentially be very serious.	https://aclanthology.org/2022.aacl-short.30	Gavin Abercrombie, Verena Rieser
Improving Graph-Based Text Representations with Character and Word Level N-grams	Graph-based text representation focuses on how text documents are represented as graphs for exploiting dependency information between tokens and documents within a corpus. Despite the increasing interest in graph representation learning, there is limited research in exploring new ways for graph-based text representation, which is important in downstream natural language processing tasks. In this paper, we first propose a new heterogeneous word-character text graph that combines word and character n-gram nodes together with document nodes, allowing us to better learn dependencies among these entities. Additionally, we propose two new graph-based neural models, WCTextGCN and WCTextGAT, for modeling our proposed text graph. Extensive experiments in text classification and automatic text summarization benchmarks demonstrate that our proposed models consistently outperform competitive baselines and state-of-the-art graph-based models.	https://aclanthology.org/2022.aacl-short.29	Wenzhe Li, Nikolaos Aletras
Adversarially Improving NMT Robustness to ASR Errors with Confusion Sets	Neural machine translation (NMT) models are known to be fragile to noisy inputs from automatic speech recognition (ASR) systems. Existing methods are usually tailored for robustness against only homophone errors which account for a small portion of realistic ASR errors. In this paper, we propose an adversarial example generation method based on confusion sets that contain words easily confusable with a target word by ASR to conduct adversarial training for NMT models. Specifically, an adversarial example is generated from the perspective of acoustic relations instead of the traditional uniform or unigram sampling from the confusion sets. Experiments on different test sets with hand-crafted and real-world noise demonstrate the effectiveness of our method over previous methods. Moreover, our approach can achieve improvements on the clean test set.	https://aclanthology.org/2022.aacl-short.28	Shuaibo Wang, Yufeng Chen, Songming Zhang, Deyi Xiong, Jinan Xu
Do ever larger octopi still amplify reporting biases? Evidence from judgments of typical colour	Language models (LMs) trained on raw texts have no direct access to the physical world. Gordon and Van Durme (2013) point out that LMs can thus suffer from reporting bias: texts rarely report on common facts, instead focusing on the unusual aspects of a situation. If LMs are only trained on text corpora and naively memorise local co-occurrence statistics, they thus naturally would learn a biased view of the physical world. While prior studies have repeatedly verified that LMs of smaller scales (e.g., RoBERTa, GPT-2) amplify reporting bias, it remains unknown whether such trends continue when models are scaled up. We investigate reporting bias from the perspective of colour in larger language models (LLMs) such as PaLM and GPT-3. Specifically, we query LLMs for the typical colour of objects, which is one simple type of perceptually grounded physical common sense. Surprisingly, we find that LLMs significantly outperform smaller LMs in determining an object's typical colour and more closely track human judgments, instead of overfitting to surface patterns stored in texts. This suggests that very large models of language alone are able to overcome certain types of reporting bias that are characterized by local co-occurrences.	https://aclanthology.org/2022.aacl-short.27	Fangyu Liu, Julian Eisenschlos, Jeremy Cole, Nigel Collier
Post-Training with Interrogative Sentences for Enhancing BART-based Korean Question Generator	The pre-trained language models such as KoBART often fail in generating perfect interrogative sentences when they are applied to Korean question generation. This is mainly due to the fact that the language models are much experienced with declarative sentences, but not with interrogative sentences. Therefore, this paper proposes a novel post-training of KoBART to enhance it for Korean question generation. The enhancement of KoBART is accomplished in three ways: (i) introduction of question infilling objective to KoBART to enforce it to focus more on the structure of interrogative sentences, (ii) augmentation of training data for question generation with another data set to cope with the lack of training instances for post-training, (iii) introduction of Korean spacing objective to make KoBART understand the linguistic features of Korean. Since there is no standard data set for Korean question generation, this paper also proposes KorQuAD-QG, a new data set for this task, to verify the performance of the proposed post-training. Our code are publicly available at https://github.com/gminipark/post_training_qg	https://aclanthology.org/2022.aacl-short.26	Gyu-Min Park, Seong-Eun Hong, Seong-Bae Park
A Simple Yet Effective Hybrid Pre-trained Language Model for Unsupervised Sentence Acceptability Prediction	Sentence acceptability judgment assesses to what degree a sentence is acceptable to native speakers of the language. Most unsupervised prediction approaches rely on a language model to obtain the likelihood of a sentence that reflects acceptability. However, two problems exist: first, low-frequency words would have a significant negative impact on the sentence likelihood derived from the language model; second, when it comes to multiple domains, the language model needs to be trained on domain-specific text for domain adaptation. To address both problems, we propose a simple method that substitutes Part-of-Speech (POS) tags for low-frequency words in sentences used for continual training of masked language models. Experimental results show that our word-tag-hybrid BERT model brings improvement on both a sentence acceptability benchmark and a cross-domain sentence acceptability evaluation corpus. Furthermore, our annotated cross-domain sentence acceptability evaluation corpus would benefit future research.	https://aclanthology.org/2022.aacl-short.25	Yang Zhao, Issei Yoshida
NGEP: A Graph-based Event Planning Framework for Story Generation	To improve the performance of long text generation, recent studies have leveraged automatically planned event structures (i.e. storylines) to guide story generation. Such prior works mostly employ end-to-end neural generation models to predict event sequences for a story. However, such generation models struggle to guarantee the narrative coherence of separate events due to the hallucination problem, and additionally the generated event sequences are often hard to control due to the end-to-end nature of the models. To address these challenges, we propose NGEP, an novel event planning framework which generates an event sequence by performing inference on an automatically constructed event graph and enhances generalisation ability through a neural event advisor. We conduct a range of experiments on multiple criteria, and the results demonstrate that our graph-based neural framework outperforms the state-of-the-art (SOTA) event planning approaches, considering both the performance of event sequence generation and the effectiveness on the downstream task of story generation.	https://aclanthology.org/2022.aacl-short.24	Chen Tang, Zhihao Zhang, Tyler Loakman, Chenghua Lin, Frank Guerin
Improving Chinese Story Generation via Awareness of Syntactic Dependencies and Semantics	Story generation aims to generate a long narrative conditioned on a given input. In spite of the success of prior works with the application of pre-trained models, current neural models for Chinese stories still struggle to generate high-quality long text narratives. We hypothesise that this stems from ambiguity in syntactically parsing the Chinese language, which does not have explicit delimiters for word segmentation. Consequently, neural models suffer from the inefficient capturing of features in Chinese narratives. In this paper, we present a new generation framework that enhances the feature capturing mechanism by informing the generation model of dependencies between words and additionally augmenting the semantic representation learning through synonym denoising training. We conduct a range of experiments, and the results demonstrate that our framework outperforms the state-of-the-art Chinese generation models on all evaluation metrics, demonstrating the benefits of enhanced dependency and semantic representation learning.	https://aclanthology.org/2022.aacl-short.23	Henglin Huang, Chen Tang, Tyler Loakman, Frank Guerin, Chenghua Lin
Multi-Type Conversational Question-Answer Generation with Closed-ended and Unanswerable Questions	Conversational question answering (CQA) facilitates an incremental and interactive understanding of a given context, but building a CQA system is difficult for many domains due to the problem of data scarcity. In this paper, we introduce a novel method to synthesize data for CQA with various question types, including open-ended, closed-ended, and unanswerable questions. We design a different generation flow for each question type and effectively combine them in a single, shared framework. Moreover, we devise a hierarchical answerability classification (hierarchical AC) module that improves quality of the synthetic data while acquiring unanswerable questions. Manual inspections show that synthetic data generated with our framework have characteristics very similar to those of human-generated conversations. Across four domains, CQA systems trained on our synthetic data indeed show good performance close to the systems trained on human-annotated data.	https://aclanthology.org/2022.aacl-short.22	Seonjeong Hwang, Yunsu Kim, Gary Geunbae Lee
An Improved Baseline for Sentence-level Relation Extraction	Sentence-level relation extraction (RE) aims at identifying the relationship between two entities in a sentence. Many efforts have been devoted to this problem, while the best performing methods are still far from perfect. In this paper, we revisit two problems that affect the performance of existing RE models, namely entity representation and noisy or ill-defined labels. Our improved RE baseline, incorporated with entity representations with typed markers, achieves an F1 of 74.6% on TACRED, significantly outperforms previous SOTA methods. Furthermore, the presented new baseline achieves an F1 of 91.1% on the refined Re-TACRED dataset, demonstrating that the pretrained language models (PLMs) achieve high performance on this task. We release our code to the community for future research.	https://aclanthology.org/2022.aacl-short.21	Wenxuan Zhou, Muhao Chen
How Relevant is Selective Memory Population in Lifelong Language Learning?	Lifelong language learning seeks to have models continuously learn multiple tasks in a sequential order without suffering from catastrophic forgetting. State-of-the-art approaches rely on sparse experience replay as the primary approach to prevent forgetting. Experience replay usually adopts sampling methods for the memory population; however, the effect of the chosen sampling strategy on model performance has not yet been studied. In this paper, we investigate how relevant the selective memory population is in the lifelong learning process of text classification and question-answering tasks. We found that methods that randomly store a uniform number of samples from the entire data stream lead to high performances, especially for low memory size, which is consistent with computer vision studies.	https://aclanthology.org/2022.aacl-short.20	Vladimir Araujo, Helena Balabin, Julio Hurtado, Alvaro Soto, Marie-Francine Moens
The Effects of Language Token Prefixing for Multilingual Machine Translation	Machine translation traditionally refers to translating from a single source language into a single target language. In recent years, the field has moved towards large neural models either translating from or into many languages. The model must be correctly cued to translate into the correct target language.This is typically done by prefixing language tokens onto the source or target sequence. The location and content of the prefix can vary and many use different approaches without much justification towards one approach or another. As a guidance to future researchers and directions for future work, we present a series of experiments that show how the positioning and type of a target language prefix token effects translation performance. We show that source side prefixes improve performance. Further, we find that the best language information to denote via tokens depends on the supported language set.	https://aclanthology.org/2022.aacl-short.19	Rachel Wicks, Kevin Duh
Exploring Universal Sentence Encoders for Zero-shot Text Classification	"Universal Sentence Encoder (USE) has gained much popularity recently as a general-purpose sentence encoding technique. As the name suggests, USE is designed to be fairly general and has indeed been shown to achieve superior performances for many downstream NLP tasks. In this paper, we present an interesting ""negative"" result on USE in the context of zero-shot text classification, a challenging task, which has recently gained much attraction. More specifically, we found some interesting cases of zero-shot text classification, where topic based inference outperformed USE-based inference in terms of F1 score. Further investigation revealed that USE struggles to perform well on data-sets with a large number of labels with high semantic overlaps, while topic-based classification works well for the same."	https://aclanthology.org/2022.aacl-short.18	Souvika Sarkar, Dongji Feng, Shubhra Kanti Karmaker Santu
