title	abstract	url
Towards Lightweight Controllable Audio Synthesis with Conditional Implicit Neural Representations	Controllable audio synthesis is a core element of creative sound design. Recent advancements in AI have made high-fidelity neural audio synthesis achievable. However, the high temporal resolution of audio and our perceptual sensitivity to small irregularities in waveforms make synthesizing at high sampling rates a complex and computationally intensive task, prohibiting real-time, controllable synthesis within many approaches. In this work we aim to shed light on the potential of Conditional Implicit Neural Representations (CINRs) as lightweight backbones in generative frameworks for audio synthesis. Implicit neural representations (INRs) are neural networks used to approximate low-dimensional functions, trained to represent a single geometric object by mapping input coordinates to structural information at input locations. In contrast with other neural methods for representing geometric objects, the memory required to parameterize the object is independent of resolution, and only scales with its complexity. A corollary of this is that INRs have infinite resolution, as they can be sampled at arbitrary resolutions. To apply the concept of INRs in the generative domain we frame generative modelling as learning a distribution of continuous functions. This can be achieved by introducing conditioning methods to INRs. Our experiments show that small Periodic Conditional INRs (PCINRs) learn faster and generally produce quantitatively better audio reconstructions than Transposed Convolutional Neural Networks with equal parameter counts. However, their performance is very sensitive to activation scaling hyperparameters. When learning to represent more uniform sets, PCINRs tend to introduce artificial high-frequency components in reconstructions. We validate this noise can be minimized by applying standard weight regularization during training or decreasing the compositional depth of PCINRs, and suggest directions for future research.	https://openreview.net/forum?id=-e7kA-HhM3
Conditional Generation of Periodic Signals with Fourier-Based Decoder	Periodic signals play an important role in daily lives. Although conventional sequential models have shown remarkable success in various fields, they still come short in modeling periodicity; they either collapse, diverge or ignore details. In this paper, we introduce a novel framework inspired by Fourier series to generate periodic signals. We first decompose the given signals into multiple sines and cosines and then conditionally generate periodic signals with the output components. We have shown our model efficacy on three tasks: reconstruction, imputation and conditional generation. Our model outperforms baselines in all tasks and shows more stable and refined results.	https://openreview.net/forum?id=y9Sxt1Lpyw
Finding Maximally Informative Patches in Images	We consider the problem of distilling an image into an ordered set of maximally informative patches, given prior data from the same domain. We cast this problem as one of maximizing a pointwise mutual information (PMI) objective between a subset of an image's patches and the perceptual content of the entire image. We take an image synthesis-based approach, reasoning that the patches that are most informative would also be most useful for predicting other pixel values. We capture this idea with an image completion CNN trained to model the PMI between an image's perceptual content and any of its subregions. Because our PMI objective is a submodular, monotonic function, we can greedily construct patch sets using the CNN to obtain a provably close approximation to the intractable optimal solution. We evaluate our approach on datasets of faces, common objects, and line drawings. For all datasets, we find that a surprisingly few number of patches are needed to reconstruct most images, demonstrating a particular type of redundancy of information in images, and new potentials in their sparse representations. We also show that these minimal patch sets may be used effectively for downstream tasks such as image classification.	https://openreview.net/forum?id=IQvu5_MY7aE
Preventing posterior collapse in variational autoencoders for text generation via decoder regularization	Variational autoencoders trained to minimize the reconstruction error are sensitive to the posterior collapse problem, that is the proposal posterior distribution is always equal to the prior. We propose a novel regularization method based on fraternal dropout to prevent posterior collapse. We evaluate our approach using several metrics and observe improvements in all the tested configurations.	https://openreview.net/forum?id=xC5JrgVGyCe
An Interpretability-augmented Genetic Expert for Deep Molecular Optimization	The recently proposed genetic expert guided learning (GEGL) framework has demonstrated impressive performances on several de novo molecular design tasks. Despite the displayed state-of-the art results, the proposed system relies on an expert-designed Genetic expert. Although hand-crafted experts allow to navigate the chemical space efficiently, designing such experts requires a significant amount of effort and might contain inherent biases which can potentially slow down convergence or even lead to sub-optimal solutions. In this research, we propose a novel genetic expert named InFrag which is free of design rules and can generate new molecules by combining promising molecular fragments. Fragments are obtained by using an additional graph convolutional neural network which computes attributions for each atom for a given molecule. Molecular substructures which contribute positively to the task score are kept and combined to propose novel molecules. We experimentally demonstrate that, within the GEGL framework, our proposed attribution-based genetic expert is either competitive or outperforms the original expert-designed genetic expert on goal-directed optimization tasks. When limiting the number of optimization rounds to one and three rounds, a performance increase of approximately $ 43\%$ and $20\%$ respectively is observed compared to the baseline genetic expert.	https://openreview.net/forum?id=gj6B1PahXUg
Deep Generative model with Hierarchical Latent Factors for Timeseries Anomaly Detection	Multivariate time-series anomaly detection has become an active area of research in recent years, with Deep Learning models outperforming previous approaches on benchmark datasets. Among reconstruction-based models, almost all previous work has focused on Variational Autoencoders and Generative Adversarial Networks. This work presents DGHL, a new family of generative models for time-series anomaly detection, trained by maximizing the observed likelihood directly by posterior sampling and alternating gradient-descent. A top-down Convolution Network maps time-series windows to a novel hierarchical latent space, exploiting temporal dynamics to encode information efficiently. Despite relying on posterior sampling, it is computationally more efficient than current approaches, with up to 10x shorter training times than RNN based models. Our method outperformed other state-of-the-art models on four popular benchmark datasets. Finally, DGHL is robust to variable features between entities and accurate even with large proportions of missing values, settings with increasing relevance with IoT. We demonstrate the superior robustness of DGHL with novel occlusion experiments in this literature.	https://openreview.net/forum?id=FwkZ4m3VjFi
XCI-Sketch: Extraction of Color Information from Images for Generation of Colored Outlines and Sketches	Sketches are a medium to convey a visual scene from an individual's creative perspective. The addition of color substantially enhances the overall expressivity of a sketch. This paper proposes two methods to mimic human-drawn colored sketches by utilizing the Contour Drawing Dataset. Our first approach renders colored outline sketches by applying image processing techniques aided by k-means color clustering. The second method uses a generative adversarial network to develop a model that can generate colored sketches from previously unobserved images. We assess the results obtained through quantitative and qualitative evaluations.	https://openreview.net/forum?id=hAy2T4S4N_
Variational Autoencoder with Differentiable Physics Engine for Human Gait Analysis and Synthesis	We address the task of learning generative models of human gait. As gait motion always follows the physical laws, a generative model should also produce outputs that comply with the physical laws, particularly rigid body dynamics with contact and friction. We propose a deep generative model combined with a differentiable physics engine, which outputs physically plausible signals by construction. The proposed model is also equipped with a policy network conditioned on each sample. We show an example of the application of such a model to style transfer of gait.	https://openreview.net/forum?id=9ISlKio3Bt
Towards modelling hazard factors in unstructured data spaces using gradient-based latent interpolation	The application of deep learning in survival analysis (SA) allows utilizing unstructured and high-dimensional data types uncommon in traditional survival methods. This allows to advance methods in fields such as digital health, predictive maintenance, and churn analysis, but often yields less interpretable and intuitively understandable models due to the black-box character of deep learning-based approaches. We close this gap by proposing 1) a multi-task variational autoencoder (VAE) with survival objective, yielding survival-oriented embeddings, and 2) a novel method HazardWalk that allows to model hazard factors in the original data space. HazardWalk transforms the latent distribution of our autoencoder into areas of maximized/minimized hazard and then uses the decoder to project changes to the original domain. Our procedure is evaluated on a simulated dataset as well as on a dataset of CT imaging data of patients with liver metastases.	https://openreview.net/forum?id=tgsBmOwcAL
A Generalized and Distributable Generative Model for Private Representation Learning	"We study the problem of learning data representations that are private yet informative, i.e., providing information about intended ""ally"" targets while obfuscating sensitive ""adversary"" attributes. We propose a novel framework, Exclusion-Inclusion Generative Adversarial Network (EIGAN), that generalizes adversarial private representation learning (PRL) approaches to generate data encodings that account for multiple (possibly overlapping) ally and adversary targets. Preserving privacy is even more difficult when the data is collected across multiple distributed nodes, which for privacy reasons may not wish to share their data even for PRL training. Thus, learning such data representations at each node in a distributed manner (i.e., without transmitting source data) is of particular importance. This motivates us to develop D-EIGAN, the first distributed PRL method, based on fractional parameter sharing that promotes differentially private parameter sharing and also accounts for communication resource limitations. We theoretically analyze the behavior of adversaries under the optimal EIGAN and D-EIGAN encoders and consider the impact of dependencies among ally and adversary tasks on the encoder performance. Our experiments on real-world and synthetic datasets demonstrate the advantages of EIGAN encodings in terms of accuracy, robustness, and scalability; in particular, we show that EIGAN outperforms the previous state-of-the-art by a significant accuracy margin (47% improvement). The experiments further reveal that D-EIGAN's performance is consistent with EIGAN under different node data distributions and is resilient to communication constraints."	https://openreview.net/forum?id=cRKEnMKHY_z
Gaussian Mixture Variational Autoencoder with Contrastive Learning for Multi-Label Classification	Multi-label classification (MLC) is a prediction task where each sample can have more than one label. We propose a novel contrastive learning boosted multi-label prediction model based on a Gaussian mixture variational autoencoder (C-GMVAE), which learns a multimodal prior space and employs a contrastive loss. Many existing methods introduce extra complex neural modules to capture the label correlations, in addition to the prediction modules. We find that by using contrastive learning in the supervised setting, we can exploit label information effectively, and learn meaningful feature and label embeddings capturing both the label correlations and predictive power, without extra neural modules. Our method also adopts the idea of learning and aligning latent spaces for both features and labels. More specifically, C-GMVAE imposes a Gaussian mixture structure on the latent space, to alleviate posterior collapse and over-regularization issues, in contrast to previous works based on a unimodal prior. C-GMVAE outperforms existing methods on multiple public datasets and can often match other models' full performance with only 50\% of the training data. Furthermore, we show that the learnt embeddings provide insights into the interpretation of label-label interactions.	https://openreview.net/forum?id=JjT60OSLDBN
Deep Variational Semi-Supervised Novelty Detection	In anomaly detection (AD), one seeks to identify whether a test sample is abnormal, given a data set of normal samples. A recent and promising approach to AD relies on deep generative models, such as variational autoencoders (VAEs), for unsupervised learning of the normal data distribution. In semi-supervised AD (SSAD), the data also includes a small sample of labeled anomalies. In this work, we propose two variational methods for training VAEs for SSAD. The intuitive idea in both methods is to train the encoder to `separate' between latent vectors for normal and outlier data. We show that this idea can be derived from principled probabilistic formulations of the problem, and propose simple and effective algorithms. Our methods can be applied to various data types, as we demonstrate on SSAD datasets ranging from natural images to astronomy and medicine, can be combined with any VAE model architecture, and are naturally compatible with ensembling. When comparing to state-of-the-art SSAD methods that are not specific to particular data types, we obtain marked improvement in outlier detection.	https://openreview.net/forum?id=pyEsZ1jQXw
Latent Space Refinement for Deep Generative Models	Deep generative models are becoming widely used across science and industry for a variety of purposes. A common challenge is achieving a precise implicit or explicit representation of the data probability density. Recent proposals have suggested using classifier weights to refine the learned density of deep generative models. We extend this idea to all types of generative models and show how latent space refinement via iterated generative modeling can circumvent topological obstructions and improve precision. This methodology also applies to cases were the target model is non-differentiable and has many internal latent dimensions which must be marginalized over before refinement. We demonstrate our Latent Space Refinement (LaSeR) protocol on a variety of examples, focusing on the combinations of Normalizing Flows and Generative Adversarial Networks.	https://openreview.net/forum?id=ujw48b2-hm
Improving Model Compatibility of Generative Adversarial Networks by Boundary Calibration	Generative Adversarial Networks (GANs) is a powerful family of models that learn an underlying distribution to generate synthetic data. Many existing studies of GANs focus on improving the realness of the generated image data for visual applications, and few of them concern about improving the quality of the generated data for training other classifiers---a task known as the model compatibility problem. As a consequence, existing GANs often prefer generating `easier' synthetic data that are far from the boundaries of the classifiers, and refrain from generating near-boundary data, which are known to play an important roles in training the classifiers. To improve GAN in terms of model compatibility, we propose Boundary-Calibration GANs (BCGANs), which leverage the boundary information from a set of pre-trained classifiers using the original data. In particular, we introduce an auxiliary Boundary-Calibration loss (BC-loss) into the generator of GAN to match the statistics between the posterior distributions of original data and generated data with respect to the boundaries of the pre-trained classifiers. The BC-loss is provably unbiased and can be easily coupled with different GAN variants to improve their model compatibility. Experimental results demonstrate that BCGANs not only generate realistic images like original GANs but also achieves superior model compatibility than the original GANs.	https://openreview.net/forum?id=6i3_eKHHzpz
Learning Disentangled Representation for Spatiotemporal Graph Generation	Modeling and understanding spatiotemporal graphs have been a long-standing research topic in network science and typically replies on network processing hypothesized by human knowledge. In this paper, we aim at pushing forward the modeling and understanding of spatiotemporal graphs via new disentangled deep generative models. Specifically, a new Bayesian model is proposed that factorizes spatiotemporal graphs into spatial, temporal, and graph factors as well as the factors that explain the interplay among them. A variational objective function and new mutual information thresholding algorithms driven by information bottleneck theory have been proposed to maximize the disentanglement among the factors with theoretical guarantees. Qualitative and quantitative experiments on both synthetic and real-world datasets demonstrate the superiority of the proposed model over the state-of-the-art by up to 69.2\% for graph generation and 41.5\% for interpretability.	https://openreview.net/forum?id=8I9N-y3lsB5
Score-Based Generative Classifiers	The tremendous success of generative models in recent years raises the question of whether they can also be used to perform classification. Generative models have been used as adversarially robust classifiers on simple datasets such as MNIST, but this robustness has not been observed on more complex datasets like CIFAR-10. Additionally, on natural image datasets, previous results have suggested a trade-off between the likelihood of the data and classification accuracy. In this work, we investigate score-based generative models as classifiers for natural images. We show that these models not only obtain competitive likelihood values but simultaneously achieve state-of-the-art classification accuracy for generative classifiers on CIFAR-10. Nevertheless, we find that these models are only slightly, if at all, more robust than discriminative baseline models on out-of-distribution tasks based on common image corruptions. Similarly and contrary to prior results, we find that score-based are prone to worst-case distribution shifts in the form of adversarial perturbations. Our work highlights that score-based generative models are closing the gap in classification accuracy compared to standard discriminative models. While they do not yet deliver on the promise of adversarial and out-of-domain robustness, they provide a different approach to classification that warrants further research.	https://openreview.net/forum?id=usdN2qgg0L
Transparent Liquid Segmentation for Robotic Pouring	Liquid state estimation is important for robotics tasks such as pouring; however, estimating the state of transparent liquids is a challenging problem. We propose a novel segmentation pipeline that can segment transparent liquids such as water from a static, RGB image without requiring any manual annotations or heating of the liquid for training. Instead, we use a generative model that is capable of translating unpaired images of colored liquids into synthetically generated transparent liquid images. Segmentation labels of colored liquids are obtained automatically using background subtraction. We use paired samples of synthetically generated transparent liquid images and background subtraction for our segmentation pipeline. Our experiments show that we are able to accurately predict a segmentation mask for transparent liquids without requiring any manual annotations. We demonstrate the utility of transparent liquid segmentation in a robotic pouring task that controls pouring by perceiving liquid height in a transparent cup. Accompanying video and supplementary information can be found at https://sites.google.com/view/roboticliquidpouring	https://openreview.net/forum?id=xvvpL6X3c6
Grapher: Multi-Stage Knowledge Graph Construction using Pretrained Language Models	In this work we address the problem of Knowledge Graph (KG) construction from text, proposing a novel end-to-end multi-stage Grapher system, that separates the overall generation process into two stages. The graph nodes are generated first using pretrained language model, followed by a simple edge construction head, enabling efficient KG extraction from the textual descriptions. For each stage we proposed several architectural choices that can be used depending on the available training resources. We evaluated the Grapher on a recent WebNLG 2020 Challenge dataset, achieving competitive results on text-to-RDF generation task, as well as on a recent large-scale TekGen dataset, showing strong overall performance. We believe that the proposed Grapher system can serve as a viable KG construction alternative to the existing linearization or sampling-based graph generation approaches.	https://openreview.net/forum?id=N2CFXG8-pRd
Normality-Calibrated Autoencoder for Unsupervised Anomaly Detection on Data Contamination	In this paper, we propose Normality-Calibrated Autoencoder (NCAE), which can boost anomaly detection performance on the contaminated datasets without any prior information or explicit abnormal samples in the training phase. The NCAE adversarially generates high confident normal samples from a latent space having low entropy and leverages them to predict abnormal samples in a training dataset. NCAE is trained to minimise reconstruction errors in uncontaminated samples and maximise reconstruction errors in contaminated samples. The experimental results demonstrate that our method outperforms shallow, hybrid, and deep methods for unsupervised anomaly detection and achieves comparable performance compared with semi-supervised methods using labelled anomaly samples in the training phase. The source code is publicly available on 'https://github.com/andreYoo/NCAE_UAD.git'.	https://openreview.net/forum?id=qfABnNv_3HP
Self-Supervised Anomaly Detection via Neural Autoregressive Flows with Active Learning	Many self-supervised methods have been proposed with the target of image anomaly detection. These methods often rely on the paradigm of data augmentation with predefined transformations such as flipping, cropping, and rotations. However, it is not straightforward to apply these techniques for non-image data, such as time series or tabular data, while the performance of the existing deep approaches has been under our expectation on tasks beyond images. In this work, we propose a novel active learning (AL) scheme that relied on neural autoregressive flows (NAF) for self-supervised anomaly detection, specifically on small-scale data. Unlike other generative models such as GANs or VAEs, flow-based models allow to explicitly learn the probability density and thus can assign accurate likelihoods to normal data which makes it usable to detect anomalies. The proposed NAF-AL method is achieved by efficiently generating random samples from latent space and transforming them into feature space along with likelihoods via invertible mapping. The samples with lower likelihoods are selected and further checked by outlier detection using Mahalanobis distance. The augmented samples incorporating with normal samples are used for training a better detector so as to approach decision boundaries. Compared with random transformations, NAF-AL can be interpreted as a likelihood-oriented data augmentation that is more efficient and robust. Extensive experiments show that our approach outperforms existing baselines on multiple time series and tabular datasets, and a real-world application in advanced manufacturing, with significant improvement on anomaly detection accuracy and robustness over the state-of-the-art.	https://openreview.net/forum?id=LdWEo5mri6
Semi-supervised Multiple Instance Learning using Variational Auto-Encoders	We consider the multiple-instance learning (MIL) paradigm, which is a special case of supervised learning where training instances are grouped into bags. In MIL, the hidden instance labels do not have to be the same as the label of the comprising bag. On the other hand, the hybrid modelling approach is known to possess advantages basically due to the smooth consolidation of both discriminative and generative components. In this paper, we investigate whether we can get the best of both worlds (MIL and hybrid modelling), especially in a semi-supervised learning (SSL) setting. We first integrate a variational autoencoder (VAE), which is a powerful deep generative model, with an attention-based MIL classifier, then evaluate the performance of the resulting model in SSL. We assess the proposed approach on an established benchmark as well as a real-world medical dataset.	https://openreview.net/forum?id=irZt4xL3XeM
