title	abstract	url
An Underexplored Dilemma between Confidence and Calibration in Quantized Neural Networks	Modern convolutional neural networks (CNNs) are known to be overconfident in terms of their calibration on unseen input data. That is to say, they are more confident than they are accurate. This is undesirable if the probabilities predicted are to be used for downstream decision making. When considering accuracy, CNNs are also surprisingly robust to compression techniques, such as quantization, which aim to reduce computational and memory costs. We show that this robustness can be partially explained by the calibration behavior of modern CNNs, and may be improved with overconfidence. This is due to an intuitive result: low confidence predictions are more likely to change post-quantization, whilst being less accurate. High confidence predictions will be more accurate, but more difficult to change. Thus, a minimal drop in post-quantization accuracy is incurred. This presents a potential conflict in neural network design: worse calibration from overconfidence may lead to better robustness to quantization. We perform experiments applying post-training quantization to a variety of CNNs, on the CIFAR-100 and ImageNet datasets, and make our code publicly available.	https://openreview.net/forum?id=_5d0_qtXt5d
Pathologies in Priors and Inference for Bayesian Transformers	In recent years, the transformer has established itself as a workhorse in many applications ranging from natural language processing to reinforcement learning. Similarly, Bayesian deep learning has become the gold-standard for uncertainty estimation in safety-critical applications, where robustness and calibration are crucial. Surprisingly, no successful attempts to improve transformer models in terms of predictive uncertainty using Bayesian inference exist. In this work, we study this curiously underpopulated area of Bayesian transformers. We find that weight-space inference in transformers does not work well, regardless of the approximate posterior. We also find that the prior is at least partially at fault, but that it is very hard to find well-specified weight priors for these models. We hypothesize that these problems stem from the complexity of obtaining a meaningful mapping from weight-space to function-space distributions in the transformer. Therefore, moving closer to function-space, we propose a novel method based on the implicit reparameterization of the Dirichlet distribution to apply variational inference directly to the attention weights. We find that this proposed method performs competitively with our baselines.	https://openreview.net/forum?id=Gv41ucDhhlY
GOPHER: Categorical probabilistic forecasting with graph structure via local continuous-time dynamics	We consider the problem of probabilistic forecasting over categories with graph structure, where the dynamics at a vertex depends on its local connectivity structure. We present GOPHER, a method that combines the inductive bias of graph neural networks with neural ODEs to capture the intrinsic local continuous-time dynamics of our probabilistic forecasts. We study the benefits of these two inductive biases by comparing against baseline models that help disentangle the benefits of each. We find that capturing the graph structure is crucial for accurate in-domain probabilistic predictions and more sample efficient models. Surprisingly, our experiments demonstrate that the continuous time evolution inductive bias brings little to no benefit despite reflecting the true probability dynamics.	https://openreview.net/forum?id=v2DmCzi1gfh
Is the Number of Trainable Parameters All That Actually Matters?	Recent work has identified simple empirical scaling laws for language models, linking compute budget, dataset size, model size, and autoregressive modeling loss. The validity of these simple power laws across orders of magnitude in model scale provides compelling evidence that larger models are also more capable models. However, scaling up models under the constraints of hardware and infrastructure is no easy feat, and rapidly becomes a hard and expensive engineering problem. We investigate ways to tentatively \emph{cheat} scaling laws, and train larger models for cheaper. We emulate an increase in effective parameters, using efficient approximations: either by \emph{doping} the models with frozen random parameters, or by using fast structured transforms in place of dense linear layers. We find that the scaling relationship between test loss and compute depends only on the \emph{actual} number of trainable parameters; scaling laws cannot be deceived by spurious parameters.	https://openreview.net/forum?id=JCzF3p8-47S
Semi-Local Convolutions for LiDAR Scan Processing	A number of applications, such as mobile robots or automated vehicles, use LiDAR sensors to obtain detailed information about their three-dimensional surroundings.Many methods use image-like projections to efficiently process these LiDAR measurements and use deep convolutional neural networks to predict semantic classes for each point in the scan. The spatial stationary assumption enables the usage of convolutions. However, LiDAR scans exhibit large differences in appearance over the vertical axis. Therefore, we propose semi local convolution (SLC), a convolution layer with reduced amount of weight-sharing along the vertical dimension. We are first to investigate the usage of such a layer independent of any other model changes. Our experiments did not show any improvement over traditional convolution layers in terms of segmentation IoU or accuracy.	https://openreview.net/forum?id=rSGfLc2w4Z
Return Dispersion as an Estimator of Learning Potential for Prioritized Level Replay	Prioritized Level Replay (PLR) has been shown to induce adaptive curricula that improve the sample-efficiency and generalization of reinforcement learning policies in environments featuring multiple tasks or levels. PLR selectively samples training levels weighed by a function of recent temporal-difference errors experienced on each level. We explore the dispersion of returns as an alternative prioritization criterion to address certain issues with TD error scores.	https://openreview.net/forum?id=1-j1aJfCKa9
Adversarial Training Blocks Generalization in Neural Policies	Deep neural networks have made it possible for reinforcement learning algorithms to learn from raw high dimensional inputs. This jump in the progress has caused deep reinforcement learning algorithms to be deployed in many different fields from financial markets to biomedical applications. While the vulnerability of deep neural networks to imperceptible specifically crafted perturbations has also been inherited by deep reinforcement learning agents, several adversarial training methods have been proposed to overcome this vulnerability. In this paper we focus on state-of-the-art adversarial training algorithms and investigate their robustness to semantically meaningful natural perturbations ranging from changes in brightness to rotation. We conduct several experiments in the OpenAI Atari environments, and find that state-of-the-art adversarially trained neural policies are more sensitive to natural perturbations than vanilla trained agents. We believe our investigation lays out intriguing properties of adversarial training and our observations can help build robust and generalizable neural policies.	https://openreview.net/forum?id=fXGimmbtD9c
Adversarial Training Blocks Generalization in Neural Policies	Deep neural networks have made it possible for reinforcement learning algorithms to learn from raw high dimensional inputs. This jump in the progress has caused deep reinforcement learning algorithms to be deployed in many different fields from financial markets to biomedical applications. While the vulnerability of deep neural networks to imperceptible specifically crafted perturbations has also been inherited by deep reinforcement learning agents, several adversarial training methods have been proposed to overcome this vulnerability. In this paper we focus on state-of-the-art adversarial training algorithms and investigate their robustness to semantically meaningful natural perturbations ranging from changes in brightness to rotation. We conduct several experiments in the OpenAI Atari environments, and find that state-of-the-art adversarially trained neural policies are more sensitive to natural perturbations than vanilla trained agents. We believe our investigation lays out intriguing properties of adversarial training and our observations can help build robust and generalizable neural policies.	https://openreview.net/forum?id=QTQAWyY0Gwt
Adversarial Training Blocks Generalization in Neural Policies	Deep neural networks have made it possible for reinforcement learning algorithms to learn from raw high dimensional inputs. This jump in the progress has caused deep reinforcement learning algorithms to be deployed in many different fields from financial markets to biomedical applications. While the vulnerability of deep neural networks to imperceptible specifically crafted perturbations has also been inherited by deep reinforcement learning agents, several adversarial training methods have been proposed to overcome this vulnerability. In this paper we focus on state-of-the-art adversarial training algorithms and investigate their robustness to semantically meaningful natural perturbations ranging from changes in brightness to rotation. We conduct several experiments in the OpenAI Atari environments, and find that state-of-the-art adversarially trained neural policies are more sensitive to natural perturbations than vanilla trained agents. We believe our investigation lays out intriguing properties of adversarial training and our observations can help build robust and generalizable neural policies.	https://openreview.net/forum?id=fXGimmbtD9c
Adversarial Training Blocks Generalization in Neural Policies	Deep neural networks have made it possible for reinforcement learning algorithms to learn from raw high dimensional inputs. This jump in the progress has caused deep reinforcement learning algorithms to be deployed in many different fields from financial markets to biomedical applications. While the vulnerability of deep neural networks to imperceptible specifically crafted perturbations has also been inherited by deep reinforcement learning agents, several adversarial training methods have been proposed to overcome this vulnerability. In this paper we focus on state-of-the-art adversarial training algorithms and investigate their robustness to semantically meaningful natural perturbations ranging from changes in brightness to rotation. We conduct several experiments in the OpenAI Atari environments, and find that state-of-the-art adversarially trained neural policies are more sensitive to natural perturbations than vanilla trained agents. We believe our investigation lays out intriguing properties of adversarial training and our observations can help build robust and generalizable neural policies.	https://openreview.net/forum?id=QTQAWyY0Gwt
Benchmarking Robustness to Natural Distribution Shifts for Facial Analysis	During the deployment of machine learning models, performance degradation can occur compared to the training and validation data. This generalization gap can appear for a variety of reasons and be particularly critical in applications where certain groups of people are disadvantaged by the outcome, e.g. facial analysis. Literature provides a vast amount of methods to either perform robust classification under distribution shifts or at least to express the uncertainty caused by the shifts. However, there is still a need for data that exhibit different natural distribution shifts considering specific subgroups to test these methods. We use a balanced dataset for facial analysis and introduce subpopulation shifts, spurious correlations, and subpopulation-specific label noise. This forms our basis to investigate to what extent known approaches for calibrating neural networks remain reliable under these specified shifts. Each of the modifications leads to performance degradation, but the combination of ensembles and temperature scaling is particularly useful to stabilize the calibration over the shifts.	https://openreview.net/forum?id=MJgzr6dQPvl
Multi-Domain Ensembles for Domain Generalization	In this paper, we consider the challenging problem of multi-source zero shot domain generalization (MDG), where labeled training data from multiple source domains are available but with no access to data from the target domain. Many methods have been proposed to address this problem, but surprisingly the naiive solution of pooling all source data together and training a single ERM model is highly competitive. Constructing an ensemble of deep classifiers is a popular approach for building models that are calibrated under challenging distribution shifts. Hence, we propose MulDEns (Multi-Domain Deep Ensembles), a new approach for constructing deep ensembles in multi-domain problems that does not require to construct domain-specific models. Our empirical studies on multiple standard benchmarks show that MulDEns significantly outperforms ERM and existing ensembling solutions for MDG.	https://openreview.net/forum?id=mmlix0UucTh
Re-labeling Domains Improves Multi-Domain Generalization	Domain generalization (DG) methods aim to develop models that generalize to settings where the test distribution is different from the training data. In this paper, we focus on the challenging problem of multi-source zero-shot DG, where labeled training data from multiple source domains is available but with no access to data from the target domain. Though this problem has become an important topic of research, surprisingly, the naive solution of pooling all source data together and training a single classifier is highly competitive on standard benchmarks. More importantly, even sophisticated approaches that explicitly optimize for invariance across different domains do not necessarily provide non-trivial gains over ERM. We hypothesize that this behavior arises due to the poor definitions of the domain splits itself. In this paper, we make a first attempt to understand the role pre-defined domain labels play in the success of domain-aware DG methods. To this end, we ignore the domain labels that come with the dataset but instead alternatively perform unsupervised clustering to infer domain splits and train the DG method with these domain labels. We also introduce a novel regularization to improve the behavior of this alternating optimization process. We conduct analysis on two standard benchmarks PACS and VLCS and demonstrate the benefit of re-categorizing samples into new domain groups on DG performance.	https://openreview.net/forum?id=UQGYhou3oEi
The impact of domain shift on the calibration of fine-tuned models	Transfer learning has become a standard technique in computer vision and natural language processing thanks to the fact that it often substantially improves performance on downstream tasks. Recent work by Hendrycks et al. demonstrated that using a pre-trained model can also significantly improve a model's calibration, i.e. how well the model's confidence estimates correspond to the probability of its prediction being correct. In this paper, we provide some nuance to the claim that pre-training improves calibration by demonstrating that this beneficial effect diminishes when there is a domain shift between the pre-training and fine-tuning tasks.	https://openreview.net/forum?id=dZ7MVojplmi
Extending the WILDS Benchmark for Unsupervised Adaptation	Machine learning systems deployed in the wild are often trained on a source distribution but deployed on a different target distribution. Unlabeled data can be a powerful point of leverage for mitigating these distribution shifts, as it is frequently much more available than labeled data. However, existing distribution shift benchmarks for unlabeled data do not reflect the breadth of scenarios that arise in real-world applications. In this work, we present the WILDS 2.0 update, which extends 8 of the 10 datasets in the WILDS benchmark of distribution shifts to include curated unlabeled data that would be realistically obtainable in deployment. To maintain consistency, the labeled training, validation, and test sets, as well as the evaluation metrics, are exactly the same as in the original WILDS benchmark. These datasets span a wide range of applications (from histology to wildlife conservation), tasks (classification, regression, and detection), and modalities (photos, satellite images, microscope slides, text, molecular graphs). We systematically benchmark state-of-the-art methods that leverage unlabeled data, including domain-invariant, self-training, and self-supervised methods, and show that their success on WILDS is limited. To facilitate method development and evaluation, we provide an open-source package that automates data loading and contains all of the model architectures and methods used in this paper. Code and leaderboards are available at https://wilds.stanford.edu.	https://openreview.net/forum?id=2EhHKKXMbG0
Is Importance Weighting Incompatible with Interpolating Classifiers?	Importance weighting is a classic technique to handle distribution shifts. However, prior work has presented strong empirical and theoretical evidence demonstrating that importance weights can have little to no effect on overparameterized neural networks. \emph{Is importance weighting truly incompatible with the training of overparameterized neural networks?} Our paper answers this in the negative. We show that importance weighting fails not because of the overparameterization, but instead, as a result of using exponentially-tailed losses like the logistic or cross-entropy loss. As a remedy, we show that polynomially-tailed losses restore the effects of importance reweighting in correcting distribution shift in overparameterized models. We characterize the behavior of gradient descent on importance weighted polynomially-tailed losses with overparameterized linear models, and theoretically demonstrate the advantage of using polynomially-tailed losses in a label shift setting. Surprisingly, our theory shows that using weights that are obtained by exponentiating the classical unbiased importance weights can improve performance. Finally, we demonstrate the practical value of our analysis with neural network experiments on a subpopulation shift and a label shift dataset. Our polynomially-tailed loss consistently increases the test accuracy by 2-3%.	https://openreview.net/forum?id=pEhpLxVsd03
Domain-agnostic Test-time Adaptation by Prototypical Training with Auxiliary Data	Test-time adaptation (TTA) aims to achieve high accuracy on out-of-distribution (OOD) target data with only model parameters trained on the source domain and the target data. Standard TTA assumes that the test data is under a single distribution, or the distribution gradually changes with test data streaming in. However, in many scenarios, this assumption does not always hold. For instance, when inference is performed on the cloud, the test data can come from totally different users. In this paper, we try to tackle Domain-agnostic Test-time Adaptation (DaTTA), a new problem setting where the test data distribution is unknown and varies abruptly. To address DaTTA, we propose a framework to perform prototypical training with auxiliary data (PAD). Specifically, we fine-tune the model with augmented test images by consistency loss and further regulate the training process by auxiliary data. We curate a dataset for DaTTA, and the proposed PAD outperforms previous best methods by large margins on both DaTTA and standard TTA.	https://openreview.net/forum?id=bAO-2cGNX_j
Correct-N-Contrast: A Contrastive Approach for Improving Robustness to Spurious Correlations	We propose Correct-N-Contrast (CNC), a contrastive learning method to improve robustness to spurious correlations when training group labels are unknown. Our motivating observation is that worst-group performance is related to a representation alignment loss, which measures the distance in feature space between different groups within each class. We prove that the gap between worst-group and average loss for each class is upper bounded by this alignment loss for that class. Thus, CNC aims to improve representation alignment via contrastive learning. First, CNC uses an ERM model to infer the group information. Second, with a careful sampling scheme, CNC trains a contrastive model to encourage similar representations for groups in the same class. We show that CNC significantly improves worst-group accuracy over existing state-of-the-art methods on popular benchmarks, e.g., achieving $7.7\%$ absolute lift in worst-group accuracy on the CelebA dataset, and performs almost as well as methods trained with group labels. CNC also learns better-aligned representations between different groups in each class, reducing the alignment loss substantially compared to prior methods.	https://openreview.net/forum?id=Q41kl_DwS3Y
Boosting worst-group accuracy without group annotations	Despite having good average test accuracy, classification models can have poor performance on subpopulations that are not well represented in the training data. In this work, we introduce a criterion to estimate the accuracy on these populations. This allows us to design a procedure that achieves good worst-group performance and unlike previous procedures requires no group labels. We provide a sound empirical investigation of our procedure and show that it recovers the worst-group performance of methods that use oracle group annotations.	https://openreview.net/forum?id=-D8l1ifCHYi
Catastrophic Failures of Neural Active Learning on Heteroskedastic Distributions	Models which can actively seek out the best quality training data hold the promise of more accurate, adaptable, and efficient machine learning. State-of-the-art techniques tend to prefer examples which are the most difficult to classify. While this works well on homogeneous datasets, we find that it can lead to catastrophic failures when performing active learning on multiple distributions which have different degrees of label noise (heteroskedasticity). Most active learning algorithms strongly prefer to draw from the distribution with more noise, even if its examples have no informative structure (such as solid color images). We find that active learning which encourages diversity and model uncertainty in the selected examples can significantly mitigate these failures. We hope these observations are immediately useful to practitioners and can lead to the construction of more realistic and challenging active learning benchmarks.	https://openreview.net/forum?id=6Mfsc-BYp2d
A Closer Look at Distribution Shifts and Out-of-Distribution Generalization on Graphs	Distribution shifts, in which the training distribution differs from the testing distribution, can significantly degrade the performance of Graph Neural Networks (GNNs). We curate GDS, a benchmark of eight datasets reflecting a diverse range of distribution shifts across graphs. We observe that: (1) most domain generalization algorithms fail to work when applied to domain shifts on graphs; and (2) combinations of powerful GNN models and augmentation techniques usually achieve the best out-of-distribution performance. These emphasize the need for domain generalization algorithms tailored for graphs and further graph augmentation techniques that enhance the robustness of predictors.	https://openreview.net/forum?id=XvgPGWazqRH
Leveraging Unlabeled Data to Predict Out-of-Distribution Performance	Real-world machine learning deployments are characterized by mismatches between the source (training) and target (test) distributions that may cause performance drops. In this work, we investigate methods for predicting the target domain accuracy using only labeled source data and unlabeled target data. We propose Average Thresholded Confidence (ATC), a practical method that learns a \emph{threshold} on the model's confidence, predicting accuracy as the fraction of unlabeled examples for which model confidence exceeds that threshold. ATC outperforms previous methods across several model architectures, types of distribution shifts (e.g., due to synthetic corruptions, dataset reproduction, or novel subpopulations), and datasets (\textsc{Wilds}, ImageNet, \breeds, CIFAR, and MNIST). In our experiments, ATC estimates target performance $2\text{--}4\times$ more accurately than prior methods. We also explore the theoretical foundations of the problem, proving that, in general, identifying the accuracy is just as hard as identifying the optimal predictor and thus, the efficacy of any method rests upon (perhaps unstated) assumptions on the nature of the shift. Finally, analyzing our method on some toy distributions, we provide insights concerning when it works.	https://openreview.net/forum?id=wcrff7Gh0RR
