title	abstract	url
Model Zoo: A Growing Brain That Learns Continually	This paper argues that continual learning methods can benefit by splitting the capacity of the learner across multiple models. We use statistical learning theory and a thorough experimental analysis to show how multiple tasks can interact with each other in a highly non-trivial fashion when trained on a single model. The generalization error on a particular task can improve when it is trained with synergistic tasks, but can just as easily deteriorate when trained with competing tasks. This phenomenon motivates our method named Model Zoo which, inspired from the boosting literature, grows an ensemble of small models, each of which is trained during one episode of continual learning. We demonstrate large gains in accuracy on a variety of continual learning benchmarks.	https://openreview.net/forum?id=ZMMrVImtOrz
Robust fine-tuning of zero-shot models	Large pre-trained models such as CLIP or ALIGN offer consistent accuracy across a range of data distributions when performing zero-shot inference (i.e., without fine-tuning on a specific dataset). Although existing fine-tuning approaches substantially improve accuracy in-distribution, they often reduce out-of-distribution robustness. We address this tension by introducing a simple and effective method for improving robustness: ensembling the weights of the zero-shot and fine-tuned models (WiSE-FT). Compared to standard fine-tuning, WiSE-FT provides large accuracy improvements out-of-distribution, while preserving high in-distribution accuracy. On ImageNet (in-distribution) and five derived distribution shifts, WiSE-FT improves out-of-distribution accuracy by 4 to 6 percentage points (pp) over prior work while increasing in-distribution accuracy by 1.6 pp. WiSE-FT achieves similarly large robustness improvements (2 to 23 pp) on a diverse set of six further distribution shifts, and in-distribution accuracy gains of 0.8 to 3.3 pp compared to standard fine-tuning on seven commonly used transfer learning datasets. These improvements come at no additional computational cost during fine-tuning or inference.	https://openreview.net/forum?id=x4-czw5UxFX
Semi-Supervised Domain Generalization with Stochastic StyleMatch	We study semi-supervised domain generalization (SSDG), a more realistic problem setting than existing domain generalization research. In particular, SSDG assumes only a few data are labeled from each source domain, along with abundant unlabeled data. Our proposed approach, called StyleMatch, extends FixMatch's two-view consistency learning paradigm in two crucial ways to address SSDG: first, stochastic modeling is applied to the classifier's weights to mitigate overfitting in the scarce labeled data; and second, style augmentation is integrated as a third view into the multi-view consistency learning framework to enhance robustness to domain shift. Two SSDG benchmarks are established where StyleMatch outperforms strong baseline methods developed in relevant areas including domain generalization and semi-supervised learning.	https://openreview.net/forum?id=1JssKBooMlp
Unsupervised Attribute Alignment for Characterizing Distribution Shift	Detecting and addressing distribution shift is an important task in machine learning. However, most of the machine learning solutions to deal with distribution shift lack the capability to identify the key characteristics of such a shift and present it to humans in an interpretable way. In this work, we propose a novel framework to compare two datasets and identify distribution shifts between the datasets. The key challenge is to identify generative factors of variation, which we refer to as attributes, that characterize the similarities and differences between the datasets. Producing this characterization requires finding a set of attributes that can be aligned between the two datasets and sets that are unique. We address this challenge through a novel approach that performs both attribute discovery and attribute alignment across the two distributions. We evaluate our algorithm's effectiveness at accurately identifying these attributes in two separate experiments, one involving two variants of MNIST and a second experiment involving two versions of dSprites.	https://openreview.net/forum?id=Bk1hklAuZyh
Smooth Transfer Learning for Source-to-Target Generalization	Transfer learning for deep models has shown great success for various recognition tasks. Typically, a backbone network is pre-trained on a source dataset, then fine-tuned on a target dataset. We considered that when both datasets are at hand, learning them simultaneously at least for some period of iterations would yield higher test performance rather than the step-wise optimization. We propose Smooth Transfer Learning, which uses a learnable scheduler function for the loss coefficients so that degrees of contributions from two datasets can be smoothly changed along training time for optimal target performance. The scheduler function is designed so that it can express either pre-training-then-fine-tuning or multi-task learning with fixed weights as special cases. Our method consistently outperforms these special cases in object classification with CIFAR-10 and CIFAR-100, and in digit classification with SVHN and MNIST.	https://openreview.net/forum?id=2FE0NwK3Jbn
Exploring Covariate and Concept Shift for Out-of-Distribution Detection	The modeling of what a neural network does not know -- i.e. uncertainty -- is fundamentally important both in terms of theory and practice. This is especially true as the model encounters distribution shift during inference. Bayesian inference has been regarded as the most principled method of uncertainty modeling because it explicitly models two types of uncertainty: \textit{epistemic uncertainty} and aleatoric uncertainty in the form posteriors over parameters and data likelihood respectively. Epistemic uncertainty captures the uncertainty of model parameters due to lack of data, while aleatoric uncertainty captures inherent data ambiguity. Practically, epistemic uncertainty is often assessed by a model's out-of-distribution (OOD) detection performance or calibration, while aleatoric uncertainty can be assessed by in-distribution error detection. Recent attempts to model uncertainty using deterministic models failed to disentangle these two uncertainties due to their non-Bayesian nature. However, it is still possible to capture them empirically in a deterministic model using a combination of density estimation and softmax-entropy. This leaves us the question: how to approach OOD detection/calibration for deterministic (as opposed to Bayesian) and discriminative (as opposed to generative) models? This is arguably the most widely used class of models due to its speed (compared to Bayesian models) and simplicity (compared to generative models). It seems that the conventional association of OOD data with epistemic uncertainty fails under the scope of this type of models, specifically because it does not reason about what has changed in the input distribution and the mechanisms through which these changes affect neural networks and a different perspective is needed to analyze them.	https://openreview.net/forum?id=3AWGg4CySNh
On Adaptivity and Confounding in Contextual Bandit Experiments	Multi-armed bandit algorithms minimize experimentation costs required to converge on optimal behavior. They do so by rapidly adapting experimentation effort away from poorly performing actions as feedback is observed. But this desirable feature makes them sensitive to confounding. We highlight, for instance, that popular bandit algorithms cannot address the problem of identifying the best action when day-of-week effects may confound inferences. In response, this paper formulates a general model of contextual bandit experiments with nonstationary contexts, which act as the confounders for inferences and can be also viewed as the distribution shifts in the earlier periods of the experiments. In addition, this general model allows the target distribution or population distribution that is used to determine the best action to be different from the empirical distribution over the contexts observed during the experiments. The paper proposes deconfounded Thompson sampling, which makes simple, but critical, modifications to the way Thompson sampling is usually applied. Theoretical guarantees suggest the algorithm strikes a delicate balance between adaptivity and robustness to confounding and distribution shifts. It attains asymptotic lower bounds on the number of samples required to confidently identify the best action --- suggesting optimal adaptivity --- but also satisfies strong performance guarantees in the presence of day-of-week effects and delayed observations --- suggesting unusual robustness.	https://openreview.net/forum?id=crjYr3dUnPn
PCA Subspaces Are Not Always Optimal for Bayesian Learning	Bayesian Neural Networks are often sought after for their strong and trustworthy predictive power. However, inference in these models is often computationally expensive and can be reduced using dimensionality reduction where the key goal is to find an appropriate subspace in which to perform the inference, while retaining significant predictive power. In this work, we propose a theoretical comparative study of the Principal Component Analysis versus the random projection for Bayesian Linear Regression. We find that the PCA is not always the optimal dimensionality reduction method and that the random projection can actually be superior, especially in cases where the data distribution is shifted and the labels have a small norm. We then confirm these results experimentally. Therefore, this work suggests to consider dimension reduction by random projection for Bayesian inference when noisy data are expected.	https://openreview.net/forum?id=iPYHorHDtPh
Calibrated Ensembles: A Simple Way to Mitigate ID-OOD Accuracy Tradeoffs	We often see undesirable tradeoffs in robust machine learning where out-of-distribution (OOD) accuracy is at odds with in-distribution (ID) accuracy. A 'robust' classifier obtained via specialized techniques like removing spurious features has better OOD but worse ID accuracy compared to a 'standard' classifier trained via vanilla ERM. On six distribution shift datasets, we find that simply ensembling the standard and robust models is a strong baseline---we match the ID accuracy of a standard model with only a small drop in OOD accuracy compared to the robust model. However, calibrating these models in-domain surprisingly improves the OOD accuracy of the ensemble and completely eliminates the tradeoff and we achieve the best of both ID and OOD accuracy over the original models.	https://openreview.net/forum?id=dmDE-9e9F_x
Understanding Post-hoc Adaptation for Improving Subgroup Robustness	A number of deep learning approaches have recently been proposed to improve model performance on subgroups under-represented in the training set. However, Menon et al. recently showed that models with poor subgroup performance can still learn representations which contain useful information about these subgroups. In this work, we explore the representations learned by various approaches to robust learning, finding that different approaches learn practically identical representations. We probe a range of post-hoc procedures for making predictions from learned representations, showing that the distribution of the post-hoc validation set is paramount, and that clustering-based methods may be a promising approach.	https://openreview.net/forum?id=UmMqvN9Aid-
Photoacoustic imaging with conditional priors from normalizing flows	For many ill-posed inverse problems, such as photoacoustic imaging, the uncertainty of the solution is highly affected by measurement noise and data incompleteness (due, for example, to limited aperture). For these problems, the choice of prior information is a crucial aspect of a computationally effective solution scheme. We propose a regularization scheme for photoacoustic imaging that leverages prior information learned by a generative network. We train conditional normalizing flows on pairs of photoacoustic sources (the unknowns of the problem) and the associated data in order to exploit the posterior distribution of the solution. The learned prior is combined with physics-based optimization (enforced by partial differential equations), according to the deep prior framework, in order to achieve robustness with respect to out-of-distribution data. Numerical evidence suggests the superiority of this approach with respect to non-conditional deep priors, and the ability to retrieve features of the unknowns that are typically challenging for limited-view photoacoustics.	https://openreview.net/forum?id=woi1OTvROO1
PLUGIn-CS: A simple algorithm for compressive sensing with generative prior	We consider the problem of recovering an unknown latent code vector under a known generative model from compressive measurements. For a $d$-layer deep generative network $\mathcal{G}:\mathbb{R}^{n_0}\rightarrow \mathbb{R}^{n_d}$ with ReLU activation functions and compressive measurement matrix $\Phi \in \mathbb{R}^{m\times n_d}$, let the observation be $\Phi\mathcal{G}(x)+\epsilon$ where $\epsilon$ is noise. We introduce a simple novel algorithm, Partially Linearized Update for Generative Inversion in Compressive Sensing (PLUGIn-CS), to estimate $x$ (and thus $\mathcal{G}(x)$). We prove that, when sensing matrix and weights are Gaussian, if layer widths $n_i \gtrsim 5^i n_0$ and number of measurements $m \gtrsim 2^dn_0$ (both up to log factors), then the algorithm converges geometrically to a (small) neighbourhood of $x$ with high probability. Note the inequality on layer widths allows $n_i>n_{i+1}$ when $i\geq 1$ and thus allows the network to have some contractive layers. After a sufficient number of iterations, the estimation errors for both $x$ and $\mathcal{G}(x)$ are at most in the order of $\sqrt{4^dn_0/m} \|\epsilon\|$. Numerical experiments on synthetic data and real data are provided to validate our theoretical results and to illustrate that the algorithm can effectively recover images from compressive measurements.	https://openreview.net/forum?id=2v7XbFVRH3G
SSFD: Self-Supervised Feature Distance as an MR Image Reconstruction Quality Metric	Evaluation of accelerated magnetic resonance imaging (MRI) reconstruction methods is imperfect due to the discordance between quantitative image quality metrics and radiologist-perceived image quality. Self-supervised learning (SSL) has become a popular pre-training tool due to its ability to capture generalizable and domain-specific feature representations of the underlying data for downstream tasks. In this study, we use SSL to extract image-level feature representations of MR images, and use those features to compute a self-supervised feature distance (SSFD) metric to assess MR image reconstruction quality. We demonstrate preliminary results showing the superiority of SSFD to common image quality metrics such as PSNR and SSIM, its robustness to image perturbations, and its ability to capture both pixel-level and global image quality information.	https://openreview.net/forum?id=dgMvTzf6M_3
Beyond Independent Measurements: General Compressed Sensing with GNN Application	We consider the problem of recovering a structured signal $\mathbf{x} \in \mathbb{R}^{n}$ from noisy linear observations $\mathbf{y} =\mathbf{M} \mathbf{x}+\mathbf{w}$. The measurement matrix is modeled as $\mathbf{M} = \mathbf{B}\mathbf{A}$, where $\mathbf{B} \in \mathbb{R}^{l \times m}$ is arbitrary and $\mathbf{A} \in \mathbb{R}^{m \times n}$ has independent sub-gaussian rows. By varying $\mathbf{B}$, and the sub-gaussian distribution of $\mathbf{A}$, this gives a family of measurement matrices which may have heavy tails, dependent rows and columns, and singular values with a large dynamic range. When the structure is given as a possibly non-convex cone $T \subset \mathbb{R}^{n}$, an approximate empirical risk minimizer is proven to be a robust estimator if the effective number of measurements is sufficient, even in the presence of a model mismatch. In classical compressed sensing with independent (sub-)gaussian measurements, one asks \textit{how many measurements are needed to recover $\mathbf{x}$?} In our setting, however, the effective number of measurements depends on the properties of $\mathbf{B}$. We show that the \textit{effective rank} of $\mathbf{B}$ may be used as a surrogate for the number of measurements, and if this exceeds the squared \textit{Gaussian mean width} of $(T-T) \cap \mathbb{S}^{n-1}$, then accurate recovery is guaranteed. Furthermore, we examine the special case of generative priors in detail, that is when $\mathbf{x}$ lies close to $T = \mathrm{ran}(G)$ and $G: \mathbb{R}^k \rightarrow \mathbb{R}^n$ is a Generative Neural Network (GNN) with ReLU activation functions. Our work relies on a recent result in random matrix theory by Jeong, Li, Plan, and Y{\i}lmaz.	https://openreview.net/forum?id=rQhQIbvP3SA
NeRP: Implicit Neural Representation Learning with Prior Embedding for Sparsely Sampled Image Reconstruction	Image reconstruction is an inverse problem that solves for a computational image based on sampled sensor measurement. Sparsely sampled image reconstruction poses addition challenges due to limited measurements. In this work, we propose an implicit Neural Representation learning methodology with Prior embedding (NeRP) to reconstruct a computational image from sparsely sampled measurements. The method differs fundamentally from previous deep learning-based image reconstruction approaches in that NeRP exploits the internal information in an image prior, and the physics of the sparsely sampled measurements to produce a representation of the unknown subject. No large-scale data is required to train the NeRP except for a prior image and sparsely sampled measurements. In addition, we demonstrate that NeRP is a general methodology that generalizes to different imaging modalities such as CT and MRI. We also show that NeRP can robustly capture the subtle yet significant image changes required for assessing tumor progression.	https://openreview.net/forum?id=fRB_ak9moDt
Matching Plug-and-Play Algorithms to the Denoiser	To solve inverse problems, plug-and-play (PnP) methods have been developed that replace the proximal step in a convex optimization algorithm with a call to an application-specific denoiser, often implemented using a deep neural network (DNN). Although such methods have been successful, they can be improved. For example, denoisers are usually designed/trained to remove white Gaussian noise, but the denoiser input error in PnP algorithms is usually far from white or Gaussian. Approximate message passing (AMP) methods provide white and Gaussian denoiser input error, but only when the forward operator is a large random matrix. In this work, we propose a PnP algorithm based on generalized expectation consistent (GEC) approximation that offers predictable error statistics at each iteration, as well as a new DNN denoiser that leverages those statistics.	https://openreview.net/forum?id=oRF0-zGYAei
Learning Structured Sparse Matrices for Signal Recovery via Unrolled Optimization	Countless signal processing applications include the reconstruction of an unknown signal from very few indirect linear measurements. Because the measurement operator is commonly constrained by the hardware or the physics of the observation process, finding measurement matrices that enable accurate signal recovery poses a challenging discrete optimization task. Meanwhile, recent advances in the field of machine learning have highlighted the effectiveness of gradient-based optimization methods applied to large computational graphs such as those arising naturally when unrolling iterative algorithms for signal recovery. However, it has remained unclear how to leverage this technique when the set of admissible measurement matrices is both discrete and sparse. In this paper, we tackle this problem and propose an efficient and flexible method for learning structured sparse measurement matrices. Our approach uses unrolled optimization in conjunction with Gumbel reparametrizations. We empirically demonstrate the effectiveness of our method in two prototypical compressed sensing situations.	https://openreview.net/forum?id=IxKSqOq1TKQ
Sparse deep computer-generated holography for optical microscopy	Computer-generated holography (CGH) has broad applications such as direct-view display, virtual and augmented reality, as well as optical microscopy. CGH usually utilizes a spatial light modulator that displays a computer-generated phase mask, modulating the phase of coherent light in order to generate customized patterns. The algorithm that computes the phase mask is the core of CGH and is usually tailored to meet different applications. CGH for optical microscopy usually requires 3D accessibility (i.e., generating overlapping patterns along the $z$-axis) and micron-scale spatial precision. Here, we propose a CGH algorithm using an unsupervised generative model designed for optical microscopy to synthesize 3D selected illumination. The algorithm, named sparse deep CGH, is able to generate sparsely distributed points in a large 3D volume with higher contrast than conventional CGH algorithms.	https://openreview.net/forum?id=0Mo684AhZAm
Multi-Task Accelerated MR Reconstruction Schemes for Jointly Training Multiple Contrasts	Model-based accelerated MRI reconstruction methods leverage large datasets to reconstruct diagnostic-quality images from undersampled k-space. These networks require matching training and test time distributions to achieve high quality reconstructions. However, there is inherent variability in MR datasets, including different contrasts, orientations, anatomies, and institution-specific protocols. The current paradigm is to train separate models for each dataset. However, this is a demanding process and cannot exploit information that may be shared amongst datasets. To address this issue, we propose multi-task learning (MTL) schemes that can jointly reconstruct multiple datasets. We test multiple MTL architectures and weighted loss functions against single task learning (STL) baselines. Our quantitative and qualitative results suggest that MTL can outperform STL across a range of dataset ratios for two knee contrasts.	https://openreview.net/forum?id=S6sXIL3l_r7
Greedy Learning for Large-Scale Neural MRI Reconstruction	Model-based deep learning approaches have recently shown state-of-the-art performance for accelerated MRI reconstruction. These methods unroll iterative proximal gradient descent by alternating between data-consistency and a neural-network based proximal operation. However, they demand several unrolled iterations with sufficiently expressive proximals for high resolution and multi-dimensional imaging (e.g., 3D MRI). This impedes traditional training via backpropagation due to prohibitively intensive memory and compute needed to calculate gradients and store intermediate activations per layer. To address this challenge, we advocate an alternative training method by greedily relaxing the objective. We split the end-to-end network into decoupled network modules, and optimize each network module separately, thereby avoiding the need to compute costly end-to-end gradients. We empirically demonstrate that the proposed greedy learning method requires 6x less memory with no additional computations, while generalizing slightly better than backpropagation.	https://openreview.net/forum?id=tKeEIFvmENy
Solving Inverse Problems in Medical Imaging with Score-Based Generative Models	Solving inverse problems with a small number of measurements has important applications in medical imaging, including image reconstruction for undersampled MRI and sparse-view CT. With the progress of machine learning, traditional image reconstruction methods have been outperformed by models that learn to directly map measurements to medial images. However, these models require both ground truth medical images and their measurements for training, which complicates data collection and harms their generalization performance to unknown measurement processes. To address these issues, we propose a fully unsupervised technique for inverse problem solving, leveraging the recently introduced score-based generative models. Specifically, we train a score-based generative model to capture the prior distribution of medical images, which is subsequently combined with a given physical measurement process to sample images consistent with measurements at the test time. Our method makes no assumption on the measurement process during training, and can be flexibly adapted to any linear measurement processes. Empirically, we observe comparable or better performance to supervised learning techniques, with better generalization to unknown measurement processes on several MRI/CT datasets.	https://openreview.net/forum?id=4rFAhgrA0lA
