title	abstract	url
Evaluating the Adversarial Robustness of a Foveated Texture Transform Module in a CNN	Biologically inspired mechanisms such as foveation and multiple fixation points have previously been shown to help alleviate adversarial examples (Reddy et al., 2020). By mimicking the effects of visual crowding present in human vision, foveated, texture-based computations may provide another route for increasing adversarial robustness. Previous statistical models of texture rendering (Portilla & Simoncelli, 2000; Gatys et al., 2015) paved the way for the development of a Foveated Texture Transform (FTT) module which utilizes localized texture synthesis in foveated receptive fields (Deza et al. 2019). The FTT module was added to a VGG-11 CNN architecture and ten randomly initialized networks were trained on 20-class subsets of the Places and EcoSet datasets for scene and object classification respectively. The trained networks were attacked using Projected Gradient Descent (PGD) and the adversarial accuracies were calculated at multiple epochs to evaluate changes in robustness as the networks trained. The results indicate that the FTT module significantly improved adversarial robustness for scene classification, especially when the validation loss was at a minimum. However, the FTT module did not provide a statistically significant increase in adversarial robustness for object classification. Furthermore, we do not find a trade-off between accuracy and robustness (Tsipras et al., 2018) for the FTT module suggesting a benefit of using foveated, texture-based distortions in the latent space during learning compared to non-perturbed latent space representations. Finally, we investigate the nature of latent space distortions with additional controls that probe other directions in the latent space that are not texture-based. A link to our code is available at https://github.com/JonGant/FoveatedTextureTransform.	https://openreview.net/forum?id=HyhSFQ1hOgV
V1- and IT-like representations are directly accessible to human visual perception	Human visual recognition of complex patterns is supported by hierarchical representations in the ventral stream of visual cortex. However, it remains undetermined whether representations in early visual cortical areas, e.g. primary visual cortex (V1), are directly accessible by perception or are merely intermediates used only for the generation of more complex representations in higher-level visual areas, e.g. inferior temporal cortex (IT). Here, we constructed deep convolutional neural network (dCNN) based simulations of V1 and IT by linearly weighting dCNN features to maximize predictivity of electrophysiological responses. We used these cortical simulations to synthesize stimuli which linearly interpolate through either a V1- or IT-like feature space. In a visual discrimination task, we found that human observers are highly sensitive to variation through both V1 and IT representational spaces. We found that behavior on this task cannot be explained by an observer model that makes use of solely V1 features or IT features, but instead is best explained by a weighted combination of V1 and IT features. Our results thus provide evidence for the insufficiency of IT-like representations and the utility of representations in both early and late regions of the ventral visual stream for human visual perception.	https://openreview.net/forum?id=ec7BWId59zF
Unsupervised Representation Learning Facilitates Human-like Spatial Reasoning	When judging the sameness of three-dimensional (3D) objects that differ by a rotation, response time typically increases with the angle of rotation. This increase is usually taken as evidence for mental rotation, but the extent to which low-level perceptual mechanisms contribute to this phenomenon is unclear. To investigate this, we built a neural model that breaks down this computation into two stages: a fast feedforward stage that extracts low-dimensional latent representations of the objects being compared, and a slow recurrent processing stage that compares those representations to arrive at a decision by accumulating evidence at a rate that is proportional to the proximity of the representations. We found that representation of 3D objects learned by a generic autoencoder was sufficient to emulate human response times using this model. We conclude that perceptual representations may play a key role in limiting the speed of spatial reasoning. We discuss our findings in the context of the mental rotation hypothesis and identify additional, as yet unverified representational constraints that must be satisfied by neural systems that perform mental rotation.	https://openreview.net/forum?id=jHvxhJzCTeM
Bio-inspired learnable divisive normalization for ANNs	In this work we introduce DivNormEI, a novel bio-inspired convolutional network that performs divisive normalization, a canonical cortical computation, along with lateral inhibition and excitation that is tailored for integration into modern Artificial Neural Networks (ANNs). DivNormEI, an extension of prior computational models of divisive normalization in the primate primary visual cortex, is implemented as a modular layer that can be integrated in a straightforward manner into most commonly used modern ANNs. DivNormEI normalizes incoming activations via learned non-linear within-feature shunting inhibition along with across-feature linear lateral inhibition and excitation. In this work, we show how the integration of DivNormEI within a task-driven self-supervised encoder-decoder architecture encourages the emergence of the well-known contrast-invariant tuning property found to be exhibited by simple cells in the primate primary visual cortex. Additionally, the integration of DivNormEI into an ANN (VGG-9 network) trained to perform image classification on ImageNet-100 improves both sample efficiency and top-1 accuracy on a held-out validation set. We believe our findings from the bio-inspired DivNormEI model that simultaneously explains properties found in primate V1 neurons and outperforms the competing baseline architecture on large-scale object recognition will promote further investigation of this crucial cortical computation in the context of modern machine learning tasks and ANNs.	https://openreview.net/forum?id=-ZOjASLOsrV
Learning to perceive objects by prediction	The representation of objects is the building block of higher-level concepts. Infants develop the notion of objects without supervision. The prediction error of future sensory input is likely the major teaching signal for infants. Inspired by this, we propose a new framework to extract object-centric representation from single 2D images by learning to predict future scenes in the presence of moving objects. We treat objects as latent causes of which the function for an agent is to facilitate efficient prediction of the coherent motion of their parts in visual input. Distinct from previous object-centric models, our model learns to explicitly infer objects' locations in a 3D environment in addition to segmenting objects. Further, the network learns a latent code space where objects with the same geometric shape and texture/color frequently group together. The model requires no supervision or pre-training of any part of the network. We created a new synthetic dataset with more complex textures on objects and background and found several previous models not based on predictive learning overly rely on clustering colors and lose specificity in object segmentation. Our work demonstrates a new approach for learning symbolic representation grounded in sensation and action.	https://openreview.net/forum?id=lIQ45G9P_zh
A four-year-old can outperform ResNet-50: Out-of-distribution robustness may not require large-scale experience	Recent gains in model robustness towards out-of-distribution images are predominantly achieved through ever-increasing large-scale datasets. While this approach is very effective in achieving human-level distortion robustness, it raises the question of whether human robustness, too, requires massive amounts of experience. We therefore investigated the developmental trajectory of human object recognition robustness by comparing children aged 4–6, 7–9, 10-–12, 13–15 against adults and against different deep learning models. Assessing how recognition accuracy degrades when images are distorted by salt-and-pepper noise, we find that while overall performance improves with age, even the youngest children in the study showed remarkable robustness and outperformed standard CNNs and self-supervised models on distorted images. In order to compare the robustness of different age groups and models as a function of visual experience, we used a back-of-the-envelope calculation to estimated the number of `images' that those young children had been exposed to during their lifetime. We find that for humans, more data does not necessarily lead to better out-of-distribution robustness. Compared to various deep learning models, children's high out-of-distribution robustness requires relatively little data. Taken together, this indicates that human out-of-distribution robustness develops very early in life and may not require seeing billions of different images during lifetime given the right choice of representation and information processing optimised during evolution.	https://openreview.net/forum?id=7yMg2rS9N5I
Neural Structure Mapping For Learning Abstract Visual Analogies	Building conceptual abstractions from sensory information and then reasoning about them is central to human intelligence. Abstract reasoning both relies on, and is facilitated by, our ability to make analogies about concepts from known domains to novel domains. Structure Mapping Theory of human analogical reasoning posits that analogical mappings rely on (higher-order) relations and not on the sensory content of the domain. This enables humans to reason systematically about novel domains, a problem with which machine learning (ML) models tend to struggle. We introduce a two-stage neural framework, which we label Neural Structure Mapping (NSM), to learn visual analogies from Raven's Progressive Matrices, an abstract visual reasoning test of fluid intelligence. Our framework uses (1) a multi-task visual relationship encoder to extract constituent concepts from raw visual input in the source domain, and (2) a neural module net analogy inference engine to reason compositionally about the inferred relation in the target domain. Our NSM approach (a) isolates the relational structure from the source domain with high accuracy, and (b) successfully utilizes this structure for analogical reasoning in the target domain.	https://openreview.net/forum?id=l-TLGjxwajn
What can 5.17 billion regression fits tell us about artificial models of the human visual system?	Rapid simultaneous advances in machine vision and cognitive neuroimaging present an unparalleled opportunity to assess the current state of artificial models of the human visual system. Here, we perform a large-scale benchmarking analysis of 72 modern deep neural network models to characterize with robust statistical power how differences in architecture and training task contribute to the prediction of human fMRI activity across 16 distinct regions of the human visual system. We find: one, that even stark architectural differences (e.g. the absence of convolution in transformers and MLP-mixers) have very little consequence in emergent fits to brain data; two, that differences in task have clear effects--with categorization and self-supervised models showing relatively stronger brain predictivity across the board; three, that feature reweighting leads to substantial improvements in brain predictivity, without overfitting -- yielding model-to-brain regression weights that generalize at the same level of predictivity to brain responses over 1000s of new images. Broadly, this work presents a lay-of-the-land for the emergent correspondences between the feature spaces of modern deep neural network models and the representational structure inherent to the human visual system.	https://openreview.net/forum?id=i_xiyGq6FNT
Signal Strength and Noise Drive Feature Preference in CNN Image Classifiers	Feature preference in Convolutional Neural Network (CNN) image classifiers is integral to their decision making process, and while the topic has been well studied, it is still not understood at a fundamental level. We test a range of task relevant feature attributes (including shape, texture, and color) with varying degrees of signal and noise in highly controlled CNN image classification experiments using synthetic datasets to determine feature preferences. We find that CNNs will prefer features with stronger signal strength and lower noise irrespective of whether the feature is texture, shape, or color. This provides guidance for a predictive model for task relevant feature preferences, demonstrates pathways for bias in machine models that can be avoided with careful controls on experimental setup, and suggests that comparisons between how humans and machines prefer task relevant features in vision classification tasks should be revisited.	https://openreview.net/forum?id=CXQpLhjrTwJ
Cyclic orthogonal convolutions for long-range integration of features	In Convolutional Neural Networks (CNNs) information flows across a small neighbourhood of each pixel of an image, preventing long-range integration of features before reaching deep layers in the network. Inspired by the neurons of the human visual cortex responding to similar but distant visual features, we propose a novel architecture that allows efficient information flow between features $z$ and locations $(x,y)$ across the entire image with a small number of layers. This architecture uses a cycle of three orthogonal convolutions, not only in $(x,y)$ coordinates, but also in $(x,z)$ and $(y,z)$ coordinates. We stack a sequence of such cycles to obtain our deep network, named CycleNet. When compared to CNNs of similar size, our model obtains competitive results at image classification on CIFAR-10 and ImageNet datasets. We hypothesise that long-range integration favours recognition of objects by shape rather than texture, and we show that CycleNet transfers better than CNNs to stylised images. On the Pathfinder challenge, where integration of distant features is crucial, CycleNet outperforms CNNs by a large margin. Code has been made available at: https://github.com/netX21/Submission	https://openreview.net/forum?id=868DWd46dv2
On the use of Cortical Magnification and Saccades as Biological Proxies for Data Augmentation	Self-supervised learning is a strong way to learn useful representations from the bulk of natural data. It's suggested to be responsible for building the visual representation in humans, but the specific objective and algorithm are unknown. Currently, most self-supervised methods encourage the system to learn an invariant representation of different transformations of the same image in contrast to those of other images. However, such transformations are generally non-biologically plausible, and often consist of contrived perceptual schemes such as random cropping and color jittering. In this paper, we attempt to reconfigure these augmentations to be more biologically or perceptually plausible while still conferring the same benefits for encouraging a good representation. Critically, we find that random cropping can be substituted by cortical magnification, and saccade-like sampling of the image could also assist the representation learning. The feasibility of these transformations suggests a potential way that biological visual systems could implement self-supervision. Further, they break the widely accepted spatially-uniform processing assumption used in many computer vision algorithms, suggesting a role for spatially-adaptive computation in humans and machines alike.	https://openreview.net/forum?id=Rpazl253IHb
Multimodal neural networks better explain multivoxel patterns in the hippocampus	"The human hippocampus possesses ""concept cells"", neurons that fire when presented with stimuli belonging to a specific concept, regardless of the modality. Recently, similar concept cells were discovered in a multimodal network called CLIP [1].Here, we ask whether CLIP can explain the fMRI activity of the human hippocampus better than a purely visual (or linguistic) model. We extend our analysis to a range of publicly available uni- and multi-modal models. We demonstrate that ``multimodality'' stands out as a key component when assessing the ability of a network to explain the multivoxel activity in the hippocampus."	https://openreview.net/forum?id=6dymbuga7nL
Seeking the Building Blocks of Visual Imagery and Creativity in a Cognitively Inspired Neural Network	How do we imagine visual objects, and combine them to create new forms? To answer this question, we need to explore the cognitive, computational and neural mechanisms underlying imagery and creativity. The body of research on deep learning models with creative behaviors is growing. However, in this paper we suggest that the complexity of such models and their training sets is an impediment to using them as tools to understand human aspects of creativity. We propose using simpler models, inspired by neural and cognitive mechanisms, that are trained with smaller data sets. We show that a standard deep learning architecture can demonstrate imagery by generating shape/color combinations using only symbolic codes as input. However, generating a new combination that was not experienced by the model was not possible. We discuss the limitations of such models, and explain how creativity could be embedded by incorporating mechanisms to transform the network's output into new combinations and use that as new training data.	https://openreview.net/forum?id=X7gkZcELB6f
Controlled-rearing studies of newborn chicks and deep neural networks	"Convolutional neural networks (CNNs) can now achieve human-level performance on challenging object recognition tasks. CNNs are also the leading quantitative models in terms of predicting neural and behavioral responses in visual recognition tasks. However, there is a widely accepted critique of CNN models: unlike newborn animals, which learn rapidly and efficiently, CNNs are thought to be ""data hungry,"" requiring massive amounts of training data to develop accurate models for object recognition. This critique challenges the promise of using CNNs as models of visual development. Here, we directly examined whether CNNs are more data hungry than newborn animals by performing parallel controlled-rearing experiments on newborn chicks and CNNs. We raised newborn chicks in strictly controlled visual environments, then simulated the training data available in that environment by constructing a virtual animal chamber in a video game engine. We recorded the visual images acquired by an agent moving through the virtual chamber and used those images to train CNNs. When CNNs were provided with similar visual training data as chicks, the CNNs successfully solved the same challenging view-invariant object recognition tasks as the chicks. Thus, the CNNs were not more data hungry than animals: both CNNs and chicks successfully developed robust object models from training data of a single object."	https://openreview.net/forum?id=vaZfVKSXH7a
Contrastive Learning Through Time	Human infants learn to recognize objects largely without supervision. In machine learning, contrastive learning has emerged as a powerful form of unsupervised representation learning. The utility of learned representations for downstream tasks depends strongly on the chosen augmentation operations. Taking inspiration from biology, we here study a framework for unsupervised learning of object representations we call Contrastive Learning Through Time (CLTT). CLTT simulates viewing sequences as they might be experienced by an infant while interacting with objects and avoids arbitrary augmentation operations. Instead, positive pairs are formed by successive views in such unsegmented viewing sequences. Generating viewing sequences procedurally, rather than using natural videos, gives us perfect control over the temporal structure of the input and allows us to ask the following two questions. First, can CLTT approach the performance of fully supervised learning? Second, if so, what are the required conditions on the temporal structure of the input? To answer these questions, we develop a new data set using a near-photorealistic training environment based on ThreeDWorld (TDW). We consider several state-of-the-art contrastive learning methods and demonstrate that CLTT allows linear classification performance that approaches that of the fully supervised setting if subsequent views are sufficiently likely to stem from the same object. We also consider the effect of one object being seen systematically before or after another object. We show that this leads to increased representational similarity between these objects, reminiscent of classic neurobiological findings. The data sets and code for this paper can be downloaded at: https://www.github.com/trieschlab/CLTT.	https://openreview.net/forum?id=HTCRs8taN8
Modeling Category-Selective Cortical Regions with Topographic Variational Autoencoders	Category-selectivity in the brain describes the observation that certain spatially localized areas of the cerebral cortex tend to respond robustly and selectively to stimuli from specific limited categories. One of the most well known examples of category-selectivity is the Fusiform Face Area (FFA), an area of the inferior temporal cortex in primates which responds preferentially to images of faces when compared with objects or other generic stimuli. In this work, we leverage the newly introduced Topographic Variational Autoencoder to model of the emergence of such localized category-selectivity in an unsupervised manner. Experimentally, we demonstrate our model yields spatially dense neural clusters selective to faces, bodies, and places through visualized maps of Cohen's d metric. We compare our model with related supervised approaches, namely the Topographic Deep Articifial Neural Network (TDANN) of Lee et al., and discuss both theoretical and empirical similarities. Finally, we show preliminary results suggesting that our model yields a nested spatial hierarchy of increasingly abstract categories, analogous to observations from the human ventral temporal cortex.	https://openreview.net/forum?id=yGRq_lW54bI
KDSalBox: A toolbox of efficient knowledge-distilled saliency models	Dozens of saliency models have been designed over the last few decades, targeted at diverse applications ranging from image compression and retargeting to robot navigation, surveillance, and distractor detection. Barriers to their use include the different and often incompatible software environments that they rely on, as well as the computational inefficiency of older implementations. For application-purposes models are then frequently chosen based on convenience and efficiency, at the expense of optimizing for task performance. To facilitate the evaluation and selection of saliency models for different applications, we present KDSalBox - a toolbox of 10 knowledge-distilled saliency models. Using the original model implementations available in their native environments, we produce saliency training data for efficient MobileNet-based architectures, that are identical in their architecture but differ in how they learn to distribute saliency over an image. The resulting toolbox allows these 10 models to be efficiently run, compared, and be practically applied.	https://openreview.net/forum?id=7QC7MC5VzUh
Bio-inspired Min-Nets Improve the Performance and Robustness of Deep Networks	Min-Nets are inspired by end-stopped cortical cells with units that output the minimum of two learned filters. We insert such Min-units into state-of-the-art deep networks, such as the popular ResNet and DenseNet, and show that the resulting Min-Nets perform better on the Cifar-10 benchmark. Moreover, we show that Min-Nets are more robust against JPEG compression artifacts. We argue that the minimum operation is the simplest way of implementing an AND operation on pairs of filters and that such AND operations introduce a bias that is appropriate given the statistics of natural images.	https://openreview.net/forum?id=zxxdFLB8F24
Exploring the Structure of Human Adjective Representations	Human semantic representations are both difficult to capture and hard to fully interpret. Similarity judgments of words are highly sensitive to context, and association norms may only capture coarse similarity. By contrast, feature norms are more interpretable, and the number of norms can be scaled without limit, but they often only exist for sets of nouns described with concrete norms. In this paper, we introduce a new large dataset of nouns normed by a set of continuous adjective ratings both concrete and abstract. We compare our dataset to other forms of representation and find that they capture rich, unique structure, which can be represented by a low-dimensional latent semantic space. We further make relationships between our data and neural network representations from different modalities. Our dataset contributes to an increasingly detailed picture of one relatively sizable swath of human semantic representations, and can be used in a variety of modeling paradigms.	https://openreview.net/forum?id=vHE-ETSMGhl
