title	abstract	url	authors
Samanantar: The Largest Publicly Available Parallel Corpora Collection for 11 Indic Languages	We present Samanantar, the largest publicly available parallel corpora collection for Indic languages. The collection contains a total of 49.7 million sentence pairs between English and 11 Indic languages (from two language families). Specifically, we compile 12.4 million sentence pairs from existing, publicly available parallel corpora, and additionally mine 37.4 million sentence pairs from the Web, resulting in a 4× increase. We mine the parallel sentences from the Web by combining many corpora, tools, and methods: (a) Web-crawled monolingual corpora, (b) document OCR for extracting sentences from scanned documents, (c) multilingual representation models for aligning sentences, and (d) approximate nearest neighbor search for searching in a large collection of sentences. Human evaluation of samples from the newly mined corpora validate the high quality of the parallel sentences across 11 languages. Further, we extract 83.4 million sentence pairs between all 55 Indic language pairs from the English-centric parallel corpus using English as the pivot language. We trained multilingual NMT models spanning all these languages on Samanantar which outperform existing models and baselines on publicly available benchmarks, such as FLORES, establishing the utility of Samanantar. Our data and models are available publicly at Samanantar and we hope they will help advance research in NMT and multilingual NLP for Indic languages.	https://aclanthology.org/2022.tacl-1.9	Gowtham Ramesh, Sumanth Doddapaneni, Aravinth Bheemaraj, Mayank Jobanputra, Raghavan AK, Ajitesh Sharma, Sujit Sahoo, Harshita Diddee, Mahalakshmi J, Divyanshu Kakwani, Navneet Kumar, Aswin Pradeep, Srihari Nagaraj, Kumar Deepak, Vivek Raghavan, Anoop Kunchukuttan, Pratyush Kumar, Mitesh Shantadevi Khapra
Out-of-Domain Discourse Dependency Parsing via Bootstrapping: An Empirical Analysis on Its Effectiveness and Limitation	Discourse parsing has been studied for decades. However, it still remains challenging to utilize discourse parsing for real-world applications because the parsing accuracy degrades significantly on out-of-domain text. In this paper, we report and discuss the effectiveness and limitations of bootstrapping methods for adapting modern BERT-based discourse dependency parsers to out-of-domain text without relying on additional human supervision. Specifically, we investigate self-training, co-training, tri-training, and asymmetric tri-training of graph-based and transition-based discourse dependency parsing models, as well as confidence measures and sample selection criteria in two adaptation scenarios: monologue adaptation between scientific disciplines and dialogue genre adaptation. We also release COVID-19 Discourse Dependency Treebank (COVID19-DTB), a new manually annotated resource for discourse dependency parsing of biomedical paper abstracts. The experimental results show that bootstrapping is significantly and consistently effective for unsupervised domain adaptation of discourse dependency parsing, but the low coverage of accurately predicted pseudo labels is a bottleneck for further improvement. We show that active learning can mitigate this limitation.	https://aclanthology.org/2022.tacl-1.8	Noriki Nishida, Yuji Matsumoto
Break, Perturb, Build: Automatic Perturbation of Reasoning Paths Through Question Decomposition	"Recent efforts to create challenge benchmarks that test the abilities of natural language understanding models have largely depended on human annotations. In this work, we introduce the ""Break, Perturb, Build"" (BPB) framework for automatic reasoning-oriented perturbation of question-answer pairs. BPB represents a question by decomposing it into the reasoning steps that are required to answer it, symbolically perturbs the decomposition, and then generates new question-answer pairs. We demonstrate the effectiveness of BPB by creating evaluation sets for three reading comprehension (RC) benchmarks, generating thousands of high-quality examples without human intervention. We evaluate a range of RC models on our evaluation sets, which reveals large performance gaps on generated examples compared to the original data. Moreover, symbolic perturbations enable fine-grained analysis of the strengths and limitations of models. Last, augmenting the training data with examples generated by BPB helps close the performance gaps, without any drop on the original data distribution."	https://aclanthology.org/2022.tacl-1.7	Mor Geva, Tomer Wolfson, Jonathan Berant
Dealing with Disagreements: Looking Beyond the Majority Vote in Subjective Annotations	Majority voting and averaging are common approaches used to resolve annotator disagreements and derive single ground truth labels from multiple annotations. However, annotators may systematically disagree with one another, often reflecting their individual biases and values, especially in the case of subjective tasks such as detecting affect, aggression, and hate speech. Annotator disagreements may capture important nuances in such tasks that are often ignored while aggregating annotations to a single ground truth. In order to address this, we investigate the efficacy of multi-annotator models. In particular, our multi-task based approach treats predicting each annotators' judgements as separate subtasks, while sharing a common learned representation of the task. We show that this approach yields same or better performance than aggregating labels in the data prior to training across seven different binary classification tasks. Our approach also provides a way to estimate uncertainty in predictions, which we demonstrate better correlate with annotation disagreements than traditional methods. Being able to model uncertainty is especially useful in deployment scenarios where knowing when not to make a prediction is important.	https://aclanthology.org/2022.tacl-1.6	Aida Mostafazadeh Davani, Mark Díaz, Vinodkumar Prabhakaran
Canine: Pre-training an Efficient Tokenization-Free Encoder for Language Representation	Pipelined NLP systems have largely been superseded by end-to-end neural modeling, yet nearly all commonly used models still require an explicit tokenization step. While recent tokenization approaches based on data-derived subword lexicons are less brittle than manually engineered tokenizers, these techniques are not equally suited to all languages, and the use of any fixed vocabulary may limit a model's ability to adapt. In this paper, we present Canine, a neural encoder that operates directly on character sequences—without explicit tokenization or vocabulary—and a pre-training strategy that operates either directly on characters or optionally uses subwords as a soft inductive bias. To use its finer-grained input effectively and efficiently, Canine combines downsampling, which reduces the input sequence length, with a deep transformer stack, which encodes context. Canine outperforms a comparable mBert model by 5.7 F1 on TyDi QA, a challenging multilingual benchmark, despite having fewer model parameters.	https://aclanthology.org/2022.tacl-1.5	Jonathan H. Clark, Dan Garrette, Iulia Turc, John Wieting
Quality at a Glance: An Audit of Web-Crawled Multilingual Datasets	With the success of large-scale pre-training and multilingual modeling in Natural Language Processing (NLP), recent years have seen a proliferation of large, Web-mined text datasets covering hundreds of languages. We manually audit the quality of 205 language-specific corpora released with five major public datasets (CCAligned, ParaCrawl, WikiMatrix, OSCAR, mC4). Lower-resource corpora have systematic issues: At least 15 corpora have no usable text, and a significant fraction contains less than 50% sentences of acceptable quality. In addition, many are mislabeled or use nonstandard/ambiguous language codes. We demonstrate that these issues are easy to detect even for non-proficient speakers, and supplement the human audit with automatic analyses. Finally, we recommend techniques to evaluate and improve multilingual corpora and discuss potential risks that come with low-quality data releases.	https://aclanthology.org/2022.tacl-1.4	Julia Kreutzer, Isaac Caswell, Lisa Wang, Ahsan Wahab, Daan van Esch, Nasanbayar Ulzii-Orshikh, Allahsera Tapo, Nishant Subramani, Artem Sokolov, Claytone Sikasote, Monang Setyawan, Supheakmungkol Sarin, Sokhar Samb, Benoît Sagot, Clara Rivera, Annette Rios, Isabel Papadimitriou, Salomey Osei, Pedro Ortiz Suarez, Iroro Orife, Kelechi Ogueji, Andre Niyongabo Rubungo, Toan Q. Nguyen, Mathias Müller, André Müller, Shamsuddeen Hassan Muhammad, Nanda Muhammad, Ayanda Mnyakeni, Jamshidbek Mirzakhalov, Tapiwanashe Matangira, Colin Leong, Nze Lawson, Sneha Kudugunta, Yacine Jernite, Mathias Jenny, Orhan Firat, Bonaventure F. P. Dossou, Sakhile Dlamini, Nisansa de Silva, Sakine Çabuk Ballı, Stella Biderman, Alessia Battisti, Ahmed Baruwa, Ankur Bapna, Pallavi Baljekar, Israel Abebe Azime, Ayodele Awokoya, Duygu Ataman, Orevaoghene Ahia, Oghenefego Ahia, Sweta Agrawal, Mofetoluwa Adeyemi
FeTaQA: Free-form Table Question Answering	Existing table question answering datasets contain abundant factual questions that primarily evaluate a QA system's comprehension of query and tabular data. However, restricted by their short-form answers, these datasets fail to include question–answer interactions that represent more advanced and naturally occurring information needs: questions that ask for reasoning and integration of information pieces retrieved from a structured knowledge source. To complement the existing datasets and to reveal the challenging nature of the table-based question answering task, we introduce FeTaQA, a new dataset with 10K Wikipedia-based table, question, free-form answer, supporting table cells pairs. FeTaQA is collected from noteworthy descriptions of Wikipedia tables that contain information people tend to seek; generation of these descriptions requires advanced processing that humans perform on a daily basis: Understand the question and table, retrieve, integrate, infer, and conduct text planning and surface realization to generate an answer. We provide two benchmark methods for the proposed task: a pipeline method based on semantic parsing-based QA systems and an end-to-end method based on large pretrained text generation models, and show that FeTaQA poses a challenge for both methods.	https://aclanthology.org/2022.tacl-1.3	Linyong Nan, Chiachun Hsieh, Ziming Mao, Xi Victoria Lin, Neha Verma, Rui Zhang, Wojciech Kryściński, Hailey Schoelkopf, Riley Kong, Xiangru Tang, Mutethia Mutuma, Ben Rosand, Isabel Trindade, Renusree Bandaru, Jacob Cunningham, Caiming Xiong, Dragomir Radev, Dragomir Radev
Decomposing and Recomposing Event Structure	We present an event structure classification empirically derived from inferential properties annotated on sentence- and document-level Universal Decompositional Semantics (UDS) graphs. We induce this classification jointly with semantic role, entity, and event-event relation classifications using a document-level generative model structured by these graphs. To support this induction, we augment existing annotations found in the UDS1.0 dataset, which covers the entirety of the English Web Treebank, with an array of inferential properties capturing fine-grained aspects of the temporal and aspectual structure of events. The resulting dataset (available at decomp.io) is the largest annotation of event structure and (partial) event coreference to date.	https://aclanthology.org/2022.tacl-1.2	William Gantt, Lelia Glass, Aaron Steven White
Word Acquisition in Neural Language Models	We investigate how neural language models acquire individual words during training, extracting learning curves and ages of acquisition for over 600 words on the MacArthur-Bates Communicative Development Inventory (Fenson et al., 2007). Drawing on studies of word acquisition in children, we evaluate multiple predictors for words' ages of acquisition in LSTMs, BERT, and GPT-2. We find that the effects of concreteness, word length, and lexical class are pointedly different in children and language models, reinforcing the importance of interaction and sensorimotor experience in child language acquisition. Language models rely far more on word frequency than children, but, like children, they exhibit slower learning of words in longer utterances. Interestingly, models follow consistent patterns during training for both unidirectional and bidirectional models, and for both LSTM and Transformer architectures. Models predict based on unigram token frequencies early in training, before transitioning loosely to bigram probabilities, eventually converging on more nuanced predictions. These results shed light on the role of distributional learning mechanisms in children, while also providing insights for more human-like language acquisition in language models.	https://aclanthology.org/2022.tacl-1.1	Tyler A. Chang, Benjamin K. Bergen
Retrieve Fast, Rerank Smart: Cooperative and Joint Approaches for Improved Cross-Modal Retrieval	Current state-of-the-art approaches to cross- modal retrieval process text and visual input jointly, relying on Transformer-based architectures with cross-attention mechanisms that attend over all words and objects in an image. While offering unmatched retrieval performance, such models: 1) are typically pretrained from scratch and thus less scalable, 2) suffer from huge retrieval latency and inefficiency issues, which makes them impractical in realistic applications. To address these crucial gaps towards both improved and efficient cross- modal retrieval, we propose a novel fine-tuning framework that turns any pretrained text-image multi-modal model into an efficient retrieval model. The framework is based on a cooperative retrieve-and-rerank approach that combines: 1) twin networks (i.e., a bi-encoder) to separately encode all items of a corpus, enabling efficient initial retrieval, and 2) a cross-encoder component for a more nuanced (i.e., smarter) ranking of the retrieved small set of items. We also propose to jointly fine- tune the two components with shared weights, yielding a more parameter-efficient model. Our experiments on a series of standard cross-modal retrieval benchmarks in monolingual, multilingual, and zero-shot setups, demonstrate improved accuracy and huge efficiency benefits over the state-of-the-art cross- encoders.1	https://aclanthology.org/2022.tacl-1.29	Gregor Geigle, Jonas Pfeiffer, Nils Reimers, Ivan Vulić, Iryna Gurevych
A Neighborhood Framework for Resource-Lean Content Flagging	We propose a novel framework for cross- lingual content flagging with limited target- language data, which significantly outperforms prior work in terms of predictive performance. The framework is based on a nearest-neighbor architecture. It is a modern instantiation of the vanilla k-nearest neighbor model, as we use Transformer representations in all its components. Our framework can adapt to new source- language instances, without the need to be retrained from scratch. Unlike prior work on neighborhood-based approaches, we encode the neighborhood information based on query– neighbor interactions. We propose two encoding schemes and we show their effectiveness using both qualitative and quantitative analysis. Our evaluation results on eight languages from two different datasets for abusive language detection show sizable improvements of up to 9.5 F1 points absolute (for Italian) over strong baselines. On average, we achieve 3.6 absolute F1 points of improvement for the three languages in the Jigsaw Multilingual dataset and 2.14 points for the WUL dataset.	https://aclanthology.org/2022.tacl-1.28	Sheikh Muhammad Sarwar, Dimitrina Zlatkova, Momchil Hardalov, Yoan Dinkov, Isabelle Augenstein, Preslav Nakov
TopiOCQA: Open-domain Conversational Question Answering with Topic Switching	In a conversational question answering scenario, a questioner seeks to extract information about a topic through a series of interdependent questions and answers. As the conversation progresses, they may switch to related topics, a phenomenon commonly observed in information-seeking search sessions. However, current datasets for conversational question answering are limiting in two ways: 1) they do not contain topic switches; and 2) they assume the reference text for the conversation is given, that is, the setting is not open-domain. We introduce TopiOCQA (pronounced Tapioca), an open-domain conversational dataset with topic switches based on Wikipedia. TopiOCQA contains 3,920 conversations with information-seeking questions and free-form answers. On average, a conversation in our dataset spans 13 question-answer turns and involves four topics (documents). TopiOCQA poses a challenging test-bed for models, where efficient retrieval is required on multiple turns of the same conversation, in conjunction with constructing valid responses using conversational history. We evaluate several baselines, by combining state-of-the-art document retrieval methods with neural reader models. Our best model achieves F1 of 55.8, falling short of human performance by 14.2 points, indicating the difficulty of our dataset. Our dataset and code are available at https://mcgill-nlp.github.io/topiocqa.	https://aclanthology.org/2022.tacl-1.27	Vaibhav Adlakha, Shehzaad Dhuliawala, Kaheer Suleman, Harm de Vries, Siva Reddy
Czech Grammar Error Correction with a Large and Diverse Corpus	We introduce a large and diverse Czech corpus annotated for grammatical error correction (GEC) with the aim to contribute to the still scarce data resources in this domain for languages other than English. The Grammar Error Correction Corpus for Czech (GECCC) offers a variety of four domains, covering error distributions ranging from high error density essays written by non-native speakers, to website texts, where errors are expected to be much less common. We compare several Czech GEC systems, including several Transformer-based ones, setting a strong baseline to future research. Finally, we meta-evaluate common GEC metrics against human judgments on our data. We make the new Czech GEC corpus publicly available under the CC BY-SA 4.0 license at http://hdl.handle.net/11234/1-4639.	https://aclanthology.org/2022.tacl-1.26	Jakub Náplava, Milan Straka, Jana Straková, Alexandr Rosen
LOT: A Story-Centric Benchmark for Evaluating Chinese Long Text Understanding and Generation	Standard multi-task benchmarks are essential for developing pretraining models that can generalize to various downstream tasks. Existing benchmarks for natural language processing (NLP) usually focus only on understanding or generating short texts. However, long text modeling requires many distinct abilities in contrast to short texts, such as the modeling of long-range discourse and commonsense relations, and the coherence and controllability of generation. The lack of standardized benchmarks makes it difficult to assess these abilities of a model and fairly compare different models, especially Chinese models. Therefore, we propose a story-centric benchmark named LOT for evaluating Chinese long text modeling, which aggregates two understanding tasks and two generation tasks. We construct new datasets for these tasks based on human-written Chinese stories with hundreds of words. Furthermore, we release an encoder-decoder-based Chinese long text pretraining model named LongLM with up to 1 billion parameters. We pretrain LongLM on 120G Chinese novels with two generative tasks including text infilling and conditional continuation. Extensive experiments show that LongLM outperforms similar-sized pretraining models substantially on both the understanding and generation tasks in LOT.	https://aclanthology.org/2022.tacl-1.25	Jian Guan, Zhuoer Feng, Yamei Chen, Ruilin He, Xiaoxi Mao, Changjie Fan, Minlie Huang
PADA: Example-based Prompt Learning for on-the-fly Adaptation to Unseen Domains	Natural Language Processing algorithms have made incredible progress, but they still struggle when applied to out-of-distribution examples. We address a challenging and underexplored version of this domain adaptation problem, where an algorithm is trained on several source domains, and then applied to examples from unseen domains that are unknown at training time. Particularly, no examples, labeled or unlabeled, or any other knowledge about the target domain are available to the algorithm at training time. We present PADA: An example-based autoregressive Prompt learning algorithm for on-the-fly Any-Domain Adaptation, based on the T5 language model. Given a test example, PADA first generates a unique prompt for it and then, conditioned on this prompt, labels the example with respect to the NLP prediction task. PADA is trained to generate a prompt that is a token sequence of unrestricted length, consisting of Domain Related Features (DRFs) that characterize each of the source domains. Intuitively, the generated prompt is a unique signature that maps the test example to a semantic space spanned by the source domains. In experiments with 3 tasks (text classification and sequence tagging), for a total of 14 multi-source adaptation scenarios, PADA substantially outperforms strong baselines.1	https://aclanthology.org/2022.tacl-1.24	Eyal Ben-David, Nadav Oved, Roi Reichart
Data-driven Model Generalizability in Crosslinguistic Low-resource Morphological Segmentation	Common designs of model evaluation typically focus on monolingual settings, where different models are compared according to their performance on a single data set that is assumed to be representative of all possible data for the task at hand. While this may be reasonable for a large data set, this assumption is difficult to maintain in low-resource scenarios, where artifacts of the data collection can yield data sets that are outliers, potentially making conclusions about model performance coincidental. To address these concerns, we investigate model generalizability in crosslinguistic low-resource scenarios. Using morphological segmentation as the test case, we compare three broad classes of models with different parameterizations, taking data from 11 languages across 6 language families. In each experimental setting, we evaluate all models on a first data set, then examine their performance consistency when introducing new randomly sampled data sets with the same size and when applying the trained models to unseen test sets of varying sizes. The results demonstrate that the extent of model generalization depends on the characteristics of the data set, and does not necessarily rely heavily on the data set size. Among the characteristics that we studied, the ratio of morpheme overlap and that of the average number of morphemes per word between the training and test sets are the two most prominent factors. Our findings suggest that future work should adopt random sampling to construct data sets with different sizes in order to make more responsible claims about model evaluation.	https://aclanthology.org/2022.tacl-1.23	Zoey Liu, Emily Prud’hommeaux
End-to-end Argument Mining with Cross-corpora Multi-task Learning	Mining an argument structure from text is an important step for tasks such as argument search and summarization. While studies on argument(ation) mining have proposed promising neural network models, they usually suffer from a shortage of training data. To address this issue, we expand the training data with various auxiliary argument mining corpora and propose an end-to-end cross-corpus training method called Multi-Task Argument Mining (MT-AM). To evaluate our approach, we conducted experiments for the main argument mining tasks on several well-established argument mining corpora. The results demonstrate that MT-AM generally outperformed the models trained on a single corpus. Also, the smaller the target corpus was, the better the MT-AM performed. Our extensive analyses suggest that the improvement of MT-AM depends on several factors of transferability among auxiliary and target corpora.	https://aclanthology.org/2022.tacl-1.37	Gaku Morio, Hiroaki Ozaki, Terufumi Morishita, Kohsuke Yanai
Document Summarization with Latent Queries	The availability of large-scale datasets has driven the development of neural models that create generic summaries for single or multiple documents. For query-focused summarization (QFS), labeled training data in the form of queries, documents, and summaries is not readily available. We provide a unified modeling framework for any kind of summarization, under the assumption that all summaries are a response to a query, which is observed in the case of QFS and latent in the case of generic summarization. We model queries as discrete latent variables over document tokens, and learn representations compatible with observed and unobserved query verbalizations. Our framework formulates summarization as a generative process, and jointly optimizes a latent query model and a conditional language model. Despite learning from generic summarization data only, our approach outperforms strong comparison systems across benchmarks, query types, document settings, and target domains.1	https://aclanthology.org/2022.tacl-1.36	Yumo Xu, Mirella Lapata
