title	abstract	url	authors
Ultra-fine Entity Typing with Indirect Supervision from Natural Language Inference	The task of ultra-fine entity typing (UFET) seeks to predict diverse and free-form words or phrases that describe the appropriate types of entities mentioned in sentences. A key challenge for this task lies in the large number of types and the scarcity of annotated data per type. Existing systems formulate the task as a multi-way classification problem and train directly or distantly supervised classifiers. This causes two issues: (i) the classifiers do not capture the type semantics because types are often converted into indices; (ii) systems developed in this way are limited to predicting within a pre-defined type set, and often fall short of generalizing to types that are rarely seen or unseen in training. This work presents LITE🍻, a new approach that formulates entity typing as a natural language inference (NLI) problem, making use of (i) the indirect supervision from NLI to infer type information meaningfully represented as textual hypotheses and alleviate the data scarcity issue, as well as (ii) a learning-to-rank objective to avoid the pre-defining of a type set. Experiments show that, with limited training data, LITE obtains state-of-the-art performance on the UFET task. In addition, LITE demonstrates its strong generalizability by not only yielding best results on other fine-grained entity typing benchmarks, more importantly, a pre-trained LITE system works well on new data containing unseen types.1	https://aclanthology.org/2022.tacl-1.35	Bangzheng Li, Wenpeng Yin, Muhao Chen
It’s not Rocket Science: Interpreting Figurative Language in Narratives	Figurative language is ubiquitous in English. Yet, the vast majority of NLP research focuses on literal language. Existing text representations by design rely on compositionality, while figurative language is often non- compositional. In this paper, we study the interpretation of two non-compositional figurative languages (idioms and similes). We collected datasets of fictional narratives containing a figurative expression along with crowd-sourced plausible and implausible continuations relying on the correct interpretation of the expression. We then trained models to choose or generate the plausible continuation. Our experiments show that models based solely on pre-trained language models perform substantially worse than humans on these tasks. We additionally propose knowledge-enhanced models, adopting human strategies for interpreting figurative language types: inferring meaning from the context and relying on the constituent words' literal meanings. The knowledge-enhanced models improve the performance on both the discriminative and generative tasks, further bridging the gap from human performance.	https://aclanthology.org/2022.tacl-1.34	Tuhin Chakrabarty, Yejin Choi, Vered Shwartz
Sentence Similarity Based on Contexts	Existing methods to measure sentence similarity are faced with two challenges: (1) labeled datasets are usually limited in size, making them insufficient to train supervised neural models; and (2) there is a training-test gap for unsupervised language modeling (LM) based models to compute semantic scores between sentences, since sentence-level semantics are not explicitly modeled at training. This results in inferior performances in this task. In this work, we propose a new framework to address these two issues. The proposed framework is based on the core idea that the meaning of a sentence should be defined by its contexts, and that sentence similarity can be measured by comparing the probabilities of generating two sentences given the same context. The proposed framework is able to generate high-quality, large-scale dataset with semantic similarity scores between two sentences in an unsupervised manner, with which the train-test gap can be largely bridged. Extensive experiments show that the proposed framework achieves significant performance boosts over existing baselines under both the supervised and unsupervised settings across different datasets.	https://aclanthology.org/2022.tacl-1.33	Xiaofei Sun, Yuxian Meng, Xiang Ao, Fei Wu, Tianwei Zhang, Jiwei Li, Chun Fan
Relational Memory-Augmented Language Models	We present a memory-augmented approach to condition an autoregressive language model on a knowledge graph. We represent the graph as a collection of relation triples and retrieve relevant relations for a given context to improve text generation. Experiments on WikiText-103, WMT19, and enwik8 English datasets demonstrate that our approach produces a better language model in terms of perplexity and bits per character. We also show that relational memory improves coherence, is complementary to token-based memory, and enables causal interventions. Our model provides a simple yet effective way to combine an autoregressive language model and a knowledge graph for more coherent and logical generation.	https://aclanthology.org/2022.tacl-1.32	Qi Liu, Dani Yogatama, Phil Blunsom
♫ MuSiQue: Multihop Questions via Single-hop Question Composition	Multihop reasoning remains an elusive goal as existing multihop benchmarks are known to be largely solvable via shortcuts. Can we create a question answering (QA) dataset that, by construction, requires proper multihop reasoning? To this end, we introduce a bottom–up approach that systematically selects composable pairs of single-hop questions that are connected, that is, where one reasoning step critically relies on information from another. This bottom–up methodology lets us explore a vast space of questions and add stringent filters as well as other mechanisms targeting connected reasoning. It provides fine-grained control over the construction process and the properties of the resulting k-hop questions. We use this methodology to create MuSiQue-Ans, a new multihop QA dataset with 25K 2–4 hop questions. Relative to existing datasets, MuSiQue-Ans is more difficult overall (3× increase in human–machine gap), and harder to cheat via disconnected reasoning (e.g., a single-hop model has a 30-point drop in F1). We further add unanswerable contrast questions to produce a more stringent dataset, MuSiQue-Full. We hope our datasets will help the NLP community develop models that perform genuine multihop reasoning.1	https://aclanthology.org/2022.tacl-1.31	Harsh Trivedi, Niranjan Balasubramanian, Tushar Khot, Ashish Sabharwal
The Flores-101 Evaluation Benchmark for Low-Resource and Multilingual Machine Translation	One of the biggest challenges hindering progress in low-resource and multilingual machine translation is the lack of good evaluation benchmarks. Current evaluation benchmarks either lack good coverage of low-resource languages, consider only restricted domains, or are low quality because they are constructed using semi-automatic procedures. In this work, we introduce the Flores-101 evaluation benchmark, consisting of 3001 sentences extracted from English Wikipedia and covering a variety of different topics and domains. These sentences have been translated in 101 languages by professional translators through a carefully controlled process. The resulting dataset enables better assessment of model quality on the long tail of low-resource languages, including the evaluation of many-to-many multilingual translation systems, as all translations are fully aligned. By publicly releasing such a high-quality and high-coverage dataset, we hope to foster progress in the machine translation community and beyond.	https://aclanthology.org/2022.tacl-1.30	Naman Goyal, Cynthia Gao, Vishrav Chaudhary, Peng-Jen Chen, Guillaume Wenzek, Da Ju, Sanjana Krishnan, Marc’Aurelio Ranzato, Francisco Guzmán, Angela Fan
VILA: Improving Structured Content Extraction from Scientific PDFs Using Visual Layout Groups	Accurately extracting structured content from PDFs is a critical first step for NLP over scientific papers. Recent work has improved extraction accuracy by incorporating elementary layout information, for example, each token's 2D position on the page, into language model pretraining. We introduce new methods that explicitly model VIsual LAyout (VILA) groups, that is, text lines or text blocks, to further improve performance. In our I-VILA approach, we show that simply inserting special tokens denoting layout group boundaries into model inputs can lead to a 1.9% Macro F1 improvement in token classification. In the H-VILA approach, we show that hierarchical encoding of layout-groups can result in up to 47% inference time reduction with less than 0.8% Macro F1 loss. Unlike prior layout-aware approaches, our methods do not require expensive additional pretraining, only fine-tuning, which we show can reduce training cost by up to 95%. Experiments are conducted on a newly curated evaluation suite, S2-VLUE, that unifies existing automatically labeled datasets and includes a new dataset of manual annotations covering diverse papers from 19 scientific disciplines. Pre-trained weights, benchmark datasets, and source code are available at https://github.com/allenai/VILA.	https://aclanthology.org/2022.tacl-1.22	Zejiang Shen, Kyle Lo, Lucy Lu Wang, Bailey Kuehl, Daniel S. Weld, Doug Downey
Evaluating Explanations: How Much Do Explanations from the Teacher Aid Students?	While many methods purport to explain predictions by highlighting salient features, what aims these explanations serve and how they ought to be evaluated often go unstated. In this work, we introduce a framework to quantify the value of explanations via the accuracy gains that they confer on a student model trained to simulate a teacher model. Crucially, the explanations are available to the student during training, but are not available at test time. Compared with prior proposals, our approach is less easily gamed, enabling principled, automatic, model-agnostic evaluation of attributions. Using our framework, we compare numerous attribution methods for text classification and question answering, and observe quantitative differences that are consistent (to a moderate to high degree) across different student model architectures and learning strategies.1	https://aclanthology.org/2022.tacl-1.21	Danish Pruthi, Rachit Bansal, Bhuwan Dhingra, Livio Baldini Soares, Michael Collins, Zachary C. Lipton, Graham Neubig, William W. Cohen
A Multi-Level Optimization Framework for End-to-End Text Augmentation	Text augmentation is an effective technique in alleviating overfitting in NLP tasks. In existing methods, text augmentation and downstream tasks are mostly performed separately. As a result, the augmented texts may not be optimal to train the downstream model. To address this problem, we propose a three-level optimization framework to perform text augmentation and the downstream task end-to- end. The augmentation model is trained in a way tailored to the downstream task. Our framework consists of three learning stages. A text summarization model is trained to perform data augmentation at the first stage. Each summarization example is associated with a weight to account for its domain difference with the text classification data. At the second stage, we use the model trained at the first stage to perform text augmentation and train a text classification model on the augmented texts. At the third stage, we evaluate the text classification model trained at the second stage and update weights of summarization examples by minimizing the validation loss. These three stages are performed end-to-end. We evaluate our method on several text classification datasets where the results demonstrate the effectiveness of our method. Code is available at https://github.com/Sai-Ashish/End-to-End-Text-Augmentation.	https://aclanthology.org/2022.tacl-1.20	Sai Ashish Somayajula, Linfeng Song, Pengtao Xie
Towards General Natural Language Understanding with Probabilistic Worldbuilding	We introduce the Probabilistic Worldbuilding Model (PWM), a new fully symbolic Bayesian model of semantic parsing and reasoning, as a first step in a research program toward more domain- and task-general NLU and AI. Humans create internal mental models of their observations that greatly aid in their ability to understand and reason about a large variety of problems. In PWM, the meanings of sentences, acquired facts about the world, and intermediate steps in reasoning are all expressed in a human-readable formal language, with the design goal of interpretability. PWM is Bayesian, designed specifically to be able to generalize to new domains and new tasks. We derive and implement an inference algorithm that reads sentences by parsing and abducing updates to its latent world model that capture the semantics of those sentences, and evaluate it on two out-of-domain question-answering datasets: (1) ProofWriter and (2) a new dataset we call FictionalGeoQA, designed to be more representative of real language but still simple enough to focus on evaluating reasoning ability, while being robust against heuristics. Our method outperforms baselines on both, thereby demonstrating its value as a proof-of-concept.	https://aclanthology.org/2022.tacl-1.19	Abulhair Saparov, Tom M. Mitchell
Designing an Automatic Agent for Repeated Language–based Persuasion Games	Persuasion games are fundamental in economics and AI research and serve as the basis for important applications. However, work on this setup assumes communication with stylized messages that do not consist of rich human language. In this paper we consider a repeated sender (expert) – receiver (decision maker) game, where the sender is fully informed about the state of the world and aims to persuade the receiver to accept a deal by sending one of several possible natural language reviews. We design an automatic expert that plays this repeated game, aiming to achieve the maximal payoff. Our expert is implemented within the Monte Carlo Tree Search (MCTS) algorithm, with deep learning models that exploit behavioral and linguistic signals in order to predict the next action of the decision maker, and the future payoff of the expert given the state of the game and a candidate review. We demonstrate the superiority of our expert over strong baselines and its adaptability to different decision makers and potential proposed deals.1	https://aclanthology.org/2022.tacl-1.18	Maya Raifer, Guy Rotman, Reut Apel, Moshe Tennenholtz, Roi Reichart
ByT5: Towards a Token-Free Future with Pre-trained Byte-to-Byte Models	Most widely used pre-trained language models operate on sequences of tokens corresponding to word or subword units. By comparison, token-free models that operate directly on raw text (bytes or characters) have many benefits: They can process text in any language out of the box, they are more robust to noise, and they minimize technical debt by removing complex and error-prone text preprocessing pipelines. Because byte or character sequences are longer than token sequences, past work on token-free models has often introduced new model architectures designed to amortize the cost of operating directly on raw text. In this paper, we show that a standard Transformer architecture can be used with minimal modifications to process byte sequences. We characterize the trade-offs in terms of parameter count, training FLOPs, and inference speed, and show that byte-level models are competitive with their token-level counterparts. We also demonstrate that byte-level models are significantly more robust to noise and perform better on tasks that are sensitive to spelling and pronunciation. As part of our contribution, we release a new set of pre-trained byte-level Transformer models based on the T5 architecture, as well as all code and data used in our experiments.1	https://aclanthology.org/2022.tacl-1.17	Linting Xue, Aditya Barua, Noah Constant, Rami Al-Rfou, Sharan Narang, Mihir Kale, Adam Roberts, Colin Raffel
Multilingual Autoregressive Entity Linking	We present mGENRE, a sequence-to- sequence system for the Multilingual Entity Linking (MEL) problem—the task of resolving language-specific mentions to a multilingual Knowledge Base (KB). For a mention in a given language, mGENRE predicts the name of the target entity left-to-right, token-by-token in an autoregressive fashion. The autoregressive formulation allows us to effectively cross-encode mention string and entity names to capture more interactions than the standard dot product between mention and entity vectors. It also enables fast search within a large KB even for mentions that do not appear in mention tables and with no need for large-scale vector indices. While prior MEL works use a single representation for each entity, we match against entity names of as many languages as possible, which allows exploiting language connections between source input and target name. Moreover, in a zero-shot setting on languages with no training data at all, mGENRE treats the target language as a latent variable that is marginalized at prediction time. This leads to over 50% improvements in average accuracy. We show the efficacy of our approach through extensive evaluation including experiments on three popular MEL benchmarks where we establish new state-of-the-art results. Source code available at https://github.com/facebookresearch/GENRE.	https://aclanthology.org/2022.tacl-1.16	Nicola De Cao, Ledell Wu, Kashyap Popat, Mikel Artetxe, Naman Goyal, Mikhail Plekhanov, Luke Zettlemoyer, Nicola Cancedda, Sebastian Riedel, Fabio Petroni
Time-Aware Language Models as Temporal Knowledge Bases	"Many facts come with an expiration date, from the name of the President to the basketball team Lebron James plays for. However, most language models (LMs) are trained on snapshots of data collected at a specific moment in time. This can limit their utility, especially in the closed-book setting where the pretraining corpus must contain the facts the model should memorize. We introduce a diagnostic dataset aimed at probing LMs for factual knowledge that changes over time and highlight problems with LMs at either end of the spectrum—those trained on specific slices of temporal data, as well as those trained on a wide range of temporal data. To mitigate these problems, we propose a simple technique for jointly modeling text with its timestamp. This improves memorization of seen facts from the training time period, as well as calibration on predictions about unseen facts from future time periods. We also show that models trained with temporal context can be efficiently ""refreshed"" as new data arrives, without the need for retraining from scratch."	https://aclanthology.org/2022.tacl-1.15	Bhuwan Dhingra, Jeremy R. Cole, Julian Martin Eisenschlos, Daniel Gillick, Jacob Eisenstein, William W. Cohen
Neuro-symbolic Natural Logic with Introspective Revision for Natural Language Inference	We introduce a neuro-symbolic natural logic framework based on reinforcement learning with introspective revision. The model samples and rewards specific reasoning paths through policy gradient, in which the introspective revision algorithm modifies intermediate symbolic reasoning steps to discover reward-earning operations as well as leverages external knowledge to alleviate spurious reasoning and training inefficiency. The framework is supported by properly designed local relation models to avoid input entangling, which helps ensure the interpretability of the proof paths. The proposed model has built-in interpretability and shows superior capability in monotonicity inference, systematic generalization, and interpretability, compared with previous models on the existing datasets.	https://aclanthology.org/2022.tacl-1.14	Yufei Feng, Xiaoyu Yang, Xiaodan Zhu, Michael Greenspan
ABNIRML: Analyzing the Behavior of Neural IR Models	Pretrained contextualized language models such as BERT and T5 have established a new state-of-the-art for ad-hoc search. However, it is not yet well understood why these methods are so effective, what makes some variants more effective than others, and what pitfalls they may have. We present a new comprehensive framework for Analyzing the Behavior of Neural IR ModeLs (ABNIRML), which includes new types of diagnostic probes that allow us to test several characteristics—such as writing styles, factuality, sensitivity to paraphrasing and word order—that are not addressed by previous techniques. To demonstrate the value of the framework, we conduct an extensive empirical study that yields insights into the factors that contribute to the neural model's gains, and identify potential unintended biases the models exhibit. Some of our results confirm conventional wisdom, for example, that recent neural ranking models rely less on exact term overlap with the query, and instead leverage richer linguistic information, evidenced by their higher sensitivity to word and sentence order. Other results are more surprising, such as that some models (e.g., T5 and ColBERT) are biased towards factually correct (rather than simply relevant) texts. Further, some characteristics vary even for the same base language model, and other characteristics can appear due to random variations during model training.1	https://aclanthology.org/2022.tacl-1.13	Sean MacAvaney, Sergey Feldman, Nazli Goharian, Doug Downey, Arman Cohan
Predicting Document Coverage for Relation Extraction	This paper presents a new task of predicting the coverage of a text document for relation extraction (RE): Does the document contain many relational tuples for a given entity? Coverage predictions are useful in selecting the best documents for knowledge base construction with large input corpora. To study this problem, we present a dataset of 31,366 diverse documents for 520 entities. We analyze the correlation of document coverage with features like length, entity mention frequency, Alexa rank, language complexity, and information retrieval scores. Each of these features has only moderate predictive power. We employ methods combining features with statistical models like TF-IDF and language models like BERT. The model combining features and BERT, HERB, achieves an F1 score of up to 46%. We demonstrate the utility of coverage predictions on two use cases: KB construction and claim refutation.	https://aclanthology.org/2022.tacl-1.12	Sneha Singhania, Simon Razniewski, Gerhard Weikum
A Survey on Automated Fact-Checking	Fact-checking has become increasingly important due to the speed with which both information and misinformation can spread in the modern media ecosystem. Therefore, researchers have been exploring how fact-checking can be automated, using techniques based on natural language processing, machine learning, knowledge representation, and databases to automatically predict the veracity of claims. In this paper, we survey automated fact-checking stemming from natural language processing, and discuss its connections to related tasks and disciplines. In this process, we present an overview of existing datasets and models, aiming to unify the various definitions given and identify common concepts. Finally, we highlight challenges for future research.	https://aclanthology.org/2022.tacl-1.11	Zhijiang Guo, Michael Schlichtkrull, Andreas Vlachos
SummaC: Re-Visiting NLI-based Models for Inconsistency Detection in Summarization	In the summarization domain, a key requirement for summaries is to be factually consistent with the input document. Previous work has found that natural language inference (NLI) models do not perform competitively when applied to inconsistency detection. In this work, we revisit the use of NLI for inconsistency detection, finding that past work suffered from a mismatch in input granularity between NLI datasets (sentence-level), and inconsistency detection (document level). We provide a highly effective and light-weight method called SummaCConv that enables NLI models to be successfully used for this task by segmenting documents into sentence units and aggregating scores between pairs of sentences. We furthermore introduce a new benchmark called SummaC (Summary Consistency) which consists of six large inconsistency detection datasets. On this dataset, SummaCConv obtains state-of-the-art results with a balanced accuracy of 74.4%, a 5% improvement compared with prior work.	https://aclanthology.org/2022.tacl-1.10	Philippe Laban, Tobias Schnabel, Paul N. Bennett, Marti A. Hearst
