title	abstract	url	authors
Towards Question-Answering as an Automatic Metric for Evaluating the Content Quality of a Summary	Abstract A desirable property of a reference-based evaluation metric that measures the content quality of a summary is that it should estimate how much information that summary has in common with a reference. Traditional text overlap based metrics such as ROUGE fail to achieve this because they are limited to matching tokens, either lexically or via embeddings. In this work, we propose a metric to evaluate the content quality of a summary using question-answering (QA). QA-based methods directly measure a summary's information overlap with a reference, making them fundamentally different than text overlap metrics. We demonstrate the experimental benefits of QA-based metrics through an analysis of our proposed metric, QAEval. QAEval outperforms current state-of-the-art metrics on most evaluations using benchmark datasets, while being competitive on others due to limitations of state-of-the-art models. Through a careful analysis of each component of QAEval, we identify its performance bottlenecks and estimate that its potential upper-bound performance surpasses all other automatic metrics, approaching that of the gold-standard Pyramid Method.1	https://aclanthology.org/2021.tacl-1.47	Daniel Deutsch, Tania Bedrax-Weiss, Dan Roth
Joint Universal Syntactic and Semantic Parsing	While numerous attempts have been made to jointly parse syntax and semantics, high performance in one domain typically comes at the price of performance in the other. This trade-off contradicts the large body of research focusing on the rich interactions at the syntax–semantics interface. We explore multiple model architectures that allow us to exploit the rich syntactic and semantic annotations contained in the Universal Decompositional Semantics (UDS) dataset, jointly parsing Universal Dependencies and UDS to obtain state-of-the-art results in both formalisms. We analyze the behavior of a joint model of syntax and semantics, finding patterns supported by linguistic theory at the syntax–semantics interface. We then investigate to what degree joint modeling generalizes to a multilingual setting, where we find similar trends across 8 languages.	https://aclanthology.org/2021.tacl-1.46	Elias Stengel-Eskin, Kenton Murray, Sheng Zhang, Aaron Steven White, Benjamin Van Durme
Revisiting Negation in Neural Machine Translation	In this paper, we evaluate the translation of negation both automatically and manually, in English–German (EN–DE) and English– Chinese (EN–ZH). We show that the ability of neural machine translation (NMT) models to translate negation has improved with deeper and more advanced networks, although the performance varies between language pairs and translation directions. The accuracy of manual evaluation in EN→DE, DE→EN, EN→ZH, and ZH→EN is 95.7%, 94.8%, 93.4%, and 91.7%, respectively. In addition, we show that under-translation is the most significant error type in NMT, which contrasts with the more diverse error profile previously observed for statistical machine translation. To better understand the root of the under-translation of negation, we study the model's information flow and training data. While our information flow analysis does not reveal any deficiencies that could be used to detect or fix the under-translation of negation, we find that negation is often rephrased during training, which could make it more difficult for the model to learn a reliable link between source and target negation. We finally conduct intrinsic analysis and extrinsic probing tasks on negation, showing that NMT models can distinguish negation and non-negation tokens very well and encode a lot of information about negation in hidden states but nevertheless leave room for improvement.	https://aclanthology.org/2021.tacl-1.45	Gongbo Tang, Philipp Rönchen, Rico Sennrich, Joakim Nivre
Classifying Argumentative Relations Using Logical Mechanisms and Argumentation Schemes	While argument mining has achieved significant success in classifying argumentative relations between statements (support, attack, and neutral), we have a limited computational understanding of logical mechanisms that constitute those relations. Most recent studies rely on black-box models, which are not as linguistically insightful as desired. On the other hand, earlier studies use rather simple lexical features, missing logical relations between statements. To overcome these limitations, our work classifies argumentative relations based on four logical and theory-informed mechanisms between two statements, namely, (i) factual consistency, (ii) sentiment coherence, (iii) causal relation, and (iv) normative relation. We demonstrate that our operationalization of these logical mechanisms classifies argumentative relations without directly training on data labeled with the relations, significantly better than several unsupervised baselines. We further demonstrate that these mechanisms also improve supervised classifiers through representation learning.	https://aclanthology.org/2021.tacl-1.44	Yohan Jo, Seojin Bang, Chris Reed, Eduard Hovy
Strong Equivalence of TAG and CCG	Tree-adjoining grammar (TAG) and combinatory categorial grammar (CCG) are two well-established mildly context-sensitive grammar formalisms that are known to have the same expressive power on strings (i.e., generate the same class of string languages). It is demonstrated that their expressive power on trees also essentially coincides. In fact, CCG without lexicon entries for the empty string and only first-order rules of degree at most 2 are sufficient for its full expressive power.	https://aclanthology.org/2021.tacl-1.43	Lena Katharina Schiffer, Andreas Maletti
Revisiting Few-shot Relation Classification: Evaluation Data and Classification Schemes	We explore few-shot learning (FSL) for relation classification (RC). Focusing on the realistic scenario of FSL, in which a test instance might not belong to any of the target categories (none-of-the-above, [NOTA]), we first revisit the recent popular dataset structure for FSL, pointing out its unrealistic data distribution. To remedy this, we propose a novel methodology for deriving more realistic few-shot test data from available datasets for supervised RC, and apply it to the TACRED dataset. This yields a new challenging benchmark for FSL-RC, on which state of the art models show poor performance. Next, we analyze classification schemes within the popular embedding-based nearest-neighbor approach for FSL, with respect to constraints they impose on the embedding space. Triggered by this analysis, we propose a novel classification scheme in which the NOTA category is represented as learned vectors, shown empirically to be an appealing option for FSL.	https://aclanthology.org/2021.tacl-1.42	Ofer Sabo, Yanai Elazar, Yoav Goldberg, Ido Dagan
Efficient Computation of Expectations under Spanning Tree Distributions	Abstract We give a general framework for inference in spanning tree models. We propose unified algorithms for the important cases of first-order expectations and second-order expectations in edge-factored, non-projective spanning-tree models. Our algorithms exploit a fundamental connection between gradients and expectations, which allows us to derive efficient algorithms. These algorithms are easy to implement with or without automatic differentiation software. We motivate the development of our framework with several cautionary tales of previous research, which has developed numerous inefficient algorithms for computing expectations and their gradients. We demonstrate how our framework efficiently computes several quantities with known algorithms, including the expected attachment score, entropy, and generalized expectation criteria. As a bonus, we give algorithms for quantities that are missing in the literature, including the KL divergence. In all cases, our approach matches the efficiency of existing algorithms and, in several cases, reduces the runtime complexity by a factor of the sentence length. We validate the implementation of our framework through runtime experiments. We find our algorithms are up to 15 and 9 times faster than previous algorithms for computing the Shannon entropy and the gradient of the generalized expectation objective, respectively.	https://aclanthology.org/2021.tacl-1.41	Ran Zmigrod, Tim Vieira, Ryan Cotterell
Pretraining the Noisy Channel Model for Task-Oriented Dialogue	Abstract Direct decoding for task-oriented dialogue is known to suffer from the explaining-away effect, manifested in models that prefer short and generic responses. Here we argue for the use of Bayes' theorem to factorize the dialogue task into two models, the distribution of the context given the response, and the prior for the response itself. This approach, an instantiation of the noisy channel model, both mitigates the explaining-away effect and allows the principled incorporation of large pretrained models for the response prior. We present extensive experiments showing that a noisy channel model decodes better responses compared to direct decoding and that a two-stage pretraining strategy, employing both open-domain and task-oriented dialogue data, improves over randomly initialized models.	https://aclanthology.org/2021.tacl-1.40	Qi Liu, Lei Yu, Laura Rimell, Phil Blunsom
Self-supervised Regularization for Text Classification	Abstract Text classification is a widely studied problem and has broad applications. In many real-world problems, the number of texts for training classification models is limited, which renders these models prone to overfitting. To address this problem, we propose SSL-Reg, a data-dependent regularization approach based on self-supervised learning (SSL). SSL (Devlin et al., 2019a) is an unsupervised learning approach that defines auxiliary tasks on input data without using any human-provided labels and learns data representations by solving these auxiliary tasks. In SSL-Reg, a supervised classification task and an unsupervised SSL task are performed simultaneously. The SSL task is unsupervised, which is defined purely on input texts without using any human- provided labels. Training a model using an SSL task can prevent the model from being overfitted to a limited number of class labels in the classification task. Experiments on 17 text classification datasets demonstrate the effectiveness of our proposed method. Code is available at https://github.com/UCSD-AI4H/SSReg.	https://aclanthology.org/2021.tacl-1.39	Meng Zhou, Zechen Li, Pengtao Xie
Evaluating Document Coherence Modeling	Abstract While pretrained language models (LMs) have driven impressive gains over morpho-syntactic and semantic tasks, their ability to model discourse and pragmatic phenomena is less clear. As a step towards a better understanding of their discourse modeling capabilities, we propose a sentence intrusion detection task. We examine the performance of a broad range of pretrained LMs on this detection task for English. Lacking a dataset for the task, we introduce INSteD, a novel intruder sentence detection dataset, containing 170,000+ documents constructed from English Wikipedia and CNN news articles. Our experiments show that pretrained LMs perform impressively in in-domain evaluation, but experience a substantial drop in the cross-domain setting, indicating limited generalization capacity. Further results over a novel linguistic probe dataset show that there is substantial room for improvement, especially in the cross- domain setting.	https://aclanthology.org/2021.tacl-1.38	Aili Shen, Meladel Mistica, Bahar Salehi, Hang Li, Timothy Baldwin, Jianzhong Qi
There Once Was a Really Bad Poet, It Was Automated but You Didn’t Know It	Abstract Limerick generation exemplifies some of the most difficult challenges faced in poetry generation, as the poems must tell a story in only five lines, with constraints on rhyme, stress, and meter. To address these challenges, we introduce LimGen, a novel and fully automated system for limerick generation that outperforms state-of-the-art neural network-based poetry models, as well as prior rule-based poetry models. LimGen consists of three important pieces: the Adaptive Multi-Templated Constraint algorithm that constrains our search to the space of realistic poems, the Multi-Templated Beam Search algorithm which searches efficiently through the space, and the probabilistic Storyline algorithm that provides coherent storylines related to a user-provided prompt word. The resulting limericks satisfy poetic constraints and have thematically coherent storylines, which are sometimes even funny (when we are lucky).	https://aclanthology.org/2021.tacl-1.37	Jianyou Wang, Xiaoxuan Zhang, Yuren Zhou, Christopher Suh, Cynthia Rudin
Context-aware Adversarial Training for Name Regularity Bias in Named Entity Recognition	Abstract In this work, we examine the ability of NER models to use contextual information when predicting the type of an ambiguous entity. We introduce NRB, a new testbed carefully designed to diagnose Name Regularity Bias of NER models. Our results indicate that all state-of-the-art models we tested show such a bias; BERT fine-tuned models significantly outperforming feature-based (LSTM-CRF) ones on NRB, despite having comparable (sometimes lower) performance on standard benchmarks. To mitigate this bias, we propose a novel model-agnostic training method that adds learnable adversarial noise to some entity mentions, thus enforcing models to focus more strongly on the contextual signal, leading to significant gains on NRB. Combining it with two other training strategies, data augmentation and parameter freezing, leads to further gains.	https://aclanthology.org/2021.tacl-1.36	Abbas Ghaddar, Philippe Langlais, Ahmad Rashid, Mehdi Rezagholizadeh
Decoupling the Role of Data, Attention, and Losses in Multimodal Transformers	Abstract Recently, multimodal transformer models have gained popularity because their performance on downstream tasks suggests they learn rich visual-linguistic representations. Focusing on zero-shot image retrieval tasks, we study three important factors that can impact the quality of learned representations: pretraining data, the attention mechanism, and loss functions. By pretraining models on six datasets, we observe that dataset noise and language similarity to our downstream task are important indicators of model performance. Through architectural analysis, we learn that models with a multimodal attention mechanism can outperform deeper models with modality-specific attention mechanisms. Finally, we show that successful contrastive losses used in the self-supervised learning literature do not yield similar performance gains when used in multimodal transformers.	https://aclanthology.org/2021.tacl-1.35	Lisa Anne Hendricks, John Mellor, Rosalia Schneider, Jean-Baptiste Alayrac, Aida Nematzadeh
Dialogue State Tracking with Incremental Reasoning	Abstract Tracking dialogue states to better interpret user goals and feed downstream policy learning is a bottleneck in dialogue management. Common practice has been to treat it as a problem of classifying dialogue content into a set of pre-defined slot-value pairs, or generating values for different slots given the dialogue history. Both have limitations on considering dependencies that occur on dialogues, and are lacking of reasoning capabilities. This paper proposes to track dialogue states gradually with reasoning over dialogue turns with the help of the back-end data. Empirical results demonstrate that our method outperforms the state-of-the-art methods in terms of joint belief accuracy for MultiWOZ 2.1, a large-scale human–human dialogue dataset across multiple domains.	https://aclanthology.org/2021.tacl-1.34	Lizi Liao, Le Hong Long, Yunshan Ma, Wenqiang Lei, Tat-Seng Chua
Characterizing English Variation across Social Media Communities with BERT	Abstract Much previous work characterizing language variation across Internet social groups has focused on the types of words used by these groups. We extend this type of study by employing BERT to characterize variation in the senses of words as well, analyzing two months of English comments in 474 Reddit communities. The specificity of different sense clusters to a community, combined with the specificity of a community's unique word types, is used to identify cases where a social group's language deviates from the norm. We validate our metrics using user-created glossaries and draw on sociolinguistic theories to connect language variation with trends in community behavior. We find that communities with highly distinctive language are medium-sized, and their loyal and highly engaged users interact in dense networks.	https://aclanthology.org/2021.tacl-1.33	Li Lucy, David Bamman
Optimizing over subsequences generates context-sensitive languages	Abstract Phonological generalizations are finite-state. While Optimality Theory is a popular framework for modeling phonology, it is known to generate non-finite-state mappings and languages. This paper demonstrates that Optimality Theory is capable of generating non-context-free languages, contributing to the characterization of its generative capacity. This is achieved with minimal modification to the theory as it is standardly employed.	https://aclanthology.org/2021.tacl-1.32	Andrew Lamont
Data-to-text Generation with Macro Planning	Abstract Recent approaches to data-to-text generation have adopted the very successful encoder-decoder architecture or variants thereof. These models generate text that is fluent (but often imprecise) and perform quite poorly at selecting appropriate content and ordering it coherently. To overcome some of these issues, we propose a neural model with a macro planning stage followed by a generation stage reminiscent of traditional methods which embrace separate modules for planning and surface realization. Macro plans represent high level organization of important content such as entities, events, and their interactions; they are learned from data and given as input to the generator. Extensive experiments on two data-to-text benchmarks (RotoWire and MLB) show that our approach outperforms competitive baselines in terms of automatic and human evaluation.	https://aclanthology.org/2021.tacl-1.31	Ratish Puduppully, Mirella Lapata
Iterative Paraphrastic Augmentation with Discriminative Span Alignment	Abstract We introduce a novel paraphrastic augmentation strategy based on sentence-level lexically constrained paraphrasing and discriminative span alignment. Our approach allows for the large-scale expansion of existing datasets or the rapid creation of new datasets using a small, manually produced seed corpus. We demonstrate our approach with experiments on the Berkeley FrameNet Project, a large-scale language understanding effort spanning more than two decades of human labor. With four days of training data collection for a span alignment model and one day of parallel compute, we automatically generate and release to the community 495,300 unique (Frame,Trigger) pairs in diverse sentential contexts, a roughly 50-fold expansion atop FrameNet v1.7. The resulting dataset is intrinsically and extrinsically evaluated in detail, showing positive results on a downstream task.	https://aclanthology.org/2021.tacl-1.30	Ryan Culkin, J. Edward Hu, Elias Stengel-Eskin, Guanghui Qin, Benjamin Van Durme
Neural OCR Post-Hoc Correction of Historical Corpora	Abstract Optical character recognition (OCR) is crucial for a deeper access to historical collections. OCR needs to account for orthographic variations, typefaces, or language evolution (i.e., new letters, word spellings), as the main source of character, word, or word segmentation transcription errors. For digital corpora of historical prints, the errors are further exacerbated due to low scan quality and lack of language standardization. For the task of OCR post-hoc correction, we propose a neural approach based on a combination of recurrent (RNN) and deep convolutional network (ConvNet) to correct OCR transcription errors. At character level we flexibly capture errors, and decode the corrected output based on a novel attention mechanism. Accounting for the input and output similarity, we propose a new loss function that rewards the model's correcting behavior. Evaluation on a historical book corpus in German language shows that our models are robust in capturing diverse OCR transcription errors and reduce the word error rate of 32.3% by more than 89%.	https://aclanthology.org/2021.tacl-1.29	Lijun Lyu, Maria Koutraki, Martin Krickl, Besnik Fetahu
A Computational Framework for Slang Generation	Abstract Slang is a common type of informal language, but its flexible nature and paucity of data resources present challenges for existing natural language systems. We take an initial step toward machine generation of slang by developing a framework that models the speaker's word choice in slang context. Our framework encodes novel slang meaning by relating the conventional and slang senses of a word while incorporating syntactic and contextual knowledge in slang usage. We construct the framework using a combination of probabilistic inference and neural contrastive learning. We perform rigorous evaluations on three slang dictionaries and show that our approach not only outperforms state-of-the-art language models, but also better predicts the historical emergence of slang word usages from 1960s to 2000s. We interpret the proposed models and find that the contrastively learned semantic space is sensitive to the similarities between slang and conventional senses of words. Our work creates opportunities for the automated generation and interpretation of informal language.	https://aclanthology.org/2021.tacl-1.28	Zhewei Sun, Richard Zemel, Yang Xu
Decontextualization: Making Sentences Stand-Alone	Abstract Models for question answering, dialogue agents, and summarization often interpret the meaning of a sentence in a rich context and use that meaning in a new context. Taking excerpts of text can be problematic, as key pieces may not be explicit in a local window. We isolate and define the problem of sentence decontextualization: taking a sentence together with its context and rewriting it to be interpretable out of context, while preserving its meaning. We describe an annotation procedure, collect data on the Wikipedia corpus, and use the data to train models to automatically decontextualize sentences. We present preliminary studies that show the value of sentence decontextualization in a user-facing task, and as preprocessing for systems that perform document understanding. We argue that decontextualization is an important subtask in many downstream applications, and that the definitions and resources provided can benefit tasks that operate on sentences that occur in a richer context.	https://aclanthology.org/2021.tacl-1.27	Eunsol Choi, Jennimaria Palomaki, Matthew Lamm, Tom Kwiatkowski, Dipanjan Das, Michael Collins
An Error Analysis Framework for Shallow Surface Realization	Abstract The metrics standardly used to evaluate Natural Language Generation (NLG) models, such as BLEU or METEOR, fail to provide information on which linguistic factors impact performance. Focusing on Surface Realization (SR), the task of converting an unordered dependency tree into a well-formed sentence, we propose a framework for error analysis which permits identifying which features of the input affect the models' results. This framework consists of two main components: (i) correlation analyses between a wide range of syntactic metrics and standard performance metrics and (ii) a set of techniques to automatically identify syntactic constructs that often co-occur with low performance scores. We demonstrate the advantages of our framework by performing error analysis on the results of 174 system runs submitted to the Multilingual SR shared tasks; we show that dependency edge accuracy correlate with automatic metrics thereby providing a more interpretable basis for evaluation; and we suggest ways in which our framework could be used to improve models and data. The framework is available in the form of a toolkit which can be used both by campaign organizers to provide detailed, linguistically interpretable feedback on the state of the art in multilingual SR, and by individual researchers to improve models and datasets.1	https://aclanthology.org/2021.tacl-1.26	Anastasia Shimorina, Yannick Parmentier, Claire Gardent
