title	abstract	url	authors
Planning with Learned Entity Prompts for Abstractive Summarization	Abstract We introduce a simple but flexible mechanism to learn an intermediate plan to ground the generation of abstractive summaries. Specifically, we prepend (or prompt) target summaries with entity chains—ordered sequences of entities mentioned in the summary. Transformer-based sequence-to-sequence models are then trained to generate the entity chain and then continue generating the summary conditioned on the entity chain and the input. We experimented with both pretraining and finetuning with this content planning objective. When evaluated on CNN/DailyMail, XSum, SAMSum, and BillSum, we demonstrate empirically that the grounded generation with the planning objective improves entity specificity and planning in summaries for all datasets, and achieves state-of-the-art performance on XSum and SAMSum in terms of rouge. Moreover, we demonstrate empirically that planning with entity chains provides a mechanism to control hallucinations in abstractive summaries. By prompting the decoder with a modified content plan that drops hallucinated entities, we outperform state-of-the-art approaches for faithfulness when evaluated automatically and by humans.	https://aclanthology.org/2021.tacl-1.88	Shashi Narayan, Yao Zhao, Joshua Maynez, Gonçalo Simões, Vitaly Nikolaev, Ryan McDonald
Experts, Errors, and Context: A Large-Scale Study of Human Evaluation for Machine Translation	Abstract Human evaluation of modern high-quality machine translation systems is a difficult problem, and there is increasing evidence that inadequate evaluation procedures can lead to erroneous conclusions. While there has been considerable research on human evaluation, the field still lacks a commonly accepted standard procedure. As a step toward this goal, we propose an evaluation methodology grounded in explicit error analysis, based on the Multidimensional Quality Metrics (MQM) framework. We carry out the largest MQM research study to date, scoring the outputs of top systems from the WMT 2020 shared task in two language pairs using annotations provided by professional translators with access to full document context. We analyze the resulting data extensively, finding among other results a substantially different ranking of evaluated systems from the one established by the WMT crowd workers, exhibiting a clear preference for human over machine output. Surprisingly, we also find that automatic metrics based on pre-trained embeddings can outperform human crowd workers. We make our corpus publicly available for further research.	https://aclanthology.org/2021.tacl-1.87	Markus Freitag, George Foster, David Grangier, Viresh Ratnakar, Qijun Tan, Wolfgang Macherey
Differentiable Subset Pruning of Transformer Heads	Abstract Multi-head attention, a collection of several attention mechanisms that independently attend to different parts of the input, is the key ingredient in the Transformer. Recent work has shown, however, that a large proportion of the heads in a Transformer's multi-head attention mechanism can be safely pruned away without significantly harming the performance of the model; such pruning leads to models that are noticeably smaller and faster in practice. Our work introduces a new head pruning technique that we term differentiable subset pruning. ntuitively, our method learns per- head importance variables and then enforces a user-specified hard constraint on the number of unpruned heads. he importance variables are learned via stochastic gradient descent. e conduct experiments on natural language inference and machine translation; we show that differentiable subset pruning performs comparably or better than previous works while offering precise control of the sparsity level.1	https://aclanthology.org/2021.tacl-1.86	Jiaoda Li, Ryan Cotterell, Mrinmaya Sachan
Weisfeiler-Leman in the Bamboo: Novel AMR Graph Metrics and a Benchmark for AMR Graph Similarity	Abstract Several metrics have been proposed for assessing the similarity of (abstract) meaning representations (AMRs), but little is known about how they relate to human similarity ratings. Moreover, the current metrics have complementary strengths and weaknesses: Some emphasize speed, while others make the alignment of graph structures explicit, at the price of a costly alignment step. In this work we propose new Weisfeiler-Leman AMR similarity metrics that unify the strengths of previous metrics, while mitigating their weaknesses. Specifically, our new metrics are able to match contextualized substructures and induce n:m alignments between their nodes. Furthermore, we introduce a Benchmark for AMR Metrics based on Overt Objectives (Bamboo), the first benchmark to support empirical assessment of graph-based MR similarity metrics. Bamboo maximizes the interpretability of results by defining multiple overt objectives that range from sentence similarity objectives to stress tests that probe a metric's robustness against meaning-altering and meaning- preserving graph transformations. We show the benefits of Bamboo by profiling previous metrics and our own metrics. Results indicate that our novel metrics may serve as a strong baseline for future work.	https://aclanthology.org/2021.tacl-1.85	Juri Opitz, Angel Daza, Anette Frank
Self-Diagnosis and Self-Debiasing: A Proposal for Reducing Corpus-Based Bias in NLP	Abstract ⚠ This paper contains prompts and model outputs that are offensive in nature. When trained on large, unfiltered crawls from the Internet, language models pick up and reproduce all kinds of undesirable biases that can be found in the data: They often generate racist, sexist, violent, or otherwise toxic language. As large models require millions of training examples to achieve good performance, it is difficult to completely prevent them from being exposed to such content. In this paper, we first demonstrate a surprising finding: Pretrained language models recognize, to a considerable degree, their undesirable biases and the toxicity of the content they produce. We refer to this capability as self-diagnosis. Based on this finding, we then propose a decoding algorithm that, given only a textual description of the undesired behavior, reduces the probability of a language model producing problematic text. We refer to this approach as self-debiasing. Self-debiasing does not rely on manually curated word lists, nor does it require any training data or changes to the model's parameters. While we by no means eliminate the issue of language models generating biased text, we believe our approach to be an important step in this direction.1	https://aclanthology.org/2021.tacl-1.84	Timo Schick, Sahana Udupa, Hinrich Schütze
Erratum: Measuring and Improving Consistency in Pretrained Language Models	Abstract During production of this paper, an error was introduced to the formula on the bottom of the right column of page 1020. In the last two terms of the formula, the n and m subscripts were swapped. The correct formula is:Lc=∑n=1k∑m=n+1kDKL(Qnri∥Qmri)+DKL(Qmri∥Qnri)The paper has been updated.	https://aclanthology.org/2021.tacl-1.83	Yanai Elazar, Nora Kassner, Shauli Ravfogel, Abhilasha Ravichander, Eduard Hovy, Hinrich Schütze, Yoav Goldberg
MKQA: A Linguistically Diverse Benchmark for Multilingual Open Domain Question Answering	Abstract Progress in cross-lingual modeling depends on challenging, realistic, and diverse evaluation sets. We introduce Multilingual Knowledge Questions and Answers (MKQA), an open- domain question answering evaluation set comprising 10k question-answer pairs aligned across 26 typologically diverse languages (260k question-answer pairs in total). Answers are based on heavily curated, language- independent data representation, making results comparable across languages and independent of language-specific passages. With 26 languages, this dataset supplies the widest range of languages to-date for evaluating question answering. We benchmark a variety of state- of-the-art methods and baselines for generative and extractive question answering, trained on Natural Questions, in zero shot and translation settings. Results indicate this dataset is challenging even in English, but especially in low-resource languages.1	https://aclanthology.org/2021.tacl-1.82	Shayne Longpre, Yi Lu, Joachim Daiber
A Biologically Plausible Parser	Abstract We describe a parser of English effectuated by biologically plausible neurons and synapses, and implemented through the Assembly Calculus, a recently proposed computational framework for cognitive function. We demonstrate that this device is capable of correctly parsing reasonably nontrivial sentences.1 While our experiments entail rather simple sentences in English, our results suggest that the parser can be extended beyond what we have implemented, to several directions encompassing much of language. For example, we present a simple Russian version of the parser, and discuss how to handle recursion, embedding, and polysemy.	https://aclanthology.org/2021.tacl-1.81	Daniel Mitropolsky, Michael J. Collins, Christos H. Papadimitriou
Model Compression for Domain Adaptation through Causal Effect Estimation	Abstract Recent improvements in the predictive quality of natural language processing systems are often dependent on a substantial increase in the number of model parameters. This has led to various attempts of compressing such models, but existing methods have not considered the differences in the predictive power of various model components or in the generalizability of the compressed models. To understand the connection between model compression and out-of-distribution generalization, we define the task of compressing language representation models such that they perform best in a domain adaptation setting. We choose to address this problem from a causal perspective, attempting to estimate the average treatment effect (ATE) of a model component, such as a single layer, on the model's predictions. Our proposed ATE-guided Model Compression scheme (AMoC), generates many model candidates, differing by the model components that were removed. Then, we select the best candidate through a stepwise regression model that utilizes the ATE to predict the expected performance on the target domain. AMoC outperforms strong baselines on dozens of domain pairs across three text classification and sequence tagging tasks.1	https://aclanthology.org/2021.tacl-1.80	Guy Rotman, Amir Feder, Roi Reichart
On Generative Spoken Language Modeling from Raw Audio	Abstract We introduce Generative Spoken Language Modeling, the task of learning the acoustic and linguistic characteristics of a language from raw audio (no text, no labels), and a set of metrics to automatically evaluate the learned representations at acoustic and linguistic levels for both encoding and generation. We set up baseline systems consisting of a discrete speech encoder (returning pseudo-text units), a generative language model (trained on pseudo- text), and a speech decoder (generating a waveform from pseudo-text) all trained without supervision and validate the proposed metrics with human evaluation. Across 3 speech encoders (CPC, wav2vec 2.0, HuBERT), we find that the number of discrete units (50, 100, or 200) matters in a task-dependent and encoder- dependent way, and that some combinations approach text-based systems.1	https://aclanthology.org/2021.tacl-1.79	Kushal Lakhotia, Eugene Kharitonov, Wei-Ning Hsu, Yossi Adi, Adam Polyak, Benjamin Bolte, Tu-Anh Nguyen, Jade Copet, Alexei Baevski, Abdelrahman Mohamed, Emmanuel Dupoux
Partially Supervised Named Entity Recognition via the Expected Entity Ratio Loss	Abstract We study learning named entity recognizers in the presence of missing entity annotations. We approach this setting as tagging with latent variables and propose a novel loss, the Expected Entity Ratio, to learn models in the presence of systematically missing tags. We show that our approach is both theoretically sound and empirically useful. Experimentally, we find that it meets or exceeds performance of strong and state-of-the-art baselines across a variety of languages, annotation scenarios, and amounts of labeled data. In particular, we find that it significantly outperforms the previous state-of-the-art methods from Mayhew et al. (2019) and Li et al. (2021) by +12.7 and +2.3 F1 score in a challenging setting with only 1,000 biased annotations, averaged across 7 datasets. We also show that, when combined with our approach, a novel sparse annotation scheme outperforms exhaustive annotation for modest annotation budgets.1	https://aclanthology.org/2021.tacl-1.78	Thomas Effland, Michael Collins
Continual Learning for Grounded Instruction Generation by Observing Human Following Behavior	Abstract We study continual learning for natural language instruction generation, by observing human users' instruction execution. We focus on a collaborative scenario, where the system both acts and delegates tasks to human users using natural language. We compare user execution of generated instructions to the original system intent as an indication to the system's success communicating its intent. We show how to use this signal to improve the system's ability to generate instructions via contextual bandit learning. In interaction with real users, our system demonstrates dramatic improvements in its ability to generate language over time.	https://aclanthology.org/2021.tacl-1.77	Noriyuki Kojima, Alane Suhr, Yoav Artzi
Lexically Aware Semi-Supervised Learning for OCR Post-Correction	Abstract Much of the existing linguistic data in many languages of the world is locked away in non- digitized books and documents. Optical character recognition (OCR) can be used to produce digitized text, and previous work has demonstrated the utility of neural post-correction methods that improve the results of general- purpose OCR systems on recognition of less- well-resourced languages. However, these methods rely on manually curated post- correction data, which are relatively scarce compared to the non-annotated raw images that need to be digitized. In this paper, we present a semi-supervised learning method that makes it possible to utilize these raw images to improve performance, specifically through the use of self-training, a technique where a model is iteratively trained on its own outputs. In addition, to enforce consistency in the recognized vocabulary, we introduce a lexically aware decoding method that augments the neural post-correction model with a count-based language model constructed from the recognized texts, implemented using weighted finite-state automata (WFSA) for efficient and effective decoding. Results on four endangered languages demonstrate the utility of the proposed method, with relative error reductions of 15%–29%, where we find the combination of self-training and lexically aware decoding essential for achieving consistent improvements.1	https://aclanthology.org/2021.tacl-1.76	Shruti Rijhwani, Daisy Rosenblum, Antonios Anastasopoulos, Graham Neubig
Structured Self-Supervised Pretraining for Commonsense Knowledge Graph Completion	Abstract To develop commonsense-grounded NLP applications, a comprehensive and accurate commonsense knowledge graph (CKG) is needed. It is time-consuming to manually construct CKGs and many research efforts have been devoted to the automatic construction of CKGs. Previous approaches focus on generating concepts that have direct and obvious relationships with existing concepts and lack an capability to generate unobvious concepts. In this work, we aim to bridge this gap. We propose a general graph-to-paths pretraining framework that leverages high-order structures in CKGs to capture high-order relationships between concepts. We instantiate this general framework to four special cases: long path, path-to-path, router, and graph-node-path. Experiments on two datasets demonstrate the effectiveness of our methods. The code will be released via the public GitHub repository.	https://aclanthology.org/2021.tacl-1.75	Jiayuan Huang, Yangkai Du, Shuting Tao, Kun Xu, Pengtao Xie
Quantifying Social Biases in NLP: A Generalization and Empirical Comparison of Extrinsic Fairness Metrics	Abstract Measuring bias is key for better understanding and addressing unfairness in NLP/ML models. This is often done via fairness metrics, which quantify the differences in a model's behaviour across a range of demographic groups. In this work, we shed more light on the differences and similarities between the fairness metrics used in NLP. First, we unify a broad range of existing metrics under three generalized fairness metrics, revealing the connections between them. Next, we carry out an extensive empirical comparison of existing metrics and demonstrate that the observed differences in bias measurement can be systematically explained via differences in parameter choices for our generalized metrics.	https://aclanthology.org/2021.tacl-1.74	Paula Czarnowska, Yogarshi Vyas, Kashif Shah
On the Difficulty of Translating Free-Order Case-Marking Languages	Abstract Identifying factors that make certain languages harder to model than others is essential to reach language equality in future Natural Language Processing technologies. Free-order case-marking languages, such as Russian, Latin, or Tamil, have proved more challenging than fixed-order languages for the tasks of syntactic parsing and subject-verb agreement prediction. In this work, we investigate whether this class of languages is also more difficult to translate by state-of-the-art Neural Machine Translation (NMT) models. Using a variety of synthetic languages and a newly introduced translation challenge set, we find that word order flexibility in the source language only leads to a very small loss of NMT quality, even though the core verb arguments become impossible to disambiguate in sentences without semantic cues. The latter issue is indeed solved by the addition of case marking. However, in medium- and low-resource settings, the overall NMT quality of fixed-order languages remains unmatched.	https://aclanthology.org/2021.tacl-1.73	Arianna Bisazza, Ahmet Üstün, Stephan Sportel
Controllable Summarization with Constrained Markov Decision Process	Abstract We study controllable text summarization, which allows users to gain control on a particular attribute (e.g., length limit) of the generated summaries. In this work, we propose a novel training framework based on Constrained Markov Decision Process (CMDP), which conveniently includes a reward function along with a set of constraints, to facilitate better summarization control. The reward function encourages the generation to resemble the human-written reference, while the constraints are used to explicitly prevent the generated summaries from violating user-imposed requirements. Our framework can be applied to control important attributes of summarization, including length, covered entities, and abstractiveness, as we devise specific constraints for each of these aspects. Extensive experiments on popular benchmarks show that our CMDP framework helps generate informative summaries while complying with a given attribute's requirement.1	https://aclanthology.org/2021.tacl-1.72	Hou Pong Chan, Lu Wang, Irwin King
Memory-Based Semantic Parsing	Abstract We present a memory-based model for context- dependent semantic parsing. Previous approaches focus on enabling the decoder to copy or modify the parse from the previous utterance, assuming there is a dependency between the current and previous parses. In this work, we propose to represent contextual information using an external memory. We learn a context memory controller that manages the memory by maintaining the cumulative meaning of sequential user utterances. We evaluate our approach on three semantic parsing benchmarks. Experimental results show that our model can better process context-dependent information and demonstrates improved performance without using task-specific decoders.	https://aclanthology.org/2021.tacl-1.71	Parag Jain, Mirella Lapata
Identity-Based Patterns in Deep Convolutional Networks: Generative Adversarial Phonology and Reduplication	Abstract This paper models unsupervised learning of an identity-based pattern (or copying) in speech called reduplication from raw continuous data with deep convolutional neural networks. We use the ciwGAN architecture (Beguš, 2021a) in which learning of meaningful representations in speech emerges from a requirement that the CNNs generate informative data. We propose a technique to wug-test CNNs trained on speech and, based on four generative tests, argue that the network learns to represent an identity-based pattern in its latent space. By manipulating only two categorical variables in the latent space, we can actively turn an unreduplicated form into a reduplicated form with no other substantial changes to the output in the majority of cases. We also argue that the network extends the identity-based pattern to unobserved data. Exploration of how meaningful representations of identity-based patterns emerge in CNNs and how the latent space variables outside of the training range correlate with identity-based patterns in the output has general implications for neural network interpretability.	https://aclanthology.org/2021.tacl-1.70	Gašper Beguš
What Helps Transformers Recognize Conversational Structure? Importance of Context, Punctuation, and Labels in Dialog Act Recognition	Abstract Dialog acts can be interpreted as the atomic units of a conversation, more fine-grained than utterances, characterized by a specific communicative function. The ability to structure a conversational transcript as a sequence of dialog acts—dialog act recognition, including the segmentation—is critical for understanding dialog. We apply two pre-trained transformer models, XLNet and Longformer, to this task in English and achieve strong results on Switchboard Dialog Act and Meeting Recorder Dialog Act corpora with dialog act segmentation error rates (DSER) of 8.4% and 14.2%. To understand the key factors affecting dialog act recognition, we perform a comparative analysis of models trained under different conditions. We find that the inclusion of a broader conversational context helps disambiguate many dialog act classes, especially those infrequent in the training data. The presence of punctuation in the transcripts has a massive effect on the models' performance, and a detailed analysis reveals specific segmentation patterns observed in its absence. Finally, we find that the label set specificity does not affect dialog act segmentation performance. These findings have significant practical implications for spoken language understanding applications that depend heavily on a good-quality segmentation being available.	https://aclanthology.org/2021.tacl-1.69	Piotr Żelasko, Raghavendra Pappagari, Najim Dehak
ParsiNLU: A Suite of Language Understanding Challenges for Persian	Abstract Despite the progress made in recent years in addressing natural language understanding (NLU) challenges, the majority of this progress remains to be concentrated on resource-rich languages like English. This work focuses on Persian language, one of the widely spoken languages in the world, and yet there are few NLU datasets available for this language. The availability of high-quality evaluation datasets is a necessity for reliable assessment of the progress on different NLU tasks and domains. We introduce ParsiNLU, the first benchmark in Persian language that includes a range of language understanding tasks—reading comprehension, textual entailment, and so on. These datasets are collected in a multitude of ways, often involving manual annotations by native speakers. This results in over 14.5k new instances across 6 distinct NLU tasks. Additionally, we present the first results on state-of-the-art monolingual and multilingual pre-trained language models on this benchmark and compare them with human performance, which provides valuable insights into our ability to tackle natural language understanding challenges in Persian. We hope ParsiNLU fosters further research and advances in Persian language understanding.1	https://aclanthology.org/2021.tacl-1.68	Daniel Khashabi, Arman Cohan, Siamak Shakeri, Pedram Hosseini, Pouya Pezeshkpour, Malihe Alikhani, Moin Aminnaseri, Marzieh Bitaab, Faeze Brahman, Sarik Ghazarian, Mozhdeh Gheini, Arman Kabiri, Rabeeh Karimi Mahabagdi, Omid Memarrast, Ahmadreza Mosallanezhad, Erfan Noury, Shahab Raji, Mohammad Sadegh Rasooli, Sepideh Sadeghi, Erfan Sadeqi Azer, Niloofar Safi Samghabadi, Mahsa Shafaei, Saber Sheybani, Ali Tazarv, Yadollah Yaghoobzadeh
